 00:00:00.000000 IP6 fe80::640d:7dff:fe5f:ebd7 > ff02::2: ICMP6, router solicitation, length 16
 00:00:00.500084 IP6 fe80::e82d:bfff:fec5:fe95 > ff02::2: ICMP6, router solicitation, length 16
 00:00:01.269107 IP6 fe80::98b5:99ff:fe39:d2e1 > ff02::2: ICMP6, router solicitation, length 16
 00:00:01.547579 IP6 fe80::18ac:7eff:fe7d:3e73 > ff02::2: ICMP6, router solicitation, length 16
 00:00:02.625497 ARP, Request who-has 10.0.0.6 tell 10.0.0.8, length 28
 00:00:02.626536 ARP, Reply 10.0.0.6 is-at 32:cd:a8:c3:26:f9, length 28
 00:00:02.648996 IP 10.0.0.8.44828 > 10.0.0.6.1883: Flags [S], seq 313949053, win 42340, options [mss 1460,sackOK,TS val 1095902584 ecr 0,nop,wscale 9], length 0
 00:00:02.649103 IP 10.0.0.6.1883 > 10.0.0.8.44828: Flags [S.], seq 1598809727, ack 313949054, win 43440, options [mss 1460,sackOK,TS val 3791197145 ecr 1095902584,nop,wscale 9], length 0
 00:00:02.657330 IP 10.0.0.8.44828 > 10.0.0.6.1883: Flags [.], ack 1598809728, win 83, options [nop,nop,TS val 1095902635 ecr 3791197145], length 0
 00:00:02.657664 IP 10.0.0.8.44828 > 10.0.0.6.1883: Flags [P.], seq 313949054:313949074, ack 1598809728, win 83, options [nop,nop,TS val 1095902636 ecr 3791197145], length 20
 00:00:02.657798 IP 10.0.0.6.1883 > 10.0.0.8.44828: Flags [.], ack 313949074, win 85, options [nop,nop,TS val 3791197154 ecr 1095902636], length 0
 00:00:02.658325 IP 10.0.0.6.1883 > 10.0.0.8.44828: Flags [P.], seq 1598809728:1598809732, ack 313949074, win 85, options [nop,nop,TS val 3791197154 ecr 1095902636], length 4
 00:00:02.659022 IP 10.0.0.8.44828 > 10.0.0.6.1883: Flags [.], ack 1598809732, win 83, options [nop,nop,TS val 1095902637 ecr 3791197154], length 0
 00:00:02.659376 IP 10.0.0.8.44828 > 10.0.0.6.1883: Flags [P.], seq 313949074:313949138, ack 1598809732, win 83, options [nop,nop,TS val 1095902637 ecr 3791197154], length 64
 00:00:02.659590 IP 10.0.0.6.1883 > 10.0.0.8.44828: Flags [P.], seq 1598809732:1598809797, ack 313949138, win 85, options [nop,nop,TS val 3791197156 ecr 1095902637], length 65
 00:00:02.660010 IP 10.0.0.8.44828 > 10.0.0.6.1883: Flags [P.], seq 313949138:313949533, ack 1598809797, win 83, options [nop,nop,TS val 1095902638 ecr 3791197156], length 395
 00:00:02.660076 IP 10.0.0.6.1883 > 10.0.0.8.44828: Flags [P.], seq 1598809797:1598809802, ack 313949533, win 85, options [nop,nop,TS val 3791197156 ecr 1095902638], length 5
 00:00:02.706665 IP 10.0.0.8.44828 > 10.0.0.6.1883: Flags [.], ack 1598809802, win 83, options [nop,nop,TS val 1095902685 ecr 3791197156], length 0
 00:00:02.706796 IP 10.0.0.6.1883 > 10.0.0.8.44828: Flags [P.], seq 1598809802:1598809806, ack 313949533, win 85, options [nop,nop,TS val 3791197203 ecr 1095902685], length 4
 00:00:02.707255 IP 10.0.0.8.44828 > 10.0.0.6.1883: Flags [.], ack 1598809806, win 83, options [nop,nop,TS val 1095902685 ecr 3791197203], length 0
 00:00:02.708380 IP 10.0.0.8.44828 > 10.0.0.6.1883: Flags [P.], seq 313949533:313949537, ack 1598809806, win 83, options [nop,nop,TS val 1095902686 ecr 3791197203], length 4
 00:00:02.708737 IP 10.0.0.6.1883 > 10.0.0.8.44828: Flags [P.], seq 1598809806:1598809810, ack 313949537, win 85, options [nop,nop,TS val 3791197205 ecr 1095902686], length 4
 00:00:02.791711 IP 10.0.0.8.44828 > 10.0.0.6.1883: Flags [.], ack 1598809810, win 83, options [nop,nop,TS val 1095902728 ecr 3791197205], length 0
 00:00:03.073155 IP6 fe80::d4be:afff:feb6:be37 > ff02::2: ICMP6, router solicitation, length 16
 00:00:03.305408 IP6 fe80::30cd:a8ff:fec3:26f9 > ff02::2: ICMP6, router solicitation, length 16
 00:00:03.346341 IP6 fe80::e89a:94ff:fe5d:bfef > ff02::2: ICMP6, router solicitation, length 16
 00:00:03.587851 IP6 fe80::28a2:adff:fe9a:164e > ff02::2: ICMP6, router solicitation, length 16
 00:00:03.611334 IP 10.0.0.8.44828 > 10.0.0.6.1883: Flags [P.], seq 313949537:313949932, ack 1598809810, win 83, options [nop,nop,TS val 1095903588 ecr 3791197205], length 395
 00:00:03.612441 IP 10.0.0.6.1883 > 10.0.0.8.44828: Flags [P.], seq 1598809810:1598809814, ack 313949932, win 85, options [nop,nop,TS val 3791198108 ecr 1095903588], length 4
 00:00:03.614407 IP 10.0.0.8.44828 > 10.0.0.6.1883: Flags [.], ack 1598809814, win 83, options [nop,nop,TS val 1095903591 ecr 3791198108], length 0
 00:00:03.614699 IP 10.0.0.8.44828 > 10.0.0.6.1883: Flags [P.], seq 313949932:313949936, ack 1598809814, win 83, options [nop,nop,TS val 1095903591 ecr 3791198108], length 4
 00:00:03.615355 IP 10.0.0.6.1883 > 10.0.0.8.44828: Flags [P.], seq 1598809814:1598809818, ack 313949936, win 85, options [nop,nop,TS val 3791198111 ecr 1095903591], length 4
 00:00:03.661507 IP 10.0.0.8.44828 > 10.0.0.6.1883: Flags [.], ack 1598809818, win 83, options [nop,nop,TS val 1095903639 ecr 3791198111], length 0
 00:00:04.612714 IP 10.0.0.8.44828 > 10.0.0.6.1883: Flags [P.], seq 313949936:313950331, ack 1598809818, win 83, options [nop,nop,TS val 1095904588 ecr 3791198111], length 395
 00:00:04.613821 IP 10.0.0.6.1883 > 10.0.0.8.44828: Flags [P.], seq 1598809818:1598809822, ack 313950331, win 85, options [nop,nop,TS val 3791199109 ecr 1095904588], length 4
 00:00:04.615867 IP 10.0.0.8.44828 > 10.0.0.6.1883: Flags [.], ack 1598809822, win 83, options [nop,nop,TS val 1095904591 ecr 3791199109], length 0
 00:00:04.616488 IP 10.0.0.8.44828 > 10.0.0.6.1883: Flags [P.], seq 313950331:313950335, ack 1598809822, win 83, options [nop,nop,TS val 1095904592 ecr 3791199109], length 4
 00:00:04.617465 IP 10.0.0.6.1883 > 10.0.0.8.44828: Flags [P.], seq 1598809822:1598809826, ack 313950335, win 85, options [nop,nop,TS val 3791199113 ecr 1095904592], length 4
 00:00:04.662455 IP 10.0.0.8.44828 > 10.0.0.6.1883: Flags [.], ack 1598809826, win 83, options [nop,nop,TS val 1095904639 ecr 3791199113], length 0
 00:00:04.842395 IP6 fe80::44a3:1cff:fead:a2ab > ff02::2: ICMP6, router solicitation, length 16
 00:00:04.876716 IP6 fe80::a8fd:d9ff:fe3e:2914 > ff02::2: ICMP6, router solicitation, length 16
 00:00:04.884705 IP6 fe80::c41f:88ff:fe56:889e > ff02::2: ICMP6, router solicitation, length 16
 00:00:05.615289 IP 10.0.0.8.44828 > 10.0.0.6.1883: Flags [P.], seq 313950335:313950730, ack 1598809826, win 83, options [nop,nop,TS val 1095905589 ecr 3791199113], length 395
 00:00:05.616458 IP 10.0.0.6.1883 > 10.0.0.8.44828: Flags [P.], seq 1598809826:1598809830, ack 313950730, win 85, options [nop,nop,TS val 3791200111 ecr 1095905589], length 4
 00:00:05.618838 IP 10.0.0.8.44828 > 10.0.0.6.1883: Flags [.], ack 1598809830, win 83, options [nop,nop,TS val 1095905594 ecr 3791200111], length 0
 00:00:05.618841 IP 10.0.0.8.44828 > 10.0.0.6.1883: Flags [P.], seq 313950730:313950734, ack 1598809830, win 83, options [nop,nop,TS val 1095905594 ecr 3791200111], length 4
 00:00:05.619826 IP 10.0.0.6.1883 > 10.0.0.8.44828: Flags [P.], seq 1598809830:1598809834, ack 313950734, win 85, options [nop,nop,TS val 3791200114 ecr 1095905594], length 4
 00:00:05.661467 IP 10.0.0.8.44828 > 10.0.0.6.1883: Flags [.], ack 1598809834, win 83, options [nop,nop,TS val 1095905638 ecr 3791200114], length 0
 00:00:06.616907 IP 10.0.0.8.44828 > 10.0.0.6.1883: Flags [P.], seq 313950734:313951129, ack 1598809834, win 83, options [nop,nop,TS val 1095906591 ecr 3791200114], length 395
 00:00:06.617763 IP 10.0.0.6.1883 > 10.0.0.8.44828: Flags [P.], seq 1598809834:1598809838, ack 313951129, win 85, options [nop,nop,TS val 3791201112 ecr 1095906591], length 4
 00:00:06.619604 IP 10.0.0.8.44828 > 10.0.0.6.1883: Flags [.], ack 1598809838, win 83, options [nop,nop,TS val 1095906594 ecr 3791201112], length 0
 00:00:06.619997 IP 10.0.0.8.44828 > 10.0.0.6.1883: Flags [P.], seq 313951129:313951133, ack 1598809838, win 83, options [nop,nop,TS val 1095906594 ecr 3791201112], length 4
 00:00:06.620676 IP 10.0.0.6.1883 > 10.0.0.8.44828: Flags [P.], seq 1598809838:1598809842, ack 313951133, win 85, options [nop,nop,TS val 3791201115 ecr 1095906594], length 4
 00:00:06.661608 IP 10.0.0.8.44828 > 10.0.0.6.1883: Flags [.], ack 1598809842, win 83, options [nop,nop,TS val 1095906637 ecr 3791201115], length 0
 00:00:06.941081 IP6 fe80::1484:76ff:feeb:5b5b > ff02::2: ICMP6, router solicitation, length 16
 00:00:06.946009 IP6 fe80::a4d6:1dff:feb6:bf67 > ff02::2: ICMP6, router solicitation, length 16
 00:00:06.956001 IP6 fe80::bc89:1ff:fe9b:df13 > ff02::2: ICMP6, router solicitation, length 16
 00:00:07.619639 IP 10.0.0.8.44828 > 10.0.0.6.1883: Flags [P.], seq 313951133:313951528, ack 1598809842, win 83, options [nop,nop,TS val 1095907593 ecr 3791201115], length 395
 00:00:07.620387 IP 10.0.0.6.1883 > 10.0.0.8.44828: Flags [P.], seq 1598809842:1598809846, ack 313951528, win 85, options [nop,nop,TS val 3791202114 ecr 1095907593], length 4
 00:00:07.621891 IP 10.0.0.8.44828 > 10.0.0.6.1883: Flags [.], ack 1598809846, win 83, options [nop,nop,TS val 1095907596 ecr 3791202114], length 0
 00:00:07.622260 IP 10.0.0.8.44828 > 10.0.0.6.1883: Flags [P.], seq 313951528:313951532, ack 1598809846, win 83, options [nop,nop,TS val 1095907597 ecr 3791202114], length 4
 00:00:07.623096 IP 10.0.0.6.1883 > 10.0.0.8.44828: Flags [P.], seq 1598809846:1598809850, ack 313951532, win 85, options [nop,nop,TS val 3791202116 ecr 1095907597], length 4
 00:00:07.665868 IP 10.0.0.8.44828 > 10.0.0.6.1883: Flags [P.], seq 313951532:313951534, ack 1598809850, win 83, options [nop,nop,TS val 1095907639 ecr 3791202116], length 2
 00:00:07.666729 IP 10.0.0.6.1883 > 10.0.0.8.44828: Flags [P.], seq 1598809850:1598809852, ack 313951534, win 85, options [nop,nop,TS val 3791202160 ecr 1095907639], length 2
 00:00:07.709366 IP 10.0.0.8.44828 > 10.0.0.6.1883: Flags [.], ack 1598809852, win 83, options [nop,nop,TS val 1095907685 ecr 3791202160], length 0
 00:00:08.622848 IP 10.0.0.8.44828 > 10.0.0.6.1883: Flags [P.], seq 313951534:313951929, ack 1598809852, win 83, options [nop,nop,TS val 1095908594 ecr 3791202160], length 395
 00:00:08.623814 IP 10.0.0.6.1883 > 10.0.0.8.44828: Flags [P.], seq 1598809852:1598809856, ack 313951929, win 85, options [nop,nop,TS val 3791203117 ecr 1095908594], length 4
 00:00:08.625625 IP 10.0.0.8.44828 > 10.0.0.6.1883: Flags [.], ack 1598809856, win 83, options [nop,nop,TS val 1095908599 ecr 3791203117], length 0
 00:00:08.626064 IP 10.0.0.8.44828 > 10.0.0.6.1883: Flags [P.], seq 313951929:313951933, ack 1598809856, win 83, options [nop,nop,TS val 1095908600 ecr 3791203117], length 4
 00:00:08.627085 IP 10.0.0.6.1883 > 10.0.0.8.44828: Flags [P.], seq 1598809856:1598809860, ack 313951933, win 85, options [nop,nop,TS val 3791203120 ecr 1095908600], length 4
 00:00:08.669648 IP 10.0.0.8.44828 > 10.0.0.6.1883: Flags [.], ack 1598809860, win 83, options [nop,nop,TS val 1095908645 ecr 3791203120], length 0
 00:00:09.621466 IP 10.0.0.8.44828 > 10.0.0.6.1883: Flags [P.], seq 313951933:313952328, ack 1598809860, win 83, options [nop,nop,TS val 1095909595 ecr 3791203120], length 395
 00:00:09.622465 IP 10.0.0.6.1883 > 10.0.0.8.44828: Flags [P.], seq 1598809860:1598809864, ack 313952328, win 85, options [nop,nop,TS val 3791204115 ecr 1095909595], length 4
 00:00:09.623722 IP 10.0.0.8.44828 > 10.0.0.6.1883: Flags [.], ack 1598809864, win 83, options [nop,nop,TS val 1095909598 ecr 3791204115], length 0
 00:00:09.623834 IP 10.0.0.8.44828 > 10.0.0.6.1883: Flags [P.], seq 313952328:313952332, ack 1598809864, win 83, options [nop,nop,TS val 1095909598 ecr 3791204115], length 4
 00:00:09.624288 IP 10.0.0.6.1883 > 10.0.0.8.44828: Flags [P.], seq 1598809864:1598809868, ack 313952332, win 85, options [nop,nop,TS val 3791204117 ecr 1095909598], length 4
 00:00:09.665392 IP 10.0.0.8.44828 > 10.0.0.6.1883: Flags [.], ack 1598809868, win 83, options [nop,nop,TS val 1095909640 ecr 3791204117], length 0
 00:00:10.623587 IP 10.0.0.8.44828 > 10.0.0.6.1883: Flags [P.], seq 313952332:313952727, ack 1598809868, win 83, options [nop,nop,TS val 1095910597 ecr 3791204117], length 395
 00:00:10.624413 IP 10.0.0.6.1883 > 10.0.0.8.44828: Flags [P.], seq 1598809868:1598809872, ack 313952727, win 85, options [nop,nop,TS val 3791205116 ecr 1095910597], length 4
 00:00:10.627221 IP 10.0.0.8.44828 > 10.0.0.6.1883: Flags [.], ack 1598809872, win 83, options [nop,nop,TS val 1095910600 ecr 3791205116], length 0
 00:00:10.627493 IP 10.0.0.8.44828 > 10.0.0.6.1883: Flags [P.], seq 313952727:313952731, ack 1598809872, win 83, options [nop,nop,TS val 1095910600 ecr 3791205116], length 4
 00:00:10.627934 IP 10.0.0.6.1883 > 10.0.0.8.44828: Flags [P.], seq 1598809872:1598809876, ack 313952731, win 85, options [nop,nop,TS val 3791205120 ecr 1095910600], length 4
 00:00:10.669877 IP 10.0.0.8.44828 > 10.0.0.6.1883: Flags [.], ack 1598809876, win 83, options [nop,nop,TS val 1095910644 ecr 3791205120], length 0
 00:00:11.625091 IP 10.0.0.8.44828 > 10.0.0.6.1883: Flags [P.], seq 313952731:313953126, ack 1598809876, win 83, options [nop,nop,TS val 1095911598 ecr 3791205120], length 395
 00:00:11.626013 IP 10.0.0.6.1883 > 10.0.0.8.44828: Flags [P.], seq 1598809876:1598809880, ack 313953126, win 85, options [nop,nop,TS val 3791206118 ecr 1095911598], length 4
 00:00:11.626892 IP 10.0.0.8.44828 > 10.0.0.6.1883: Flags [.], ack 1598809880, win 83, options [nop,nop,TS val 1095911600 ecr 3791206118], length 0
 00:00:11.627551 IP 10.0.0.8.44828 > 10.0.0.6.1883: Flags [P.], seq 313953126:313953130, ack 1598809880, win 83, options [nop,nop,TS val 1095911600 ecr 3791206118], length 4
 00:00:11.627922 IP 10.0.0.6.1883 > 10.0.0.8.44828: Flags [P.], seq 1598809880:1598809884, ack 313953130, win 85, options [nop,nop,TS val 3791206120 ecr 1095911600], length 4
 00:00:11.669517 IP 10.0.0.8.44828 > 10.0.0.6.1883: Flags [.], ack 1598809884, win 83, options [nop,nop,TS val 1095911643 ecr 3791206120], length 0
 00:00:12.626052 IP 10.0.0.8.44828 > 10.0.0.6.1883: Flags [P.], seq 313953130:313953525, ack 1598809884, win 83, options [nop,nop,TS val 1095912598 ecr 3791206120], length 395
 00:00:12.626977 IP 10.0.0.6.1883 > 10.0.0.8.44828: Flags [P.], seq 1598809884:1598809888, ack 313953525, win 85, options [nop,nop,TS val 3791207118 ecr 1095912598], length 4
 00:00:12.627759 IP 10.0.0.8.44828 > 10.0.0.6.1883: Flags [.], ack 1598809888, win 83, options [nop,nop,TS val 1095912601 ecr 3791207118], length 0
 00:00:12.628370 IP 10.0.0.8.44828 > 10.0.0.6.1883: Flags [P.], seq 313953525:313953529, ack 1598809888, win 83, options [nop,nop,TS val 1095912601 ecr 3791207118], length 4
 00:00:12.628626 IP 10.0.0.6.1883 > 10.0.0.8.44828: Flags [P.], seq 1598809888:1598809892, ack 313953529, win 85, options [nop,nop,TS val 3791207120 ecr 1095912601], length 4
 00:00:12.665741 IP 10.0.0.8.44828 > 10.0.0.6.1883: Flags [P.], seq 313953529:313953531, ack 1598809892, win 83, options [nop,nop,TS val 1095912638 ecr 3791207120], length 2
 00:00:12.666060 IP 10.0.0.6.1883 > 10.0.0.8.44828: Flags [P.], seq 1598809892:1598809894, ack 313953531, win 85, options [nop,nop,TS val 3791207157 ecr 1095912638], length 2
 00:00:12.709522 IP 10.0.0.8.44828 > 10.0.0.6.1883: Flags [.], ack 1598809894, win 83, options [nop,nop,TS val 1095912682 ecr 3791207157], length 0
 00:00:13.625975 IP 10.0.0.8.44828 > 10.0.0.6.1883: Flags [P.], seq 313953531:313953926, ack 1598809894, win 83, options [nop,nop,TS val 1095913598 ecr 3791207157], length 395
 00:00:13.626794 IP 10.0.0.6.1883 > 10.0.0.8.44828: Flags [P.], seq 1598809894:1598809898, ack 313953926, win 85, options [nop,nop,TS val 3791208117 ecr 1095913598], length 4
 00:00:13.629909 IP 10.0.0.8.44828 > 10.0.0.6.1883: Flags [.], ack 1598809898, win 83, options [nop,nop,TS val 1095913600 ecr 3791208117], length 0
 00:00:13.630862 IP 10.0.0.8.44828 > 10.0.0.6.1883: Flags [P.], seq 313953926:313953930, ack 1598809898, win 83, options [nop,nop,TS val 1095913603 ecr 3791208117], length 4
 00:00:13.632410 IP 10.0.0.6.1883 > 10.0.0.8.44828: Flags [P.], seq 1598809898:1598809902, ack 313953930, win 85, options [nop,nop,TS val 3791208122 ecr 1095913603], length 4
 00:00:13.677800 IP 10.0.0.8.44828 > 10.0.0.6.1883: Flags [.], ack 1598809902, win 83, options [nop,nop,TS val 1095913650 ecr 3791208122], length 0
 00:00:14.628633 IP 10.0.0.8.44828 > 10.0.0.6.1883: Flags [P.], seq 313953930:313954325, ack 1598809902, win 83, options [nop,nop,TS val 1095914599 ecr 3791208122], length 395
 00:00:14.629264 IP 10.0.0.6.1883 > 10.0.0.8.44828: Flags [P.], seq 1598809902:1598809906, ack 313954325, win 85, options [nop,nop,TS val 3791209119 ecr 1095914599], length 4
 00:00:14.630941 IP 10.0.0.8.44828 > 10.0.0.6.1883: Flags [.], ack 1598809906, win 83, options [nop,nop,TS val 1095914602 ecr 3791209119], length 0
 00:00:14.631298 IP 10.0.0.8.44828 > 10.0.0.6.1883: Flags [P.], seq 313954325:313954329, ack 1598809906, win 83, options [nop,nop,TS val 1095914602 ecr 3791209119], length 4
 00:00:14.632153 IP 10.0.0.6.1883 > 10.0.0.8.44828: Flags [P.], seq 1598809906:1598809910, ack 313954329, win 85, options [nop,nop,TS val 3791209122 ecr 1095914602], length 4
 00:00:14.673606 IP 10.0.0.8.44828 > 10.0.0.6.1883: Flags [.], ack 1598809910, win 83, options [nop,nop,TS val 1095914645 ecr 3791209122], length 0
 00:00:15.629467 IP 10.0.0.8.44828 > 10.0.0.6.1883: Flags [P.], seq 313954329:313954724, ack 1598809910, win 83, options [nop,nop,TS val 1095915599 ecr 3791209122], length 395
 00:00:15.630095 IP 10.0.0.6.1883 > 10.0.0.8.44828: Flags [P.], seq 1598809910:1598809914, ack 313954724, win 85, options [nop,nop,TS val 3791210120 ecr 1095915599], length 4
 00:00:15.631087 IP 10.0.0.8.44828 > 10.0.0.6.1883: Flags [.], ack 1598809914, win 83, options [nop,nop,TS val 1095915602 ecr 3791210120], length 0
 00:00:15.631675 IP 10.0.0.8.44828 > 10.0.0.6.1883: Flags [P.], seq 313954724:313954728, ack 1598809914, win 83, options [nop,nop,TS val 1095915602 ecr 3791210120], length 4
 00:00:15.632190 IP 10.0.0.6.1883 > 10.0.0.8.44828: Flags [P.], seq 1598809914:1598809918, ack 313954728, win 85, options [nop,nop,TS val 3791210122 ecr 1095915602], length 4
 00:00:15.673416 IP 10.0.0.8.44828 > 10.0.0.6.1883: Flags [.], ack 1598809918, win 83, options [nop,nop,TS val 1095915645 ecr 3791210122], length 0
 00:00:16.629978 IP 10.0.0.8.44828 > 10.0.0.6.1883: Flags [P.], seq 313954728:313955123, ack 1598809918, win 83, options [nop,nop,TS val 1095916601 ecr 3791210122], length 395
 00:00:16.630686 IP 10.0.0.6.1883 > 10.0.0.8.44828: Flags [P.], seq 1598809918:1598809922, ack 313955123, win 85, options [nop,nop,TS val 3791211120 ecr 1095916601], length 4
 00:00:16.632564 IP 10.0.0.8.44828 > 10.0.0.6.1883: Flags [.], ack 1598809922, win 83, options [nop,nop,TS val 1095916603 ecr 3791211120], length 0
 00:00:16.632566 IP 10.0.0.8.44828 > 10.0.0.6.1883: Flags [P.], seq 313955123:313955127, ack 1598809922, win 83, options [nop,nop,TS val 1095916603 ecr 3791211120], length 4
 00:00:16.633041 IP 10.0.0.6.1883 > 10.0.0.8.44828: Flags [P.], seq 1598809922:1598809926, ack 313955127, win 85, options [nop,nop,TS val 3791211122 ecr 1095916603], length 4
 00:00:16.723083 IP 10.0.0.8.44828 > 10.0.0.6.1883: Flags [.], ack 1598809926, win 83, options [nop,nop,TS val 1095916649 ecr 3791211122], length 0
 00:00:17.632756 IP 10.0.0.8.44828 > 10.0.0.6.1883: Flags [P.], seq 313955127:313955522, ack 1598809926, win 83, options [nop,nop,TS val 1095917602 ecr 3791211122], length 395
 00:00:17.645646 IP 10.0.0.6.1883 > 10.0.0.8.44828: Flags [P.], seq 1598809926:1598809930, ack 313955522, win 85, options [nop,nop,TS val 3791212122 ecr 1095917602], length 4
 00:00:17.720090 IP 10.0.0.8.44828 > 10.0.0.6.1883: Flags [.], ack 1598809930, win 83, options [nop,nop,TS val 1095917689 ecr 3791212122], length 0
 00:00:17.720538 IP 10.0.0.8.44828 > 10.0.0.6.1883: Flags [P.], seq 313955522:313955524, ack 1598809930, win 83, options [nop,nop,TS val 1095917690 ecr 3791212122], length 2
 00:00:17.721117 IP 10.0.0.6.1883 > 10.0.0.8.44828: Flags [P.], seq 1598809930:1598809932, ack 313955524, win 85, options [nop,nop,TS val 3791212210 ecr 1095917690], length 2
 00:00:17.735344 IP 10.0.0.8.44828 > 10.0.0.6.1883: Flags [P.], seq 313955524:313955528, ack 1598809932, win 83, options [nop,nop,TS val 1095917704 ecr 3791212210], length 4
 00:00:17.735775 IP 10.0.0.6.1883 > 10.0.0.8.44828: Flags [P.], seq 1598809932:1598809936, ack 313955528, win 85, options [nop,nop,TS val 3791212224 ecr 1095917704], length 4
 00:00:17.815424 IP 10.0.0.8.44828 > 10.0.0.6.1883: Flags [.], ack 1598809936, win 83, options [nop,nop,TS val 1095917772 ecr 3791212224], length 0
 00:00:18.637850 IP 10.0.0.8.44828 > 10.0.0.6.1883: Flags [P.], seq 313955528:313955923, ack 1598809936, win 83, options [nop,nop,TS val 1095918605 ecr 3791212224], length 395
 00:00:18.639709 IP 10.0.0.6.1883 > 10.0.0.8.44828: Flags [P.], seq 1598809936:1598809940, ack 313955923, win 85, options [nop,nop,TS val 3791213128 ecr 1095918605], length 4
 00:00:18.642505 IP 10.0.0.8.44828 > 10.0.0.6.1883: Flags [.], ack 1598809940, win 83, options [nop,nop,TS val 1095918613 ecr 3791213128], length 0
 00:00:18.643038 IP 10.0.0.8.44828 > 10.0.0.6.1883: Flags [P.], seq 313955923:313955927, ack 1598809940, win 83, options [nop,nop,TS val 1095918613 ecr 3791213128], length 4
 00:00:18.643849 IP 10.0.0.6.1883 > 10.0.0.8.44828: Flags [P.], seq 1598809940:1598809944, ack 313955927, win 85, options [nop,nop,TS val 3791213131 ecr 1095918613], length 4
 00:00:18.751910 IP 10.0.0.8.44828 > 10.0.0.6.1883: Flags [.], ack 1598809944, win 83, options [nop,nop,TS val 1095918706 ecr 3791213131], length 0
 00:00:19.760774 IP 10.0.0.8.44828 > 10.0.0.6.1883: Flags [P.], seq 313955927:313956322, ack 1598809944, win 83, options [nop,nop,TS val 1095919729 ecr 3791213131], length 395
 00:00:19.761770 IP 10.0.0.6.1883 > 10.0.0.8.44828: Flags [P.], seq 1598809944:1598809948, ack 313956322, win 85, options [nop,nop,TS val 3791214249 ecr 1095919729], length 4
 00:00:19.766506 IP 10.0.0.8.44828 > 10.0.0.6.1883: Flags [.], ack 1598809948, win 83, options [nop,nop,TS val 1095919735 ecr 3791214249], length 0
 00:00:19.766640 IP 10.0.0.8.44828 > 10.0.0.6.1883: Flags [P.], seq 313956322:313956326, ack 1598809948, win 83, options [nop,nop,TS val 1095919735 ecr 3791214249], length 4
 00:00:19.766994 IP 10.0.0.6.1883 > 10.0.0.8.44828: Flags [P.], seq 1598809948:1598809952, ack 313956326, win 85, options [nop,nop,TS val 3791214255 ecr 1095919735], length 4
 00:00:20.122485 IP 10.0.0.6.1883 > 10.0.0.8.44828: Flags [P.], seq 1598809948:1598809952, ack 313956326, win 85, options [nop,nop,TS val 3791214610 ecr 1095919735], length 4
 00:00:20.122481 IP 10.0.0.8.44828 > 10.0.0.6.1883: Flags [.], ack 1598809952, win 83, options [nop,nop,TS val 1095919948 ecr 3791214255], length 0
 00:00:20.234109 IP 10.0.0.8.44828 > 10.0.0.6.1883: Flags [.], ack 1598809952, win 83, options [nop,nop,TS val 1095920158 ecr 3791214610,nop,nop,sack 1 {1598809948:1598809952}], length 0
 00:00:20.764257 IP 10.0.0.8.44828 > 10.0.0.6.1883: Flags [P.], seq 313956326:313956721, ack 1598809952, win 83, options [nop,nop,TS val 1095920732 ecr 3791214610], length 395
 00:00:20.765166 IP 10.0.0.6.1883 > 10.0.0.8.44828: Flags [P.], seq 1598809952:1598809956, ack 313956721, win 85, options [nop,nop,TS val 3791215252 ecr 1095920732], length 4
 00:00:20.767181 IP 10.0.0.8.44828 > 10.0.0.6.1883: Flags [.], ack 1598809956, win 83, options [nop,nop,TS val 1095920735 ecr 3791215252], length 0
 00:00:20.767396 IP 10.0.0.8.44828 > 10.0.0.6.1883: Flags [P.], seq 313956721:313956725, ack 1598809956, win 83, options [nop,nop,TS val 1095920735 ecr 3791215252], length 4
 00:00:20.767740 IP 10.0.0.6.1883 > 10.0.0.8.44828: Flags [P.], seq 1598809956:1598809960, ack 313956725, win 85, options [nop,nop,TS val 3791215255 ecr 1095920735], length 4
 00:00:20.821655 IP 10.0.0.8.44828 > 10.0.0.6.1883: Flags [.], ack 1598809960, win 83, options [nop,nop,TS val 1095920782 ecr 3791215255], length 0
 00:00:21.765055 IP 10.0.0.8.44828 > 10.0.0.6.1883: Flags [P.], seq 313956725:313957120, ack 1598809960, win 83, options [nop,nop,TS val 1095921733 ecr 3791215255], length 395
 00:00:21.765991 IP 10.0.0.6.1883 > 10.0.0.8.44828: Flags [P.], seq 1598809960:1598809964, ack 313957120, win 85, options [nop,nop,TS val 3791216253 ecr 1095921733], length 4
 00:00:21.771559 IP 10.0.0.8.44828 > 10.0.0.6.1883: Flags [.], ack 1598809964, win 83, options [nop,nop,TS val 1095921739 ecr 3791216253], length 0
 00:00:21.771733 IP 10.0.0.8.44828 > 10.0.0.6.1883: Flags [P.], seq 313957120:313957124, ack 1598809964, win 83, options [nop,nop,TS val 1095921739 ecr 3791216253], length 4
 00:00:21.772026 IP 10.0.0.6.1883 > 10.0.0.8.44828: Flags [P.], seq 1598809964:1598809968, ack 313957124, win 85, options [nop,nop,TS val 3791216259 ecr 1095921739], length 4
 00:00:21.982275 IP 10.0.0.8.44828 > 10.0.0.6.1883: Flags [.], ack 1598809968, win 83, options [nop,nop,TS val 1095921782 ecr 3791216259], length 0
 00:00:22.769855 IP 10.0.0.8.44828 > 10.0.0.6.1883: Flags [P.], seq 313957124:313957519, ack 1598809968, win 83, options [nop,nop,TS val 1095922737 ecr 3791216259], length 395
 00:00:22.770607 IP 10.0.0.6.1883 > 10.0.0.8.44828: Flags [P.], seq 1598809968:1598809972, ack 313957519, win 85, options [nop,nop,TS val 3791217257 ecr 1095922737], length 4
 00:00:22.772535 IP 10.0.0.8.44828 > 10.0.0.6.1883: Flags [P.], seq 313957519:313957521, ack 1598809972, win 83, options [nop,nop,TS val 1095922739 ecr 3791217257], length 2
 00:00:22.773023 IP 10.0.0.6.1883 > 10.0.0.8.44828: Flags [P.], seq 1598809972:1598809974, ack 313957521, win 85, options [nop,nop,TS val 3791217259 ecr 1095922739], length 2
 00:00:22.774951 IP 10.0.0.8.44828 > 10.0.0.6.1883: Flags [P.], seq 313957521:313957525, ack 1598809974, win 83, options [nop,nop,TS val 1095922742 ecr 3791217259], length 4
 00:00:22.775336 IP 10.0.0.6.1883 > 10.0.0.8.44828: Flags [P.], seq 1598809974:1598809978, ack 313957525, win 85, options [nop,nop,TS val 3791217261 ecr 1095922742], length 4
 00:00:23.009388 IP 10.0.0.8.44828 > 10.0.0.6.1883: Flags [.], ack 1598809978, win 83, options [nop,nop,TS val 1095922949 ecr 3791217261], length 0
 00:00:23.773682 IP 10.0.0.8.44828 > 10.0.0.6.1883: Flags [P.], seq 313957525:313957920, ack 1598809978, win 83, options [nop,nop,TS val 1095923740 ecr 3791217261], length 395
 00:00:23.774775 IP 10.0.0.6.1883 > 10.0.0.8.44828: Flags [P.], seq 1598809978:1598809982, ack 313957920, win 85, options [nop,nop,TS val 3791218260 ecr 1095923740], length 4
 00:00:23.776694 IP 10.0.0.8.44828 > 10.0.0.6.1883: Flags [.], ack 1598809982, win 83, options [nop,nop,TS val 1095923743 ecr 3791218260], length 0
 00:00:23.776907 IP 10.0.0.8.44828 > 10.0.0.6.1883: Flags [P.], seq 313957920:313957924, ack 1598809982, win 83, options [nop,nop,TS val 1095923743 ecr 3791218260], length 4
 00:00:23.777190 IP 10.0.0.6.1883 > 10.0.0.8.44828: Flags [P.], seq 1598809982:1598809986, ack 313957924, win 85, options [nop,nop,TS val 3791218263 ecr 1095923743], length 4
 00:00:24.009574 IP 10.0.0.8.44828 > 10.0.0.6.1883: Flags [.], ack 1598809986, win 83, options [nop,nop,TS val 1095923962 ecr 3791218263], length 0
 00:00:24.777097 IP 10.0.0.8.44828 > 10.0.0.6.1883: Flags [P.], seq 313957924:313958319, ack 1598809986, win 83, options [nop,nop,TS val 1095924743 ecr 3791218263], length 395
 00:00:24.778330 IP 10.0.0.6.1883 > 10.0.0.8.44828: Flags [P.], seq 1598809986:1598809990, ack 313958319, win 85, options [nop,nop,TS val 3791219263 ecr 1095924743], length 4
 00:00:24.779405 IP 10.0.0.8.44828 > 10.0.0.6.1883: Flags [.], ack 1598809990, win 83, options [nop,nop,TS val 1095924746 ecr 3791219263], length 0
 00:00:24.779715 IP 10.0.0.8.44828 > 10.0.0.6.1883: Flags [P.], seq 313958319:313958323, ack 1598809990, win 83, options [nop,nop,TS val 1095924747 ecr 3791219263], length 4
 00:00:24.779852 IP 10.0.0.6.1883 > 10.0.0.8.44828: Flags [P.], seq 1598809990:1598809994, ack 313958323, win 85, options [nop,nop,TS val 3791219265 ecr 1095924747], length 4
 00:00:24.991313 IP 10.0.0.8.44828 > 10.0.0.6.1883: Flags [.], ack 1598809994, win 83, options [nop,nop,TS val 1095924953 ecr 3791219265], length 0
 00:00:25.778329 IP 10.0.0.8.44828 > 10.0.0.6.1883: Flags [P.], seq 313958323:313958718, ack 1598809994, win 83, options [nop,nop,TS val 1095925743 ecr 3791219265], length 395
 00:00:25.779101 IP 10.0.0.6.1883 > 10.0.0.8.44828: Flags [P.], seq 1598809994:1598809998, ack 313958718, win 85, options [nop,nop,TS val 3791220264 ecr 1095925743], length 4
 00:00:25.780228 IP 10.0.0.8.44828 > 10.0.0.6.1883: Flags [.], ack 1598809998, win 83, options [nop,nop,TS val 1095925746 ecr 3791220264], length 0
 00:00:25.781157 IP 10.0.0.8.44828 > 10.0.0.6.1883: Flags [P.], seq 313958718:313958722, ack 1598809998, win 83, options [nop,nop,TS val 1095925747 ecr 3791220264], length 4
 00:00:25.781471 IP 10.0.0.6.1883 > 10.0.0.8.44828: Flags [P.], seq 1598809998:1598810002, ack 313958722, win 85, options [nop,nop,TS val 3791220266 ecr 1095925747], length 4
 00:00:25.825997 IP 10.0.0.8.44828 > 10.0.0.6.1883: Flags [.], ack 1598810002, win 83, options [nop,nop,TS val 1095925792 ecr 3791220266], length 0
 00:00:26.795794 IP 10.0.0.8.44828 > 10.0.0.6.1883: Flags [P.], seq 313958722:313959117, ack 1598810002, win 83, options [nop,nop,TS val 1095926761 ecr 3791220266], length 395
 00:00:26.796484 IP 10.0.0.6.1883 > 10.0.0.8.44828: Flags [P.], seq 1598810002:1598810006, ack 313959117, win 85, options [nop,nop,TS val 3791221281 ecr 1095926761], length 4
 00:00:26.797506 IP 10.0.0.8.44828 > 10.0.0.6.1883: Flags [.], ack 1598810006, win 83, options [nop,nop,TS val 1095926763 ecr 3791221281], length 0
 00:00:26.797530 IP 10.0.0.8.44828 > 10.0.0.6.1883: Flags [P.], seq 313959117:313959121, ack 1598810006, win 83, options [nop,nop,TS val 1095926763 ecr 3791221281], length 4
 00:00:26.798329 IP 10.0.0.6.1883 > 10.0.0.8.44828: Flags [P.], seq 1598810006:1598810010, ack 313959121, win 85, options [nop,nop,TS val 3791221282 ecr 1095926763], length 4
 00:00:27.013533 IP 10.0.0.8.44828 > 10.0.0.6.1883: Flags [.], ack 1598810010, win 83, options [nop,nop,TS val 1095926972 ecr 3791221282], length 0
 00:00:27.418127 IP6 fe80::640d:7dff:fe5f:ebd7 > ff02::2: ICMP6, router solicitation, length 16
 00:00:27.840163 IP 10.0.0.8.44828 > 10.0.0.6.1883: Flags [P.], seq 313959121:313959516, ack 1598810010, win 83, options [nop,nop,TS val 1095927805 ecr 3791221282], length 395
 00:00:27.841538 IP 10.0.0.6.1883 > 10.0.0.8.44828: Flags [P.], seq 1598810010:1598810014, ack 313959516, win 85, options [nop,nop,TS val 3791222325 ecr 1095927805], length 4
 00:00:27.842372 IP 10.0.0.8.44828 > 10.0.0.6.1883: Flags [P.], seq 313959516:313959518, ack 1598810014, win 83, options [nop,nop,TS val 1095927808 ecr 3791222325], length 2
 00:00:27.842793 IP 10.0.0.6.1883 > 10.0.0.8.44828: Flags [P.], seq 1598810014:1598810016, ack 313959518, win 85, options [nop,nop,TS val 3791222326 ecr 1095927808], length 2
 00:00:27.843829 IP 10.0.0.8.44828 > 10.0.0.6.1883: Flags [P.], seq 313959518:313959522, ack 1598810016, win 83, options [nop,nop,TS val 1095927809 ecr 3791222326], length 4
 00:00:27.844081 IP 10.0.0.6.1883 > 10.0.0.8.44828: Flags [P.], seq 1598810016:1598810020, ack 313959522, win 85, options [nop,nop,TS val 3791222328 ecr 1095927809], length 4
 00:00:27.885729 IP 10.0.0.8.44828 > 10.0.0.6.1883: Flags [.], ack 1598810020, win 83, options [nop,nop,TS val 1095927851 ecr 3791222328], length 0
 00:00:28.841269 IP 10.0.0.8.44828 > 10.0.0.6.1883: Flags [P.], seq 313959522:313959917, ack 1598810020, win 83, options [nop,nop,TS val 1095928806 ecr 3791222328], length 395
 00:00:28.841930 IP 10.0.0.6.1883 > 10.0.0.8.44828: Flags [P.], seq 1598810020:1598810024, ack 313959917, win 85, options [nop,nop,TS val 3791223325 ecr 1095928806], length 4
 00:00:28.843628 IP 10.0.0.8.44828 > 10.0.0.6.1883: Flags [.], ack 1598810024, win 83, options [nop,nop,TS val 1095928808 ecr 3791223325], length 0
 00:00:28.843921 IP 10.0.0.8.44828 > 10.0.0.6.1883: Flags [P.], seq 313959917:313959921, ack 1598810024, win 83, options [nop,nop,TS val 1095928809 ecr 3791223325], length 4
 00:00:28.844349 IP 10.0.0.6.1883 > 10.0.0.8.44828: Flags [P.], seq 1598810024:1598810028, ack 313959921, win 85, options [nop,nop,TS val 3791223327 ecr 1095928809], length 4
 00:00:28.885512 IP 10.0.0.8.44828 > 10.0.0.6.1883: Flags [.], ack 1598810028, win 83, options [nop,nop,TS val 1095928850 ecr 3791223327], length 0
 00:00:29.430494 IP6 fe80::e82d:bfff:fec5:fe95 > ff02::2: ICMP6, router solicitation, length 16
 00:00:29.842462 IP 10.0.0.8.44828 > 10.0.0.6.1883: Flags [P.], seq 313959921:313960316, ack 1598810028, win 83, options [nop,nop,TS val 1095929807 ecr 3791223327], length 395
 00:00:29.843332 IP 10.0.0.6.1883 > 10.0.0.8.44828: Flags [P.], seq 1598810028:1598810032, ack 313960316, win 85, options [nop,nop,TS val 3791224326 ecr 1095929807], length 4
 00:00:29.844999 IP 10.0.0.8.44828 > 10.0.0.6.1883: Flags [.], ack 1598810032, win 83, options [nop,nop,TS val 1095929809 ecr 3791224326], length 0
 00:00:29.845151 IP 10.0.0.8.44828 > 10.0.0.6.1883: Flags [P.], seq 313960316:313960320, ack 1598810032, win 83, options [nop,nop,TS val 1095929809 ecr 3791224326], length 4
 00:00:29.845699 IP 10.0.0.6.1883 > 10.0.0.8.44828: Flags [P.], seq 1598810032:1598810036, ack 313960320, win 85, options [nop,nop,TS val 3791224328 ecr 1095929809], length 4
 00:00:29.889564 IP 10.0.0.8.44828 > 10.0.0.6.1883: Flags [.], ack 1598810036, win 83, options [nop,nop,TS val 1095929854 ecr 3791224328], length 0
 00:00:30.843912 IP 10.0.0.8.44828 > 10.0.0.6.1883: Flags [P.], seq 313960320:313960715, ack 1598810036, win 83, options [nop,nop,TS val 1095930808 ecr 3791224328], length 395
 00:00:30.844685 IP 10.0.0.6.1883 > 10.0.0.8.44828: Flags [P.], seq 1598810036:1598810040, ack 313960715, win 85, options [nop,nop,TS val 3791225327 ecr 1095930808], length 4
 00:00:30.846040 IP 10.0.0.8.44828 > 10.0.0.6.1883: Flags [.], ack 1598810040, win 83, options [nop,nop,TS val 1095930809 ecr 3791225327], length 0
 00:00:30.846270 IP 10.0.0.8.44828 > 10.0.0.6.1883: Flags [P.], seq 313960715:313960719, ack 1598810040, win 83, options [nop,nop,TS val 1095930810 ecr 3791225327], length 4
 00:00:30.846571 IP 10.0.0.6.1883 > 10.0.0.8.44828: Flags [P.], seq 1598810040:1598810044, ack 313960719, win 85, options [nop,nop,TS val 3791225329 ecr 1095930810], length 4
 00:00:30.889801 IP 10.0.0.8.44828 > 10.0.0.6.1883: Flags [.], ack 1598810044, win 83, options [nop,nop,TS val 1095930854 ecr 3791225329], length 0
 00:00:31.480232 IP6 fe80::98b5:99ff:fe39:d2e1 > ff02::2: ICMP6, router solicitation, length 16
 00:00:31.845280 IP 10.0.0.8.44828 > 10.0.0.6.1883: Flags [P.], seq 313960719:313961114, ack 1598810044, win 83, options [nop,nop,TS val 1095931809 ecr 3791225329], length 395
 00:00:31.846130 IP 10.0.0.6.1883 > 10.0.0.8.44828: Flags [P.], seq 1598810044:1598810048, ack 313961114, win 85, options [nop,nop,TS val 3791226328 ecr 1095931809], length 4
 00:00:31.847663 IP 10.0.0.8.44828 > 10.0.0.6.1883: Flags [.], ack 1598810048, win 83, options [nop,nop,TS val 1095931811 ecr 3791226328], length 0
 00:00:31.847754 IP 10.0.0.8.44828 > 10.0.0.6.1883: Flags [P.], seq 313961114:313961118, ack 1598810048, win 83, options [nop,nop,TS val 1095931811 ecr 3791226328], length 4
 00:00:31.848051 IP 10.0.0.6.1883 > 10.0.0.8.44828: Flags [P.], seq 1598810048:1598810052, ack 313961118, win 85, options [nop,nop,TS val 3791226330 ecr 1095931811], length 4
 00:00:31.889762 IP 10.0.0.8.44828 > 10.0.0.6.1883: Flags [.], ack 1598810052, win 83, options [nop,nop,TS val 1095931853 ecr 3791226330], length 0
 00:00:32.843031 IP 10.0.0.8.44828 > 10.0.0.6.1883: Flags [P.], seq 313961118:313961120, ack 1598810052, win 83, options [nop,nop,TS val 1095932806 ecr 3791226330], length 2
 00:00:32.843451 IP 10.0.0.6.1883 > 10.0.0.8.44828: Flags [P.], seq 1598810052:1598810054, ack 313961120, win 85, options [nop,nop,TS val 3791227324 ecr 1095932806], length 2
 00:00:32.844847 IP 10.0.0.8.44828 > 10.0.0.6.1883: Flags [.], ack 1598810054, win 83, options [nop,nop,TS val 1095932807 ecr 3791227324], length 0
 00:00:32.845705 IP 10.0.0.8.44828 > 10.0.0.6.1883: Flags [P.], seq 313961120:313961515, ack 1598810054, win 83, options [nop,nop,TS val 1095932808 ecr 3791227324], length 395
 00:00:32.846945 IP 10.0.0.6.1883 > 10.0.0.8.44828: Flags [P.], seq 1598810054:1598810058, ack 313961515, win 85, options [nop,nop,TS val 3791227328 ecr 1095932808], length 4
 00:00:32.847334 IP 10.0.0.8.44828 > 10.0.0.6.1883: Flags [P.], seq 313961515:313961519, ack 1598810058, win 83, options [nop,nop,TS val 1095932810 ecr 3791227328], length 4
 00:00:32.847441 IP 10.0.0.6.1883 > 10.0.0.8.44828: Flags [P.], seq 1598810058:1598810062, ack 313961519, win 85, options [nop,nop,TS val 3791227329 ecr 1095932810], length 4
 00:00:32.889783 IP 10.0.0.8.44828 > 10.0.0.6.1883: Flags [.], ack 1598810062, win 83, options [nop,nop,TS val 1095932853 ecr 3791227329], length 0
 00:00:33.545060 IP6 fe80::e89a:94ff:fe5d:bfef > ff02::2: ICMP6, router solicitation, length 16
 00:00:33.571178 IP6 fe80::d4be:afff:feb6:be37 > ff02::2: ICMP6, router solicitation, length 16
 00:00:33.582735 IP6 fe80::18ac:7eff:fe7d:3e73 > ff02::2: ICMP6, router solicitation, length 16
 00:00:33.847120 IP 10.0.0.8.44828 > 10.0.0.6.1883: Flags [P.], seq 313961519:313961914, ack 1598810062, win 83, options [nop,nop,TS val 1095933809 ecr 3791227329], length 395
 00:00:33.847806 IP 10.0.0.6.1883 > 10.0.0.8.44828: Flags [P.], seq 1598810062:1598810066, ack 313961914, win 85, options [nop,nop,TS val 3791228328 ecr 1095933809], length 4
 00:00:33.849057 IP 10.0.0.8.44828 > 10.0.0.6.1883: Flags [.], ack 1598810066, win 83, options [nop,nop,TS val 1095933811 ecr 3791228328], length 0
 00:00:33.849418 IP 10.0.0.8.44828 > 10.0.0.6.1883: Flags [P.], seq 313961914:313961918, ack 1598810066, win 83, options [nop,nop,TS val 1095933811 ecr 3791228328], length 4
 00:00:33.849820 IP 10.0.0.6.1883 > 10.0.0.8.44828: Flags [P.], seq 1598810066:1598810070, ack 313961918, win 85, options [nop,nop,TS val 3791228330 ecr 1095933811], length 4
 00:00:33.893507 IP 10.0.0.8.44828 > 10.0.0.6.1883: Flags [.], ack 1598810070, win 83, options [nop,nop,TS val 1095933856 ecr 3791228330], length 0
 00:00:34.848208 IP 10.0.0.8.44828 > 10.0.0.6.1883: Flags [P.], seq 313961918:313962313, ack 1598810070, win 83, options [nop,nop,TS val 1095934810 ecr 3791228330], length 395
 00:00:34.849182 IP 10.0.0.6.1883 > 10.0.0.8.44828: Flags [P.], seq 1598810070:1598810074, ack 313962313, win 85, options [nop,nop,TS val 3791229329 ecr 1095934810], length 4
 00:00:34.850577 IP 10.0.0.8.44828 > 10.0.0.6.1883: Flags [.], ack 1598810074, win 83, options [nop,nop,TS val 1095934812 ecr 3791229329], length 0
 00:00:34.850920 IP 10.0.0.8.44828 > 10.0.0.6.1883: Flags [P.], seq 313962313:313962317, ack 1598810074, win 83, options [nop,nop,TS val 1095934813 ecr 3791229329], length 4
 00:00:34.851396 IP 10.0.0.6.1883 > 10.0.0.8.44828: Flags [P.], seq 1598810074:1598810078, ack 313962317, win 85, options [nop,nop,TS val 3791229331 ecr 1095934813], length 4
 00:00:34.895856 IP 10.0.0.8.44828 > 10.0.0.6.1883: Flags [.], ack 1598810078, win 83, options [nop,nop,TS val 1095934858 ecr 3791229331], length 0
 00:00:35.562358 IP6 fe80::30cd:a8ff:fec3:26f9 > ff02::2: ICMP6, router solicitation, length 16
 00:00:35.848700 IP 10.0.0.8.44828 > 10.0.0.6.1883: Flags [P.], seq 313962317:313962712, ack 1598810078, win 83, options [nop,nop,TS val 1095935810 ecr 3791229331], length 395
 00:00:35.849492 IP 10.0.0.6.1883 > 10.0.0.8.44828: Flags [P.], seq 1598810078:1598810082, ack 313962712, win 85, options [nop,nop,TS val 3791230329 ecr 1095935810], length 4
 00:00:35.850802 IP 10.0.0.8.44828 > 10.0.0.6.1883: Flags [.], ack 1598810082, win 83, options [nop,nop,TS val 1095935812 ecr 3791230329], length 0
 00:00:35.850882 IP 10.0.0.8.44828 > 10.0.0.6.1883: Flags [P.], seq 313962712:313962716, ack 1598810082, win 83, options [nop,nop,TS val 1095935812 ecr 3791230329], length 4
