 00:00:00.000000 IP6 fe80::e07d:2eff:fe7b:b074 > ff02::2: ICMP6, router solicitation, length 16
 00:00:00.231985 IP6 fe80::34de:55ff:fe98:679 > ff02::2: ICMP6, router solicitation, length 16
 00:00:00.247788 IP6 fe80::8831:51ff:fec6:6176 > ff02::2: ICMP6, router solicitation, length 16
 00:00:00.255862 IP6 fe80::f0d0:5aff:fef8:7722 > ff02::2: ICMP6, router solicitation, length 16
 00:00:00.521619 IP6 fe80::4480:99ff:fe91:a82c > ff02::2: ICMP6, router solicitation, length 16
 00:00:00.536436 IP6 fe80::fc6d:a7ff:fe92:7aaa > ff02::2: ICMP6, router solicitation, length 16
 00:00:00.539921 IP6 fe80::ac48:65ff:fef6:1feb > ff02::2: ICMP6, router solicitation, length 16
 00:00:00.734091 IP6 fe80::c8b9:48ff:fe8c:3b0e > ff02::2: ICMP6, router solicitation, length 16
 00:00:00.992847 IP6 fe80::702b:88ff:fe8d:d253 > ff02::2: ICMP6, router solicitation, length 16
 00:00:01.047158 IP6 fe80::8c17:20ff:fe0e:4026 > ff02::2: ICMP6, router solicitation, length 16
 00:00:01.272171 IP6 fe80::88b3:b0ff:fefc:df3d > ff02::2: ICMP6, router solicitation, length 16
 00:00:02.058749 IP6 fe80::a84b:36ff:feb7:e01e > ff02::2: ICMP6, router solicitation, length 16
 00:00:02.067437 IP6 fe80::ac09:cdff:fe68:be0d > ff02::2: ICMP6, router solicitation, length 16
 00:00:11.616582 ARP, Request who-has 10.0.0.6 tell 10.0.0.8, length 28
 00:00:11.617795 ARP, Reply 10.0.0.6 is-at 72:2b:88:8d:d2:53, length 28
 00:00:11.646536 IP 10.0.0.8.44794 > 10.0.0.6.1883: Flags [S], seq 3098033963, win 42340, options [mss 1460,sackOK,TS val 1095710717 ecr 0,nop,wscale 9], length 0
 00:00:11.646602 IP 10.0.0.6.1883 > 10.0.0.8.44794: Flags [S.], seq 2377296846, ack 3098033964, win 43440, options [mss 1460,sackOK,TS val 3791005290 ecr 1095710717,nop,wscale 9], length 0
 00:00:11.654744 IP 10.0.0.8.44794 > 10.0.0.6.1883: Flags [.], ack 2377296847, win 83, options [nop,nop,TS val 1095710780 ecr 3791005290], length 0
 00:00:11.654799 IP 10.0.0.8.44794 > 10.0.0.6.1883: Flags [P.], seq 3098033964:3098033984, ack 2377296847, win 83, options [nop,nop,TS val 1095710780 ecr 3791005290], length 20
 00:00:11.654952 IP 10.0.0.6.1883 > 10.0.0.8.44794: Flags [.], ack 3098033984, win 85, options [nop,nop,TS val 3791005299 ecr 1095710780], length 0
 00:00:11.655053 IP 10.0.0.6.1883 > 10.0.0.8.44794: Flags [P.], seq 2377296847:2377296851, ack 3098033984, win 85, options [nop,nop,TS val 3791005299 ecr 1095710780], length 4
 00:00:11.663279 IP 10.0.0.8.44794 > 10.0.0.6.1883: Flags [.], ack 2377296851, win 83, options [nop,nop,TS val 1095710789 ecr 3791005299], length 0
 00:00:11.664224 IP 10.0.0.8.44794 > 10.0.0.6.1883: Flags [P.], seq 3098033984:3098034048, ack 2377296851, win 83, options [nop,nop,TS val 1095710789 ecr 3791005299], length 64
 00:00:11.664498 IP 10.0.0.6.1883 > 10.0.0.8.44794: Flags [P.], seq 2377296851:2377296916, ack 3098034048, win 85, options [nop,nop,TS val 3791005308 ecr 1095710789], length 65
 00:00:11.665384 IP 10.0.0.8.44794 > 10.0.0.6.1883: Flags [P.], seq 3098034048:3098034443, ack 2377296916, win 83, options [nop,nop,TS val 1095710791 ecr 3791005308], length 395
 00:00:11.665501 IP 10.0.0.6.1883 > 10.0.0.8.44794: Flags [P.], seq 2377296916:2377296921, ack 3098034443, win 85, options [nop,nop,TS val 3791005309 ecr 1095710791], length 5
 00:00:11.709666 IP 10.0.0.8.44794 > 10.0.0.6.1883: Flags [.], ack 2377296921, win 83, options [nop,nop,TS val 1095710835 ecr 3791005309], length 0
 00:00:11.709802 IP 10.0.0.6.1883 > 10.0.0.8.44794: Flags [P.], seq 2377296921:2377296925, ack 3098034443, win 85, options [nop,nop,TS val 3791005354 ecr 1095710835], length 4
 00:00:11.710238 IP 10.0.0.8.44794 > 10.0.0.6.1883: Flags [.], ack 2377296925, win 83, options [nop,nop,TS val 1095710836 ecr 3791005354], length 0
 00:00:11.712049 IP 10.0.0.8.44794 > 10.0.0.6.1883: Flags [P.], seq 3098034443:3098034447, ack 2377296925, win 83, options [nop,nop,TS val 1095710836 ecr 3791005354], length 4
 00:00:11.712382 IP 10.0.0.6.1883 > 10.0.0.8.44794: Flags [P.], seq 2377296925:2377296929, ack 3098034447, win 85, options [nop,nop,TS val 3791005356 ecr 1095710836], length 4
 00:00:11.755901 IP 10.0.0.8.44794 > 10.0.0.6.1883: Flags [.], ack 2377296929, win 83, options [nop,nop,TS val 1095710880 ecr 3791005356], length 0
 00:00:12.594654 IP 10.0.0.8.44794 > 10.0.0.6.1883: Flags [P.], seq 3098034447:3098034842, ack 2377296929, win 83, options [nop,nop,TS val 1095711719 ecr 3791005356], length 395
 00:00:12.597631 IP 10.0.0.6.1883 > 10.0.0.8.44794: Flags [P.], seq 2377296929:2377296933, ack 3098034842, win 85, options [nop,nop,TS val 3791006239 ecr 1095711719], length 4
 00:00:12.598755 IP 10.0.0.8.44794 > 10.0.0.6.1883: Flags [.], ack 2377296933, win 83, options [nop,nop,TS val 1095711723 ecr 3791006239], length 0
 00:00:12.598757 IP 10.0.0.8.44794 > 10.0.0.6.1883: Flags [P.], seq 3098034842:3098034846, ack 2377296933, win 83, options [nop,nop,TS val 1095711724 ecr 3791006239], length 4
 00:00:12.599562 IP 10.0.0.6.1883 > 10.0.0.8.44794: Flags [P.], seq 2377296933:2377296937, ack 3098034846, win 85, options [nop,nop,TS val 3791006242 ecr 1095711724], length 4
 00:00:12.649555 IP 10.0.0.8.44794 > 10.0.0.6.1883: Flags [.], ack 2377296937, win 83, options [nop,nop,TS val 1095711767 ecr 3791006242], length 0
 00:00:13.685164 IP 10.0.0.8.44794 > 10.0.0.6.1883: Flags [P.], seq 3098034846:3098035241, ack 2377296937, win 83, options [nop,nop,TS val 1095712809 ecr 3791006242], length 395
 00:00:13.686318 IP 10.0.0.6.1883 > 10.0.0.8.44794: Flags [P.], seq 2377296937:2377296941, ack 3098035241, win 85, options [nop,nop,TS val 3791007329 ecr 1095712809], length 4
 00:00:13.687234 IP 10.0.0.8.44794 > 10.0.0.6.1883: Flags [.], ack 2377296941, win 83, options [nop,nop,TS val 1095712812 ecr 3791007329], length 0
 00:00:13.687761 IP 10.0.0.8.44794 > 10.0.0.6.1883: Flags [P.], seq 3098035241:3098035245, ack 2377296941, win 83, options [nop,nop,TS val 1095712812 ecr 3791007329], length 4
 00:00:13.688048 IP 10.0.0.6.1883 > 10.0.0.8.44794: Flags [P.], seq 2377296941:2377296945, ack 3098035245, win 85, options [nop,nop,TS val 3791007331 ecr 1095712812], length 4
 00:00:13.766941 IP 10.0.0.8.44794 > 10.0.0.6.1883: Flags [.], ack 2377296945, win 83, options [nop,nop,TS val 1095712855 ecr 3791007331], length 0
 00:00:14.081522 IP6 fe80::bc5d:60ff:fea1:d5f2 > ff02::2: ICMP6, router solicitation, length 16
 00:00:14.313631 IP6 fe80::34de:55ff:fe98:679 > ff02::2: ICMP6, router solicitation, length 16
 00:00:14.582575 IP6 fe80::8831:51ff:fec6:6176 > ff02::2: ICMP6, router solicitation, length 16
 00:00:14.686951 IP 10.0.0.8.44794 > 10.0.0.6.1883: Flags [P.], seq 3098035245:3098035640, ack 2377296945, win 83, options [nop,nop,TS val 1095713810 ecr 3791007331], length 395
 00:00:14.687979 IP 10.0.0.6.1883 > 10.0.0.8.44794: Flags [P.], seq 2377296945:2377296949, ack 3098035640, win 85, options [nop,nop,TS val 3791008330 ecr 1095713810], length 4
 00:00:14.689604 IP 10.0.0.8.44794 > 10.0.0.6.1883: Flags [.], ack 2377296949, win 83, options [nop,nop,TS val 1095713813 ecr 3791008330], length 0
 00:00:14.690262 IP 10.0.0.8.44794 > 10.0.0.6.1883: Flags [P.], seq 3098035640:3098035644, ack 2377296949, win 83, options [nop,nop,TS val 1095713813 ecr 3791008330], length 4
 00:00:14.690536 IP 10.0.0.6.1883 > 10.0.0.8.44794: Flags [P.], seq 2377296949:2377296953, ack 3098035644, win 85, options [nop,nop,TS val 3791008333 ecr 1095713813], length 4
 00:00:14.774379 IP 10.0.0.8.44794 > 10.0.0.6.1883: Flags [.], ack 2377296953, win 83, options [nop,nop,TS val 1095713874 ecr 3791008333], length 0
 00:00:15.581906 IP6 fe80::c8b9:48ff:fe8c:3b0e > ff02::2: ICMP6, router solicitation, length 16
 00:00:15.687846 IP 10.0.0.8.44794 > 10.0.0.6.1883: Flags [P.], seq 3098035644:3098036039, ack 2377296953, win 83, options [nop,nop,TS val 1095714811 ecr 3791008333], length 395
 00:00:15.688994 IP 10.0.0.6.1883 > 10.0.0.8.44794: Flags [P.], seq 2377296953:2377296957, ack 3098036039, win 85, options [nop,nop,TS val 3791009330 ecr 1095714811], length 4
 00:00:15.690569 IP 10.0.0.8.44794 > 10.0.0.6.1883: Flags [.], ack 2377296957, win 83, options [nop,nop,TS val 1095714814 ecr 3791009330], length 0
 00:00:15.691513 IP 10.0.0.8.44794 > 10.0.0.6.1883: Flags [P.], seq 3098036039:3098036043, ack 2377296957, win 83, options [nop,nop,TS val 1095714814 ecr 3791009330], length 4
 00:00:15.691664 IP 10.0.0.6.1883 > 10.0.0.8.44794: Flags [P.], seq 2377296957:2377296961, ack 3098036043, win 85, options [nop,nop,TS val 3791009333 ecr 1095714814], length 4
 00:00:15.746596 IP 10.0.0.8.44794 > 10.0.0.6.1883: Flags [.], ack 2377296961, win 83, options [nop,nop,TS val 1095714857 ecr 3791009333], length 0
 00:00:15.872915 IP6 fe80::ac48:65ff:fef6:1feb > ff02::2: ICMP6, router solicitation, length 16
 00:00:15.883210 IP6 fe80::f0d0:5aff:fef8:7722 > ff02::2: ICMP6, router solicitation, length 16
 00:00:16.105613 IP6 fe80::e07d:2eff:fe7b:b074 > ff02::2: ICMP6, router solicitation, length 16
 00:00:16.130867 IP6 fe80::4480:99ff:fe91:a82c > ff02::2: ICMP6, router solicitation, length 16
 00:00:16.629399 IP6 fe80::fc6d:a7ff:fe92:7aaa > ff02::2: ICMP6, router solicitation, length 16
 00:00:16.665744 IP 10.0.0.8.44794 > 10.0.0.6.1883: Flags [P.], seq 3098036043:3098036045, ack 2377296961, win 83, options [nop,nop,TS val 1095715789 ecr 3791009333], length 2
 00:00:16.667162 IP 10.0.0.6.1883 > 10.0.0.8.44794: Flags [P.], seq 2377296961:2377296963, ack 3098036045, win 85, options [nop,nop,TS val 3791010308 ecr 1095715789], length 2
 00:00:16.668069 IP 10.0.0.8.44794 > 10.0.0.6.1883: Flags [.], ack 2377296963, win 83, options [nop,nop,TS val 1095715791 ecr 3791010308], length 0
 00:00:16.690148 IP 10.0.0.8.44794 > 10.0.0.6.1883: Flags [P.], seq 3098036045:3098036440, ack 2377296963, win 83, options [nop,nop,TS val 1095715812 ecr 3791010308], length 395
 00:00:16.691014 IP 10.0.0.6.1883 > 10.0.0.8.44794: Flags [P.], seq 2377296963:2377296967, ack 3098036440, win 85, options [nop,nop,TS val 3791010332 ecr 1095715812], length 4
 00:00:16.692662 IP 10.0.0.8.44794 > 10.0.0.6.1883: Flags [P.], seq 3098036440:3098036444, ack 2377296967, win 83, options [nop,nop,TS val 1095715815 ecr 3791010332], length 4
 00:00:16.693027 IP 10.0.0.6.1883 > 10.0.0.8.44794: Flags [P.], seq 2377296967:2377296971, ack 3098036444, win 85, options [nop,nop,TS val 3791010334 ecr 1095715815], length 4
 00:00:16.733834 IP 10.0.0.8.44794 > 10.0.0.6.1883: Flags [.], ack 2377296971, win 83, options [nop,nop,TS val 1095715857 ecr 3791010334], length 0
 00:00:16.882542 IP6 fe80::88b3:b0ff:fefc:df3d > ff02::2: ICMP6, router solicitation, length 16
 00:00:17.125931 IP6 fe80::702b:88ff:fe8d:d253 > ff02::2: ICMP6, router solicitation, length 16
 00:00:17.692883 IP 10.0.0.8.44794 > 10.0.0.6.1883: Flags [P.], seq 3098036444:3098036839, ack 2377296971, win 83, options [nop,nop,TS val 1095716813 ecr 3791010334], length 395
 00:00:17.693969 IP 10.0.0.6.1883 > 10.0.0.8.44794: Flags [P.], seq 2377296971:2377296975, ack 3098036839, win 85, options [nop,nop,TS val 3791011334 ecr 1095716813], length 4
 00:00:17.694805 IP 10.0.0.8.44794 > 10.0.0.6.1883: Flags [.], ack 2377296975, win 83, options [nop,nop,TS val 1095716817 ecr 3791011334], length 0
 00:00:17.694896 IP 10.0.0.8.44794 > 10.0.0.6.1883: Flags [P.], seq 3098036839:3098036843, ack 2377296975, win 83, options [nop,nop,TS val 1095716817 ecr 3791011334], length 4
 00:00:17.695148 IP 10.0.0.6.1883 > 10.0.0.8.44794: Flags [P.], seq 2377296975:2377296979, ack 3098036843, win 85, options [nop,nop,TS val 3791011336 ecr 1095716817], length 4
 00:00:17.737972 IP 10.0.0.8.44794 > 10.0.0.6.1883: Flags [.], ack 2377296979, win 83, options [nop,nop,TS val 1095716860 ecr 3791011336], length 0
 00:00:18.692713 IP 10.0.0.8.44794 > 10.0.0.6.1883: Flags [P.], seq 3098036843:3098037238, ack 2377296979, win 83, options [nop,nop,TS val 1095717815 ecr 3791011336], length 395
 00:00:18.693389 IP 10.0.0.6.1883 > 10.0.0.8.44794: Flags [P.], seq 2377296979:2377296983, ack 3098037238, win 85, options [nop,nop,TS val 3791012334 ecr 1095717815], length 4
 00:00:18.694726 IP 10.0.0.8.44794 > 10.0.0.6.1883: Flags [.], ack 2377296983, win 83, options [nop,nop,TS val 1095717816 ecr 3791012334], length 0
 00:00:18.694728 IP 10.0.0.8.44794 > 10.0.0.6.1883: Flags [P.], seq 3098037238:3098037242, ack 2377296983, win 83, options [nop,nop,TS val 1095717816 ecr 3791012334], length 4
 00:00:18.695173 IP 10.0.0.6.1883 > 10.0.0.8.44794: Flags [P.], seq 2377296983:2377296987, ack 3098037242, win 85, options [nop,nop,TS val 3791012335 ecr 1095717816], length 4
 00:00:18.738110 IP 10.0.0.8.44794 > 10.0.0.6.1883: Flags [.], ack 2377296987, win 83, options [nop,nop,TS val 1095717860 ecr 3791012335], length 0
 00:00:19.436808 IP6 fe80::a84b:36ff:feb7:e01e > ff02::2: ICMP6, router solicitation, length 16
 00:00:19.440730 IP6 fe80::8c17:20ff:fe0e:4026 > ff02::2: ICMP6, router solicitation, length 16
 00:00:19.694528 IP 10.0.0.8.44794 > 10.0.0.6.1883: Flags [P.], seq 3098037242:3098037637, ack 2377296987, win 83, options [nop,nop,TS val 1095718816 ecr 3791012335], length 395
 00:00:19.695138 IP 10.0.0.6.1883 > 10.0.0.8.44794: Flags [P.], seq 2377296987:2377296991, ack 3098037637, win 85, options [nop,nop,TS val 3791013335 ecr 1095718816], length 4
 00:00:19.696437 IP 10.0.0.8.44794 > 10.0.0.6.1883: Flags [.], ack 2377296991, win 83, options [nop,nop,TS val 1095718817 ecr 3791013335], length 0
 00:00:19.696786 IP 10.0.0.8.44794 > 10.0.0.6.1883: Flags [P.], seq 3098037637:3098037641, ack 2377296991, win 83, options [nop,nop,TS val 1095718818 ecr 3791013335], length 4
 00:00:19.697341 IP 10.0.0.6.1883 > 10.0.0.8.44794: Flags [P.], seq 2377296991:2377296995, ack 3098037641, win 85, options [nop,nop,TS val 3791013337 ecr 1095718818], length 4
 00:00:19.742965 IP 10.0.0.8.44794 > 10.0.0.6.1883: Flags [.], ack 2377296995, win 83, options [nop,nop,TS val 1095718863 ecr 3791013337], length 0
 00:00:20.695935 IP 10.0.0.8.44794 > 10.0.0.6.1883: Flags [P.], seq 3098037641:3098038036, ack 2377296995, win 83, options [nop,nop,TS val 1095719817 ecr 3791013337], length 395
 00:00:20.696571 IP 10.0.0.6.1883 > 10.0.0.8.44794: Flags [P.], seq 2377296995:2377296999, ack 3098038036, win 85, options [nop,nop,TS val 3791014336 ecr 1095719817], length 4
 00:00:20.698089 IP 10.0.0.8.44794 > 10.0.0.6.1883: Flags [.], ack 2377296999, win 83, options [nop,nop,TS val 1095719819 ecr 3791014336], length 0
 00:00:20.698175 IP 10.0.0.8.44794 > 10.0.0.6.1883: Flags [P.], seq 3098038036:3098038040, ack 2377296999, win 83, options [nop,nop,TS val 1095719819 ecr 3791014336], length 4
 00:00:20.698411 IP 10.0.0.6.1883 > 10.0.0.8.44794: Flags [P.], seq 2377296999:2377297003, ack 3098038040, win 85, options [nop,nop,TS val 3791014338 ecr 1095719819], length 4
 00:00:20.746150 IP 10.0.0.8.44794 > 10.0.0.6.1883: Flags [.], ack 2377297003, win 83, options [nop,nop,TS val 1095719863 ecr 3791014338], length 0
 00:00:21.623642 IP6 fe80::ac09:cdff:fe68:be0d > ff02::2: ICMP6, router solicitation, length 16
 00:00:21.667155 IP 10.0.0.8.44794 > 10.0.0.6.1883: Flags [P.], seq 3098038040:3098038042, ack 2377297003, win 83, options [nop,nop,TS val 1095720788 ecr 3791014338], length 2
 00:00:21.667500 IP 10.0.0.6.1883 > 10.0.0.8.44794: Flags [P.], seq 2377297003:2377297005, ack 3098038042, win 85, options [nop,nop,TS val 3791015306 ecr 1095720788], length 2
 00:00:21.668466 IP 10.0.0.8.44794 > 10.0.0.6.1883: Flags [.], ack 2377297005, win 83, options [nop,nop,TS val 1095720789 ecr 3791015306], length 0
 00:00:21.700254 IP 10.0.0.8.44794 > 10.0.0.6.1883: Flags [P.], seq 3098038042:3098038437, ack 2377297005, win 83, options [nop,nop,TS val 1095720820 ecr 3791015306], length 395
 00:00:21.701152 IP 10.0.0.6.1883 > 10.0.0.8.44794: Flags [P.], seq 2377297005:2377297009, ack 3098038437, win 85, options [nop,nop,TS val 3791015340 ecr 1095720820], length 4
 00:00:21.702922 IP 10.0.0.8.44794 > 10.0.0.6.1883: Flags [P.], seq 3098038437:3098038441, ack 2377297009, win 83, options [nop,nop,TS val 1095720822 ecr 3791015340], length 4
 00:00:21.703292 IP 10.0.0.6.1883 > 10.0.0.8.44794: Flags [P.], seq 2377297009:2377297013, ack 3098038441, win 85, options [nop,nop,TS val 3791015342 ecr 1095720822], length 4
 00:00:21.758571 IP 10.0.0.8.44794 > 10.0.0.6.1883: Flags [.], ack 2377297013, win 83, options [nop,nop,TS val 1095720867 ecr 3791015342], length 0
 00:00:22.703173 IP 10.0.0.8.44794 > 10.0.0.6.1883: Flags [P.], seq 3098038441:3098038836, ack 2377297013, win 83, options [nop,nop,TS val 1095721822 ecr 3791015342], length 395
 00:00:22.716569 IP 10.0.0.6.1883 > 10.0.0.8.44794: Flags [P.], seq 2377297013:2377297017, ack 3098038836, win 85, options [nop,nop,TS val 3791016343 ecr 1095721822], length 4
 00:00:22.717457 IP 10.0.0.8.44794 > 10.0.0.6.1883: Flags [.], ack 2377297017, win 83, options [nop,nop,TS val 1095721837 ecr 3791016343], length 0
 00:00:22.718462 IP 10.0.0.8.44794 > 10.0.0.6.1883: Flags [P.], seq 3098038836:3098038840, ack 2377297017, win 83, options [nop,nop,TS val 1095721837 ecr 3791016343], length 4
 00:00:22.718971 IP 10.0.0.6.1883 > 10.0.0.8.44794: Flags [P.], seq 2377297017:2377297021, ack 3098038840, win 85, options [nop,nop,TS val 3791016357 ecr 1095721837], length 4
 00:00:22.944788 IP 10.0.0.8.44794 > 10.0.0.6.1883: Flags [.], ack 2377297021, win 83, options [nop,nop,TS val 1095721883 ecr 3791016357], length 0
 00:00:23.726281 IP 10.0.0.8.44794 > 10.0.0.6.1883: Flags [P.], seq 3098038840:3098039235, ack 2377297021, win 83, options [nop,nop,TS val 1095722844 ecr 3791016357], length 395
 00:00:23.729865 IP 10.0.0.6.1883 > 10.0.0.8.44794: Flags [P.], seq 2377297021:2377297025, ack 3098039235, win 85, options [nop,nop,TS val 3791017365 ecr 1095722844], length 4
 00:00:23.733285 IP 10.0.0.8.44794 > 10.0.0.6.1883: Flags [.], ack 2377297025, win 83, options [nop,nop,TS val 1095722853 ecr 3791017365], length 0
 00:00:23.734999 IP 10.0.0.8.44794 > 10.0.0.6.1883: Flags [P.], seq 3098039235:3098039239, ack 2377297025, win 83, options [nop,nop,TS val 1095722853 ecr 3791017365], length 4
 00:00:23.735333 IP 10.0.0.6.1883 > 10.0.0.8.44794: Flags [P.], seq 2377297025:2377297029, ack 3098039239, win 85, options [nop,nop,TS val 3791017373 ecr 1095722853], length 4
 00:00:23.949629 IP 10.0.0.8.44794 > 10.0.0.6.1883: Flags [.], ack 2377297029, win 83, options [nop,nop,TS val 1095723066 ecr 3791017373], length 0
 00:00:24.733798 IP 10.0.0.8.44794 > 10.0.0.6.1883: Flags [P.], seq 3098039239:3098039634, ack 2377297029, win 83, options [nop,nop,TS val 1095723851 ecr 3791017373], length 395
 00:00:24.736110 IP 10.0.0.6.1883 > 10.0.0.8.44794: Flags [P.], seq 2377297029:2377297033, ack 3098039634, win 85, options [nop,nop,TS val 3791018372 ecr 1095723851], length 4
 00:00:24.741070 IP 10.0.0.8.44794 > 10.0.0.6.1883: Flags [.], ack 2377297033, win 83, options [nop,nop,TS val 1095723860 ecr 3791018372], length 0
 00:00:24.743113 IP 10.0.0.8.44794 > 10.0.0.6.1883: Flags [P.], seq 3098039634:3098039638, ack 2377297033, win 83, options [nop,nop,TS val 1095723861 ecr 3791018372], length 4
 00:00:24.743608 IP 10.0.0.6.1883 > 10.0.0.8.44794: Flags [P.], seq 2377297033:2377297037, ack 3098039638, win 85, options [nop,nop,TS val 3791018381 ecr 1095723861], length 4
 00:00:24.834749 IP 10.0.0.8.44794 > 10.0.0.6.1883: Flags [.], ack 2377297037, win 83, options [nop,nop,TS val 1095723905 ecr 3791018381], length 0
 00:00:25.739356 IP 10.0.0.8.44794 > 10.0.0.6.1883: Flags [P.], seq 3098039638:3098040033, ack 2377297037, win 83, options [nop,nop,TS val 1095724856 ecr 3791018381], length 395
 00:00:25.740877 IP 10.0.0.6.1883 > 10.0.0.8.44794: Flags [P.], seq 2377297037:2377297041, ack 3098040033, win 85, options [nop,nop,TS val 3791019377 ecr 1095724856], length 4
 00:00:25.744009 IP 10.0.0.8.44794 > 10.0.0.6.1883: Flags [.], ack 2377297041, win 83, options [nop,nop,TS val 1095724861 ecr 3791019377], length 0
 00:00:25.744640 IP 10.0.0.8.44794 > 10.0.0.6.1883: Flags [P.], seq 3098040033:3098040037, ack 2377297041, win 83, options [nop,nop,TS val 1095724862 ecr 3791019377], length 4
 00:00:25.745116 IP 10.0.0.6.1883 > 10.0.0.8.44794: Flags [P.], seq 2377297041:2377297045, ack 3098040037, win 85, options [nop,nop,TS val 3791019382 ecr 1095724862], length 4
 00:00:25.832276 IP 10.0.0.8.44794 > 10.0.0.6.1883: Flags [.], ack 2377297045, win 83, options [nop,nop,TS val 1095724909 ecr 3791019382], length 0
 00:00:26.743451 IP 10.0.0.8.44794 > 10.0.0.6.1883: Flags [P.], seq 3098040037:3098040039, ack 2377297045, win 83, options [nop,nop,TS val 1095725860 ecr 3791019382], length 2
 00:00:26.743841 IP 10.0.0.6.1883 > 10.0.0.8.44794: Flags [P.], seq 2377297045:2377297047, ack 3098040039, win 85, options [nop,nop,TS val 3791020380 ecr 1095725860], length 2
 00:00:26.747728 IP 10.0.0.8.44794 > 10.0.0.6.1883: Flags [P.], seq 3098040039:3098040434, ack 2377297047, win 83, options [nop,nop,TS val 1095725865 ecr 3791020380], length 395
 00:00:26.748699 IP 10.0.0.6.1883 > 10.0.0.8.44794: Flags [P.], seq 2377297047:2377297051, ack 3098040434, win 85, options [nop,nop,TS val 3791020385 ecr 1095725865], length 4
 00:00:26.750827 IP 10.0.0.8.44794 > 10.0.0.6.1883: Flags [P.], seq 3098040434:3098040438, ack 2377297051, win 83, options [nop,nop,TS val 1095725868 ecr 3791020385], length 4
 00:00:26.751146 IP 10.0.0.6.1883 > 10.0.0.8.44794: Flags [P.], seq 2377297051:2377297055, ack 3098040438, win 85, options [nop,nop,TS val 3791020387 ecr 1095725868], length 4
 00:00:26.945683 IP 10.0.0.8.44794 > 10.0.0.6.1883: Flags [.], ack 2377297055, win 83, options [nop,nop,TS val 1095726063 ecr 3791020387], length 0
 00:00:27.746736 IP 10.0.0.8.44794 > 10.0.0.6.1883: Flags [P.], seq 3098040438:3098040833, ack 2377297055, win 83, options [nop,nop,TS val 1095726862 ecr 3791020387], length 395
 00:00:27.747470 IP 10.0.0.6.1883 > 10.0.0.8.44794: Flags [P.], seq 2377297055:2377297059, ack 3098040833, win 85, options [nop,nop,TS val 3791021383 ecr 1095726862], length 4
 00:00:27.750313 IP 10.0.0.8.44794 > 10.0.0.6.1883: Flags [.], ack 2377297059, win 83, options [nop,nop,TS val 1095726867 ecr 3791021383], length 0
 00:00:27.751142 IP 10.0.0.8.44794 > 10.0.0.6.1883: Flags [P.], seq 3098040833:3098040837, ack 2377297059, win 83, options [nop,nop,TS val 1095726868 ecr 3791021383], length 4
 00:00:27.751721 IP 10.0.0.6.1883 > 10.0.0.8.44794: Flags [P.], seq 2377297059:2377297063, ack 3098040837, win 85, options [nop,nop,TS val 3791021387 ecr 1095726868], length 4
 00:00:27.797847 IP 10.0.0.8.44794 > 10.0.0.6.1883: Flags [.], ack 2377297063, win 83, options [nop,nop,TS val 1095726911 ecr 3791021387], length 0
 00:00:28.748224 IP 10.0.0.8.44794 > 10.0.0.6.1883: Flags [P.], seq 3098040837:3098041232, ack 2377297063, win 83, options [nop,nop,TS val 1095727865 ecr 3791021387], length 395
 00:00:28.749343 IP 10.0.0.6.1883 > 10.0.0.8.44794: Flags [P.], seq 2377297063:2377297067, ack 3098041232, win 85, options [nop,nop,TS val 3791022384 ecr 1095727865], length 4
 00:00:28.750100 IP 10.0.0.8.44794 > 10.0.0.6.1883: Flags [.], ack 2377297067, win 83, options [nop,nop,TS val 1095727867 ecr 3791022384], length 0
 00:00:28.750320 IP 10.0.0.8.44794 > 10.0.0.6.1883: Flags [P.], seq 3098041232:3098041236, ack 2377297067, win 83, options [nop,nop,TS val 1095727867 ecr 3791022384], length 4
 00:00:28.750570 IP 10.0.0.6.1883 > 10.0.0.8.44794: Flags [P.], seq 2377297067:2377297071, ack 3098041236, win 85, options [nop,nop,TS val 3791022386 ecr 1095727867], length 4
 00:00:28.971696 IP 10.0.0.8.44794 > 10.0.0.6.1883: Flags [.], ack 2377297071, win 83, options [nop,nop,TS val 1095727911 ecr 3791022386], length 0
 00:00:29.753541 IP 10.0.0.8.44794 > 10.0.0.6.1883: Flags [P.], seq 3098041236:3098041631, ack 2377297071, win 83, options [nop,nop,TS val 1095728869 ecr 3791022386], length 395
 00:00:29.754230 IP 10.0.0.6.1883 > 10.0.0.8.44794: Flags [P.], seq 2377297071:2377297075, ack 3098041631, win 85, options [nop,nop,TS val 3791023389 ecr 1095728869], length 4
 00:00:29.758782 IP 10.0.0.8.44794 > 10.0.0.6.1883: Flags [.], ack 2377297075, win 83, options [nop,nop,TS val 1095728875 ecr 3791023389], length 0
 00:00:29.758783 IP 10.0.0.8.44794 > 10.0.0.6.1883: Flags [P.], seq 3098041631:3098041635, ack 2377297075, win 83, options [nop,nop,TS val 1095728875 ecr 3791023389], length 4
 00:00:29.759193 IP 10.0.0.6.1883 > 10.0.0.8.44794: Flags [P.], seq 2377297075:2377297079, ack 3098041635, win 85, options [nop,nop,TS val 3791023394 ecr 1095728875], length 4
 00:00:29.802039 IP 10.0.0.8.44794 > 10.0.0.6.1883: Flags [.], ack 2377297079, win 83, options [nop,nop,TS val 1095728918 ecr 3791023394], length 0
 00:00:30.754591 IP 10.0.0.8.44794 > 10.0.0.6.1883: Flags [P.], seq 3098041635:3098042030, ack 2377297079, win 83, options [nop,nop,TS val 1095729869 ecr 3791023394], length 395
 00:00:30.755641 IP 10.0.0.6.1883 > 10.0.0.8.44794: Flags [P.], seq 2377297079:2377297083, ack 3098042030, win 85, options [nop,nop,TS val 3791024390 ecr 1095729869], length 4
 00:00:30.757948 IP 10.0.0.8.44794 > 10.0.0.6.1883: Flags [.], ack 2377297083, win 83, options [nop,nop,TS val 1095729873 ecr 3791024390], length 0
 00:00:30.758482 IP 10.0.0.8.44794 > 10.0.0.6.1883: Flags [P.], seq 3098042030:3098042034, ack 2377297083, win 83, options [nop,nop,TS val 1095729873 ecr 3791024390], length 4
 00:00:30.758926 IP 10.0.0.6.1883 > 10.0.0.8.44794: Flags [P.], seq 2377297083:2377297087, ack 3098042034, win 85, options [nop,nop,TS val 3791024393 ecr 1095729873], length 4
 00:00:31.179125 IP 10.0.0.6.1883 > 10.0.0.8.44794: Flags [P.], seq 2377297083:2377297087, ack 3098042034, win 85, options [nop,nop,TS val 3791024794 ecr 1095729873], length 4
 00:00:31.206051 IP 10.0.0.8.44794 > 10.0.0.6.1883: Flags [.], ack 2377297087, win 83, options [nop,nop,TS val 1095730087 ecr 3791024393], length 0
 00:00:31.208145 IP 10.0.0.8.44794 > 10.0.0.6.1883: Flags [.], ack 2377297087, win 83, options [nop,nop,TS val 1095730323 ecr 3791024794,nop,nop,sack 1 {2377297083:2377297087}], length 0
 00:00:31.746120 IP 10.0.0.8.44794 > 10.0.0.6.1883: Flags [P.], seq 3098042034:3098042036, ack 2377297087, win 83, options [nop,nop,TS val 1095730860 ecr 3791024794], length 2
 00:00:31.746556 IP 10.0.0.6.1883 > 10.0.0.8.44794: Flags [P.], seq 2377297087:2377297089, ack 3098042036, win 85, options [nop,nop,TS val 3791025380 ecr 1095730860], length 2
 00:00:31.748237 IP 10.0.0.8.44794 > 10.0.0.6.1883: Flags [.], ack 2377297089, win 83, options [nop,nop,TS val 1095730863 ecr 3791025380], length 0
 00:00:31.757652 IP 10.0.0.8.44794 > 10.0.0.6.1883: Flags [P.], seq 3098042036:3098042431, ack 2377297089, win 83, options [nop,nop,TS val 1095730873 ecr 3791025380], length 395
 00:00:31.758351 IP 10.0.0.6.1883 > 10.0.0.8.44794: Flags [P.], seq 2377297089:2377297093, ack 3098042431, win 85, options [nop,nop,TS val 3791025392 ecr 1095730873], length 4
 00:00:31.760843 IP 10.0.0.8.44794 > 10.0.0.6.1883: Flags [P.], seq 3098042431:3098042435, ack 2377297093, win 83, options [nop,nop,TS val 1095730876 ecr 3791025392], length 4
 00:00:31.761066 IP 10.0.0.6.1883 > 10.0.0.8.44794: Flags [P.], seq 2377297093:2377297097, ack 3098042435, win 85, options [nop,nop,TS val 3791025395 ecr 1095730876], length 4
 00:00:31.849159 IP 10.0.0.8.44794 > 10.0.0.6.1883: Flags [.], ack 2377297097, win 83, options [nop,nop,TS val 1095730918 ecr 3791025395], length 0
 00:00:32.764286 IP 10.0.0.8.44794 > 10.0.0.6.1883: Flags [P.], seq 3098042435:3098042830, ack 2377297097, win 83, options [nop,nop,TS val 1095731879 ecr 3791025395], length 395
 00:00:32.764588 IP 10.0.0.6.1883 > 10.0.0.8.44794: Flags [P.], seq 2377297097:2377297101, ack 3098042830, win 85, options [nop,nop,TS val 3791026398 ecr 1095731879], length 4
 00:00:32.765070 IP 10.0.0.8.44794 > 10.0.0.6.1883: Flags [.], ack 2377297101, win 83, options [nop,nop,TS val 1095731880 ecr 3791026398], length 0
 00:00:32.765246 IP 10.0.0.8.44794 > 10.0.0.6.1883: Flags [P.], seq 3098042830:3098042834, ack 2377297101, win 83, options [nop,nop,TS val 1095731880 ecr 3791026398], length 4
 00:00:32.765372 IP 10.0.0.6.1883 > 10.0.0.8.44794: Flags [P.], seq 2377297101:2377297105, ack 3098042834, win 85, options [nop,nop,TS val 3791026399 ecr 1095731880], length 4
 00:00:32.991479 IP 10.0.0.8.44794 > 10.0.0.6.1883: Flags [.], ack 2377297105, win 83, options [nop,nop,TS val 1095732081 ecr 3791026399], length 0
 00:00:33.769005 IP 10.0.0.8.44794 > 10.0.0.6.1883: Flags [P.], seq 3098042834:3098043229, ack 2377297105, win 83, options [nop,nop,TS val 1095732883 ecr 3791026399], length 395
 00:00:33.770059 IP 10.0.0.6.1883 > 10.0.0.8.44794: Flags [P.], seq 2377297105:2377297109, ack 3098043229, win 85, options [nop,nop,TS val 3791027403 ecr 1095732883], length 4
 00:00:33.775670 IP 10.0.0.8.44794 > 10.0.0.6.1883: Flags [.], ack 2377297109, win 83, options [nop,nop,TS val 1095732889 ecr 3791027403], length 0
 00:00:33.775672 IP 10.0.0.8.44794 > 10.0.0.6.1883: Flags [P.], seq 3098043229:3098043233, ack 2377297109, win 83, options [nop,nop,TS val 1095732889 ecr 3791027403], length 4
 00:00:33.776300 IP 10.0.0.6.1883 > 10.0.0.8.44794: Flags [P.], seq 2377297109:2377297113, ack 3098043233, win 85, options [nop,nop,TS val 3791027409 ecr 1095732889], length 4
 00:00:33.865283 IP 10.0.0.8.44794 > 10.0.0.6.1883: Flags [.], ack 2377297113, win 83, options [nop,nop,TS val 1095732933 ecr 3791027409], length 0
 00:00:34.774121 IP 10.0.0.8.44794 > 10.0.0.6.1883: Flags [P.], seq 3098043233:3098043628, ack 2377297113, win 83, options [nop,nop,TS val 1095733887 ecr 3791027409], length 395
 00:00:34.775582 IP 10.0.0.6.1883 > 10.0.0.8.44794: Flags [P.], seq 2377297113:2377297117, ack 3098043628, win 85, options [nop,nop,TS val 3791028407 ecr 1095733887], length 4
 00:00:34.781284 IP 10.0.0.8.44794 > 10.0.0.6.1883: Flags [.], ack 2377297117, win 83, options [nop,nop,TS val 1095733893 ecr 3791028407], length 0
 00:00:34.781520 IP 10.0.0.8.44794 > 10.0.0.6.1883: Flags [P.], seq 3098043628:3098043632, ack 2377297117, win 83, options [nop,nop,TS val 1095733894 ecr 3791028407], length 4
 00:00:34.785289 IP 10.0.0.6.1883 > 10.0.0.8.44794: Flags [P.], seq 2377297117:2377297121, ack 3098043632, win 85, options [nop,nop,TS val 3791028414 ecr 1095733894], length 4
 00:00:34.869305 IP 10.0.0.8.44794 > 10.0.0.6.1883: Flags [.], ack 2377297121, win 83, options [nop,nop,TS val 1095733953 ecr 3791028414], length 0
 00:00:35.775181 IP 10.0.0.8.44794 > 10.0.0.6.1883: Flags [P.], seq 3098043632:3098044027, ack 2377297121, win 83, options [nop,nop,TS val 1095734887 ecr 3791028414], length 395
 00:00:35.776592 IP 10.0.0.6.1883 > 10.0.0.8.44794: Flags [P.], seq 2377297121:2377297125, ack 3098044027, win 85, options [nop,nop,TS val 3791029408 ecr 1095734887], length 4
 00:00:35.780901 IP 10.0.0.8.44794 > 10.0.0.6.1883: Flags [.], ack 2377297125, win 83, options [nop,nop,TS val 1095734893 ecr 3791029408], length 0
 00:00:35.781404 IP 10.0.0.8.44794 > 10.0.0.6.1883: Flags [P.], seq 3098044027:3098044031, ack 2377297125, win 83, options [nop,nop,TS val 1095734894 ecr 3791029408], length 4
 00:00:35.781669 IP 10.0.0.6.1883 > 10.0.0.8.44794: Flags [P.], seq 2377297125:2377297129, ack 3098044031, win 85, options [nop,nop,TS val 3791029413 ecr 1095734894], length 4
 00:00:35.840033 IP 10.0.0.8.44794 > 10.0.0.6.1883: Flags [.], ack 2377297129, win 83, options [nop,nop,TS val 1095734953 ecr 3791029413], length 0
 00:00:36.798267 IP 10.0.0.8.44794 > 10.0.0.6.1883: Flags [P.], seq 3098044031:3098044033, ack 2377297129, win 83, options [nop,nop,TS val 1095735910 ecr 3791029413], length 2
 00:00:36.798668 IP 10.0.0.6.1883 > 10.0.0.8.44794: Flags [P.], seq 2377297129:2377297131, ack 3098044033, win 85, options [nop,nop,TS val 3791030430 ecr 1095735910], length 2
 00:00:36.800410 IP 10.0.0.8.44794 > 10.0.0.6.1883: Flags [P.], seq 3098044033:3098044428, ack 2377297131, win 83, options [nop,nop,TS val 1095735913 ecr 3791030430], length 395
 00:00:36.802887 IP 10.0.0.6.1883 > 10.0.0.8.44794: Flags [P.], seq 2377297131:2377297135, ack 3098044428, win 85, options [nop,nop,TS val 3791030432 ecr 1095735913], length 4
 00:00:36.805162 IP 10.0.0.8.44794 > 10.0.0.6.1883: Flags [P.], seq 3098044428:3098044432, ack 2377297135, win 83, options [nop,nop,TS val 1095735918 ecr 3791030432], length 4
 00:00:36.805980 IP 10.0.0.6.1883 > 10.0.0.8.44794: Flags [P.], seq 2377297135:2377297139, ack 3098044432, win 85, options [nop,nop,TS val 3791030437 ecr 1095735918], length 4
 00:00:37.012532 IP 10.0.0.8.44794 > 10.0.0.6.1883: Flags [.], ack 2377297139, win 83, options [nop,nop,TS val 1095736094 ecr 3791030437], length 0
 00:00:37.801126 IP 10.0.0.8.44794 > 10.0.0.6.1883: Flags [P.], seq 3098044432:3098044827, ack 2377297139, win 83, options [nop,nop,TS val 1095736912 ecr 3791030437], length 395
 00:00:37.802582 IP 10.0.0.6.1883 > 10.0.0.8.44794: Flags [P.], seq 2377297139:2377297143, ack 3098044827, win 85, options [nop,nop,TS val 3791031433 ecr 1095736912], length 4
 00:00:37.803054 IP 10.0.0.8.44794 > 10.0.0.6.1883: Flags [.], ack 2377297143, win 83, options [nop,nop,TS val 1095736916 ecr 3791031433], length 0
 00:00:37.804296 IP 10.0.0.8.44794 > 10.0.0.6.1883: Flags [P.], seq 3098044827:3098044831, ack 2377297143, win 83, options [nop,nop,TS val 1095736916 ecr 3791031433], length 4
 00:00:37.804403 IP 10.0.0.6.1883 > 10.0.0.8.44794: Flags [P.], seq 2377297143:2377297147, ack 3098044831, win 85, options [nop,nop,TS val 3791031435 ecr 1095736916], length 4
 00:00:37.846297 IP 10.0.0.8.44794 > 10.0.0.6.1883: Flags [.], ack 2377297147, win 83, options [nop,nop,TS val 1095736959 ecr 3791031435], length 0
 00:00:38.802956 IP 10.0.0.8.44794 > 10.0.0.6.1883: Flags [P.], seq 3098044831:3098045226, ack 2377297147, win 83, options [nop,nop,TS val 1095737915 ecr 3791031435], length 395
 00:00:38.803733 IP 10.0.0.6.1883 > 10.0.0.8.44794: Flags [P.], seq 2377297147:2377297151, ack 3098045226, win 85, options [nop,nop,TS val 3791032434 ecr 1095737915], length 4
 00:00:38.805521 IP 10.0.0.8.44794 > 10.0.0.6.1883: Flags [.], ack 2377297151, win 83, options [nop,nop,TS val 1095737917 ecr 3791032434], length 0
 00:00:38.805685 IP 10.0.0.8.44794 > 10.0.0.6.1883: Flags [P.], seq 3098045226:3098045230, ack 2377297151, win 83, options [nop,nop,TS val 1095737917 ecr 3791032434], length 4
 00:00:38.806097 IP 10.0.0.6.1883 > 10.0.0.8.44794: Flags [P.], seq 2377297151:2377297155, ack 3098045230, win 85, options [nop,nop,TS val 3791032436 ecr 1095737917], length 4
 00:00:38.910081 IP 10.0.0.8.44794 > 10.0.0.6.1883: Flags [.], ack 2377297155, win 83, options [nop,nop,TS val 1095737962 ecr 3791032436], length 0
 00:00:39.808367 IP 10.0.0.8.44794 > 10.0.0.6.1883: Flags [P.], seq 3098045230:3098045625, ack 2377297155, win 83, options [nop,nop,TS val 1095738919 ecr 3791032436], length 395
 00:00:39.809219 IP 10.0.0.6.1883 > 10.0.0.8.44794: Flags [P.], seq 2377297155:2377297159, ack 3098045625, win 85, options [nop,nop,TS val 3791033439 ecr 1095738919], length 4
 00:00:39.810989 IP 10.0.0.8.44794 > 10.0.0.6.1883: Flags [.], ack 2377297159, win 83, options [nop,nop,TS val 1095738922 ecr 3791033439], length 0
 00:00:39.811527 IP 10.0.0.8.44794 > 10.0.0.6.1883: Flags [P.], seq 3098045625:3098045629, ack 2377297159, win 83, options [nop,nop,TS val 1095738922 ecr 3791033439], length 4
 00:00:39.811854 IP 10.0.0.6.1883 > 10.0.0.8.44794: Flags [P.], seq 2377297159:2377297163, ack 3098045629, win 85, options [nop,nop,TS val 3791033442 ecr 1095738922], length 4
 00:00:39.867623 IP 10.0.0.8.44794 > 10.0.0.6.1883: Flags [.], ack 2377297163, win 83, options [nop,nop,TS val 1095738965 ecr 3791033442], length 0
 00:00:40.982587 IP 10.0.0.8.44794 > 10.0.0.6.1883: Flags [P.], seq 3098045629:3098046024, ack 2377297163, win 83, options [nop,nop,TS val 1095740093 ecr 3791033442], length 395
 00:00:40.982879 IP 10.0.0.6.1883 > 10.0.0.8.44794: Flags [P.], seq 2377297163:2377297167, ack 3098046024, win 85, options [nop,nop,TS val 3791034612 ecr 1095740093], length 4
 00:00:41.166069 IP 10.0.0.8.44794 > 10.0.0.6.1883: Flags [.], ack 2377297167, win 83, options [nop,nop,TS val 1095740276 ecr 3791034612], length 0
 00:00:41.166236 IP 10.0.0.8.44794 > 10.0.0.6.1883: Flags [P.], seq 3098046024:3098046028, ack 2377297167, win 83, options [nop,nop,TS val 1095740276 ecr 3791034612], length 4
 00:00:41.166819 IP 10.0.0.6.1883 > 10.0.0.8.44794: Flags [P.], seq 2377297167:2377297171, ack 3098046028, win 85, options [nop,nop,TS val 3791034796 ecr 1095740276], length 4
 00:00:41.213785 IP 10.0.0.8.44794 > 10.0.0.6.1883: Flags [.], ack 2377297171, win 83, options [nop,nop,TS val 1095740321 ecr 3791034796], length 0
 00:00:41.907797 IP 10.0.0.8.44794 > 10.0.0.6.1883: Flags [P.], seq 3098046028:3098046030, ack 2377297171, win 83, options [nop,nop,TS val 1095741018 ecr 3791034796], length 2
 00:00:41.908691 IP 10.0.0.6.1883 > 10.0.0.8.44794: Flags [P.], seq 2377297171:2377297173, ack 3098046030, win 85, options [nop,nop,TS val 3791035537 ecr 1095741018], length 2
 00:00:41.910551 IP 10.0.0.8.44794 > 10.0.0.6.1883: Flags [.], ack 2377297173, win 83, options [nop,nop,TS val 1095741021 ecr 3791035537], length 0
 00:00:42.015837 IP 10.0.0.8.44794 > 10.0.0.6.1883: Flags [P.], seq 3098046030:3098046425, ack 2377297173, win 83, options [nop,nop,TS val 1095741125 ecr 3791035537], length 395
 00:00:42.016798 IP 10.0.0.6.1883 > 10.0.0.8.44794: Flags [P.], seq 2377297173:2377297177, ack 3098046425, win 85, options [nop,nop,TS val 3791035645 ecr 1095741125], length 4
 00:00:42.017745 IP 10.0.0.8.44794 > 10.0.0.6.1883: Flags [.], ack 2377297177, win 83, options [nop,nop,TS val 1095741128 ecr 3791035645], length 0
 00:00:42.017747 IP 10.0.0.8.44794 > 10.0.0.6.1883: Flags [P.], seq 3098046425:3098046429, ack 2377297177, win 83, options [nop,nop,TS val 1095741128 ecr 3791035645], length 4
 00:00:42.018328 IP 10.0.0.6.1883 > 10.0.0.8.44794: Flags [P.], seq 2377297177:2377297181, ack 3098046429, win 85, options [nop,nop,TS val 3791035647 ecr 1095741128], length 4
 00:00:42.061996 IP 10.0.0.8.44794 > 10.0.0.6.1883: Flags [.], ack 2377297181, win 83, options [nop,nop,TS val 1095741172 ecr 3791035647], length 0
 00:00:43.026878 IP 10.0.0.8.44794 > 10.0.0.6.1883: Flags [P.], seq 3098046429:3098046824, ack 2377297181, win 83, options [nop,nop,TS val 1095742136 ecr 3791035647], length 395
 00:00:43.027759 IP 10.0.0.6.1883 > 10.0.0.8.44794: Flags [P.], seq 2377297181:2377297185, ack 3098046824, win 85, options [nop,nop,TS val 3791036656 ecr 1095742136], length 4
 00:00:43.028460 IP 10.0.0.8.44794 > 10.0.0.6.1883: Flags [.], ack 2377297185, win 83, options [nop,nop,TS val 1095742138 ecr 3791036656], length 0
 00:00:43.029035 IP 10.0.0.8.44794 > 10.0.0.6.1883: Flags [P.], seq 3098046824:3098046828, ack 2377297185, win 83, options [nop,nop,TS val 1095742138 ecr 3791036656], length 4
 00:00:43.029235 IP 10.0.0.6.1883 > 10.0.0.8.44794: Flags [P.], seq 2377297185:2377297189, ack 3098046828, win 85, options [nop,nop,TS val 3791036657 ecr 1095742138], length 4
 00:00:43.073837 IP 10.0.0.8.44794 > 10.0.0.6.1883: Flags [.], ack 2377297189, win 83, options [nop,nop,TS val 1095742184 ecr 3791036657], length 0
 00:00:44.010429 IP6 fe80::34de:55ff:fe98:679 > ff02::2: ICMP6, router solicitation, length 16
 00:00:44.026881 IP 10.0.0.8.44794 > 10.0.0.6.1883: Flags [P.], seq 3098046828:3098047223, ack 2377297189, win 83, options [nop,nop,TS val 1095743136 ecr 3791036657], length 395
 00:00:44.027332 IP 10.0.0.6.1883 > 10.0.0.8.44794: Flags [P.], seq 2377297189:2377297193, ack 3098047223, win 85, options [nop,nop,TS val 3791037655 ecr 1095743136], length 4
 00:00:44.027758 IP 10.0.0.8.44794 > 10.0.0.6.1883: Flags [.], ack 2377297193, win 83, options [nop,nop,TS val 1095743137 ecr 3791037655], length 0
 00:00:44.027793 IP 10.0.0.8.44794 > 10.0.0.6.1883: Flags [P.], seq 3098047223:3098047227, ack 2377297193, win 83, options [nop,nop,TS val 1095743137 ecr 3791037655], length 4
