 00:00:00.000000 IP6 fe80::9450:d3ff:fe08:231a > ff02::2: ICMP6, router solicitation, length 16
 00:00:00.490056 IP6 fe80::7cac:d8ff:fe22:7014 > ff02::2: ICMP6, router solicitation, length 16
 00:00:00.502982 IP6 fe80::5821:b2ff:fe4b:f64b > ff02::2: ICMP6, router solicitation, length 16
 00:00:00.532690 IP6 fe80::c832:5cff:fe68:bff2 > ff02::2: ICMP6, router solicitation, length 16
 00:00:00.766506 IP6 fe80::c0d4:21ff:fe89:42f7 > ff02::2: ICMP6, router solicitation, length 16
 00:00:01.278046 IP6 fe80::b47d:64ff:fe38:30c9 > ff02::2: ICMP6, router solicitation, length 16
 00:00:01.298922 IP6 fe80::cc25:f9ff:febe:3bcd > ff02::2: ICMP6, router solicitation, length 16
 00:00:01.513547 IP6 fe80::b41c:10ff:fe66:3b48 > ff02::2: ICMP6, router solicitation, length 16
 00:00:02.042584 IP6 fe80::78c7:57ff:fe5b:bf > ff02::2: ICMP6, router solicitation, length 16
 00:00:02.076322 IP6 fe80::400:7fff:feed:1b31 > ff02::2: ICMP6, router solicitation, length 16
 00:00:02.306296 IP6 fe80::f8ff:bbff:fecb:88cd > ff02::2: ICMP6, router solicitation, length 16
 00:00:02.573182 IP6 fe80::d053:e9ff:fe43:5371 > ff02::2: ICMP6, router solicitation, length 16
 00:00:02.594385 IP6 fe80::1401:96ff:fedb:af8e > ff02::2: ICMP6, router solicitation, length 16
 00:00:02.604480 IP6 fe80::f06f:14ff:fe07:8de7 > ff02::2: ICMP6, router solicitation, length 16
 00:00:11.697646 ARP, Request who-has 10.0.0.6 tell 10.0.0.8, length 28
 00:00:11.698409 ARP, Reply 10.0.0.6 is-at b6:1c:10:66:3b:48, length 28
 00:00:11.722748 IP 10.0.0.8.44862 > 10.0.0.6.1883: Flags [S], seq 756101427, win 42340, options [mss 1460,sackOK,TS val 1096090263 ecr 0,nop,wscale 9], length 0
 00:00:11.723016 IP 10.0.0.6.1883 > 10.0.0.8.44862: Flags [S.], seq 715574814, ack 756101428, win 43440, options [mss 1460,sackOK,TS val 3791384813 ecr 1096090263,nop,wscale 9], length 0
 00:00:11.733826 IP 10.0.0.8.44862 > 10.0.0.6.1883: Flags [.], ack 715574815, win 83, options [nop,nop,TS val 1096090306 ecr 3791384813], length 0
 00:00:11.734060 IP 10.0.0.8.44862 > 10.0.0.6.1883: Flags [P.], seq 756101428:756101448, ack 715574815, win 83, options [nop,nop,TS val 1096090306 ecr 3791384813], length 20
 00:00:11.734203 IP 10.0.0.6.1883 > 10.0.0.8.44862: Flags [.], ack 756101448, win 85, options [nop,nop,TS val 3791384825 ecr 1096090306], length 0
 00:00:11.734642 IP 10.0.0.6.1883 > 10.0.0.8.44862: Flags [P.], seq 715574815:715574819, ack 756101448, win 85, options [nop,nop,TS val 3791384825 ecr 1096090306], length 4
 00:00:11.734900 IP 10.0.0.8.44862 > 10.0.0.6.1883: Flags [.], ack 715574819, win 83, options [nop,nop,TS val 1096090307 ecr 3791384825], length 0
 00:00:11.735624 IP 10.0.0.8.44862 > 10.0.0.6.1883: Flags [P.], seq 756101448:756101512, ack 715574819, win 83, options [nop,nop,TS val 1096090307 ecr 3791384825], length 64
 00:00:11.736149 IP 10.0.0.6.1883 > 10.0.0.8.44862: Flags [P.], seq 715574819:715574884, ack 756101512, win 85, options [nop,nop,TS val 3791384827 ecr 1096090307], length 65
 00:00:11.736301 IP 10.0.0.8.44862 > 10.0.0.6.1883: Flags [P.], seq 756101512:756101907, ack 715574884, win 83, options [nop,nop,TS val 1096090309 ecr 3791384827], length 395
 00:00:11.736387 IP 10.0.0.6.1883 > 10.0.0.8.44862: Flags [P.], seq 715574884:715574889, ack 756101907, win 85, options [nop,nop,TS val 3791384827 ecr 1096090309], length 5
 00:00:11.780979 IP 10.0.0.8.44862 > 10.0.0.6.1883: Flags [.], ack 715574889, win 83, options [nop,nop,TS val 1096090350 ecr 3791384827], length 0
 00:00:11.781029 IP 10.0.0.6.1883 > 10.0.0.8.44862: Flags [P.], seq 715574889:715574893, ack 756101907, win 85, options [nop,nop,TS val 3791384872 ecr 1096090350], length 4
 00:00:11.794361 IP 10.0.0.8.44862 > 10.0.0.6.1883: Flags [.], ack 715574893, win 83, options [nop,nop,TS val 1096090366 ecr 3791384872], length 0
 00:00:11.795513 IP 10.0.0.8.44862 > 10.0.0.6.1883: Flags [P.], seq 756101907:756101911, ack 715574893, win 83, options [nop,nop,TS val 1096090367 ecr 3791384872], length 4
 00:00:11.796004 IP 10.0.0.6.1883 > 10.0.0.8.44862: Flags [P.], seq 715574893:715574897, ack 756101911, win 85, options [nop,nop,TS val 3791384886 ecr 1096090367], length 4
 00:00:11.837540 IP 10.0.0.8.44862 > 10.0.0.6.1883: Flags [.], ack 715574897, win 83, options [nop,nop,TS val 1096090410 ecr 3791384886], length 0
 00:00:12.692998 IP 10.0.0.8.44862 > 10.0.0.6.1883: Flags [P.], seq 756101911:756102306, ack 715574897, win 83, options [nop,nop,TS val 1096091264 ecr 3791384886], length 395
 00:00:12.694356 IP 10.0.0.6.1883 > 10.0.0.8.44862: Flags [P.], seq 715574897:715574901, ack 756102306, win 85, options [nop,nop,TS val 3791385784 ecr 1096091264], length 4
 00:00:12.694899 IP 10.0.0.8.44862 > 10.0.0.6.1883: Flags [.], ack 715574901, win 83, options [nop,nop,TS val 1096091267 ecr 3791385784], length 0
 00:00:12.694972 IP 10.0.0.8.44862 > 10.0.0.6.1883: Flags [P.], seq 756102306:756102310, ack 715574901, win 83, options [nop,nop,TS val 1096091267 ecr 3791385784], length 4
 00:00:12.695167 IP 10.0.0.6.1883 > 10.0.0.8.44862: Flags [P.], seq 715574901:715574905, ack 756102310, win 85, options [nop,nop,TS val 3791385785 ecr 1096091267], length 4
 00:00:12.737333 IP 10.0.0.8.44862 > 10.0.0.6.1883: Flags [.], ack 715574905, win 83, options [nop,nop,TS val 1096091309 ecr 3791385785], length 0
 00:00:13.694232 IP 10.0.0.8.44862 > 10.0.0.6.1883: Flags [P.], seq 756102310:756102705, ack 715574905, win 83, options [nop,nop,TS val 1096092265 ecr 3791385785], length 395
 00:00:13.695514 IP 10.0.0.6.1883 > 10.0.0.8.44862: Flags [P.], seq 715574905:715574909, ack 756102705, win 85, options [nop,nop,TS val 3791386785 ecr 1096092265], length 4
 00:00:13.696025 IP 10.0.0.8.44862 > 10.0.0.6.1883: Flags [.], ack 715574909, win 83, options [nop,nop,TS val 1096092267 ecr 3791386785], length 0
 00:00:13.697174 IP 10.0.0.8.44862 > 10.0.0.6.1883: Flags [P.], seq 756102705:756102709, ack 715574909, win 83, options [nop,nop,TS val 1096092268 ecr 3791386785], length 4
 00:00:13.697535 IP 10.0.0.6.1883 > 10.0.0.8.44862: Flags [P.], seq 715574909:715574913, ack 756102709, win 85, options [nop,nop,TS val 3791386787 ecr 1096092268], length 4
 00:00:13.741158 IP 10.0.0.8.44862 > 10.0.0.6.1883: Flags [.], ack 715574913, win 83, options [nop,nop,TS val 1096092312 ecr 3791386787], length 0
 00:00:13.823036 IP6 fe80::9450:d3ff:fe08:231a > ff02::2: ICMP6, router solicitation, length 16
 00:00:14.695756 IP 10.0.0.8.44862 > 10.0.0.6.1883: Flags [P.], seq 756102709:756103104, ack 715574913, win 83, options [nop,nop,TS val 1096093266 ecr 3791386787], length 395
 00:00:14.697784 IP 10.0.0.6.1883 > 10.0.0.8.44862: Flags [P.], seq 715574913:715574917, ack 756103104, win 85, options [nop,nop,TS val 3791387787 ecr 1096093266], length 4
 00:00:14.698350 IP 10.0.0.8.44862 > 10.0.0.6.1883: Flags [.], ack 715574917, win 83, options [nop,nop,TS val 1096093269 ecr 3791387787], length 0
 00:00:14.699461 IP 10.0.0.8.44862 > 10.0.0.6.1883: Flags [P.], seq 756103104:756103108, ack 715574917, win 83, options [nop,nop,TS val 1096093270 ecr 3791387787], length 4
 00:00:14.700015 IP 10.0.0.6.1883 > 10.0.0.8.44862: Flags [P.], seq 715574917:715574921, ack 756103108, win 85, options [nop,nop,TS val 3791387789 ecr 1096093270], length 4
 00:00:14.741526 IP 10.0.0.8.44862 > 10.0.0.6.1883: Flags [.], ack 715574921, win 83, options [nop,nop,TS val 1096093312 ecr 3791387789], length 0
 00:00:15.090863 IP6 fe80::5821:b2ff:fe4b:f64b > ff02::2: ICMP6, router solicitation, length 16
 00:00:15.337468 IP6 fe80::7cac:d8ff:fe22:7014 > ff02::2: ICMP6, router solicitation, length 16
 00:00:15.696268 IP 10.0.0.8.44862 > 10.0.0.6.1883: Flags [P.], seq 756103108:756103503, ack 715574921, win 83, options [nop,nop,TS val 1096094267 ecr 3791387789], length 395
 00:00:15.697031 IP 10.0.0.6.1883 > 10.0.0.8.44862: Flags [P.], seq 715574921:715574925, ack 756103503, win 85, options [nop,nop,TS val 3791388786 ecr 1096094267], length 4
 00:00:15.697329 IP 10.0.0.8.44862 > 10.0.0.6.1883: Flags [.], ack 715574925, win 83, options [nop,nop,TS val 1096094268 ecr 3791388786], length 0
 00:00:15.697964 IP 10.0.0.8.44862 > 10.0.0.6.1883: Flags [P.], seq 756103503:756103507, ack 715574925, win 83, options [nop,nop,TS val 1096094268 ecr 3791388786], length 4
 00:00:15.698491 IP 10.0.0.6.1883 > 10.0.0.8.44862: Flags [P.], seq 715574925:715574929, ack 756103507, win 85, options [nop,nop,TS val 3791388787 ecr 1096094268], length 4
 00:00:15.745279 IP 10.0.0.8.44862 > 10.0.0.6.1883: Flags [.], ack 715574929, win 83, options [nop,nop,TS val 1096094315 ecr 3791388787], length 0
 00:00:16.125413 IP6 fe80::c0d4:21ff:fe89:42f7 > ff02::2: ICMP6, router solicitation, length 16
 00:00:16.384504 IP6 fe80::c832:5cff:fe68:bff2 > ff02::2: ICMP6, router solicitation, length 16
 00:00:16.697736 IP 10.0.0.8.44862 > 10.0.0.6.1883: Flags [P.], seq 756103507:756103902, ack 715574929, win 83, options [nop,nop,TS val 1096095267 ecr 3791388787], length 395
 00:00:16.698290 IP 10.0.0.6.1883 > 10.0.0.8.44862: Flags [P.], seq 715574929:715574933, ack 756103902, win 85, options [nop,nop,TS val 3791389786 ecr 1096095267], length 4
 00:00:16.698663 IP 10.0.0.8.44862 > 10.0.0.6.1883: Flags [.], ack 715574933, win 83, options [nop,nop,TS val 1096095268 ecr 3791389786], length 0
 00:00:16.698664 IP 10.0.0.8.44862 > 10.0.0.6.1883: Flags [P.], seq 756103902:756103906, ack 715574933, win 83, options [nop,nop,TS val 1096095269 ecr 3791389786], length 4
 00:00:16.698868 IP 10.0.0.6.1883 > 10.0.0.8.44862: Flags [P.], seq 715574933:715574937, ack 756103906, win 85, options [nop,nop,TS val 3791389787 ecr 1096095269], length 4
 00:00:16.737678 IP 10.0.0.8.44862 > 10.0.0.6.1883: Flags [P.], seq 756103906:756103908, ack 715574937, win 83, options [nop,nop,TS val 1096095307 ecr 3791389787], length 2
 00:00:16.738120 IP 10.0.0.6.1883 > 10.0.0.8.44862: Flags [P.], seq 715574937:715574939, ack 756103908, win 85, options [nop,nop,TS val 3791389826 ecr 1096095307], length 2
 00:00:16.784394 IP 10.0.0.8.44862 > 10.0.0.6.1883: Flags [.], ack 715574939, win 83, options [nop,nop,TS val 1096095354 ecr 3791389826], length 0
 00:00:17.385078 IP6 fe80::b41c:10ff:fe66:3b48 > ff02::2: ICMP6, router solicitation, length 16
 00:00:17.699302 IP 10.0.0.8.44862 > 10.0.0.6.1883: Flags [P.], seq 756103908:756104303, ack 715574939, win 83, options [nop,nop,TS val 1096096269 ecr 3791389826], length 395
 00:00:17.700039 IP 10.0.0.6.1883 > 10.0.0.8.44862: Flags [P.], seq 715574939:715574943, ack 756104303, win 85, options [nop,nop,TS val 3791390788 ecr 1096096269], length 4
 00:00:17.700500 IP 10.0.0.8.44862 > 10.0.0.6.1883: Flags [.], ack 715574943, win 83, options [nop,nop,TS val 1096096270 ecr 3791390788], length 0
 00:00:17.700506 IP 10.0.0.8.44862 > 10.0.0.6.1883: Flags [P.], seq 756104303:756104307, ack 715574943, win 83, options [nop,nop,TS val 1096096270 ecr 3791390788], length 4
 00:00:17.700823 IP 10.0.0.6.1883 > 10.0.0.8.44862: Flags [P.], seq 715574943:715574947, ack 756104307, win 85, options [nop,nop,TS val 3791390788 ecr 1096096270], length 4
 00:00:17.743166 IP 10.0.0.8.44862 > 10.0.0.6.1883: Flags [.], ack 715574947, win 83, options [nop,nop,TS val 1096096312 ecr 3791390788], length 0
 00:00:18.699956 IP6 fe80::cc25:f9ff:febe:3bcd > ff02::2: ICMP6, router solicitation, length 16
 00:00:18.702107 IP 10.0.0.8.44862 > 10.0.0.6.1883: Flags [P.], seq 756104307:756104702, ack 715574947, win 83, options [nop,nop,TS val 1096097271 ecr 3791390788], length 395
 00:00:18.703089 IP 10.0.0.6.1883 > 10.0.0.8.44862: Flags [P.], seq 715574947:715574951, ack 756104702, win 85, options [nop,nop,TS val 3791391790 ecr 1096097271], length 4
 00:00:18.703699 IP 10.0.0.8.44862 > 10.0.0.6.1883: Flags [.], ack 715574951, win 83, options [nop,nop,TS val 1096097273 ecr 3791391790], length 0
 00:00:18.704823 IP 10.0.0.8.44862 > 10.0.0.6.1883: Flags [P.], seq 756104702:756104706, ack 715574951, win 83, options [nop,nop,TS val 1096097273 ecr 3791391790], length 4
 00:00:18.705403 IP 10.0.0.6.1883 > 10.0.0.8.44862: Flags [P.], seq 715574951:715574955, ack 756104706, win 85, options [nop,nop,TS val 3791391792 ecr 1096097273], length 4
 00:00:18.712923 IP6 fe80::b47d:64ff:fe38:30c9 > ff02::2: ICMP6, router solicitation, length 16
 00:00:18.753275 IP 10.0.0.8.44862 > 10.0.0.6.1883: Flags [.], ack 715574955, win 83, options [nop,nop,TS val 1096097318 ecr 3791391792], length 0
 00:00:19.702879 IP 10.0.0.8.44862 > 10.0.0.6.1883: Flags [P.], seq 756104706:756105101, ack 715574955, win 83, options [nop,nop,TS val 1096098271 ecr 3791391792], length 395
 00:00:19.703780 IP 10.0.0.6.1883 > 10.0.0.8.44862: Flags [P.], seq 715574955:715574959, ack 756105101, win 85, options [nop,nop,TS val 3791392790 ecr 1096098271], length 4
 00:00:19.704862 IP 10.0.0.8.44862 > 10.0.0.6.1883: Flags [.], ack 715574959, win 83, options [nop,nop,TS val 1096098273 ecr 3791392790], length 0
 00:00:19.705131 IP 10.0.0.8.44862 > 10.0.0.6.1883: Flags [P.], seq 756105101:756105105, ack 715574959, win 83, options [nop,nop,TS val 1096098273 ecr 3791392790], length 4
 00:00:19.705559 IP 10.0.0.6.1883 > 10.0.0.8.44862: Flags [P.], seq 715574959:715574963, ack 756105105, win 85, options [nop,nop,TS val 3791392792 ecr 1096098273], length 4
 00:00:19.749890 IP 10.0.0.8.44862 > 10.0.0.6.1883: Flags [.], ack 715574963, win 83, options [nop,nop,TS val 1096098318 ecr 3791392792], length 0
 00:00:20.705030 IP 10.0.0.8.44862 > 10.0.0.6.1883: Flags [P.], seq 756105105:756105500, ack 715574963, win 83, options [nop,nop,TS val 1096099273 ecr 3791392792], length 395
 00:00:20.705917 IP 10.0.0.6.1883 > 10.0.0.8.44862: Flags [P.], seq 715574963:715574967, ack 756105500, win 85, options [nop,nop,TS val 3791393792 ecr 1096099273], length 4
 00:00:20.706616 IP 10.0.0.8.44862 > 10.0.0.6.1883: Flags [.], ack 715574967, win 83, options [nop,nop,TS val 1096099274 ecr 3791393792], length 0
 00:00:20.706618 IP 10.0.0.8.44862 > 10.0.0.6.1883: Flags [P.], seq 756105500:756105504, ack 715574967, win 83, options [nop,nop,TS val 1096099274 ecr 3791393792], length 4
 00:00:20.706955 IP 10.0.0.6.1883 > 10.0.0.8.44862: Flags [P.], seq 715574967:715574971, ack 756105504, win 85, options [nop,nop,TS val 3791393793 ecr 1096099274], length 4
 00:00:20.718633 IP6 fe80::78c7:57ff:fe5b:bf > ff02::2: ICMP6, router solicitation, length 16
 00:00:20.735091 IP6 fe80::d053:e9ff:fe43:5371 > ff02::2: ICMP6, router solicitation, length 16
 00:00:20.749077 IP 10.0.0.8.44862 > 10.0.0.6.1883: Flags [.], ack 715574971, win 83, options [nop,nop,TS val 1096099317 ecr 3791393793], length 0
 00:00:20.750312 IP6 fe80::1401:96ff:fedb:af8e > ff02::2: ICMP6, router solicitation, length 16
 00:00:20.764768 IP6 fe80::f8ff:bbff:fecb:88cd > ff02::2: ICMP6, router solicitation, length 16
 00:00:20.777431 IP6 fe80::f06f:14ff:fe07:8de7 > ff02::2: ICMP6, router solicitation, length 16
 00:00:20.783018 IP6 fe80::400:7fff:feed:1b31 > ff02::2: ICMP6, router solicitation, length 16
 00:00:21.706171 IP 10.0.0.8.44862 > 10.0.0.6.1883: Flags [P.], seq 756105504:756105899, ack 715574971, win 83, options [nop,nop,TS val 1096100273 ecr 3791393793], length 395
 00:00:21.706868 IP 10.0.0.6.1883 > 10.0.0.8.44862: Flags [P.], seq 715574971:715574975, ack 756105899, win 85, options [nop,nop,TS val 3791394792 ecr 1096100273], length 4
 00:00:21.707140 IP 10.0.0.8.44862 > 10.0.0.6.1883: Flags [.], ack 715574975, win 83, options [nop,nop,TS val 1096100274 ecr 3791394792], length 0
 00:00:21.708581 IP 10.0.0.8.44862 > 10.0.0.6.1883: Flags [P.], seq 756105899:756105903, ack 715574975, win 83, options [nop,nop,TS val 1096100275 ecr 3791394792], length 4
 00:00:21.708766 IP 10.0.0.6.1883 > 10.0.0.8.44862: Flags [P.], seq 715574975:715574979, ack 756105903, win 85, options [nop,nop,TS val 3791394794 ecr 1096100275], length 4
 00:00:21.745193 IP 10.0.0.8.44862 > 10.0.0.6.1883: Flags [P.], seq 756105903:756105905, ack 715574979, win 83, options [nop,nop,TS val 1096100313 ecr 3791394794], length 2
 00:00:21.745521 IP 10.0.0.6.1883 > 10.0.0.8.44862: Flags [P.], seq 715574979:715574981, ack 756105905, win 85, options [nop,nop,TS val 3791394831 ecr 1096100313], length 2
 00:00:21.796867 IP 10.0.0.8.44862 > 10.0.0.6.1883: Flags [.], ack 715574981, win 83, options [nop,nop,TS val 1096100357 ecr 3791394831], length 0
 00:00:22.707007 IP 10.0.0.8.44862 > 10.0.0.6.1883: Flags [P.], seq 756105905:756106300, ack 715574981, win 83, options [nop,nop,TS val 1096101274 ecr 3791394831], length 395
 00:00:22.707467 IP 10.0.0.6.1883 > 10.0.0.8.44862: Flags [P.], seq 715574981:715574985, ack 756106300, win 85, options [nop,nop,TS val 3791395792 ecr 1096101274], length 4
 00:00:22.708546 IP 10.0.0.8.44862 > 10.0.0.6.1883: Flags [.], ack 715574985, win 83, options [nop,nop,TS val 1096101275 ecr 3791395792], length 0
 00:00:22.708547 IP 10.0.0.8.44862 > 10.0.0.6.1883: Flags [P.], seq 756106300:756106304, ack 715574985, win 83, options [nop,nop,TS val 1096101275 ecr 3791395792], length 4
 00:00:22.708787 IP 10.0.0.6.1883 > 10.0.0.8.44862: Flags [P.], seq 715574985:715574989, ack 756106304, win 85, options [nop,nop,TS val 3791395794 ecr 1096101275], length 4
 00:00:22.770004 IP 10.0.0.8.44862 > 10.0.0.6.1883: Flags [.], ack 715574989, win 83, options [nop,nop,TS val 1096101337 ecr 3791395794], length 0
 00:00:23.777436 IP 10.0.0.8.44862 > 10.0.0.6.1883: Flags [P.], seq 756106304:756106699, ack 715574989, win 83, options [nop,nop,TS val 1096102344 ecr 3791395794], length 395
 00:00:23.778284 IP 10.0.0.6.1883 > 10.0.0.8.44862: Flags [P.], seq 715574989:715574993, ack 756106699, win 85, options [nop,nop,TS val 3791396863 ecr 1096102344], length 4
 00:00:23.779235 IP 10.0.0.8.44862 > 10.0.0.6.1883: Flags [.], ack 715574993, win 83, options [nop,nop,TS val 1096102345 ecr 3791396863], length 0
 00:00:23.779238 IP 10.0.0.8.44862 > 10.0.0.6.1883: Flags [P.], seq 756106699:756106703, ack 715574993, win 83, options [nop,nop,TS val 1096102346 ecr 3791396863], length 4
 00:00:23.779461 IP 10.0.0.6.1883 > 10.0.0.8.44862: Flags [P.], seq 715574993:715574997, ack 756106703, win 85, options [nop,nop,TS val 3791396864 ecr 1096102346], length 4
 00:00:23.981635 IP 10.0.0.8.44862 > 10.0.0.6.1883: Flags [.], ack 715574997, win 83, options [nop,nop,TS val 1096102388 ecr 3791396864], length 0
 00:00:24.812340 IP 10.0.0.8.44862 > 10.0.0.6.1883: Flags [P.], seq 756106703:756107098, ack 715574997, win 83, options [nop,nop,TS val 1096103378 ecr 3791396864], length 395
 00:00:24.812830 IP 10.0.0.6.1883 > 10.0.0.8.44862: Flags [P.], seq 715574997:715575001, ack 756107098, win 85, options [nop,nop,TS val 3791397897 ecr 1096103378], length 4
 00:00:24.813995 IP 10.0.0.8.44862 > 10.0.0.6.1883: Flags [.], ack 715575001, win 83, options [nop,nop,TS val 1096103380 ecr 3791397897], length 0
 00:00:24.813997 IP 10.0.0.8.44862 > 10.0.0.6.1883: Flags [P.], seq 756107098:756107102, ack 715575001, win 83, options [nop,nop,TS val 1096103380 ecr 3791397897], length 4
 00:00:24.814301 IP 10.0.0.6.1883 > 10.0.0.8.44862: Flags [P.], seq 715575001:715575005, ack 756107102, win 85, options [nop,nop,TS val 3791397898 ecr 1096103380], length 4
 00:00:25.097948 IP 10.0.0.8.44862 > 10.0.0.6.1883: Flags [.], ack 715575005, win 83, options [nop,nop,TS val 1096103571 ecr 3791397898], length 0
 00:00:25.816942 IP 10.0.0.8.44862 > 10.0.0.6.1883: Flags [P.], seq 756107102:756107497, ack 715575005, win 83, options [nop,nop,TS val 1096104382 ecr 3791397898], length 395
 00:00:25.817555 IP 10.0.0.6.1883 > 10.0.0.8.44862: Flags [P.], seq 715575005:715575009, ack 756107497, win 85, options [nop,nop,TS val 3791398901 ecr 1096104382], length 4
 00:00:25.819013 IP 10.0.0.8.44862 > 10.0.0.6.1883: Flags [.], ack 715575009, win 83, options [nop,nop,TS val 1096104384 ecr 3791398901], length 0
 00:00:25.819026 IP 10.0.0.8.44862 > 10.0.0.6.1883: Flags [P.], seq 756107497:756107501, ack 715575009, win 83, options [nop,nop,TS val 1096104384 ecr 3791398901], length 4
 00:00:25.819201 IP 10.0.0.6.1883 > 10.0.0.8.44862: Flags [P.], seq 715575009:715575013, ack 756107501, win 85, options [nop,nop,TS val 3791398903 ecr 1096104384], length 4
 00:00:25.869270 IP 10.0.0.8.44862 > 10.0.0.6.1883: Flags [.], ack 715575013, win 83, options [nop,nop,TS val 1096104434 ecr 3791398903], length 0
 00:00:27.115229 IP 10.0.0.8.44862 > 10.0.0.6.1883: Flags [P.], seq 756107501:756107896, ack 715575013, win 83, options [nop,nop,TS val 1096105680 ecr 3791398903], length 395
 00:00:27.115769 IP 10.0.0.6.1883 > 10.0.0.8.44862: Flags [P.], seq 715575013:715575017, ack 756107896, win 85, options [nop,nop,TS val 3791400199 ecr 1096105680], length 4
 00:00:27.116918 IP 10.0.0.8.44862 > 10.0.0.6.1883: Flags [P.], seq 756107896:756107898, ack 715575017, win 83, options [nop,nop,TS val 1096105681 ecr 3791400199], length 2
 00:00:27.117103 IP 10.0.0.6.1883 > 10.0.0.8.44862: Flags [P.], seq 715575017:715575019, ack 756107898, win 85, options [nop,nop,TS val 3791400200 ecr 1096105681], length 2
 00:00:27.117819 IP 10.0.0.8.44862 > 10.0.0.6.1883: Flags [P.], seq 756107898:756107902, ack 715575019, win 83, options [nop,nop,TS val 1096105682 ecr 3791400200], length 4
 00:00:27.118640 IP 10.0.0.6.1883 > 10.0.0.8.44862: Flags [P.], seq 715575019:715575023, ack 756107902, win 85, options [nop,nop,TS val 3791400201 ecr 1096105682], length 4
 00:00:27.161201 IP 10.0.0.8.44862 > 10.0.0.6.1883: Flags [.], ack 715575023, win 83, options [nop,nop,TS val 1096105726 ecr 3791400201], length 0
 00:00:28.201885 IP 10.0.0.8.44862 > 10.0.0.6.1883: Flags [P.], seq 756107902:756108297, ack 715575023, win 83, options [nop,nop,TS val 1096106766 ecr 3791400201], length 395
 00:00:28.202506 IP 10.0.0.6.1883 > 10.0.0.8.44862: Flags [P.], seq 715575023:715575027, ack 756108297, win 85, options [nop,nop,TS val 3791401285 ecr 1096106766], length 4
 00:00:28.203030 IP 10.0.0.8.44862 > 10.0.0.6.1883: Flags [.], ack 715575027, win 83, options [nop,nop,TS val 1096106767 ecr 3791401285], length 0
 00:00:28.203032 IP 10.0.0.8.44862 > 10.0.0.6.1883: Flags [P.], seq 756108297:756108301, ack 715575027, win 83, options [nop,nop,TS val 1096106767 ecr 3791401285], length 4
 00:00:28.203739 IP 10.0.0.6.1883 > 10.0.0.8.44862: Flags [P.], seq 715575027:715575031, ack 756108301, win 85, options [nop,nop,TS val 3791401286 ecr 1096106767], length 4
 00:00:28.249379 IP 10.0.0.8.44862 > 10.0.0.6.1883: Flags [.], ack 715575031, win 83, options [nop,nop,TS val 1096106813 ecr 3791401286], length 0
 00:00:29.203011 IP 10.0.0.8.44862 > 10.0.0.6.1883: Flags [P.], seq 756108301:756108696, ack 715575031, win 83, options [nop,nop,TS val 1096107766 ecr 3791401286], length 395
 00:00:29.203692 IP 10.0.0.6.1883 > 10.0.0.8.44862: Flags [P.], seq 715575031:715575035, ack 756108696, win 85, options [nop,nop,TS val 3791402285 ecr 1096107766], length 4
 00:00:29.204082 IP 10.0.0.8.44862 > 10.0.0.6.1883: Flags [.], ack 715575035, win 83, options [nop,nop,TS val 1096107768 ecr 3791402285], length 0
 00:00:29.204575 IP 10.0.0.8.44862 > 10.0.0.6.1883: Flags [P.], seq 756108696:756108700, ack 715575035, win 83, options [nop,nop,TS val 1096107768 ecr 3791402285], length 4
 00:00:29.205051 IP 10.0.0.6.1883 > 10.0.0.8.44862: Flags [P.], seq 715575035:715575039, ack 756108700, win 85, options [nop,nop,TS val 3791402287 ecr 1096107768], length 4
 00:00:29.252764 IP 10.0.0.8.44862 > 10.0.0.6.1883: Flags [.], ack 715575039, win 83, options [nop,nop,TS val 1096107816 ecr 3791402287], length 0
 00:00:30.205624 IP 10.0.0.8.44862 > 10.0.0.6.1883: Flags [P.], seq 756108700:756109095, ack 715575039, win 83, options [nop,nop,TS val 1096108767 ecr 3791402287], length 395
 00:00:30.206451 IP 10.0.0.6.1883 > 10.0.0.8.44862: Flags [P.], seq 715575039:715575043, ack 756109095, win 85, options [nop,nop,TS val 3791403288 ecr 1096108767], length 4
 00:00:30.207924 IP 10.0.0.8.44862 > 10.0.0.6.1883: Flags [.], ack 715575043, win 83, options [nop,nop,TS val 1096108770 ecr 3791403288], length 0
 00:00:30.208136 IP 10.0.0.8.44862 > 10.0.0.6.1883: Flags [P.], seq 756109095:756109099, ack 715575043, win 83, options [nop,nop,TS val 1096108770 ecr 3791403288], length 4
 00:00:30.208436 IP 10.0.0.6.1883 > 10.0.0.8.44862: Flags [P.], seq 715575043:715575047, ack 756109099, win 85, options [nop,nop,TS val 3791403290 ecr 1096108770], length 4
 00:00:30.527223 IP 10.0.0.6.1883 > 10.0.0.8.44862: Flags [P.], seq 715575043:715575047, ack 756109099, win 85, options [nop,nop,TS val 3791403608 ecr 1096108770], length 4
 00:00:30.527401 IP 10.0.0.8.44862 > 10.0.0.6.1883: Flags [.], ack 715575047, win 83, options [nop,nop,TS val 1096109090 ecr 3791403290], length 0
 00:00:30.527882 IP 10.0.0.8.44862 > 10.0.0.6.1883: Flags [.], ack 715575047, win 83, options [nop,nop,TS val 1096109091 ecr 3791403608,nop,nop,sack 1 {715575043:715575047}], length 0
 00:00:31.544722 IP 10.0.0.8.44862 > 10.0.0.6.1883: Flags [P.], seq 756109099:756109494, ack 715575047, win 83, options [nop,nop,TS val 1096110106 ecr 3791403608], length 395
 00:00:31.545400 IP 10.0.0.6.1883 > 10.0.0.8.44862: Flags [P.], seq 715575047:715575051, ack 756109494, win 85, options [nop,nop,TS val 3791404626 ecr 1096110106], length 4
 00:00:31.545778 IP 10.0.0.8.44862 > 10.0.0.6.1883: Flags [.], ack 715575051, win 83, options [nop,nop,TS val 1096110108 ecr 3791404626], length 0
 00:00:31.545779 IP 10.0.0.8.44862 > 10.0.0.6.1883: Flags [P.], seq 756109494:756109498, ack 715575051, win 83, options [nop,nop,TS val 1096110108 ecr 3791404626], length 4
 00:00:31.545999 IP 10.0.0.6.1883 > 10.0.0.8.44862: Flags [P.], seq 715575051:715575055, ack 756109498, win 85, options [nop,nop,TS val 3791404627 ecr 1096110108], length 4
 00:00:31.597323 IP 10.0.0.8.44862 > 10.0.0.6.1883: Flags [.], ack 715575055, win 83, options [nop,nop,TS val 1096110152 ecr 3791404627], length 0
 00:00:32.118604 IP 10.0.0.8.44862 > 10.0.0.6.1883: Flags [P.], seq 756109498:756109500, ack 715575055, win 83, options [nop,nop,TS val 1096110679 ecr 3791404627], length 2
 00:00:32.118839 IP 10.0.0.6.1883 > 10.0.0.8.44862: Flags [P.], seq 715575055:715575057, ack 756109500, win 85, options [nop,nop,TS val 3791405199 ecr 1096110679], length 2
 00:00:32.119261 IP 10.0.0.8.44862 > 10.0.0.6.1883: Flags [.], ack 715575057, win 83, options [nop,nop,TS val 1096110681 ecr 3791405199], length 0
 00:00:32.712183 IP 10.0.0.8.44862 > 10.0.0.6.1883: Flags [P.], seq 756109500:756109895, ack 715575057, win 83, options [nop,nop,TS val 1096111274 ecr 3791405199], length 395
 00:00:32.712881 IP 10.0.0.6.1883 > 10.0.0.8.44862: Flags [P.], seq 715575057:715575061, ack 756109895, win 85, options [nop,nop,TS val 3791405793 ecr 1096111274], length 4
 00:00:32.713265 IP 10.0.0.8.44862 > 10.0.0.6.1883: Flags [.], ack 715575061, win 83, options [nop,nop,TS val 1096111275 ecr 3791405793], length 0
 00:00:32.715283 IP 10.0.0.8.44862 > 10.0.0.6.1883: Flags [P.], seq 756109895:756109899, ack 715575061, win 83, options [nop,nop,TS val 1096111275 ecr 3791405793], length 4
 00:00:32.717347 IP 10.0.0.6.1883 > 10.0.0.8.44862: Flags [P.], seq 715575061:715575065, ack 756109899, win 85, options [nop,nop,TS val 3791405797 ecr 1096111275], length 4
 00:00:33.098640 IP 10.0.0.6.1883 > 10.0.0.8.44862: Flags [P.], seq 715575061:715575065, ack 756109899, win 85, options [nop,nop,TS val 3791406178 ecr 1096111275], length 4
 00:00:33.098826 IP 10.0.0.8.44862 > 10.0.0.6.1883: Flags [.], ack 715575065, win 83, options [nop,nop,TS val 1096111660 ecr 3791405797], length 0
 00:00:33.448073 IP 10.0.0.8.44862 > 10.0.0.6.1883: Flags [.], ack 715575065, win 83, options [nop,nop,TS val 1096111681 ecr 3791406178,nop,nop,sack 1 {715575061:715575065}], length 0
 00:00:33.714126 IP 10.0.0.8.44862 > 10.0.0.6.1883: Flags [P.], seq 756109899:756110294, ack 715575065, win 83, options [nop,nop,TS val 1096112275 ecr 3791406178], length 395
 00:00:33.714609 IP 10.0.0.6.1883 > 10.0.0.8.44862: Flags [P.], seq 715575065:715575069, ack 756110294, win 85, options [nop,nop,TS val 3791406794 ecr 1096112275], length 4
 00:00:33.715215 IP 10.0.0.8.44862 > 10.0.0.6.1883: Flags [.], ack 715575069, win 83, options [nop,nop,TS val 1096112277 ecr 3791406794], length 0
 00:00:33.715216 IP 10.0.0.8.44862 > 10.0.0.6.1883: Flags [P.], seq 756110294:756110298, ack 715575069, win 83, options [nop,nop,TS val 1096112277 ecr 3791406794], length 4
 00:00:33.715753 IP 10.0.0.6.1883 > 10.0.0.8.44862: Flags [P.], seq 715575069:715575073, ack 756110298, win 85, options [nop,nop,TS val 3791406795 ecr 1096112277], length 4
 00:00:33.898074 IP 10.0.0.8.44862 > 10.0.0.6.1883: Flags [.], ack 715575073, win 83, options [nop,nop,TS val 1096112459 ecr 3791406795], length 0
 00:00:35.052442 IP 10.0.0.8.44862 > 10.0.0.6.1883: Flags [P.], seq 756110298:756110693, ack 715575073, win 83, options [nop,nop,TS val 1096113612 ecr 3791406795], length 395
 00:00:35.053029 IP 10.0.0.6.1883 > 10.0.0.8.44862: Flags [P.], seq 715575073:715575077, ack 756110693, win 85, options [nop,nop,TS val 3791408132 ecr 1096113612], length 4
 00:00:35.053687 IP 10.0.0.8.44862 > 10.0.0.6.1883: Flags [.], ack 715575077, win 83, options [nop,nop,TS val 1096113614 ecr 3791408132], length 0
 00:00:35.053689 IP 10.0.0.8.44862 > 10.0.0.6.1883: Flags [P.], seq 756110693:756110697, ack 715575077, win 83, options [nop,nop,TS val 1096113614 ecr 3791408132], length 4
 00:00:35.053919 IP 10.0.0.6.1883 > 10.0.0.8.44862: Flags [P.], seq 715575077:715575081, ack 756110697, win 85, options [nop,nop,TS val 3791408133 ecr 1096113614], length 4
 00:00:35.113587 IP 10.0.0.8.44862 > 10.0.0.6.1883: Flags [.], ack 715575081, win 83, options [nop,nop,TS val 1096113658 ecr 3791408133], length 0
 00:00:36.054482 IP 10.0.0.8.44862 > 10.0.0.6.1883: Flags [P.], seq 756110697:756111092, ack 715575081, win 83, options [nop,nop,TS val 1096114614 ecr 3791408133], length 395
 00:00:36.054977 IP 10.0.0.6.1883 > 10.0.0.8.44862: Flags [P.], seq 715575081:715575085, ack 756111092, win 85, options [nop,nop,TS val 3791409133 ecr 1096114614], length 4
 00:00:36.055526 IP 10.0.0.8.44862 > 10.0.0.6.1883: Flags [.], ack 715575085, win 83, options [nop,nop,TS val 1096114616 ecr 3791409133], length 0
 00:00:36.056488 IP 10.0.0.8.44862 > 10.0.0.6.1883: Flags [P.], seq 756111092:756111096, ack 715575085, win 83, options [nop,nop,TS val 1096114616 ecr 3791409133], length 4
 00:00:36.056637 IP 10.0.0.6.1883 > 10.0.0.8.44862: Flags [P.], seq 715575085:715575089, ack 756111096, win 85, options [nop,nop,TS val 3791409135 ecr 1096114616], length 4
 00:00:36.105941 IP 10.0.0.8.44862 > 10.0.0.6.1883: Flags [.], ack 715575089, win 83, options [nop,nop,TS val 1096114666 ecr 3791409135], length 0
 00:00:37.100246 IP 10.0.0.8.44862 > 10.0.0.6.1883: Flags [P.], seq 756111096:756111491, ack 715575089, win 83, options [nop,nop,TS val 1096115659 ecr 3791409135], length 395
 00:00:37.100682 IP 10.0.0.6.1883 > 10.0.0.8.44862: Flags [P.], seq 715575089:715575093, ack 756111491, win 85, options [nop,nop,TS val 3791410178 ecr 1096115659], length 4
 00:00:37.101131 IP 10.0.0.8.44862 > 10.0.0.6.1883: Flags [.], ack 715575093, win 83, options [nop,nop,TS val 1096115661 ecr 3791410178], length 0
 00:00:37.101667 IP 10.0.0.8.44862 > 10.0.0.6.1883: Flags [P.], seq 756111491:756111495, ack 715575093, win 83, options [nop,nop,TS val 1096115661 ecr 3791410178], length 4
 00:00:37.101889 IP 10.0.0.6.1883 > 10.0.0.8.44862: Flags [P.], seq 715575093:715575097, ack 756111495, win 85, options [nop,nop,TS val 3791410180 ecr 1096115661], length 4
 00:00:37.301088 IP 10.0.0.8.44862 > 10.0.0.6.1883: Flags [.], ack 715575097, win 83, options [nop,nop,TS val 1096115860 ecr 3791410180], length 0
 00:00:37.301128 IP 10.0.0.8.44862 > 10.0.0.6.1883: Flags [P.], seq 756111495:756111497, ack 715575097, win 83, options [nop,nop,TS val 1096115861 ecr 3791410180], length 2
 00:00:37.301320 IP 10.0.0.6.1883 > 10.0.0.8.44862: Flags [P.], seq 715575097:715575099, ack 756111497, win 85, options [nop,nop,TS val 3791410379 ecr 1096115861], length 2
 00:00:37.302983 IP 10.0.0.8.44862 > 10.0.0.6.1883: Flags [.], ack 715575099, win 83, options [nop,nop,TS val 1096115862 ecr 3791410379], length 0
 00:00:38.123777 IP 10.0.0.8.44862 > 10.0.0.6.1883: Flags [P.], seq 756111497:756111892, ack 715575099, win 83, options [nop,nop,TS val 1096116682 ecr 3791410379], length 395
 00:00:38.124271 IP 10.0.0.6.1883 > 10.0.0.8.44862: Flags [P.], seq 715575099:715575103, ack 756111892, win 85, options [nop,nop,TS val 3791411202 ecr 1096116682], length 4
 00:00:38.125028 IP 10.0.0.8.44862 > 10.0.0.6.1883: Flags [.], ack 715575103, win 83, options [nop,nop,TS val 1096116684 ecr 3791411202], length 0
 00:00:38.125030 IP 10.0.0.8.44862 > 10.0.0.6.1883: Flags [P.], seq 756111892:756111896, ack 715575103, win 83, options [nop,nop,TS val 1096116684 ecr 3791411202], length 4
 00:00:38.125348 IP 10.0.0.6.1883 > 10.0.0.8.44862: Flags [P.], seq 715575103:715575107, ack 756111896, win 85, options [nop,nop,TS val 3791411203 ecr 1096116684], length 4
 00:00:38.320944 IP 10.0.0.8.44862 > 10.0.0.6.1883: Flags [.], ack 715575107, win 83, options [nop,nop,TS val 1096116861 ecr 3791411203], length 0
 00:00:39.325267 IP 10.0.0.8.44862 > 10.0.0.6.1883: Flags [P.], seq 756111896:756112291, ack 715575107, win 83, options [nop,nop,TS val 1096117882 ecr 3791411203], length 395
 00:00:39.325815 IP 10.0.0.6.1883 > 10.0.0.8.44862: Flags [P.], seq 715575107:715575111, ack 756112291, win 85, options [nop,nop,TS val 3791412403 ecr 1096117882], length 4
 00:00:39.326298 IP 10.0.0.8.44862 > 10.0.0.6.1883: Flags [.], ack 715575111, win 83, options [nop,nop,TS val 1096117885 ecr 3791412403], length 0
 00:00:39.327089 IP 10.0.0.8.44862 > 10.0.0.6.1883: Flags [P.], seq 756112291:756112295, ack 715575111, win 83, options [nop,nop,TS val 1096117885 ecr 3791412403], length 4
 00:00:39.327267 IP 10.0.0.6.1883 > 10.0.0.8.44862: Flags [P.], seq 715575111:715575115, ack 756112295, win 85, options [nop,nop,TS val 3791412404 ecr 1096117885], length 4
 00:00:39.371067 IP 10.0.0.8.44862 > 10.0.0.6.1883: Flags [.], ack 715575115, win 83, options [nop,nop,TS val 1096117930 ecr 3791412404], length 0
 00:00:40.326466 IP 10.0.0.8.44862 > 10.0.0.6.1883: Flags [P.], seq 756112295:756112690, ack 715575115, win 83, options [nop,nop,TS val 1096118884 ecr 3791412404], length 395
 00:00:40.326986 IP 10.0.0.6.1883 > 10.0.0.8.44862: Flags [P.], seq 715575115:715575119, ack 756112690, win 85, options [nop,nop,TS val 3791413403 ecr 1096118884], length 4
 00:00:40.328536 IP 10.0.0.8.44862 > 10.0.0.6.1883: Flags [.], ack 715575119, win 83, options [nop,nop,TS val 1096118886 ecr 3791413403], length 0
 00:00:40.329191 IP 10.0.0.8.44862 > 10.0.0.6.1883: Flags [P.], seq 756112690:756112694, ack 715575119, win 83, options [nop,nop,TS val 1096118887 ecr 3791413403], length 4
 00:00:40.329397 IP 10.0.0.6.1883 > 10.0.0.8.44862: Flags [P.], seq 715575119:715575123, ack 756112694, win 85, options [nop,nop,TS val 3791413406 ecr 1096118887], length 4
 00:00:40.532086 IP 10.0.0.8.44862 > 10.0.0.6.1883: Flags [.], ack 715575123, win 83, options [nop,nop,TS val 1096119090 ecr 3791413406], length 0
 00:00:41.216210 IP6 fe80::9450:d3ff:fe08:231a > ff02::2: ICMP6, router solicitation, length 16
 00:00:41.341020 IP 10.0.0.8.44862 > 10.0.0.6.1883: Flags [P.], seq 756112694:756113089, ack 715575123, win 83, options [nop,nop,TS val 1096119899 ecr 3791413406], length 395
 00:00:41.341527 IP 10.0.0.6.1883 > 10.0.0.8.44862: Flags [P.], seq 715575123:715575127, ack 756113089, win 85, options [nop,nop,TS val 3791414417 ecr 1096119899], length 4
 00:00:41.342124 IP 10.0.0.8.44862 > 10.0.0.6.1883: Flags [.], ack 715575127, win 83, options [nop,nop,TS val 1096119900 ecr 3791414417], length 0
 00:00:41.342125 IP 10.0.0.8.44862 > 10.0.0.6.1883: Flags [P.], seq 756113089:756113093, ack 715575127, win 83, options [nop,nop,TS val 1096119900 ecr 3791414417], length 4
 00:00:41.342254 IP 10.0.0.6.1883 > 10.0.0.8.44862: Flags [P.], seq 715575127:715575131, ack 756113093, win 85, options [nop,nop,TS val 3791414418 ecr 1096119900], length 4
 00:00:41.406212 IP 10.0.0.8.44862 > 10.0.0.6.1883: Flags [.], ack 715575131, win 83, options [nop,nop,TS val 1096119963 ecr 3791414418], length 0
 00:00:42.344321 IP 10.0.0.8.44862 > 10.0.0.6.1883: Flags [P.], seq 756113093:756113095, ack 715575131, win 83, options [nop,nop,TS val 1096120901 ecr 3791414418], length 2
 00:00:42.344738 IP 10.0.0.6.1883 > 10.0.0.8.44862: Flags [P.], seq 715575131:715575133, ack 756113095, win 85, options [nop,nop,TS val 3791415420 ecr 1096120901], length 2
 00:00:42.345281 IP 10.0.0.8.44862 > 10.0.0.6.1883: Flags [P.], seq 756113095:756113490, ack 715575133, win 83, options [nop,nop,TS val 1096120902 ecr 3791415420], length 395
 00:00:42.345642 IP 10.0.0.6.1883 > 10.0.0.8.44862: Flags [P.], seq 715575133:715575137, ack 756113490, win 85, options [nop,nop,TS val 3791415421 ecr 1096120902], length 4
 00:00:42.347228 IP 10.0.0.8.44862 > 10.0.0.6.1883: Flags [P.], seq 756113490:756113494, ack 715575137, win 83, options [nop,nop,TS val 1096120904 ecr 3791415421], length 4
 00:00:42.347385 IP 10.0.0.6.1883 > 10.0.0.8.44862: Flags [P.], seq 715575137:715575141, ack 756113494, win 85, options [nop,nop,TS val 3791415423 ecr 1096120904], length 4
 00:00:42.510333 IP 10.0.0.8.44862 > 10.0.0.6.1883: Flags [.], ack 715575141, win 83, options [nop,nop,TS val 1096121067 ecr 3791415423], length 0
 00:00:43.253634 IP6 fe80::5821:b2ff:fe4b:f64b > ff02::2: ICMP6, router solicitation, length 16
 00:00:43.345065 IP 10.0.0.8.44862 > 10.0.0.6.1883: Flags [P.], seq 756113494:756113889, ack 715575141, win 83, options [nop,nop,TS val 1096121902 ecr 3791415423], length 395
 00:00:43.345656 IP 10.0.0.6.1883 > 10.0.0.8.44862: Flags [P.], seq 715575141:715575145, ack 756113889, win 85, options [nop,nop,TS val 3791416420 ecr 1096121902], length 4
 00:00:43.346745 IP 10.0.0.8.44862 > 10.0.0.6.1883: Flags [.], ack 715575145, win 83, options [nop,nop,TS val 1096121903 ecr 3791416420], length 0
 00:00:43.346746 IP 10.0.0.8.44862 > 10.0.0.6.1883: Flags [P.], seq 756113889:756113893, ack 715575145, win 83, options [nop,nop,TS val 1096121903 ecr 3791416420], length 4
 00:00:43.347076 IP 10.0.0.6.1883 > 10.0.0.8.44862: Flags [P.], seq 715575145:715575149, ack 756113893, win 85, options [nop,nop,TS val 3791416422 ecr 1096121903], length 4
 00:00:43.400548 IP 10.0.0.8.44862 > 10.0.0.6.1883: Flags [.], ack 715575149, win 83, options [nop,nop,TS val 1096121946 ecr 3791416422], length 0
 00:00:44.347634 IP 10.0.0.8.44862 > 10.0.0.6.1883: Flags [P.], seq 756113893:756114288, ack 715575149, win 83, options [nop,nop,TS val 1096122903 ecr 3791416422], length 395
 00:00:44.348173 IP 10.0.0.6.1883 > 10.0.0.8.44862: Flags [P.], seq 715575149:715575153, ack 756114288, win 85, options [nop,nop,TS val 3791417422 ecr 1096122903], length 4
 00:00:44.349297 IP 10.0.0.8.44862 > 10.0.0.6.1883: Flags [.], ack 715575153, win 83, options [nop,nop,TS val 1096122905 ecr 3791417422], length 0
 00:00:44.349298 IP 10.0.0.8.44862 > 10.0.0.6.1883: Flags [P.], seq 756114288:756114292, ack 715575153, win 83, options [nop,nop,TS val 1096122905 ecr 3791417422], length 4
 00:00:44.349563 IP 10.0.0.6.1883 > 10.0.0.8.44862: Flags [P.], seq 715575153:715575157, ack 756114292, win 85, options [nop,nop,TS val 3791417424 ecr 1096122905], length 4
 00:00:44.534271 IP 10.0.0.8.44862 > 10.0.0.6.1883: Flags [.], ack 715575157, win 83, options [nop,nop,TS val 1096123090 ecr 3791417424], length 0
 00:00:45.377219 IP 10.0.0.8.44862 > 10.0.0.6.1883: Flags [P.], seq 756114292:756114687, ack 715575157, win 83, options [nop,nop,TS val 1096123932 ecr 3791417424], length 395
 00:00:45.377772 IP 10.0.0.6.1883 > 10.0.0.8.44862: Flags [P.], seq 715575157:715575161, ack 756114687, win 85, options [nop,nop,TS val 3791418451 ecr 1096123932], length 4
 00:00:45.378847 IP 10.0.0.8.44862 > 10.0.0.6.1883: Flags [.], ack 715575161, win 83, options [nop,nop,TS val 1096123934 ecr 3791418451], length 0
