 00:00:00.000000 IP6 fe80::2c3a:2aff:fe83:2b1f > ff02::2: ICMP6, router solicitation, length 16
 00:00:00.009614 IP6 fe80::40bb:78ff:fecf:6ac1 > ff02::2: ICMP6, router solicitation, length 16
 00:00:00.023019 IP6 fe80::ec49:78ff:feef:6c7b > ff02::2: ICMP6, router solicitation, length 16
 00:00:00.036433 IP6 fe80::f430:18ff:fe66:75e0 > ff02::2: ICMP6, router solicitation, length 16
 00:00:00.045031 IP6 fe80::649e:32ff:fe8a:ed0d > ff02::2: ICMP6, router solicitation, length 16
 00:00:00.057404 IP6 fe80::cce5:7eff:fe0c:adf3 > ff02::2: ICMP6, router solicitation, length 16
 00:00:00.063688 IP6 fe80::406d:1bff:feaf:4b75 > ff02::2: ICMP6, router solicitation, length 16
 00:00:00.071664 IP6 fe80::6c92:91ff:fe93:f7c8 > ff02::2: ICMP6, router solicitation, length 16
 00:00:11.941256 ARP, Request who-has 10.0.0.6 tell 10.0.0.8, length 28
 00:00:11.941473 ARP, Reply 10.0.0.6 is-at 2e:a6:ac:02:e5:e2, length 28
 00:00:11.977458 IP 10.0.0.8.44720 > 10.0.0.6.1883: Flags [S], seq 3038682129, win 42340, options [mss 1460,sackOK,TS val 1095245317 ecr 0,nop,wscale 9], length 0
 00:00:11.977510 IP 10.0.0.6.1883 > 10.0.0.8.44720: Flags [S.], seq 3368043293, ack 3038682130, win 43440, options [mss 1460,sackOK,TS val 3790539902 ecr 1095245317,nop,wscale 9], length 0
 00:00:11.985108 IP 10.0.0.8.44720 > 10.0.0.6.1883: Flags [.], ack 3368043294, win 83, options [nop,nop,TS val 1095245392 ecr 3790539902], length 0
 00:00:11.985145 IP 10.0.0.8.44720 > 10.0.0.6.1883: Flags [P.], seq 3038682130:3038682150, ack 3368043294, win 83, options [nop,nop,TS val 1095245392 ecr 3790539902], length 20
 00:00:11.985284 IP 10.0.0.6.1883 > 10.0.0.8.44720: Flags [.], ack 3038682150, win 85, options [nop,nop,TS val 3790539910 ecr 1095245392], length 0
 00:00:11.985768 IP 10.0.0.6.1883 > 10.0.0.8.44720: Flags [P.], seq 3368043294:3368043298, ack 3038682150, win 85, options [nop,nop,TS val 3790539910 ecr 1095245392], length 4
 00:00:11.985983 IP 10.0.0.8.44720 > 10.0.0.6.1883: Flags [.], ack 3368043298, win 83, options [nop,nop,TS val 1095245393 ecr 3790539910], length 0
 00:00:11.986809 IP 10.0.0.8.44720 > 10.0.0.6.1883: Flags [P.], seq 3038682150:3038682214, ack 3368043298, win 83, options [nop,nop,TS val 1095245393 ecr 3790539910], length 64
 00:00:11.987514 IP 10.0.0.6.1883 > 10.0.0.8.44720: Flags [P.], seq 3368043298:3368043363, ack 3038682214, win 85, options [nop,nop,TS val 3790539912 ecr 1095245393], length 65
 00:00:11.987688 IP 10.0.0.8.44720 > 10.0.0.6.1883: Flags [P.], seq 3038682214:3038682609, ack 3368043363, win 83, options [nop,nop,TS val 1095245395 ecr 3790539912], length 395
 00:00:11.987980 IP 10.0.0.6.1883 > 10.0.0.8.44720: Flags [P.], seq 3368043363:3368043368, ack 3038682609, win 85, options [nop,nop,TS val 3790539913 ecr 1095245395], length 5
 00:00:12.029591 IP 10.0.0.8.44720 > 10.0.0.6.1883: Flags [.], ack 3368043368, win 83, options [nop,nop,TS val 1095245436 ecr 3790539913], length 0
 00:00:12.029753 IP 10.0.0.6.1883 > 10.0.0.8.44720: Flags [P.], seq 3368043368:3368043372, ack 3038682609, win 85, options [nop,nop,TS val 3790539955 ecr 1095245436], length 4
 00:00:12.030337 IP 10.0.0.8.44720 > 10.0.0.6.1883: Flags [.], ack 3368043372, win 83, options [nop,nop,TS val 1095245437 ecr 3790539955], length 0
 00:00:12.031920 IP 10.0.0.8.44720 > 10.0.0.6.1883: Flags [P.], seq 3038682609:3038682613, ack 3368043372, win 83, options [nop,nop,TS val 1095245437 ecr 3790539955], length 4
 00:00:12.033174 IP 10.0.0.6.1883 > 10.0.0.8.44720: Flags [P.], seq 3368043372:3368043376, ack 3038682613, win 85, options [nop,nop,TS val 3790539957 ecr 1095245437], length 4
 00:00:12.190064 IP 10.0.0.8.44720 > 10.0.0.6.1883: Flags [.], ack 3368043376, win 83, options [nop,nop,TS val 1095245484 ecr 3790539957], length 0
 00:00:13.152090 IP 10.0.0.8.44720 > 10.0.0.6.1883: Flags [P.], seq 3038682613:3038683008, ack 3368043376, win 83, options [nop,nop,TS val 1095246557 ecr 3790539957], length 395
 00:00:13.153111 IP 10.0.0.6.1883 > 10.0.0.8.44720: Flags [P.], seq 3368043376:3368043380, ack 3038683008, win 85, options [nop,nop,TS val 3790541077 ecr 1095246557], length 4
 00:00:13.154079 IP 10.0.0.8.44720 > 10.0.0.6.1883: Flags [.], ack 3368043380, win 83, options [nop,nop,TS val 1095246560 ecr 3790541077], length 0
 00:00:13.154095 IP 10.0.0.8.44720 > 10.0.0.6.1883: Flags [P.], seq 3038683008:3038683012, ack 3368043380, win 83, options [nop,nop,TS val 1095246560 ecr 3790541077], length 4
 00:00:13.154298 IP 10.0.0.6.1883 > 10.0.0.8.44720: Flags [P.], seq 3368043380:3368043384, ack 3038683012, win 85, options [nop,nop,TS val 3790541079 ecr 1095246560], length 4
 00:00:13.208682 IP 10.0.0.8.44720 > 10.0.0.6.1883: Flags [.], ack 3368043384, win 83, options [nop,nop,TS val 1095246604 ecr 3790541079], length 0
 00:00:14.156674 IP 10.0.0.8.44720 > 10.0.0.6.1883: Flags [P.], seq 3038683012:3038683407, ack 3368043384, win 83, options [nop,nop,TS val 1095247560 ecr 3790541079], length 395
 00:00:14.157439 IP 10.0.0.6.1883 > 10.0.0.8.44720: Flags [P.], seq 3368043384:3368043388, ack 3038683407, win 85, options [nop,nop,TS val 3790542081 ecr 1095247560], length 4
 00:00:14.157660 IP 10.0.0.8.44720 > 10.0.0.6.1883: Flags [.], ack 3368043388, win 83, options [nop,nop,TS val 1095247563 ecr 3790542081], length 0
 00:00:14.158196 IP 10.0.0.8.44720 > 10.0.0.6.1883: Flags [P.], seq 3038683407:3038683411, ack 3368043388, win 83, options [nop,nop,TS val 1095247564 ecr 3790542081], length 4
 00:00:14.158426 IP 10.0.0.6.1883 > 10.0.0.8.44720: Flags [P.], seq 3368043388:3368043392, ack 3038683411, win 85, options [nop,nop,TS val 3790542082 ecr 1095247564], length 4
 00:00:14.385471 IP 10.0.0.8.44720 > 10.0.0.6.1883: Flags [.], ack 3368043392, win 83, options [nop,nop,TS val 1095247778 ecr 3790542082], length 0
 00:00:15.156833 IP 10.0.0.8.44720 > 10.0.0.6.1883: Flags [P.], seq 3038683411:3038683806, ack 3368043392, win 83, options [nop,nop,TS val 1095248562 ecr 3790542082], length 395
 00:00:15.157895 IP 10.0.0.6.1883 > 10.0.0.8.44720: Flags [P.], seq 3368043392:3368043396, ack 3038683806, win 85, options [nop,nop,TS val 3790543081 ecr 1095248562], length 4
 00:00:15.158450 IP 10.0.0.8.44720 > 10.0.0.6.1883: Flags [.], ack 3368043396, win 83, options [nop,nop,TS val 1095248564 ecr 3790543081], length 0
 00:00:15.159253 IP 10.0.0.8.44720 > 10.0.0.6.1883: Flags [P.], seq 3038683806:3038683810, ack 3368043396, win 83, options [nop,nop,TS val 1095248564 ecr 3790543081], length 4
 00:00:15.160444 IP 10.0.0.6.1883 > 10.0.0.8.44720: Flags [P.], seq 3368043396:3368043400, ack 3038683810, win 85, options [nop,nop,TS val 3790543083 ecr 1095248564], length 4
 00:00:15.211703 IP 10.0.0.8.44720 > 10.0.0.6.1883: Flags [.], ack 3368043400, win 83, options [nop,nop,TS val 1095248617 ecr 3790543083], length 0
 00:00:16.160434 IP 10.0.0.8.44720 > 10.0.0.6.1883: Flags [P.], seq 3038683810:3038684205, ack 3368043400, win 83, options [nop,nop,TS val 1095249564 ecr 3790543083], length 395
 00:00:16.161161 IP 10.0.0.6.1883 > 10.0.0.8.44720: Flags [P.], seq 3368043400:3368043404, ack 3038684205, win 85, options [nop,nop,TS val 3790544084 ecr 1095249564], length 4
 00:00:16.163586 IP 10.0.0.8.44720 > 10.0.0.6.1883: Flags [.], ack 3368043404, win 83, options [nop,nop,TS val 1095249567 ecr 3790544084], length 0
 00:00:16.164724 IP 10.0.0.8.44720 > 10.0.0.6.1883: Flags [P.], seq 3038684205:3038684209, ack 3368043404, win 83, options [nop,nop,TS val 1095249567 ecr 3790544084], length 4
 00:00:16.165570 IP 10.0.0.6.1883 > 10.0.0.8.44720: Flags [P.], seq 3368043404:3368043408, ack 3038684209, win 85, options [nop,nop,TS val 3790544088 ecr 1095249567], length 4
 00:00:16.217923 IP 10.0.0.8.44720 > 10.0.0.6.1883: Flags [.], ack 3368043408, win 83, options [nop,nop,TS val 1095249622 ecr 3790544088], length 0
 00:00:16.989389 IP 10.0.0.8.44720 > 10.0.0.6.1883: Flags [P.], seq 3038684209:3038684211, ack 3368043408, win 83, options [nop,nop,TS val 1095250392 ecr 3790544088], length 2
 00:00:16.989700 IP 10.0.0.6.1883 > 10.0.0.8.44720: Flags [P.], seq 3368043408:3368043410, ack 3038684211, win 85, options [nop,nop,TS val 3790544912 ecr 1095250392], length 2
 00:00:16.992313 IP 10.0.0.8.44720 > 10.0.0.6.1883: Flags [.], ack 3368043410, win 83, options [nop,nop,TS val 1095250394 ecr 3790544912], length 0
 00:00:17.161070 IP 10.0.0.8.44720 > 10.0.0.6.1883: Flags [P.], seq 3038684211:3038684606, ack 3368043410, win 83, options [nop,nop,TS val 1095250564 ecr 3790544912], length 395
 00:00:17.161740 IP 10.0.0.6.1883 > 10.0.0.8.44720: Flags [P.], seq 3368043410:3368043414, ack 3038684606, win 85, options [nop,nop,TS val 3790545084 ecr 1095250564], length 4
 00:00:17.163432 IP 10.0.0.8.44720 > 10.0.0.6.1883: Flags [.], ack 3368043414, win 83, options [nop,nop,TS val 1095250567 ecr 3790545084], length 0
 00:00:17.163651 IP 10.0.0.8.44720 > 10.0.0.6.1883: Flags [P.], seq 3038684606:3038684610, ack 3368043414, win 83, options [nop,nop,TS val 1095250567 ecr 3790545084], length 4
 00:00:17.164205 IP 10.0.0.6.1883 > 10.0.0.8.44720: Flags [P.], seq 3368043414:3368043418, ack 3038684610, win 85, options [nop,nop,TS val 3790545086 ecr 1095250567], length 4
 00:00:17.228246 IP 10.0.0.8.44720 > 10.0.0.6.1883: Flags [.], ack 3368043418, win 83, options [nop,nop,TS val 1095250632 ecr 3790545086], length 0
 00:00:18.161912 IP 10.0.0.8.44720 > 10.0.0.6.1883: Flags [P.], seq 3038684610:3038685005, ack 3368043418, win 83, options [nop,nop,TS val 1095251565 ecr 3790545086], length 395
 00:00:18.162651 IP 10.0.0.6.1883 > 10.0.0.8.44720: Flags [P.], seq 3368043418:3368043422, ack 3038685005, win 85, options [nop,nop,TS val 3790546084 ecr 1095251565], length 4
 00:00:18.163870 IP 10.0.0.8.44720 > 10.0.0.6.1883: Flags [.], ack 3368043422, win 83, options [nop,nop,TS val 1095251567 ecr 3790546084], length 0
 00:00:18.163949 IP 10.0.0.8.44720 > 10.0.0.6.1883: Flags [P.], seq 3038685005:3038685009, ack 3368043422, win 83, options [nop,nop,TS val 1095251567 ecr 3790546084], length 4
 00:00:18.164183 IP 10.0.0.6.1883 > 10.0.0.8.44720: Flags [P.], seq 3368043422:3368043426, ack 3038685009, win 85, options [nop,nop,TS val 3790546086 ecr 1095251567], length 4
 00:00:18.225282 IP 10.0.0.8.44720 > 10.0.0.6.1883: Flags [.], ack 3368043426, win 83, options [nop,nop,TS val 1095251629 ecr 3790546086], length 0
 00:00:19.163565 IP 10.0.0.8.44720 > 10.0.0.6.1883: Flags [P.], seq 3038685009:3038685404, ack 3368043426, win 83, options [nop,nop,TS val 1095252567 ecr 3790546086], length 395
 00:00:19.164177 IP 10.0.0.6.1883 > 10.0.0.8.44720: Flags [P.], seq 3368043426:3368043430, ack 3038685404, win 85, options [nop,nop,TS val 3790547085 ecr 1095252567], length 4
 00:00:19.165055 IP 10.0.0.8.44720 > 10.0.0.6.1883: Flags [.], ack 3368043430, win 83, options [nop,nop,TS val 1095252568 ecr 3790547085], length 0
 00:00:19.165507 IP 10.0.0.8.44720 > 10.0.0.6.1883: Flags [P.], seq 3038685404:3038685408, ack 3368043430, win 83, options [nop,nop,TS val 1095252568 ecr 3790547085], length 4
 00:00:19.165792 IP 10.0.0.6.1883 > 10.0.0.8.44720: Flags [P.], seq 3368043430:3368043434, ack 3038685408, win 85, options [nop,nop,TS val 3790547087 ecr 1095252568], length 4
 00:00:19.217967 IP 10.0.0.8.44720 > 10.0.0.6.1883: Flags [.], ack 3368043434, win 83, options [nop,nop,TS val 1095252621 ecr 3790547087], length 0
 00:00:20.164426 IP 10.0.0.8.44720 > 10.0.0.6.1883: Flags [P.], seq 3038685408:3038685803, ack 3368043434, win 83, options [nop,nop,TS val 1095253567 ecr 3790547087], length 395
 00:00:20.165165 IP 10.0.0.6.1883 > 10.0.0.8.44720: Flags [P.], seq 3368043434:3368043438, ack 3038685803, win 85, options [nop,nop,TS val 3790548086 ecr 1095253567], length 4
 00:00:20.166064 IP 10.0.0.8.44720 > 10.0.0.6.1883: Flags [.], ack 3368043438, win 83, options [nop,nop,TS val 1095253568 ecr 3790548086], length 0
 00:00:20.166196 IP 10.0.0.8.44720 > 10.0.0.6.1883: Flags [P.], seq 3038685803:3038685807, ack 3368043438, win 83, options [nop,nop,TS val 1095253569 ecr 3790548086], length 4
 00:00:20.166547 IP 10.0.0.6.1883 > 10.0.0.8.44720: Flags [P.], seq 3368043438:3368043442, ack 3038685807, win 85, options [nop,nop,TS val 3790548087 ecr 1095253569], length 4
 00:00:20.209781 IP 10.0.0.8.44720 > 10.0.0.6.1883: Flags [.], ack 3368043442, win 83, options [nop,nop,TS val 1095253612 ecr 3790548087], length 0
 00:00:21.165651 IP 10.0.0.8.44720 > 10.0.0.6.1883: Flags [P.], seq 3038685807:3038686202, ack 3368043442, win 83, options [nop,nop,TS val 1095254568 ecr 3790548087], length 395
 00:00:21.166305 IP 10.0.0.6.1883 > 10.0.0.8.44720: Flags [P.], seq 3368043442:3368043446, ack 3038686202, win 85, options [nop,nop,TS val 3790549087 ecr 1095254568], length 4
 00:00:21.167280 IP 10.0.0.8.44720 > 10.0.0.6.1883: Flags [.], ack 3368043446, win 83, options [nop,nop,TS val 1095254569 ecr 3790549087], length 0
 00:00:21.167370 IP 10.0.0.8.44720 > 10.0.0.6.1883: Flags [P.], seq 3038686202:3038686206, ack 3368043446, win 83, options [nop,nop,TS val 1095254569 ecr 3790549087], length 4
 00:00:21.167582 IP 10.0.0.6.1883 > 10.0.0.8.44720: Flags [P.], seq 3368043446:3368043450, ack 3038686206, win 85, options [nop,nop,TS val 3790549088 ecr 1095254569], length 4
 00:00:21.209993 IP 10.0.0.8.44720 > 10.0.0.6.1883: Flags [.], ack 3368043450, win 83, options [nop,nop,TS val 1095254612 ecr 3790549088], length 0
 00:00:21.988895 IP 10.0.0.8.44720 > 10.0.0.6.1883: Flags [P.], seq 3038686206:3038686208, ack 3368043450, win 83, options [nop,nop,TS val 1095255390 ecr 3790549088], length 2
 00:00:21.989432 IP 10.0.0.6.1883 > 10.0.0.8.44720: Flags [P.], seq 3368043450:3368043452, ack 3038686208, win 85, options [nop,nop,TS val 3790549909 ecr 1095255390], length 2
 00:00:21.990249 IP 10.0.0.8.44720 > 10.0.0.6.1883: Flags [.], ack 3368043452, win 83, options [nop,nop,TS val 1095255392 ecr 3790549909], length 0
 00:00:22.166438 IP 10.0.0.8.44720 > 10.0.0.6.1883: Flags [P.], seq 3038686208:3038686603, ack 3368043452, win 83, options [nop,nop,TS val 1095255568 ecr 3790549909], length 395
 00:00:22.167069 IP 10.0.0.6.1883 > 10.0.0.8.44720: Flags [P.], seq 3368043452:3368043456, ack 3038686603, win 85, options [nop,nop,TS val 3790550087 ecr 1095255568], length 4
 00:00:22.168182 IP 10.0.0.8.44720 > 10.0.0.6.1883: Flags [.], ack 3368043456, win 83, options [nop,nop,TS val 1095255569 ecr 3790550087], length 0
 00:00:22.168268 IP 10.0.0.8.44720 > 10.0.0.6.1883: Flags [P.], seq 3038686603:3038686607, ack 3368043456, win 83, options [nop,nop,TS val 1095255570 ecr 3790550087], length 4
 00:00:22.168498 IP 10.0.0.6.1883 > 10.0.0.8.44720: Flags [P.], seq 3368043456:3368043460, ack 3038686607, win 85, options [nop,nop,TS val 3790550088 ecr 1095255570], length 4
 00:00:22.209572 IP 10.0.0.8.44720 > 10.0.0.6.1883: Flags [.], ack 3368043460, win 83, options [nop,nop,TS val 1095255611 ecr 3790550088], length 0
 00:00:23.167198 IP 10.0.0.8.44720 > 10.0.0.6.1883: Flags [P.], seq 3038686607:3038687002, ack 3368043460, win 83, options [nop,nop,TS val 1095256568 ecr 3790550088], length 395
 00:00:23.167806 IP 10.0.0.6.1883 > 10.0.0.8.44720: Flags [P.], seq 3368043460:3368043464, ack 3038687002, win 85, options [nop,nop,TS val 3790551087 ecr 1095256568], length 4
 00:00:23.168839 IP 10.0.0.8.44720 > 10.0.0.6.1883: Flags [.], ack 3368043464, win 83, options [nop,nop,TS val 1095256569 ecr 3790551087], length 0
 00:00:23.169269 IP 10.0.0.8.44720 > 10.0.0.6.1883: Flags [P.], seq 3038687002:3038687006, ack 3368043464, win 83, options [nop,nop,TS val 1095256570 ecr 3790551087], length 4
 00:00:23.169568 IP 10.0.0.6.1883 > 10.0.0.8.44720: Flags [P.], seq 3368043464:3368043468, ack 3038687006, win 85, options [nop,nop,TS val 3790551089 ecr 1095256570], length 4
 00:00:23.213689 IP 10.0.0.8.44720 > 10.0.0.6.1883: Flags [.], ack 3368043468, win 83, options [nop,nop,TS val 1095256615 ecr 3790551089], length 0
 00:00:24.168409 IP 10.0.0.8.44720 > 10.0.0.6.1883: Flags [P.], seq 3038687006:3038687401, ack 3368043468, win 83, options [nop,nop,TS val 1095257569 ecr 3790551089], length 395
 00:00:24.168975 IP 10.0.0.6.1883 > 10.0.0.8.44720: Flags [P.], seq 3368043468:3368043472, ack 3038687401, win 85, options [nop,nop,TS val 3790552088 ecr 1095257569], length 4
 00:00:24.169824 IP 10.0.0.8.44720 > 10.0.0.6.1883: Flags [.], ack 3368043472, win 83, options [nop,nop,TS val 1095257570 ecr 3790552088], length 0
 00:00:24.170181 IP 10.0.0.8.44720 > 10.0.0.6.1883: Flags [P.], seq 3038687401:3038687405, ack 3368043472, win 83, options [nop,nop,TS val 1095257570 ecr 3790552088], length 4
 00:00:24.170704 IP 10.0.0.6.1883 > 10.0.0.8.44720: Flags [P.], seq 3368043472:3368043476, ack 3038687405, win 85, options [nop,nop,TS val 3790552089 ecr 1095257570], length 4
 00:00:24.213604 IP 10.0.0.8.44720 > 10.0.0.6.1883: Flags [.], ack 3368043476, win 83, options [nop,nop,TS val 1095257614 ecr 3790552089], length 0
 00:00:24.609669 IP6 fe80::284a:93ff:fe40:c5ab > ff02::2: ICMP6, router solicitation, length 16
 00:00:25.169264 IP 10.0.0.8.44720 > 10.0.0.6.1883: Flags [P.], seq 3038687405:3038687800, ack 3368043476, win 83, options [nop,nop,TS val 1095258569 ecr 3790552089], length 395
 00:00:25.170035 IP 10.0.0.6.1883 > 10.0.0.8.44720: Flags [P.], seq 3368043476:3368043480, ack 3038687800, win 85, options [nop,nop,TS val 3790553088 ecr 1095258569], length 4
 00:00:25.171530 IP 10.0.0.8.44720 > 10.0.0.6.1883: Flags [.], ack 3368043480, win 83, options [nop,nop,TS val 1095258571 ecr 3790553088], length 0
 00:00:25.171776 IP 10.0.0.8.44720 > 10.0.0.6.1883: Flags [P.], seq 3038687800:3038687804, ack 3368043480, win 83, options [nop,nop,TS val 1095258571 ecr 3790553088], length 4
 00:00:25.172084 IP 10.0.0.6.1883 > 10.0.0.8.44720: Flags [P.], seq 3368043480:3368043484, ack 3038687804, win 85, options [nop,nop,TS val 3790553090 ecr 1095258571], length 4
 00:00:25.213581 IP 10.0.0.8.44720 > 10.0.0.6.1883: Flags [.], ack 3368043484, win 83, options [nop,nop,TS val 1095258614 ecr 3790553090], length 0
 00:00:26.170391 IP 10.0.0.8.44720 > 10.0.0.6.1883: Flags [P.], seq 3038687804:3038688199, ack 3368043484, win 83, options [nop,nop,TS val 1095259570 ecr 3790553090], length 395
 00:00:26.171172 IP 10.0.0.6.1883 > 10.0.0.8.44720: Flags [P.], seq 3368043484:3368043488, ack 3038688199, win 85, options [nop,nop,TS val 3790554089 ecr 1095259570], length 4
 00:00:26.172320 IP 10.0.0.8.44720 > 10.0.0.6.1883: Flags [.], ack 3368043488, win 83, options [nop,nop,TS val 1095259571 ecr 3790554089], length 0
 00:00:26.172986 IP 10.0.0.8.44720 > 10.0.0.6.1883: Flags [P.], seq 3038688199:3038688203, ack 3368043488, win 83, options [nop,nop,TS val 1095259572 ecr 3790554089], length 4
 00:00:26.173260 IP 10.0.0.6.1883 > 10.0.0.8.44720: Flags [P.], seq 3368043488:3368043492, ack 3038688203, win 85, options [nop,nop,TS val 3790554091 ecr 1095259572], length 4
 00:00:26.217424 IP 10.0.0.8.44720 > 10.0.0.6.1883: Flags [.], ack 3368043492, win 83, options [nop,nop,TS val 1095259617 ecr 3790554091], length 0
 00:00:26.621865 IP6 fe80::2ca6:acff:fe02:e5e2 > ff02::2: ICMP6, router solicitation, length 16
 00:00:26.666338 IP6 fe80::6cde:90ff:fed0:3d64 > ff02::2: ICMP6, router solicitation, length 16
 00:00:26.991434 IP 10.0.0.8.44720 > 10.0.0.6.1883: Flags [P.], seq 3038688203:3038688205, ack 3368043492, win 83, options [nop,nop,TS val 1095260390 ecr 3790554091], length 2
 00:00:26.991763 IP 10.0.0.6.1883 > 10.0.0.8.44720: Flags [P.], seq 3368043492:3368043494, ack 3038688205, win 85, options [nop,nop,TS val 3790554909 ecr 1095260390], length 2
 00:00:26.992381 IP 10.0.0.8.44720 > 10.0.0.6.1883: Flags [.], ack 3368043494, win 83, options [nop,nop,TS val 1095260391 ecr 3790554909], length 0
 00:00:27.172918 IP 10.0.0.8.44720 > 10.0.0.6.1883: Flags [P.], seq 3038688205:3038688600, ack 3368043494, win 83, options [nop,nop,TS val 1095260572 ecr 3790554909], length 395
 00:00:27.173573 IP 10.0.0.6.1883 > 10.0.0.8.44720: Flags [P.], seq 3368043494:3368043498, ack 3038688600, win 85, options [nop,nop,TS val 3790555091 ecr 1095260572], length 4
 00:00:27.174692 IP 10.0.0.8.44720 > 10.0.0.6.1883: Flags [.], ack 3368043498, win 83, options [nop,nop,TS val 1095260573 ecr 3790555091], length 0
 00:00:27.175090 IP 10.0.0.8.44720 > 10.0.0.6.1883: Flags [P.], seq 3038688600:3038688604, ack 3368043498, win 83, options [nop,nop,TS val 1095260574 ecr 3790555091], length 4
 00:00:27.175399 IP 10.0.0.6.1883 > 10.0.0.8.44720: Flags [P.], seq 3368043498:3368043502, ack 3038688604, win 85, options [nop,nop,TS val 3790555093 ecr 1095260574], length 4
 00:00:27.217459 IP 10.0.0.8.44720 > 10.0.0.6.1883: Flags [.], ack 3368043502, win 83, options [nop,nop,TS val 1095260616 ecr 3790555093], length 0
 00:00:28.174188 IP 10.0.0.8.44720 > 10.0.0.6.1883: Flags [P.], seq 3038688604:3038688999, ack 3368043502, win 83, options [nop,nop,TS val 1095261573 ecr 3790555093], length 395
 00:00:28.174827 IP 10.0.0.6.1883 > 10.0.0.8.44720: Flags [P.], seq 3368043502:3368043506, ack 3038688999, win 85, options [nop,nop,TS val 3790556092 ecr 1095261573], length 4
 00:00:28.175696 IP 10.0.0.8.44720 > 10.0.0.6.1883: Flags [.], ack 3368043506, win 83, options [nop,nop,TS val 1095261574 ecr 3790556092], length 0
 00:00:28.175989 IP 10.0.0.8.44720 > 10.0.0.6.1883: Flags [P.], seq 3038688999:3038689003, ack 3368043506, win 83, options [nop,nop,TS val 1095261574 ecr 3790556092], length 4
 00:00:28.176686 IP 10.0.0.6.1883 > 10.0.0.8.44720: Flags [P.], seq 3368043506:3368043510, ack 3038689003, win 85, options [nop,nop,TS val 3790556093 ecr 1095261574], length 4
 00:00:28.217545 IP 10.0.0.8.44720 > 10.0.0.6.1883: Flags [.], ack 3368043510, win 83, options [nop,nop,TS val 1095261616 ecr 3790556093], length 0
 00:00:28.721223 IP6 fe80::ac1c:bbff:fef3:aa96 > ff02::2: ICMP6, router solicitation, length 16
 00:00:29.178354 IP 10.0.0.8.44720 > 10.0.0.6.1883: Flags [P.], seq 3038689003:3038689398, ack 3368043510, win 83, options [nop,nop,TS val 1095262576 ecr 3790556093], length 395
 00:00:29.178992 IP 10.0.0.6.1883 > 10.0.0.8.44720: Flags [P.], seq 3368043510:3368043514, ack 3038689398, win 85, options [nop,nop,TS val 3790557095 ecr 1095262576], length 4
 00:00:29.179924 IP 10.0.0.8.44720 > 10.0.0.6.1883: Flags [.], ack 3368043514, win 83, options [nop,nop,TS val 1095262578 ecr 3790557095], length 0
 00:00:29.180191 IP 10.0.0.8.44720 > 10.0.0.6.1883: Flags [P.], seq 3038689398:3038689402, ack 3368043514, win 83, options [nop,nop,TS val 1095262578 ecr 3790557095], length 4
 00:00:29.180995 IP 10.0.0.6.1883 > 10.0.0.8.44720: Flags [P.], seq 3368043514:3368043518, ack 3038689402, win 85, options [nop,nop,TS val 3790557097 ecr 1095262578], length 4
 00:00:29.225398 IP 10.0.0.8.44720 > 10.0.0.6.1883: Flags [.], ack 3368043518, win 83, options [nop,nop,TS val 1095262623 ecr 3790557097], length 0
 00:00:30.179749 IP 10.0.0.8.44720 > 10.0.0.6.1883: Flags [P.], seq 3038689402:3038689797, ack 3368043518, win 83, options [nop,nop,TS val 1095263577 ecr 3790557097], length 395
 00:00:30.180325 IP 10.0.0.6.1883 > 10.0.0.8.44720: Flags [P.], seq 3368043518:3368043522, ack 3038689797, win 85, options [nop,nop,TS val 3790558096 ecr 1095263577], length 4
 00:00:30.181692 IP 10.0.0.8.44720 > 10.0.0.6.1883: Flags [.], ack 3368043522, win 83, options [nop,nop,TS val 1095263578 ecr 3790558096], length 0
 00:00:30.182019 IP 10.0.0.8.44720 > 10.0.0.6.1883: Flags [P.], seq 3038689797:3038689801, ack 3368043522, win 83, options [nop,nop,TS val 1095263578 ecr 3790558096], length 4
 00:00:30.182260 IP 10.0.0.6.1883 > 10.0.0.8.44720: Flags [P.], seq 3368043522:3368043526, ack 3038689801, win 85, options [nop,nop,TS val 3790558098 ecr 1095263578], length 4
 00:00:30.225615 IP 10.0.0.8.44720 > 10.0.0.6.1883: Flags [.], ack 3368043526, win 83, options [nop,nop,TS val 1095263623 ecr 3790558098], length 0
 00:00:30.739661 IP6 fe80::2c24:e9ff:fe01:e43d > ff02::2: ICMP6, router solicitation, length 16
 00:00:31.182045 IP 10.0.0.8.44720 > 10.0.0.6.1883: Flags [P.], seq 3038689801:3038690196, ack 3368043526, win 83, options [nop,nop,TS val 1095264579 ecr 3790558098], length 395
 00:00:31.182913 IP 10.0.0.6.1883 > 10.0.0.8.44720: Flags [P.], seq 3368043526:3368043530, ack 3038690196, win 85, options [nop,nop,TS val 3790559098 ecr 1095264579], length 4
 00:00:31.183388 IP 10.0.0.8.44720 > 10.0.0.6.1883: Flags [.], ack 3368043530, win 83, options [nop,nop,TS val 1095264580 ecr 3790559098], length 0
 00:00:31.183430 IP 10.0.0.8.44720 > 10.0.0.6.1883: Flags [P.], seq 3038690196:3038690200, ack 3368043530, win 83, options [nop,nop,TS val 1095264581 ecr 3790559098], length 4
 00:00:31.183629 IP 10.0.0.6.1883 > 10.0.0.8.44720: Flags [P.], seq 3368043530:3368043534, ack 3038690200, win 85, options [nop,nop,TS val 3790559099 ecr 1095264581], length 4
 00:00:31.225408 IP 10.0.0.8.44720 > 10.0.0.6.1883: Flags [.], ack 3368043534, win 83, options [nop,nop,TS val 1095264623 ecr 3790559099], length 0
 00:00:31.992447 IP 10.0.0.8.44720 > 10.0.0.6.1883: Flags [P.], seq 3038690200:3038690202, ack 3368043534, win 83, options [nop,nop,TS val 1095265389 ecr 3790559099], length 2
 00:00:31.992872 IP 10.0.0.6.1883 > 10.0.0.8.44720: Flags [P.], seq 3368043534:3368043536, ack 3038690202, win 85, options [nop,nop,TS val 3790559908 ecr 1095265389], length 2
 00:00:31.994797 IP 10.0.0.8.44720 > 10.0.0.6.1883: Flags [.], ack 3368043536, win 83, options [nop,nop,TS val 1095265390 ecr 3790559908], length 0
 00:00:32.184141 IP 10.0.0.8.44720 > 10.0.0.6.1883: Flags [P.], seq 3038690202:3038690597, ack 3368043536, win 83, options [nop,nop,TS val 1095265581 ecr 3790559908], length 395
 00:00:32.185001 IP 10.0.0.6.1883 > 10.0.0.8.44720: Flags [P.], seq 3368043536:3368043540, ack 3038690597, win 85, options [nop,nop,TS val 3790560100 ecr 1095265581], length 4
 00:00:32.186294 IP 10.0.0.8.44720 > 10.0.0.6.1883: Flags [.], ack 3368043540, win 83, options [nop,nop,TS val 1095265582 ecr 3790560100], length 0
 00:00:32.186424 IP 10.0.0.8.44720 > 10.0.0.6.1883: Flags [P.], seq 3038690597:3038690601, ack 3368043540, win 83, options [nop,nop,TS val 1095265583 ecr 3790560100], length 4
 00:00:32.186776 IP 10.0.0.6.1883 > 10.0.0.8.44720: Flags [P.], seq 3368043540:3368043544, ack 3038690601, win 85, options [nop,nop,TS val 3790560101 ecr 1095265583], length 4
 00:00:32.229371 IP 10.0.0.8.44720 > 10.0.0.6.1883: Flags [.], ack 3368043544, win 83, options [nop,nop,TS val 1095265626 ecr 3790560101], length 0
 00:00:32.766712 IP6 fe80::2c3a:2aff:fe83:2b1f > ff02::2: ICMP6, router solicitation, length 16
 00:00:32.807674 IP6 fe80::6c92:91ff:fe93:f7c8 > ff02::2: ICMP6, router solicitation, length 16
 00:00:32.818650 IP6 fe80::8806:a8ff:feb6:815e > ff02::2: ICMP6, router solicitation, length 16
 00:00:33.185226 IP 10.0.0.8.44720 > 10.0.0.6.1883: Flags [P.], seq 3038690601:3038690996, ack 3368043544, win 83, options [nop,nop,TS val 1095266581 ecr 3790560101], length 395
 00:00:33.185534 IP 10.0.0.6.1883 > 10.0.0.8.44720: Flags [P.], seq 3368043544:3368043548, ack 3038690996, win 85, options [nop,nop,TS val 3790561100 ecr 1095266581], length 4
 00:00:33.186105 IP 10.0.0.8.44720 > 10.0.0.6.1883: Flags [.], ack 3368043548, win 83, options [nop,nop,TS val 1095266582 ecr 3790561100], length 0
 00:00:33.186166 IP 10.0.0.8.44720 > 10.0.0.6.1883: Flags [P.], seq 3038690996:3038691000, ack 3368043548, win 83, options [nop,nop,TS val 1095266582 ecr 3790561100], length 4
 00:00:33.186270 IP 10.0.0.6.1883 > 10.0.0.8.44720: Flags [P.], seq 3368043548:3368043552, ack 3038691000, win 85, options [nop,nop,TS val 3790561101 ecr 1095266582], length 4
 00:00:33.229646 IP 10.0.0.8.44720 > 10.0.0.6.1883: Flags [.], ack 3368043552, win 83, options [nop,nop,TS val 1095266626 ecr 3790561101], length 0
 00:00:34.186822 IP 10.0.0.8.44720 > 10.0.0.6.1883: Flags [P.], seq 3038691000:3038691395, ack 3368043552, win 83, options [nop,nop,TS val 1095267582 ecr 3790561101], length 395
 00:00:34.187513 IP 10.0.0.6.1883 > 10.0.0.8.44720: Flags [P.], seq 3368043552:3368043556, ack 3038691395, win 85, options [nop,nop,TS val 3790562101 ecr 1095267582], length 4
 00:00:34.188670 IP 10.0.0.8.44720 > 10.0.0.6.1883: Flags [.], ack 3368043556, win 83, options [nop,nop,TS val 1095267584 ecr 3790562101], length 0
 00:00:34.188994 IP 10.0.0.8.44720 > 10.0.0.6.1883: Flags [P.], seq 3038691395:3038691399, ack 3368043556, win 83, options [nop,nop,TS val 1095267584 ecr 3790562101], length 4
 00:00:34.189398 IP 10.0.0.6.1883 > 10.0.0.8.44720: Flags [P.], seq 3368043556:3368043560, ack 3038691399, win 85, options [nop,nop,TS val 3790562103 ecr 1095267584], length 4
 00:00:34.233534 IP 10.0.0.8.44720 > 10.0.0.6.1883: Flags [.], ack 3368043560, win 83, options [nop,nop,TS val 1095267629 ecr 3790562103], length 0
 00:00:34.828019 IP6 fe80::ec49:78ff:feef:6c7b > ff02::2: ICMP6, router solicitation, length 16
 00:00:34.855542 IP6 fe80::40bb:78ff:fecf:6ac1 > ff02::2: ICMP6, router solicitation, length 16
 00:00:34.875757 IP6 fe80::406d:1bff:feaf:4b75 > ff02::2: ICMP6, router solicitation, length 16
 00:00:34.885472 IP6 fe80::f430:18ff:fe66:75e0 > ff02::2: ICMP6, router solicitation, length 16
 00:00:34.890887 IP6 fe80::649e:32ff:fe8a:ed0d > ff02::2: ICMP6, router solicitation, length 16
 00:00:34.898647 IP6 fe80::cce5:7eff:fe0c:adf3 > ff02::2: ICMP6, router solicitation, length 16
 00:00:35.189122 IP 10.0.0.8.44720 > 10.0.0.6.1883: Flags [P.], seq 3038691399:3038691794, ack 3368043560, win 83, options [nop,nop,TS val 1095268584 ecr 3790562103], length 395
 00:00:35.189748 IP 10.0.0.6.1883 > 10.0.0.8.44720: Flags [P.], seq 3368043560:3368043564, ack 3038691794, win 85, options [nop,nop,TS val 3790563103 ecr 1095268584], length 4
 00:00:35.190897 IP 10.0.0.8.44720 > 10.0.0.6.1883: Flags [.], ack 3368043564, win 83, options [nop,nop,TS val 1095268585 ecr 3790563103], length 0
 00:00:35.191112 IP 10.0.0.8.44720 > 10.0.0.6.1883: Flags [P.], seq 3038691794:3038691798, ack 3368043564, win 83, options [nop,nop,TS val 1095268586 ecr 3790563103], length 4
 00:00:35.191362 IP 10.0.0.6.1883 > 10.0.0.8.44720: Flags [P.], seq 3368043564:3368043568, ack 3038691798, win 85, options [nop,nop,TS val 3790563105 ecr 1095268586], length 4
 00:00:35.233220 IP 10.0.0.8.44720 > 10.0.0.6.1883: Flags [.], ack 3368043568, win 83, options [nop,nop,TS val 1095268628 ecr 3790563105], length 0
 00:00:36.190362 IP 10.0.0.8.44720 > 10.0.0.6.1883: Flags [P.], seq 3038691798:3038692193, ack 3368043568, win 83, options [nop,nop,TS val 1095269585 ecr 3790563105], length 395
 00:00:36.190978 IP 10.0.0.6.1883 > 10.0.0.8.44720: Flags [P.], seq 3368043568:3368043572, ack 3038692193, win 85, options [nop,nop,TS val 3790564104 ecr 1095269585], length 4
 00:00:36.192021 IP 10.0.0.8.44720 > 10.0.0.6.1883: Flags [.], ack 3368043572, win 83, options [nop,nop,TS val 1095269586 ecr 3790564104], length 0
 00:00:36.192303 IP 10.0.0.8.44720 > 10.0.0.6.1883: Flags [P.], seq 3038692193:3038692197, ack 3368043572, win 83, options [nop,nop,TS val 1095269586 ecr 3790564104], length 4
 00:00:36.192700 IP 10.0.0.6.1883 > 10.0.0.8.44720: Flags [P.], seq 3368043572:3368043576, ack 3038692197, win 85, options [nop,nop,TS val 3790564105 ecr 1095269586], length 4
 00:00:36.233404 IP 10.0.0.8.44720 > 10.0.0.6.1883: Flags [.], ack 3368043576, win 83, options [nop,nop,TS val 1095269628 ecr 3790564105], length 0
 00:00:36.993844 IP 10.0.0.8.44720 > 10.0.0.6.1883: Flags [P.], seq 3038692197:3038692199, ack 3368043576, win 83, options [nop,nop,TS val 1095270388 ecr 3790564105], length 2
 00:00:36.994179 IP 10.0.0.6.1883 > 10.0.0.8.44720: Flags [P.], seq 3368043576:3368043578, ack 3038692199, win 85, options [nop,nop,TS val 3790564907 ecr 1095270388], length 2
 00:00:36.995059 IP 10.0.0.8.44720 > 10.0.0.6.1883: Flags [.], ack 3368043578, win 83, options [nop,nop,TS val 1095270389 ecr 3790564907], length 0
 00:00:37.191568 IP 10.0.0.8.44720 > 10.0.0.6.1883: Flags [P.], seq 3038692199:3038692594, ack 3368043578, win 83, options [nop,nop,TS val 1095270586 ecr 3790564907], length 395
 00:00:37.192139 IP 10.0.0.6.1883 > 10.0.0.8.44720: Flags [P.], seq 3368043578:3368043582, ack 3038692594, win 85, options [nop,nop,TS val 3790565104 ecr 1095270586], length 4
 00:00:37.196530 IP 10.0.0.8.44720 > 10.0.0.6.1883: Flags [.], ack 3368043582, win 83, options [nop,nop,TS val 1095270587 ecr 3790565104], length 0
 00:00:37.196895 IP 10.0.0.8.44720 > 10.0.0.6.1883: Flags [P.], seq 3038692594:3038692598, ack 3368043582, win 83, options [nop,nop,TS val 1095270588 ecr 3790565104], length 4
 00:00:37.197226 IP 10.0.0.6.1883 > 10.0.0.8.44720: Flags [P.], seq 3368043582:3368043586, ack 3038692598, win 85, options [nop,nop,TS val 3790565109 ecr 1095270588], length 4
 00:00:37.245192 IP 10.0.0.8.44720 > 10.0.0.6.1883: Flags [.], ack 3368043586, win 83, options [nop,nop,TS val 1095270639 ecr 3790565109], length 0
 00:00:38.192704 IP 10.0.0.8.44720 > 10.0.0.6.1883: Flags [P.], seq 3038692598:3038692993, ack 3368043586, win 83, options [nop,nop,TS val 1095271586 ecr 3790565109], length 395
 00:00:38.193454 IP 10.0.0.6.1883 > 10.0.0.8.44720: Flags [P.], seq 3368043586:3368043590, ack 3038692993, win 85, options [nop,nop,TS val 3790566105 ecr 1095271586], length 4
 00:00:38.194308 IP 10.0.0.8.44720 > 10.0.0.6.1883: Flags [.], ack 3368043590, win 83, options [nop,nop,TS val 1095271588 ecr 3790566105], length 0
 00:00:38.194760 IP 10.0.0.8.44720 > 10.0.0.6.1883: Flags [P.], seq 3038692993:3038692997, ack 3368043590, win 83, options [nop,nop,TS val 1095271588 ecr 3790566105], length 4
 00:00:38.194977 IP 10.0.0.6.1883 > 10.0.0.8.44720: Flags [P.], seq 3368043590:3368043594, ack 3038692997, win 85, options [nop,nop,TS val 3790566107 ecr 1095271588], length 4
 00:00:38.237428 IP 10.0.0.8.44720 > 10.0.0.6.1883: Flags [.], ack 3368043594, win 83, options [nop,nop,TS val 1095271631 ecr 3790566107], length 0
 00:00:39.194331 IP 10.0.0.8.44720 > 10.0.0.6.1883: Flags [P.], seq 3038692997:3038693392, ack 3368043594, win 83, options [nop,nop,TS val 1095272587 ecr 3790566107], length 395
 00:00:39.194918 IP 10.0.0.6.1883 > 10.0.0.8.44720: Flags [P.], seq 3368043594:3368043598, ack 3038693392, win 85, options [nop,nop,TS val 3790567106 ecr 1095272587], length 4
 00:00:39.196020 IP 10.0.0.8.44720 > 10.0.0.6.1883: Flags [.], ack 3368043598, win 83, options [nop,nop,TS val 1095272588 ecr 3790567106], length 0
 00:00:39.196264 IP 10.0.0.8.44720 > 10.0.0.6.1883: Flags [P.], seq 3038693392:3038693396, ack 3368043598, win 83, options [nop,nop,TS val 1095272589 ecr 3790567106], length 4
 00:00:39.196494 IP 10.0.0.6.1883 > 10.0.0.8.44720: Flags [P.], seq 3368043598:3368043602, ack 3038693396, win 85, options [nop,nop,TS val 3790567108 ecr 1095272589], length 4
 00:00:39.237856 IP 10.0.0.8.44720 > 10.0.0.6.1883: Flags [.], ack 3368043602, win 83, options [nop,nop,TS val 1095272631 ecr 3790567108], length 0
 00:00:40.196292 IP 10.0.0.8.44720 > 10.0.0.6.1883: Flags [P.], seq 3038693396:3038693791, ack 3368043602, win 83, options [nop,nop,TS val 1095273588 ecr 3790567108], length 395
 00:00:40.196973 IP 10.0.0.6.1883 > 10.0.0.8.44720: Flags [P.], seq 3368043602:3368043606, ack 3038693791, win 85, options [nop,nop,TS val 3790568108 ecr 1095273588], length 4
 00:00:40.197939 IP 10.0.0.8.44720 > 10.0.0.6.1883: Flags [.], ack 3368043606, win 83, options [nop,nop,TS val 1095273590 ecr 3790568108], length 0
 00:00:40.198450 IP 10.0.0.8.44720 > 10.0.0.6.1883: Flags [P.], seq 3038693791:3038693795, ack 3368043606, win 83, options [nop,nop,TS val 1095273590 ecr 3790568108], length 4
 00:00:40.198723 IP 10.0.0.6.1883 > 10.0.0.8.44720: Flags [P.], seq 3368043606:3368043610, ack 3038693795, win 85, options [nop,nop,TS val 3790568109 ecr 1095273590], length 4
 00:00:40.241488 IP 10.0.0.8.44720 > 10.0.0.6.1883: Flags [.], ack 3368043610, win 83, options [nop,nop,TS val 1095273634 ecr 3790568109], length 0
 00:00:41.196645 IP 10.0.0.8.44720 > 10.0.0.6.1883: Flags [P.], seq 3038693795:3038694190, ack 3368043610, win 83, options [nop,nop,TS val 1095274589 ecr 3790568109], length 395
 00:00:41.197435 IP 10.0.0.6.1883 > 10.0.0.8.44720: Flags [P.], seq 3368043610:3368043614, ack 3038694190, win 85, options [nop,nop,TS val 3790569108 ecr 1095274589], length 4
 00:00:41.199000 IP 10.0.0.8.44720 > 10.0.0.6.1883: Flags [.], ack 3368043614, win 83, options [nop,nop,TS val 1095274591 ecr 3790569108], length 0
 00:00:41.199585 IP 10.0.0.8.44720 > 10.0.0.6.1883: Flags [P.], seq 3038694190:3038694194, ack 3368043614, win 83, options [nop,nop,TS val 1095274591 ecr 3790569108], length 4
 00:00:41.199931 IP 10.0.0.6.1883 > 10.0.0.8.44720: Flags [P.], seq 3368043614:3368043618, ack 3038694194, win 85, options [nop,nop,TS val 3790569110 ecr 1095274591], length 4
 00:00:41.241655 IP 10.0.0.8.44720 > 10.0.0.6.1883: Flags [.], ack 3368043618, win 83, options [nop,nop,TS val 1095274634 ecr 3790569110], length 0
 00:00:41.996450 IP 10.0.0.8.44720 > 10.0.0.6.1883: Flags [P.], seq 3038694194:3038694196, ack 3368043618, win 83, options [nop,nop,TS val 1095275387 ecr 3790569110], length 2
 00:00:41.996789 IP 10.0.0.6.1883 > 10.0.0.8.44720: Flags [P.], seq 3368043618:3368043620, ack 3038694196, win 85, options [nop,nop,TS val 3790569907 ecr 1095275387], length 2
 00:00:41.997791 IP 10.0.0.8.44720 > 10.0.0.6.1883: Flags [.], ack 3368043620, win 83, options [nop,nop,TS val 1095275389 ecr 3790569907], length 0
 00:00:42.198667 IP 10.0.0.8.44720 > 10.0.0.6.1883: Flags [P.], seq 3038694196:3038694591, ack 3368043620, win 83, options [nop,nop,TS val 1095275590 ecr 3790569907], length 395
 00:00:42.199398 IP 10.0.0.6.1883 > 10.0.0.8.44720: Flags [P.], seq 3368043620:3368043624, ack 3038694591, win 85, options [nop,nop,TS val 3790570109 ecr 1095275590], length 4
 00:00:42.200262 IP 10.0.0.8.44720 > 10.0.0.6.1883: Flags [.], ack 3368043624, win 83, options [nop,nop,TS val 1095275592 ecr 3790570109], length 0
 00:00:42.200405 IP 10.0.0.8.44720 > 10.0.0.6.1883: Flags [P.], seq 3038694591:3038694595, ack 3368043624, win 83, options [nop,nop,TS val 1095275592 ecr 3790570109], length 4
 00:00:42.201048 IP 10.0.0.6.1883 > 10.0.0.8.44720: Flags [P.], seq 3368043624:3368043628, ack 3038694595, win 85, options [nop,nop,TS val 3790570110 ecr 1095275592], length 4
 00:00:42.245307 IP 10.0.0.8.44720 > 10.0.0.6.1883: Flags [.], ack 3368043628, win 83, options [nop,nop,TS val 1095275637 ecr 3790570110], length 0
 00:00:43.200103 IP 10.0.0.8.44720 > 10.0.0.6.1883: Flags [P.], seq 3038694595:3038694990, ack 3368043628, win 83, options [nop,nop,TS val 1095276590 ecr 3790570110], length 395
 00:00:43.201107 IP 10.0.0.6.1883 > 10.0.0.8.44720: Flags [P.], seq 3368043628:3368043632, ack 3038694990, win 85, options [nop,nop,TS val 3790571110 ecr 1095276590], length 4
 00:00:43.202189 IP 10.0.0.8.44720 > 10.0.0.6.1883: Flags [.], ack 3368043632, win 83, options [nop,nop,TS val 1095276593 ecr 3790571110], length 0
 00:00:43.202734 IP 10.0.0.8.44720 > 10.0.0.6.1883: Flags [P.], seq 3038694990:3038694994, ack 3368043632, win 83, options [nop,nop,TS val 1095276593 ecr 3790571110], length 4
 00:00:43.202998 IP 10.0.0.6.1883 > 10.0.0.8.44720: Flags [P.], seq 3368043632:3368043636, ack 3038694994, win 85, options [nop,nop,TS val 3790571112 ecr 1095276593], length 4
 00:00:43.245505 IP 10.0.0.8.44720 > 10.0.0.6.1883: Flags [.], ack 3368043636, win 83, options [nop,nop,TS val 1095276637 ecr 3790571112], length 0
 00:00:44.203712 IP 10.0.0.8.44720 > 10.0.0.6.1883: Flags [P.], seq 3038694994:3038695389, ack 3368043636, win 83, options [nop,nop,TS val 1095277594 ecr 3790571112], length 395
 00:00:44.204656 IP 10.0.0.6.1883 > 10.0.0.8.44720: Flags [P.], seq 3368043636:3368043640, ack 3038695389, win 85, options [nop,nop,TS val 3790572113 ecr 1095277594], length 4
 00:00:44.206105 IP 10.0.0.8.44720 > 10.0.0.6.1883: Flags [.], ack 3368043640, win 83, options [nop,nop,TS val 1095277596 ecr 3790572113], length 0
