 00:00:00.000000 IP6 fe80::e843:2dff:fed2:c1fe > ff02::2: ICMP6, router solicitation, length 16
 00:00:01.562974 IP6 fe80::5839:7fff:fe75:8554 > ff02::2: ICMP6, router solicitation, length 16
 00:00:01.784574 IP6 fe80::1ced:80ff:fe04:d457 > ff02::2: ICMP6, router solicitation, length 16
 00:00:01.831975 IP6 fe80::b039:d5ff:fed5:d90c > ff02::2: ICMP6, router solicitation, length 16
 00:00:02.558823 IP6 fe80::c8a4:90ff:fe26:d938 > ff02::2: ICMP6, router solicitation, length 16
 00:00:02.839416 IP6 fe80::d093:6fff:feea:b53 > ff02::2: ICMP6, router solicitation, length 16
 00:00:03.611530 IP6 fe80::b83c:ffff:fe35:4d34 > ff02::2: ICMP6, router solicitation, length 16
 00:00:05.109233 IP6 fe80::4c0:c0ff:fef7:c340 > ff02::2: ICMP6, router solicitation, length 16
 00:00:05.124065 IP6 fe80::4ca0:56ff:fe64:1437 > ff02::2: ICMP6, router solicitation, length 16
 00:00:05.148650 IP6 fe80::dcf8:c6ff:fee3:949a > ff02::2: ICMP6, router solicitation, length 16
 00:00:07.193910 IP6 fe80::c5d:64ff:fe76:69c3 > ff02::2: ICMP6, router solicitation, length 16
 00:00:07.222151 IP6 fe80::a8c2:3ff:fe7d:b2e > ff02::2: ICMP6, router solicitation, length 16
 00:00:07.230686 IP6 fe80::68d1:3ff:fe78:8284 > ff02::2: ICMP6, router solicitation, length 16
 00:00:07.240417 IP6 fe80::b86b:9ff:fe2c:acde > ff02::2: ICMP6, router solicitation, length 16
 00:00:09.298953 ARP, Request who-has 10.0.0.6 tell 10.0.0.8, length 28
 00:00:09.299258 ARP, Reply 10.0.0.6 is-at 1e:ed:80:04:d4:57, length 28
 00:00:09.322772 IP 10.0.0.8.44754 > 10.0.0.6.1883: Flags [S], seq 1011595974, win 42340, options [mss 1460,sackOK,TS val 1095446381 ecr 0,nop,wscale 9], length 0
 00:00:09.322824 IP 10.0.0.6.1883 > 10.0.0.8.44754: Flags [S.], seq 150917953, ack 1011595975, win 43440, options [mss 1460,sackOK,TS val 3790740932 ecr 1095446381,nop,wscale 9], length 0
 00:00:09.333913 IP 10.0.0.8.44754 > 10.0.0.6.1883: Flags [.], ack 150917954, win 83, options [nop,nop,TS val 1095446425 ecr 3790740932], length 0
 00:00:09.333979 IP 10.0.0.8.44754 > 10.0.0.6.1883: Flags [P.], seq 1011595975:1011595995, ack 150917954, win 83, options [nop,nop,TS val 1095446425 ecr 3790740932], length 20
 00:00:09.334005 IP 10.0.0.6.1883 > 10.0.0.8.44754: Flags [.], ack 1011595995, win 85, options [nop,nop,TS val 3790740943 ecr 1095446425], length 0
 00:00:09.334189 IP 10.0.0.6.1883 > 10.0.0.8.44754: Flags [P.], seq 150917954:150917958, ack 1011595995, win 85, options [nop,nop,TS val 3790740943 ecr 1095446425], length 4
 00:00:09.336516 IP 10.0.0.8.44754 > 10.0.0.6.1883: Flags [.], ack 150917958, win 83, options [nop,nop,TS val 1095446428 ecr 3790740943], length 0
 00:00:09.337069 IP 10.0.0.8.44754 > 10.0.0.6.1883: Flags [P.], seq 1011595995:1011596059, ack 150917958, win 83, options [nop,nop,TS val 1095446428 ecr 3790740943], length 64
 00:00:09.337328 IP 10.0.0.6.1883 > 10.0.0.8.44754: Flags [P.], seq 150917958:150918023, ack 1011596059, win 85, options [nop,nop,TS val 3790740946 ecr 1095446428], length 65
 00:00:09.337827 IP 10.0.0.8.44754 > 10.0.0.6.1883: Flags [P.], seq 1011596059:1011596454, ack 150918023, win 83, options [nop,nop,TS val 1095446429 ecr 3790740946], length 395
 00:00:09.337894 IP 10.0.0.6.1883 > 10.0.0.8.44754: Flags [P.], seq 150918023:150918028, ack 1011596454, win 85, options [nop,nop,TS val 3790740947 ecr 1095446429], length 5
 00:00:09.393512 IP 10.0.0.8.44754 > 10.0.0.6.1883: Flags [.], ack 150918028, win 83, options [nop,nop,TS val 1095446472 ecr 3790740947], length 0
 00:00:09.393553 IP 10.0.0.6.1883 > 10.0.0.8.44754: Flags [P.], seq 150918028:150918032, ack 1011596454, win 85, options [nop,nop,TS val 3790741003 ecr 1095446472], length 4
 00:00:09.394323 IP 10.0.0.8.44754 > 10.0.0.6.1883: Flags [.], ack 150918032, win 83, options [nop,nop,TS val 1095446485 ecr 3790741003], length 0
 00:00:09.394358 IP 10.0.0.8.44754 > 10.0.0.6.1883: Flags [P.], seq 1011596454:1011596458, ack 150918032, win 83, options [nop,nop,TS val 1095446485 ecr 3790741003], length 4
 00:00:09.394469 IP 10.0.0.6.1883 > 10.0.0.8.44754: Flags [P.], seq 150918032:150918036, ack 1011596458, win 85, options [nop,nop,TS val 3790741004 ecr 1095446485], length 4
 00:00:09.508665 IP 10.0.0.8.44754 > 10.0.0.6.1883: Flags [.], ack 150918036, win 83, options [nop,nop,TS val 1095446527 ecr 3790741004], length 0
 00:00:10.294552 IP 10.0.0.8.44754 > 10.0.0.6.1883: Flags [P.], seq 1011596458:1011596853, ack 150918036, win 83, options [nop,nop,TS val 1095447384 ecr 3790741004], length 395
 00:00:10.295477 IP 10.0.0.6.1883 > 10.0.0.8.44754: Flags [P.], seq 150918036:150918040, ack 1011596853, win 85, options [nop,nop,TS val 3790741904 ecr 1095447384], length 4
 00:00:10.299761 IP 10.0.0.8.44754 > 10.0.0.6.1883: Flags [.], ack 150918040, win 83, options [nop,nop,TS val 1095447390 ecr 3790741904], length 0
 00:00:10.300910 IP 10.0.0.8.44754 > 10.0.0.6.1883: Flags [P.], seq 1011596853:1011596857, ack 150918040, win 83, options [nop,nop,TS val 1095447390 ecr 3790741904], length 4
 00:00:10.301303 IP 10.0.0.6.1883 > 10.0.0.8.44754: Flags [P.], seq 150918040:150918044, ack 1011596857, win 85, options [nop,nop,TS val 3790741910 ecr 1095447390], length 4
 00:00:10.354447 IP 10.0.0.8.44754 > 10.0.0.6.1883: Flags [.], ack 150918044, win 83, options [nop,nop,TS val 1095447435 ecr 3790741910], length 0
 00:00:11.339215 IP 10.0.0.8.44754 > 10.0.0.6.1883: Flags [P.], seq 1011596857:1011597252, ack 150918044, win 83, options [nop,nop,TS val 1095448429 ecr 3790741910], length 395
 00:00:11.340336 IP 10.0.0.6.1883 > 10.0.0.8.44754: Flags [P.], seq 150918044:150918048, ack 1011597252, win 85, options [nop,nop,TS val 3790742948 ecr 1095448429], length 4
 00:00:11.341434 IP 10.0.0.8.44754 > 10.0.0.6.1883: Flags [.], ack 150918048, win 83, options [nop,nop,TS val 1095448431 ecr 3790742948], length 0
 00:00:11.342133 IP 10.0.0.8.44754 > 10.0.0.6.1883: Flags [P.], seq 1011597252:1011597256, ack 150918048, win 83, options [nop,nop,TS val 1095448432 ecr 3790742948], length 4
 00:00:11.342469 IP 10.0.0.6.1883 > 10.0.0.8.44754: Flags [P.], seq 150918048:150918052, ack 1011597256, win 85, options [nop,nop,TS val 3790742950 ecr 1095448432], length 4
 00:00:11.622972 IP 10.0.0.6.1883 > 10.0.0.8.44754: Flags [P.], seq 150918048:150918052, ack 1011597256, win 85, options [nop,nop,TS val 3790743231 ecr 1095448432], length 4
 00:00:11.623105 IP 10.0.0.8.44754 > 10.0.0.6.1883: Flags [.], ack 150918052, win 83, options [nop,nop,TS val 1095448475 ecr 3790742950], length 0
 00:00:11.623535 IP 10.0.0.8.44754 > 10.0.0.6.1883: Flags [.], ack 150918052, win 83, options [nop,nop,TS val 1095448713 ecr 3790743231,nop,nop,sack 1 {150918048:150918052}], length 0
 00:00:12.344135 IP 10.0.0.8.44754 > 10.0.0.6.1883: Flags [P.], seq 1011597256:1011597651, ack 150918052, win 83, options [nop,nop,TS val 1095449433 ecr 3790743231], length 395
 00:00:12.345478 IP 10.0.0.6.1883 > 10.0.0.8.44754: Flags [P.], seq 150918052:150918056, ack 1011597651, win 85, options [nop,nop,TS val 3790743953 ecr 1095449433], length 4
 00:00:12.347474 IP 10.0.0.8.44754 > 10.0.0.6.1883: Flags [.], ack 150918056, win 83, options [nop,nop,TS val 1095449436 ecr 3790743953], length 0
 00:00:12.348328 IP 10.0.0.8.44754 > 10.0.0.6.1883: Flags [P.], seq 1011597651:1011597655, ack 150918056, win 83, options [nop,nop,TS val 1095449437 ecr 3790743953], length 4
 00:00:12.348910 IP 10.0.0.6.1883 > 10.0.0.8.44754: Flags [P.], seq 150918056:150918060, ack 1011597655, win 85, options [nop,nop,TS val 3790743956 ecr 1095449437], length 4
 00:00:12.557842 IP 10.0.0.8.44754 > 10.0.0.6.1883: Flags [.], ack 150918060, win 83, options [nop,nop,TS val 1095449483 ecr 3790743956], length 0
 00:00:13.347295 IP 10.0.0.8.44754 > 10.0.0.6.1883: Flags [P.], seq 1011597655:1011598050, ack 150918060, win 83, options [nop,nop,TS val 1095450435 ecr 3790743956], length 395
 00:00:13.348500 IP 10.0.0.6.1883 > 10.0.0.8.44754: Flags [P.], seq 150918060:150918064, ack 1011598050, win 85, options [nop,nop,TS val 3790744955 ecr 1095450435], length 4
 00:00:13.349779 IP 10.0.0.8.44754 > 10.0.0.6.1883: Flags [.], ack 150918064, win 83, options [nop,nop,TS val 1095450439 ecr 3790744955], length 0
 00:00:13.350233 IP 10.0.0.8.44754 > 10.0.0.6.1883: Flags [P.], seq 1011598050:1011598054, ack 150918064, win 83, options [nop,nop,TS val 1095450439 ecr 3790744955], length 4
 00:00:13.350365 IP 10.0.0.6.1883 > 10.0.0.8.44754: Flags [P.], seq 150918064:150918068, ack 1011598054, win 85, options [nop,nop,TS val 3790744958 ecr 1095450439], length 4
 00:00:13.407331 IP 10.0.0.8.44754 > 10.0.0.6.1883: Flags [.], ack 150918068, win 83, options [nop,nop,TS val 1095450481 ecr 3790744958], length 0
 00:00:14.346953 IP 10.0.0.8.44754 > 10.0.0.6.1883: Flags [P.], seq 1011598054:1011598056, ack 150918068, win 83, options [nop,nop,TS val 1095451434 ecr 3790744958], length 2
 00:00:14.348994 IP 10.0.0.6.1883 > 10.0.0.8.44754: Flags [P.], seq 150918068:150918070, ack 1011598056, win 85, options [nop,nop,TS val 3790745954 ecr 1095451434], length 2
 00:00:14.350880 IP 10.0.0.8.44754 > 10.0.0.6.1883: Flags [P.], seq 1011598056:1011598451, ack 150918070, win 83, options [nop,nop,TS val 1095451439 ecr 3790745954], length 395
 00:00:14.351598 IP 10.0.0.6.1883 > 10.0.0.8.44754: Flags [P.], seq 150918070:150918074, ack 1011598451, win 85, options [nop,nop,TS val 3790745958 ecr 1095451439], length 4
 00:00:14.353471 IP 10.0.0.8.44754 > 10.0.0.6.1883: Flags [P.], seq 1011598451:1011598455, ack 150918074, win 83, options [nop,nop,TS val 1095451441 ecr 3790745958], length 4
 00:00:14.354024 IP 10.0.0.6.1883 > 10.0.0.8.44754: Flags [P.], seq 150918074:150918078, ack 1011598455, win 85, options [nop,nop,TS val 3790745960 ecr 1095451441], length 4
 00:00:14.396498 IP 10.0.0.8.44754 > 10.0.0.6.1883: Flags [.], ack 150918078, win 83, options [nop,nop,TS val 1095451485 ecr 3790745960], length 0
 00:00:15.349893 IP 10.0.0.8.44754 > 10.0.0.6.1883: Flags [P.], seq 1011598455:1011598850, ack 150918078, win 83, options [nop,nop,TS val 1095452437 ecr 3790745960], length 395
 00:00:15.350581 IP 10.0.0.6.1883 > 10.0.0.8.44754: Flags [P.], seq 150918078:150918082, ack 1011598850, win 85, options [nop,nop,TS val 3790746957 ecr 1095452437], length 4
 00:00:15.350977 IP 10.0.0.8.44754 > 10.0.0.6.1883: Flags [.], ack 150918082, win 83, options [nop,nop,TS val 1095452439 ecr 3790746957], length 0
 00:00:15.351985 IP 10.0.0.8.44754 > 10.0.0.6.1883: Flags [P.], seq 1011598850:1011598854, ack 150918082, win 83, options [nop,nop,TS val 1095452439 ecr 3790746957], length 4
 00:00:15.352273 IP 10.0.0.6.1883 > 10.0.0.8.44754: Flags [P.], seq 150918082:150918086, ack 1011598854, win 85, options [nop,nop,TS val 3790746958 ecr 1095452439], length 4
 00:00:15.630873 IP 10.0.0.8.44754 > 10.0.0.6.1883: Flags [.], ack 150918086, win 83, options [nop,nop,TS val 1095452485 ecr 3790746958], length 0
 00:00:16.358463 IP 10.0.0.8.44754 > 10.0.0.6.1883: Flags [P.], seq 1011598854:1011599249, ack 150918086, win 83, options [nop,nop,TS val 1095453444 ecr 3790746958], length 395
 00:00:16.359246 IP 10.0.0.6.1883 > 10.0.0.8.44754: Flags [P.], seq 150918086:150918090, ack 1011599249, win 85, options [nop,nop,TS val 3790747965 ecr 1095453444], length 4
 00:00:16.360675 IP 10.0.0.8.44754 > 10.0.0.6.1883: Flags [.], ack 150918090, win 83, options [nop,nop,TS val 1095453448 ecr 3790747965], length 0
 00:00:16.362075 IP 10.0.0.8.44754 > 10.0.0.6.1883: Flags [P.], seq 1011599249:1011599253, ack 150918090, win 83, options [nop,nop,TS val 1095453448 ecr 3790747965], length 4
 00:00:16.362374 IP 10.0.0.6.1883 > 10.0.0.8.44754: Flags [P.], seq 150918090:150918094, ack 1011599253, win 85, options [nop,nop,TS val 3790747968 ecr 1095453448], length 4
 00:00:16.692734 IP 10.0.0.8.44754 > 10.0.0.6.1883: Flags [.], ack 150918094, win 83, options [nop,nop,TS val 1095453726 ecr 3790747968], length 0
 00:00:16.724642 IP 10.0.0.6.1883 > 10.0.0.8.44754: Flags [P.], seq 150918090:150918094, ack 1011599253, win 85, options [nop,nop,TS val 3790748298 ecr 1095453448], length 4
 00:00:16.860453 IP 10.0.0.8.44754 > 10.0.0.6.1883: Flags [.], ack 150918094, win 83, options [nop,nop,TS val 1095453823 ecr 3790748298,nop,nop,sack 1 {150918090:150918094}], length 0
 00:00:17.367037 IP 10.0.0.8.44754 > 10.0.0.6.1883: Flags [P.], seq 1011599253:1011599648, ack 150918094, win 83, options [nop,nop,TS val 1095454452 ecr 3790748298], length 395
 00:00:17.368101 IP 10.0.0.6.1883 > 10.0.0.8.44754: Flags [P.], seq 150918094:150918098, ack 1011599648, win 85, options [nop,nop,TS val 3790748973 ecr 1095454452], length 4
 00:00:17.387649 IP 10.0.0.8.44754 > 10.0.0.6.1883: Flags [.], ack 150918098, win 83, options [nop,nop,TS val 1095454474 ecr 3790748973], length 0
 00:00:17.388284 IP 10.0.0.8.44754 > 10.0.0.6.1883: Flags [P.], seq 1011599648:1011599652, ack 150918098, win 83, options [nop,nop,TS val 1095454474 ecr 3790748973], length 4
 00:00:17.388597 IP 10.0.0.6.1883 > 10.0.0.8.44754: Flags [P.], seq 150918098:150918102, ack 1011599652, win 85, options [nop,nop,TS val 3790748994 ecr 1095454474], length 4
 00:00:17.515549 IP 10.0.0.8.44754 > 10.0.0.6.1883: Flags [.], ack 150918102, win 83, options [nop,nop,TS val 1095454592 ecr 3790748994], length 0
 00:00:18.373807 IP 10.0.0.8.44754 > 10.0.0.6.1883: Flags [P.], seq 1011599652:1011600047, ack 150918102, win 83, options [nop,nop,TS val 1095455460 ecr 3790748994], length 395
 00:00:18.374546 IP 10.0.0.6.1883 > 10.0.0.8.44754: Flags [P.], seq 150918102:150918106, ack 1011600047, win 85, options [nop,nop,TS val 3790749979 ecr 1095455460], length 4
 00:00:18.379101 IP 10.0.0.8.44754 > 10.0.0.6.1883: Flags [.], ack 150918106, win 83, options [nop,nop,TS val 1095455465 ecr 3790749979], length 0
 00:00:18.379144 IP 10.0.0.8.44754 > 10.0.0.6.1883: Flags [P.], seq 1011600047:1011600051, ack 150918106, win 83, options [nop,nop,TS val 1095455465 ecr 3790749979], length 4
 00:00:18.379222 IP 10.0.0.6.1883 > 10.0.0.8.44754: Flags [P.], seq 150918106:150918110, ack 1011600051, win 85, options [nop,nop,TS val 3790749984 ecr 1095455465], length 4
 00:00:18.435171 IP 10.0.0.8.44754 > 10.0.0.6.1883: Flags [.], ack 150918110, win 83, options [nop,nop,TS val 1095455507 ecr 3790749984], length 0
 00:00:19.348415 IP 10.0.0.8.44754 > 10.0.0.6.1883: Flags [P.], seq 1011600051:1011600053, ack 150918110, win 83, options [nop,nop,TS val 1095456434 ecr 3790749984], length 2
 00:00:19.349712 IP 10.0.0.6.1883 > 10.0.0.8.44754: Flags [P.], seq 150918110:150918112, ack 1011600053, win 85, options [nop,nop,TS val 3790750953 ecr 1095456434], length 2
 00:00:19.351284 IP 10.0.0.8.44754 > 10.0.0.6.1883: Flags [.], ack 150918112, win 83, options [nop,nop,TS val 1095456436 ecr 3790750953], length 0
 00:00:19.376270 IP 10.0.0.8.44754 > 10.0.0.6.1883: Flags [P.], seq 1011600053:1011600448, ack 150918112, win 83, options [nop,nop,TS val 1095456462 ecr 3790750953], length 395
 00:00:19.378733 IP 10.0.0.6.1883 > 10.0.0.8.44754: Flags [P.], seq 150918112:150918116, ack 1011600448, win 85, options [nop,nop,TS val 3790750981 ecr 1095456462], length 4
 00:00:19.380746 IP 10.0.0.8.44754 > 10.0.0.6.1883: Flags [P.], seq 1011600448:1011600452, ack 150918116, win 83, options [nop,nop,TS val 1095456466 ecr 3790750981], length 4
 00:00:19.381071 IP 10.0.0.6.1883 > 10.0.0.8.44754: Flags [P.], seq 150918116:150918120, ack 1011600452, win 85, options [nop,nop,TS val 3790750985 ecr 1095456466], length 4
 00:00:19.448797 IP 10.0.0.8.44754 > 10.0.0.6.1883: Flags [.], ack 150918120, win 83, options [nop,nop,TS val 1095456531 ecr 3790750985], length 0
 00:00:20.396727 IP 10.0.0.8.44754 > 10.0.0.6.1883: Flags [P.], seq 1011600452:1011600847, ack 150918120, win 83, options [nop,nop,TS val 1095457481 ecr 3790750985], length 395
 00:00:20.397965 IP 10.0.0.6.1883 > 10.0.0.8.44754: Flags [P.], seq 150918120:150918124, ack 1011600847, win 85, options [nop,nop,TS val 3790752001 ecr 1095457481], length 4
 00:00:20.398690 IP 10.0.0.8.44754 > 10.0.0.6.1883: Flags [.], ack 150918124, win 83, options [nop,nop,TS val 1095457484 ecr 3790752001], length 0
 00:00:20.399759 IP 10.0.0.8.44754 > 10.0.0.6.1883: Flags [P.], seq 1011600847:1011600851, ack 150918124, win 83, options [nop,nop,TS val 1095457484 ecr 3790752001], length 4
 00:00:20.400144 IP 10.0.0.6.1883 > 10.0.0.8.44754: Flags [P.], seq 150918124:150918128, ack 1011600851, win 85, options [nop,nop,TS val 3790752004 ecr 1095457484], length 4
 00:00:20.655949 IP 10.0.0.8.44754 > 10.0.0.6.1883: Flags [.], ack 150918128, win 83, options [nop,nop,TS val 1095457737 ecr 3790752004], length 0
 00:00:21.399431 IP 10.0.0.8.44754 > 10.0.0.6.1883: Flags [P.], seq 1011600851:1011601246, ack 150918128, win 83, options [nop,nop,TS val 1095458483 ecr 3790752004], length 395
 00:00:21.400068 IP 10.0.0.6.1883 > 10.0.0.8.44754: Flags [P.], seq 150918128:150918132, ack 1011601246, win 85, options [nop,nop,TS val 3790753003 ecr 1095458483], length 4
 00:00:21.401641 IP 10.0.0.8.44754 > 10.0.0.6.1883: Flags [.], ack 150918132, win 83, options [nop,nop,TS val 1095458485 ecr 3790753003], length 0
 00:00:21.401786 IP 10.0.0.8.44754 > 10.0.0.6.1883: Flags [P.], seq 1011601246:1011601250, ack 150918132, win 83, options [nop,nop,TS val 1095458486 ecr 3790753003], length 4
 00:00:21.402145 IP 10.0.0.6.1883 > 10.0.0.8.44754: Flags [P.], seq 150918132:150918136, ack 1011601250, win 85, options [nop,nop,TS val 3790753005 ecr 1095458486], length 4
 00:00:21.513098 IP 10.0.0.8.44754 > 10.0.0.6.1883: Flags [.], ack 150918136, win 83, options [nop,nop,TS val 1095458590 ecr 3790753005], length 0
 00:00:22.403139 IP 10.0.0.8.44754 > 10.0.0.6.1883: Flags [P.], seq 1011601250:1011601645, ack 150918136, win 83, options [nop,nop,TS val 1095459486 ecr 3790753005], length 395
 00:00:22.403875 IP 10.0.0.6.1883 > 10.0.0.8.44754: Flags [P.], seq 150918136:150918140, ack 1011601645, win 85, options [nop,nop,TS val 3790754006 ecr 1095459486], length 4
 00:00:22.406291 IP 10.0.0.8.44754 > 10.0.0.6.1883: Flags [.], ack 150918140, win 83, options [nop,nop,TS val 1095459490 ecr 3790754006], length 0
 00:00:22.406583 IP 10.0.0.8.44754 > 10.0.0.6.1883: Flags [P.], seq 1011601645:1011601649, ack 150918140, win 83, options [nop,nop,TS val 1095459490 ecr 3790754006], length 4
 00:00:22.406788 IP 10.0.0.6.1883 > 10.0.0.8.44754: Flags [P.], seq 150918140:150918144, ack 1011601649, win 85, options [nop,nop,TS val 3790754009 ecr 1095459490], length 4
 00:00:22.869381 IP 10.0.0.6.1883 > 10.0.0.8.44754: Flags [P.], seq 150918140:150918144, ack 1011601649, win 85, options [nop,nop,TS val 3790754472 ecr 1095459490], length 4
 00:00:22.869597 IP 10.0.0.8.44754 > 10.0.0.6.1883: Flags [.], ack 150918144, win 83, options [nop,nop,TS val 1095459746 ecr 3790754009], length 0
 00:00:22.905330 IP 10.0.0.8.44754 > 10.0.0.6.1883: Flags [.], ack 150918144, win 83, options [nop,nop,TS val 1095459985 ecr 3790754472,nop,nop,sack 1 {150918140:150918144}], length 0
 00:00:23.406451 IP 10.0.0.8.44754 > 10.0.0.6.1883: Flags [P.], seq 1011601649:1011602044, ack 150918144, win 83, options [nop,nop,TS val 1095460489 ecr 3790754472], length 395
 00:00:23.407099 IP 10.0.0.6.1883 > 10.0.0.8.44754: Flags [P.], seq 150918144:150918148, ack 1011602044, win 85, options [nop,nop,TS val 3790755009 ecr 1095460489], length 4
 00:00:23.409649 IP 10.0.0.8.44754 > 10.0.0.6.1883: Flags [.], ack 150918148, win 83, options [nop,nop,TS val 1095460494 ecr 3790755009], length 0
 00:00:23.411109 IP 10.0.0.8.44754 > 10.0.0.6.1883: Flags [P.], seq 1011602044:1011602048, ack 150918148, win 83, options [nop,nop,TS val 1095460494 ecr 3790755009], length 4
 00:00:23.411375 IP 10.0.0.6.1883 > 10.0.0.8.44754: Flags [P.], seq 150918148:150918152, ack 1011602048, win 85, options [nop,nop,TS val 3790755013 ecr 1095460494], length 4
 00:00:23.464037 IP 10.0.0.8.44754 > 10.0.0.6.1883: Flags [.], ack 150918152, win 83, options [nop,nop,TS val 1095460536 ecr 3790755013], length 0
 00:00:24.404767 IP 10.0.0.8.44754 > 10.0.0.6.1883: Flags [P.], seq 1011602048:1011602050, ack 150918152, win 83, options [nop,nop,TS val 1095461488 ecr 3790755013], length 2
 00:00:24.404937 IP 10.0.0.6.1883 > 10.0.0.8.44754: Flags [P.], seq 150918152:150918154, ack 1011602050, win 85, options [nop,nop,TS val 3790756007 ecr 1095461488], length 2
 00:00:24.405479 IP 10.0.0.8.44754 > 10.0.0.6.1883: Flags [.], ack 150918154, win 83, options [nop,nop,TS val 1095461489 ecr 3790756007], length 0
 00:00:24.407172 IP 10.0.0.8.44754 > 10.0.0.6.1883: Flags [P.], seq 1011602050:1011602445, ack 150918154, win 83, options [nop,nop,TS val 1095461490 ecr 3790756007], length 395
 00:00:24.407514 IP 10.0.0.6.1883 > 10.0.0.8.44754: Flags [P.], seq 150918154:150918158, ack 1011602445, win 85, options [nop,nop,TS val 3790756009 ecr 1095461490], length 4
 00:00:24.408473 IP 10.0.0.8.44754 > 10.0.0.6.1883: Flags [P.], seq 1011602445:1011602449, ack 150918158, win 83, options [nop,nop,TS val 1095461491 ecr 3790756009], length 4
 00:00:24.408684 IP 10.0.0.6.1883 > 10.0.0.8.44754: Flags [P.], seq 150918158:150918162, ack 1011602449, win 85, options [nop,nop,TS val 3790756010 ecr 1095461491], length 4
 00:00:24.602818 IP 10.0.0.8.44754 > 10.0.0.6.1883: Flags [.], ack 150918162, win 83, options [nop,nop,TS val 1095461537 ecr 3790756010], length 0
 00:00:25.407740 IP 10.0.0.8.44754 > 10.0.0.6.1883: Flags [P.], seq 1011602449:1011602844, ack 150918162, win 83, options [nop,nop,TS val 1095462490 ecr 3790756010], length 395
 00:00:25.408504 IP 10.0.0.6.1883 > 10.0.0.8.44754: Flags [P.], seq 150918162:150918166, ack 1011602844, win 85, options [nop,nop,TS val 3790757010 ecr 1095462490], length 4
 00:00:25.409693 IP 10.0.0.8.44754 > 10.0.0.6.1883: Flags [.], ack 150918166, win 83, options [nop,nop,TS val 1095462492 ecr 3790757010], length 0
 00:00:25.409978 IP 10.0.0.8.44754 > 10.0.0.6.1883: Flags [P.], seq 1011602844:1011602848, ack 150918166, win 83, options [nop,nop,TS val 1095462492 ecr 3790757010], length 4
 00:00:25.410259 IP 10.0.0.6.1883 > 10.0.0.8.44754: Flags [P.], seq 150918166:150918170, ack 1011602848, win 85, options [nop,nop,TS val 3790757011 ecr 1095462492], length 4
 00:00:25.511527 IP 10.0.0.8.44754 > 10.0.0.6.1883: Flags [.], ack 150918170, win 83, options [nop,nop,TS val 1095462584 ecr 3790757011], length 0
 00:00:26.410418 IP 10.0.0.8.44754 > 10.0.0.6.1883: Flags [P.], seq 1011602848:1011603243, ack 150918170, win 83, options [nop,nop,TS val 1095463492 ecr 3790757011], length 395
 00:00:26.412601 IP 10.0.0.6.1883 > 10.0.0.8.44754: Flags [P.], seq 150918170:150918174, ack 1011603243, win 85, options [nop,nop,TS val 3790758012 ecr 1095463492], length 4
 00:00:26.414345 IP 10.0.0.8.44754 > 10.0.0.6.1883: Flags [.], ack 150918174, win 83, options [nop,nop,TS val 1095463496 ecr 3790758012], length 0
 00:00:26.414578 IP 10.0.0.8.44754 > 10.0.0.6.1883: Flags [P.], seq 1011603243:1011603247, ack 150918174, win 83, options [nop,nop,TS val 1095463497 ecr 3790758012], length 4
 00:00:26.415411 IP 10.0.0.6.1883 > 10.0.0.8.44754: Flags [P.], seq 150918174:150918178, ack 1011603247, win 85, options [nop,nop,TS val 3790758016 ecr 1095463497], length 4
 00:00:26.638206 IP 10.0.0.8.44754 > 10.0.0.6.1883: Flags [.], ack 150918178, win 83, options [nop,nop,TS val 1095463695 ecr 3790758016], length 0
 00:00:27.412771 IP 10.0.0.8.44754 > 10.0.0.6.1883: Flags [P.], seq 1011603247:1011603642, ack 150918178, win 83, options [nop,nop,TS val 1095464494 ecr 3790758016], length 395
 00:00:27.413697 IP 10.0.0.6.1883 > 10.0.0.8.44754: Flags [P.], seq 150918178:150918182, ack 1011603642, win 85, options [nop,nop,TS val 3790759014 ecr 1095464494], length 4
 00:00:27.419613 IP 10.0.0.8.44754 > 10.0.0.6.1883: Flags [.], ack 150918182, win 83, options [nop,nop,TS val 1095464501 ecr 3790759014], length 0
 00:00:27.419793 IP 10.0.0.8.44754 > 10.0.0.6.1883: Flags [P.], seq 1011603642:1011603646, ack 150918182, win 83, options [nop,nop,TS val 1095464502 ecr 3790759014], length 4
 00:00:27.420025 IP 10.0.0.6.1883 > 10.0.0.8.44754: Flags [P.], seq 150918182:150918186, ack 1011603646, win 85, options [nop,nop,TS val 3790759020 ecr 1095464502], length 4
 00:00:27.464660 IP 10.0.0.8.44754 > 10.0.0.6.1883: Flags [.], ack 150918186, win 83, options [nop,nop,TS val 1095464547 ecr 3790759020], length 0
 00:00:27.659855 IP6 fe80::e843:2dff:fed2:c1fe > ff02::2: ICMP6, router solicitation, length 16
 00:00:28.414502 IP 10.0.0.8.44754 > 10.0.0.6.1883: Flags [P.], seq 1011603646:1011604041, ack 150918186, win 83, options [nop,nop,TS val 1095465494 ecr 3790759020], length 395
 00:00:28.415773 IP 10.0.0.6.1883 > 10.0.0.8.44754: Flags [P.], seq 150918186:150918190, ack 1011604041, win 85, options [nop,nop,TS val 3790760015 ecr 1095465494], length 4
 00:00:28.416583 IP 10.0.0.8.44754 > 10.0.0.6.1883: Flags [.], ack 150918190, win 83, options [nop,nop,TS val 1095465498 ecr 3790760015], length 0
 00:00:28.416695 IP 10.0.0.8.44754 > 10.0.0.6.1883: Flags [P.], seq 1011604041:1011604045, ack 150918190, win 83, options [nop,nop,TS val 1095465498 ecr 3790760015], length 4
 00:00:28.416891 IP 10.0.0.6.1883 > 10.0.0.8.44754: Flags [P.], seq 150918190:150918194, ack 1011604045, win 85, options [nop,nop,TS val 3790760016 ecr 1095465498], length 4
 00:00:28.460910 IP 10.0.0.8.44754 > 10.0.0.6.1883: Flags [.], ack 150918194, win 83, options [nop,nop,TS val 1095465542 ecr 3790760016], length 0
 00:00:29.406836 IP 10.0.0.8.44754 > 10.0.0.6.1883: Flags [P.], seq 1011604045:1011604047, ack 150918194, win 83, options [nop,nop,TS val 1095466487 ecr 3790760016], length 2
 00:00:29.407294 IP 10.0.0.6.1883 > 10.0.0.8.44754: Flags [P.], seq 150918194:150918196, ack 1011604047, win 85, options [nop,nop,TS val 3790761006 ecr 1095466487], length 2
 00:00:29.408610 IP 10.0.0.8.44754 > 10.0.0.6.1883: Flags [.], ack 150918196, win 83, options [nop,nop,TS val 1095466489 ecr 3790761006], length 0
 00:00:29.414644 IP 10.0.0.8.44754 > 10.0.0.6.1883: Flags [P.], seq 1011604047:1011604442, ack 150918196, win 83, options [nop,nop,TS val 1095466495 ecr 3790761006], length 395
 00:00:29.415497 IP 10.0.0.6.1883 > 10.0.0.8.44754: Flags [P.], seq 150918196:150918200, ack 1011604442, win 85, options [nop,nop,TS val 3790761015 ecr 1095466495], length 4
 00:00:29.416666 IP 10.0.0.8.44754 > 10.0.0.6.1883: Flags [P.], seq 1011604442:1011604446, ack 150918200, win 83, options [nop,nop,TS val 1095466497 ecr 3790761015], length 4
 00:00:29.417025 IP 10.0.0.6.1883 > 10.0.0.8.44754: Flags [P.], seq 150918200:150918204, ack 1011604446, win 85, options [nop,nop,TS val 3790761016 ecr 1095466497], length 4
 00:00:29.460535 IP 10.0.0.8.44754 > 10.0.0.6.1883: Flags [.], ack 150918204, win 83, options [nop,nop,TS val 1095466541 ecr 3790761016], length 0
 00:00:30.415777 IP 10.0.0.8.44754 > 10.0.0.6.1883: Flags [P.], seq 1011604446:1011604841, ack 150918204, win 83, options [nop,nop,TS val 1095467495 ecr 3790761016], length 395
 00:00:30.416803 IP 10.0.0.6.1883 > 10.0.0.8.44754: Flags [P.], seq 150918204:150918208, ack 1011604841, win 85, options [nop,nop,TS val 3790762015 ecr 1095467495], length 4
 00:00:30.417850 IP 10.0.0.8.44754 > 10.0.0.6.1883: Flags [.], ack 150918208, win 83, options [nop,nop,TS val 1095467498 ecr 3790762015], length 0
 00:00:30.417960 IP 10.0.0.8.44754 > 10.0.0.6.1883: Flags [P.], seq 1011604841:1011604845, ack 150918208, win 83, options [nop,nop,TS val 1095467498 ecr 3790762015], length 4
 00:00:30.418286 IP 10.0.0.6.1883 > 10.0.0.8.44754: Flags [P.], seq 150918208:150918212, ack 1011604845, win 85, options [nop,nop,TS val 3790762017 ecr 1095467498], length 4
 00:00:30.486187 IP 10.0.0.8.44754 > 10.0.0.6.1883: Flags [.], ack 150918212, win 83, options [nop,nop,TS val 1095467567 ecr 3790762017], length 0
 00:00:31.415393 IP 10.0.0.8.44754 > 10.0.0.6.1883: Flags [P.], seq 1011604845:1011605240, ack 150918212, win 83, options [nop,nop,TS val 1095468495 ecr 3790762017], length 395
 00:00:31.415608 IP 10.0.0.6.1883 > 10.0.0.8.44754: Flags [P.], seq 150918212:150918216, ack 1011605240, win 85, options [nop,nop,TS val 3790763014 ecr 1095468495], length 4
 00:00:31.417134 IP 10.0.0.8.44754 > 10.0.0.6.1883: Flags [.], ack 150918216, win 83, options [nop,nop,TS val 1095468497 ecr 3790763014], length 0
 00:00:31.417352 IP 10.0.0.8.44754 > 10.0.0.6.1883: Flags [P.], seq 1011605240:1011605244, ack 150918216, win 83, options [nop,nop,TS val 1095468497 ecr 3790763014], length 4
 00:00:31.417416 IP 10.0.0.6.1883 > 10.0.0.8.44754: Flags [P.], seq 150918216:150918220, ack 1011605244, win 85, options [nop,nop,TS val 3790763016 ecr 1095468497], length 4
 00:00:31.460822 IP 10.0.0.8.44754 > 10.0.0.6.1883: Flags [.], ack 150918220, win 83, options [nop,nop,TS val 1095468541 ecr 3790763016], length 0
 00:00:31.732771 IP6 fe80::1ced:80ff:fe04:d457 > ff02::2: ICMP6, router solicitation, length 16
 00:00:32.418392 IP 10.0.0.8.44754 > 10.0.0.6.1883: Flags [P.], seq 1011605244:1011605639, ack 150918220, win 83, options [nop,nop,TS val 1095469496 ecr 3790763016], length 395
 00:00:32.420395 IP 10.0.0.6.1883 > 10.0.0.8.44754: Flags [P.], seq 150918220:150918224, ack 1011605639, win 85, options [nop,nop,TS val 3790764017 ecr 1095469496], length 4
 00:00:32.487564 IP 10.0.0.8.44754 > 10.0.0.6.1883: Flags [.], ack 150918224, win 83, options [nop,nop,TS val 1095469567 ecr 3790764017], length 0
 00:00:32.488813 IP 10.0.0.8.44754 > 10.0.0.6.1883: Flags [P.], seq 1011605639:1011605643, ack 150918224, win 83, options [nop,nop,TS val 1095469567 ecr 3790764017], length 4
 00:00:32.489232 IP 10.0.0.6.1883 > 10.0.0.8.44754: Flags [P.], seq 150918224:150918228, ack 1011605643, win 85, options [nop,nop,TS val 3790764087 ecr 1095469567], length 4
 00:00:32.536658 IP 10.0.0.8.44754 > 10.0.0.6.1883: Flags [.], ack 150918228, win 83, options [nop,nop,TS val 1095469616 ecr 3790764087], length 0
 00:00:33.419435 IP 10.0.0.8.44754 > 10.0.0.6.1883: Flags [P.], seq 1011605643:1011606038, ack 150918228, win 83, options [nop,nop,TS val 1095470497 ecr 3790764087], length 395
 00:00:33.420250 IP 10.0.0.6.1883 > 10.0.0.8.44754: Flags [P.], seq 150918228:150918232, ack 1011606038, win 85, options [nop,nop,TS val 3790765017 ecr 1095470497], length 4
 00:00:33.421269 IP 10.0.0.8.44754 > 10.0.0.6.1883: Flags [.], ack 150918232, win 83, options [nop,nop,TS val 1095470500 ecr 3790765017], length 0
 00:00:33.422069 IP 10.0.0.8.44754 > 10.0.0.6.1883: Flags [P.], seq 1011606038:1011606042, ack 150918232, win 83, options [nop,nop,TS val 1095470500 ecr 3790765017], length 4
 00:00:33.422386 IP 10.0.0.6.1883 > 10.0.0.8.44754: Flags [P.], seq 150918232:150918236, ack 1011606042, win 85, options [nop,nop,TS val 3790765019 ecr 1095470500], length 4
 00:00:33.464887 IP 10.0.0.8.44754 > 10.0.0.6.1883: Flags [.], ack 150918236, win 83, options [nop,nop,TS val 1095470544 ecr 3790765019], length 0
 00:00:33.793462 IP6 fe80::c8a4:90ff:fe26:d938 > ff02::2: ICMP6, router solicitation, length 16
 00:00:33.822285 IP6 fe80::b039:d5ff:fed5:d90c > ff02::2: ICMP6, router solicitation, length 16
 00:00:33.842219 IP6 fe80::d093:6fff:feea:b53 > ff02::2: ICMP6, router solicitation, length 16
 00:00:33.858366 IP6 fe80::5839:7fff:fe75:8554 > ff02::2: ICMP6, router solicitation, length 16
 00:00:34.408180 IP 10.0.0.8.44754 > 10.0.0.6.1883: Flags [P.], seq 1011606042:1011606044, ack 150918236, win 83, options [nop,nop,TS val 1095471486 ecr 3790765019], length 2
 00:00:34.408662 IP 10.0.0.6.1883 > 10.0.0.8.44754: Flags [P.], seq 150918236:150918238, ack 1011606044, win 85, options [nop,nop,TS val 3790766005 ecr 1095471486], length 2
 00:00:34.410098 IP 10.0.0.8.44754 > 10.0.0.6.1883: Flags [.], ack 150918238, win 83, options [nop,nop,TS val 1095471488 ecr 3790766005], length 0
 00:00:34.420735 IP 10.0.0.8.44754 > 10.0.0.6.1883: Flags [P.], seq 1011606044:1011606439, ack 150918238, win 83, options [nop,nop,TS val 1095471498 ecr 3790766005], length 395
 00:00:34.421889 IP 10.0.0.6.1883 > 10.0.0.8.44754: Flags [P.], seq 150918238:150918242, ack 1011606439, win 85, options [nop,nop,TS val 3790766018 ecr 1095471498], length 4
 00:00:34.423322 IP 10.0.0.8.44754 > 10.0.0.6.1883: Flags [P.], seq 1011606439:1011606443, ack 150918242, win 83, options [nop,nop,TS val 1095471501 ecr 3790766018], length 4
 00:00:34.423726 IP 10.0.0.6.1883 > 10.0.0.8.44754: Flags [P.], seq 150918242:150918246, ack 1011606443, win 85, options [nop,nop,TS val 3790766020 ecr 1095471501], length 4
 00:00:34.464504 IP 10.0.0.8.44754 > 10.0.0.6.1883: Flags [.], ack 150918246, win 83, options [nop,nop,TS val 1095471543 ecr 3790766020], length 0
 00:00:35.421545 IP 10.0.0.8.44754 > 10.0.0.6.1883: Flags [P.], seq 1011606443:1011606838, ack 150918246, win 83, options [nop,nop,TS val 1095472499 ecr 3790766020], length 395
 00:00:35.422491 IP 10.0.0.6.1883 > 10.0.0.8.44754: Flags [P.], seq 150918246:150918250, ack 1011606838, win 85, options [nop,nop,TS val 3790767018 ecr 1095472499], length 4
 00:00:35.423273 IP 10.0.0.8.44754 > 10.0.0.6.1883: Flags [.], ack 150918250, win 83, options [nop,nop,TS val 1095472501 ecr 3790767018], length 0
 00:00:35.423887 IP 10.0.0.8.44754 > 10.0.0.6.1883: Flags [P.], seq 1011606838:1011606842, ack 150918250, win 83, options [nop,nop,TS val 1095472501 ecr 3790767018], length 4
 00:00:35.424147 IP 10.0.0.6.1883 > 10.0.0.8.44754: Flags [P.], seq 150918250:150918254, ack 1011606842, win 85, options [nop,nop,TS val 3790767020 ecr 1095472501], length 4
 00:00:35.468627 IP 10.0.0.8.44754 > 10.0.0.6.1883: Flags [.], ack 150918254, win 83, options [nop,nop,TS val 1095472547 ecr 3790767020], length 0
 00:00:35.860470 IP6 fe80::b83c:ffff:fe35:4d34 > ff02::2: ICMP6, router solicitation, length 16
 00:00:36.423245 IP 10.0.0.8.44754 > 10.0.0.6.1883: Flags [P.], seq 1011606842:1011607237, ack 150918254, win 83, options [nop,nop,TS val 1095473499 ecr 3790767020], length 395
 00:00:36.424225 IP 10.0.0.6.1883 > 10.0.0.8.44754: Flags [P.], seq 150918254:150918258, ack 1011607237, win 85, options [nop,nop,TS val 3790768020 ecr 1095473499], length 4
 00:00:36.424766 IP 10.0.0.8.44754 > 10.0.0.6.1883: Flags [.], ack 150918258, win 83, options [nop,nop,TS val 1095473502 ecr 3790768020], length 0
 00:00:36.424932 IP 10.0.0.8.44754 > 10.0.0.6.1883: Flags [P.], seq 1011607237:1011607241, ack 150918258, win 83, options [nop,nop,TS val 1095473502 ecr 3790768020], length 4
 00:00:36.425600 IP 10.0.0.6.1883 > 10.0.0.8.44754: Flags [P.], seq 150918258:150918262, ack 1011607241, win 85, options [nop,nop,TS val 3790768021 ecr 1095473502], length 4
 00:00:36.468851 IP 10.0.0.8.44754 > 10.0.0.6.1883: Flags [.], ack 150918262, win 83, options [nop,nop,TS val 1095473546 ecr 3790768021], length 0
 00:00:37.424498 IP 10.0.0.8.44754 > 10.0.0.6.1883: Flags [P.], seq 1011607241:1011607636, ack 150918262, win 83, options [nop,nop,TS val 1095474500 ecr 3790768021], length 395
 00:00:37.425210 IP 10.0.0.6.1883 > 10.0.0.8.44754: Flags [P.], seq 150918262:150918266, ack 1011607636, win 85, options [nop,nop,TS val 3790769020 ecr 1095474500], length 4
 00:00:37.426098 IP 10.0.0.8.44754 > 10.0.0.6.1883: Flags [.], ack 150918266, win 83, options [nop,nop,TS val 1095474503 ecr 3790769020], length 0
 00:00:37.426611 IP 10.0.0.8.44754 > 10.0.0.6.1883: Flags [P.], seq 1011607636:1011607640, ack 150918266, win 83, options [nop,nop,TS val 1095474503 ecr 3790769020], length 4
 00:00:37.426936 IP 10.0.0.6.1883 > 10.0.0.8.44754: Flags [P.], seq 150918266:150918270, ack 1011607640, win 85, options [nop,nop,TS val 3790769022 ecr 1095474503], length 4
 00:00:37.468615 IP 10.0.0.8.44754 > 10.0.0.6.1883: Flags [.], ack 150918270, win 83, options [nop,nop,TS val 1095474546 ecr 3790769022], length 0
 00:00:37.928260 IP6 fe80::4ca0:56ff:fe64:1437 > ff02::2: ICMP6, router solicitation, length 16
 00:00:37.958862 IP6 fe80::dcf8:c6ff:fee3:949a > ff02::2: ICMP6, router solicitation, length 16
 00:00:38.424558 IP 10.0.0.8.44754 > 10.0.0.6.1883: Flags [P.], seq 1011607640:1011608035, ack 150918270, win 83, options [nop,nop,TS val 1095475501 ecr 3790769022], length 395
 00:00:38.425378 IP 10.0.0.6.1883 > 10.0.0.8.44754: Flags [P.], seq 150918270:150918274, ack 1011608035, win 85, options [nop,nop,TS val 3790770020 ecr 1095475501], length 4
 00:00:38.426501 IP 10.0.0.8.44754 > 10.0.0.6.1883: Flags [.], ack 150918274, win 83, options [nop,nop,TS val 1095475502 ecr 3790770020], length 0
 00:00:38.426911 IP 10.0.0.8.44754 > 10.0.0.6.1883: Flags [P.], seq 1011608035:1011608039, ack 150918274, win 83, options [nop,nop,TS val 1095475503 ecr 3790770020], length 4
 00:00:38.427152 IP 10.0.0.6.1883 > 10.0.0.8.44754: Flags [P.], seq 150918274:150918278, ack 1011608039, win 85, options [nop,nop,TS val 3790770022 ecr 1095475503], length 4
 00:00:38.469063 IP 10.0.0.8.44754 > 10.0.0.6.1883: Flags [.], ack 150918278, win 83, options [nop,nop,TS val 1095475545 ecr 3790770022], length 0
 00:00:39.409434 IP 10.0.0.8.44754 > 10.0.0.6.1883: Flags [P.], seq 1011608039:1011608041, ack 150918278, win 83, options [nop,nop,TS val 1095476485 ecr 3790770022], length 2
 00:00:39.409757 IP 10.0.0.6.1883 > 10.0.0.8.44754: Flags [P.], seq 150918278:150918280, ack 1011608041, win 85, options [nop,nop,TS val 3790771004 ecr 1095476485], length 2
 00:00:39.410954 IP 10.0.0.8.44754 > 10.0.0.6.1883: Flags [.], ack 150918280, win 83, options [nop,nop,TS val 1095476486 ecr 3790771004], length 0
 00:00:39.427714 IP 10.0.0.8.44754 > 10.0.0.6.1883: Flags [P.], seq 1011608041:1011608436, ack 150918280, win 83, options [nop,nop,TS val 1095476503 ecr 3790771004], length 395
 00:00:39.428378 IP 10.0.0.6.1883 > 10.0.0.8.44754: Flags [P.], seq 150918280:150918284, ack 1011608436, win 85, options [nop,nop,TS val 3790771022 ecr 1095476503], length 4
 00:00:39.429004 IP 10.0.0.8.44754 > 10.0.0.6.1883: Flags [P.], seq 1011608436:1011608440, ack 150918284, win 83, options [nop,nop,TS val 1095476505 ecr 3790771022], length 4
 00:00:39.429323 IP 10.0.0.6.1883 > 10.0.0.8.44754: Flags [P.], seq 150918284:150918288, ack 1011608440, win 85, options [nop,nop,TS val 3790771023 ecr 1095476505], length 4
 00:00:39.472721 IP 10.0.0.8.44754 > 10.0.0.6.1883: Flags [.], ack 150918288, win 83, options [nop,nop,TS val 1095476549 ecr 3790771023], length 0
 00:00:39.925263 IP6 fe80::4c0:c0ff:fef7:c340 > ff02::2: ICMP6, router solicitation, length 16
 00:00:40.432693 IP 10.0.0.8.44754 > 10.0.0.6.1883: Flags [P.], seq 1011608440:1011608835, ack 150918288, win 83, options [nop,nop,TS val 1095477508 ecr 3790771023], length 395
 00:00:40.433438 IP 10.0.0.6.1883 > 10.0.0.8.44754: Flags [P.], seq 150918288:150918292, ack 1011608835, win 85, options [nop,nop,TS val 3790772027 ecr 1095477508], length 4
 00:00:40.434027 IP 10.0.0.8.44754 > 10.0.0.6.1883: Flags [.], ack 150918292, win 83, options [nop,nop,TS val 1095477509 ecr 3790772027], length 0
 00:00:40.434388 IP 10.0.0.8.44754 > 10.0.0.6.1883: Flags [P.], seq 1011608835:1011608839, ack 150918292, win 83, options [nop,nop,TS val 1095477509 ecr 3790772027], length 4
 00:00:40.434909 IP 10.0.0.6.1883 > 10.0.0.8.44754: Flags [P.], seq 150918292:150918296, ack 1011608839, win 85, options [nop,nop,TS val 3790772028 ecr 1095477509], length 4
 00:00:40.476962 IP 10.0.0.8.44754 > 10.0.0.6.1883: Flags [.], ack 150918296, win 83, options [nop,nop,TS val 1095477552 ecr 3790772028], length 0
 00:00:41.434011 IP 10.0.0.8.44754 > 10.0.0.6.1883: Flags [P.], seq 1011608839:1011609234, ack 150918296, win 83, options [nop,nop,TS val 1095478509 ecr 3790772028], length 395
 00:00:41.434859 IP 10.0.0.6.1883 > 10.0.0.8.44754: Flags [P.], seq 150918296:150918300, ack 1011609234, win 85, options [nop,nop,TS val 3790773028 ecr 1095478509], length 4
 00:00:41.435898 IP 10.0.0.8.44754 > 10.0.0.6.1883: Flags [.], ack 150918300, win 83, options [nop,nop,TS val 1095478510 ecr 3790773028], length 0
