00:00:09.072175 IP 10.0.0.6.1883 > 10.0.0.8.44998: Flags [S.], seq 2787520982, ack 3131655446, win 43440, options [mss 1460,sackOK,TS val 3792399994 ecr 1097105413,nop,wscale 9], length 0
00:00:09.084087 IP 10.0.0.6.1883 > 10.0.0.8.44998: Flags [.], ack 3131655466, win 85, options [nop,nop,TS val 3792400005 ecr 1097105484], length 0
00:00:09.085450 IP 10.0.0.6.1883 > 10.0.0.8.44998: Flags [P.], seq 2787520983:2787520987, ack 3131655466, win 85, options [nop,nop,TS val 3792400006 ecr 1097105484], length 4
00:00:09.087008 IP 10.0.0.6.1883 > 10.0.0.8.44998: Flags [P.], seq 2787520987:2787521052, ack 3131655530, win 85, options [nop,nop,TS val 3792400008 ecr 1097105489], length 65
00:00:09.087948 IP 10.0.0.6.1883 > 10.0.0.8.44998: Flags [P.], seq 2787521052:2787521057, ack 3131655925, win 85, options [nop,nop,TS val 3792400009 ecr 1097105491], length 5
00:00:09.131677 IP 10.0.0.6.1883 > 10.0.0.8.44998: Flags [P.], seq 2787521057:2787521061, ack 3131655925, win 85, options [nop,nop,TS val 3792400053 ecr 1097105535], length 4
00:00:09.135002 IP 10.0.0.6.1883 > 10.0.0.8.44998: Flags [P.], seq 2787521061:2787521065, ack 3131655929, win 85, options [nop,nop,TS val 3792400056 ecr 1097105536], length 4
00:00:10.026918 IP 10.0.0.6.1883 > 10.0.0.8.44998: Flags [P.], seq 2787521065:2787521069, ack 3131656324, win 85, options [nop,nop,TS val 3792400948 ecr 1097106428], length 4
00:00:10.029425 IP 10.0.0.6.1883 > 10.0.0.8.44998: Flags [P.], seq 2787521069:2787521073, ack 3131656328, win 85, options [nop,nop,TS val 3792400951 ecr 1097106431], length 4
00:00:11.244114 IP 10.0.0.6.1883 > 10.0.0.8.44998: Flags [P.], seq 2787521073:2787521077, ack 3131656723, win 85, options [nop,nop,TS val 3792402165 ecr 1097107645], length 4
00:00:11.246574 IP 10.0.0.6.1883 > 10.0.0.8.44998: Flags [P.], seq 2787521077:2787521081, ack 3131656727, win 85, options [nop,nop,TS val 3792402168 ecr 1097107648], length 4
00:00:11.479136 IP 10.0.0.6.1883 > 10.0.0.8.44998: Flags [P.], seq 2787521077:2787521081, ack 3131656727, win 85, options [nop,nop,TS val 3792402400 ecr 1097107648], length 4
00:00:12.245490 IP 10.0.0.6.1883 > 10.0.0.8.44998: Flags [P.], seq 2787521081:2787521085, ack 3131657122, win 85, options [nop,nop,TS val 3792403167 ecr 1097108647], length 4
00:00:12.247555 IP 10.0.0.6.1883 > 10.0.0.8.44998: Flags [P.], seq 2787521085:2787521089, ack 3131657126, win 85, options [nop,nop,TS val 3792403169 ecr 1097108650], length 4
00:00:13.248554 IP 10.0.0.6.1883 > 10.0.0.8.44998: Flags [P.], seq 2787521089:2787521093, ack 3131657521, win 85, options [nop,nop,TS val 3792404170 ecr 1097109650], length 4
00:00:13.250862 IP 10.0.0.6.1883 > 10.0.0.8.44998: Flags [P.], seq 2787521093:2787521097, ack 3131657525, win 85, options [nop,nop,TS val 3792404172 ecr 1097109653], length 4
00:00:14.090213 IP 10.0.0.6.1883 > 10.0.0.8.44998: Flags [P.], seq 2787521097:2787521099, ack 3131657527, win 85, options [nop,nop,TS val 3792405012 ecr 1097110492], length 2
00:00:14.249688 IP 10.0.0.6.1883 > 10.0.0.8.44998: Flags [P.], seq 2787521099:2787521103, ack 3131657922, win 85, options [nop,nop,TS val 3792405171 ecr 1097110652], length 4
00:00:14.252192 IP 10.0.0.6.1883 > 10.0.0.8.44998: Flags [P.], seq 2787521103:2787521107, ack 3131657926, win 85, options [nop,nop,TS val 3792405173 ecr 1097110654], length 4
00:00:15.252571 IP 10.0.0.6.1883 > 10.0.0.8.44998: Flags [P.], seq 2787521107:2787521111, ack 3131658321, win 85, options [nop,nop,TS val 3792406174 ecr 1097111654], length 4
00:00:15.254811 IP 10.0.0.6.1883 > 10.0.0.8.44998: Flags [P.], seq 2787521111:2787521115, ack 3131658325, win 85, options [nop,nop,TS val 3792406176 ecr 1097111657], length 4
00:00:16.254390 IP 10.0.0.6.1883 > 10.0.0.8.44998: Flags [P.], seq 2787521115:2787521119, ack 3131658720, win 85, options [nop,nop,TS val 3792407176 ecr 1097112655], length 4
00:00:16.256669 IP 10.0.0.6.1883 > 10.0.0.8.44998: Flags [P.], seq 2787521119:2787521123, ack 3131658724, win 85, options [nop,nop,TS val 3792407178 ecr 1097112659], length 4
00:00:17.255067 IP 10.0.0.6.1883 > 10.0.0.8.44998: Flags [P.], seq 2787521123:2787521127, ack 3131659119, win 85, options [nop,nop,TS val 3792408176 ecr 1097113657], length 4
00:00:17.256844 IP 10.0.0.6.1883 > 10.0.0.8.44998: Flags [P.], seq 2787521127:2787521131, ack 3131659123, win 85, options [nop,nop,TS val 3792408178 ecr 1097113660], length 4
00:00:18.255851 IP 10.0.0.6.1883 > 10.0.0.8.44998: Flags [P.], seq 2787521131:2787521135, ack 3131659518, win 85, options [nop,nop,TS val 3792409177 ecr 1097114659], length 4
00:00:18.256776 IP 10.0.0.6.1883 > 10.0.0.8.44998: Flags [P.], seq 2787521135:2787521139, ack 3131659522, win 85, options [nop,nop,TS val 3792409178 ecr 1097114660], length 4
00:00:19.090564 IP 10.0.0.6.1883 > 10.0.0.8.44998: Flags [P.], seq 2787521139:2787521141, ack 3131659524, win 85, options [nop,nop,TS val 3792410012 ecr 1097115493], length 2
00:00:19.257086 IP 10.0.0.6.1883 > 10.0.0.8.44998: Flags [P.], seq 2787521141:2787521145, ack 3131659919, win 85, options [nop,nop,TS val 3792410178 ecr 1097115659], length 4
00:00:19.258688 IP 10.0.0.6.1883 > 10.0.0.8.44998: Flags [P.], seq 2787521145:2787521149, ack 3131659923, win 85, options [nop,nop,TS val 3792410180 ecr 1097115662], length 4
00:00:20.257964 IP 10.0.0.6.1883 > 10.0.0.8.44998: Flags [P.], seq 2787521149:2787521153, ack 3131660318, win 85, options [nop,nop,TS val 3792411179 ecr 1097116661], length 4
00:00:20.258629 IP 10.0.0.6.1883 > 10.0.0.8.44998: Flags [P.], seq 2787521153:2787521157, ack 3131660322, win 85, options [nop,nop,TS val 3792411180 ecr 1097116662], length 4
00:00:21.259489 IP 10.0.0.6.1883 > 10.0.0.8.44998: Flags [P.], seq 2787521157:2787521161, ack 3131660717, win 85, options [nop,nop,TS val 3792412181 ecr 1097117662], length 4
00:00:21.261374 IP 10.0.0.6.1883 > 10.0.0.8.44998: Flags [P.], seq 2787521161:2787521165, ack 3131660721, win 85, options [nop,nop,TS val 3792412183 ecr 1097117664], length 4
00:00:22.260004 IP 10.0.0.6.1883 > 10.0.0.8.44998: Flags [P.], seq 2787521165:2787521169, ack 3131661116, win 85, options [nop,nop,TS val 3792413181 ecr 1097118662], length 4
00:00:22.261829 IP 10.0.0.6.1883 > 10.0.0.8.44998: Flags [P.], seq 2787521169:2787521173, ack 3131661120, win 85, options [nop,nop,TS val 3792413183 ecr 1097118665], length 4
00:00:23.261819 IP 10.0.0.6.1883 > 10.0.0.8.44998: Flags [P.], seq 2787521173:2787521177, ack 3131661515, win 85, options [nop,nop,TS val 3792414183 ecr 1097119664], length 4
00:00:23.263284 IP 10.0.0.6.1883 > 10.0.0.8.44998: Flags [P.], seq 2787521177:2787521181, ack 3131661519, win 85, options [nop,nop,TS val 3792414185 ecr 1097119666], length 4
00:00:24.092806 IP 10.0.0.6.1883 > 10.0.0.8.44998: Flags [P.], seq 2787521181:2787521183, ack 3131661521, win 85, options [nop,nop,TS val 3792415014 ecr 1097120495], length 2
00:00:24.264108 IP 10.0.0.6.1883 > 10.0.0.8.44998: Flags [P.], seq 2787521183:2787521187, ack 3131661916, win 85, options [nop,nop,TS val 3792415185 ecr 1097120666], length 4
00:00:24.267412 IP 10.0.0.6.1883 > 10.0.0.8.44998: Flags [P.], seq 2787521187:2787521191, ack 3131661920, win 85, options [nop,nop,TS val 3792415189 ecr 1097120668], length 4
00:00:25.264660 IP 10.0.0.6.1883 > 10.0.0.8.44998: Flags [P.], seq 2787521191:2787521195, ack 3131662315, win 85, options [nop,nop,TS val 3792416186 ecr 1097121667], length 4
00:00:25.266989 IP 10.0.0.6.1883 > 10.0.0.8.44998: Flags [P.], seq 2787521195:2787521199, ack 3131662319, win 85, options [nop,nop,TS val 3792416188 ecr 1097121669], length 4
00:00:26.266269 IP 10.0.0.6.1883 > 10.0.0.8.44998: Flags [P.], seq 2787521199:2787521203, ack 3131662714, win 85, options [nop,nop,TS val 3792417187 ecr 1097122668], length 4
00:00:26.268235 IP 10.0.0.6.1883 > 10.0.0.8.44998: Flags [P.], seq 2787521203:2787521207, ack 3131662718, win 85, options [nop,nop,TS val 3792417189 ecr 1097122671], length 4
00:00:27.266619 IP 10.0.0.6.1883 > 10.0.0.8.44998: Flags [P.], seq 2787521207:2787521211, ack 3131663113, win 85, options [nop,nop,TS val 3792418188 ecr 1097123670], length 4
00:00:27.267390 IP 10.0.0.6.1883 > 10.0.0.8.44998: Flags [P.], seq 2787521211:2787521215, ack 3131663117, win 85, options [nop,nop,TS val 3792418189 ecr 1097123670], length 4
00:00:28.268439 IP 10.0.0.6.1883 > 10.0.0.8.44998: Flags [P.], seq 2787521215:2787521219, ack 3131663512, win 85, options [nop,nop,TS val 3792419190 ecr 1097124670], length 4
00:00:28.270175 IP 10.0.0.6.1883 > 10.0.0.8.44998: Flags [P.], seq 2787521219:2787521223, ack 3131663516, win 85, options [nop,nop,TS val 3792419192 ecr 1097124673], length 4
00:00:29.095342 IP 10.0.0.6.1883 > 10.0.0.8.44998: Flags [P.], seq 2787521223:2787521225, ack 3131663518, win 85, options [nop,nop,TS val 3792420017 ecr 1097125498], length 2
00:00:29.268697 IP 10.0.0.6.1883 > 10.0.0.8.44998: Flags [P.], seq 2787521225:2787521229, ack 3131663913, win 85, options [nop,nop,TS val 3792420190 ecr 1097125672], length 4
00:00:29.269466 IP 10.0.0.6.1883 > 10.0.0.8.44998: Flags [P.], seq 2787521229:2787521233, ack 3131663917, win 85, options [nop,nop,TS val 3792420191 ecr 1097125673], length 4
00:00:30.271062 IP 10.0.0.6.1883 > 10.0.0.8.44998: Flags [P.], seq 2787521233:2787521237, ack 3131664312, win 85, options [nop,nop,TS val 3792421192 ecr 1097126673], length 4
00:00:30.273423 IP 10.0.0.6.1883 > 10.0.0.8.44998: Flags [P.], seq 2787521237:2787521241, ack 3131664316, win 85, options [nop,nop,TS val 3792421195 ecr 1097126675], length 4
00:00:31.273084 IP 10.0.0.6.1883 > 10.0.0.8.44998: Flags [P.], seq 2787521241:2787521245, ack 3131664711, win 85, options [nop,nop,TS val 3792422194 ecr 1097127675], length 4
00:00:31.274775 IP 10.0.0.6.1883 > 10.0.0.8.44998: Flags [P.], seq 2787521245:2787521249, ack 3131664715, win 85, options [nop,nop,TS val 3792422196 ecr 1097127677], length 4
00:00:32.274527 IP 10.0.0.6.1883 > 10.0.0.8.44998: Flags [P.], seq 2787521249:2787521253, ack 3131665110, win 85, options [nop,nop,TS val 3792423196 ecr 1097128676], length 4
00:00:32.276417 IP 10.0.0.6.1883 > 10.0.0.8.44998: Flags [P.], seq 2787521253:2787521257, ack 3131665114, win 85, options [nop,nop,TS val 3792423198 ecr 1097128679], length 4
00:00:33.276061 IP 10.0.0.6.1883 > 10.0.0.8.44998: Flags [P.], seq 2787521257:2787521261, ack 3131665509, win 85, options [nop,nop,TS val 3792424197 ecr 1097129677], length 4
00:00:33.277762 IP 10.0.0.6.1883 > 10.0.0.8.44998: Flags [P.], seq 2787521261:2787521265, ack 3131665513, win 85, options [nop,nop,TS val 3792424199 ecr 1097129680], length 4
00:00:34.098204 IP 10.0.0.6.1883 > 10.0.0.8.44998: Flags [P.], seq 2787521265:2787521267, ack 3131665515, win 85, options [nop,nop,TS val 3792425019 ecr 1097130500], length 2
00:00:34.277605 IP 10.0.0.6.1883 > 10.0.0.8.44998: Flags [P.], seq 2787521267:2787521271, ack 3131665910, win 85, options [nop,nop,TS val 3792425199 ecr 1097130679], length 4
00:00:34.279287 IP 10.0.0.6.1883 > 10.0.0.8.44998: Flags [P.], seq 2787521271:2787521275, ack 3131665914, win 85, options [nop,nop,TS val 3792425201 ecr 1097130682], length 4
00:00:35.278781 IP 10.0.0.6.1883 > 10.0.0.8.44998: Flags [P.], seq 2787521275:2787521279, ack 3131666309, win 85, options [nop,nop,TS val 3792426200 ecr 1097131680], length 4
00:00:35.280460 IP 10.0.0.6.1883 > 10.0.0.8.44998: Flags [P.], seq 2787521279:2787521283, ack 3131666313, win 85, options [nop,nop,TS val 3792426202 ecr 1097131683], length 4
00:00:36.280819 IP 10.0.0.6.1883 > 10.0.0.8.44998: Flags [P.], seq 2787521283:2787521287, ack 3131666708, win 85, options [nop,nop,TS val 3792427202 ecr 1097132682], length 4
00:00:36.282915 IP 10.0.0.6.1883 > 10.0.0.8.44998: Flags [P.], seq 2787521287:2787521291, ack 3131666712, win 85, options [nop,nop,TS val 3792427204 ecr 1097132685], length 4
00:00:37.282095 IP 10.0.0.6.1883 > 10.0.0.8.44998: Flags [P.], seq 2787521291:2787521295, ack 3131667107, win 85, options [nop,nop,TS val 3792428203 ecr 1097133683], length 4
00:00:37.283858 IP 10.0.0.6.1883 > 10.0.0.8.44998: Flags [P.], seq 2787521295:2787521299, ack 3131667111, win 85, options [nop,nop,TS val 3792428205 ecr 1097133686], length 4
00:00:38.283650 IP 10.0.0.6.1883 > 10.0.0.8.44998: Flags [P.], seq 2787521299:2787521303, ack 3131667506, win 85, options [nop,nop,TS val 3792429205 ecr 1097134685], length 4
00:00:38.285433 IP 10.0.0.6.1883 > 10.0.0.8.44998: Flags [P.], seq 2787521303:2787521307, ack 3131667510, win 85, options [nop,nop,TS val 3792429207 ecr 1097134688], length 4
00:00:39.099990 IP 10.0.0.6.1883 > 10.0.0.8.44998: Flags [P.], seq 2787521307:2787521309, ack 3131667512, win 85, options [nop,nop,TS val 3792430021 ecr 1097135502], length 2
00:00:39.284705 IP 10.0.0.6.1883 > 10.0.0.8.44998: Flags [P.], seq 2787521309:2787521313, ack 3131667907, win 85, options [nop,nop,TS val 3792430206 ecr 1097135686], length 4
00:00:39.286762 IP 10.0.0.6.1883 > 10.0.0.8.44998: Flags [P.], seq 2787521313:2787521317, ack 3131667911, win 85, options [nop,nop,TS val 3792430208 ecr 1097135689], length 4
00:00:40.286432 IP 10.0.0.6.1883 > 10.0.0.8.44998: Flags [P.], seq 2787521317:2787521321, ack 3131668306, win 85, options [nop,nop,TS val 3792431208 ecr 1097136687], length 4
00:00:40.287659 IP 10.0.0.6.1883 > 10.0.0.8.44998: Flags [P.], seq 2787521321:2787521325, ack 3131668310, win 85, options [nop,nop,TS val 3792431209 ecr 1097136690], length 4
00:00:41.285756 IP 10.0.0.6.1883 > 10.0.0.8.44998: Flags [P.], seq 2787521325:2787521329, ack 3131668705, win 85, options [nop,nop,TS val 3792432207 ecr 1097137689], length 4
00:00:41.286457 IP 10.0.0.6.1883 > 10.0.0.8.44998: Flags [P.], seq 2787521329:2787521333, ack 3131668709, win 85, options [nop,nop,TS val 3792432208 ecr 1097137690], length 4
00:00:42.286878 IP 10.0.0.6.1883 > 10.0.0.8.44998: Flags [P.], seq 2787521333:2787521337, ack 3131669104, win 85, options [nop,nop,TS val 3792433208 ecr 1097138689], length 4
00:00:42.289011 IP 10.0.0.6.1883 > 10.0.0.8.44998: Flags [P.], seq 2787521337:2787521341, ack 3131669108, win 85, options [nop,nop,TS val 3792433210 ecr 1097138692], length 4
00:00:43.289156 IP 10.0.0.6.1883 > 10.0.0.8.44998: Flags [P.], seq 2787521341:2787521345, ack 3131669503, win 85, options [nop,nop,TS val 3792434210 ecr 1097139692], length 4
00:00:43.291549 IP 10.0.0.6.1883 > 10.0.0.8.44998: Flags [P.], seq 2787521345:2787521349, ack 3131669507, win 85, options [nop,nop,TS val 3792434213 ecr 1097139694], length 4
00:00:44.103706 IP 10.0.0.6.1883 > 10.0.0.8.44998: Flags [P.], seq 2787521349:2787521351, ack 3131669509, win 85, options [nop,nop,TS val 3792435025 ecr 1097140504], length 2
00:00:44.292555 IP 10.0.0.6.1883 > 10.0.0.8.44998: Flags [P.], seq 2787521351:2787521355, ack 3131669904, win 85, options [nop,nop,TS val 3792435214 ecr 1097140693], length 4
00:00:44.295775 IP 10.0.0.6.1883 > 10.0.0.8.44998: Flags [P.], seq 2787521355:2787521359, ack 3131669908, win 85, options [nop,nop,TS val 3792435217 ecr 1097140696], length 4
00:00:45.294826 IP 10.0.0.6.1883 > 10.0.0.8.44998: Flags [P.], seq 2787521359:2787521363, ack 3131670303, win 85, options [nop,nop,TS val 3792436216 ecr 1097141696], length 4
00:00:45.298207 IP 10.0.0.6.1883 > 10.0.0.8.44998: Flags [P.], seq 2787521363:2787521367, ack 3131670307, win 85, options [nop,nop,TS val 3792436220 ecr 1097141699], length 4
00:00:46.296699 IP 10.0.0.6.1883 > 10.0.0.8.44998: Flags [P.], seq 2787521367:2787521371, ack 3131670702, win 85, options [nop,nop,TS val 3792437218 ecr 1097142697], length 4
00:00:46.299484 IP 10.0.0.6.1883 > 10.0.0.8.44998: Flags [P.], seq 2787521371:2787521375, ack 3131670706, win 85, options [nop,nop,TS val 3792437221 ecr 1097142701], length 4
00:00:47.297726 IP 10.0.0.6.1883 > 10.0.0.8.44998: Flags [P.], seq 2787521375:2787521379, ack 3131671101, win 85, options [nop,nop,TS val 3792438219 ecr 1097143698], length 4
00:00:47.300623 IP 10.0.0.6.1883 > 10.0.0.8.44998: Flags [P.], seq 2787521379:2787521383, ack 3131671105, win 85, options [nop,nop,TS val 3792438222 ecr 1097143702], length 4
00:00:48.299890 IP 10.0.0.6.1883 > 10.0.0.8.44998: Flags [P.], seq 2787521383:2787521387, ack 3131671500, win 85, options [nop,nop,TS val 3792439221 ecr 1097144700], length 4
00:00:48.302346 IP 10.0.0.6.1883 > 10.0.0.8.44998: Flags [P.], seq 2787521387:2787521391, ack 3131671504, win 85, options [nop,nop,TS val 3792439224 ecr 1097144704], length 4
00:00:49.103220 IP 10.0.0.6.1883 > 10.0.0.8.44998: Flags [P.], seq 2787521391:2787521393, ack 3131671506, win 85, options [nop,nop,TS val 3792440025 ecr 1097145504], length 2
00:00:49.299740 IP 10.0.0.6.1883 > 10.0.0.8.44998: Flags [P.], seq 2787521393:2787521397, ack 3131671901, win 85, options [nop,nop,TS val 3792440221 ecr 1097145701], length 4
00:00:49.304146 IP 10.0.0.6.1883 > 10.0.0.8.44998: Flags [P.], seq 2787521397:2787521401, ack 3131671905, win 85, options [nop,nop,TS val 3792440225 ecr 1097145704], length 4
00:00:50.301732 IP 10.0.0.6.1883 > 10.0.0.8.44998: Flags [P.], seq 2787521401:2787521405, ack 3131672300, win 85, options [nop,nop,TS val 3792441223 ecr 1097146702], length 4
00:00:50.305010 IP 10.0.0.6.1883 > 10.0.0.8.44998: Flags [P.], seq 2787521405:2787521409, ack 3131672304, win 85, options [nop,nop,TS val 3792441226 ecr 1097146706], length 4
00:00:51.302468 IP 10.0.0.6.1883 > 10.0.0.8.44998: Flags [P.], seq 2787521409:2787521413, ack 3131672699, win 85, options [nop,nop,TS val 3792442224 ecr 1097147703], length 4
00:00:51.304705 IP 10.0.0.6.1883 > 10.0.0.8.44998: Flags [P.], seq 2787521413:2787521417, ack 3131672703, win 85, options [nop,nop,TS val 3792442226 ecr 1097147706], length 4
00:00:52.303550 IP 10.0.0.6.1883 > 10.0.0.8.44998: Flags [P.], seq 2787521417:2787521421, ack 3131673098, win 85, options [nop,nop,TS val 3792443225 ecr 1097148703], length 4
00:00:52.306239 IP 10.0.0.6.1883 > 10.0.0.8.44998: Flags [P.], seq 2787521421:2787521425, ack 3131673102, win 85, options [nop,nop,TS val 3792443227 ecr 1097148707], length 4
00:00:53.303603 IP 10.0.0.6.1883 > 10.0.0.8.44998: Flags [P.], seq 2787521425:2787521429, ack 3131673497, win 85, options [nop,nop,TS val 3792444225 ecr 1097149704], length 4
00:00:53.306466 IP 10.0.0.6.1883 > 10.0.0.8.44998: Flags [P.], seq 2787521429:2787521433, ack 3131673501, win 85, options [nop,nop,TS val 3792444227 ecr 1097149708], length 4
00:00:54.105946 IP 10.0.0.6.1883 > 10.0.0.8.44998: Flags [P.], seq 2787521433:2787521435, ack 3131673503, win 85, options [nop,nop,TS val 3792445027 ecr 1097150506], length 2
00:00:54.305524 IP 10.0.0.6.1883 > 10.0.0.8.44998: Flags [P.], seq 2787521435:2787521439, ack 3131673898, win 85, options [nop,nop,TS val 3792445227 ecr 1097150706], length 4
00:00:54.308451 IP 10.0.0.6.1883 > 10.0.0.8.44998: Flags [P.], seq 2787521439:2787521443, ack 3131673902, win 85, options [nop,nop,TS val 3792445230 ecr 1097150709], length 4
00:00:55.307049 IP 10.0.0.6.1883 > 10.0.0.8.44998: Flags [P.], seq 2787521443:2787521447, ack 3131674297, win 85, options [nop,nop,TS val 3792446228 ecr 1097151708], length 4
00:00:55.309841 IP 10.0.0.6.1883 > 10.0.0.8.44998: Flags [P.], seq 2787521447:2787521451, ack 3131674301, win 85, options [nop,nop,TS val 3792446231 ecr 1097151711], length 4
00:00:56.309482 IP 10.0.0.6.1883 > 10.0.0.8.44998: Flags [P.], seq 2787521451:2787521455, ack 3131674696, win 85, options [nop,nop,TS val 3792447231 ecr 1097152710], length 4
00:00:56.312665 IP 10.0.0.6.1883 > 10.0.0.8.44998: Flags [P.], seq 2787521455:2787521459, ack 3131674700, win 85, options [nop,nop,TS val 3792447234 ecr 1097152713], length 4
00:00:57.310643 IP 10.0.0.6.1883 > 10.0.0.8.44998: Flags [P.], seq 2787521459:2787521463, ack 3131675095, win 85, options [nop,nop,TS val 3792448232 ecr 1097153711], length 4
00:00:57.313350 IP 10.0.0.6.1883 > 10.0.0.8.44998: Flags [P.], seq 2787521463:2787521467, ack 3131675099, win 85, options [nop,nop,TS val 3792448234 ecr 1097153714], length 4
00:00:58.315230 IP 10.0.0.6.1883 > 10.0.0.8.44998: Flags [P.], seq 2787521467:2787521471, ack 3131675494, win 85, options [nop,nop,TS val 3792449237 ecr 1097154716], length 4
00:00:58.318017 IP 10.0.0.6.1883 > 10.0.0.8.44998: Flags [P.], seq 2787521471:2787521475, ack 3131675498, win 85, options [nop,nop,TS val 3792449239 ecr 1097154719], length 4
00:00:59.106569 IP 10.0.0.6.1883 > 10.0.0.8.44998: Flags [P.], seq 2787521475:2787521477, ack 3131675500, win 85, options [nop,nop,TS val 3792450028 ecr 1097155508], length 2
00:00:59.316542 IP 10.0.0.6.1883 > 10.0.0.8.44998: Flags [P.], seq 2787521477:2787521481, ack 3131675895, win 85, options [nop,nop,TS val 3792450238 ecr 1097155717], length 4
00:00:59.319344 IP 10.0.0.6.1883 > 10.0.0.8.44998: Flags [P.], seq 2787521481:2787521485, ack 3131675899, win 85, options [nop,nop,TS val 3792450240 ecr 1097155720], length 4
00:01:00.317718 IP 10.0.0.6.1883 > 10.0.0.8.44998: Flags [P.], seq 2787521485:2787521489, ack 3131676294, win 85, options [nop,nop,TS val 3792451239 ecr 1097156718], length 4
00:01:00.321093 IP 10.0.0.6.1883 > 10.0.0.8.44998: Flags [P.], seq 2787521489:2787521493, ack 3131676298, win 85, options [nop,nop,TS val 3792451242 ecr 1097156722], length 4
00:01:01.318682 IP 10.0.0.6.1883 > 10.0.0.8.44998: Flags [P.], seq 2787521493:2787521497, ack 3131676693, win 85, options [nop,nop,TS val 3792452240 ecr 1097157720], length 4
00:01:01.321328 IP 10.0.0.6.1883 > 10.0.0.8.44998: Flags [P.], seq 2787521497:2787521501, ack 3131676697, win 85, options [nop,nop,TS val 3792452242 ecr 1097157723], length 4
00:01:02.319998 IP 10.0.0.6.1883 > 10.0.0.8.44998: Flags [P.], seq 2787521501:2787521505, ack 3131677092, win 85, options [nop,nop,TS val 3792453241 ecr 1097158721], length 4
00:01:02.322217 IP 10.0.0.6.1883 > 10.0.0.8.44998: Flags [P.], seq 2787521505:2787521509, ack 3131677096, win 85, options [nop,nop,TS val 3792453244 ecr 1097158724], length 4
00:01:03.320425 IP 10.0.0.6.1883 > 10.0.0.8.44998: Flags [P.], seq 2787521509:2787521513, ack 3131677491, win 85, options [nop,nop,TS val 3792454242 ecr 1097159722], length 4
00:01:03.321943 IP 10.0.0.6.1883 > 10.0.0.8.44998: Flags [P.], seq 2787521513:2787521517, ack 3131677495, win 85, options [nop,nop,TS val 3792454243 ecr 1097159725], length 4
00:01:04.106441 IP 10.0.0.6.1883 > 10.0.0.8.44998: Flags [P.], seq 2787521517:2787521519, ack 3131677497, win 85, options [nop,nop,TS val 3792455028 ecr 1097160509], length 2
00:01:04.320641 IP 10.0.0.6.1883 > 10.0.0.8.44998: Flags [P.], seq 2787521519:2787521523, ack 3131677892, win 85, options [nop,nop,TS val 3792455242 ecr 1097160723], length 4
00:01:04.322105 IP 10.0.0.6.1883 > 10.0.0.8.44998: Flags [P.], seq 2787521523:2787521527, ack 3131677896, win 85, options [nop,nop,TS val 3792455244 ecr 1097160725], length 4
00:01:05.321749 IP 10.0.0.6.1883 > 10.0.0.8.44998: Flags [P.], seq 2787521527:2787521531, ack 3131678291, win 85, options [nop,nop,TS val 3792456243 ecr 1097161724], length 4
00:01:05.323361 IP 10.0.0.6.1883 > 10.0.0.8.44998: Flags [P.], seq 2787521531:2787521535, ack 3131678295, win 85, options [nop,nop,TS val 3792456245 ecr 1097161726], length 4
00:01:06.323017 IP 10.0.0.6.1883 > 10.0.0.8.44998: Flags [P.], seq 2787521535:2787521539, ack 3131678690, win 85, options [nop,nop,TS val 3792457244 ecr 1097162725], length 4
00:01:06.325191 IP 10.0.0.6.1883 > 10.0.0.8.44998: Flags [P.], seq 2787521539:2787521543, ack 3131678694, win 85, options [nop,nop,TS val 3792457247 ecr 1097162728], length 4
00:01:07.324848 IP 10.0.0.6.1883 > 10.0.0.8.44998: Flags [P.], seq 2787521543:2787521547, ack 3131679089, win 85, options [nop,nop,TS val 3792458246 ecr 1097163727], length 4
00:01:07.326632 IP 10.0.0.6.1883 > 10.0.0.8.44998: Flags [P.], seq 2787521547:2787521551, ack 3131679093, win 85, options [nop,nop,TS val 3792458248 ecr 1097163729], length 4
00:01:08.326180 IP 10.0.0.6.1883 > 10.0.0.8.44998: Flags [P.], seq 2787521551:2787521555, ack 3131679488, win 85, options [nop,nop,TS val 3792459248 ecr 1097164729], length 4
00:01:08.327513 IP 10.0.0.6.1883 > 10.0.0.8.44998: Flags [P.], seq 2787521555:2787521559, ack 3131679492, win 85, options [nop,nop,TS val 3792459249 ecr 1097164730], length 4
00:01:09.107836 IP 10.0.0.6.1883 > 10.0.0.8.44998: Flags [P.], seq 2787521559:2787521561, ack 3131679494, win 85, options [nop,nop,TS val 3792460029 ecr 1097165510], length 2
00:01:09.327809 IP 10.0.0.6.1883 > 10.0.0.8.44998: Flags [P.], seq 2787521561:2787521565, ack 3131679889, win 85, options [nop,nop,TS val 3792460249 ecr 1097165730], length 4
00:01:09.329414 IP 10.0.0.6.1883 > 10.0.0.8.44998: Flags [P.], seq 2787521565:2787521569, ack 3131679893, win 85, options [nop,nop,TS val 3792460251 ecr 1097165732], length 4
00:01:10.328563 IP 10.0.0.6.1883 > 10.0.0.8.44998: Flags [P.], seq 2787521569:2787521573, ack 3131680288, win 85, options [nop,nop,TS val 3792461250 ecr 1097166731], length 4
00:01:10.330086 IP 10.0.0.6.1883 > 10.0.0.8.44998: Flags [P.], seq 2787521573:2787521577, ack 3131680292, win 85, options [nop,nop,TS val 3792461251 ecr 1097166733], length 4
00:01:11.329976 IP 10.0.0.6.1883 > 10.0.0.8.44998: Flags [P.], seq 2787521577:2787521581, ack 3131680687, win 85, options [nop,nop,TS val 3792462251 ecr 1097167732], length 4
00:01:11.331540 IP 10.0.0.6.1883 > 10.0.0.8.44998: Flags [P.], seq 2787521581:2787521585, ack 3131680691, win 85, options [nop,nop,TS val 3792462253 ecr 1097167734], length 4
00:01:12.331501 IP 10.0.0.6.1883 > 10.0.0.8.44998: Flags [P.], seq 2787521585:2787521589, ack 3131681086, win 85, options [nop,nop,TS val 3792463253 ecr 1097168734], length 4
00:01:12.332979 IP 10.0.0.6.1883 > 10.0.0.8.44998: Flags [P.], seq 2787521589:2787521593, ack 3131681090, win 85, options [nop,nop,TS val 3792463254 ecr 1097168736], length 4
00:01:13.332331 IP 10.0.0.6.1883 > 10.0.0.8.44998: Flags [P.], seq 2787521593:2787521597, ack 3131681485, win 85, options [nop,nop,TS val 3792464254 ecr 1097169735], length 4
00:01:13.333965 IP 10.0.0.6.1883 > 10.0.0.8.44998: Flags [P.], seq 2787521597:2787521601, ack 3131681489, win 85, options [nop,nop,TS val 3792464255 ecr 1097169736], length 4
00:01:14.110081 IP 10.0.0.6.1883 > 10.0.0.8.44998: Flags [P.], seq 2787521601:2787521603, ack 3131681491, win 85, options [nop,nop,TS val 3792465031 ecr 1097170512], length 2
00:01:14.334674 IP 10.0.0.6.1883 > 10.0.0.8.44998: Flags [P.], seq 2787521603:2787521607, ack 3131681886, win 85, options [nop,nop,TS val 3792465256 ecr 1097170736], length 4
00:01:14.336437 IP 10.0.0.6.1883 > 10.0.0.8.44998: Flags [P.], seq 2787521607:2787521611, ack 3131681890, win 85, options [nop,nop,TS val 3792465258 ecr 1097170739], length 4
00:01:15.336733 IP 10.0.0.6.1883 > 10.0.0.8.44998: Flags [P.], seq 2787521611:2787521615, ack 3131682285, win 85, options [nop,nop,TS val 3792466258 ecr 1097171738], length 4
00:01:15.338335 IP 10.0.0.6.1883 > 10.0.0.8.44998: Flags [P.], seq 2787521615:2787521619, ack 3131682289, win 85, options [nop,nop,TS val 3792466260 ecr 1097171741], length 4
00:01:16.337807 IP 10.0.0.6.1883 > 10.0.0.8.44998: Flags [P.], seq 2787521619:2787521623, ack 3131682684, win 85, options [nop,nop,TS val 3792467259 ecr 1097172740], length 4
00:01:16.339553 IP 10.0.0.6.1883 > 10.0.0.8.44998: Flags [P.], seq 2787521623:2787521627, ack 3131682688, win 85, options [nop,nop,TS val 3792467261 ecr 1097172742], length 4
00:01:17.339483 IP 10.0.0.6.1883 > 10.0.0.8.44998: Flags [P.], seq 2787521627:2787521631, ack 3131683083, win 85, options [nop,nop,TS val 3792468261 ecr 1097173742], length 4
00:01:17.341241 IP 10.0.0.6.1883 > 10.0.0.8.44998: Flags [P.], seq 2787521631:2787521635, ack 3131683087, win 85, options [nop,nop,TS val 3792468263 ecr 1097173744], length 4
00:01:18.340848 IP 10.0.0.6.1883 > 10.0.0.8.44998: Flags [P.], seq 2787521635:2787521639, ack 3131683482, win 85, options [nop,nop,TS val 3792469262 ecr 1097174743], length 4
00:01:18.342741 IP 10.0.0.6.1883 > 10.0.0.8.44998: Flags [P.], seq 2787521639:2787521643, ack 3131683486, win 85, options [nop,nop,TS val 3792469264 ecr 1097174745], length 4
00:01:19.110788 IP 10.0.0.6.1883 > 10.0.0.8.44998: Flags [P.], seq 2787521643:2787521645, ack 3131683488, win 85, options [nop,nop,TS val 3792470032 ecr 1097175513], length 2
00:01:19.342411 IP 10.0.0.6.1883 > 10.0.0.8.44998: Flags [P.], seq 2787521645:2787521649, ack 3131683883, win 85, options [nop,nop,TS val 3792470264 ecr 1097175745], length 4
00:01:19.344391 IP 10.0.0.6.1883 > 10.0.0.8.44998: Flags [P.], seq 2787521649:2787521653, ack 3131683887, win 85, options [nop,nop,TS val 3792470266 ecr 1097175747], length 4
00:01:20.342905 IP 10.0.0.6.1883 > 10.0.0.8.44998: Flags [P.], seq 2787521653:2787521657, ack 3131684282, win 85, options [nop,nop,TS val 3792471264 ecr 1097176746], length 4
00:01:20.343589 IP 10.0.0.6.1883 > 10.0.0.8.44998: Flags [P.], seq 2787521657:2787521661, ack 3131684286, win 85, options [nop,nop,TS val 3792471265 ecr 1097176747], length 4
00:01:21.344311 IP 10.0.0.6.1883 > 10.0.0.8.44998: Flags [P.], seq 2787521661:2787521665, ack 3131684681, win 85, options [nop,nop,TS val 3792472266 ecr 1097177746], length 4
00:01:21.346130 IP 10.0.0.6.1883 > 10.0.0.8.44998: Flags [P.], seq 2787521665:2787521669, ack 3131684685, win 85, options [nop,nop,TS val 3792472268 ecr 1097177749], length 4
00:01:22.345880 IP 10.0.0.6.1883 > 10.0.0.8.44998: Flags [P.], seq 2787521669:2787521673, ack 3131685080, win 85, options [nop,nop,TS val 3792473267 ecr 1097178748], length 4
00:01:22.347780 IP 10.0.0.6.1883 > 10.0.0.8.44998: Flags [P.], seq 2787521673:2787521677, ack 3131685084, win 85, options [nop,nop,TS val 3792473269 ecr 1097178750], length 4
00:01:23.347629 IP 10.0.0.6.1883 > 10.0.0.8.44998: Flags [P.], seq 2787521677:2787521681, ack 3131685479, win 85, options [nop,nop,TS val 3792474269 ecr 1097179750], length 4
00:01:23.349370 IP 10.0.0.6.1883 > 10.0.0.8.44998: Flags [P.], seq 2787521681:2787521685, ack 3131685483, win 85, options [nop,nop,TS val 3792474271 ecr 1097179752], length 4
00:01:24.112886 IP 10.0.0.6.1883 > 10.0.0.8.44998: Flags [P.], seq 2787521685:2787521687, ack 3131685485, win 85, options [nop,nop,TS val 3792475034 ecr 1097180515], length 2
00:01:24.348764 IP 10.0.0.6.1883 > 10.0.0.8.44998: Flags [P.], seq 2787521687:2787521691, ack 3131685880, win 85, options [nop,nop,TS val 3792475270 ecr 1097180751], length 4
00:01:24.350364 IP 10.0.0.6.1883 > 10.0.0.8.44998: Flags [P.], seq 2787521691:2787521695, ack 3131685884, win 85, options [nop,nop,TS val 3792475272 ecr 1097180753], length 4
00:01:25.349366 IP 10.0.0.6.1883 > 10.0.0.8.44998: Flags [P.], seq 2787521695:2787521699, ack 3131686279, win 85, options [nop,nop,TS val 3792476271 ecr 1097181752], length 4
00:01:25.350757 IP 10.0.0.6.1883 > 10.0.0.8.44998: Flags [P.], seq 2787521699:2787521703, ack 3131686283, win 85, options [nop,nop,TS val 3792476272 ecr 1097181754], length 4
00:01:26.350291 IP 10.0.0.6.1883 > 10.0.0.8.44998: Flags [P.], seq 2787521703:2787521707, ack 3131686678, win 85, options [nop,nop,TS val 3792477272 ecr 1097182753], length 4
00:01:26.352365 IP 10.0.0.6.1883 > 10.0.0.8.44998: Flags [P.], seq 2787521707:2787521711, ack 3131686682, win 85, options [nop,nop,TS val 3792477274 ecr 1097182755], length 4
00:01:27.351805 IP 10.0.0.6.1883 > 10.0.0.8.44998: Flags [P.], seq 2787521711:2787521715, ack 3131687077, win 85, options [nop,nop,TS val 3792478273 ecr 1097183754], length 4
00:01:27.353318 IP 10.0.0.6.1883 > 10.0.0.8.44998: Flags [P.], seq 2787521715:2787521719, ack 3131687081, win 85, options [nop,nop,TS val 3792478275 ecr 1097183756], length 4
00:01:28.353464 IP 10.0.0.6.1883 > 10.0.0.8.44998: Flags [P.], seq 2787521719:2787521723, ack 3131687476, win 85, options [nop,nop,TS val 3792479275 ecr 1097184756], length 4
00:01:28.356045 IP 10.0.0.6.1883 > 10.0.0.8.44998: Flags [P.], seq 2787521723:2787521727, ack 3131687480, win 85, options [nop,nop,TS val 3792479277 ecr 1097184758], length 4
00:01:29.114014 IP 10.0.0.6.1883 > 10.0.0.8.44998: Flags [P.], seq 2787521727:2787521729, ack 3131687482, win 85, options [nop,nop,TS val 3792480035 ecr 1097185517], length 2
00:01:29.355953 IP 10.0.0.6.1883 > 10.0.0.8.44998: Flags [P.], seq 2787521729:2787521733, ack 3131687877, win 85, options [nop,nop,TS val 3792480277 ecr 1097185758], length 4
00:01:29.357476 IP 10.0.0.6.1883 > 10.0.0.8.44998: Flags [P.], seq 2787521733:2787521737, ack 3131687881, win 85, options [nop,nop,TS val 3792480279 ecr 1097185760], length 4
00:01:30.357009 IP 10.0.0.6.1883 > 10.0.0.8.44998: Flags [P.], seq 2787521737:2787521741, ack 3131688276, win 85, options [nop,nop,TS val 3792481278 ecr 1097186759], length 4
00:01:30.358777 IP 10.0.0.6.1883 > 10.0.0.8.44998: Flags [P.], seq 2787521741:2787521745, ack 3131688280, win 85, options [nop,nop,TS val 3792481280 ecr 1097186762], length 4
00:01:31.363425 IP 10.0.0.6.1883 > 10.0.0.8.44998: Flags [P.], seq 2787521745:2787521749, ack 3131688675, win 85, options [nop,nop,TS val 3792482281 ecr 1097187761], length 4
00:01:31.518326 IP 10.0.0.6.1883 > 10.0.0.8.44998: Flags [P.], seq 2787521749:2787521753, ack 3131688679, win 85, options [nop,nop,TS val 3792482440 ecr 1097187920], length 4
00:01:32.705011 IP 10.0.0.6.1883 > 10.0.0.8.44998: Flags [P.], seq 2787521753:2787521757, ack 3131689074, win 85, options [nop,nop,TS val 3792483599 ecr 1097189077], length 4
00:01:32.730726 IP 10.0.0.6.1883 > 10.0.0.8.44998: Flags [P.], seq 2787521757:2787521761, ack 3131689078, win 85, options [nop,nop,TS val 3792483652 ecr 1097189132], length 4
00:01:33.706592 IP 10.0.0.6.1883 > 10.0.0.8.44998: Flags [P.], seq 2787521761:2787521765, ack 3131689473, win 85, options [nop,nop,TS val 3792484628 ecr 1097190107], length 4
00:01:33.708072 IP 10.0.0.6.1883 > 10.0.0.8.44998: Flags [P.], seq 2787521765:2787521769, ack 3131689477, win 85, options [nop,nop,TS val 3792484629 ecr 1097190111], length 4
00:01:34.115664 IP 10.0.0.6.1883 > 10.0.0.8.44998: Flags [P.], seq 2787521769:2787521771, ack 3131689479, win 85, options [nop,nop,TS val 3792485037 ecr 1097190518], length 2
00:01:34.710674 IP 10.0.0.6.1883 > 10.0.0.8.44998: Flags [P.], seq 2787521771:2787521775, ack 3131689874, win 85, options [nop,nop,TS val 3792485631 ecr 1097191111], length 4
00:01:34.714530 IP 10.0.0.6.1883 > 10.0.0.8.44998: Flags [P.], seq 2787521775:2787521779, ack 3131689878, win 85, options [nop,nop,TS val 3792485636 ecr 1097191115], length 4
00:01:35.709521 IP 10.0.0.6.1883 > 10.0.0.8.44998: Flags [P.], seq 2787521779:2787521783, ack 3131690273, win 85, options [nop,nop,TS val 3792486631 ecr 1097192112], length 4
00:01:35.711443 IP 10.0.0.6.1883 > 10.0.0.8.44998: Flags [P.], seq 2787521783:2787521787, ack 3131690277, win 85, options [nop,nop,TS val 3792486633 ecr 1097192114], length 4
00:01:36.710739 IP 10.0.0.6.1883 > 10.0.0.8.44998: Flags [P.], seq 2787521787:2787521791, ack 3131690672, win 85, options [nop,nop,TS val 3792487632 ecr 1097193113], length 4
00:01:36.712570 IP 10.0.0.6.1883 > 10.0.0.8.44998: Flags [P.], seq 2787521791:2787521795, ack 3131690676, win 85, options [nop,nop,TS val 3792487634 ecr 1097193115], length 4
00:01:37.711454 IP 10.0.0.6.1883 > 10.0.0.8.44998: Flags [P.], seq 2787521795:2787521799, ack 3131691071, win 85, options [nop,nop,TS val 3792488633 ecr 1097194114], length 4
00:01:37.714057 IP 10.0.0.6.1883 > 10.0.0.8.44998: Flags [P.], seq 2787521799:2787521803, ack 3131691075, win 85, options [nop,nop,TS val 3792488635 ecr 1097194116], length 4
00:01:38.712761 IP 10.0.0.6.1883 > 10.0.0.8.44998: Flags [P.], seq 2787521803:2787521807, ack 3131691470, win 85, options [nop,nop,TS val 3792489634 ecr 1097195115], length 4
00:01:38.714777 IP 10.0.0.6.1883 > 10.0.0.8.44998: Flags [P.], seq 2787521807:2787521811, ack 3131691474, win 85, options [nop,nop,TS val 3792489636 ecr 1097195117], length 4
00:01:39.117034 IP 10.0.0.6.1883 > 10.0.0.8.44998: Flags [P.], seq 2787521811:2787521813, ack 3131691476, win 85, options [nop,nop,TS val 3792490038 ecr 1097195520], length 2
00:01:39.714557 IP 10.0.0.6.1883 > 10.0.0.8.44998: Flags [P.], seq 2787521813:2787521817, ack 3131691871, win 85, options [nop,nop,TS val 3792490636 ecr 1097196117], length 4
00:01:39.716214 IP 10.0.0.6.1883 > 10.0.0.8.44998: Flags [P.], seq 2787521817:2787521821, ack 3131691875, win 85, options [nop,nop,TS val 3792490638 ecr 1097196119], length 4
00:01:40.715913 IP 10.0.0.6.1883 > 10.0.0.8.44998: Flags [P.], seq 2787521821:2787521825, ack 3131692270, win 85, options [nop,nop,TS val 3792491637 ecr 1097197118], length 4
00:01:40.717163 IP 10.0.0.6.1883 > 10.0.0.8.44998: Flags [P.], seq 2787521825:2787521829, ack 3131692274, win 85, options [nop,nop,TS val 3792491639 ecr 1097197120], length 4
00:01:41.716616 IP 10.0.0.6.1883 > 10.0.0.8.44998: Flags [P.], seq 2787521829:2787521833, ack 3131692669, win 85, options [nop,nop,TS val 3792492638 ecr 1097198119], length 4
00:01:41.718630 IP 10.0.0.6.1883 > 10.0.0.8.44998: Flags [P.], seq 2787521833:2787521837, ack 3131692673, win 85, options [nop,nop,TS val 3792492640 ecr 1097198121], length 4
00:01:42.717421 IP 10.0.0.6.1883 > 10.0.0.8.44998: Flags [P.], seq 2787521837:2787521841, ack 3131693068, win 85, options [nop,nop,TS val 3792493639 ecr 1097199120], length 4
00:01:42.719453 IP 10.0.0.6.1883 > 10.0.0.8.44998: Flags [P.], seq 2787521841:2787521845, ack 3131693072, win 85, options [nop,nop,TS val 3792493641 ecr 1097199122], length 4
00:01:43.720427 IP 10.0.0.6.1883 > 10.0.0.8.44998: Flags [P.], seq 2787521845:2787521849, ack 3131693467, win 85, options [nop,nop,TS val 3792494642 ecr 1097200120], length 4
00:01:43.721714 IP 10.0.0.6.1883 > 10.0.0.8.44998: Flags [P.], seq 2787521849:2787521853, ack 3131693471, win 85, options [nop,nop,TS val 3792494643 ecr 1097200124], length 4
00:01:44.117939 IP 10.0.0.6.1883 > 10.0.0.8.44998: Flags [P.], seq 2787521853:2787521855, ack 3131693473, win 85, options [nop,nop,TS val 3792495039 ecr 1097200521], length 2
00:01:44.720382 IP 10.0.0.6.1883 > 10.0.0.8.44998: Flags [P.], seq 2787521855:2787521859, ack 3131693868, win 85, options [nop,nop,TS val 3792495642 ecr 1097201123], length 4
00:01:44.722075 IP 10.0.0.6.1883 > 10.0.0.8.44998: Flags [P.], seq 2787521859:2787521863, ack 3131693872, win 85, options [nop,nop,TS val 3792495643 ecr 1097201125], length 4
00:01:45.721353 IP 10.0.0.6.1883 > 10.0.0.8.44998: Flags [P.], seq 2787521863:2787521867, ack 3131694267, win 85, options [nop,nop,TS val 3792496643 ecr 1097202124], length 4
00:01:45.723280 IP 10.0.0.6.1883 > 10.0.0.8.44998: Flags [P.], seq 2787521867:2787521871, ack 3131694271, win 85, options [nop,nop,TS val 3792496645 ecr 1097202126], length 4
00:01:46.724570 IP 10.0.0.6.1883 > 10.0.0.8.44998: Flags [P.], seq 2787521871:2787521875, ack 3131694666, win 85, options [nop,nop,TS val 3792497645 ecr 1097203125], length 4
00:01:46.726545 IP 10.0.0.6.1883 > 10.0.0.8.44998: Flags [P.], seq 2787521875:2787521879, ack 3131694670, win 85, options [nop,nop,TS val 3792497648 ecr 1097203129], length 4
00:01:47.726049 IP 10.0.0.6.1883 > 10.0.0.8.44998: Flags [P.], seq 2787521879:2787521883, ack 3131695065, win 85, options [nop,nop,TS val 3792498647 ecr 1097204127], length 4
00:01:47.727621 IP 10.0.0.6.1883 > 10.0.0.8.44998: Flags [P.], seq 2787521883:2787521887, ack 3131695069, win 85, options [nop,nop,TS val 3792498649 ecr 1097204130], length 4
00:01:48.726229 IP 10.0.0.6.1883 > 10.0.0.8.44998: Flags [P.], seq 2787521887:2787521891, ack 3131695464, win 85, options [nop,nop,TS val 3792499648 ecr 1097205128], length 4
00:01:48.728187 IP 10.0.0.6.1883 > 10.0.0.8.44998: Flags [P.], seq 2787521891:2787521895, ack 3131695468, win 85, options [nop,nop,TS val 3792499650 ecr 1097205130], length 4
00:01:49.119864 IP 10.0.0.6.1883 > 10.0.0.8.44998: Flags [P.], seq 2787521895:2787521897, ack 3131695470, win 85, options [nop,nop,TS val 3792500041 ecr 1097205522], length 2
00:01:52.449940 IP 10.0.0.6.1883 > 10.0.0.8.44998: Flags [F.], seq 2787521897, ack 3131695471, win 85, options [nop,nop,TS val 3792503371 ecr 1097208852], length 0