00:00:09.900566 IP 10.0.0.6.1883 > 10.0.0.8.44970: Flags [S.], seq 2894247760, ack 340581891, win 43440, options [mss 1460,sackOK,TS val 3792201143 ecr 1096906553,nop,wscale 9], length 0
00:00:09.916180 IP 10.0.0.6.1883 > 10.0.0.8.44970: Flags [.], ack 340581911, win 85, options [nop,nop,TS val 3792201160 ecr 1096906636], length 0
00:00:09.919542 IP 10.0.0.6.1883 > 10.0.0.8.44970: Flags [P.], seq 2894247761:2894247765, ack 340581911, win 85, options [nop,nop,TS val 3792201161 ecr 1096906636], length 4
00:00:09.925820 IP 10.0.0.6.1883 > 10.0.0.8.44970: Flags [P.], seq 2894247765:2894247830, ack 340581975, win 85, options [nop,nop,TS val 3792201170 ecr 1096906651], length 65
00:00:09.932210 IP 10.0.0.6.1883 > 10.0.0.8.44970: Flags [P.], seq 2894247830:2894247835, ack 340582370, win 85, options [nop,nop,TS val 3792201176 ecr 1096906658], length 5
00:00:10.033946 IP 10.0.0.6.1883 > 10.0.0.8.44970: Flags [P.], seq 2894247835:2894247839, ack 340582370, win 85, options [nop,nop,TS val 3792201278 ecr 1096906759], length 4
00:00:10.074243 IP 10.0.0.6.1883 > 10.0.0.8.44970: Flags [P.], seq 2894247839:2894247843, ack 340582374, win 85, options [nop,nop,TS val 3792201318 ecr 1096906798], length 4
00:00:10.885887 IP 10.0.0.6.1883 > 10.0.0.8.44970: Flags [P.], seq 2894247843:2894247847, ack 340582769, win 85, options [nop,nop,TS val 3792202130 ecr 1096907610], length 4
00:00:10.888115 IP 10.0.0.6.1883 > 10.0.0.8.44970: Flags [P.], seq 2894247847:2894247851, ack 340582773, win 85, options [nop,nop,TS val 3792202132 ecr 1096907613], length 4
00:00:11.948454 IP 10.0.0.6.1883 > 10.0.0.8.44970: Flags [P.], seq 2894247851:2894247855, ack 340583168, win 85, options [nop,nop,TS val 3792203189 ecr 1096908669], length 4
00:00:11.958158 IP 10.0.0.6.1883 > 10.0.0.8.44970: Flags [P.], seq 2894247855:2894247859, ack 340583172, win 85, options [nop,nop,TS val 3792203202 ecr 1096908682], length 4
00:00:13.166100 IP 10.0.0.6.1883 > 10.0.0.8.44970: Flags [P.], seq 2894247859:2894247863, ack 340583567, win 85, options [nop,nop,TS val 3792204410 ecr 1096909890], length 4
00:00:13.168627 IP 10.0.0.6.1883 > 10.0.0.8.44970: Flags [P.], seq 2894247863:2894247867, ack 340583571, win 85, options [nop,nop,TS val 3792204413 ecr 1096909893], length 4
00:00:14.265910 IP 10.0.0.6.1883 > 10.0.0.8.44970: Flags [P.], seq 2894247867:2894247871, ack 340583966, win 85, options [nop,nop,TS val 3792205509 ecr 1096910990], length 4
00:00:14.268629 IP 10.0.0.6.1883 > 10.0.0.8.44970: Flags [P.], seq 2894247871:2894247875, ack 340583970, win 85, options [nop,nop,TS val 3792205513 ecr 1096910993], length 4
00:00:14.935176 IP 10.0.0.6.1883 > 10.0.0.8.44970: Flags [P.], seq 2894247875:2894247877, ack 340583972, win 85, options [nop,nop,TS val 3792206179 ecr 1096911660], length 2
00:00:15.266730 IP 10.0.0.6.1883 > 10.0.0.8.44970: Flags [P.], seq 2894247877:2894247881, ack 340584367, win 85, options [nop,nop,TS val 3792206511 ecr 1096911992], length 4
00:00:15.268195 IP 10.0.0.6.1883 > 10.0.0.8.44970: Flags [P.], seq 2894247881:2894247885, ack 340584371, win 85, options [nop,nop,TS val 3792206512 ecr 1096911993], length 4
00:00:16.269463 IP 10.0.0.6.1883 > 10.0.0.8.44970: Flags [P.], seq 2894247885:2894247889, ack 340584766, win 85, options [nop,nop,TS val 3792207513 ecr 1096912993], length 4
00:00:16.271582 IP 10.0.0.6.1883 > 10.0.0.8.44970: Flags [P.], seq 2894247889:2894247893, ack 340584770, win 85, options [nop,nop,TS val 3792207516 ecr 1096912996], length 4
00:00:17.269183 IP 10.0.0.6.1883 > 10.0.0.8.44970: Flags [P.], seq 2894247893:2894247897, ack 340585165, win 85, options [nop,nop,TS val 3792208513 ecr 1096913994], length 4
00:00:17.332244 IP 10.0.0.6.1883 > 10.0.0.8.44970: Flags [P.], seq 2894247897:2894247901, ack 340585169, win 85, options [nop,nop,TS val 3792208576 ecr 1096914057], length 4
00:00:18.333822 IP 10.0.0.6.1883 > 10.0.0.8.44970: Flags [P.], seq 2894247901:2894247905, ack 340585564, win 85, options [nop,nop,TS val 3792209578 ecr 1096915059], length 4
00:00:18.335863 IP 10.0.0.6.1883 > 10.0.0.8.44970: Flags [P.], seq 2894247905:2894247909, ack 340585568, win 85, options [nop,nop,TS val 3792209580 ecr 1096915060], length 4
00:00:19.335655 IP 10.0.0.6.1883 > 10.0.0.8.44970: Flags [P.], seq 2894247909:2894247913, ack 340585963, win 85, options [nop,nop,TS val 3792210579 ecr 1096916060], length 4
00:00:19.338421 IP 10.0.0.6.1883 > 10.0.0.8.44970: Flags [P.], seq 2894247913:2894247917, ack 340585967, win 85, options [nop,nop,TS val 3792210582 ecr 1096916063], length 4
00:00:19.937089 IP 10.0.0.6.1883 > 10.0.0.8.44970: Flags [P.], seq 2894247917:2894247919, ack 340585969, win 85, options [nop,nop,TS val 3792211181 ecr 1096916661], length 2
00:00:20.337628 IP 10.0.0.6.1883 > 10.0.0.8.44970: Flags [P.], seq 2894247919:2894247923, ack 340586364, win 85, options [nop,nop,TS val 3792211582 ecr 1096917061], length 4
00:00:20.339508 IP 10.0.0.6.1883 > 10.0.0.8.44970: Flags [P.], seq 2894247923:2894247927, ack 340586368, win 85, options [nop,nop,TS val 3792211583 ecr 1096917064], length 4
00:00:21.337878 IP 10.0.0.6.1883 > 10.0.0.8.44970: Flags [P.], seq 2894247927:2894247931, ack 340586763, win 85, options [nop,nop,TS val 3792212582 ecr 1096918062], length 4
00:00:21.383781 IP 10.0.0.6.1883 > 10.0.0.8.44970: Flags [P.], seq 2894247931:2894247935, ack 340586767, win 85, options [nop,nop,TS val 3792212628 ecr 1096918109], length 4
00:00:22.337079 IP 10.0.0.6.1883 > 10.0.0.8.44970: Flags [P.], seq 2894247935:2894247939, ack 340587162, win 85, options [nop,nop,TS val 3792213581 ecr 1096919063], length 4
00:00:22.337797 IP 10.0.0.6.1883 > 10.0.0.8.44970: Flags [P.], seq 2894247939:2894247943, ack 340587166, win 85, options [nop,nop,TS val 3792213582 ecr 1096919063], length 4
00:00:23.339906 IP 10.0.0.6.1883 > 10.0.0.8.44970: Flags [P.], seq 2894247943:2894247947, ack 340587561, win 85, options [nop,nop,TS val 3792214584 ecr 1096920066], length 4
00:00:23.340719 IP 10.0.0.6.1883 > 10.0.0.8.44970: Flags [P.], seq 2894247947:2894247951, ack 340587565, win 85, options [nop,nop,TS val 3792214585 ecr 1096920067], length 4
00:00:24.350245 IP 10.0.0.6.1883 > 10.0.0.8.44970: Flags [P.], seq 2894247951:2894247955, ack 340587960, win 85, options [nop,nop,TS val 3792215594 ecr 1096921076], length 4
00:00:24.350742 IP 10.0.0.6.1883 > 10.0.0.8.44970: Flags [P.], seq 2894247955:2894247959, ack 340587964, win 85, options [nop,nop,TS val 3792215595 ecr 1096921077], length 4
00:00:24.938234 IP 10.0.0.6.1883 > 10.0.0.8.44970: Flags [P.], seq 2894247959:2894247961, ack 340587966, win 85, options [nop,nop,TS val 3792216182 ecr 1096921664], length 2
00:00:25.355019 IP 10.0.0.6.1883 > 10.0.0.8.44970: Flags [P.], seq 2894247961:2894247965, ack 340588361, win 85, options [nop,nop,TS val 3792216599 ecr 1096922080], length 4
00:00:25.356801 IP 10.0.0.6.1883 > 10.0.0.8.44970: Flags [P.], seq 2894247965:2894247969, ack 340588365, win 85, options [nop,nop,TS val 3792216601 ecr 1096922082], length 4
00:00:26.356179 IP 10.0.0.6.1883 > 10.0.0.8.44970: Flags [P.], seq 2894247969:2894247973, ack 340588760, win 85, options [nop,nop,TS val 3792217600 ecr 1096923081], length 4
00:00:26.358894 IP 10.0.0.6.1883 > 10.0.0.8.44970: Flags [P.], seq 2894247973:2894247977, ack 340588764, win 85, options [nop,nop,TS val 3792217603 ecr 1096923083], length 4
00:00:27.356895 IP 10.0.0.6.1883 > 10.0.0.8.44970: Flags [P.], seq 2894247977:2894247981, ack 340589159, win 85, options [nop,nop,TS val 3792218601 ecr 1096924082], length 4
00:00:27.358269 IP 10.0.0.6.1883 > 10.0.0.8.44970: Flags [P.], seq 2894247981:2894247985, ack 340589163, win 85, options [nop,nop,TS val 3792218602 ecr 1096924083], length 4
00:00:28.357973 IP 10.0.0.6.1883 > 10.0.0.8.44970: Flags [P.], seq 2894247985:2894247989, ack 340589558, win 85, options [nop,nop,TS val 3792219602 ecr 1096925083], length 4
00:00:28.358995 IP 10.0.0.6.1883 > 10.0.0.8.44970: Flags [P.], seq 2894247989:2894247993, ack 340589562, win 85, options [nop,nop,TS val 3792219603 ecr 1096925084], length 4
00:00:29.360295 IP 10.0.0.6.1883 > 10.0.0.8.44970: Flags [P.], seq 2894247993:2894247997, ack 340589957, win 85, options [nop,nop,TS val 3792220604 ecr 1096926085], length 4
00:00:29.381945 IP 10.0.0.6.1883 > 10.0.0.8.44970: Flags [P.], seq 2894247997:2894248001, ack 340589961, win 85, options [nop,nop,TS val 3792220626 ecr 1096926107], length 4
00:00:29.942910 IP 10.0.0.6.1883 > 10.0.0.8.44970: Flags [P.], seq 2894248001:2894248003, ack 340589963, win 85, options [nop,nop,TS val 3792221187 ecr 1096926666], length 2
00:00:30.462183 IP 10.0.0.6.1883 > 10.0.0.8.44970: Flags [P.], seq 2894248003:2894248007, ack 340590358, win 85, options [nop,nop,TS val 3792221706 ecr 1096927186], length 4
00:00:30.463143 IP 10.0.0.6.1883 > 10.0.0.8.44970: Flags [P.], seq 2894248007:2894248011, ack 340590362, win 85, options [nop,nop,TS val 3792221707 ecr 1096927189], length 4
00:00:31.462112 IP 10.0.0.6.1883 > 10.0.0.8.44970: Flags [P.], seq 2894248011:2894248015, ack 340590757, win 85, options [nop,nop,TS val 3792222706 ecr 1096928188], length 4
00:00:31.462632 IP 10.0.0.6.1883 > 10.0.0.8.44970: Flags [P.], seq 2894248015:2894248019, ack 340590761, win 85, options [nop,nop,TS val 3792222707 ecr 1096928189], length 4
00:00:32.463836 IP 10.0.0.6.1883 > 10.0.0.8.44970: Flags [P.], seq 2894248019:2894248023, ack 340591156, win 85, options [nop,nop,TS val 3792223708 ecr 1096929189], length 4
00:00:32.464824 IP 10.0.0.6.1883 > 10.0.0.8.44970: Flags [P.], seq 2894248023:2894248027, ack 340591160, win 85, options [nop,nop,TS val 3792223709 ecr 1096929190], length 4
00:00:33.465913 IP 10.0.0.6.1883 > 10.0.0.8.44970: Flags [P.], seq 2894248027:2894248031, ack 340591555, win 85, options [nop,nop,TS val 3792224710 ecr 1096930191], length 4
00:00:33.467595 IP 10.0.0.6.1883 > 10.0.0.8.44970: Flags [P.], seq 2894248031:2894248035, ack 340591559, win 85, options [nop,nop,TS val 3792224712 ecr 1096930192], length 4
00:00:34.469020 IP 10.0.0.6.1883 > 10.0.0.8.44970: Flags [P.], seq 2894248035:2894248039, ack 340591954, win 85, options [nop,nop,TS val 3792225712 ecr 1096931192], length 4
00:00:34.474325 IP 10.0.0.6.1883 > 10.0.0.8.44970: Flags [P.], seq 2894248039:2894248043, ack 340591958, win 85, options [nop,nop,TS val 3792225718 ecr 1096931196], length 4
00:00:34.944074 IP 10.0.0.6.1883 > 10.0.0.8.44970: Flags [P.], seq 2894248043:2894248045, ack 340591960, win 85, options [nop,nop,TS val 3792226188 ecr 1096931668], length 2
00:00:35.467893 IP 10.0.0.6.1883 > 10.0.0.8.44970: Flags [P.], seq 2894248045:2894248049, ack 340592355, win 85, options [nop,nop,TS val 3792226712 ecr 1096932193], length 4
00:00:35.470092 IP 10.0.0.6.1883 > 10.0.0.8.44970: Flags [P.], seq 2894248049:2894248053, ack 340592359, win 85, options [nop,nop,TS val 3792226714 ecr 1096932194], length 4
00:00:36.470655 IP 10.0.0.6.1883 > 10.0.0.8.44970: Flags [P.], seq 2894248053:2894248057, ack 340592754, win 85, options [nop,nop,TS val 3792227715 ecr 1096933194], length 4
00:00:36.472185 IP 10.0.0.6.1883 > 10.0.0.8.44970: Flags [P.], seq 2894248057:2894248061, ack 340592758, win 85, options [nop,nop,TS val 3792227716 ecr 1096933197], length 4
00:00:37.470787 IP 10.0.0.6.1883 > 10.0.0.8.44970: Flags [P.], seq 2894248061:2894248065, ack 340593153, win 85, options [nop,nop,TS val 3792228715 ecr 1096934195], length 4
00:00:37.472520 IP 10.0.0.6.1883 > 10.0.0.8.44970: Flags [P.], seq 2894248065:2894248069, ack 340593157, win 85, options [nop,nop,TS val 3792228716 ecr 1096934197], length 4
00:00:38.474038 IP 10.0.0.6.1883 > 10.0.0.8.44970: Flags [P.], seq 2894248069:2894248073, ack 340593552, win 85, options [nop,nop,TS val 3792229718 ecr 1096935199], length 4
00:00:38.474612 IP 10.0.0.6.1883 > 10.0.0.8.44970: Flags [P.], seq 2894248073:2894248077, ack 340593556, win 85, options [nop,nop,TS val 3792229719 ecr 1096935200], length 4
00:00:39.476446 IP 10.0.0.6.1883 > 10.0.0.8.44970: Flags [P.], seq 2894248077:2894248081, ack 340593951, win 85, options [nop,nop,TS val 3792230720 ecr 1096936201], length 4
00:00:39.477847 IP 10.0.0.6.1883 > 10.0.0.8.44970: Flags [P.], seq 2894248081:2894248085, ack 340593955, win 85, options [nop,nop,TS val 3792230721 ecr 1096936203], length 4
00:00:39.944645 IP 10.0.0.6.1883 > 10.0.0.8.44970: Flags [P.], seq 2894248085:2894248087, ack 340593957, win 85, options [nop,nop,TS val 3792231188 ecr 1096936669], length 2
00:00:40.476933 IP 10.0.0.6.1883 > 10.0.0.8.44970: Flags [P.], seq 2894248087:2894248091, ack 340594352, win 85, options [nop,nop,TS val 3792231721 ecr 1096937202], length 4
00:00:40.479249 IP 10.0.0.6.1883 > 10.0.0.8.44970: Flags [P.], seq 2894248091:2894248095, ack 340594356, win 85, options [nop,nop,TS val 3792231723 ecr 1096937205], length 4
00:00:41.478127 IP 10.0.0.6.1883 > 10.0.0.8.44970: Flags [P.], seq 2894248095:2894248099, ack 340594751, win 85, options [nop,nop,TS val 3792232722 ecr 1096938203], length 4
00:00:41.480136 IP 10.0.0.6.1883 > 10.0.0.8.44970: Flags [P.], seq 2894248099:2894248103, ack 340594755, win 85, options [nop,nop,TS val 3792232724 ecr 1096938205], length 4
00:00:42.507288 IP 10.0.0.6.1883 > 10.0.0.8.44970: Flags [P.], seq 2894248103:2894248107, ack 340595150, win 85, options [nop,nop,TS val 3792233751 ecr 1096939232], length 4
00:00:42.509917 IP 10.0.0.6.1883 > 10.0.0.8.44970: Flags [P.], seq 2894248107:2894248111, ack 340595154, win 85, options [nop,nop,TS val 3792233754 ecr 1096939235], length 4
00:00:43.520589 IP 10.0.0.6.1883 > 10.0.0.8.44970: Flags [P.], seq 2894248111:2894248115, ack 340595549, win 85, options [nop,nop,TS val 3792234764 ecr 1096940246], length 4
00:00:43.522541 IP 10.0.0.6.1883 > 10.0.0.8.44970: Flags [P.], seq 2894248115:2894248119, ack 340595553, win 85, options [nop,nop,TS val 3792234766 ecr 1096940248], length 4
00:00:44.521735 IP 10.0.0.6.1883 > 10.0.0.8.44970: Flags [P.], seq 2894248119:2894248123, ack 340595948, win 85, options [nop,nop,TS val 3792235766 ecr 1096941247], length 4
00:00:44.523042 IP 10.0.0.6.1883 > 10.0.0.8.44970: Flags [P.], seq 2894248123:2894248127, ack 340595952, win 85, options [nop,nop,TS val 3792235767 ecr 1096941249], length 4
00:00:44.945271 IP 10.0.0.6.1883 > 10.0.0.8.44970: Flags [P.], seq 2894248127:2894248129, ack 340595954, win 85, options [nop,nop,TS val 3792236189 ecr 1096941670], length 2
00:00:45.523056 IP 10.0.0.6.1883 > 10.0.0.8.44970: Flags [P.], seq 2894248129:2894248133, ack 340596349, win 85, options [nop,nop,TS val 3792236767 ecr 1096942248], length 4
00:00:45.524251 IP 10.0.0.6.1883 > 10.0.0.8.44970: Flags [P.], seq 2894248133:2894248137, ack 340596353, win 85, options [nop,nop,TS val 3792236768 ecr 1096942250], length 4
00:00:46.525179 IP 10.0.0.6.1883 > 10.0.0.8.44970: Flags [P.], seq 2894248137:2894248141, ack 340596748, win 85, options [nop,nop,TS val 3792237769 ecr 1096943250], length 4
00:00:46.527773 IP 10.0.0.6.1883 > 10.0.0.8.44970: Flags [P.], seq 2894248141:2894248145, ack 340596752, win 85, options [nop,nop,TS val 3792237772 ecr 1096943252], length 4
00:00:47.525377 IP 10.0.0.6.1883 > 10.0.0.8.44970: Flags [P.], seq 2894248145:2894248149, ack 340597147, win 85, options [nop,nop,TS val 3792238769 ecr 1096944250], length 4
00:00:47.527177 IP 10.0.0.6.1883 > 10.0.0.8.44970: Flags [P.], seq 2894248149:2894248153, ack 340597151, win 85, options [nop,nop,TS val 3792238771 ecr 1096944253], length 4
00:00:48.527006 IP 10.0.0.6.1883 > 10.0.0.8.44970: Flags [P.], seq 2894248153:2894248157, ack 340597546, win 85, options [nop,nop,TS val 3792239771 ecr 1096945252], length 4
00:00:48.529211 IP 10.0.0.6.1883 > 10.0.0.8.44970: Flags [P.], seq 2894248157:2894248161, ack 340597550, win 85, options [nop,nop,TS val 3792239773 ecr 1096945254], length 4
00:00:49.527960 IP 10.0.0.6.1883 > 10.0.0.8.44970: Flags [P.], seq 2894248161:2894248165, ack 340597945, win 85, options [nop,nop,TS val 3792240772 ecr 1096946253], length 4
00:00:49.529585 IP 10.0.0.6.1883 > 10.0.0.8.44970: Flags [P.], seq 2894248165:2894248169, ack 340597949, win 85, options [nop,nop,TS val 3792240774 ecr 1096946255], length 4
00:00:49.947266 IP 10.0.0.6.1883 > 10.0.0.8.44970: Flags [P.], seq 2894248169:2894248171, ack 340597951, win 85, options [nop,nop,TS val 3792241191 ecr 1096946673], length 2
00:00:50.528388 IP 10.0.0.6.1883 > 10.0.0.8.44970: Flags [P.], seq 2894248171:2894248175, ack 340598346, win 85, options [nop,nop,TS val 3792241772 ecr 1096947254], length 4
00:00:50.529337 IP 10.0.0.6.1883 > 10.0.0.8.44970: Flags [P.], seq 2894248175:2894248179, ack 340598350, win 85, options [nop,nop,TS val 3792241773 ecr 1096947255], length 4
00:00:51.529981 IP 10.0.0.6.1883 > 10.0.0.8.44970: Flags [P.], seq 2894248179:2894248183, ack 340598745, win 85, options [nop,nop,TS val 3792242774 ecr 1096948255], length 4
00:00:51.531557 IP 10.0.0.6.1883 > 10.0.0.8.44970: Flags [P.], seq 2894248183:2894248187, ack 340598749, win 85, options [nop,nop,TS val 3792242776 ecr 1096948257], length 4
00:00:52.532297 IP 10.0.0.6.1883 > 10.0.0.8.44970: Flags [P.], seq 2894248187:2894248191, ack 340599144, win 85, options [nop,nop,TS val 3792243776 ecr 1096949256], length 4
00:00:52.535421 IP 10.0.0.6.1883 > 10.0.0.8.44970: Flags [P.], seq 2894248191:2894248195, ack 340599148, win 85, options [nop,nop,TS val 3792243779 ecr 1096949260], length 4
00:00:53.535257 IP 10.0.0.6.1883 > 10.0.0.8.44970: Flags [P.], seq 2894248195:2894248199, ack 340599543, win 85, options [nop,nop,TS val 3792244779 ecr 1096950259], length 4
00:00:53.536925 IP 10.0.0.6.1883 > 10.0.0.8.44970: Flags [P.], seq 2894248199:2894248203, ack 340599547, win 85, options [nop,nop,TS val 3792244781 ecr 1096950262], length 4
00:00:54.538188 IP 10.0.0.6.1883 > 10.0.0.8.44970: Flags [P.], seq 2894248203:2894248207, ack 340599942, win 85, options [nop,nop,TS val 3792245782 ecr 1096951263], length 4
00:00:54.538733 IP 10.0.0.6.1883 > 10.0.0.8.44970: Flags [P.], seq 2894248207:2894248211, ack 340599946, win 85, options [nop,nop,TS val 3792245783 ecr 1096951265], length 4
00:00:54.948427 IP 10.0.0.6.1883 > 10.0.0.8.44970: Flags [P.], seq 2894248211:2894248213, ack 340599948, win 85, options [nop,nop,TS val 3792246192 ecr 1096951674], length 2
00:00:55.539279 IP 10.0.0.6.1883 > 10.0.0.8.44970: Flags [P.], seq 2894248213:2894248217, ack 340600343, win 85, options [nop,nop,TS val 3792246783 ecr 1096952264], length 4
00:00:55.540921 IP 10.0.0.6.1883 > 10.0.0.8.44970: Flags [P.], seq 2894248217:2894248221, ack 340600347, win 85, options [nop,nop,TS val 3792246785 ecr 1096952266], length 4
00:00:56.540628 IP 10.0.0.6.1883 > 10.0.0.8.44970: Flags [P.], seq 2894248221:2894248225, ack 340600742, win 85, options [nop,nop,TS val 3792247785 ecr 1096953266], length 4
00:00:56.542219 IP 10.0.0.6.1883 > 10.0.0.8.44970: Flags [P.], seq 2894248225:2894248229, ack 340600746, win 85, options [nop,nop,TS val 3792247786 ecr 1096953268], length 4
00:00:57.542487 IP 10.0.0.6.1883 > 10.0.0.8.44970: Flags [P.], seq 2894248229:2894248233, ack 340601141, win 85, options [nop,nop,TS val 3792248786 ecr 1096954267], length 4
00:00:57.544334 IP 10.0.0.6.1883 > 10.0.0.8.44970: Flags [P.], seq 2894248233:2894248237, ack 340601145, win 85, options [nop,nop,TS val 3792248788 ecr 1096954269], length 4
00:00:58.542909 IP 10.0.0.6.1883 > 10.0.0.8.44970: Flags [P.], seq 2894248237:2894248241, ack 340601540, win 85, options [nop,nop,TS val 3792249787 ecr 1096955269], length 4
00:00:58.543362 IP 10.0.0.6.1883 > 10.0.0.8.44970: Flags [P.], seq 2894248241:2894248245, ack 340601544, win 85, options [nop,nop,TS val 3792249787 ecr 1096955269], length 4
00:00:59.544074 IP 10.0.0.6.1883 > 10.0.0.8.44970: Flags [P.], seq 2894248245:2894248249, ack 340601939, win 85, options [nop,nop,TS val 3792250788 ecr 1096956270], length 4
00:00:59.544785 IP 10.0.0.6.1883 > 10.0.0.8.44970: Flags [P.], seq 2894248249:2894248253, ack 340601943, win 85, options [nop,nop,TS val 3792250789 ecr 1096956270], length 4
00:00:59.948850 IP 10.0.0.6.1883 > 10.0.0.8.44970: Flags [P.], seq 2894248253:2894248255, ack 340601945, win 85, options [nop,nop,TS val 3792251193 ecr 1096956675], length 2
00:01:00.545701 IP 10.0.0.6.1883 > 10.0.0.8.44970: Flags [P.], seq 2894248255:2894248259, ack 340602340, win 85, options [nop,nop,TS val 3792251790 ecr 1096957271], length 4
00:01:00.548099 IP 10.0.0.6.1883 > 10.0.0.8.44970: Flags [P.], seq 2894248259:2894248263, ack 340602344, win 85, options [nop,nop,TS val 3792251792 ecr 1096957273], length 4
00:01:01.546602 IP 10.0.0.6.1883 > 10.0.0.8.44970: Flags [P.], seq 2894248263:2894248267, ack 340602739, win 85, options [nop,nop,TS val 3792252791 ecr 1096958272], length 4
00:01:01.548130 IP 10.0.0.6.1883 > 10.0.0.8.44970: Flags [P.], seq 2894248267:2894248271, ack 340602743, win 85, options [nop,nop,TS val 3792252792 ecr 1096958273], length 4
00:01:02.553062 IP 10.0.0.6.1883 > 10.0.0.8.44970: Flags [P.], seq 2894248271:2894248275, ack 340603138, win 85, options [nop,nop,TS val 3792253797 ecr 1096959278], length 4
00:01:02.554884 IP 10.0.0.6.1883 > 10.0.0.8.44970: Flags [P.], seq 2894248275:2894248279, ack 340603142, win 85, options [nop,nop,TS val 3792253799 ecr 1096959280], length 4
00:01:03.557554 IP 10.0.0.6.1883 > 10.0.0.8.44970: Flags [P.], seq 2894248279:2894248283, ack 340603537, win 85, options [nop,nop,TS val 3792254802 ecr 1096960283], length 4
00:01:03.559100 IP 10.0.0.6.1883 > 10.0.0.8.44970: Flags [P.], seq 2894248283:2894248287, ack 340603541, win 85, options [nop,nop,TS val 3792254803 ecr 1096960284], length 4
00:01:04.559126 IP 10.0.0.6.1883 > 10.0.0.8.44970: Flags [P.], seq 2894248287:2894248291, ack 340603936, win 85, options [nop,nop,TS val 3792255803 ecr 1096961284], length 4
00:01:04.561004 IP 10.0.0.6.1883 > 10.0.0.8.44970: Flags [P.], seq 2894248291:2894248295, ack 340603940, win 85, options [nop,nop,TS val 3792255805 ecr 1096961286], length 4
00:01:04.952088 IP 10.0.0.6.1883 > 10.0.0.8.44970: Flags [P.], seq 2894248295:2894248297, ack 340603942, win 85, options [nop,nop,TS val 3792256196 ecr 1096961677], length 2
00:01:05.564534 IP 10.0.0.6.1883 > 10.0.0.8.44970: Flags [P.], seq 2894248297:2894248301, ack 340604337, win 85, options [nop,nop,TS val 3792256806 ecr 1096962286], length 4
00:01:05.580976 IP 10.0.0.6.1883 > 10.0.0.8.44970: Flags [P.], seq 2894248301:2894248305, ack 340604341, win 85, options [nop,nop,TS val 3792256825 ecr 1096962305], length 4
00:01:06.564279 IP 10.0.0.6.1883 > 10.0.0.8.44970: Flags [P.], seq 2894248305:2894248309, ack 340604736, win 85, options [nop,nop,TS val 3792257808 ecr 1096963287], length 4
00:01:06.713430 IP 10.0.0.6.1883 > 10.0.0.8.44970: Flags [P.], seq 2894248309:2894248313, ack 340604740, win 85, options [nop,nop,TS val 3792257957 ecr 1096963437], length 4
00:01:07.732516 IP 10.0.0.6.1883 > 10.0.0.8.44970: Flags [P.], seq 2894248313:2894248317, ack 340605135, win 85, options [nop,nop,TS val 3792258976 ecr 1096964455], length 4
00:01:07.735017 IP 10.0.0.6.1883 > 10.0.0.8.44970: Flags [P.], seq 2894248317:2894248321, ack 340605139, win 85, options [nop,nop,TS val 3792258979 ecr 1096964459], length 4
00:01:08.734805 IP 10.0.0.6.1883 > 10.0.0.8.44970: Flags [P.], seq 2894248321:2894248325, ack 340605534, win 85, options [nop,nop,TS val 3792259979 ecr 1096965458], length 4
00:01:08.738250 IP 10.0.0.6.1883 > 10.0.0.8.44970: Flags [P.], seq 2894248325:2894248329, ack 340605538, win 85, options [nop,nop,TS val 3792259981 ecr 1096965463], length 4
00:01:09.740193 IP 10.0.0.6.1883 > 10.0.0.8.44970: Flags [P.], seq 2894248329:2894248333, ack 340605933, win 85, options [nop,nop,TS val 3792260984 ecr 1096966463], length 4
00:01:09.746160 IP 10.0.0.6.1883 > 10.0.0.8.44970: Flags [P.], seq 2894248333:2894248337, ack 340605937, win 85, options [nop,nop,TS val 3792260990 ecr 1096966470], length 4
00:01:09.955113 IP 10.0.0.6.1883 > 10.0.0.8.44970: Flags [P.], seq 2894248337:2894248339, ack 340605939, win 85, options [nop,nop,TS val 3792261198 ecr 1096966679], length 2
00:01:10.752582 IP 10.0.0.6.1883 > 10.0.0.8.44970: Flags [P.], seq 2894248339:2894248343, ack 340606334, win 85, options [nop,nop,TS val 3792261993 ecr 1096967472], length 4
00:01:10.760485 IP 10.0.0.6.1883 > 10.0.0.8.44970: Flags [P.], seq 2894248343:2894248347, ack 340606338, win 85, options [nop,nop,TS val 3792262004 ecr 1096967485], length 4
00:01:11.753114 IP 10.0.0.6.1883 > 10.0.0.8.44970: Flags [P.], seq 2894248347:2894248351, ack 340606733, win 85, options [nop,nop,TS val 3792262994 ecr 1096968475], length 4
00:01:11.756224 IP 10.0.0.6.1883 > 10.0.0.8.44970: Flags [P.], seq 2894248351:2894248355, ack 340606737, win 85, options [nop,nop,TS val 3792263000 ecr 1096968481], length 4
00:01:12.753140 IP 10.0.0.6.1883 > 10.0.0.8.44970: Flags [P.], seq 2894248355:2894248359, ack 340607132, win 85, options [nop,nop,TS val 3792263997 ecr 1096969477], length 4
00:01:12.755889 IP 10.0.0.6.1883 > 10.0.0.8.44970: Flags [P.], seq 2894248359:2894248363, ack 340607136, win 85, options [nop,nop,TS val 3792264000 ecr 1096969480], length 4
00:01:13.753928 IP 10.0.0.6.1883 > 10.0.0.8.44970: Flags [P.], seq 2894248363:2894248367, ack 340607531, win 85, options [nop,nop,TS val 3792264998 ecr 1096970479], length 4
00:01:13.755585 IP 10.0.0.6.1883 > 10.0.0.8.44970: Flags [P.], seq 2894248367:2894248371, ack 340607535, win 85, options [nop,nop,TS val 3792264999 ecr 1096970481], length 4
00:01:14.761574 IP 10.0.0.6.1883 > 10.0.0.8.44970: Flags [P.], seq 2894248371:2894248375, ack 340607930, win 85, options [nop,nop,TS val 3792266000 ecr 1096971480], length 4
00:01:14.768109 IP 10.0.0.6.1883 > 10.0.0.8.44970: Flags [P.], seq 2894248375:2894248379, ack 340607934, win 85, options [nop,nop,TS val 3792266012 ecr 1096971493], length 4
00:01:14.975426 IP 10.0.0.6.1883 > 10.0.0.8.44970: Flags [P.], seq 2894248379:2894248381, ack 340607936, win 85, options [nop,nop,TS val 3792266219 ecr 1096971701], length 2
00:01:15.771625 IP 10.0.0.6.1883 > 10.0.0.8.44970: Flags [P.], seq 2894248381:2894248385, ack 340608331, win 85, options [nop,nop,TS val 3792267015 ecr 1096972495], length 4
00:01:15.775978 IP 10.0.0.6.1883 > 10.0.0.8.44970: Flags [P.], seq 2894248385:2894248389, ack 340608335, win 85, options [nop,nop,TS val 3792267020 ecr 1096972501], length 4
00:01:16.780577 IP 10.0.0.6.1883 > 10.0.0.8.44970: Flags [P.], seq 2894248389:2894248393, ack 340608730, win 85, options [nop,nop,TS val 3792268021 ecr 1096973501], length 4
00:01:16.786797 IP 10.0.0.6.1883 > 10.0.0.8.44970: Flags [P.], seq 2894248393:2894248397, ack 340608734, win 85, options [nop,nop,TS val 3792268031 ecr 1096973511], length 4
00:01:17.780317 IP 10.0.0.6.1883 > 10.0.0.8.44970: Flags [P.], seq 2894248397:2894248401, ack 340609129, win 85, options [nop,nop,TS val 3792269024 ecr 1096974505], length 4
00:01:17.782567 IP 10.0.0.6.1883 > 10.0.0.8.44970: Flags [P.], seq 2894248401:2894248405, ack 340609133, win 85, options [nop,nop,TS val 3792269027 ecr 1096974508], length 4
00:01:18.786994 IP 10.0.0.6.1883 > 10.0.0.8.44970: Flags [P.], seq 2894248405:2894248409, ack 340609528, win 85, options [nop,nop,TS val 3792270031 ecr 1096975511], length 4
00:01:18.791472 IP 10.0.0.6.1883 > 10.0.0.8.44970: Flags [P.], seq 2894248409:2894248413, ack 340609532, win 85, options [nop,nop,TS val 3792270035 ecr 1096975516], length 4
00:01:19.287338 IP 10.0.0.6.1883 > 10.0.0.8.44970: Flags [P.], seq 2894248409:2894248413, ack 340609532, win 85, options [nop,nop,TS val 3792270531 ecr 1096975516], length 4
00:01:19.791194 IP 10.0.0.6.1883 > 10.0.0.8.44970: Flags [P.], seq 2894248413:2894248417, ack 340609927, win 85, options [nop,nop,TS val 3792271035 ecr 1096976515], length 4
00:01:19.795574 IP 10.0.0.6.1883 > 10.0.0.8.44970: Flags [P.], seq 2894248417:2894248421, ack 340609931, win 85, options [nop,nop,TS val 3792271040 ecr 1096976520], length 4
00:01:20.293135 IP 10.0.0.6.1883 > 10.0.0.8.44970: Flags [P.], seq 2894248421:2894248423, ack 340609933, win 85, options [nop,nop,TS val 3792271537 ecr 1096977017], length 2
00:01:20.795652 IP 10.0.0.6.1883 > 10.0.0.8.44970: Flags [P.], seq 2894248423:2894248427, ack 340610328, win 85, options [nop,nop,TS val 3792272038 ecr 1096977519], length 4
00:01:20.798727 IP 10.0.0.6.1883 > 10.0.0.8.44970: Flags [P.], seq 2894248427:2894248431, ack 340610332, win 85, options [nop,nop,TS val 3792272043 ecr 1096977524], length 4
00:01:21.799019 IP 10.0.0.6.1883 > 10.0.0.8.44970: Flags [P.], seq 2894248431:2894248435, ack 340610727, win 85, options [nop,nop,TS val 3792273042 ecr 1096978522], length 4
00:01:21.804568 IP 10.0.0.6.1883 > 10.0.0.8.44970: Flags [P.], seq 2894248435:2894248439, ack 340610731, win 85, options [nop,nop,TS val 3792273049 ecr 1096978529], length 4
00:01:22.804693 IP 10.0.0.6.1883 > 10.0.0.8.44970: Flags [P.], seq 2894248439:2894248443, ack 340611126, win 85, options [nop,nop,TS val 3792274047 ecr 1096979527], length 4
00:01:22.807695 IP 10.0.0.6.1883 > 10.0.0.8.44970: Flags [P.], seq 2894248443:2894248447, ack 340611130, win 85, options [nop,nop,TS val 3792274052 ecr 1096979532], length 4
00:01:23.805552 IP 10.0.0.6.1883 > 10.0.0.8.44970: Flags [P.], seq 2894248447:2894248451, ack 340611525, win 85, options [nop,nop,TS val 3792275049 ecr 1096980529], length 4
00:01:23.807826 IP 10.0.0.6.1883 > 10.0.0.8.44970: Flags [P.], seq 2894248451:2894248455, ack 340611529, win 85, options [nop,nop,TS val 3792275052 ecr 1096980532], length 4
00:01:24.808143 IP 10.0.0.6.1883 > 10.0.0.8.44970: Flags [P.], seq 2894248455:2894248459, ack 340611924, win 85, options [nop,nop,TS val 3792276051 ecr 1096981531], length 4
00:01:24.812313 IP 10.0.0.6.1883 > 10.0.0.8.44970: Flags [P.], seq 2894248459:2894248463, ack 340611928, win 85, options [nop,nop,TS val 3792276056 ecr 1096981536], length 4
00:01:25.342168 IP 10.0.0.6.1883 > 10.0.0.8.44970: Flags [P.], seq 2894248459:2894248463, ack 340611928, win 85, options [nop,nop,TS val 3792276442 ecr 1096981536], length 4
00:01:25.344733 IP 10.0.0.6.1883 > 10.0.0.8.44970: Flags [P.], seq 2894248463:2894248465, ack 340611930, win 85, options [nop,nop,TS val 3792276589 ecr 1096982069], length 2
00:01:25.846923 IP 10.0.0.6.1883 > 10.0.0.8.44970: Flags [P.], seq 2894248465:2894248469, ack 340612325, win 85, options [nop,nop,TS val 3792277091 ecr 1096982571], length 4
00:01:25.852419 IP 10.0.0.6.1883 > 10.0.0.8.44970: Flags [P.], seq 2894248469:2894248473, ack 340612329, win 85, options [nop,nop,TS val 3792277096 ecr 1096982578], length 4
00:01:26.848200 IP 10.0.0.6.1883 > 10.0.0.8.44970: Flags [P.], seq 2894248473:2894248477, ack 340612724, win 85, options [nop,nop,TS val 3792278092 ecr 1096983572], length 4
00:01:26.850481 IP 10.0.0.6.1883 > 10.0.0.8.44970: Flags [P.], seq 2894248477:2894248481, ack 340612728, win 85, options [nop,nop,TS val 3792278094 ecr 1096983575], length 4
00:01:27.849380 IP 10.0.0.6.1883 > 10.0.0.8.44970: Flags [P.], seq 2894248481:2894248485, ack 340613123, win 85, options [nop,nop,TS val 3792279093 ecr 1096984574], length 4
00:01:27.851496 IP 10.0.0.6.1883 > 10.0.0.8.44970: Flags [P.], seq 2894248485:2894248489, ack 340613127, win 85, options [nop,nop,TS val 3792279095 ecr 1096984576], length 4
00:01:28.849695 IP 10.0.0.6.1883 > 10.0.0.8.44970: Flags [P.], seq 2894248489:2894248493, ack 340613522, win 85, options [nop,nop,TS val 3792280094 ecr 1096985575], length 4
00:01:28.851102 IP 10.0.0.6.1883 > 10.0.0.8.44970: Flags [P.], seq 2894248493:2894248497, ack 340613526, win 85, options [nop,nop,TS val 3792280095 ecr 1096985576], length 4
00:01:29.850492 IP 10.0.0.6.1883 > 10.0.0.8.44970: Flags [P.], seq 2894248497:2894248501, ack 340613921, win 85, options [nop,nop,TS val 3792281094 ecr 1096986576], length 4
00:01:29.852130 IP 10.0.0.6.1883 > 10.0.0.8.44970: Flags [P.], seq 2894248501:2894248505, ack 340613925, win 85, options [nop,nop,TS val 3792281096 ecr 1096986577], length 4
00:01:30.345144 IP 10.0.0.6.1883 > 10.0.0.8.44970: Flags [P.], seq 2894248505:2894248507, ack 340613927, win 85, options [nop,nop,TS val 3792281589 ecr 1096987070], length 2
00:01:30.852076 IP 10.0.0.6.1883 > 10.0.0.8.44970: Flags [P.], seq 2894248507:2894248511, ack 340614322, win 85, options [nop,nop,TS val 3792282096 ecr 1096987577], length 4
00:01:30.854644 IP 10.0.0.6.1883 > 10.0.0.8.44970: Flags [P.], seq 2894248511:2894248515, ack 340614326, win 85, options [nop,nop,TS val 3792282099 ecr 1096987580], length 4
00:01:31.853319 IP 10.0.0.6.1883 > 10.0.0.8.44970: Flags [P.], seq 2894248515:2894248519, ack 340614721, win 85, options [nop,nop,TS val 3792283097 ecr 1096988578], length 4
00:01:31.855219 IP 10.0.0.6.1883 > 10.0.0.8.44970: Flags [P.], seq 2894248519:2894248523, ack 340614725, win 85, options [nop,nop,TS val 3792283099 ecr 1096988580], length 4
00:01:32.853508 IP 10.0.0.6.1883 > 10.0.0.8.44970: Flags [P.], seq 2894248523:2894248527, ack 340615120, win 85, options [nop,nop,TS val 3792284098 ecr 1096989579], length 4
00:01:32.855359 IP 10.0.0.6.1883 > 10.0.0.8.44970: Flags [P.], seq 2894248527:2894248531, ack 340615124, win 85, options [nop,nop,TS val 3792284099 ecr 1096989581], length 4
00:01:33.854779 IP 10.0.0.6.1883 > 10.0.0.8.44970: Flags [P.], seq 2894248531:2894248535, ack 340615519, win 85, options [nop,nop,TS val 3792285099 ecr 1096990580], length 4
00:01:33.856299 IP 10.0.0.6.1883 > 10.0.0.8.44970: Flags [P.], seq 2894248535:2894248539, ack 340615523, win 85, options [nop,nop,TS val 3792285100 ecr 1096990581], length 4
00:01:34.865670 IP 10.0.0.6.1883 > 10.0.0.8.44970: Flags [P.], seq 2894248539:2894248543, ack 340615918, win 85, options [nop,nop,TS val 3792286110 ecr 1096991591], length 4
00:01:34.867742 IP 10.0.0.6.1883 > 10.0.0.8.44970: Flags [P.], seq 2894248543:2894248547, ack 340615922, win 85, options [nop,nop,TS val 3792286112 ecr 1096991593], length 4
00:01:35.347779 IP 10.0.0.6.1883 > 10.0.0.8.44970: Flags [P.], seq 2894248547:2894248549, ack 340615924, win 85, options [nop,nop,TS val 3792286592 ecr 1096992073], length 2
00:01:35.878232 IP 10.0.0.6.1883 > 10.0.0.8.44970: Flags [P.], seq 2894248549:2894248553, ack 340616319, win 85, options [nop,nop,TS val 3792287122 ecr 1096992603], length 4
00:01:35.880134 IP 10.0.0.6.1883 > 10.0.0.8.44970: Flags [P.], seq 2894248553:2894248557, ack 340616323, win 85, options [nop,nop,TS val 3792287124 ecr 1096992605], length 4
00:01:36.880696 IP 10.0.0.6.1883 > 10.0.0.8.44970: Flags [P.], seq 2894248557:2894248561, ack 340616718, win 85, options [nop,nop,TS val 3792288125 ecr 1096993606], length 4
00:01:36.883064 IP 10.0.0.6.1883 > 10.0.0.8.44970: Flags [P.], seq 2894248561:2894248565, ack 340616722, win 85, options [nop,nop,TS val 3792288127 ecr 1096993608], length 4
00:01:37.882428 IP 10.0.0.6.1883 > 10.0.0.8.44970: Flags [P.], seq 2894248565:2894248569, ack 340617117, win 85, options [nop,nop,TS val 3792289126 ecr 1096994607], length 4
00:01:37.883723 IP 10.0.0.6.1883 > 10.0.0.8.44970: Flags [P.], seq 2894248569:2894248573, ack 340617121, win 85, options [nop,nop,TS val 3792289128 ecr 1096994609], length 4
00:01:38.887435 IP 10.0.0.6.1883 > 10.0.0.8.44970: Flags [P.], seq 2894248573:2894248577, ack 340617516, win 85, options [nop,nop,TS val 3792290131 ecr 1096995612], length 4
00:01:38.889892 IP 10.0.0.6.1883 > 10.0.0.8.44970: Flags [P.], seq 2894248577:2894248581, ack 340617520, win 85, options [nop,nop,TS val 3792290134 ecr 1096995615], length 4
00:01:39.889578 IP 10.0.0.6.1883 > 10.0.0.8.44970: Flags [P.], seq 2894248581:2894248585, ack 340617915, win 85, options [nop,nop,TS val 3792291133 ecr 1096996614], length 4
00:01:39.891766 IP 10.0.0.6.1883 > 10.0.0.8.44970: Flags [P.], seq 2894248585:2894248589, ack 340617919, win 85, options [nop,nop,TS val 3792291136 ecr 1096996616], length 4
00:01:40.352541 IP 10.0.0.6.1883 > 10.0.0.8.44970: Flags [P.], seq 2894248589:2894248591, ack 340617921, win 85, options [nop,nop,TS val 3792291594 ecr 1096997074], length 2
00:01:40.963879 IP 10.0.0.6.1883 > 10.0.0.8.44970: Flags [P.], seq 2894248591:2894248595, ack 340618316, win 85, options [nop,nop,TS val 3792292180 ecr 1096997660], length 4
00:01:40.972167 IP 10.0.0.6.1883 > 10.0.0.8.44970: Flags [P.], seq 2894248595:2894248599, ack 340618320, win 85, options [nop,nop,TS val 3792292213 ecr 1096997691], length 4
00:01:41.361450 IP 10.0.0.6.1883 > 10.0.0.8.44970: Flags [P.], seq 2894248595:2894248599, ack 340618320, win 85, options [nop,nop,TS val 3792292598 ecr 1096997691], length 4
00:01:42.358521 IP 10.0.0.6.1883 > 10.0.0.8.44970: Flags [P.], seq 2894248599:2894248603, ack 340618715, win 85, options [nop,nop,TS val 3792293602 ecr 1096999081], length 4
00:01:42.364163 IP 10.0.0.6.1883 > 10.0.0.8.44970: Flags [P.], seq 2894248603:2894248607, ack 340618719, win 85, options [nop,nop,TS val 3792293608 ecr 1096999089], length 4
00:01:43.364391 IP 10.0.0.6.1883 > 10.0.0.8.44970: Flags [P.], seq 2894248607:2894248611, ack 340619114, win 85, options [nop,nop,TS val 3792294608 ecr 1097000089], length 4
00:01:43.366678 IP 10.0.0.6.1883 > 10.0.0.8.44970: Flags [P.], seq 2894248611:2894248615, ack 340619118, win 85, options [nop,nop,TS val 3792294611 ecr 1097000091], length 4
00:01:44.539279 IP 10.0.0.6.1883 > 10.0.0.8.44970: Flags [P.], seq 2894248615:2894248619, ack 340619513, win 85, options [nop,nop,TS val 3792295783 ecr 1097001263], length 4
00:01:44.541242 IP 10.0.0.6.1883 > 10.0.0.8.44970: Flags [P.], seq 2894248619:2894248623, ack 340619517, win 85, options [nop,nop,TS val 3792295785 ecr 1097001266], length 4
00:01:45.355438 IP 10.0.0.6.1883 > 10.0.0.8.44970: Flags [P.], seq 2894248623:2894248625, ack 340619519, win 85, options [nop,nop,TS val 3792296599 ecr 1097002080], length 2
00:01:45.565611 IP 10.0.0.6.1883 > 10.0.0.8.44970: Flags [P.], seq 2894248625:2894248629, ack 340619914, win 85, options [nop,nop,TS val 3792296809 ecr 1097002290], length 4
00:01:45.589328 IP 10.0.0.6.1883 > 10.0.0.8.44970: Flags [P.], seq 2894248629:2894248633, ack 340619918, win 85, options [nop,nop,TS val 3792296833 ecr 1097002314], length 4
00:01:46.568500 IP 10.0.0.6.1883 > 10.0.0.8.44970: Flags [P.], seq 2894248633:2894248637, ack 340620313, win 85, options [nop,nop,TS val 3792297812 ecr 1097003293], length 4
00:01:46.610629 IP 10.0.0.6.1883 > 10.0.0.8.44970: Flags [P.], seq 2894248637:2894248641, ack 340620317, win 85, options [nop,nop,TS val 3792297814 ecr 1097003295], length 4
00:01:47.570903 IP 10.0.0.6.1883 > 10.0.0.8.44970: Flags [P.], seq 2894248641:2894248645, ack 340620712, win 85, options [nop,nop,TS val 3792298815 ecr 1097004295], length 4
00:01:47.655273 IP 10.0.0.6.1883 > 10.0.0.8.44970: Flags [P.], seq 2894248645:2894248649, ack 340620716, win 85, options [nop,nop,TS val 3792298899 ecr 1097004380], length 4
00:01:48.937766 IP 10.0.0.6.1883 > 10.0.0.8.44970: Flags [P.], seq 2894248649:2894248653, ack 340621111, win 85, options [nop,nop,TS val 3792300182 ecr 1097005660], length 4
00:01:48.944080 IP 10.0.0.6.1883 > 10.0.0.8.44970: Flags [P.], seq 2894248653:2894248657, ack 340621115, win 85, options [nop,nop,TS val 3792300188 ecr 1097005669], length 4
00:01:49.939794 IP 10.0.0.6.1883 > 10.0.0.8.44970: Flags [P.], seq 2894248657:2894248661, ack 340621510, win 85, options [nop,nop,TS val 3792301184 ecr 1097006662], length 4
00:01:49.943457 IP 10.0.0.6.1883 > 10.0.0.8.44970: Flags [P.], seq 2894248661:2894248665, ack 340621514, win 85, options [nop,nop,TS val 3792301187 ecr 1097006667], length 4
00:01:50.357933 IP 10.0.0.6.1883 > 10.0.0.8.44970: Flags [P.], seq 2894248665:2894248667, ack 340621516, win 85, options [nop,nop,TS val 3792301602 ecr 1097007082], length 2
00:01:50.951045 IP 10.0.0.6.1883 > 10.0.0.8.44970: Flags [P.], seq 2894248667:2894248671, ack 340621911, win 85, options [nop,nop,TS val 3792302195 ecr 1097007675], length 4
00:01:50.958924 IP 10.0.0.6.1883 > 10.0.0.8.44970: Flags [P.], seq 2894248671:2894248675, ack 340621915, win 85, options [nop,nop,TS val 3792302203 ecr 1097007684], length 4
00:01:51.365014 IP 10.0.0.6.1883 > 10.0.0.8.44970: Flags [P.], seq 2894248671:2894248675, ack 340621915, win 85, options [nop,nop,TS val 3792302609 ecr 1097007684], length 4
00:01:54.991470 IP 10.0.0.6.1883 > 10.0.0.8.44970: Flags [F.], seq 2894248675, ack 340621916, win 85, options [nop,nop,TS val 3792306235 ecr 1097011716], length 0