00:00:03.767715 IP 10.0.0.6.1883 > 10.0.0.8.45026: Flags [S.], seq 3582166489, ack 3315409261, win 43440, options [mss 1460,sackOK,TS val 3792601809 ecr 1097307235,nop,wscale 9], length 0
00:00:03.779866 IP 10.0.0.6.1883 > 10.0.0.8.45026: Flags [.], ack 3315409281, win 85, options [nop,nop,TS val 3792601821 ecr 1097307303], length 0
00:00:03.780337 IP 10.0.0.6.1883 > 10.0.0.8.45026: Flags [P.], seq 3582166490:3582166494, ack 3315409281, win 85, options [nop,nop,TS val 3792601822 ecr 1097307303], length 4
00:00:03.781746 IP 10.0.0.6.1883 > 10.0.0.8.45026: Flags [P.], seq 3582166494:3582166559, ack 3315409345, win 85, options [nop,nop,TS val 3792601823 ecr 1097307304], length 65
00:00:03.782139 IP 10.0.0.6.1883 > 10.0.0.8.45026: Flags [P.], seq 3582166559:3582166564, ack 3315409740, win 85, options [nop,nop,TS val 3792601824 ecr 1097307305], length 5
00:00:03.924170 IP 10.0.0.6.1883 > 10.0.0.8.45026: Flags [P.], seq 3582166564:3582166568, ack 3315409740, win 85, options [nop,nop,TS val 3792601966 ecr 1097307434], length 4
00:00:03.928054 IP 10.0.0.6.1883 > 10.0.0.8.45026: Flags [P.], seq 3582166568:3582166572, ack 3315409744, win 85, options [nop,nop,TS val 3792601970 ecr 1097307451], length 4
00:00:04.728148 IP 10.0.0.6.1883 > 10.0.0.8.45026: Flags [P.], seq 3582166572:3582166576, ack 3315410139, win 85, options [nop,nop,TS val 3792602770 ecr 1097308251], length 4
00:00:04.729815 IP 10.0.0.6.1883 > 10.0.0.8.45026: Flags [P.], seq 3582166576:3582166580, ack 3315410143, win 85, options [nop,nop,TS val 3792602771 ecr 1097308253], length 4
00:00:05.734781 IP 10.0.0.6.1883 > 10.0.0.8.45026: Flags [P.], seq 3582166580:3582166584, ack 3315410538, win 85, options [nop,nop,TS val 3792603776 ecr 1097309258], length 4
00:00:05.736069 IP 10.0.0.6.1883 > 10.0.0.8.45026: Flags [P.], seq 3582166584:3582166588, ack 3315410542, win 85, options [nop,nop,TS val 3792603778 ecr 1097309259], length 4
00:00:06.736606 IP 10.0.0.6.1883 > 10.0.0.8.45026: Flags [P.], seq 3582166588:3582166592, ack 3315410937, win 85, options [nop,nop,TS val 3792604778 ecr 1097310259], length 4
00:00:06.739108 IP 10.0.0.6.1883 > 10.0.0.8.45026: Flags [P.], seq 3582166592:3582166596, ack 3315410941, win 85, options [nop,nop,TS val 3792604781 ecr 1097310262], length 4
00:00:07.746636 IP 10.0.0.6.1883 > 10.0.0.8.45026: Flags [P.], seq 3582166596:3582166600, ack 3315411336, win 85, options [nop,nop,TS val 3792605788 ecr 1097311269], length 4
00:00:07.747355 IP 10.0.0.6.1883 > 10.0.0.8.45026: Flags [P.], seq 3582166600:3582166604, ack 3315411340, win 85, options [nop,nop,TS val 3792605789 ecr 1097311271], length 4
00:00:08.749009 IP 10.0.0.6.1883 > 10.0.0.8.45026: Flags [P.], seq 3582166604:3582166608, ack 3315411735, win 85, options [nop,nop,TS val 3792606791 ecr 1097312271], length 4
00:00:08.749704 IP 10.0.0.6.1883 > 10.0.0.8.45026: Flags [P.], seq 3582166608:3582166612, ack 3315411739, win 85, options [nop,nop,TS val 3792606791 ecr 1097312273], length 4
00:00:08.782990 IP 10.0.0.6.1883 > 10.0.0.8.45026: Flags [P.], seq 3582166612:3582166614, ack 3315411741, win 85, options [nop,nop,TS val 3792606825 ecr 1097312306], length 2
00:00:09.754081 IP 10.0.0.6.1883 > 10.0.0.8.45026: Flags [P.], seq 3582166614:3582166618, ack 3315412136, win 85, options [nop,nop,TS val 3792607796 ecr 1097313276], length 4
00:00:09.755182 IP 10.0.0.6.1883 > 10.0.0.8.45026: Flags [P.], seq 3582166618:3582166622, ack 3315412140, win 85, options [nop,nop,TS val 3792607797 ecr 1097313278], length 4
00:00:10.759881 IP 10.0.0.6.1883 > 10.0.0.8.45026: Flags [P.], seq 3582166622:3582166626, ack 3315412535, win 85, options [nop,nop,TS val 3792608801 ecr 1097314282], length 4
00:00:10.761984 IP 10.0.0.6.1883 > 10.0.0.8.45026: Flags [P.], seq 3582166626:3582166630, ack 3315412539, win 85, options [nop,nop,TS val 3792608803 ecr 1097314284], length 4
00:00:11.771405 IP 10.0.0.6.1883 > 10.0.0.8.45026: Flags [P.], seq 3582166630:3582166634, ack 3315412934, win 85, options [nop,nop,TS val 3792609813 ecr 1097315294], length 4
00:00:11.772099 IP 10.0.0.6.1883 > 10.0.0.8.45026: Flags [P.], seq 3582166634:3582166638, ack 3315412938, win 85, options [nop,nop,TS val 3792609814 ecr 1097315295], length 4
00:00:12.772087 IP 10.0.0.6.1883 > 10.0.0.8.45026: Flags [P.], seq 3582166638:3582166642, ack 3315413333, win 85, options [nop,nop,TS val 3792610814 ecr 1097316295], length 4
00:00:12.772846 IP 10.0.0.6.1883 > 10.0.0.8.45026: Flags [P.], seq 3582166642:3582166646, ack 3315413337, win 85, options [nop,nop,TS val 3792610814 ecr 1097316296], length 4
00:00:13.777341 IP 10.0.0.6.1883 > 10.0.0.8.45026: Flags [P.], seq 3582166646:3582166650, ack 3315413732, win 85, options [nop,nop,TS val 3792611819 ecr 1097317300], length 4
00:00:13.778285 IP 10.0.0.6.1883 > 10.0.0.8.45026: Flags [P.], seq 3582166650:3582166654, ack 3315413736, win 85, options [nop,nop,TS val 3792611820 ecr 1097317301], length 4
00:00:13.783850 IP 10.0.0.6.1883 > 10.0.0.8.45026: Flags [P.], seq 3582166654:3582166656, ack 3315413738, win 85, options [nop,nop,TS val 3792611825 ecr 1097317307], length 2
00:00:14.777888 IP 10.0.0.6.1883 > 10.0.0.8.45026: Flags [P.], seq 3582166656:3582166660, ack 3315414133, win 85, options [nop,nop,TS val 3792612819 ecr 1097318301], length 4
00:00:14.779017 IP 10.0.0.6.1883 > 10.0.0.8.45026: Flags [P.], seq 3582166660:3582166664, ack 3315414137, win 85, options [nop,nop,TS val 3792612821 ecr 1097318302], length 4
00:00:15.779125 IP 10.0.0.6.1883 > 10.0.0.8.45026: Flags [P.], seq 3582166664:3582166668, ack 3315414532, win 85, options [nop,nop,TS val 3792613821 ecr 1097319302], length 4
00:00:15.779645 IP 10.0.0.6.1883 > 10.0.0.8.45026: Flags [P.], seq 3582166668:3582166672, ack 3315414536, win 85, options [nop,nop,TS val 3792613821 ecr 1097319303], length 4
00:00:16.779877 IP 10.0.0.6.1883 > 10.0.0.8.45026: Flags [P.], seq 3582166672:3582166676, ack 3315414931, win 85, options [nop,nop,TS val 3792614821 ecr 1097320303], length 4
00:00:16.780521 IP 10.0.0.6.1883 > 10.0.0.8.45026: Flags [P.], seq 3582166676:3582166680, ack 3315414935, win 85, options [nop,nop,TS val 3792614822 ecr 1097320304], length 4
00:00:17.781166 IP 10.0.0.6.1883 > 10.0.0.8.45026: Flags [P.], seq 3582166680:3582166684, ack 3315415330, win 85, options [nop,nop,TS val 3792615823 ecr 1097321304], length 4
00:00:17.782944 IP 10.0.0.6.1883 > 10.0.0.8.45026: Flags [P.], seq 3582166684:3582166688, ack 3315415334, win 85, options [nop,nop,TS val 3792615825 ecr 1097321306], length 4
00:00:18.782091 IP 10.0.0.6.1883 > 10.0.0.8.45026: Flags [P.], seq 3582166688:3582166692, ack 3315415729, win 85, options [nop,nop,TS val 3792616824 ecr 1097322305], length 4
00:00:18.783218 IP 10.0.0.6.1883 > 10.0.0.8.45026: Flags [P.], seq 3582166692:3582166696, ack 3315415733, win 85, options [nop,nop,TS val 3792616825 ecr 1097322306], length 4
00:00:18.785315 IP 10.0.0.6.1883 > 10.0.0.8.45026: Flags [P.], seq 3582166696:3582166698, ack 3315415735, win 85, options [nop,nop,TS val 3792616827 ecr 1097322309], length 2
00:00:20.120353 IP 10.0.0.6.1883 > 10.0.0.8.45026: Flags [P.], seq 3582166698:3582166702, ack 3315416130, win 85, options [nop,nop,TS val 3792618162 ecr 1097323643], length 4
00:00:20.121154 IP 10.0.0.6.1883 > 10.0.0.8.45026: Flags [P.], seq 3582166702:3582166706, ack 3315416134, win 85, options [nop,nop,TS val 3792618163 ecr 1097323644], length 4
00:00:21.146167 IP 10.0.0.6.1883 > 10.0.0.8.45026: Flags [P.], seq 3582166706:3582166710, ack 3315416529, win 85, options [nop,nop,TS val 3792619188 ecr 1097324668], length 4
00:00:21.148250 IP 10.0.0.6.1883 > 10.0.0.8.45026: Flags [P.], seq 3582166710:3582166714, ack 3315416533, win 85, options [nop,nop,TS val 3792619190 ecr 1097324671], length 4
00:00:22.146719 IP 10.0.0.6.1883 > 10.0.0.8.45026: Flags [P.], seq 3582166714:3582166718, ack 3315416928, win 85, options [nop,nop,TS val 3792620188 ecr 1097325669], length 4
00:00:22.147386 IP 10.0.0.6.1883 > 10.0.0.8.45026: Flags [P.], seq 3582166718:3582166722, ack 3315416932, win 85, options [nop,nop,TS val 3792620189 ecr 1097325671], length 4
00:00:23.148792 IP 10.0.0.6.1883 > 10.0.0.8.45026: Flags [P.], seq 3582166722:3582166726, ack 3315417327, win 85, options [nop,nop,TS val 3792621190 ecr 1097326671], length 4
00:00:23.149792 IP 10.0.0.6.1883 > 10.0.0.8.45026: Flags [P.], seq 3582166726:3582166730, ack 3315417331, win 85, options [nop,nop,TS val 3792621191 ecr 1097326673], length 4
00:00:23.795656 IP 10.0.0.6.1883 > 10.0.0.8.45026: Flags [P.], seq 3582166730:3582166732, ack 3315417333, win 85, options [nop,nop,TS val 3792621837 ecr 1097327319], length 2
00:00:24.150296 IP 10.0.0.6.1883 > 10.0.0.8.45026: Flags [P.], seq 3582166732:3582166736, ack 3315417728, win 85, options [nop,nop,TS val 3792622192 ecr 1097327673], length 4
00:00:24.151622 IP 10.0.0.6.1883 > 10.0.0.8.45026: Flags [P.], seq 3582166736:3582166740, ack 3315417732, win 85, options [nop,nop,TS val 3792622193 ecr 1097327675], length 4
00:00:25.152715 IP 10.0.0.6.1883 > 10.0.0.8.45026: Flags [P.], seq 3582166740:3582166744, ack 3315418127, win 85, options [nop,nop,TS val 3792623194 ecr 1097328675], length 4
00:00:25.153814 IP 10.0.0.6.1883 > 10.0.0.8.45026: Flags [P.], seq 3582166744:3582166748, ack 3315418131, win 85, options [nop,nop,TS val 3792623195 ecr 1097328677], length 4
00:00:26.302412 IP 10.0.0.6.1883 > 10.0.0.8.45026: Flags [P.], seq 3582166748:3582166752, ack 3315418526, win 85, options [nop,nop,TS val 3792624344 ecr 1097329825], length 4
00:00:26.304314 IP 10.0.0.6.1883 > 10.0.0.8.45026: Flags [P.], seq 3582166752:3582166756, ack 3315418530, win 85, options [nop,nop,TS val 3792624346 ecr 1097329827], length 4
00:00:27.304428 IP 10.0.0.6.1883 > 10.0.0.8.45026: Flags [P.], seq 3582166756:3582166760, ack 3315418925, win 85, options [nop,nop,TS val 3792625346 ecr 1097330827], length 4
00:00:27.305265 IP 10.0.0.6.1883 > 10.0.0.8.45026: Flags [P.], seq 3582166760:3582166764, ack 3315418929, win 85, options [nop,nop,TS val 3792625347 ecr 1097330829], length 4
00:00:28.305634 IP 10.0.0.6.1883 > 10.0.0.8.45026: Flags [P.], seq 3582166764:3582166768, ack 3315419324, win 85, options [nop,nop,TS val 3792626347 ecr 1097331828], length 4
00:00:28.306946 IP 10.0.0.6.1883 > 10.0.0.8.45026: Flags [P.], seq 3582166768:3582166772, ack 3315419328, win 85, options [nop,nop,TS val 3792626349 ecr 1097331830], length 4
00:00:28.797483 IP 10.0.0.6.1883 > 10.0.0.8.45026: Flags [P.], seq 3582166772:3582166774, ack 3315419330, win 85, options [nop,nop,TS val 3792626839 ecr 1097332321], length 2
00:00:29.306439 IP 10.0.0.6.1883 > 10.0.0.8.45026: Flags [P.], seq 3582166774:3582166778, ack 3315419725, win 85, options [nop,nop,TS val 3792627348 ecr 1097332829], length 4
00:00:29.307180 IP 10.0.0.6.1883 > 10.0.0.8.45026: Flags [P.], seq 3582166778:3582166782, ack 3315419729, win 85, options [nop,nop,TS val 3792627349 ecr 1097332831], length 4
00:00:30.307230 IP 10.0.0.6.1883 > 10.0.0.8.45026: Flags [P.], seq 3582166782:3582166786, ack 3315420124, win 85, options [nop,nop,TS val 3792628349 ecr 1097333830], length 4
00:00:30.307858 IP 10.0.0.6.1883 > 10.0.0.8.45026: Flags [P.], seq 3582166786:3582166790, ack 3315420128, win 85, options [nop,nop,TS val 3792628349 ecr 1097333831], length 4
00:00:31.308232 IP 10.0.0.6.1883 > 10.0.0.8.45026: Flags [P.], seq 3582166790:3582166794, ack 3315420523, win 85, options [nop,nop,TS val 3792629350 ecr 1097334831], length 4
00:00:31.309380 IP 10.0.0.6.1883 > 10.0.0.8.45026: Flags [P.], seq 3582166794:3582166798, ack 3315420527, win 85, options [nop,nop,TS val 3792629351 ecr 1097334832], length 4
00:00:32.310293 IP 10.0.0.6.1883 > 10.0.0.8.45026: Flags [P.], seq 3582166798:3582166802, ack 3315420922, win 85, options [nop,nop,TS val 3792630352 ecr 1097335832], length 4
00:00:32.312092 IP 10.0.0.6.1883 > 10.0.0.8.45026: Flags [P.], seq 3582166802:3582166806, ack 3315420926, win 85, options [nop,nop,TS val 3792630354 ecr 1097335835], length 4
00:00:33.311388 IP 10.0.0.6.1883 > 10.0.0.8.45026: Flags [P.], seq 3582166806:3582166810, ack 3315421321, win 85, options [nop,nop,TS val 3792631353 ecr 1097336833], length 4
00:00:33.312530 IP 10.0.0.6.1883 > 10.0.0.8.45026: Flags [P.], seq 3582166810:3582166814, ack 3315421325, win 85, options [nop,nop,TS val 3792631354 ecr 1097336836], length 4
00:00:33.820387 IP 10.0.0.6.1883 > 10.0.0.8.45026: Flags [P.], seq 3582166814:3582166816, ack 3315421327, win 85, options [nop,nop,TS val 3792631862 ecr 1097337343], length 2
00:00:34.324678 IP 10.0.0.6.1883 > 10.0.0.8.45026: Flags [P.], seq 3582166816:3582166820, ack 3315421722, win 85, options [nop,nop,TS val 3792632366 ecr 1097337847], length 4
00:00:34.325318 IP 10.0.0.6.1883 > 10.0.0.8.45026: Flags [P.], seq 3582166820:3582166824, ack 3315421726, win 85, options [nop,nop,TS val 3792632367 ecr 1097337849], length 4
00:00:35.329462 IP 10.0.0.6.1883 > 10.0.0.8.45026: Flags [P.], seq 3582166824:3582166828, ack 3315422121, win 85, options [nop,nop,TS val 3792633371 ecr 1097338851], length 4
00:00:35.330469 IP 10.0.0.6.1883 > 10.0.0.8.45026: Flags [P.], seq 3582166828:3582166832, ack 3315422125, win 85, options [nop,nop,TS val 3792633372 ecr 1097338854], length 4
00:00:36.333438 IP 10.0.0.6.1883 > 10.0.0.8.45026: Flags [P.], seq 3582166832:3582166836, ack 3315422520, win 85, options [nop,nop,TS val 3792634375 ecr 1097339855], length 4
00:00:36.334298 IP 10.0.0.6.1883 > 10.0.0.8.45026: Flags [P.], seq 3582166836:3582166840, ack 3315422524, win 85, options [nop,nop,TS val 3792634376 ecr 1097339857], length 4
00:00:37.336681 IP 10.0.0.6.1883 > 10.0.0.8.45026: Flags [P.], seq 3582166840:3582166844, ack 3315422919, win 85, options [nop,nop,TS val 3792635378 ecr 1097340858], length 4
00:00:37.338861 IP 10.0.0.6.1883 > 10.0.0.8.45026: Flags [P.], seq 3582166844:3582166848, ack 3315422923, win 85, options [nop,nop,TS val 3792635380 ecr 1097340862], length 4
00:00:38.337809 IP 10.0.0.6.1883 > 10.0.0.8.45026: Flags [P.], seq 3582166848:3582166852, ack 3315423318, win 85, options [nop,nop,TS val 3792636379 ecr 1097341860], length 4
00:00:38.341274 IP 10.0.0.6.1883 > 10.0.0.8.45026: Flags [P.], seq 3582166852:3582166856, ack 3315423322, win 85, options [nop,nop,TS val 3792636383 ecr 1097341864], length 4
00:00:38.839316 IP 10.0.0.6.1883 > 10.0.0.8.45026: Flags [P.], seq 3582166856:3582166858, ack 3315423324, win 85, options [nop,nop,TS val 3792636881 ecr 1097342362], length 2
00:00:39.341943 IP 10.0.0.6.1883 > 10.0.0.8.45026: Flags [P.], seq 3582166858:3582166862, ack 3315423719, win 85, options [nop,nop,TS val 3792637384 ecr 1097342864], length 4
00:00:39.342789 IP 10.0.0.6.1883 > 10.0.0.8.45026: Flags [P.], seq 3582166862:3582166866, ack 3315423723, win 85, options [nop,nop,TS val 3792637384 ecr 1097342866], length 4
00:00:40.343794 IP 10.0.0.6.1883 > 10.0.0.8.45026: Flags [P.], seq 3582166866:3582166870, ack 3315424118, win 85, options [nop,nop,TS val 3792638385 ecr 1097343866], length 4
00:00:40.345324 IP 10.0.0.6.1883 > 10.0.0.8.45026: Flags [P.], seq 3582166870:3582166874, ack 3315424122, win 85, options [nop,nop,TS val 3792638387 ecr 1097343869], length 4
00:00:41.345871 IP 10.0.0.6.1883 > 10.0.0.8.45026: Flags [P.], seq 3582166874:3582166878, ack 3315424517, win 85, options [nop,nop,TS val 3792639387 ecr 1097344869], length 4
00:00:41.347677 IP 10.0.0.6.1883 > 10.0.0.8.45026: Flags [P.], seq 3582166878:3582166882, ack 3315424521, win 85, options [nop,nop,TS val 3792639389 ecr 1097344870], length 4
00:00:42.553112 IP 10.0.0.6.1883 > 10.0.0.8.45026: Flags [P.], seq 3582166882:3582166886, ack 3315424916, win 85, options [nop,nop,TS val 3792640595 ecr 1097346075], length 4
00:00:42.553901 IP 10.0.0.6.1883 > 10.0.0.8.45026: Flags [P.], seq 3582166886:3582166890, ack 3315424920, win 85, options [nop,nop,TS val 3792640596 ecr 1097346077], length 4
00:00:43.673343 IP 10.0.0.6.1883 > 10.0.0.8.45026: Flags [P.], seq 3582166890:3582166894, ack 3315425315, win 85, options [nop,nop,TS val 3792641715 ecr 1097347196], length 4
00:00:43.674221 IP 10.0.0.6.1883 > 10.0.0.8.45026: Flags [P.], seq 3582166894:3582166898, ack 3315425319, win 85, options [nop,nop,TS val 3792641716 ecr 1097347198], length 4
00:00:43.878069 IP 10.0.0.6.1883 > 10.0.0.8.45026: Flags [P.], seq 3582166898:3582166900, ack 3315425321, win 85, options [nop,nop,TS val 3792641920 ecr 1097347401], length 2
00:00:44.677263 IP 10.0.0.6.1883 > 10.0.0.8.45026: Flags [P.], seq 3582166900:3582166904, ack 3315425716, win 85, options [nop,nop,TS val 3792642719 ecr 1097348199], length 4
00:00:44.678138 IP 10.0.0.6.1883 > 10.0.0.8.45026: Flags [P.], seq 3582166904:3582166908, ack 3315425720, win 85, options [nop,nop,TS val 3792642720 ecr 1097348201], length 4
00:00:45.687252 IP 10.0.0.6.1883 > 10.0.0.8.45026: Flags [P.], seq 3582166908:3582166912, ack 3315426115, win 85, options [nop,nop,TS val 3792643729 ecr 1097349210], length 4
00:00:45.687855 IP 10.0.0.6.1883 > 10.0.0.8.45026: Flags [P.], seq 3582166912:3582166916, ack 3315426119, win 85, options [nop,nop,TS val 3792643729 ecr 1097349211], length 4
00:00:46.694004 IP 10.0.0.6.1883 > 10.0.0.8.45026: Flags [P.], seq 3582166916:3582166920, ack 3315426514, win 85, options [nop,nop,TS val 3792644736 ecr 1097350216], length 4
00:00:46.695304 IP 10.0.0.6.1883 > 10.0.0.8.45026: Flags [P.], seq 3582166920:3582166924, ack 3315426518, win 85, options [nop,nop,TS val 3792644737 ecr 1097350218], length 4
00:00:47.694964 IP 10.0.0.6.1883 > 10.0.0.8.45026: Flags [P.], seq 3582166924:3582166928, ack 3315426913, win 85, options [nop,nop,TS val 3792645737 ecr 1097351217], length 4
00:00:47.695965 IP 10.0.0.6.1883 > 10.0.0.8.45026: Flags [P.], seq 3582166928:3582166932, ack 3315426917, win 85, options [nop,nop,TS val 3792645738 ecr 1097351219], length 4
00:00:48.696183 IP 10.0.0.6.1883 > 10.0.0.8.45026: Flags [P.], seq 3582166932:3582166936, ack 3315427312, win 85, options [nop,nop,TS val 3792646738 ecr 1097352219], length 4
00:00:48.697127 IP 10.0.0.6.1883 > 10.0.0.8.45026: Flags [P.], seq 3582166936:3582166940, ack 3315427316, win 85, options [nop,nop,TS val 3792646739 ecr 1097352220], length 4
00:00:48.880573 IP 10.0.0.6.1883 > 10.0.0.8.45026: Flags [P.], seq 3582166940:3582166942, ack 3315427318, win 85, options [nop,nop,TS val 3792646922 ecr 1097352404], length 2
00:00:49.720322 IP 10.0.0.6.1883 > 10.0.0.8.45026: Flags [P.], seq 3582166942:3582166946, ack 3315427713, win 85, options [nop,nop,TS val 3792647762 ecr 1097353242], length 4
00:00:49.721899 IP 10.0.0.6.1883 > 10.0.0.8.45026: Flags [P.], seq 3582166946:3582166950, ack 3315427717, win 85, options [nop,nop,TS val 3792647763 ecr 1097353245], length 4
00:00:50.741838 IP 10.0.0.6.1883 > 10.0.0.8.45026: Flags [P.], seq 3582166950:3582166954, ack 3315428112, win 85, options [nop,nop,TS val 3792648783 ecr 1097354265], length 4
00:00:50.742608 IP 10.0.0.6.1883 > 10.0.0.8.45026: Flags [P.], seq 3582166954:3582166958, ack 3315428116, win 85, options [nop,nop,TS val 3792648784 ecr 1097354266], length 4
00:00:51.743488 IP 10.0.0.6.1883 > 10.0.0.8.45026: Flags [P.], seq 3582166958:3582166962, ack 3315428511, win 85, options [nop,nop,TS val 3792649785 ecr 1097355266], length 4
00:00:51.745059 IP 10.0.0.6.1883 > 10.0.0.8.45026: Flags [P.], seq 3582166962:3582166966, ack 3315428515, win 85, options [nop,nop,TS val 3792649787 ecr 1097355268], length 4
00:00:52.747128 IP 10.0.0.6.1883 > 10.0.0.8.45026: Flags [P.], seq 3582166966:3582166970, ack 3315428910, win 85, options [nop,nop,TS val 3792650789 ecr 1097356270], length 4
00:00:52.747632 IP 10.0.0.6.1883 > 10.0.0.8.45026: Flags [P.], seq 3582166970:3582166974, ack 3315428914, win 85, options [nop,nop,TS val 3792650789 ecr 1097356271], length 4
00:00:53.752667 IP 10.0.0.6.1883 > 10.0.0.8.45026: Flags [P.], seq 3582166974:3582166978, ack 3315429309, win 85, options [nop,nop,TS val 3792651794 ecr 1097357276], length 4
00:00:53.753487 IP 10.0.0.6.1883 > 10.0.0.8.45026: Flags [P.], seq 3582166978:3582166982, ack 3315429313, win 85, options [nop,nop,TS val 3792651795 ecr 1097357277], length 4
00:00:53.882672 IP 10.0.0.6.1883 > 10.0.0.8.45026: Flags [P.], seq 3582166982:3582166984, ack 3315429315, win 85, options [nop,nop,TS val 3792651924 ecr 1097357406], length 2
00:00:54.753302 IP 10.0.0.6.1883 > 10.0.0.8.45026: Flags [P.], seq 3582166984:3582166988, ack 3315429710, win 85, options [nop,nop,TS val 3792652795 ecr 1097358276], length 4
00:00:54.754013 IP 10.0.0.6.1883 > 10.0.0.8.45026: Flags [P.], seq 3582166988:3582166992, ack 3315429714, win 85, options [nop,nop,TS val 3792652796 ecr 1097358277], length 4
00:00:55.759465 IP 10.0.0.6.1883 > 10.0.0.8.45026: Flags [P.], seq 3582166992:3582166996, ack 3315430109, win 85, options [nop,nop,TS val 3792653801 ecr 1097359282], length 4
00:00:55.760038 IP 10.0.0.6.1883 > 10.0.0.8.45026: Flags [P.], seq 3582166996:3582167000, ack 3315430113, win 85, options [nop,nop,TS val 3792653802 ecr 1097359283], length 4
00:00:56.760449 IP 10.0.0.6.1883 > 10.0.0.8.45026: Flags [P.], seq 3582167000:3582167004, ack 3315430508, win 85, options [nop,nop,TS val 3792654802 ecr 1097360283], length 4
00:00:56.761122 IP 10.0.0.6.1883 > 10.0.0.8.45026: Flags [P.], seq 3582167004:3582167008, ack 3315430512, win 85, options [nop,nop,TS val 3792654803 ecr 1097360285], length 4
00:00:57.763308 IP 10.0.0.6.1883 > 10.0.0.8.45026: Flags [P.], seq 3582167008:3582167012, ack 3315430907, win 85, options [nop,nop,TS val 3792655805 ecr 1097361286], length 4
00:00:57.764941 IP 10.0.0.6.1883 > 10.0.0.8.45026: Flags [P.], seq 3582167012:3582167016, ack 3315430911, win 85, options [nop,nop,TS val 3792655807 ecr 1097361288], length 4
00:00:58.765202 IP 10.0.0.6.1883 > 10.0.0.8.45026: Flags [P.], seq 3582167016:3582167020, ack 3315431306, win 85, options [nop,nop,TS val 3792656807 ecr 1097362288], length 4
00:00:58.766960 IP 10.0.0.6.1883 > 10.0.0.8.45026: Flags [P.], seq 3582167020:3582167024, ack 3315431310, win 85, options [nop,nop,TS val 3792656809 ecr 1097362290], length 4
00:00:58.884528 IP 10.0.0.6.1883 > 10.0.0.8.45026: Flags [P.], seq 3582167024:3582167026, ack 3315431312, win 85, options [nop,nop,TS val 3792656926 ecr 1097362408], length 2
00:00:59.766265 IP 10.0.0.6.1883 > 10.0.0.8.45026: Flags [P.], seq 3582167026:3582167030, ack 3315431707, win 85, options [nop,nop,TS val 3792657808 ecr 1097363289], length 4
00:00:59.767449 IP 10.0.0.6.1883 > 10.0.0.8.45026: Flags [P.], seq 3582167030:3582167034, ack 3315431711, win 85, options [nop,nop,TS val 3792657809 ecr 1097363290], length 4
00:01:00.767514 IP 10.0.0.6.1883 > 10.0.0.8.45026: Flags [P.], seq 3582167034:3582167038, ack 3315432106, win 85, options [nop,nop,TS val 3792658809 ecr 1097364290], length 4
00:01:00.768910 IP 10.0.0.6.1883 > 10.0.0.8.45026: Flags [P.], seq 3582167038:3582167042, ack 3315432110, win 85, options [nop,nop,TS val 3792658811 ecr 1097364292], length 4
00:01:01.791854 IP 10.0.0.6.1883 > 10.0.0.8.45026: Flags [P.], seq 3582167042:3582167046, ack 3315432505, win 85, options [nop,nop,TS val 3792659833 ecr 1097365315], length 4
00:01:01.793262 IP 10.0.0.6.1883 > 10.0.0.8.45026: Flags [P.], seq 3582167046:3582167050, ack 3315432509, win 85, options [nop,nop,TS val 3792659835 ecr 1097365316], length 4
00:01:02.812002 IP 10.0.0.6.1883 > 10.0.0.8.45026: Flags [P.], seq 3582167050:3582167054, ack 3315432904, win 85, options [nop,nop,TS val 3792660854 ecr 1097366335], length 4
00:01:02.813465 IP 10.0.0.6.1883 > 10.0.0.8.45026: Flags [P.], seq 3582167054:3582167058, ack 3315432908, win 85, options [nop,nop,TS val 3792660855 ecr 1097366336], length 4
00:01:03.812970 IP 10.0.0.6.1883 > 10.0.0.8.45026: Flags [P.], seq 3582167058:3582167062, ack 3315433303, win 85, options [nop,nop,TS val 3792661855 ecr 1097367336], length 4
00:01:03.814223 IP 10.0.0.6.1883 > 10.0.0.8.45026: Flags [P.], seq 3582167062:3582167066, ack 3315433307, win 85, options [nop,nop,TS val 3792661856 ecr 1097367337], length 4
00:01:03.885989 IP 10.0.0.6.1883 > 10.0.0.8.45026: Flags [P.], seq 3582167066:3582167068, ack 3315433309, win 85, options [nop,nop,TS val 3792661928 ecr 1097367409], length 2
00:01:04.814183 IP 10.0.0.6.1883 > 10.0.0.8.45026: Flags [P.], seq 3582167068:3582167072, ack 3315433704, win 85, options [nop,nop,TS val 3792662856 ecr 1097368337], length 4
00:01:04.815232 IP 10.0.0.6.1883 > 10.0.0.8.45026: Flags [P.], seq 3582167072:3582167076, ack 3315433708, win 85, options [nop,nop,TS val 3792662857 ecr 1097368338], length 4
00:01:05.815678 IP 10.0.0.6.1883 > 10.0.0.8.45026: Flags [P.], seq 3582167076:3582167080, ack 3315434103, win 85, options [nop,nop,TS val 3792663857 ecr 1097369338], length 4
00:01:05.816790 IP 10.0.0.6.1883 > 10.0.0.8.45026: Flags [P.], seq 3582167080:3582167084, ack 3315434107, win 85, options [nop,nop,TS val 3792663858 ecr 1097369340], length 4
00:01:06.816279 IP 10.0.0.6.1883 > 10.0.0.8.45026: Flags [P.], seq 3582167084:3582167088, ack 3315434502, win 85, options [nop,nop,TS val 3792664858 ecr 1097370339], length 4
00:01:06.816989 IP 10.0.0.6.1883 > 10.0.0.8.45026: Flags [P.], seq 3582167088:3582167092, ack 3315434506, win 85, options [nop,nop,TS val 3792664859 ecr 1097370340], length 4
00:01:07.828236 IP 10.0.0.6.1883 > 10.0.0.8.45026: Flags [P.], seq 3582167092:3582167096, ack 3315434901, win 85, options [nop,nop,TS val 3792665870 ecr 1097371351], length 4
00:01:07.829695 IP 10.0.0.6.1883 > 10.0.0.8.45026: Flags [P.], seq 3582167096:3582167100, ack 3315434905, win 85, options [nop,nop,TS val 3792665871 ecr 1097371352], length 4
00:01:08.831174 IP 10.0.0.6.1883 > 10.0.0.8.45026: Flags [P.], seq 3582167100:3582167104, ack 3315435300, win 85, options [nop,nop,TS val 3792666873 ecr 1097372354], length 4
00:01:08.832069 IP 10.0.0.6.1883 > 10.0.0.8.45026: Flags [P.], seq 3582167104:3582167108, ack 3315435304, win 85, options [nop,nop,TS val 3792666874 ecr 1097372355], length 4
00:01:09.006066 IP 10.0.0.6.1883 > 10.0.0.8.45026: Flags [P.], seq 3582167108:3582167110, ack 3315435306, win 85, options [nop,nop,TS val 3792667048 ecr 1097372529], length 2
00:01:09.878185 IP 10.0.0.6.1883 > 10.0.0.8.45026: Flags [P.], seq 3582167110:3582167114, ack 3315435701, win 85, options [nop,nop,TS val 3792667920 ecr 1097373401], length 4
00:01:09.879242 IP 10.0.0.6.1883 > 10.0.0.8.45026: Flags [P.], seq 3582167114:3582167118, ack 3315435705, win 85, options [nop,nop,TS val 3792667921 ecr 1097373403], length 4
00:01:11.054800 IP 10.0.0.6.1883 > 10.0.0.8.45026: Flags [P.], seq 3582167118:3582167122, ack 3315436100, win 85, options [nop,nop,TS val 3792669096 ecr 1097374577], length 4
00:01:11.055342 IP 10.0.0.6.1883 > 10.0.0.8.45026: Flags [P.], seq 3582167122:3582167126, ack 3315436104, win 85, options [nop,nop,TS val 3792669097 ecr 1097374579], length 4
00:01:12.059442 IP 10.0.0.6.1883 > 10.0.0.8.45026: Flags [P.], seq 3582167126:3582167130, ack 3315436499, win 85, options [nop,nop,TS val 3792670101 ecr 1097375580], length 4
00:01:12.060858 IP 10.0.0.6.1883 > 10.0.0.8.45026: Flags [P.], seq 3582167130:3582167134, ack 3315436503, win 85, options [nop,nop,TS val 3792670102 ecr 1097375584], length 4
00:01:13.111136 IP 10.0.0.6.1883 > 10.0.0.8.45026: Flags [P.], seq 3582167134:3582167138, ack 3315436898, win 85, options [nop,nop,TS val 3792671153 ecr 1097376634], length 4
00:01:13.113006 IP 10.0.0.6.1883 > 10.0.0.8.45026: Flags [P.], seq 3582167138:3582167142, ack 3315436902, win 85, options [nop,nop,TS val 3792671155 ecr 1097376636], length 4
00:01:14.008911 IP 10.0.0.6.1883 > 10.0.0.8.45026: Flags [P.], seq 3582167142:3582167144, ack 3315436904, win 85, options [nop,nop,TS val 3792672051 ecr 1097377532], length 2
00:01:14.111943 IP 10.0.0.6.1883 > 10.0.0.8.45026: Flags [P.], seq 3582167144:3582167148, ack 3315437299, win 85, options [nop,nop,TS val 3792672154 ecr 1097377635], length 4
00:01:14.114619 IP 10.0.0.6.1883 > 10.0.0.8.45026: Flags [P.], seq 3582167148:3582167152, ack 3315437303, win 85, options [nop,nop,TS val 3792672156 ecr 1097377638], length 4
00:01:15.115117 IP 10.0.0.6.1883 > 10.0.0.8.45026: Flags [P.], seq 3582167152:3582167156, ack 3315437698, win 85, options [nop,nop,TS val 3792673157 ecr 1097378636], length 4
00:01:15.116574 IP 10.0.0.6.1883 > 10.0.0.8.45026: Flags [P.], seq 3582167156:3582167160, ack 3315437702, win 85, options [nop,nop,TS val 3792673158 ecr 1097378640], length 4
00:01:16.122760 IP 10.0.0.6.1883 > 10.0.0.8.45026: Flags [P.], seq 3582167160:3582167164, ack 3315438097, win 85, options [nop,nop,TS val 3792674164 ecr 1097379645], length 4
00:01:16.123495 IP 10.0.0.6.1883 > 10.0.0.8.45026: Flags [P.], seq 3582167164:3582167168, ack 3315438101, win 85, options [nop,nop,TS val 3792674165 ecr 1097379647], length 4
00:01:17.127386 IP 10.0.0.6.1883 > 10.0.0.8.45026: Flags [P.], seq 3582167168:3582167172, ack 3315438496, win 85, options [nop,nop,TS val 3792675169 ecr 1097380650], length 4
00:01:17.128780 IP 10.0.0.6.1883 > 10.0.0.8.45026: Flags [P.], seq 3582167172:3582167176, ack 3315438500, win 85, options [nop,nop,TS val 3792675170 ecr 1097380652], length 4
00:01:18.127578 IP 10.0.0.6.1883 > 10.0.0.8.45026: Flags [P.], seq 3582167176:3582167180, ack 3315438895, win 85, options [nop,nop,TS val 3792676169 ecr 1097381650], length 4
00:01:18.129944 IP 10.0.0.6.1883 > 10.0.0.8.45026: Flags [P.], seq 3582167180:3582167184, ack 3315438899, win 85, options [nop,nop,TS val 3792676172 ecr 1097381653], length 4
00:01:19.009747 IP 10.0.0.6.1883 > 10.0.0.8.45026: Flags [P.], seq 3582167184:3582167186, ack 3315438901, win 85, options [nop,nop,TS val 3792677051 ecr 1097382533], length 2
00:01:19.128698 IP 10.0.0.6.1883 > 10.0.0.8.45026: Flags [P.], seq 3582167186:3582167190, ack 3315439296, win 85, options [nop,nop,TS val 3792677170 ecr 1097382652], length 4
00:01:19.129285 IP 10.0.0.6.1883 > 10.0.0.8.45026: Flags [P.], seq 3582167190:3582167194, ack 3315439300, win 85, options [nop,nop,TS val 3792677171 ecr 1097382653], length 4
00:01:20.129411 IP 10.0.0.6.1883 > 10.0.0.8.45026: Flags [P.], seq 3582167194:3582167198, ack 3315439695, win 85, options [nop,nop,TS val 3792678171 ecr 1097383653], length 4
00:01:20.130295 IP 10.0.0.6.1883 > 10.0.0.8.45026: Flags [P.], seq 3582167198:3582167202, ack 3315439699, win 85, options [nop,nop,TS val 3792678172 ecr 1097383654], length 4
00:01:21.130701 IP 10.0.0.6.1883 > 10.0.0.8.45026: Flags [P.], seq 3582167202:3582167206, ack 3315440094, win 85, options [nop,nop,TS val 3792679172 ecr 1097384653], length 4
00:01:21.131410 IP 10.0.0.6.1883 > 10.0.0.8.45026: Flags [P.], seq 3582167206:3582167210, ack 3315440098, win 85, options [nop,nop,TS val 3792679173 ecr 1097384655], length 4
00:01:22.134433 IP 10.0.0.6.1883 > 10.0.0.8.45026: Flags [P.], seq 3582167210:3582167214, ack 3315440493, win 85, options [nop,nop,TS val 3792680176 ecr 1097385658], length 4
00:01:22.134980 IP 10.0.0.6.1883 > 10.0.0.8.45026: Flags [P.], seq 3582167214:3582167218, ack 3315440497, win 85, options [nop,nop,TS val 3792680177 ecr 1097385658], length 4
00:01:23.135088 IP 10.0.0.6.1883 > 10.0.0.8.45026: Flags [P.], seq 3582167218:3582167222, ack 3315440892, win 85, options [nop,nop,TS val 3792681177 ecr 1097386658], length 4
00:01:23.135473 IP 10.0.0.6.1883 > 10.0.0.8.45026: Flags [P.], seq 3582167222:3582167226, ack 3315440896, win 85, options [nop,nop,TS val 3792681177 ecr 1097386659], length 4
00:01:24.011569 IP 10.0.0.6.1883 > 10.0.0.8.45026: Flags [P.], seq 3582167226:3582167228, ack 3315440898, win 85, options [nop,nop,TS val 3792682053 ecr 1097387534], length 2
00:01:24.137743 IP 10.0.0.6.1883 > 10.0.0.8.45026: Flags [P.], seq 3582167228:3582167232, ack 3315441293, win 85, options [nop,nop,TS val 3792682179 ecr 1097387661], length 4
00:01:24.138977 IP 10.0.0.6.1883 > 10.0.0.8.45026: Flags [P.], seq 3582167232:3582167236, ack 3315441297, win 85, options [nop,nop,TS val 3792682180 ecr 1097387662], length 4
00:01:25.139649 IP 10.0.0.6.1883 > 10.0.0.8.45026: Flags [P.], seq 3582167236:3582167240, ack 3315441692, win 85, options [nop,nop,TS val 3792683181 ecr 1097388663], length 4
00:01:25.140259 IP 10.0.0.6.1883 > 10.0.0.8.45026: Flags [P.], seq 3582167240:3582167244, ack 3315441696, win 85, options [nop,nop,TS val 3792683182 ecr 1097388664], length 4
00:01:26.140231 IP 10.0.0.6.1883 > 10.0.0.8.45026: Flags [P.], seq 3582167244:3582167248, ack 3315442091, win 85, options [nop,nop,TS val 3792684182 ecr 1097389664], length 4
00:01:26.140640 IP 10.0.0.6.1883 > 10.0.0.8.45026: Flags [P.], seq 3582167248:3582167252, ack 3315442095, win 85, options [nop,nop,TS val 3792684182 ecr 1097389664], length 4
00:01:27.145378 IP 10.0.0.6.1883 > 10.0.0.8.45026: Flags [P.], seq 3582167252:3582167256, ack 3315442490, win 85, options [nop,nop,TS val 3792685187 ecr 1097390668], length 4
00:01:27.146530 IP 10.0.0.6.1883 > 10.0.0.8.45026: Flags [P.], seq 3582167256:3582167260, ack 3315442494, win 85, options [nop,nop,TS val 3792685188 ecr 1097390669], length 4
00:01:28.149514 IP 10.0.0.6.1883 > 10.0.0.8.45026: Flags [P.], seq 3582167260:3582167264, ack 3315442889, win 85, options [nop,nop,TS val 3792686191 ecr 1097391672], length 4
00:01:28.150593 IP 10.0.0.6.1883 > 10.0.0.8.45026: Flags [P.], seq 3582167264:3582167268, ack 3315442893, win 85, options [nop,nop,TS val 3792686192 ecr 1097391674], length 4
00:01:29.013168 IP 10.0.0.6.1883 > 10.0.0.8.45026: Flags [P.], seq 3582167268:3582167270, ack 3315442895, win 85, options [nop,nop,TS val 3792687055 ecr 1097392536], length 2
00:01:29.151909 IP 10.0.0.6.1883 > 10.0.0.8.45026: Flags [P.], seq 3582167270:3582167274, ack 3315443290, win 85, options [nop,nop,TS val 3792687194 ecr 1097392675], length 4
00:01:29.153343 IP 10.0.0.6.1883 > 10.0.0.8.45026: Flags [P.], seq 3582167274:3582167278, ack 3315443294, win 85, options [nop,nop,TS val 3792687195 ecr 1097392676], length 4
00:01:30.153079 IP 10.0.0.6.1883 > 10.0.0.8.45026: Flags [P.], seq 3582167278:3582167282, ack 3315443689, win 85, options [nop,nop,TS val 3792688195 ecr 1097393676], length 4
00:01:30.154190 IP 10.0.0.6.1883 > 10.0.0.8.45026: Flags [P.], seq 3582167282:3582167286, ack 3315443693, win 85, options [nop,nop,TS val 3792688196 ecr 1097393677], length 4
00:01:31.154550 IP 10.0.0.6.1883 > 10.0.0.8.45026: Flags [P.], seq 3582167286:3582167290, ack 3315444088, win 85, options [nop,nop,TS val 3792689196 ecr 1097394677], length 4
00:01:31.156136 IP 10.0.0.6.1883 > 10.0.0.8.45026: Flags [P.], seq 3582167290:3582167294, ack 3315444092, win 85, options [nop,nop,TS val 3792689198 ecr 1097394679], length 4
00:01:32.155597 IP 10.0.0.6.1883 > 10.0.0.8.45026: Flags [P.], seq 3582167294:3582167298, ack 3315444487, win 85, options [nop,nop,TS val 3792690197 ecr 1097395678], length 4
00:01:32.156162 IP 10.0.0.6.1883 > 10.0.0.8.45026: Flags [P.], seq 3582167298:3582167302, ack 3315444491, win 85, options [nop,nop,TS val 3792690198 ecr 1097395680], length 4
00:01:33.157402 IP 10.0.0.6.1883 > 10.0.0.8.45026: Flags [P.], seq 3582167302:3582167306, ack 3315444886, win 85, options [nop,nop,TS val 3792691199 ecr 1097396680], length 4
00:01:33.157939 IP 10.0.0.6.1883 > 10.0.0.8.45026: Flags [P.], seq 3582167306:3582167310, ack 3315444890, win 85, options [nop,nop,TS val 3792691200 ecr 1097396681], length 4
00:01:34.015560 IP 10.0.0.6.1883 > 10.0.0.8.45026: Flags [P.], seq 3582167310:3582167312, ack 3315444892, win 85, options [nop,nop,TS val 3792692057 ecr 1097397539], length 2
00:01:34.158441 IP 10.0.0.6.1883 > 10.0.0.8.45026: Flags [P.], seq 3582167312:3582167316, ack 3315445287, win 85, options [nop,nop,TS val 3792692200 ecr 1097397681], length 4
00:01:34.158919 IP 10.0.0.6.1883 > 10.0.0.8.45026: Flags [P.], seq 3582167316:3582167320, ack 3315445291, win 85, options [nop,nop,TS val 3792692201 ecr 1097397682], length 4
00:01:35.159523 IP 10.0.0.6.1883 > 10.0.0.8.45026: Flags [P.], seq 3582167320:3582167324, ack 3315445686, win 85, options [nop,nop,TS val 3792693201 ecr 1097398682], length 4
00:01:35.160843 IP 10.0.0.6.1883 > 10.0.0.8.45026: Flags [P.], seq 3582167324:3582167328, ack 3315445690, win 85, options [nop,nop,TS val 3792693202 ecr 1097398684], length 4
00:01:36.160856 IP 10.0.0.6.1883 > 10.0.0.8.45026: Flags [P.], seq 3582167328:3582167332, ack 3315446085, win 85, options [nop,nop,TS val 3792694202 ecr 1097399684], length 4
00:01:36.161777 IP 10.0.0.6.1883 > 10.0.0.8.45026: Flags [P.], seq 3582167332:3582167336, ack 3315446089, win 85, options [nop,nop,TS val 3792694203 ecr 1097399685], length 4
00:01:37.161957 IP 10.0.0.6.1883 > 10.0.0.8.45026: Flags [P.], seq 3582167336:3582167340, ack 3315446484, win 85, options [nop,nop,TS val 3792695204 ecr 1097400685], length 4
00:01:37.162851 IP 10.0.0.6.1883 > 10.0.0.8.45026: Flags [P.], seq 3582167340:3582167344, ack 3315446488, win 85, options [nop,nop,TS val 3792695204 ecr 1097400686], length 4
00:01:38.166124 IP 10.0.0.6.1883 > 10.0.0.8.45026: Flags [P.], seq 3582167344:3582167348, ack 3315446883, win 85, options [nop,nop,TS val 3792696208 ecr 1097401689], length 4
00:01:38.167066 IP 10.0.0.6.1883 > 10.0.0.8.45026: Flags [P.], seq 3582167348:3582167352, ack 3315446887, win 85, options [nop,nop,TS val 3792696209 ecr 1097401690], length 4
00:01:39.017770 IP 10.0.0.6.1883 > 10.0.0.8.45026: Flags [P.], seq 3582167352:3582167354, ack 3315446889, win 85, options [nop,nop,TS val 3792697059 ecr 1097402540], length 2
00:01:39.167006 IP 10.0.0.6.1883 > 10.0.0.8.45026: Flags [P.], seq 3582167354:3582167358, ack 3315447284, win 85, options [nop,nop,TS val 3792697209 ecr 1097402690], length 4
00:01:39.167605 IP 10.0.0.6.1883 > 10.0.0.8.45026: Flags [P.], seq 3582167358:3582167362, ack 3315447288, win 85, options [nop,nop,TS val 3792697209 ecr 1097402691], length 4
00:01:40.167839 IP 10.0.0.6.1883 > 10.0.0.8.45026: Flags [P.], seq 3582167362:3582167366, ack 3315447683, win 85, options [nop,nop,TS val 3792698209 ecr 1097403691], length 4
00:01:40.168530 IP 10.0.0.6.1883 > 10.0.0.8.45026: Flags [P.], seq 3582167366:3582167370, ack 3315447687, win 85, options [nop,nop,TS val 3792698210 ecr 1097403692], length 4
00:01:41.169045 IP 10.0.0.6.1883 > 10.0.0.8.45026: Flags [P.], seq 3582167370:3582167374, ack 3315448082, win 85, options [nop,nop,TS val 3792699211 ecr 1097404692], length 4
00:01:41.169524 IP 10.0.0.6.1883 > 10.0.0.8.45026: Flags [P.], seq 3582167374:3582167378, ack 3315448086, win 85, options [nop,nop,TS val 3792699211 ecr 1097404693], length 4
00:01:42.170281 IP 10.0.0.6.1883 > 10.0.0.8.45026: Flags [P.], seq 3582167378:3582167382, ack 3315448481, win 85, options [nop,nop,TS val 3792700212 ecr 1097405693], length 4
00:01:42.171780 IP 10.0.0.6.1883 > 10.0.0.8.45026: Flags [P.], seq 3582167382:3582167386, ack 3315448485, win 85, options [nop,nop,TS val 3792700213 ecr 1097405694], length 4
00:01:43.170620 IP 10.0.0.6.1883 > 10.0.0.8.45026: Flags [P.], seq 3582167386:3582167390, ack 3315448880, win 85, options [nop,nop,TS val 3792701212 ecr 1097406694], length 4
00:01:43.171311 IP 10.0.0.6.1883 > 10.0.0.8.45026: Flags [P.], seq 3582167390:3582167394, ack 3315448884, win 85, options [nop,nop,TS val 3792701213 ecr 1097406695], length 4
00:01:44.019707 IP 10.0.0.6.1883 > 10.0.0.8.45026: Flags [P.], seq 3582167394:3582167396, ack 3315448886, win 85, options [nop,nop,TS val 3792702061 ecr 1097407543], length 2
00:01:44.171845 IP 10.0.0.6.1883 > 10.0.0.8.45026: Flags [P.], seq 3582167396:3582167400, ack 3315449281, win 85, options [nop,nop,TS val 3792702213 ecr 1097407695], length 4
00:01:44.172488 IP 10.0.0.6.1883 > 10.0.0.8.45026: Flags [P.], seq 3582167400:3582167404, ack 3315449285, win 85, options [nop,nop,TS val 3792702214 ecr 1097407696], length 4
00:01:45.168416 IP 10.0.0.6.1883 > 10.0.0.8.45026: Flags [F.], seq 3582167404, ack 3315449286, win 85, options [nop,nop,TS val 3792703210 ecr 1097408691], length 0