00:00:12.515643 IP 10.0.0.6.1883 > 10.0.0.8.44896: Flags [S.], seq 1400237860, ack 1405119465, win 43440, options [mss 1460,sackOK,TS val 3791594224 ecr 1096299673,nop,wscale 9], length 0
00:00:12.533521 IP 10.0.0.6.1883 > 10.0.0.8.44896: Flags [.], ack 1405119485, win 85, options [nop,nop,TS val 3791594242 ecr 1096299723], length 0
00:00:12.533645 IP 10.0.0.6.1883 > 10.0.0.8.44896: Flags [P.], seq 1400237861:1400237865, ack 1405119485, win 85, options [nop,nop,TS val 3791594242 ecr 1096299723], length 4
00:00:12.535013 IP 10.0.0.6.1883 > 10.0.0.8.44896: Flags [P.], seq 1400237865:1400237930, ack 1405119549, win 85, options [nop,nop,TS val 3791594243 ecr 1096299724], length 65
00:00:12.535728 IP 10.0.0.6.1883 > 10.0.0.8.44896: Flags [P.], seq 1400237930:1400237935, ack 1405119944, win 85, options [nop,nop,TS val 3791594244 ecr 1096299725], length 5
00:00:12.580707 IP 10.0.0.6.1883 > 10.0.0.8.44896: Flags [P.], seq 1400237935:1400237939, ack 1405119944, win 85, options [nop,nop,TS val 3791594289 ecr 1096299771], length 4
00:00:12.581998 IP 10.0.0.6.1883 > 10.0.0.8.44896: Flags [P.], seq 1400237939:1400237943, ack 1405119948, win 85, options [nop,nop,TS val 3791594290 ecr 1096299771], length 4
00:00:13.504242 IP 10.0.0.6.1883 > 10.0.0.8.44896: Flags [P.], seq 1400237943:1400237947, ack 1405120343, win 85, options [nop,nop,TS val 3791595212 ecr 1096300693], length 4
00:00:13.505794 IP 10.0.0.6.1883 > 10.0.0.8.44896: Flags [P.], seq 1400237947:1400237951, ack 1405120347, win 85, options [nop,nop,TS val 3791595214 ecr 1096300695], length 4
00:00:13.789211 IP 10.0.0.6.1883 > 10.0.0.8.44896: Flags [P.], seq 1400237947:1400237951, ack 1405120347, win 85, options [nop,nop,TS val 3791595497 ecr 1096300695], length 4
00:00:14.535273 IP 10.0.0.6.1883 > 10.0.0.8.44896: Flags [P.], seq 1400237951:1400237955, ack 1405120742, win 85, options [nop,nop,TS val 3791596243 ecr 1096301724], length 4
00:00:14.537814 IP 10.0.0.6.1883 > 10.0.0.8.44896: Flags [P.], seq 1400237955:1400237959, ack 1405120746, win 85, options [nop,nop,TS val 3791596245 ecr 1096301727], length 4
00:00:15.538866 IP 10.0.0.6.1883 > 10.0.0.8.44896: Flags [P.], seq 1400237959:1400237963, ack 1405121141, win 85, options [nop,nop,TS val 3791597247 ecr 1096302727], length 4
00:00:15.541261 IP 10.0.0.6.1883 > 10.0.0.8.44896: Flags [P.], seq 1400237963:1400237967, ack 1405121145, win 85, options [nop,nop,TS val 3791597249 ecr 1096302731], length 4
00:00:16.542829 IP 10.0.0.6.1883 > 10.0.0.8.44896: Flags [P.], seq 1400237967:1400237971, ack 1405121540, win 85, options [nop,nop,TS val 3791598251 ecr 1096303730], length 4
00:00:16.544906 IP 10.0.0.6.1883 > 10.0.0.8.44896: Flags [P.], seq 1400237971:1400237975, ack 1405121544, win 85, options [nop,nop,TS val 3791598253 ecr 1096303734], length 4
00:00:17.536637 IP 10.0.0.6.1883 > 10.0.0.8.44896: Flags [P.], seq 1400237975:1400237977, ack 1405121546, win 85, options [nop,nop,TS val 3791599244 ecr 1096304726], length 2
00:00:17.541903 IP 10.0.0.6.1883 > 10.0.0.8.44896: Flags [P.], seq 1400237977:1400237981, ack 1405121941, win 85, options [nop,nop,TS val 3791599250 ecr 1096304731], length 4
00:00:17.543322 IP 10.0.0.6.1883 > 10.0.0.8.44896: Flags [P.], seq 1400237981:1400237985, ack 1405121945, win 85, options [nop,nop,TS val 3791599251 ecr 1096304733], length 4
00:00:18.556780 IP 10.0.0.6.1883 > 10.0.0.8.44896: Flags [P.], seq 1400237985:1400237989, ack 1405122340, win 85, options [nop,nop,TS val 3791600265 ecr 1096305744], length 4
00:00:18.559219 IP 10.0.0.6.1883 > 10.0.0.8.44896: Flags [P.], seq 1400237989:1400237993, ack 1405122344, win 85, options [nop,nop,TS val 3791600267 ecr 1096305747], length 4
00:00:19.556871 IP 10.0.0.6.1883 > 10.0.0.8.44896: Flags [P.], seq 1400237993:1400237997, ack 1405122739, win 85, options [nop,nop,TS val 3791601265 ecr 1096306746], length 4
00:00:19.558369 IP 10.0.0.6.1883 > 10.0.0.8.44896: Flags [P.], seq 1400237997:1400238001, ack 1405122743, win 85, options [nop,nop,TS val 3791601266 ecr 1096306747], length 4
00:00:20.558210 IP 10.0.0.6.1883 > 10.0.0.8.44896: Flags [P.], seq 1400238001:1400238005, ack 1405123138, win 85, options [nop,nop,TS val 3791602266 ecr 1096307747], length 4
00:00:20.559656 IP 10.0.0.6.1883 > 10.0.0.8.44896: Flags [P.], seq 1400238005:1400238009, ack 1405123142, win 85, options [nop,nop,TS val 3791602268 ecr 1096307749], length 4
00:00:21.558338 IP 10.0.0.6.1883 > 10.0.0.8.44896: Flags [P.], seq 1400238009:1400238013, ack 1405123537, win 85, options [nop,nop,TS val 3791603266 ecr 1096308748], length 4
00:00:21.559009 IP 10.0.0.6.1883 > 10.0.0.8.44896: Flags [P.], seq 1400238013:1400238017, ack 1405123541, win 85, options [nop,nop,TS val 3791603267 ecr 1096308749], length 4
00:00:22.537709 IP 10.0.0.6.1883 > 10.0.0.8.44896: Flags [P.], seq 1400238017:1400238019, ack 1405123543, win 85, options [nop,nop,TS val 3791604246 ecr 1096309727], length 2
00:00:22.559536 IP 10.0.0.6.1883 > 10.0.0.8.44896: Flags [P.], seq 1400238019:1400238023, ack 1405123938, win 85, options [nop,nop,TS val 3791604268 ecr 1096309749], length 4
00:00:22.560786 IP 10.0.0.6.1883 > 10.0.0.8.44896: Flags [P.], seq 1400238023:1400238027, ack 1405123942, win 85, options [nop,nop,TS val 3791604269 ecr 1096309750], length 4
00:00:23.561269 IP 10.0.0.6.1883 > 10.0.0.8.44896: Flags [P.], seq 1400238027:1400238031, ack 1405124337, win 85, options [nop,nop,TS val 3791605269 ecr 1096310750], length 4
00:00:23.562934 IP 10.0.0.6.1883 > 10.0.0.8.44896: Flags [P.], seq 1400238031:1400238035, ack 1405124341, win 85, options [nop,nop,TS val 3791605271 ecr 1096310752], length 4
00:00:24.562146 IP 10.0.0.6.1883 > 10.0.0.8.44896: Flags [P.], seq 1400238035:1400238039, ack 1405124736, win 85, options [nop,nop,TS val 3791606270 ecr 1096311751], length 4
00:00:24.564152 IP 10.0.0.6.1883 > 10.0.0.8.44896: Flags [P.], seq 1400238039:1400238043, ack 1405124740, win 85, options [nop,nop,TS val 3791606272 ecr 1096311753], length 4
00:00:25.563659 IP 10.0.0.6.1883 > 10.0.0.8.44896: Flags [P.], seq 1400238043:1400238047, ack 1405125135, win 85, options [nop,nop,TS val 3791607272 ecr 1096312753], length 4
00:00:25.565837 IP 10.0.0.6.1883 > 10.0.0.8.44896: Flags [P.], seq 1400238047:1400238051, ack 1405125139, win 85, options [nop,nop,TS val 3791607274 ecr 1096312754], length 4
00:00:26.565221 IP 10.0.0.6.1883 > 10.0.0.8.44896: Flags [P.], seq 1400238051:1400238055, ack 1405125534, win 85, options [nop,nop,TS val 3791608273 ecr 1096313754], length 4
00:00:26.566679 IP 10.0.0.6.1883 > 10.0.0.8.44896: Flags [P.], seq 1400238055:1400238059, ack 1405125538, win 85, options [nop,nop,TS val 3791608275 ecr 1096313756], length 4
00:00:27.539336 IP 10.0.0.6.1883 > 10.0.0.8.44896: Flags [P.], seq 1400238059:1400238061, ack 1405125540, win 85, options [nop,nop,TS val 3791609247 ecr 1096314729], length 2
00:00:27.565906 IP 10.0.0.6.1883 > 10.0.0.8.44896: Flags [P.], seq 1400238061:1400238065, ack 1405125935, win 85, options [nop,nop,TS val 3791609274 ecr 1096314755], length 4
00:00:27.567291 IP 10.0.0.6.1883 > 10.0.0.8.44896: Flags [P.], seq 1400238065:1400238069, ack 1405125939, win 85, options [nop,nop,TS val 3791609275 ecr 1096314756], length 4
00:00:28.567043 IP 10.0.0.6.1883 > 10.0.0.8.44896: Flags [P.], seq 1400238069:1400238073, ack 1405126334, win 85, options [nop,nop,TS val 3791610275 ecr 1096315756], length 4
00:00:28.568963 IP 10.0.0.6.1883 > 10.0.0.8.44896: Flags [P.], seq 1400238073:1400238077, ack 1405126338, win 85, options [nop,nop,TS val 3791610277 ecr 1096315758], length 4
00:00:29.568306 IP 10.0.0.6.1883 > 10.0.0.8.44896: Flags [P.], seq 1400238077:1400238081, ack 1405126733, win 85, options [nop,nop,TS val 3791611276 ecr 1096316758], length 4
00:00:29.568827 IP 10.0.0.6.1883 > 10.0.0.8.44896: Flags [P.], seq 1400238081:1400238085, ack 1405126737, win 85, options [nop,nop,TS val 3791611277 ecr 1096316759], length 4
00:00:30.569662 IP 10.0.0.6.1883 > 10.0.0.8.44896: Flags [P.], seq 1400238085:1400238089, ack 1405127132, win 85, options [nop,nop,TS val 3791612278 ecr 1096317759], length 4
00:00:30.571122 IP 10.0.0.6.1883 > 10.0.0.8.44896: Flags [P.], seq 1400238089:1400238093, ack 1405127136, win 85, options [nop,nop,TS val 3791612279 ecr 1096317760], length 4
00:00:31.570420 IP 10.0.0.6.1883 > 10.0.0.8.44896: Flags [P.], seq 1400238093:1400238097, ack 1405127531, win 85, options [nop,nop,TS val 3791613278 ecr 1096318759], length 4
00:00:31.572327 IP 10.0.0.6.1883 > 10.0.0.8.44896: Flags [P.], seq 1400238097:1400238101, ack 1405127535, win 85, options [nop,nop,TS val 3791613280 ecr 1096318761], length 4
00:00:32.539992 IP 10.0.0.6.1883 > 10.0.0.8.44896: Flags [P.], seq 1400238101:1400238103, ack 1405127537, win 85, options [nop,nop,TS val 3791614248 ecr 1096319730], length 2
00:00:32.571257 IP 10.0.0.6.1883 > 10.0.0.8.44896: Flags [P.], seq 1400238103:1400238107, ack 1405127932, win 85, options [nop,nop,TS val 3791614279 ecr 1096319761], length 4
00:00:32.572366 IP 10.0.0.6.1883 > 10.0.0.8.44896: Flags [P.], seq 1400238107:1400238111, ack 1405127936, win 85, options [nop,nop,TS val 3791614280 ecr 1096319762], length 4
00:00:33.571936 IP 10.0.0.6.1883 > 10.0.0.8.44896: Flags [P.], seq 1400238111:1400238115, ack 1405128331, win 85, options [nop,nop,TS val 3791615280 ecr 1096320762], length 4
00:00:33.572673 IP 10.0.0.6.1883 > 10.0.0.8.44896: Flags [P.], seq 1400238115:1400238119, ack 1405128335, win 85, options [nop,nop,TS val 3791615281 ecr 1096320763], length 4
00:00:34.572940 IP 10.0.0.6.1883 > 10.0.0.8.44896: Flags [P.], seq 1400238119:1400238123, ack 1405128730, win 85, options [nop,nop,TS val 3791616281 ecr 1096321763], length 4
00:00:34.573480 IP 10.0.0.6.1883 > 10.0.0.8.44896: Flags [P.], seq 1400238123:1400238127, ack 1405128734, win 85, options [nop,nop,TS val 3791616282 ecr 1096321763], length 4
00:00:35.574633 IP 10.0.0.6.1883 > 10.0.0.8.44896: Flags [P.], seq 1400238127:1400238131, ack 1405129129, win 85, options [nop,nop,TS val 3791617283 ecr 1096322764], length 4
00:00:35.576636 IP 10.0.0.6.1883 > 10.0.0.8.44896: Flags [P.], seq 1400238131:1400238135, ack 1405129133, win 85, options [nop,nop,TS val 3791617285 ecr 1096322765], length 4
00:00:36.576849 IP 10.0.0.6.1883 > 10.0.0.8.44896: Flags [P.], seq 1400238135:1400238139, ack 1405129528, win 85, options [nop,nop,TS val 3791618285 ecr 1096323765], length 4
00:00:36.578518 IP 10.0.0.6.1883 > 10.0.0.8.44896: Flags [P.], seq 1400238139:1400238143, ack 1405129532, win 85, options [nop,nop,TS val 3791618287 ecr 1096323767], length 4
00:00:37.541712 IP 10.0.0.6.1883 > 10.0.0.8.44896: Flags [P.], seq 1400238143:1400238145, ack 1405129534, win 85, options [nop,nop,TS val 3791619250 ecr 1096324731], length 2
00:00:37.576973 IP 10.0.0.6.1883 > 10.0.0.8.44896: Flags [P.], seq 1400238145:1400238149, ack 1405129929, win 85, options [nop,nop,TS val 3791619285 ecr 1096324766], length 4
00:00:37.581133 IP 10.0.0.6.1883 > 10.0.0.8.44896: Flags [P.], seq 1400238149:1400238153, ack 1405129933, win 85, options [nop,nop,TS val 3791619289 ecr 1096324768], length 4
00:00:38.577430 IP 10.0.0.6.1883 > 10.0.0.8.44896: Flags [P.], seq 1400238153:1400238157, ack 1405130328, win 85, options [nop,nop,TS val 3791620286 ecr 1096325767], length 4
00:00:38.577926 IP 10.0.0.6.1883 > 10.0.0.8.44896: Flags [P.], seq 1400238157:1400238161, ack 1405130332, win 85, options [nop,nop,TS val 3791620286 ecr 1096325768], length 4
00:00:39.580362 IP 10.0.0.6.1883 > 10.0.0.8.44896: Flags [P.], seq 1400238161:1400238165, ack 1405130727, win 85, options [nop,nop,TS val 3791621288 ecr 1096326769], length 4
00:00:39.581780 IP 10.0.0.6.1883 > 10.0.0.8.44896: Flags [P.], seq 1400238165:1400238169, ack 1405130731, win 85, options [nop,nop,TS val 3791621290 ecr 1096326771], length 4
00:00:40.581327 IP 10.0.0.6.1883 > 10.0.0.8.44896: Flags [P.], seq 1400238169:1400238173, ack 1405131126, win 85, options [nop,nop,TS val 3791622289 ecr 1096327771], length 4
00:00:40.581994 IP 10.0.0.6.1883 > 10.0.0.8.44896: Flags [P.], seq 1400238173:1400238177, ack 1405131130, win 85, options [nop,nop,TS val 3791622290 ecr 1096327772], length 4
00:00:41.584486 IP 10.0.0.6.1883 > 10.0.0.8.44896: Flags [P.], seq 1400238177:1400238181, ack 1405131525, win 85, options [nop,nop,TS val 3791623293 ecr 1096328774], length 4
00:00:41.585187 IP 10.0.0.6.1883 > 10.0.0.8.44896: Flags [P.], seq 1400238181:1400238185, ack 1405131529, win 85, options [nop,nop,TS val 3791623293 ecr 1096328775], length 4
00:00:42.546714 IP 10.0.0.6.1883 > 10.0.0.8.44896: Flags [P.], seq 1400238185:1400238187, ack 1405131531, win 85, options [nop,nop,TS val 3791624255 ecr 1096329737], length 2
00:00:42.586884 IP 10.0.0.6.1883 > 10.0.0.8.44896: Flags [P.], seq 1400238187:1400238191, ack 1405131926, win 85, options [nop,nop,TS val 3791624295 ecr 1096329776], length 4
00:00:42.588529 IP 10.0.0.6.1883 > 10.0.0.8.44896: Flags [P.], seq 1400238191:1400238195, ack 1405131930, win 85, options [nop,nop,TS val 3791624297 ecr 1096329778], length 4
00:00:43.587113 IP 10.0.0.6.1883 > 10.0.0.8.44896: Flags [P.], seq 1400238195:1400238199, ack 1405132325, win 85, options [nop,nop,TS val 3791625295 ecr 1096330777], length 4
00:00:43.587489 IP 10.0.0.6.1883 > 10.0.0.8.44896: Flags [P.], seq 1400238199:1400238203, ack 1405132329, win 85, options [nop,nop,TS val 3791625296 ecr 1096330777], length 4
00:00:44.588992 IP 10.0.0.6.1883 > 10.0.0.8.44896: Flags [P.], seq 1400238203:1400238207, ack 1405132724, win 85, options [nop,nop,TS val 3791626297 ecr 1096331778], length 4
00:00:44.590771 IP 10.0.0.6.1883 > 10.0.0.8.44896: Flags [P.], seq 1400238207:1400238211, ack 1405132728, win 85, options [nop,nop,TS val 3791626299 ecr 1096331780], length 4
00:00:45.592608 IP 10.0.0.6.1883 > 10.0.0.8.44896: Flags [P.], seq 1400238211:1400238215, ack 1405133123, win 85, options [nop,nop,TS val 3791627301 ecr 1096332781], length 4
00:00:45.593762 IP 10.0.0.6.1883 > 10.0.0.8.44896: Flags [P.], seq 1400238215:1400238219, ack 1405133127, win 85, options [nop,nop,TS val 3791627302 ecr 1096332783], length 4
00:00:46.594688 IP 10.0.0.6.1883 > 10.0.0.8.44896: Flags [P.], seq 1400238219:1400238223, ack 1405133522, win 85, options [nop,nop,TS val 3791628303 ecr 1096333782], length 4
00:00:46.596423 IP 10.0.0.6.1883 > 10.0.0.8.44896: Flags [P.], seq 1400238223:1400238227, ack 1405133526, win 85, options [nop,nop,TS val 3791628304 ecr 1096333785], length 4
00:00:47.548695 IP 10.0.0.6.1883 > 10.0.0.8.44896: Flags [P.], seq 1400238227:1400238229, ack 1405133528, win 85, options [nop,nop,TS val 3791629257 ecr 1096334738], length 2
00:00:47.594544 IP 10.0.0.6.1883 > 10.0.0.8.44896: Flags [P.], seq 1400238229:1400238233, ack 1405133923, win 85, options [nop,nop,TS val 3791629303 ecr 1096334783], length 4
00:00:47.594868 IP 10.0.0.6.1883 > 10.0.0.8.44896: Flags [P.], seq 1400238233:1400238237, ack 1405133927, win 85, options [nop,nop,TS val 3791629303 ecr 1096334785], length 4
00:00:48.595096 IP 10.0.0.6.1883 > 10.0.0.8.44896: Flags [P.], seq 1400238237:1400238241, ack 1405134322, win 85, options [nop,nop,TS val 3791630303 ecr 1096335785], length 4
00:00:48.595723 IP 10.0.0.6.1883 > 10.0.0.8.44896: Flags [P.], seq 1400238241:1400238245, ack 1405134326, win 85, options [nop,nop,TS val 3791630304 ecr 1096335785], length 4
00:00:49.598231 IP 10.0.0.6.1883 > 10.0.0.8.44896: Flags [P.], seq 1400238245:1400238249, ack 1405134721, win 85, options [nop,nop,TS val 3791631305 ecr 1096336786], length 4
00:00:49.600747 IP 10.0.0.6.1883 > 10.0.0.8.44896: Flags [P.], seq 1400238249:1400238253, ack 1405134725, win 85, options [nop,nop,TS val 3791631309 ecr 1096336789], length 4
00:00:50.599079 IP 10.0.0.6.1883 > 10.0.0.8.44896: Flags [P.], seq 1400238253:1400238257, ack 1405135120, win 85, options [nop,nop,TS val 3791632307 ecr 1096337787], length 4
00:00:50.600219 IP 10.0.0.6.1883 > 10.0.0.8.44896: Flags [P.], seq 1400238257:1400238261, ack 1405135124, win 85, options [nop,nop,TS val 3791632308 ecr 1096337790], length 4
00:00:51.597589 IP 10.0.0.6.1883 > 10.0.0.8.44896: Flags [P.], seq 1400238261:1400238265, ack 1405135519, win 85, options [nop,nop,TS val 3791633306 ecr 1096338787], length 4
00:00:51.598224 IP 10.0.0.6.1883 > 10.0.0.8.44896: Flags [P.], seq 1400238265:1400238269, ack 1405135523, win 85, options [nop,nop,TS val 3791633306 ecr 1096338788], length 4
00:00:52.550688 IP 10.0.0.6.1883 > 10.0.0.8.44896: Flags [P.], seq 1400238269:1400238271, ack 1405135525, win 85, options [nop,nop,TS val 3791634259 ecr 1096339739], length 2
00:00:52.600888 IP 10.0.0.6.1883 > 10.0.0.8.44896: Flags [P.], seq 1400238271:1400238275, ack 1405135920, win 85, options [nop,nop,TS val 3791634309 ecr 1096339789], length 4
00:00:52.602444 IP 10.0.0.6.1883 > 10.0.0.8.44896: Flags [P.], seq 1400238275:1400238279, ack 1405135924, win 85, options [nop,nop,TS val 3791634310 ecr 1096339791], length 4
00:00:53.600660 IP 10.0.0.6.1883 > 10.0.0.8.44896: Flags [P.], seq 1400238279:1400238283, ack 1405136319, win 85, options [nop,nop,TS val 3791635309 ecr 1096340790], length 4
00:00:53.601188 IP 10.0.0.6.1883 > 10.0.0.8.44896: Flags [P.], seq 1400238283:1400238287, ack 1405136323, win 85, options [nop,nop,TS val 3791635309 ecr 1096340791], length 4
00:00:54.604329 IP 10.0.0.6.1883 > 10.0.0.8.44896: Flags [P.], seq 1400238287:1400238291, ack 1405136718, win 85, options [nop,nop,TS val 3791636312 ecr 1096341792], length 4
00:00:54.605925 IP 10.0.0.6.1883 > 10.0.0.8.44896: Flags [P.], seq 1400238291:1400238295, ack 1405136722, win 85, options [nop,nop,TS val 3791636314 ecr 1096341795], length 4
00:00:55.604338 IP 10.0.0.6.1883 > 10.0.0.8.44896: Flags [P.], seq 1400238295:1400238299, ack 1405137117, win 85, options [nop,nop,TS val 3791637312 ecr 1096342793], length 4
00:00:55.607204 IP 10.0.0.6.1883 > 10.0.0.8.44896: Flags [P.], seq 1400238299:1400238303, ack 1405137121, win 85, options [nop,nop,TS val 3791637315 ecr 1096342795], length 4
00:00:56.606918 IP 10.0.0.6.1883 > 10.0.0.8.44896: Flags [P.], seq 1400238303:1400238307, ack 1405137516, win 85, options [nop,nop,TS val 3791638315 ecr 1096343795], length 4
00:00:56.608589 IP 10.0.0.6.1883 > 10.0.0.8.44896: Flags [P.], seq 1400238307:1400238311, ack 1405137520, win 85, options [nop,nop,TS val 3791638317 ecr 1096343797], length 4
00:00:57.718002 IP 10.0.0.6.1883 > 10.0.0.8.44896: Flags [P.], seq 1400238311:1400238315, ack 1405137915, win 85, options [nop,nop,TS val 3791639426 ecr 1096344907], length 4
00:00:57.726921 IP 10.0.0.6.1883 > 10.0.0.8.44896: Flags [P.], seq 1400238315:1400238317, ack 1405137917, win 85, options [nop,nop,TS val 3791639435 ecr 1096344916], length 2
00:00:57.730187 IP 10.0.0.6.1883 > 10.0.0.8.44896: Flags [P.], seq 1400238317:1400238321, ack 1405137921, win 85, options [nop,nop,TS val 3791639438 ecr 1096344920], length 4
00:00:58.735429 IP 10.0.0.6.1883 > 10.0.0.8.44896: Flags [P.], seq 1400238321:1400238325, ack 1405138316, win 85, options [nop,nop,TS val 3791640443 ecr 1096345921], length 4
00:00:58.736966 IP 10.0.0.6.1883 > 10.0.0.8.44896: Flags [P.], seq 1400238325:1400238329, ack 1405138320, win 85, options [nop,nop,TS val 3791640445 ecr 1096345926], length 4
00:00:59.736475 IP 10.0.0.6.1883 > 10.0.0.8.44896: Flags [P.], seq 1400238329:1400238333, ack 1405138715, win 85, options [nop,nop,TS val 3791641445 ecr 1096346924], length 4
00:00:59.745560 IP 10.0.0.6.1883 > 10.0.0.8.44896: Flags [P.], seq 1400238333:1400238337, ack 1405138719, win 85, options [nop,nop,TS val 3791641453 ecr 1096346934], length 4
00:01:00.739967 IP 10.0.0.6.1883 > 10.0.0.8.44896: Flags [P.], seq 1400238337:1400238341, ack 1405139114, win 85, options [nop,nop,TS val 3791642447 ecr 1096347927], length 4
00:01:00.742850 IP 10.0.0.6.1883 > 10.0.0.8.44896: Flags [P.], seq 1400238341:1400238345, ack 1405139118, win 85, options [nop,nop,TS val 3791642451 ecr 1096347931], length 4
00:01:01.741122 IP 10.0.0.6.1883 > 10.0.0.8.44896: Flags [P.], seq 1400238345:1400238349, ack 1405139513, win 85, options [nop,nop,TS val 3791643449 ecr 1096348928], length 4
00:01:01.749369 IP 10.0.0.6.1883 > 10.0.0.8.44896: Flags [P.], seq 1400238349:1400238353, ack 1405139517, win 85, options [nop,nop,TS val 3791643457 ecr 1096348938], length 4
00:01:02.744954 IP 10.0.0.6.1883 > 10.0.0.8.44896: Flags [P.], seq 1400238353:1400238357, ack 1405139912, win 85, options [nop,nop,TS val 3791644453 ecr 1096349932], length 4
00:01:02.750207 IP 10.0.0.6.1883 > 10.0.0.8.44896: Flags [P.], seq 1400238357:1400238359, ack 1405139914, win 85, options [nop,nop,TS val 3791644458 ecr 1096349939], length 2
00:01:02.752493 IP 10.0.0.6.1883 > 10.0.0.8.44896: Flags [P.], seq 1400238359:1400238363, ack 1405139918, win 85, options [nop,nop,TS val 3791644461 ecr 1096349942], length 4
00:01:03.745723 IP 10.0.0.6.1883 > 10.0.0.8.44896: Flags [P.], seq 1400238363:1400238367, ack 1405140313, win 85, options [nop,nop,TS val 3791645454 ecr 1096350934], length 4
00:01:03.746509 IP 10.0.0.6.1883 > 10.0.0.8.44896: Flags [P.], seq 1400238367:1400238371, ack 1405140317, win 85, options [nop,nop,TS val 3791645455 ecr 1096350936], length 4
00:01:04.747855 IP 10.0.0.6.1883 > 10.0.0.8.44896: Flags [P.], seq 1400238371:1400238375, ack 1405140712, win 85, options [nop,nop,TS val 3791646456 ecr 1096351936], length 4
00:01:04.750377 IP 10.0.0.6.1883 > 10.0.0.8.44896: Flags [P.], seq 1400238375:1400238379, ack 1405140716, win 85, options [nop,nop,TS val 3791646458 ecr 1096351940], length 4
00:01:05.749236 IP 10.0.0.6.1883 > 10.0.0.8.44896: Flags [P.], seq 1400238379:1400238383, ack 1405141111, win 85, options [nop,nop,TS val 3791647457 ecr 1096352937], length 4
00:01:05.750531 IP 10.0.0.6.1883 > 10.0.0.8.44896: Flags [P.], seq 1400238383:1400238387, ack 1405141115, win 85, options [nop,nop,TS val 3791647459 ecr 1096352940], length 4
00:01:06.751510 IP 10.0.0.6.1883 > 10.0.0.8.44896: Flags [P.], seq 1400238387:1400238391, ack 1405141510, win 85, options [nop,nop,TS val 3791648459 ecr 1096353939], length 4
00:01:06.754548 IP 10.0.0.6.1883 > 10.0.0.8.44896: Flags [P.], seq 1400238391:1400238395, ack 1405141514, win 85, options [nop,nop,TS val 3791648463 ecr 1096353943], length 4
00:01:07.749045 IP 10.0.0.6.1883 > 10.0.0.8.44896: Flags [P.], seq 1400238395:1400238397, ack 1405141516, win 85, options [nop,nop,TS val 3791649455 ecr 1096354935], length 2
00:01:07.757478 IP 10.0.0.6.1883 > 10.0.0.8.44896: Flags [P.], seq 1400238397:1400238401, ack 1405141911, win 85, options [nop,nop,TS val 3791649465 ecr 1096354944], length 4
00:01:07.759351 IP 10.0.0.6.1883 > 10.0.0.8.44896: Flags [P.], seq 1400238401:1400238405, ack 1405141915, win 85, options [nop,nop,TS val 3791649467 ecr 1096354948], length 4
00:01:08.086942 IP 10.0.0.6.1883 > 10.0.0.8.44896: Flags [P.], seq 1400238401:1400238405, ack 1405141915, win 85, options [nop,nop,TS val 3791649795 ecr 1096354948], length 4
00:01:08.760120 IP 10.0.0.6.1883 > 10.0.0.8.44896: Flags [P.], seq 1400238405:1400238409, ack 1405142310, win 85, options [nop,nop,TS val 3791650467 ecr 1096355947], length 4
00:01:08.763712 IP 10.0.0.6.1883 > 10.0.0.8.44896: Flags [P.], seq 1400238409:1400238413, ack 1405142314, win 85, options [nop,nop,TS val 3791650472 ecr 1096355953], length 4
00:01:09.764260 IP 10.0.0.6.1883 > 10.0.0.8.44896: Flags [P.], seq 1400238413:1400238417, ack 1405142709, win 85, options [nop,nop,TS val 3791651472 ecr 1096356951], length 4
00:01:09.773662 IP 10.0.0.6.1883 > 10.0.0.8.44896: Flags [P.], seq 1400238417:1400238421, ack 1405142713, win 85, options [nop,nop,TS val 3791651481 ecr 1096356962], length 4
00:01:10.769669 IP 10.0.0.6.1883 > 10.0.0.8.44896: Flags [P.], seq 1400238421:1400238425, ack 1405143108, win 85, options [nop,nop,TS val 3791652478 ecr 1096357957], length 4
00:01:10.772463 IP 10.0.0.6.1883 > 10.0.0.8.44896: Flags [P.], seq 1400238425:1400238429, ack 1405143112, win 85, options [nop,nop,TS val 3791652480 ecr 1096357960], length 4
00:01:11.773738 IP 10.0.0.6.1883 > 10.0.0.8.44896: Flags [P.], seq 1400238429:1400238433, ack 1405143507, win 85, options [nop,nop,TS val 3791653482 ecr 1096358961], length 4
00:01:11.776465 IP 10.0.0.6.1883 > 10.0.0.8.44896: Flags [P.], seq 1400238433:1400238437, ack 1405143511, win 85, options [nop,nop,TS val 3791653484 ecr 1096358964], length 4
00:01:12.770973 IP 10.0.0.6.1883 > 10.0.0.8.44896: Flags [P.], seq 1400238437:1400238439, ack 1405143513, win 85, options [nop,nop,TS val 3791654479 ecr 1096359961], length 2
00:01:12.772855 IP 10.0.0.6.1883 > 10.0.0.8.44896: Flags [P.], seq 1400238439:1400238443, ack 1405143908, win 85, options [nop,nop,TS val 3791654481 ecr 1096359963], length 4
00:01:12.773271 IP 10.0.0.6.1883 > 10.0.0.8.44896: Flags [P.], seq 1400238443:1400238447, ack 1405143912, win 85, options [nop,nop,TS val 3791654481 ecr 1096359963], length 4
00:01:13.775456 IP 10.0.0.6.1883 > 10.0.0.8.44896: Flags [P.], seq 1400238447:1400238451, ack 1405144307, win 85, options [nop,nop,TS val 3791655483 ecr 1096360964], length 4
00:01:13.781811 IP 10.0.0.6.1883 > 10.0.0.8.44896: Flags [P.], seq 1400238451:1400238455, ack 1405144311, win 85, options [nop,nop,TS val 3791655490 ecr 1096360972], length 4
00:01:14.775994 IP 10.0.0.6.1883 > 10.0.0.8.44896: Flags [P.], seq 1400238455:1400238459, ack 1405144706, win 85, options [nop,nop,TS val 3791656484 ecr 1096361966], length 4
00:01:14.776365 IP 10.0.0.6.1883 > 10.0.0.8.44896: Flags [P.], seq 1400238459:1400238463, ack 1405144710, win 85, options [nop,nop,TS val 3791656485 ecr 1096361966], length 4
00:01:15.776878 IP 10.0.0.6.1883 > 10.0.0.8.44896: Flags [P.], seq 1400238463:1400238467, ack 1405145105, win 85, options [nop,nop,TS val 3791657485 ecr 1096362967], length 4
00:01:15.777311 IP 10.0.0.6.1883 > 10.0.0.8.44896: Flags [P.], seq 1400238467:1400238471, ack 1405145109, win 85, options [nop,nop,TS val 3791657485 ecr 1096362967], length 4
00:01:16.778232 IP 10.0.0.6.1883 > 10.0.0.8.44896: Flags [P.], seq 1400238471:1400238475, ack 1405145504, win 85, options [nop,nop,TS val 3791658486 ecr 1096363968], length 4
00:01:16.778819 IP 10.0.0.6.1883 > 10.0.0.8.44896: Flags [P.], seq 1400238475:1400238479, ack 1405145508, win 85, options [nop,nop,TS val 3791658487 ecr 1096363969], length 4
00:01:17.776456 IP 10.0.0.6.1883 > 10.0.0.8.44896: Flags [P.], seq 1400238479:1400238481, ack 1405145510, win 85, options [nop,nop,TS val 3791659485 ecr 1096364966], length 2
00:01:17.779816 IP 10.0.0.6.1883 > 10.0.0.8.44896: Flags [P.], seq 1400238481:1400238485, ack 1405145905, win 85, options [nop,nop,TS val 3791659488 ecr 1096364970], length 4
00:01:17.791171 IP 10.0.0.6.1883 > 10.0.0.8.44896: Flags [P.], seq 1400238485:1400238489, ack 1405145909, win 85, options [nop,nop,TS val 3791659499 ecr 1096364981], length 4
00:01:18.782325 IP 10.0.0.6.1883 > 10.0.0.8.44896: Flags [P.], seq 1400238489:1400238493, ack 1405146304, win 85, options [nop,nop,TS val 3791660490 ecr 1096365971], length 4
00:01:18.784397 IP 10.0.0.6.1883 > 10.0.0.8.44896: Flags [P.], seq 1400238493:1400238497, ack 1405146308, win 85, options [nop,nop,TS val 3791660493 ecr 1096365973], length 4
00:01:19.783721 IP 10.0.0.6.1883 > 10.0.0.8.44896: Flags [P.], seq 1400238497:1400238501, ack 1405146703, win 85, options [nop,nop,TS val 3791661492 ecr 1096366973], length 4
00:01:19.786758 IP 10.0.0.6.1883 > 10.0.0.8.44896: Flags [P.], seq 1400238501:1400238505, ack 1405146707, win 85, options [nop,nop,TS val 3791661495 ecr 1096366975], length 4
00:01:20.788357 IP 10.0.0.6.1883 > 10.0.0.8.44896: Flags [P.], seq 1400238505:1400238509, ack 1405147102, win 85, options [nop,nop,TS val 3791662496 ecr 1096367978], length 4
00:01:20.789109 IP 10.0.0.6.1883 > 10.0.0.8.44896: Flags [P.], seq 1400238509:1400238513, ack 1405147106, win 85, options [nop,nop,TS val 3791662497 ecr 1096367979], length 4
00:01:21.789434 IP 10.0.0.6.1883 > 10.0.0.8.44896: Flags [P.], seq 1400238513:1400238517, ack 1405147501, win 85, options [nop,nop,TS val 3791663498 ecr 1096368979], length 4
00:01:21.790253 IP 10.0.0.6.1883 > 10.0.0.8.44896: Flags [P.], seq 1400238517:1400238521, ack 1405147505, win 85, options [nop,nop,TS val 3791663498 ecr 1096368980], length 4
00:01:22.777466 IP 10.0.0.6.1883 > 10.0.0.8.44896: Flags [P.], seq 1400238521:1400238523, ack 1405147507, win 85, options [nop,nop,TS val 3791664486 ecr 1096369967], length 2
00:01:22.790836 IP 10.0.0.6.1883 > 10.0.0.8.44896: Flags [P.], seq 1400238523:1400238527, ack 1405147902, win 85, options [nop,nop,TS val 3791664499 ecr 1096369980], length 4
00:01:22.791550 IP 10.0.0.6.1883 > 10.0.0.8.44896: Flags [P.], seq 1400238527:1400238531, ack 1405147906, win 85, options [nop,nop,TS val 3791664500 ecr 1096369981], length 4
00:01:23.791006 IP 10.0.0.6.1883 > 10.0.0.8.44896: Flags [P.], seq 1400238531:1400238535, ack 1405148301, win 85, options [nop,nop,TS val 3791665499 ecr 1096370981], length 4
00:01:23.791653 IP 10.0.0.6.1883 > 10.0.0.8.44896: Flags [P.], seq 1400238535:1400238539, ack 1405148305, win 85, options [nop,nop,TS val 3791665500 ecr 1096370981], length 4
00:01:24.793231 IP 10.0.0.6.1883 > 10.0.0.8.44896: Flags [P.], seq 1400238539:1400238543, ack 1405148700, win 85, options [nop,nop,TS val 3791666501 ecr 1096371982], length 4
00:01:24.794553 IP 10.0.0.6.1883 > 10.0.0.8.44896: Flags [P.], seq 1400238543:1400238547, ack 1405148704, win 85, options [nop,nop,TS val 3791666503 ecr 1096371984], length 4
00:01:25.793701 IP 10.0.0.6.1883 > 10.0.0.8.44896: Flags [P.], seq 1400238547:1400238551, ack 1405149099, win 85, options [nop,nop,TS val 3791667502 ecr 1096372983], length 4
00:01:25.794339 IP 10.0.0.6.1883 > 10.0.0.8.44896: Flags [P.], seq 1400238551:1400238555, ack 1405149103, win 85, options [nop,nop,TS val 3791667502 ecr 1096372984], length 4
00:01:26.796197 IP 10.0.0.6.1883 > 10.0.0.8.44896: Flags [P.], seq 1400238555:1400238559, ack 1405149498, win 85, options [nop,nop,TS val 3791668504 ecr 1096373984], length 4
00:01:26.811812 IP 10.0.0.6.1883 > 10.0.0.8.44896: Flags [P.], seq 1400238559:1400238563, ack 1405149502, win 85, options [nop,nop,TS val 3791668520 ecr 1096373999], length 4
00:01:27.779190 IP 10.0.0.6.1883 > 10.0.0.8.44896: Flags [P.], seq 1400238563:1400238565, ack 1405149504, win 85, options [nop,nop,TS val 3791669487 ecr 1096374969], length 2
00:01:27.797843 IP 10.0.0.6.1883 > 10.0.0.8.44896: Flags [P.], seq 1400238565:1400238569, ack 1405149899, win 85, options [nop,nop,TS val 3791669506 ecr 1096374986], length 4
00:01:27.799105 IP 10.0.0.6.1883 > 10.0.0.8.44896: Flags [P.], seq 1400238569:1400238573, ack 1405149903, win 85, options [nop,nop,TS val 3791669507 ecr 1096374989], length 4
00:01:28.796902 IP 10.0.0.6.1883 > 10.0.0.8.44896: Flags [P.], seq 1400238573:1400238577, ack 1405150298, win 85, options [nop,nop,TS val 3791670505 ecr 1096375986], length 4
00:01:28.797318 IP 10.0.0.6.1883 > 10.0.0.8.44896: Flags [P.], seq 1400238577:1400238581, ack 1405150302, win 85, options [nop,nop,TS val 3791670505 ecr 1096375987], length 4
00:01:29.798900 IP 10.0.0.6.1883 > 10.0.0.8.44896: Flags [P.], seq 1400238581:1400238585, ack 1405150697, win 85, options [nop,nop,TS val 3791671507 ecr 1096376988], length 4
00:01:29.801544 IP 10.0.0.6.1883 > 10.0.0.8.44896: Flags [P.], seq 1400238585:1400238589, ack 1405150701, win 85, options [nop,nop,TS val 3791671510 ecr 1096376991], length 4
00:01:30.800507 IP 10.0.0.6.1883 > 10.0.0.8.44896: Flags [P.], seq 1400238589:1400238593, ack 1405151096, win 85, options [nop,nop,TS val 3791672509 ecr 1096377990], length 4
00:01:30.802565 IP 10.0.0.6.1883 > 10.0.0.8.44896: Flags [P.], seq 1400238593:1400238597, ack 1405151100, win 85, options [nop,nop,TS val 3791672510 ecr 1096377991], length 4
00:01:31.823883 IP 10.0.0.6.1883 > 10.0.0.8.44896: Flags [P.], seq 1400238597:1400238601, ack 1405151495, win 85, options [nop,nop,TS val 3791673532 ecr 1096379013], length 4
00:01:31.824769 IP 10.0.0.6.1883 > 10.0.0.8.44896: Flags [P.], seq 1400238601:1400238605, ack 1405151499, win 85, options [nop,nop,TS val 3791673533 ecr 1096379014], length 4
00:01:32.791737 IP 10.0.0.6.1883 > 10.0.0.8.44896: Flags [P.], seq 1400238605:1400238607, ack 1405151501, win 85, options [nop,nop,TS val 3791674500 ecr 1096379980], length 2
00:01:32.827880 IP 10.0.0.6.1883 > 10.0.0.8.44896: Flags [P.], seq 1400238607:1400238611, ack 1405151896, win 85, options [nop,nop,TS val 3791674536 ecr 1096380016], length 4
00:01:32.829335 IP 10.0.0.6.1883 > 10.0.0.8.44896: Flags [P.], seq 1400238611:1400238615, ack 1405151900, win 85, options [nop,nop,TS val 3791674537 ecr 1096380018], length 4
00:01:33.841606 IP 10.0.0.6.1883 > 10.0.0.8.44896: Flags [P.], seq 1400238615:1400238619, ack 1405152295, win 85, options [nop,nop,TS val 3791675550 ecr 1096381031], length 4
00:01:33.843893 IP 10.0.0.6.1883 > 10.0.0.8.44896: Flags [P.], seq 1400238619:1400238623, ack 1405152299, win 85, options [nop,nop,TS val 3791675552 ecr 1096381033], length 4
00:01:34.855135 IP 10.0.0.6.1883 > 10.0.0.8.44896: Flags [P.], seq 1400238623:1400238627, ack 1405152694, win 85, options [nop,nop,TS val 3791676563 ecr 1096382044], length 4
00:01:34.856962 IP 10.0.0.6.1883 > 10.0.0.8.44896: Flags [P.], seq 1400238627:1400238631, ack 1405152698, win 85, options [nop,nop,TS val 3791676565 ecr 1096382046], length 4
00:01:35.858593 IP 10.0.0.6.1883 > 10.0.0.8.44896: Flags [P.], seq 1400238631:1400238635, ack 1405153093, win 85, options [nop,nop,TS val 3791677567 ecr 1096383047], length 4
00:01:35.861398 IP 10.0.0.6.1883 > 10.0.0.8.44896: Flags [P.], seq 1400238635:1400238639, ack 1405153097, win 85, options [nop,nop,TS val 3791677569 ecr 1096383050], length 4
00:01:36.859411 IP 10.0.0.6.1883 > 10.0.0.8.44896: Flags [P.], seq 1400238639:1400238643, ack 1405153492, win 85, options [nop,nop,TS val 3791678567 ecr 1096384049], length 4
00:01:36.860043 IP 10.0.0.6.1883 > 10.0.0.8.44896: Flags [P.], seq 1400238643:1400238647, ack 1405153496, win 85, options [nop,nop,TS val 3791678568 ecr 1096384050], length 4
00:01:37.861957 IP 10.0.0.6.1883 > 10.0.0.8.44896: Flags [P.], seq 1400238647:1400238651, ack 1405153891, win 85, options [nop,nop,TS val 3791679570 ecr 1096385050], length 4
00:01:37.863770 IP 10.0.0.6.1883 > 10.0.0.8.44896: Flags [P.], seq 1400238651:1400238653, ack 1405153893, win 85, options [nop,nop,TS val 3791679571 ecr 1096385052], length 2
00:01:37.865175 IP 10.0.0.6.1883 > 10.0.0.8.44896: Flags [P.], seq 1400238653:1400238657, ack 1405153897, win 85, options [nop,nop,TS val 3791679573 ecr 1096385054], length 4
00:01:38.091722 IP 10.0.0.6.1883 > 10.0.0.8.44896: Flags [P.], seq 1400238653:1400238657, ack 1405153897, win 85, options [nop,nop,TS val 3791679800 ecr 1096385054], length 4
00:01:38.898363 IP 10.0.0.6.1883 > 10.0.0.8.44896: Flags [P.], seq 1400238657:1400238661, ack 1405154292, win 85, options [nop,nop,TS val 3791680607 ecr 1096386088], length 4
00:01:38.903291 IP 10.0.0.6.1883 > 10.0.0.8.44896: Flags [P.], seq 1400238661:1400238665, ack 1405154296, win 85, options [nop,nop,TS val 3791680611 ecr 1096386093], length 4
00:01:39.903435 IP 10.0.0.6.1883 > 10.0.0.8.44896: Flags [P.], seq 1400238665:1400238669, ack 1405154691, win 85, options [nop,nop,TS val 3791681611 ecr 1096387091], length 4
00:01:39.907649 IP 10.0.0.6.1883 > 10.0.0.8.44896: Flags [P.], seq 1400238669:1400238673, ack 1405154695, win 85, options [nop,nop,TS val 3791681616 ecr 1096387097], length 4
00:01:40.916230 IP 10.0.0.6.1883 > 10.0.0.8.44896: Flags [P.], seq 1400238673:1400238677, ack 1405155090, win 85, options [nop,nop,TS val 3791682624 ecr 1096388103], length 4
00:01:40.918773 IP 10.0.0.6.1883 > 10.0.0.8.44896: Flags [P.], seq 1400238677:1400238681, ack 1405155094, win 85, options [nop,nop,TS val 3791682627 ecr 1096388108], length 4
00:01:41.928286 IP 10.0.0.6.1883 > 10.0.0.8.44896: Flags [P.], seq 1400238681:1400238685, ack 1405155489, win 85, options [nop,nop,TS val 3791683633 ecr 1096389112], length 4
00:01:41.934203 IP 10.0.0.6.1883 > 10.0.0.8.44896: Flags [P.], seq 1400238685:1400238689, ack 1405155493, win 85, options [nop,nop,TS val 3791683642 ecr 1096389123], length 4
00:01:42.888013 IP 10.0.0.6.1883 > 10.0.0.8.44896: Flags [P.], seq 1400238689:1400238691, ack 1405155495, win 85, options [nop,nop,TS val 3791684595 ecr 1096390076], length 2
00:01:42.925729 IP 10.0.0.6.1883 > 10.0.0.8.44896: Flags [P.], seq 1400238691:1400238695, ack 1405155890, win 85, options [nop,nop,TS val 3791684633 ecr 1096390113], length 4
00:01:42.928218 IP 10.0.0.6.1883 > 10.0.0.8.44896: Flags [P.], seq 1400238695:1400238699, ack 1405155894, win 85, options [nop,nop,TS val 3791684636 ecr 1096390117], length 4
00:01:43.939844 IP 10.0.0.6.1883 > 10.0.0.8.44896: Flags [P.], seq 1400238699:1400238703, ack 1405156289, win 85, options [nop,nop,TS val 3791685648 ecr 1096391127], length 4
00:01:43.941887 IP 10.0.0.6.1883 > 10.0.0.8.44896: Flags [P.], seq 1400238703:1400238707, ack 1405156293, win 85, options [nop,nop,TS val 3791685650 ecr 1096391131], length 4
00:01:44.941226 IP 10.0.0.6.1883 > 10.0.0.8.44896: Flags [P.], seq 1400238707:1400238711, ack 1405156688, win 85, options [nop,nop,TS val 3791686649 ecr 1096392129], length 4
00:01:44.950174 IP 10.0.0.6.1883 > 10.0.0.8.44896: Flags [P.], seq 1400238711:1400238715, ack 1405156692, win 85, options [nop,nop,TS val 3791686658 ecr 1096392138], length 4
00:01:45.946216 IP 10.0.0.6.1883 > 10.0.0.8.44896: Flags [P.], seq 1400238715:1400238719, ack 1405157087, win 85, options [nop,nop,TS val 3791687654 ecr 1096393133], length 4
00:01:45.948513 IP 10.0.0.6.1883 > 10.0.0.8.44896: Flags [P.], seq 1400238719:1400238723, ack 1405157091, win 85, options [nop,nop,TS val 3791687657 ecr 1096393137], length 4
00:01:46.441318 IP 10.0.0.6.1883 > 10.0.0.8.44896: Flags [P.], seq 1400238719:1400238723, ack 1405157091, win 85, options [nop,nop,TS val 3791688149 ecr 1096393137], length 4
00:01:46.951994 IP 10.0.0.6.1883 > 10.0.0.8.44896: Flags [P.], seq 1400238723:1400238727, ack 1405157486, win 85, options [nop,nop,TS val 3791688658 ecr 1096394138], length 4
00:01:46.956992 IP 10.0.0.6.1883 > 10.0.0.8.44896: Flags [P.], seq 1400238727:1400238731, ack 1405157490, win 85, options [nop,nop,TS val 3791688665 ecr 1096394146], length 4
00:01:47.898885 IP 10.0.0.6.1883 > 10.0.0.8.44896: Flags [P.], seq 1400238731:1400238733, ack 1405157492, win 85, options [nop,nop,TS val 3791689607 ecr 1096395087], length 2
00:01:47.951490 IP 10.0.0.6.1883 > 10.0.0.8.44896: Flags [P.], seq 1400238733:1400238737, ack 1405157887, win 85, options [nop,nop,TS val 3791689660 ecr 1096395141], length 4
00:01:47.952878 IP 10.0.0.6.1883 > 10.0.0.8.44896: Flags [P.], seq 1400238737:1400238741, ack 1405157891, win 85, options [nop,nop,TS val 3791689661 ecr 1096395143], length 4
00:01:48.953788 IP 10.0.0.6.1883 > 10.0.0.8.44896: Flags [P.], seq 1400238741:1400238745, ack 1405158286, win 85, options [nop,nop,TS val 3791690662 ecr 1096396143], length 4
00:01:48.955024 IP 10.0.0.6.1883 > 10.0.0.8.44896: Flags [P.], seq 1400238745:1400238749, ack 1405158290, win 85, options [nop,nop,TS val 3791690663 ecr 1096396144], length 4
00:01:50.030848 IP 10.0.0.6.1883 > 10.0.0.8.44896: Flags [P.], seq 1400238749:1400238753, ack 1405158685, win 85, options [nop,nop,TS val 3791691739 ecr 1096397220], length 4
00:01:50.031520 IP 10.0.0.6.1883 > 10.0.0.8.44896: Flags [P.], seq 1400238753:1400238757, ack 1405158689, win 85, options [nop,nop,TS val 3791691740 ecr 1096397221], length 4
00:01:51.033228 IP 10.0.0.6.1883 > 10.0.0.8.44896: Flags [P.], seq 1400238757:1400238761, ack 1405159084, win 85, options [nop,nop,TS val 3791692741 ecr 1096398221], length 4
00:01:51.058930 IP 10.0.0.6.1883 > 10.0.0.8.44896: Flags [P.], seq 1400238761:1400238765, ack 1405159088, win 85, options [nop,nop,TS val 3791692767 ecr 1096398247], length 4
00:01:52.086976 IP 10.0.0.6.1883 > 10.0.0.8.44896: Flags [P.], seq 1400238765:1400238769, ack 1405159483, win 85, options [nop,nop,TS val 3791693794 ecr 1096399273], length 4
00:01:52.093019 IP 10.0.0.6.1883 > 10.0.0.8.44896: Flags [P.], seq 1400238769:1400238773, ack 1405159487, win 85, options [nop,nop,TS val 3791693801 ecr 1096399281], length 4
00:01:52.453776 IP 10.0.0.6.1883 > 10.0.0.8.44896: Flags [P.], seq 1400238769:1400238773, ack 1405159487, win 85, options [nop,nop,TS val 3791694161 ecr 1096399281], length 4
00:01:52.899663 IP 10.0.0.6.1883 > 10.0.0.8.44896: Flags [P.], seq 1400238773:1400238775, ack 1405159489, win 85, options [nop,nop,TS val 3791694608 ecr 1096400089], length 2
00:01:56.018225 IP 10.0.0.6.1883 > 10.0.0.8.44896: Flags [F.], seq 1400238775, ack 1405159490, win 85, options [nop,nop,TS val 3791697725 ecr 1096403205], length 0