00:00:04.438335 IP 10.0.0.6.1883 > 10.0.0.8.44942: Flags [S.], seq 3502762739, ack 3906225181, win 43440, options [mss 1460,sackOK,TS val 3791831115 ecr 1096536530,nop,wscale 9], length 0
00:00:04.446891 IP 10.0.0.6.1883 > 10.0.0.8.44942: Flags [.], ack 3906225201, win 85, options [nop,nop,TS val 3791831123 ecr 1096536605], length 0
00:00:04.447228 IP 10.0.0.6.1883 > 10.0.0.8.44942: Flags [P.], seq 3502762740:3502762744, ack 3906225201, win 85, options [nop,nop,TS val 3791831124 ecr 1096536605], length 4
00:00:04.449542 IP 10.0.0.6.1883 > 10.0.0.8.44942: Flags [P.], seq 3502762744:3502762809, ack 3906225265, win 85, options [nop,nop,TS val 3791831126 ecr 1096536607], length 65
00:00:04.449822 IP 10.0.0.6.1883 > 10.0.0.8.44942: Flags [P.], seq 3502762809:3502762814, ack 3906225660, win 85, options [nop,nop,TS val 3791831126 ecr 1096536608], length 5
00:00:04.453798 IP 10.0.0.6.1883 > 10.0.0.8.44942: Flags [P.], seq 3502762814:3502762818, ack 3906225660, win 85, options [nop,nop,TS val 3791831130 ecr 1096536612], length 4
00:00:04.454769 IP 10.0.0.6.1883 > 10.0.0.8.44942: Flags [P.], seq 3502762818:3502762822, ack 3906225664, win 85, options [nop,nop,TS val 3791831131 ecr 1096536613], length 4
00:00:05.374625 IP 10.0.0.6.1883 > 10.0.0.8.44942: Flags [P.], seq 3502762822:3502762826, ack 3906226059, win 85, options [nop,nop,TS val 3791832051 ecr 1096537532], length 4
00:00:05.375230 IP 10.0.0.6.1883 > 10.0.0.8.44942: Flags [P.], seq 3502762826:3502762830, ack 3906226063, win 85, options [nop,nop,TS val 3791832052 ecr 1096537533], length 4
00:00:06.387994 IP 10.0.0.6.1883 > 10.0.0.8.44942: Flags [P.], seq 3502762830:3502762834, ack 3906226458, win 85, options [nop,nop,TS val 3791833063 ecr 1096538543], length 4
00:00:06.391257 IP 10.0.0.6.1883 > 10.0.0.8.44942: Flags [P.], seq 3502762834:3502762838, ack 3906226462, win 85, options [nop,nop,TS val 3791833068 ecr 1096538548], length 4
00:00:07.390865 IP 10.0.0.6.1883 > 10.0.0.8.44942: Flags [P.], seq 3502762838:3502762842, ack 3906226857, win 85, options [nop,nop,TS val 3791834067 ecr 1096539546], length 4
00:00:07.393676 IP 10.0.0.6.1883 > 10.0.0.8.44942: Flags [P.], seq 3502762842:3502762846, ack 3906226861, win 85, options [nop,nop,TS val 3791834070 ecr 1096539550], length 4
00:00:08.392187 IP 10.0.0.6.1883 > 10.0.0.8.44942: Flags [P.], seq 3502762846:3502762850, ack 3906227256, win 85, options [nop,nop,TS val 3791835069 ecr 1096540548], length 4
00:00:08.394525 IP 10.0.0.6.1883 > 10.0.0.8.44942: Flags [P.], seq 3502762850:3502762854, ack 3906227260, win 85, options [nop,nop,TS val 3791835071 ecr 1096540551], length 4
00:00:09.395900 IP 10.0.0.6.1883 > 10.0.0.8.44942: Flags [P.], seq 3502762854:3502762858, ack 3906227655, win 85, options [nop,nop,TS val 3791836072 ecr 1096541552], length 4
00:00:09.398194 IP 10.0.0.6.1883 > 10.0.0.8.44942: Flags [P.], seq 3502762858:3502762862, ack 3906227659, win 85, options [nop,nop,TS val 3791836075 ecr 1096541555], length 4
00:00:09.449760 IP 10.0.0.6.1883 > 10.0.0.8.44942: Flags [P.], seq 3502762862:3502762864, ack 3906227661, win 85, options [nop,nop,TS val 3791836126 ecr 1096541608], length 2
00:00:10.397674 IP 10.0.0.6.1883 > 10.0.0.8.44942: Flags [P.], seq 3502762864:3502762868, ack 3906228056, win 85, options [nop,nop,TS val 3791837074 ecr 1096542554], length 4
00:00:10.399871 IP 10.0.0.6.1883 > 10.0.0.8.44942: Flags [P.], seq 3502762868:3502762872, ack 3906228060, win 85, options [nop,nop,TS val 3791837076 ecr 1096542557], length 4
00:00:11.516017 IP 10.0.0.6.1883 > 10.0.0.8.44942: Flags [P.], seq 3502762872:3502762876, ack 3906228455, win 85, options [nop,nop,TS val 3791838163 ecr 1096543644], length 4
00:00:11.649189 IP 10.0.0.6.1883 > 10.0.0.8.44942: Flags [P.], seq 3502762876:3502762880, ack 3906228459, win 85, options [nop,nop,TS val 3791838326 ecr 1096543807], length 4
00:00:12.516521 IP 10.0.0.6.1883 > 10.0.0.8.44942: Flags [P.], seq 3502762880:3502762884, ack 3906228854, win 85, options [nop,nop,TS val 3791839187 ecr 1096544668], length 4
00:00:12.654357 IP 10.0.0.6.1883 > 10.0.0.8.44942: Flags [P.], seq 3502762884:3502762888, ack 3906228858, win 85, options [nop,nop,TS val 3791839331 ecr 1096544812], length 4
00:00:13.053765 IP 10.0.0.6.1883 > 10.0.0.8.44942: Flags [P.], seq 3502762884:3502762888, ack 3906228858, win 85, options [nop,nop,TS val 3791839730 ecr 1096544812], length 4
00:00:13.668558 IP 10.0.0.6.1883 > 10.0.0.8.44942: Flags [P.], seq 3502762888:3502762892, ack 3906229253, win 85, options [nop,nop,TS val 3791840344 ecr 1096545824], length 4
00:00:13.671429 IP 10.0.0.6.1883 > 10.0.0.8.44942: Flags [P.], seq 3502762892:3502762896, ack 3906229257, win 85, options [nop,nop,TS val 3791840348 ecr 1096545828], length 4
00:00:14.494519 IP 10.0.0.6.1883 > 10.0.0.8.44942: Flags [P.], seq 3502762896:3502762898, ack 3906229259, win 85, options [nop,nop,TS val 3791841171 ecr 1096546651], length 2
00:00:14.758997 IP 10.0.0.6.1883 > 10.0.0.8.44942: Flags [P.], seq 3502762898:3502762902, ack 3906229654, win 85, options [nop,nop,TS val 3791841435 ecr 1096546914], length 4
00:00:14.762474 IP 10.0.0.6.1883 > 10.0.0.8.44942: Flags [P.], seq 3502762902:3502762906, ack 3906229658, win 85, options [nop,nop,TS val 3791841439 ecr 1096546919], length 4
00:00:15.764106 IP 10.0.0.6.1883 > 10.0.0.8.44942: Flags [P.], seq 3502762906:3502762910, ack 3906230053, win 85, options [nop,nop,TS val 3791842437 ecr 1096547916], length 4
00:00:15.765936 IP 10.0.0.6.1883 > 10.0.0.8.44942: Flags [P.], seq 3502762910:3502762914, ack 3906230057, win 85, options [nop,nop,TS val 3791842442 ecr 1096547923], length 4
00:00:16.761475 IP 10.0.0.6.1883 > 10.0.0.8.44942: Flags [P.], seq 3502762914:3502762918, ack 3906230452, win 85, options [nop,nop,TS val 3791843438 ecr 1096548918], length 4
00:00:16.776308 IP 10.0.0.6.1883 > 10.0.0.8.44942: Flags [P.], seq 3502762918:3502762922, ack 3906230456, win 85, options [nop,nop,TS val 3791843453 ecr 1096548934], length 4
00:00:17.766373 IP 10.0.0.6.1883 > 10.0.0.8.44942: Flags [P.], seq 3502762922:3502762926, ack 3906230851, win 85, options [nop,nop,TS val 3791844443 ecr 1096549922], length 4
00:00:17.767972 IP 10.0.0.6.1883 > 10.0.0.8.44942: Flags [P.], seq 3502762926:3502762930, ack 3906230855, win 85, options [nop,nop,TS val 3791844444 ecr 1096549925], length 4
00:00:18.768036 IP 10.0.0.6.1883 > 10.0.0.8.44942: Flags [P.], seq 3502762930:3502762934, ack 3906231250, win 85, options [nop,nop,TS val 3791845444 ecr 1096550924], length 4
00:00:18.771138 IP 10.0.0.6.1883 > 10.0.0.8.44942: Flags [P.], seq 3502762934:3502762938, ack 3906231254, win 85, options [nop,nop,TS val 3791845448 ecr 1096550928], length 4
00:00:19.495978 IP 10.0.0.6.1883 > 10.0.0.8.44942: Flags [P.], seq 3502762938:3502762940, ack 3906231256, win 85, options [nop,nop,TS val 3791846172 ecr 1096551653], length 2
00:00:19.773998 IP 10.0.0.6.1883 > 10.0.0.8.44942: Flags [P.], seq 3502762940:3502762944, ack 3906231651, win 85, options [nop,nop,TS val 3791846451 ecr 1096551931], length 4
00:00:19.777996 IP 10.0.0.6.1883 > 10.0.0.8.44942: Flags [P.], seq 3502762944:3502762948, ack 3906231655, win 85, options [nop,nop,TS val 3791846455 ecr 1096551935], length 4
00:00:20.776563 IP 10.0.0.6.1883 > 10.0.0.8.44942: Flags [P.], seq 3502762948:3502762952, ack 3906232050, win 85, options [nop,nop,TS val 3791847453 ecr 1096552934], length 4
00:00:20.777673 IP 10.0.0.6.1883 > 10.0.0.8.44942: Flags [P.], seq 3502762952:3502762956, ack 3906232054, win 85, options [nop,nop,TS val 3791847454 ecr 1096552936], length 4
00:00:21.778701 IP 10.0.0.6.1883 > 10.0.0.8.44942: Flags [P.], seq 3502762956:3502762960, ack 3906232449, win 85, options [nop,nop,TS val 3791848455 ecr 1096553936], length 4
00:00:21.779165 IP 10.0.0.6.1883 > 10.0.0.8.44942: Flags [P.], seq 3502762960:3502762964, ack 3906232453, win 85, options [nop,nop,TS val 3791848456 ecr 1096553937], length 4
00:00:22.782488 IP 10.0.0.6.1883 > 10.0.0.8.44942: Flags [P.], seq 3502762964:3502762968, ack 3906232848, win 85, options [nop,nop,TS val 3791849459 ecr 1096554938], length 4
00:00:22.783432 IP 10.0.0.6.1883 > 10.0.0.8.44942: Flags [P.], seq 3502762968:3502762972, ack 3906232852, win 85, options [nop,nop,TS val 3791849460 ecr 1096554941], length 4
00:00:23.783637 IP 10.0.0.6.1883 > 10.0.0.8.44942: Flags [P.], seq 3502762972:3502762976, ack 3906233247, win 85, options [nop,nop,TS val 3791850460 ecr 1096555940], length 4
00:00:23.784741 IP 10.0.0.6.1883 > 10.0.0.8.44942: Flags [P.], seq 3502762976:3502762980, ack 3906233251, win 85, options [nop,nop,TS val 3791850461 ecr 1096555943], length 4
00:00:24.495082 IP 10.0.0.6.1883 > 10.0.0.8.44942: Flags [P.], seq 3502762980:3502762982, ack 3906233253, win 85, options [nop,nop,TS val 3791851172 ecr 1096556653], length 2
00:00:24.785341 IP 10.0.0.6.1883 > 10.0.0.8.44942: Flags [P.], seq 3502762982:3502762986, ack 3906233648, win 85, options [nop,nop,TS val 3791851462 ecr 1096556941], length 4
00:00:24.786297 IP 10.0.0.6.1883 > 10.0.0.8.44942: Flags [P.], seq 3502762986:3502762990, ack 3906233652, win 85, options [nop,nop,TS val 3791851463 ecr 1096556944], length 4
00:00:25.784304 IP 10.0.0.6.1883 > 10.0.0.8.44942: Flags [P.], seq 3502762990:3502762994, ack 3906234047, win 85, options [nop,nop,TS val 3791852461 ecr 1096557942], length 4
00:00:25.785237 IP 10.0.0.6.1883 > 10.0.0.8.44942: Flags [P.], seq 3502762994:3502762998, ack 3906234051, win 85, options [nop,nop,TS val 3791852462 ecr 1096557943], length 4
00:00:26.785395 IP 10.0.0.6.1883 > 10.0.0.8.44942: Flags [P.], seq 3502762998:3502763002, ack 3906234446, win 85, options [nop,nop,TS val 3791853462 ecr 1096558944], length 4
00:00:26.785821 IP 10.0.0.6.1883 > 10.0.0.8.44942: Flags [P.], seq 3502763002:3502763006, ack 3906234450, win 85, options [nop,nop,TS val 3791853462 ecr 1096558944], length 4
00:00:27.786175 IP 10.0.0.6.1883 > 10.0.0.8.44942: Flags [P.], seq 3502763006:3502763010, ack 3906234845, win 85, options [nop,nop,TS val 3791854463 ecr 1096559944], length 4
00:00:27.786643 IP 10.0.0.6.1883 > 10.0.0.8.44942: Flags [P.], seq 3502763010:3502763014, ack 3906234849, win 85, options [nop,nop,TS val 3791854463 ecr 1096559945], length 4
00:00:28.788944 IP 10.0.0.6.1883 > 10.0.0.8.44942: Flags [P.], seq 3502763014:3502763018, ack 3906235244, win 85, options [nop,nop,TS val 3791855465 ecr 1096560946], length 4
00:00:28.789929 IP 10.0.0.6.1883 > 10.0.0.8.44942: Flags [P.], seq 3502763018:3502763022, ack 3906235248, win 85, options [nop,nop,TS val 3791855466 ecr 1096560948], length 4
00:00:29.497053 IP 10.0.0.6.1883 > 10.0.0.8.44942: Flags [P.], seq 3502763022:3502763024, ack 3906235250, win 85, options [nop,nop,TS val 3791856174 ecr 1096561655], length 2
00:00:29.789579 IP 10.0.0.6.1883 > 10.0.0.8.44942: Flags [P.], seq 3502763024:3502763028, ack 3906235645, win 85, options [nop,nop,TS val 3791856466 ecr 1096561948], length 4
00:00:29.790256 IP 10.0.0.6.1883 > 10.0.0.8.44942: Flags [P.], seq 3502763028:3502763032, ack 3906235649, win 85, options [nop,nop,TS val 3791856467 ecr 1096561948], length 4
00:00:30.792303 IP 10.0.0.6.1883 > 10.0.0.8.44942: Flags [P.], seq 3502763032:3502763036, ack 3906236044, win 85, options [nop,nop,TS val 3791857468 ecr 1096562949], length 4
00:00:30.795172 IP 10.0.0.6.1883 > 10.0.0.8.44942: Flags [P.], seq 3502763036:3502763040, ack 3906236048, win 85, options [nop,nop,TS val 3791857472 ecr 1096562952], length 4
00:00:31.792866 IP 10.0.0.6.1883 > 10.0.0.8.44942: Flags [P.], seq 3502763040:3502763044, ack 3906236443, win 85, options [nop,nop,TS val 3791858469 ecr 1096563950], length 4
00:00:31.794348 IP 10.0.0.6.1883 > 10.0.0.8.44942: Flags [P.], seq 3502763044:3502763048, ack 3906236447, win 85, options [nop,nop,TS val 3791858471 ecr 1096563952], length 4
00:00:32.793917 IP 10.0.0.6.1883 > 10.0.0.8.44942: Flags [P.], seq 3502763048:3502763052, ack 3906236842, win 85, options [nop,nop,TS val 3791859470 ecr 1096564952], length 4
00:00:32.794352 IP 10.0.0.6.1883 > 10.0.0.8.44942: Flags [P.], seq 3502763052:3502763056, ack 3906236846, win 85, options [nop,nop,TS val 3791859471 ecr 1096564953], length 4
00:00:33.806999 IP 10.0.0.6.1883 > 10.0.0.8.44942: Flags [P.], seq 3502763056:3502763060, ack 3906237241, win 85, options [nop,nop,TS val 3791860483 ecr 1096565963], length 4
00:00:33.809428 IP 10.0.0.6.1883 > 10.0.0.8.44942: Flags [P.], seq 3502763060:3502763064, ack 3906237245, win 85, options [nop,nop,TS val 3791860486 ecr 1096565966], length 4
00:00:34.502295 IP 10.0.0.6.1883 > 10.0.0.8.44942: Flags [P.], seq 3502763064:3502763066, ack 3906237247, win 85, options [nop,nop,TS val 3791861179 ecr 1096566660], length 2
00:00:34.808002 IP 10.0.0.6.1883 > 10.0.0.8.44942: Flags [P.], seq 3502763066:3502763070, ack 3906237642, win 85, options [nop,nop,TS val 3791861485 ecr 1096566966], length 4
00:00:34.808349 IP 10.0.0.6.1883 > 10.0.0.8.44942: Flags [P.], seq 3502763070:3502763074, ack 3906237646, win 85, options [nop,nop,TS val 3791861485 ecr 1096566967], length 4
00:00:35.809205 IP 10.0.0.6.1883 > 10.0.0.8.44942: Flags [P.], seq 3502763074:3502763078, ack 3906238041, win 85, options [nop,nop,TS val 3791862486 ecr 1096567967], length 4
00:00:35.810209 IP 10.0.0.6.1883 > 10.0.0.8.44942: Flags [P.], seq 3502763078:3502763082, ack 3906238045, win 85, options [nop,nop,TS val 3791862487 ecr 1096567968], length 4
00:00:36.810526 IP 10.0.0.6.1883 > 10.0.0.8.44942: Flags [P.], seq 3502763082:3502763086, ack 3906238440, win 85, options [nop,nop,TS val 3791863487 ecr 1096568968], length 4
00:00:36.811909 IP 10.0.0.6.1883 > 10.0.0.8.44942: Flags [P.], seq 3502763086:3502763090, ack 3906238444, win 85, options [nop,nop,TS val 3791863488 ecr 1096568970], length 4
00:00:37.811777 IP 10.0.0.6.1883 > 10.0.0.8.44942: Flags [P.], seq 3502763090:3502763094, ack 3906238839, win 85, options [nop,nop,TS val 3791864488 ecr 1096569970], length 4
00:00:37.812579 IP 10.0.0.6.1883 > 10.0.0.8.44942: Flags [P.], seq 3502763094:3502763098, ack 3906238843, win 85, options [nop,nop,TS val 3791864489 ecr 1096569971], length 4
00:00:38.812665 IP 10.0.0.6.1883 > 10.0.0.8.44942: Flags [P.], seq 3502763098:3502763102, ack 3906239238, win 85, options [nop,nop,TS val 3791865489 ecr 1096570971], length 4
00:00:38.813531 IP 10.0.0.6.1883 > 10.0.0.8.44942: Flags [P.], seq 3502763102:3502763106, ack 3906239242, win 85, options [nop,nop,TS val 3791865490 ecr 1096570971], length 4
00:00:39.502468 IP 10.0.0.6.1883 > 10.0.0.8.44942: Flags [P.], seq 3502763106:3502763108, ack 3906239244, win 85, options [nop,nop,TS val 3791866179 ecr 1096571661], length 2
00:00:39.814751 IP 10.0.0.6.1883 > 10.0.0.8.44942: Flags [P.], seq 3502763108:3502763112, ack 3906239639, win 85, options [nop,nop,TS val 3791866491 ecr 1096571972], length 4
00:00:39.817291 IP 10.0.0.6.1883 > 10.0.0.8.44942: Flags [P.], seq 3502763112:3502763116, ack 3906239643, win 85, options [nop,nop,TS val 3791866494 ecr 1096571975], length 4
00:00:40.814951 IP 10.0.0.6.1883 > 10.0.0.8.44942: Flags [P.], seq 3502763116:3502763120, ack 3906240038, win 85, options [nop,nop,TS val 3791867492 ecr 1096572973], length 4
00:00:40.815566 IP 10.0.0.6.1883 > 10.0.0.8.44942: Flags [P.], seq 3502763120:3502763124, ack 3906240042, win 85, options [nop,nop,TS val 3791867492 ecr 1096572974], length 4
00:00:41.816519 IP 10.0.0.6.1883 > 10.0.0.8.44942: Flags [P.], seq 3502763124:3502763128, ack 3906240437, win 85, options [nop,nop,TS val 3791868493 ecr 1096573974], length 4
00:00:41.817680 IP 10.0.0.6.1883 > 10.0.0.8.44942: Flags [P.], seq 3502763128:3502763132, ack 3906240441, win 85, options [nop,nop,TS val 3791868494 ecr 1096573975], length 4
00:00:42.827222 IP 10.0.0.6.1883 > 10.0.0.8.44942: Flags [P.], seq 3502763132:3502763136, ack 3906240836, win 85, options [nop,nop,TS val 3791869504 ecr 1096574985], length 4
00:00:42.828323 IP 10.0.0.6.1883 > 10.0.0.8.44942: Flags [P.], seq 3502763136:3502763140, ack 3906240840, win 85, options [nop,nop,TS val 3791869505 ecr 1096574986], length 4
00:00:43.832509 IP 10.0.0.6.1883 > 10.0.0.8.44942: Flags [P.], seq 3502763140:3502763144, ack 3906241235, win 85, options [nop,nop,TS val 3791870509 ecr 1096575990], length 4
00:00:43.834376 IP 10.0.0.6.1883 > 10.0.0.8.44942: Flags [P.], seq 3502763144:3502763148, ack 3906241239, win 85, options [nop,nop,TS val 3791870511 ecr 1096575992], length 4
00:00:44.503644 IP 10.0.0.6.1883 > 10.0.0.8.44942: Flags [P.], seq 3502763148:3502763150, ack 3906241241, win 85, options [nop,nop,TS val 3791871180 ecr 1096576662], length 2
00:00:44.833259 IP 10.0.0.6.1883 > 10.0.0.8.44942: Flags [P.], seq 3502763150:3502763154, ack 3906241636, win 85, options [nop,nop,TS val 3791871510 ecr 1096576991], length 4
00:00:44.834527 IP 10.0.0.6.1883 > 10.0.0.8.44942: Flags [P.], seq 3502763154:3502763158, ack 3906241640, win 85, options [nop,nop,TS val 3791871511 ecr 1096576992], length 4
00:00:45.834568 IP 10.0.0.6.1883 > 10.0.0.8.44942: Flags [P.], seq 3502763158:3502763162, ack 3906242035, win 85, options [nop,nop,TS val 3791872511 ecr 1096577993], length 4
00:00:45.835271 IP 10.0.0.6.1883 > 10.0.0.8.44942: Flags [P.], seq 3502763162:3502763166, ack 3906242039, win 85, options [nop,nop,TS val 3791872512 ecr 1096577993], length 4
00:00:46.835868 IP 10.0.0.6.1883 > 10.0.0.8.44942: Flags [P.], seq 3502763166:3502763170, ack 3906242434, win 85, options [nop,nop,TS val 3791873512 ecr 1096578993], length 4
00:00:46.837079 IP 10.0.0.6.1883 > 10.0.0.8.44942: Flags [P.], seq 3502763170:3502763174, ack 3906242438, win 85, options [nop,nop,TS val 3791873514 ecr 1096578995], length 4
00:00:47.836376 IP 10.0.0.6.1883 > 10.0.0.8.44942: Flags [P.], seq 3502763174:3502763178, ack 3906242833, win 85, options [nop,nop,TS val 3791874513 ecr 1096579994], length 4
00:00:47.837109 IP 10.0.0.6.1883 > 10.0.0.8.44942: Flags [P.], seq 3502763178:3502763182, ack 3906242837, win 85, options [nop,nop,TS val 3791874514 ecr 1096579995], length 4
00:00:48.841104 IP 10.0.0.6.1883 > 10.0.0.8.44942: Flags [P.], seq 3502763182:3502763186, ack 3906243232, win 85, options [nop,nop,TS val 3791875518 ecr 1096580998], length 4
00:00:48.842430 IP 10.0.0.6.1883 > 10.0.0.8.44942: Flags [P.], seq 3502763186:3502763190, ack 3906243236, win 85, options [nop,nop,TS val 3791875519 ecr 1096581000], length 4
00:00:49.506483 IP 10.0.0.6.1883 > 10.0.0.8.44942: Flags [P.], seq 3502763190:3502763192, ack 3906243238, win 85, options [nop,nop,TS val 3791876183 ecr 1096581664], length 2
00:00:49.840979 IP 10.0.0.6.1883 > 10.0.0.8.44942: Flags [P.], seq 3502763192:3502763196, ack 3906243633, win 85, options [nop,nop,TS val 3791876518 ecr 1096581999], length 4
00:00:49.841568 IP 10.0.0.6.1883 > 10.0.0.8.44942: Flags [P.], seq 3502763196:3502763200, ack 3906243637, win 85, options [nop,nop,TS val 3791876518 ecr 1096582000], length 4
00:00:50.843502 IP 10.0.0.6.1883 > 10.0.0.8.44942: Flags [P.], seq 3502763200:3502763204, ack 3906244032, win 85, options [nop,nop,TS val 3791877520 ecr 1096583001], length 4
00:00:50.844606 IP 10.0.0.6.1883 > 10.0.0.8.44942: Flags [P.], seq 3502763204:3502763208, ack 3906244036, win 85, options [nop,nop,TS val 3791877521 ecr 1096583003], length 4
00:00:51.853882 IP 10.0.0.6.1883 > 10.0.0.8.44942: Flags [P.], seq 3502763208:3502763212, ack 3906244431, win 85, options [nop,nop,TS val 3791878530 ecr 1096584011], length 4
00:00:51.854771 IP 10.0.0.6.1883 > 10.0.0.8.44942: Flags [P.], seq 3502763212:3502763216, ack 3906244435, win 85, options [nop,nop,TS val 3791878531 ecr 1096584013], length 4
00:00:52.855733 IP 10.0.0.6.1883 > 10.0.0.8.44942: Flags [P.], seq 3502763216:3502763220, ack 3906244830, win 85, options [nop,nop,TS val 3791879532 ecr 1096585013], length 4
00:00:52.857256 IP 10.0.0.6.1883 > 10.0.0.8.44942: Flags [P.], seq 3502763220:3502763224, ack 3906244834, win 85, options [nop,nop,TS val 3791879534 ecr 1096585015], length 4
00:00:53.897966 IP 10.0.0.6.1883 > 10.0.0.8.44942: Flags [P.], seq 3502763224:3502763228, ack 3906245229, win 85, options [nop,nop,TS val 3791880534 ecr 1096586015], length 4
00:00:53.898865 IP 10.0.0.6.1883 > 10.0.0.8.44942: Flags [P.], seq 3502763228:3502763232, ack 3906245233, win 85, options [nop,nop,TS val 3791880575 ecr 1096586057], length 4
00:00:54.782483 IP 10.0.0.6.1883 > 10.0.0.8.44942: Flags [P.], seq 3502763232:3502763234, ack 3906245235, win 85, options [nop,nop,TS val 3791881459 ecr 1096586939], length 2
00:00:54.866430 IP 10.0.0.6.1883 > 10.0.0.8.44942: Flags [P.], seq 3502763234:3502763238, ack 3906245630, win 85, options [nop,nop,TS val 3791881543 ecr 1096587024], length 4
00:00:54.867943 IP 10.0.0.6.1883 > 10.0.0.8.44942: Flags [P.], seq 3502763238:3502763242, ack 3906245634, win 85, options [nop,nop,TS val 3791881544 ecr 1096587026], length 4
00:00:55.866813 IP 10.0.0.6.1883 > 10.0.0.8.44942: Flags [P.], seq 3502763242:3502763246, ack 3906246029, win 85, options [nop,nop,TS val 3791882543 ecr 1096588025], length 4
00:00:55.867655 IP 10.0.0.6.1883 > 10.0.0.8.44942: Flags [P.], seq 3502763246:3502763250, ack 3906246033, win 85, options [nop,nop,TS val 3791882544 ecr 1096588026], length 4
00:00:56.868818 IP 10.0.0.6.1883 > 10.0.0.8.44942: Flags [P.], seq 3502763250:3502763254, ack 3906246428, win 85, options [nop,nop,TS val 3791883545 ecr 1096589026], length 4
00:00:56.870581 IP 10.0.0.6.1883 > 10.0.0.8.44942: Flags [P.], seq 3502763254:3502763258, ack 3906246432, win 85, options [nop,nop,TS val 3791883547 ecr 1096589028], length 4
00:00:57.869347 IP 10.0.0.6.1883 > 10.0.0.8.44942: Flags [P.], seq 3502763258:3502763262, ack 3906246827, win 85, options [nop,nop,TS val 3791884546 ecr 1096590028], length 4
00:00:57.869704 IP 10.0.0.6.1883 > 10.0.0.8.44942: Flags [P.], seq 3502763262:3502763266, ack 3906246831, win 85, options [nop,nop,TS val 3791884546 ecr 1096590028], length 4
00:00:58.870504 IP 10.0.0.6.1883 > 10.0.0.8.44942: Flags [P.], seq 3502763266:3502763270, ack 3906247226, win 85, options [nop,nop,TS val 3791885547 ecr 1096591029], length 4
00:00:58.870903 IP 10.0.0.6.1883 > 10.0.0.8.44942: Flags [P.], seq 3502763270:3502763274, ack 3906247230, win 85, options [nop,nop,TS val 3791885547 ecr 1096591029], length 4
00:00:59.782304 IP 10.0.0.6.1883 > 10.0.0.8.44942: Flags [P.], seq 3502763274:3502763276, ack 3906247232, win 85, options [nop,nop,TS val 3791886459 ecr 1096591941], length 2
00:00:59.871824 IP 10.0.0.6.1883 > 10.0.0.8.44942: Flags [P.], seq 3502763276:3502763280, ack 3906247627, win 85, options [nop,nop,TS val 3791886548 ecr 1096592030], length 4
00:00:59.872278 IP 10.0.0.6.1883 > 10.0.0.8.44942: Flags [P.], seq 3502763280:3502763284, ack 3906247631, win 85, options [nop,nop,TS val 3791886549 ecr 1096592031], length 4
00:01:00.872979 IP 10.0.0.6.1883 > 10.0.0.8.44942: Flags [P.], seq 3502763284:3502763288, ack 3906248026, win 85, options [nop,nop,TS val 3791887549 ecr 1096593030], length 4
00:01:00.874323 IP 10.0.0.6.1883 > 10.0.0.8.44942: Flags [P.], seq 3502763288:3502763292, ack 3906248030, win 85, options [nop,nop,TS val 3791887551 ecr 1096593032], length 4
00:01:01.877958 IP 10.0.0.6.1883 > 10.0.0.8.44942: Flags [P.], seq 3502763292:3502763296, ack 3906248425, win 85, options [nop,nop,TS val 3791888554 ecr 1096594036], length 4
00:01:01.878573 IP 10.0.0.6.1883 > 10.0.0.8.44942: Flags [P.], seq 3502763296:3502763300, ack 3906248429, win 85, options [nop,nop,TS val 3791888555 ecr 1096594037], length 4
00:01:02.878312 IP 10.0.0.6.1883 > 10.0.0.8.44942: Flags [P.], seq 3502763300:3502763304, ack 3906248824, win 85, options [nop,nop,TS val 3791889555 ecr 1096595037], length 4
00:01:02.878972 IP 10.0.0.6.1883 > 10.0.0.8.44942: Flags [P.], seq 3502763304:3502763308, ack 3906248828, win 85, options [nop,nop,TS val 3791889556 ecr 1096595037], length 4
00:01:03.884136 IP 10.0.0.6.1883 > 10.0.0.8.44942: Flags [P.], seq 3502763308:3502763312, ack 3906249223, win 85, options [nop,nop,TS val 3791890561 ecr 1096596042], length 4
00:01:03.884916 IP 10.0.0.6.1883 > 10.0.0.8.44942: Flags [P.], seq 3502763312:3502763316, ack 3906249227, win 85, options [nop,nop,TS val 3791890561 ecr 1096596043], length 4
00:01:04.783897 IP 10.0.0.6.1883 > 10.0.0.8.44942: Flags [P.], seq 3502763316:3502763318, ack 3906249229, win 85, options [nop,nop,TS val 3791891460 ecr 1096596941], length 2
00:01:04.886267 IP 10.0.0.6.1883 > 10.0.0.8.44942: Flags [P.], seq 3502763318:3502763322, ack 3906249624, win 85, options [nop,nop,TS val 3791891563 ecr 1096597044], length 4
00:01:04.887292 IP 10.0.0.6.1883 > 10.0.0.8.44942: Flags [P.], seq 3502763322:3502763326, ack 3906249628, win 85, options [nop,nop,TS val 3791891564 ecr 1096597045], length 4
00:01:05.893967 IP 10.0.0.6.1883 > 10.0.0.8.44942: Flags [P.], seq 3502763326:3502763330, ack 3906250023, win 85, options [nop,nop,TS val 3791892570 ecr 1096598051], length 4
00:01:05.895607 IP 10.0.0.6.1883 > 10.0.0.8.44942: Flags [P.], seq 3502763330:3502763334, ack 3906250027, win 85, options [nop,nop,TS val 3791892572 ecr 1096598053], length 4
00:01:06.896451 IP 10.0.0.6.1883 > 10.0.0.8.44942: Flags [P.], seq 3502763334:3502763338, ack 3906250422, win 85, options [nop,nop,TS val 3791893573 ecr 1096599054], length 4
00:01:06.898191 IP 10.0.0.6.1883 > 10.0.0.8.44942: Flags [P.], seq 3502763338:3502763342, ack 3906250426, win 85, options [nop,nop,TS val 3791893575 ecr 1096599055], length 4
00:01:07.912168 IP 10.0.0.6.1883 > 10.0.0.8.44942: Flags [P.], seq 3502763342:3502763346, ack 3906250821, win 85, options [nop,nop,TS val 3791894589 ecr 1096600070], length 4
00:01:07.913096 IP 10.0.0.6.1883 > 10.0.0.8.44942: Flags [P.], seq 3502763346:3502763350, ack 3906250825, win 85, options [nop,nop,TS val 3791894590 ecr 1096600071], length 4
00:01:08.914299 IP 10.0.0.6.1883 > 10.0.0.8.44942: Flags [P.], seq 3502763350:3502763354, ack 3906251220, win 85, options [nop,nop,TS val 3791895591 ecr 1096601072], length 4
00:01:08.915863 IP 10.0.0.6.1883 > 10.0.0.8.44942: Flags [P.], seq 3502763354:3502763358, ack 3906251224, win 85, options [nop,nop,TS val 3791895592 ecr 1096601073], length 4
00:01:09.785248 IP 10.0.0.6.1883 > 10.0.0.8.44942: Flags [P.], seq 3502763358:3502763360, ack 3906251226, win 85, options [nop,nop,TS val 3791896462 ecr 1096601943], length 2
00:01:09.915283 IP 10.0.0.6.1883 > 10.0.0.8.44942: Flags [P.], seq 3502763360:3502763364, ack 3906251621, win 85, options [nop,nop,TS val 3791896592 ecr 1096602073], length 4
00:01:09.916616 IP 10.0.0.6.1883 > 10.0.0.8.44942: Flags [P.], seq 3502763364:3502763368, ack 3906251625, win 85, options [nop,nop,TS val 3791896593 ecr 1096602074], length 4
00:01:10.917342 IP 10.0.0.6.1883 > 10.0.0.8.44942: Flags [P.], seq 3502763368:3502763372, ack 3906252020, win 85, options [nop,nop,TS val 3791897594 ecr 1096603075], length 4
00:01:10.918784 IP 10.0.0.6.1883 > 10.0.0.8.44942: Flags [P.], seq 3502763372:3502763376, ack 3906252024, win 85, options [nop,nop,TS val 3791897595 ecr 1096603076], length 4
00:01:11.928027 IP 10.0.0.6.1883 > 10.0.0.8.44942: Flags [P.], seq 3502763376:3502763380, ack 3906252419, win 85, options [nop,nop,TS val 3791898604 ecr 1096604080], length 4
00:01:11.938397 IP 10.0.0.6.1883 > 10.0.0.8.44942: Flags [P.], seq 3502763380:3502763384, ack 3906252423, win 85, options [nop,nop,TS val 3791898615 ecr 1096604095], length 4
00:01:12.929498 IP 10.0.0.6.1883 > 10.0.0.8.44942: Flags [P.], seq 3502763384:3502763388, ack 3906252818, win 85, options [nop,nop,TS val 3791899606 ecr 1096605086], length 4
00:01:13.104918 IP 10.0.0.6.1883 > 10.0.0.8.44942: Flags [P.], seq 3502763388:3502763392, ack 3906252822, win 85, options [nop,nop,TS val 3791899781 ecr 1096605263], length 4
00:01:13.945555 IP 10.0.0.6.1883 > 10.0.0.8.44942: Flags [P.], seq 3502763392:3502763396, ack 3906253217, win 85, options [nop,nop,TS val 3791900622 ecr 1096606104], length 4
00:01:13.946465 IP 10.0.0.6.1883 > 10.0.0.8.44942: Flags [P.], seq 3502763396:3502763400, ack 3906253221, win 85, options [nop,nop,TS val 3791900623 ecr 1096606105], length 4
00:01:14.791167 IP 10.0.0.6.1883 > 10.0.0.8.44942: Flags [P.], seq 3502763400:3502763402, ack 3906253223, win 85, options [nop,nop,TS val 3791901468 ecr 1096606950], length 2
00:01:14.947491 IP 10.0.0.6.1883 > 10.0.0.8.44942: Flags [P.], seq 3502763402:3502763406, ack 3906253618, win 85, options [nop,nop,TS val 3791901624 ecr 1096607105], length 4
00:01:14.948839 IP 10.0.0.6.1883 > 10.0.0.8.44942: Flags [P.], seq 3502763406:3502763410, ack 3906253622, win 85, options [nop,nop,TS val 3791901625 ecr 1096607107], length 4
00:01:15.949377 IP 10.0.0.6.1883 > 10.0.0.8.44942: Flags [P.], seq 3502763410:3502763414, ack 3906254017, win 85, options [nop,nop,TS val 3791902626 ecr 1096608107], length 4
00:01:15.950947 IP 10.0.0.6.1883 > 10.0.0.8.44942: Flags [P.], seq 3502763414:3502763418, ack 3906254021, win 85, options [nop,nop,TS val 3791902627 ecr 1096608108], length 4
00:01:16.955238 IP 10.0.0.6.1883 > 10.0.0.8.44942: Flags [P.], seq 3502763418:3502763422, ack 3906254416, win 85, options [nop,nop,TS val 3791903632 ecr 1096609113], length 4
00:01:16.955836 IP 10.0.0.6.1883 > 10.0.0.8.44942: Flags [P.], seq 3502763422:3502763426, ack 3906254420, win 85, options [nop,nop,TS val 3791903632 ecr 1096609114], length 4
00:01:17.958900 IP 10.0.0.6.1883 > 10.0.0.8.44942: Flags [P.], seq 3502763426:3502763430, ack 3906254815, win 85, options [nop,nop,TS val 3791904635 ecr 1096610116], length 4
00:01:17.961840 IP 10.0.0.6.1883 > 10.0.0.8.44942: Flags [P.], seq 3502763430:3502763434, ack 3906254819, win 85, options [nop,nop,TS val 3791904638 ecr 1096610118], length 4
00:01:18.974367 IP 10.0.0.6.1883 > 10.0.0.8.44942: Flags [P.], seq 3502763434:3502763438, ack 3906255214, win 85, options [nop,nop,TS val 3791905651 ecr 1096611131], length 4
00:01:18.975985 IP 10.0.0.6.1883 > 10.0.0.8.44942: Flags [P.], seq 3502763438:3502763442, ack 3906255218, win 85, options [nop,nop,TS val 3791905652 ecr 1096611133], length 4
00:01:19.792575 IP 10.0.0.6.1883 > 10.0.0.8.44942: Flags [P.], seq 3502763442:3502763444, ack 3906255220, win 85, options [nop,nop,TS val 3791906469 ecr 1096611950], length 2
00:01:19.975013 IP 10.0.0.6.1883 > 10.0.0.8.44942: Flags [P.], seq 3502763444:3502763448, ack 3906255615, win 85, options [nop,nop,TS val 3791906652 ecr 1096612133], length 4
00:01:19.975970 IP 10.0.0.6.1883 > 10.0.0.8.44942: Flags [P.], seq 3502763448:3502763452, ack 3906255619, win 85, options [nop,nop,TS val 3791906653 ecr 1096612134], length 4
00:01:20.975652 IP 10.0.0.6.1883 > 10.0.0.8.44942: Flags [P.], seq 3502763452:3502763456, ack 3906256014, win 85, options [nop,nop,TS val 3791907652 ecr 1096613133], length 4
00:01:20.976540 IP 10.0.0.6.1883 > 10.0.0.8.44942: Flags [P.], seq 3502763456:3502763460, ack 3906256018, win 85, options [nop,nop,TS val 3791907653 ecr 1096613134], length 4
00:01:21.981058 IP 10.0.0.6.1883 > 10.0.0.8.44942: Flags [P.], seq 3502763460:3502763464, ack 3906256413, win 85, options [nop,nop,TS val 3791908657 ecr 1096614139], length 4
00:01:21.982616 IP 10.0.0.6.1883 > 10.0.0.8.44942: Flags [P.], seq 3502763464:3502763468, ack 3906256417, win 85, options [nop,nop,TS val 3791908659 ecr 1096614140], length 4
00:01:22.982875 IP 10.0.0.6.1883 > 10.0.0.8.44942: Flags [P.], seq 3502763468:3502763472, ack 3906256812, win 85, options [nop,nop,TS val 3791909659 ecr 1096615139], length 4
00:01:22.984975 IP 10.0.0.6.1883 > 10.0.0.8.44942: Flags [P.], seq 3502763472:3502763476, ack 3906256816, win 85, options [nop,nop,TS val 3791909662 ecr 1096615142], length 4
00:01:23.985251 IP 10.0.0.6.1883 > 10.0.0.8.44942: Flags [P.], seq 3502763476:3502763480, ack 3906257211, win 85, options [nop,nop,TS val 3791910662 ecr 1096616141], length 4
00:01:23.988095 IP 10.0.0.6.1883 > 10.0.0.8.44942: Flags [P.], seq 3502763480:3502763484, ack 3906257215, win 85, options [nop,nop,TS val 3791910664 ecr 1096616144], length 4
00:01:24.795365 IP 10.0.0.6.1883 > 10.0.0.8.44942: Flags [P.], seq 3502763484:3502763486, ack 3906257217, win 85, options [nop,nop,TS val 3791911472 ecr 1096616952], length 2
00:01:24.987081 IP 10.0.0.6.1883 > 10.0.0.8.44942: Flags [P.], seq 3502763486:3502763490, ack 3906257612, win 85, options [nop,nop,TS val 3791911663 ecr 1096617143], length 4
00:01:24.989385 IP 10.0.0.6.1883 > 10.0.0.8.44942: Flags [P.], seq 3502763490:3502763494, ack 3906257616, win 85, options [nop,nop,TS val 3791911666 ecr 1096617146], length 4
00:01:25.986367 IP 10.0.0.6.1883 > 10.0.0.8.44942: Flags [P.], seq 3502763494:3502763498, ack 3906258011, win 85, options [nop,nop,TS val 3791912663 ecr 1096618143], length 4
00:01:25.987721 IP 10.0.0.6.1883 > 10.0.0.8.44942: Flags [P.], seq 3502763498:3502763502, ack 3906258015, win 85, options [nop,nop,TS val 3791912664 ecr 1096618145], length 4
00:01:26.987251 IP 10.0.0.6.1883 > 10.0.0.8.44942: Flags [P.], seq 3502763502:3502763506, ack 3906258410, win 85, options [nop,nop,TS val 3791913664 ecr 1096619145], length 4
00:01:26.988249 IP 10.0.0.6.1883 > 10.0.0.8.44942: Flags [P.], seq 3502763506:3502763510, ack 3906258414, win 85, options [nop,nop,TS val 3791913665 ecr 1096619146], length 4
00:01:27.999184 IP 10.0.0.6.1883 > 10.0.0.8.44942: Flags [P.], seq 3502763510:3502763514, ack 3906258809, win 85, options [nop,nop,TS val 3791914676 ecr 1096620155], length 4
00:01:28.002235 IP 10.0.0.6.1883 > 10.0.0.8.44942: Flags [P.], seq 3502763514:3502763518, ack 3906258813, win 85, options [nop,nop,TS val 3791914678 ecr 1096620158], length 4
00:01:28.998902 IP 10.0.0.6.1883 > 10.0.0.8.44942: Flags [P.], seq 3502763518:3502763522, ack 3906259208, win 85, options [nop,nop,TS val 3791915675 ecr 1096621156], length 4
00:01:28.999821 IP 10.0.0.6.1883 > 10.0.0.8.44942: Flags [P.], seq 3502763522:3502763526, ack 3906259212, win 85, options [nop,nop,TS val 3791915676 ecr 1096621158], length 4
00:01:29.799212 IP 10.0.0.6.1883 > 10.0.0.8.44942: Flags [P.], seq 3502763526:3502763528, ack 3906259214, win 85, options [nop,nop,TS val 3791916475 ecr 1096621953], length 2
00:01:30.002153 IP 10.0.0.6.1883 > 10.0.0.8.44942: Flags [P.], seq 3502763528:3502763532, ack 3906259609, win 85, options [nop,nop,TS val 3791916679 ecr 1096622158], length 4
00:01:30.005096 IP 10.0.0.6.1883 > 10.0.0.8.44942: Flags [P.], seq 3502763532:3502763536, ack 3906259613, win 85, options [nop,nop,TS val 3791916681 ecr 1096622161], length 4
00:01:31.001795 IP 10.0.0.6.1883 > 10.0.0.8.44942: Flags [P.], seq 3502763536:3502763540, ack 3906260008, win 85, options [nop,nop,TS val 3791917678 ecr 1096623159], length 4
00:01:31.002691 IP 10.0.0.6.1883 > 10.0.0.8.44942: Flags [P.], seq 3502763540:3502763544, ack 3906260012, win 85, options [nop,nop,TS val 3791917679 ecr 1096623161], length 4
00:01:32.005928 IP 10.0.0.6.1883 > 10.0.0.8.44942: Flags [P.], seq 3502763544:3502763548, ack 3906260407, win 85, options [nop,nop,TS val 3791918682 ecr 1096624163], length 4
00:01:32.007388 IP 10.0.0.6.1883 > 10.0.0.8.44942: Flags [P.], seq 3502763548:3502763552, ack 3906260411, win 85, options [nop,nop,TS val 3791918684 ecr 1096624165], length 4
00:01:33.007807 IP 10.0.0.6.1883 > 10.0.0.8.44942: Flags [P.], seq 3502763552:3502763556, ack 3906260806, win 85, options [nop,nop,TS val 3791919684 ecr 1096625165], length 4
00:01:33.008949 IP 10.0.0.6.1883 > 10.0.0.8.44942: Flags [P.], seq 3502763556:3502763560, ack 3906260810, win 85, options [nop,nop,TS val 3791919686 ecr 1096625167], length 4
00:01:34.009358 IP 10.0.0.6.1883 > 10.0.0.8.44942: Flags [P.], seq 3502763560:3502763564, ack 3906261205, win 85, options [nop,nop,TS val 3791920686 ecr 1096626166], length 4
00:01:34.011118 IP 10.0.0.6.1883 > 10.0.0.8.44942: Flags [P.], seq 3502763564:3502763568, ack 3906261209, win 85, options [nop,nop,TS val 3791920687 ecr 1096626168], length 4
00:01:34.796059 IP 10.0.0.6.1883 > 10.0.0.8.44942: Flags [P.], seq 3502763568:3502763570, ack 3906261211, win 85, options [nop,nop,TS val 3791921473 ecr 1096626954], length 2
00:01:35.011160 IP 10.0.0.6.1883 > 10.0.0.8.44942: Flags [P.], seq 3502763570:3502763574, ack 3906261606, win 85, options [nop,nop,TS val 3791921688 ecr 1096627168], length 4
00:01:35.013256 IP 10.0.0.6.1883 > 10.0.0.8.44942: Flags [P.], seq 3502763574:3502763578, ack 3906261610, win 85, options [nop,nop,TS val 3791921689 ecr 1096627170], length 4
00:01:36.013285 IP 10.0.0.6.1883 > 10.0.0.8.44942: Flags [P.], seq 3502763578:3502763582, ack 3906262005, win 85, options [nop,nop,TS val 3791922690 ecr 1096628168], length 4
00:01:36.015432 IP 10.0.0.6.1883 > 10.0.0.8.44942: Flags [P.], seq 3502763582:3502763586, ack 3906262009, win 85, options [nop,nop,TS val 3791922692 ecr 1096628172], length 4
00:01:37.013537 IP 10.0.0.6.1883 > 10.0.0.8.44942: Flags [P.], seq 3502763586:3502763590, ack 3906262404, win 85, options [nop,nop,TS val 3791923690 ecr 1096629170], length 4
00:01:37.015628 IP 10.0.0.6.1883 > 10.0.0.8.44942: Flags [P.], seq 3502763590:3502763594, ack 3906262408, win 85, options [nop,nop,TS val 3791923692 ecr 1096629173], length 4
00:01:38.020735 IP 10.0.0.6.1883 > 10.0.0.8.44942: Flags [P.], seq 3502763594:3502763598, ack 3906262803, win 85, options [nop,nop,TS val 3791924697 ecr 1096630175], length 4
00:01:38.022765 IP 10.0.0.6.1883 > 10.0.0.8.44942: Flags [P.], seq 3502763598:3502763602, ack 3906262807, win 85, options [nop,nop,TS val 3791924699 ecr 1096630180], length 4
00:01:39.020429 IP 10.0.0.6.1883 > 10.0.0.8.44942: Flags [P.], seq 3502763602:3502763606, ack 3906263202, win 85, options [nop,nop,TS val 3791925697 ecr 1096631176], length 4
00:01:39.023117 IP 10.0.0.6.1883 > 10.0.0.8.44942: Flags [P.], seq 3502763606:3502763610, ack 3906263206, win 85, options [nop,nop,TS val 3791925699 ecr 1096631179], length 4
00:01:39.801477 IP 10.0.0.6.1883 > 10.0.0.8.44942: Flags [P.], seq 3502763610:3502763612, ack 3906263208, win 85, options [nop,nop,TS val 3791926478 ecr 1096631956], length 2
00:01:40.019977 IP 10.0.0.6.1883 > 10.0.0.8.44942: Flags [P.], seq 3502763612:3502763616, ack 3906263603, win 85, options [nop,nop,TS val 3791926697 ecr 1096632178], length 4
00:01:40.020866 IP 10.0.0.6.1883 > 10.0.0.8.44942: Flags [P.], seq 3502763616:3502763620, ack 3906263607, win 85, options [nop,nop,TS val 3791926697 ecr 1096632179], length 4
00:01:41.020315 IP 10.0.0.6.1883 > 10.0.0.8.44942: Flags [P.], seq 3502763620:3502763624, ack 3906264002, win 85, options [nop,nop,TS val 3791927697 ecr 1096633178], length 4
00:01:41.020888 IP 10.0.0.6.1883 > 10.0.0.8.44942: Flags [P.], seq 3502763624:3502763628, ack 3906264006, win 85, options [nop,nop,TS val 3791927697 ecr 1096633179], length 4
00:01:42.024575 IP 10.0.0.6.1883 > 10.0.0.8.44942: Flags [P.], seq 3502763628:3502763632, ack 3906264401, win 85, options [nop,nop,TS val 3791928701 ecr 1096634180], length 4
00:01:42.026771 IP 10.0.0.6.1883 > 10.0.0.8.44942: Flags [P.], seq 3502763632:3502763636, ack 3906264405, win 85, options [nop,nop,TS val 3791928703 ecr 1096634183], length 4
00:01:43.029282 IP 10.0.0.6.1883 > 10.0.0.8.44942: Flags [P.], seq 3502763636:3502763640, ack 3906264800, win 85, options [nop,nop,TS val 3791929706 ecr 1096635185], length 4
00:01:43.031497 IP 10.0.0.6.1883 > 10.0.0.8.44942: Flags [P.], seq 3502763640:3502763644, ack 3906264804, win 85, options [nop,nop,TS val 3791929708 ecr 1096635188], length 4
00:01:44.030757 IP 10.0.0.6.1883 > 10.0.0.8.44942: Flags [P.], seq 3502763644:3502763648, ack 3906265199, win 85, options [nop,nop,TS val 3791930707 ecr 1096636185], length 4
00:01:44.033298 IP 10.0.0.6.1883 > 10.0.0.8.44942: Flags [P.], seq 3502763648:3502763652, ack 3906265203, win 85, options [nop,nop,TS val 3791930709 ecr 1096636190], length 4
00:01:44.800580 IP 10.0.0.6.1883 > 10.0.0.8.44942: Flags [P.], seq 3502763652:3502763654, ack 3906265205, win 85, options [nop,nop,TS val 3791931477 ecr 1096636958], length 2
00:01:46.048327 IP 10.0.0.6.1883 > 10.0.0.8.44942: Flags [F.], seq 3502763654, ack 3906265206, win 85, options [nop,nop,TS val 3791932724 ecr 1096638205], length 0