 00:00:00.000000 IP6 fe80::188c:52ff:fe8f:5c24 > ff02::2: ICMP6, router solicitation, length 16
 00:00:00.027081 IP6 fe80::443c:c2ff:fe89:c3ed > ff02::2: ICMP6, router solicitation, length 16
 00:00:00.281466 IP6 fe80::b4b5:1cff:fedb:dec5 > ff02::2: ICMP6, router solicitation, length 16
 00:00:00.291972 IP6 fe80::9824:90ff:fec8:c38b > ff02::2: ICMP6, router solicitation, length 16
 00:00:00.548424 IP6 fe80::70d9:56ff:fe59:710d > ff02::2: ICMP6, router solicitation, length 16
 00:00:00.558682 IP6 fe80::9c8b:9fff:feff:41b5 > ff02::2: ICMP6, router solicitation, length 16
 00:00:00.757100 IP6 fe80::7425:bbff:fe75:83c5 > ff02::2: ICMP6, router solicitation, length 16
 00:00:01.294459 IP6 fe80::3c01:c4ff:fee6:273 > ff02::2: ICMP6, router solicitation, length 16
 00:00:01.564907 IP6 fe80::b073:25ff:fefd:18b9 > ff02::2: ICMP6, router solicitation, length 16
 00:00:01.793545 IP6 fe80::24fc:eeff:feab:a4ab > ff02::2: ICMP6, router solicitation, length 16
 00:00:01.822021 IP6 fe80::24f2:47ff:fe7f:bc20 > ff02::2: ICMP6, router solicitation, length 16
 00:00:01.836317 IP6 fe80::84c1:2bff:fe96:b31e > ff02::2: ICMP6, router solicitation, length 16
 00:00:02.830777 IP6 fe80::ac92:cbff:fef0:2fca > ff02::2: ICMP6, router solicitation, length 16
 00:00:03.316879 IP6 fe80::344e:63ff:fe68:f38 > ff02::2: ICMP6, router solicitation, length 16
 00:00:07.796863 ARP, Request who-has 10.0.0.6 tell 10.0.0.8, length 28
 00:00:07.797926 ARP, Reply 10.0.0.6 is-at 76:25:bb:75:83:c5, length 28
 00:00:07.827041 IP 10.0.0.8.45174 > 10.0.0.6.1883: Flags [S], seq 2446303792, win 42340, options [mss 1460,sackOK,TS val 1098059295 ecr 0,nop,wscale 9], length 0
 00:00:07.827217 IP 10.0.0.6.1883 > 10.0.0.8.45174: Flags [S.], seq 3711507008, ack 2446303793, win 43440, options [mss 1460,sackOK,TS val 3793353871 ecr 1098059295,nop,wscale 9], length 0
 00:00:07.835584 IP 10.0.0.8.45174 > 10.0.0.6.1883: Flags [.], ack 3711507009, win 83, options [nop,nop,TS val 1098059361 ecr 3793353871], length 0
 00:00:07.835666 IP 10.0.0.8.45174 > 10.0.0.6.1883: Flags [P.], seq 2446303793:2446303813, ack 3711507009, win 83, options [nop,nop,TS val 1098059361 ecr 3793353871], length 20
 00:00:07.835800 IP 10.0.0.6.1883 > 10.0.0.8.45174: Flags [.], ack 2446303813, win 85, options [nop,nop,TS val 3793353880 ecr 1098059361], length 0
 00:00:07.836111 IP 10.0.0.6.1883 > 10.0.0.8.45174: Flags [P.], seq 3711507009:3711507013, ack 2446303813, win 85, options [nop,nop,TS val 3793353880 ecr 1098059361], length 4
 00:00:07.844216 IP 10.0.0.8.45174 > 10.0.0.6.1883: Flags [.], ack 3711507013, win 83, options [nop,nop,TS val 1098059370 ecr 3793353880], length 0
 00:00:07.844542 IP 10.0.0.8.45174 > 10.0.0.6.1883: Flags [P.], seq 2446303813:2446303877, ack 3711507013, win 83, options [nop,nop,TS val 1098059370 ecr 3793353880], length 64
 00:00:07.848378 IP 10.0.0.6.1883 > 10.0.0.8.45174: Flags [P.], seq 3711507013:3711507078, ack 2446303877, win 85, options [nop,nop,TS val 3793353889 ecr 1098059370], length 65
 00:00:07.851197 IP 10.0.0.8.45174 > 10.0.0.6.1883: Flags [P.], seq 2446303877:2446304272, ack 3711507078, win 83, options [nop,nop,TS val 1098059377 ecr 3793353889], length 395
 00:00:07.851393 IP 10.0.0.6.1883 > 10.0.0.8.45174: Flags [P.], seq 3711507078:3711507083, ack 2446304272, win 85, options [nop,nop,TS val 3793353895 ecr 1098059377], length 5
 00:00:07.896019 IP 10.0.0.8.45174 > 10.0.0.6.1883: Flags [.], ack 3711507083, win 83, options [nop,nop,TS val 1098059422 ecr 3793353895], length 0
 00:00:07.965326 IP 10.0.0.6.1883 > 10.0.0.8.45174: Flags [P.], seq 3711507083:3711507087, ack 2446304272, win 85, options [nop,nop,TS val 3793353940 ecr 1098059422], length 4
 00:00:07.966973 IP 10.0.0.8.45174 > 10.0.0.6.1883: Flags [.], ack 3711507087, win 83, options [nop,nop,TS val 1098059492 ecr 3793353940], length 0
 00:00:07.967731 IP 10.0.0.8.45174 > 10.0.0.6.1883: Flags [P.], seq 2446304272:2446304276, ack 3711507087, win 83, options [nop,nop,TS val 1098059492 ecr 3793353940], length 4
 00:00:07.968080 IP 10.0.0.6.1883 > 10.0.0.8.45174: Flags [P.], seq 3711507087:3711507091, ack 2446304276, win 85, options [nop,nop,TS val 3793354012 ecr 1098059492], length 4
 00:00:08.030627 IP 10.0.0.8.45174 > 10.0.0.6.1883: Flags [.], ack 3711507091, win 83, options [nop,nop,TS val 1098059551 ecr 3793354012], length 0
 00:00:08.780782 IP 10.0.0.8.45174 > 10.0.0.6.1883: Flags [P.], seq 2446304276:2446304671, ack 3711507091, win 83, options [nop,nop,TS val 1098060306 ecr 3793354012], length 395
 00:00:08.781532 IP 10.0.0.6.1883 > 10.0.0.8.45174: Flags [P.], seq 3711507091:3711507095, ack 2446304671, win 85, options [nop,nop,TS val 3793354826 ecr 1098060306], length 4
 00:00:08.783283 IP 10.0.0.8.45174 > 10.0.0.6.1883: Flags [.], ack 3711507095, win 83, options [nop,nop,TS val 1098060308 ecr 3793354826], length 0
 00:00:08.783934 IP 10.0.0.8.45174 > 10.0.0.6.1883: Flags [P.], seq 2446304671:2446304675, ack 3711507095, win 83, options [nop,nop,TS val 1098060309 ecr 3793354826], length 4
 00:00:08.784407 IP 10.0.0.6.1883 > 10.0.0.8.45174: Flags [P.], seq 3711507095:3711507099, ack 2446304675, win 85, options [nop,nop,TS val 3793354828 ecr 1098060309], length 4
 00:00:08.837835 IP 10.0.0.8.45174 > 10.0.0.6.1883: Flags [.], ack 3711507099, win 83, options [nop,nop,TS val 1098060354 ecr 3793354828], length 0
 00:00:09.816056 IP 10.0.0.8.45174 > 10.0.0.6.1883: Flags [P.], seq 2446304675:2446305070, ack 3711507099, win 83, options [nop,nop,TS val 1098061340 ecr 3793354828], length 395
 00:00:09.816941 IP 10.0.0.6.1883 > 10.0.0.8.45174: Flags [P.], seq 3711507099:3711507103, ack 2446305070, win 85, options [nop,nop,TS val 3793355861 ecr 1098061340], length 4
 00:00:09.891274 IP 10.0.0.8.45174 > 10.0.0.6.1883: Flags [.], ack 3711507103, win 83, options [nop,nop,TS val 1098061417 ecr 3793355861], length 0
 00:00:09.893798 IP 10.0.0.8.45174 > 10.0.0.6.1883: Flags [P.], seq 2446305070:2446305074, ack 3711507103, win 83, options [nop,nop,TS val 1098061418 ecr 3793355861], length 4
 00:00:09.896642 IP 10.0.0.6.1883 > 10.0.0.8.45174: Flags [P.], seq 3711507103:3711507107, ack 2446305074, win 85, options [nop,nop,TS val 3793355939 ecr 1098061418], length 4
 00:00:10.121034 IP 10.0.0.8.45174 > 10.0.0.6.1883: Flags [.], ack 3711507107, win 83, options [nop,nop,TS val 1098061483 ecr 3793355939], length 0
 00:00:10.817487 IP 10.0.0.8.45174 > 10.0.0.6.1883: Flags [P.], seq 2446305074:2446305469, ack 3711507107, win 83, options [nop,nop,TS val 1098062342 ecr 3793355939], length 395
 00:00:10.820229 IP 10.0.0.6.1883 > 10.0.0.8.45174: Flags [P.], seq 3711507107:3711507111, ack 2446305469, win 85, options [nop,nop,TS val 3793356863 ecr 1098062342], length 4
 00:00:10.859238 IP 10.0.0.8.45174 > 10.0.0.6.1883: Flags [.], ack 3711507111, win 83, options [nop,nop,TS val 1098062385 ecr 3793356863], length 0
 00:00:10.861746 IP 10.0.0.8.45174 > 10.0.0.6.1883: Flags [P.], seq 2446305469:2446305473, ack 3711507111, win 83, options [nop,nop,TS val 1098062386 ecr 3793356863], length 4
 00:00:10.862282 IP 10.0.0.6.1883 > 10.0.0.8.45174: Flags [P.], seq 3711507111:3711507115, ack 2446305473, win 85, options [nop,nop,TS val 3793356906 ecr 1098062386], length 4
 00:00:10.989576 IP 10.0.0.8.45174 > 10.0.0.6.1883: Flags [.], ack 3711507115, win 83, options [nop,nop,TS val 1098062491 ecr 3793356906], length 0
 00:00:11.830578 IP 10.0.0.8.45174 > 10.0.0.6.1883: Flags [P.], seq 2446305473:2446305868, ack 3711507115, win 83, options [nop,nop,TS val 1098063354 ecr 3793356906], length 395
 00:00:11.831154 IP 10.0.0.6.1883 > 10.0.0.8.45174: Flags [P.], seq 3711507115:3711507119, ack 2446305868, win 85, options [nop,nop,TS val 3793357875 ecr 1098063354], length 4
 00:00:11.832341 IP 10.0.0.8.45174 > 10.0.0.6.1883: Flags [.], ack 3711507119, win 83, options [nop,nop,TS val 1098063358 ecr 3793357875], length 0
 00:00:11.833408 IP 10.0.0.8.45174 > 10.0.0.6.1883: Flags [P.], seq 2446305868:2446305872, ack 3711507119, win 83, options [nop,nop,TS val 1098063358 ecr 3793357875], length 4
 00:00:11.834371 IP 10.0.0.6.1883 > 10.0.0.8.45174: Flags [P.], seq 3711507119:3711507123, ack 2446305872, win 85, options [nop,nop,TS val 3793357878 ecr 1098063358], length 4
 00:00:11.877919 IP 10.0.0.8.45174 > 10.0.0.6.1883: Flags [.], ack 3711507123, win 83, options [nop,nop,TS val 1098063403 ecr 3793357878], length 0
 00:00:12.868483 IP 10.0.0.8.45174 > 10.0.0.6.1883: Flags [P.], seq 2446305872:2446305874, ack 3711507123, win 83, options [nop,nop,TS val 1098064393 ecr 3793357878], length 2
 00:00:12.868789 IP 10.0.0.6.1883 > 10.0.0.8.45174: Flags [P.], seq 3711507123:3711507125, ack 2446305874, win 85, options [nop,nop,TS val 3793358913 ecr 1098064393], length 2
 00:00:12.869947 IP 10.0.0.8.45174 > 10.0.0.6.1883: Flags [P.], seq 2446305874:2446306269, ack 3711507125, win 83, options [nop,nop,TS val 1098064396 ecr 3793358913], length 395
 00:00:12.871165 IP 10.0.0.6.1883 > 10.0.0.8.45174: Flags [P.], seq 3711507125:3711507129, ack 2446306269, win 85, options [nop,nop,TS val 3793358915 ecr 1098064396], length 4
 00:00:12.872319 IP 10.0.0.8.45174 > 10.0.0.6.1883: Flags [P.], seq 2446306269:2446306273, ack 3711507129, win 83, options [nop,nop,TS val 1098064398 ecr 3793358915], length 4
 00:00:12.873097 IP 10.0.0.6.1883 > 10.0.0.8.45174: Flags [P.], seq 3711507129:3711507133, ack 2446306273, win 85, options [nop,nop,TS val 3793358917 ecr 1098064398], length 4
 00:00:12.926533 IP 10.0.0.8.45174 > 10.0.0.6.1883: Flags [.], ack 3711507133, win 83, options [nop,nop,TS val 1098064451 ecr 3793358917], length 0
 00:00:13.927377 IP 10.0.0.8.45174 > 10.0.0.6.1883: Flags [P.], seq 2446306273:2446306668, ack 3711507133, win 83, options [nop,nop,TS val 1098065453 ecr 3793358917], length 395
 00:00:13.928297 IP 10.0.0.6.1883 > 10.0.0.8.45174: Flags [P.], seq 3711507133:3711507137, ack 2446306668, win 85, options [nop,nop,TS val 3793359972 ecr 1098065453], length 4
 00:00:13.929440 IP 10.0.0.8.45174 > 10.0.0.6.1883: Flags [.], ack 3711507137, win 83, options [nop,nop,TS val 1098065455 ecr 3793359972], length 0
 00:00:13.929583 IP 10.0.0.8.45174 > 10.0.0.6.1883: Flags [P.], seq 2446306668:2446306672, ack 3711507137, win 83, options [nop,nop,TS val 1098065455 ecr 3793359972], length 4
 00:00:13.929784 IP 10.0.0.6.1883 > 10.0.0.8.45174: Flags [P.], seq 3711507137:3711507141, ack 2446306672, win 85, options [nop,nop,TS val 3793359974 ecr 1098065455], length 4
 00:00:14.132973 IP 10.0.0.8.45174 > 10.0.0.6.1883: Flags [.], ack 3711507141, win 83, options [nop,nop,TS val 1098065531 ecr 3793359974], length 0
 00:00:14.593781 IP6 fe80::188c:52ff:fe8f:5c24 > ff02::2: ICMP6, router solicitation, length 16
 00:00:14.623821 IP6 fe80::443c:c2ff:fe89:c3ed > ff02::2: ICMP6, router solicitation, length 16
 00:00:14.640328 IP6 fe80::b4b5:1cff:fedb:dec5 > ff02::2: ICMP6, router solicitation, length 16
 00:00:14.930915 IP 10.0.0.8.45174 > 10.0.0.6.1883: Flags [P.], seq 2446306672:2446307067, ack 3711507141, win 83, options [nop,nop,TS val 1098066456 ecr 3793359974], length 395
 00:00:14.931350 IP 10.0.0.6.1883 > 10.0.0.8.45174: Flags [P.], seq 3711507141:3711507145, ack 2446307067, win 85, options [nop,nop,TS val 3793360975 ecr 1098066456], length 4
 00:00:15.081428 IP 10.0.0.8.45174 > 10.0.0.6.1883: Flags [.], ack 3711507145, win 83, options [nop,nop,TS val 1098066606 ecr 3793360975], length 0
 00:00:15.081541 IP 10.0.0.8.45174 > 10.0.0.6.1883: Flags [P.], seq 2446307067:2446307071, ack 3711507145, win 83, options [nop,nop,TS val 1098066607 ecr 3793360975], length 4
 00:00:15.082133 IP 10.0.0.6.1883 > 10.0.0.8.45174: Flags [P.], seq 3711507145:3711507149, ack 2446307071, win 85, options [nop,nop,TS val 3793361126 ecr 1098066607], length 4
 00:00:15.120152 IP6 fe80::9c8b:9fff:feff:41b5 > ff02::2: ICMP6, router solicitation, length 16
 00:00:15.128708 IP 10.0.0.8.45174 > 10.0.0.6.1883: Flags [.], ack 3711507149, win 83, options [nop,nop,TS val 1098066651 ecr 3793361126], length 0
 00:00:15.372357 IP6 fe80::9824:90ff:fec8:c38b > ff02::2: ICMP6, router solicitation, length 16
 00:00:15.937715 IP 10.0.0.8.45174 > 10.0.0.6.1883: Flags [P.], seq 2446307071:2446307466, ack 3711507149, win 83, options [nop,nop,TS val 1098067462 ecr 3793361126], length 395
 00:00:15.938729 IP 10.0.0.6.1883 > 10.0.0.8.45174: Flags [P.], seq 3711507149:3711507153, ack 2446307466, win 85, options [nop,nop,TS val 3793361983 ecr 1098067462], length 4
 00:00:15.939820 IP 10.0.0.8.45174 > 10.0.0.6.1883: Flags [.], ack 3711507153, win 83, options [nop,nop,TS val 1098067465 ecr 3793361983], length 0
 00:00:15.940644 IP 10.0.0.8.45174 > 10.0.0.6.1883: Flags [P.], seq 2446307466:2446307470, ack 3711507153, win 83, options [nop,nop,TS val 1098067466 ecr 3793361983], length 4
 00:00:15.940976 IP 10.0.0.6.1883 > 10.0.0.8.45174: Flags [P.], seq 3711507153:3711507157, ack 2446307470, win 85, options [nop,nop,TS val 3793361985 ecr 1098067466], length 4
 00:00:16.159285 IP6 fe80::7425:bbff:fe75:83c5 > ff02::2: ICMP6, router solicitation, length 16
 00:00:16.159198 IP 10.0.0.8.45174 > 10.0.0.6.1883: Flags [.], ack 3711507157, win 83, options [nop,nop,TS val 1098067605 ecr 3793361985], length 0
 00:00:16.203940 IP6 fe80::70d9:56ff:fe59:710d > ff02::2: ICMP6, router solicitation, length 16
 00:00:16.908425 IP6 fe80::b073:25ff:fefd:18b9 > ff02::2: ICMP6, router solicitation, length 16
 00:00:16.938459 IP 10.0.0.8.45174 > 10.0.0.6.1883: Flags [P.], seq 2446307470:2446307865, ack 3711507157, win 83, options [nop,nop,TS val 1098068463 ecr 3793361985], length 395
 00:00:16.939112 IP 10.0.0.6.1883 > 10.0.0.8.45174: Flags [P.], seq 3711507157:3711507161, ack 2446307865, win 85, options [nop,nop,TS val 3793362983 ecr 1098068463], length 4
 00:00:16.940462 IP 10.0.0.8.45174 > 10.0.0.6.1883: Flags [.], ack 3711507161, win 83, options [nop,nop,TS val 1098068466 ecr 3793362983], length 0
 00:00:16.940589 IP 10.0.0.8.45174 > 10.0.0.6.1883: Flags [P.], seq 2446307865:2446307869, ack 3711507161, win 83, options [nop,nop,TS val 1098068466 ecr 3793362983], length 4
 00:00:16.941577 IP 10.0.0.6.1883 > 10.0.0.8.45174: Flags [P.], seq 3711507161:3711507165, ack 2446307869, win 85, options [nop,nop,TS val 3793362985 ecr 1098068466], length 4
 00:00:17.136850 IP 10.0.0.8.45174 > 10.0.0.6.1883: Flags [.], ack 3711507165, win 83, options [nop,nop,TS val 1098068514 ecr 3793362985], length 0
 00:00:17.173044 IP6 fe80::3c01:c4ff:fee6:273 > ff02::2: ICMP6, router solicitation, length 16
 00:00:17.874562 IP 10.0.0.8.45174 > 10.0.0.6.1883: Flags [P.], seq 2446307869:2446307871, ack 3711507165, win 83, options [nop,nop,TS val 1098069400 ecr 3793362985], length 2
 00:00:17.875805 IP 10.0.0.6.1883 > 10.0.0.8.45174: Flags [P.], seq 3711507165:3711507167, ack 2446307871, win 85, options [nop,nop,TS val 3793363920 ecr 1098069400], length 2
 00:00:17.878421 IP 10.0.0.8.45174 > 10.0.0.6.1883: Flags [.], ack 3711507167, win 83, options [nop,nop,TS val 1098069402 ecr 3793363920], length 0
 00:00:17.935638 IP6 fe80::84c1:2bff:fe96:b31e > ff02::2: ICMP6, router solicitation, length 16
 00:00:17.940549 IP 10.0.0.8.45174 > 10.0.0.6.1883: Flags [P.], seq 2446307871:2446308266, ack 3711507167, win 83, options [nop,nop,TS val 1098069464 ecr 3793363920], length 395
 00:00:17.941688 IP 10.0.0.6.1883 > 10.0.0.8.45174: Flags [P.], seq 3711507167:3711507171, ack 2446308266, win 85, options [nop,nop,TS val 3793363986 ecr 1098069464], length 4
 00:00:17.942980 IP 10.0.0.8.45174 > 10.0.0.6.1883: Flags [.], ack 3711507171, win 83, options [nop,nop,TS val 1098069468 ecr 3793363986], length 0
 00:00:17.943062 IP 10.0.0.8.45174 > 10.0.0.6.1883: Flags [P.], seq 2446308266:2446308270, ack 3711507171, win 83, options [nop,nop,TS val 1098069468 ecr 3793363986], length 4
 00:00:17.943519 IP 10.0.0.6.1883 > 10.0.0.8.45174: Flags [P.], seq 3711507171:3711507175, ack 2446308270, win 85, options [nop,nop,TS val 3793363987 ecr 1098069468], length 4
 00:00:17.984722 IP 10.0.0.8.45174 > 10.0.0.6.1883: Flags [.], ack 3711507175, win 83, options [nop,nop,TS val 1098069511 ecr 3793363987], length 0
 00:00:18.940019 IP 10.0.0.8.45174 > 10.0.0.6.1883: Flags [P.], seq 2446308270:2446308665, ack 3711507175, win 83, options [nop,nop,TS val 1098070465 ecr 3793363987], length 395
 00:00:18.941359 IP 10.0.0.6.1883 > 10.0.0.8.45174: Flags [P.], seq 3711507175:3711507179, ack 2446308665, win 85, options [nop,nop,TS val 3793364985 ecr 1098070465], length 4
 00:00:18.942677 IP 10.0.0.8.45174 > 10.0.0.6.1883: Flags [.], ack 3711507179, win 83, options [nop,nop,TS val 1098070468 ecr 3793364985], length 0
 00:00:18.942678 IP 10.0.0.8.45174 > 10.0.0.6.1883: Flags [P.], seq 2446308665:2446308669, ack 3711507179, win 83, options [nop,nop,TS val 1098070468 ecr 3793364985], length 4
 00:00:18.942947 IP 10.0.0.6.1883 > 10.0.0.8.45174: Flags [P.], seq 3711507179:3711507183, ack 2446308669, win 85, options [nop,nop,TS val 3793364987 ecr 1098070468], length 4
 00:00:18.984954 IP 10.0.0.8.45174 > 10.0.0.6.1883: Flags [.], ack 3711507183, win 83, options [nop,nop,TS val 1098070511 ecr 3793364987], length 0
 00:00:19.947726 IP 10.0.0.8.45174 > 10.0.0.6.1883: Flags [P.], seq 2446308669:2446309064, ack 3711507183, win 83, options [nop,nop,TS val 1098071473 ecr 3793364987], length 395
 00:00:19.948433 IP 10.0.0.6.1883 > 10.0.0.8.45174: Flags [P.], seq 3711507183:3711507187, ack 2446309064, win 85, options [nop,nop,TS val 3793365992 ecr 1098071473], length 4
 00:00:19.958713 IP 10.0.0.8.45174 > 10.0.0.6.1883: Flags [.], ack 3711507187, win 83, options [nop,nop,TS val 1098071483 ecr 3793365992], length 0
 00:00:19.960998 IP 10.0.0.8.45174 > 10.0.0.6.1883: Flags [P.], seq 2446309064:2446309068, ack 3711507187, win 83, options [nop,nop,TS val 1098071485 ecr 3793365992], length 4
 00:00:19.963397 IP 10.0.0.6.1883 > 10.0.0.8.45174: Flags [P.], seq 3711507187:3711507191, ack 2446309068, win 85, options [nop,nop,TS val 3793366007 ecr 1098071485], length 4
 00:00:19.985658 IP6 fe80::24fc:eeff:feab:a4ab > ff02::2: ICMP6, router solicitation, length 16
 00:00:20.000349 IP6 fe80::ac92:cbff:fef0:2fca > ff02::2: ICMP6, router solicitation, length 16
 00:00:20.008845 IP 10.0.0.8.45174 > 10.0.0.6.1883: Flags [.], ack 3711507191, win 83, options [nop,nop,TS val 1098071535 ecr 3793366007], length 0
 00:00:20.016902 IP6 fe80::24f2:47ff:fe7f:bc20 > ff02::2: ICMP6, router solicitation, length 16
 00:00:20.949703 IP 10.0.0.8.45174 > 10.0.0.6.1883: Flags [P.], seq 2446309068:2446309463, ack 3711507191, win 83, options [nop,nop,TS val 1098072474 ecr 3793366007], length 395
 00:00:20.951038 IP 10.0.0.6.1883 > 10.0.0.8.45174: Flags [P.], seq 3711507191:3711507195, ack 2446309463, win 85, options [nop,nop,TS val 3793366995 ecr 1098072474], length 4
 00:00:20.952315 IP 10.0.0.8.45174 > 10.0.0.6.1883: Flags [.], ack 3711507195, win 83, options [nop,nop,TS val 1098072478 ecr 3793366995], length 0
 00:00:20.953315 IP 10.0.0.8.45174 > 10.0.0.6.1883: Flags [P.], seq 2446309463:2446309467, ack 3711507195, win 83, options [nop,nop,TS val 1098072478 ecr 3793366995], length 4
 00:00:20.953808 IP 10.0.0.6.1883 > 10.0.0.8.45174: Flags [P.], seq 3711507195:3711507199, ack 2446309467, win 85, options [nop,nop,TS val 3793366998 ecr 1098072478], length 4
 00:00:21.004237 IP 10.0.0.8.45174 > 10.0.0.6.1883: Flags [.], ack 3711507199, win 83, options [nop,nop,TS val 1098072523 ecr 3793366998], length 0
 00:00:21.950988 IP 10.0.0.8.45174 > 10.0.0.6.1883: Flags [P.], seq 2446309467:2446309862, ack 3711507199, win 83, options [nop,nop,TS val 1098073476 ecr 3793366998], length 395
 00:00:21.951685 IP 10.0.0.6.1883 > 10.0.0.8.45174: Flags [P.], seq 3711507199:3711507203, ack 2446309862, win 85, options [nop,nop,TS val 3793367996 ecr 1098073476], length 4
 00:00:21.952877 IP 10.0.0.8.45174 > 10.0.0.6.1883: Flags [.], ack 3711507203, win 83, options [nop,nop,TS val 1098073478 ecr 3793367996], length 0
 00:00:21.953271 IP 10.0.0.8.45174 > 10.0.0.6.1883: Flags [P.], seq 2446309862:2446309866, ack 3711507203, win 83, options [nop,nop,TS val 1098073479 ecr 3793367996], length 4
 00:00:21.953891 IP 10.0.0.6.1883 > 10.0.0.8.45174: Flags [P.], seq 3711507203:3711507207, ack 2446309866, win 85, options [nop,nop,TS val 3793367998 ecr 1098073479], length 4
 00:00:22.004656 IP6 fe80::344e:63ff:fe68:f38 > ff02::2: ICMP6, router solicitation, length 16
 00:00:22.010619 IP 10.0.0.8.45174 > 10.0.0.6.1883: Flags [.], ack 3711507207, win 83, options [nop,nop,TS val 1098073523 ecr 3793367998], length 0
 00:00:22.875433 IP 10.0.0.8.45174 > 10.0.0.6.1883: Flags [P.], seq 2446309866:2446309868, ack 3711507207, win 83, options [nop,nop,TS val 1098074400 ecr 3793367998], length 2
 00:00:22.875941 IP 10.0.0.6.1883 > 10.0.0.8.45174: Flags [P.], seq 3711507207:3711507209, ack 2446309868, win 85, options [nop,nop,TS val 3793368920 ecr 1098074400], length 2
 00:00:22.876681 IP 10.0.0.8.45174 > 10.0.0.6.1883: Flags [.], ack 3711507209, win 83, options [nop,nop,TS val 1098074402 ecr 3793368920], length 0
 00:00:23.018227 IP 10.0.0.8.45174 > 10.0.0.6.1883: Flags [P.], seq 2446309868:2446310263, ack 3711507209, win 83, options [nop,nop,TS val 1098074542 ecr 3793368920], length 395
 00:00:23.019052 IP 10.0.0.6.1883 > 10.0.0.8.45174: Flags [P.], seq 3711507209:3711507213, ack 2446310263, win 85, options [nop,nop,TS val 3793369063 ecr 1098074542], length 4
 00:00:23.020361 IP 10.0.0.8.45174 > 10.0.0.6.1883: Flags [.], ack 3711507213, win 83, options [nop,nop,TS val 1098074546 ecr 3793369063], length 0
 00:00:23.022156 IP 10.0.0.8.45174 > 10.0.0.6.1883: Flags [P.], seq 2446310263:2446310267, ack 3711507213, win 83, options [nop,nop,TS val 1098074547 ecr 3793369063], length 4
 00:00:23.022393 IP 10.0.0.6.1883 > 10.0.0.8.45174: Flags [P.], seq 3711507213:3711507217, ack 2446310267, win 85, options [nop,nop,TS val 3793369067 ecr 1098074547], length 4
 00:00:23.293757 IP 10.0.0.8.45174 > 10.0.0.6.1883: Flags [.], ack 3711507217, win 83, options [nop,nop,TS val 1098074651 ecr 3793369067], length 0
 00:00:23.369754 IP 10.0.0.6.1883 > 10.0.0.8.45174: Flags [P.], seq 3711507213:3711507217, ack 2446310267, win 85, options [nop,nop,TS val 3793369338 ecr 1098074547], length 4
 00:00:23.521170 IP 10.0.0.8.45174 > 10.0.0.6.1883: Flags [.], ack 3711507217, win 83, options [nop,nop,TS val 1098075046 ecr 3793369338,nop,nop,sack 1 {3711507213:3711507217}], length 0
 00:00:24.023510 IP 10.0.0.8.45174 > 10.0.0.6.1883: Flags [P.], seq 2446310267:2446310662, ack 3711507217, win 83, options [nop,nop,TS val 1098075547 ecr 3793369338], length 395
 00:00:24.024562 IP 10.0.0.6.1883 > 10.0.0.8.45174: Flags [P.], seq 3711507217:3711507221, ack 2446310662, win 85, options [nop,nop,TS val 3793370068 ecr 1098075547], length 4
 00:00:24.032266 IP 10.0.0.8.45174 > 10.0.0.6.1883: Flags [.], ack 3711507221, win 83, options [nop,nop,TS val 1098075558 ecr 3793370068], length 0
 00:00:24.033547 IP 10.0.0.8.45174 > 10.0.0.6.1883: Flags [P.], seq 2446310662:2446310666, ack 3711507221, win 83, options [nop,nop,TS val 1098075559 ecr 3793370068], length 4
 00:00:24.034466 IP 10.0.0.6.1883 > 10.0.0.8.45174: Flags [P.], seq 3711507221:3711507225, ack 2446310666, win 85, options [nop,nop,TS val 3793370078 ecr 1098075559], length 4
 00:00:24.129312 IP 10.0.0.8.45174 > 10.0.0.6.1883: Flags [.], ack 3711507225, win 83, options [nop,nop,TS val 1098075603 ecr 3793370078], length 0
 00:00:25.025433 IP 10.0.0.8.45174 > 10.0.0.6.1883: Flags [P.], seq 2446310666:2446311061, ack 3711507225, win 83, options [nop,nop,TS val 1098076549 ecr 3793370078], length 395
 00:00:25.026035 IP 10.0.0.6.1883 > 10.0.0.8.45174: Flags [P.], seq 3711507225:3711507229, ack 2446311061, win 85, options [nop,nop,TS val 3793371070 ecr 1098076549], length 4
 00:00:25.030898 IP 10.0.0.8.45174 > 10.0.0.6.1883: Flags [.], ack 3711507229, win 83, options [nop,nop,TS val 1098076557 ecr 3793371070], length 0
 00:00:25.031734 IP 10.0.0.8.45174 > 10.0.0.6.1883: Flags [P.], seq 2446311061:2446311065, ack 3711507229, win 83, options [nop,nop,TS val 1098076557 ecr 3793371070], length 4
 00:00:25.032208 IP 10.0.0.6.1883 > 10.0.0.8.45174: Flags [P.], seq 3711507229:3711507233, ack 2446311065, win 85, options [nop,nop,TS val 3793371076 ecr 1098076557], length 4
 00:00:25.153847 IP 10.0.0.8.45174 > 10.0.0.6.1883: Flags [.], ack 3711507233, win 83, options [nop,nop,TS val 1098076665 ecr 3793371076], length 0
 00:00:26.027649 IP 10.0.0.8.45174 > 10.0.0.6.1883: Flags [P.], seq 2446311065:2446311460, ack 3711507233, win 83, options [nop,nop,TS val 1098077552 ecr 3793371076], length 395
 00:00:26.028242 IP 10.0.0.6.1883 > 10.0.0.8.45174: Flags [P.], seq 3711507233:3711507237, ack 2446311460, win 85, options [nop,nop,TS val 3793372072 ecr 1098077552], length 4
 00:00:26.029706 IP 10.0.0.8.45174 > 10.0.0.6.1883: Flags [.], ack 3711507237, win 83, options [nop,nop,TS val 1098077555 ecr 3793372072], length 0
 00:00:26.029739 IP 10.0.0.8.45174 > 10.0.0.6.1883: Flags [P.], seq 2446311460:2446311464, ack 3711507237, win 83, options [nop,nop,TS val 1098077555 ecr 3793372072], length 4
 00:00:26.030612 IP 10.0.0.6.1883 > 10.0.0.8.45174: Flags [P.], seq 3711507237:3711507241, ack 2446311464, win 85, options [nop,nop,TS val 3793372074 ecr 1098077555], length 4
 00:00:26.137249 IP 10.0.0.8.45174 > 10.0.0.6.1883: Flags [.], ack 3711507241, win 83, options [nop,nop,TS val 1098077659 ecr 3793372074], length 0
 00:00:27.034046 IP 10.0.0.8.45174 > 10.0.0.6.1883: Flags [P.], seq 2446311464:2446311859, ack 3711507241, win 83, options [nop,nop,TS val 1098078556 ecr 3793372074], length 395
 00:00:27.035955 IP 10.0.0.6.1883 > 10.0.0.8.45174: Flags [P.], seq 3711507241:3711507245, ack 2446311859, win 85, options [nop,nop,TS val 3793373079 ecr 1098078556], length 4
 00:00:27.038387 IP 10.0.0.8.45174 > 10.0.0.6.1883: Flags [.], ack 3711507245, win 83, options [nop,nop,TS val 1098078563 ecr 3793373079], length 0
 00:00:27.038621 IP 10.0.0.8.45174 > 10.0.0.6.1883: Flags [P.], seq 2446311859:2446311863, ack 3711507245, win 83, options [nop,nop,TS val 1098078564 ecr 3793373079], length 4
 00:00:27.039088 IP 10.0.0.6.1883 > 10.0.0.8.45174: Flags [P.], seq 3711507245:3711507249, ack 2446311863, win 85, options [nop,nop,TS val 3793373083 ecr 1098078564], length 4
 00:00:27.128554 IP 10.0.0.8.45174 > 10.0.0.6.1883: Flags [.], ack 3711507249, win 83, options [nop,nop,TS val 1098078607 ecr 3793373083], length 0
 00:00:27.877681 IP 10.0.0.8.45174 > 10.0.0.6.1883: Flags [P.], seq 2446311863:2446311865, ack 3711507249, win 83, options [nop,nop,TS val 1098079403 ecr 3793373083], length 2
 00:00:27.878153 IP 10.0.0.6.1883 > 10.0.0.8.45174: Flags [P.], seq 3711507249:3711507251, ack 2446311865, win 85, options [nop,nop,TS val 3793373922 ecr 1098079403], length 2
 00:00:27.879425 IP 10.0.0.8.45174 > 10.0.0.6.1883: Flags [.], ack 3711507251, win 83, options [nop,nop,TS val 1098079405 ecr 3793373922], length 0
 00:00:28.034557 IP 10.0.0.8.45174 > 10.0.0.6.1883: Flags [P.], seq 2446311865:2446312260, ack 3711507251, win 83, options [nop,nop,TS val 1098079559 ecr 3793373922], length 395
 00:00:28.035844 IP 10.0.0.6.1883 > 10.0.0.8.45174: Flags [P.], seq 3711507251:3711507255, ack 2446312260, win 85, options [nop,nop,TS val 3793374079 ecr 1098079559], length 4
 00:00:28.039702 IP 10.0.0.8.45174 > 10.0.0.6.1883: Flags [.], ack 3711507255, win 83, options [nop,nop,TS val 1098079565 ecr 3793374079], length 0
 00:00:28.041146 IP 10.0.0.8.45174 > 10.0.0.6.1883: Flags [P.], seq 2446312260:2446312264, ack 3711507255, win 83, options [nop,nop,TS val 1098079566 ecr 3793374079], length 4
 00:00:28.041789 IP 10.0.0.6.1883 > 10.0.0.8.45174: Flags [P.], seq 3711507255:3711507259, ack 2446312264, win 85, options [nop,nop,TS val 3793374086 ecr 1098079566], length 4
 00:00:28.085027 IP 10.0.0.8.45174 > 10.0.0.6.1883: Flags [.], ack 3711507259, win 83, options [nop,nop,TS val 1098079611 ecr 3793374086], length 0
 00:00:29.036071 IP 10.0.0.8.45174 > 10.0.0.6.1883: Flags [P.], seq 2446312264:2446312659, ack 3711507259, win 83, options [nop,nop,TS val 1098080561 ecr 3793374086], length 395
 00:00:29.037422 IP 10.0.0.6.1883 > 10.0.0.8.45174: Flags [P.], seq 3711507259:3711507263, ack 2446312659, win 85, options [nop,nop,TS val 3793375082 ecr 1098080561], length 4
 00:00:29.038900 IP 10.0.0.8.45174 > 10.0.0.6.1883: Flags [.], ack 3711507263, win 83, options [nop,nop,TS val 1098080564 ecr 3793375082], length 0
 00:00:29.039522 IP 10.0.0.8.45174 > 10.0.0.6.1883: Flags [P.], seq 2446312659:2446312663, ack 3711507263, win 83, options [nop,nop,TS val 1098080564 ecr 3793375082], length 4
 00:00:29.039953 IP 10.0.0.6.1883 > 10.0.0.8.45174: Flags [P.], seq 3711507263:3711507267, ack 2446312663, win 85, options [nop,nop,TS val 3793375084 ecr 1098080564], length 4
 00:00:29.081160 IP 10.0.0.8.45174 > 10.0.0.6.1883: Flags [.], ack 3711507267, win 83, options [nop,nop,TS val 1098080607 ecr 3793375084], length 0
 00:00:30.036878 IP 10.0.0.8.45174 > 10.0.0.6.1883: Flags [P.], seq 2446312663:2446313058, ack 3711507267, win 83, options [nop,nop,TS val 1098081562 ecr 3793375084], length 395
 00:00:30.038241 IP 10.0.0.6.1883 > 10.0.0.8.45174: Flags [P.], seq 3711507267:3711507271, ack 2446313058, win 85, options [nop,nop,TS val 3793376082 ecr 1098081562], length 4
 00:00:30.039283 IP 10.0.0.8.45174 > 10.0.0.6.1883: Flags [.], ack 3711507271, win 83, options [nop,nop,TS val 1098081565 ecr 3793376082], length 0
 00:00:30.039717 IP 10.0.0.8.45174 > 10.0.0.6.1883: Flags [P.], seq 2446313058:2446313062, ack 3711507271, win 83, options [nop,nop,TS val 1098081565 ecr 3793376082], length 4
 00:00:30.040712 IP 10.0.0.6.1883 > 10.0.0.8.45174: Flags [P.], seq 3711507271:3711507275, ack 2446313062, win 85, options [nop,nop,TS val 3793376084 ecr 1098081565], length 4
 00:00:30.085390 IP 10.0.0.8.45174 > 10.0.0.6.1883: Flags [.], ack 3711507275, win 83, options [nop,nop,TS val 1098081611 ecr 3793376084], length 0
 00:00:31.038072 IP 10.0.0.8.45174 > 10.0.0.6.1883: Flags [P.], seq 2446313062:2446313457, ack 3711507275, win 83, options [nop,nop,TS val 1098082564 ecr 3793376084], length 395
 00:00:31.039290 IP 10.0.0.6.1883 > 10.0.0.8.45174: Flags [P.], seq 3711507275:3711507279, ack 2446313457, win 85, options [nop,nop,TS val 3793377083 ecr 1098082564], length 4
 00:00:31.042089 IP 10.0.0.8.45174 > 10.0.0.6.1883: Flags [.], ack 3711507279, win 83, options [nop,nop,TS val 1098082566 ecr 3793377083], length 0
 00:00:31.042368 IP 10.0.0.8.45174 > 10.0.0.6.1883: Flags [P.], seq 2446313457:2446313461, ack 3711507279, win 83, options [nop,nop,TS val 1098082567 ecr 3793377083], length 4
 00:00:31.043052 IP 10.0.0.6.1883 > 10.0.0.8.45174: Flags [P.], seq 3711507279:3711507283, ack 2446313461, win 85, options [nop,nop,TS val 3793377087 ecr 1098082567], length 4
 00:00:31.085003 IP 10.0.0.8.45174 > 10.0.0.6.1883: Flags [.], ack 3711507283, win 83, options [nop,nop,TS val 1098082611 ecr 3793377087], length 0
 00:00:32.039679 IP 10.0.0.8.45174 > 10.0.0.6.1883: Flags [P.], seq 2446313461:2446313856, ack 3711507283, win 83, options [nop,nop,TS val 1098083565 ecr 3793377087], length 395
 00:00:32.040513 IP 10.0.0.6.1883 > 10.0.0.8.45174: Flags [P.], seq 3711507283:3711507287, ack 2446313856, win 85, options [nop,nop,TS val 3793378085 ecr 1098083565], length 4
 00:00:32.041662 IP 10.0.0.8.45174 > 10.0.0.6.1883: Flags [.], ack 3711507287, win 83, options [nop,nop,TS val 1098083567 ecr 3793378085], length 0
 00:00:32.041935 IP 10.0.0.8.45174 > 10.0.0.6.1883: Flags [P.], seq 2446313856:2446313860, ack 3711507287, win 83, options [nop,nop,TS val 1098083567 ecr 3793378085], length 4
 00:00:32.042281 IP 10.0.0.6.1883 > 10.0.0.8.45174: Flags [P.], seq 3711507287:3711507291, ack 2446313860, win 85, options [nop,nop,TS val 3793378086 ecr 1098083567], length 4
 00:00:32.084722 IP 10.0.0.8.45174 > 10.0.0.6.1883: Flags [.], ack 3711507291, win 83, options [nop,nop,TS val 1098083611 ecr 3793378086], length 0
 00:00:32.878820 IP 10.0.0.8.45174 > 10.0.0.6.1883: Flags [P.], seq 2446313860:2446313862, ack 3711507291, win 83, options [nop,nop,TS val 1098084404 ecr 3793378086], length 2
 00:00:32.879152 IP 10.0.0.6.1883 > 10.0.0.8.45174: Flags [P.], seq 3711507291:3711507293, ack 2446313862, win 85, options [nop,nop,TS val 3793378923 ecr 1098084404], length 2
 00:00:32.880072 IP 10.0.0.8.45174 > 10.0.0.6.1883: Flags [.], ack 3711507293, win 83, options [nop,nop,TS val 1098084406 ecr 3793378923], length 0
 00:00:33.041442 IP 10.0.0.8.45174 > 10.0.0.6.1883: Flags [P.], seq 2446313862:2446314257, ack 3711507293, win 83, options [nop,nop,TS val 1098084567 ecr 3793378923], length 395
 00:00:33.042174 IP 10.0.0.6.1883 > 10.0.0.8.45174: Flags [P.], seq 3711507293:3711507297, ack 2446314257, win 85, options [nop,nop,TS val 3793379086 ecr 1098084567], length 4
 00:00:33.043261 IP 10.0.0.8.45174 > 10.0.0.6.1883: Flags [.], ack 3711507297, win 83, options [nop,nop,TS val 1098084569 ecr 3793379086], length 0
 00:00:33.043445 IP 10.0.0.8.45174 > 10.0.0.6.1883: Flags [P.], seq 2446314257:2446314261, ack 3711507297, win 83, options [nop,nop,TS val 1098084569 ecr 3793379086], length 4
 00:00:33.043685 IP 10.0.0.6.1883 > 10.0.0.8.45174: Flags [P.], seq 3711507297:3711507301, ack 2446314261, win 85, options [nop,nop,TS val 3793379088 ecr 1098084569], length 4
 00:00:33.084784 IP 10.0.0.8.45174 > 10.0.0.6.1883: Flags [.], ack 3711507301, win 83, options [nop,nop,TS val 1098084611 ecr 3793379088], length 0
 00:00:34.043183 IP 10.0.0.8.45174 > 10.0.0.6.1883: Flags [P.], seq 2446314261:2446314656, ack 3711507301, win 83, options [nop,nop,TS val 1098085569 ecr 3793379088], length 395
 00:00:34.043834 IP 10.0.0.6.1883 > 10.0.0.8.45174: Flags [P.], seq 3711507301:3711507305, ack 2446314656, win 85, options [nop,nop,TS val 3793380088 ecr 1098085569], length 4
 00:00:34.044983 IP 10.0.0.8.45174 > 10.0.0.6.1883: Flags [.], ack 3711507305, win 83, options [nop,nop,TS val 1098085570 ecr 3793380088], length 0
 00:00:34.045114 IP 10.0.0.8.45174 > 10.0.0.6.1883: Flags [P.], seq 2446314656:2446314660, ack 3711507305, win 83, options [nop,nop,TS val 1098085571 ecr 3793380088], length 4
 00:00:34.045369 IP 10.0.0.6.1883 > 10.0.0.8.45174: Flags [P.], seq 3711507305:3711507309, ack 2446314660, win 85, options [nop,nop,TS val 3793380089 ecr 1098085571], length 4
 00:00:34.089051 IP 10.0.0.8.45174 > 10.0.0.6.1883: Flags [.], ack 3711507309, win 83, options [nop,nop,TS val 1098085615 ecr 3793380089], length 0
 00:00:35.047184 IP 10.0.0.8.45174 > 10.0.0.6.1883: Flags [P.], seq 2446314660:2446315055, ack 3711507309, win 83, options [nop,nop,TS val 1098086573 ecr 3793380089], length 395
 00:00:35.048153 IP 10.0.0.6.1883 > 10.0.0.8.45174: Flags [P.], seq 3711507309:3711507313, ack 2446315055, win 85, options [nop,nop,TS val 3793381092 ecr 1098086573], length 4
 00:00:35.049149 IP 10.0.0.8.45174 > 10.0.0.6.1883: Flags [.], ack 3711507313, win 83, options [nop,nop,TS val 1098086575 ecr 3793381092], length 0
 00:00:35.049370 IP 10.0.0.8.45174 > 10.0.0.6.1883: Flags [P.], seq 2446315055:2446315059, ack 3711507313, win 83, options [nop,nop,TS val 1098086575 ecr 3793381092], length 4
 00:00:35.049791 IP 10.0.0.6.1883 > 10.0.0.8.45174: Flags [P.], seq 3711507313:3711507317, ack 2446315059, win 85, options [nop,nop,TS val 3793381094 ecr 1098086575], length 4
 00:00:35.092664 IP 10.0.0.8.45174 > 10.0.0.6.1883: Flags [.], ack 3711507317, win 83, options [nop,nop,TS val 1098086618 ecr 3793381094], length 0
 00:00:36.048129 IP 10.0.0.8.45174 > 10.0.0.6.1883: Flags [P.], seq 2446315059:2446315454, ack 3711507317, win 83, options [nop,nop,TS val 1098087574 ecr 3793381094], length 395
 00:00:36.048852 IP 10.0.0.6.1883 > 10.0.0.8.45174: Flags [P.], seq 3711507317:3711507321, ack 2446315454, win 85, options [nop,nop,TS val 3793382093 ecr 1098087574], length 4
 00:00:36.049803 IP 10.0.0.8.45174 > 10.0.0.6.1883: Flags [.], ack 3711507321, win 83, options [nop,nop,TS val 1098087575 ecr 3793382093], length 0
 00:00:36.050009 IP 10.0.0.8.45174 > 10.0.0.6.1883: Flags [P.], seq 2446315454:2446315458, ack 3711507321, win 83, options [nop,nop,TS val 1098087576 ecr 3793382093], length 4
 00:00:36.050790 IP 10.0.0.6.1883 > 10.0.0.8.45174: Flags [P.], seq 3711507321:3711507325, ack 2446315458, win 85, options [nop,nop,TS val 3793382095 ecr 1098087576], length 4
 00:00:36.092850 IP 10.0.0.8.45174 > 10.0.0.6.1883: Flags [.], ack 3711507325, win 83, options [nop,nop,TS val 1098087619 ecr 3793382095], length 0
 00:00:37.049069 IP 10.0.0.8.45174 > 10.0.0.6.1883: Flags [P.], seq 2446315458:2446315853, ack 3711507325, win 83, options [nop,nop,TS val 1098088575 ecr 3793382095], length 395
 00:00:37.049654 IP 10.0.0.6.1883 > 10.0.0.8.45174: Flags [P.], seq 3711507325:3711507329, ack 2446315853, win 85, options [nop,nop,TS val 3793383094 ecr 1098088575], length 4
 00:00:37.051205 IP 10.0.0.8.45174 > 10.0.0.6.1883: Flags [.], ack 3711507329, win 83, options [nop,nop,TS val 1098088576 ecr 3793383094], length 0
 00:00:37.051434 IP 10.0.0.8.45174 > 10.0.0.6.1883: Flags [P.], seq 2446315853:2446315857, ack 3711507329, win 83, options [nop,nop,TS val 1098088577 ecr 3793383094], length 4
 00:00:37.051714 IP 10.0.0.6.1883 > 10.0.0.8.45174: Flags [P.], seq 3711507329:3711507333, ack 2446315857, win 85, options [nop,nop,TS val 3793383096 ecr 1098088577], length 4
 00:00:37.092907 IP 10.0.0.8.45174 > 10.0.0.6.1883: Flags [.], ack 3711507333, win 83, options [nop,nop,TS val 1098088619 ecr 3793383096], length 0
 00:00:37.880442 IP 10.0.0.8.45174 > 10.0.0.6.1883: Flags [P.], seq 2446315857:2446315859, ack 3711507333, win 83, options [nop,nop,TS val 1098089406 ecr 3793383096], length 2
 00:00:37.880906 IP 10.0.0.6.1883 > 10.0.0.8.45174: Flags [P.], seq 3711507333:3711507335, ack 2446315859, win 85, options [nop,nop,TS val 3793383925 ecr 1098089406], length 2
 00:00:37.882410 IP 10.0.0.8.45174 > 10.0.0.6.1883: Flags [.], ack 3711507335, win 83, options [nop,nop,TS val 1098089408 ecr 3793383925], length 0
 00:00:38.050371 IP 10.0.0.8.45174 > 10.0.0.6.1883: Flags [P.], seq 2446315859:2446316254, ack 3711507335, win 83, options [nop,nop,TS val 1098089576 ecr 3793383925], length 395
 00:00:38.050950 IP 10.0.0.6.1883 > 10.0.0.8.45174: Flags [P.], seq 3711507335:3711507339, ack 2446316254, win 85, options [nop,nop,TS val 3793384095 ecr 1098089576], length 4
 00:00:38.052405 IP 10.0.0.8.45174 > 10.0.0.6.1883: Flags [.], ack 3711507339, win 83, options [nop,nop,TS val 1098089578 ecr 3793384095], length 0
 00:00:38.052520 IP 10.0.0.8.45174 > 10.0.0.6.1883: Flags [P.], seq 2446316254:2446316258, ack 3711507339, win 83, options [nop,nop,TS val 1098089578 ecr 3793384095], length 4
 00:00:38.052899 IP 10.0.0.6.1883 > 10.0.0.8.45174: Flags [P.], seq 3711507339:3711507343, ack 2446316258, win 85, options [nop,nop,TS val 3793384097 ecr 1098089578], length 4
 00:00:38.096760 IP 10.0.0.8.45174 > 10.0.0.6.1883: Flags [.], ack 3711507343, win 83, options [nop,nop,TS val 1098089623 ecr 3793384097], length 0
 00:00:39.051147 IP 10.0.0.8.45174 > 10.0.0.6.1883: Flags [P.], seq 2446316258:2446316653, ack 3711507343, win 83, options [nop,nop,TS val 1098090577 ecr 3793384097], length 395
 00:00:39.051822 IP 10.0.0.6.1883 > 10.0.0.8.45174: Flags [P.], seq 3711507343:3711507347, ack 2446316653, win 85, options [nop,nop,TS val 3793385096 ecr 1098090577], length 4
 00:00:39.053264 IP 10.0.0.8.45174 > 10.0.0.6.1883: Flags [.], ack 3711507347, win 83, options [nop,nop,TS val 1098090578 ecr 3793385096], length 0
 00:00:39.053535 IP 10.0.0.8.45174 > 10.0.0.6.1883: Flags [P.], seq 2446316653:2446316657, ack 3711507347, win 83, options [nop,nop,TS val 1098090579 ecr 3793385096], length 4
 00:00:39.053831 IP 10.0.0.6.1883 > 10.0.0.8.45174: Flags [P.], seq 3711507347:3711507351, ack 2446316657, win 85, options [nop,nop,TS val 3793385098 ecr 1098090579], length 4
