 00:00:00.000000 IP6 fe80::3c64:cff:fedb:71e9 > ff02::2: ICMP6, router solicitation, length 16
 00:00:00.012510 IP6 fe80::d4b5:52ff:feae:9ee7 > ff02::2: ICMP6, router solicitation, length 16
 00:00:00.019998 IP6 fe80::9026:f2ff:fe25:9d6d > ff02::2: ICMP6, router solicitation, length 16
 00:00:00.227052 IP6 fe80::504d:64ff:febc:3dfa > ff02::2: ICMP6, router solicitation, length 16
 00:00:00.523129 IP6 fe80::1c06:8dff:fe28:7ff8 > ff02::2: ICMP6, router solicitation, length 16
 00:00:00.550651 IP6 fe80::a8e7:3eff:fed5:a090 > ff02::2: ICMP6, router solicitation, length 16
 00:00:00.562350 IP6 fe80::cc72:84ff:fea1:1f02 > ff02::2: ICMP6, router solicitation, length 16
 00:00:00.764530 IP6 fe80::9422:32ff:fe9e:9864 > ff02::2: ICMP6, router solicitation, length 16
 00:00:01.013376 IP6 fe80::14f7:e5ff:fec3:16ee > ff02::2: ICMP6, router solicitation, length 16
 00:00:01.273914 IP6 fe80::70fc:2bff:fe24:fce6 > ff02::2: ICMP6, router solicitation, length 16
 00:00:01.523532 IP6 fe80::8ad:8dff:febc:47c1 > ff02::2: ICMP6, router solicitation, length 16
 00:00:01.552474 IP6 fe80::e4d3:a1ff:fe0b:ebcb > ff02::2: ICMP6, router solicitation, length 16
 00:00:01.760213 IP6 fe80::a810:1ff:fe5a:bd4b > ff02::2: ICMP6, router solicitation, length 16
 00:00:02.031301 IP6 fe80::1815:cbff:fefb:ea10 > ff02::2: ICMP6, router solicitation, length 16
 00:00:06.855059 ARP, Request who-has 10.0.0.6 tell 10.0.0.8, length 28
 00:00:06.855372 ARP, Reply 10.0.0.6 is-at 52:4d:64:bc:3d:fa, length 28
 00:00:06.880615 IP 10.0.0.8.45134 > 10.0.0.6.1883: Flags [S], seq 462145291, win 42340, options [mss 1460,sackOK,TS val 1097914775 ecr 0,nop,wscale 9], length 0
 00:00:06.880682 IP 10.0.0.6.1883 > 10.0.0.8.45134: Flags [S.], seq 3161117289, ack 462145292, win 43440, options [mss 1460,sackOK,TS val 3793209330 ecr 1097914775,nop,wscale 9], length 0
 00:00:06.891587 IP 10.0.0.8.45134 > 10.0.0.6.1883: Flags [.], ack 3161117290, win 83, options [nop,nop,TS val 1097914822 ecr 3793209330], length 0
 00:00:06.891712 IP 10.0.0.8.45134 > 10.0.0.6.1883: Flags [P.], seq 462145292:462145312, ack 3161117290, win 83, options [nop,nop,TS val 1097914822 ecr 3793209330], length 20
 00:00:06.891960 IP 10.0.0.6.1883 > 10.0.0.8.45134: Flags [.], ack 462145312, win 85, options [nop,nop,TS val 3793209341 ecr 1097914822], length 0
 00:00:06.892247 IP 10.0.0.6.1883 > 10.0.0.8.45134: Flags [P.], seq 3161117290:3161117294, ack 462145312, win 85, options [nop,nop,TS val 3793209341 ecr 1097914822], length 4
 00:00:06.892669 IP 10.0.0.8.45134 > 10.0.0.6.1883: Flags [.], ack 3161117294, win 83, options [nop,nop,TS val 1097914824 ecr 3793209341], length 0
 00:00:06.893563 IP 10.0.0.8.45134 > 10.0.0.6.1883: Flags [P.], seq 462145312:462145376, ack 3161117294, win 83, options [nop,nop,TS val 1097914824 ecr 3793209341], length 64
 00:00:06.894154 IP 10.0.0.6.1883 > 10.0.0.8.45134: Flags [P.], seq 3161117294:3161117359, ack 462145376, win 85, options [nop,nop,TS val 3793209343 ecr 1097914824], length 65
 00:00:06.894440 IP 10.0.0.8.45134 > 10.0.0.6.1883: Flags [P.], seq 462145376:462145771, ack 3161117359, win 83, options [nop,nop,TS val 1097914825 ecr 3793209343], length 395
 00:00:06.894718 IP 10.0.0.6.1883 > 10.0.0.8.45134: Flags [P.], seq 3161117359:3161117364, ack 462145771, win 85, options [nop,nop,TS val 3793209344 ecr 1097914825], length 5
 00:00:06.947213 IP 10.0.0.8.45134 > 10.0.0.6.1883: Flags [.], ack 3161117364, win 83, options [nop,nop,TS val 1097914867 ecr 3793209344], length 0
 00:00:06.947622 IP 10.0.0.6.1883 > 10.0.0.8.45134: Flags [P.], seq 3161117364:3161117368, ack 462145771, win 85, options [nop,nop,TS val 3793209396 ecr 1097914867], length 4
 00:00:06.978546 IP 10.0.0.8.45134 > 10.0.0.6.1883: Flags [.], ack 3161117368, win 83, options [nop,nop,TS val 1097914909 ecr 3793209396], length 0
 00:00:06.978767 IP 10.0.0.8.45134 > 10.0.0.6.1883: Flags [P.], seq 462145771:462145775, ack 3161117368, win 83, options [nop,nop,TS val 1097914909 ecr 3793209396], length 4
 00:00:06.979059 IP 10.0.0.6.1883 > 10.0.0.8.45134: Flags [P.], seq 3161117368:3161117372, ack 462145775, win 85, options [nop,nop,TS val 3793209428 ecr 1097914909], length 4
 00:00:07.050286 IP 10.0.0.8.45134 > 10.0.0.6.1883: Flags [.], ack 3161117372, win 83, options [nop,nop,TS val 1097914979 ecr 3793209428], length 0
 00:00:07.847605 IP 10.0.0.8.45134 > 10.0.0.6.1883: Flags [P.], seq 462145775:462146170, ack 3161117372, win 83, options [nop,nop,TS val 1097915777 ecr 3793209428], length 395
 00:00:07.848699 IP 10.0.0.6.1883 > 10.0.0.8.45134: Flags [P.], seq 3161117372:3161117376, ack 462146170, win 85, options [nop,nop,TS val 3793210298 ecr 1097915777], length 4
 00:00:07.849158 IP 10.0.0.8.45134 > 10.0.0.6.1883: Flags [.], ack 3161117376, win 83, options [nop,nop,TS val 1097915780 ecr 3793210298], length 0
 00:00:07.850647 IP 10.0.0.8.45134 > 10.0.0.6.1883: Flags [P.], seq 462146170:462146174, ack 3161117376, win 83, options [nop,nop,TS val 1097915780 ecr 3793210298], length 4
 00:00:07.851158 IP 10.0.0.6.1883 > 10.0.0.8.45134: Flags [P.], seq 3161117376:3161117380, ack 462146174, win 85, options [nop,nop,TS val 3793210300 ecr 1097915780], length 4
 00:00:07.899489 IP 10.0.0.8.45134 > 10.0.0.6.1883: Flags [.], ack 3161117380, win 83, options [nop,nop,TS val 1097915826 ecr 3793210300], length 0
 00:00:08.849166 IP 10.0.0.8.45134 > 10.0.0.6.1883: Flags [P.], seq 462146174:462146569, ack 3161117380, win 83, options [nop,nop,TS val 1097916780 ecr 3793210300], length 395
 00:00:08.850790 IP 10.0.0.6.1883 > 10.0.0.8.45134: Flags [P.], seq 3161117380:3161117384, ack 462146569, win 85, options [nop,nop,TS val 3793211300 ecr 1097916780], length 4
 00:00:08.851664 IP 10.0.0.8.45134 > 10.0.0.6.1883: Flags [.], ack 3161117384, win 83, options [nop,nop,TS val 1097916782 ecr 3793211300], length 0
 00:00:08.851666 IP 10.0.0.8.45134 > 10.0.0.6.1883: Flags [P.], seq 462146569:462146573, ack 3161117384, win 83, options [nop,nop,TS val 1097916782 ecr 3793211300], length 4
 00:00:08.852158 IP 10.0.0.6.1883 > 10.0.0.8.45134: Flags [P.], seq 3161117384:3161117388, ack 462146573, win 85, options [nop,nop,TS val 3793211301 ecr 1097916782], length 4
 00:00:08.903487 IP 10.0.0.8.45134 > 10.0.0.6.1883: Flags [.], ack 3161117388, win 83, options [nop,nop,TS val 1097916827 ecr 3793211301], length 0
 00:00:09.896391 IP 10.0.0.8.45134 > 10.0.0.6.1883: Flags [P.], seq 462146573:462146968, ack 3161117388, win 83, options [nop,nop,TS val 1097917826 ecr 3793211301], length 395
 00:00:09.897329 IP 10.0.0.6.1883 > 10.0.0.8.45134: Flags [P.], seq 3161117388:3161117392, ack 462146968, win 85, options [nop,nop,TS val 3793212346 ecr 1097917826], length 4
 00:00:09.898601 IP 10.0.0.8.45134 > 10.0.0.6.1883: Flags [.], ack 3161117392, win 83, options [nop,nop,TS val 1097917829 ecr 3793212346], length 0
 00:00:09.899311 IP 10.0.0.8.45134 > 10.0.0.6.1883: Flags [P.], seq 462146968:462146972, ack 3161117392, win 83, options [nop,nop,TS val 1097917829 ecr 3793212346], length 4
 00:00:09.899583 IP 10.0.0.6.1883 > 10.0.0.8.45134: Flags [P.], seq 3161117392:3161117396, ack 462146972, win 85, options [nop,nop,TS val 3793212349 ecr 1097917829], length 4
 00:00:10.136765 IP 10.0.0.6.1883 > 10.0.0.8.45134: Flags [P.], seq 3161117392:3161117396, ack 462146972, win 85, options [nop,nop,TS val 3793212586 ecr 1097917829], length 4
 00:00:10.175871 IP 10.0.0.8.45134 > 10.0.0.6.1883: Flags [.], ack 3161117396, win 83, options [nop,nop,TS val 1097918068 ecr 3793212349], length 0
 00:00:10.188982 IP 10.0.0.8.45134 > 10.0.0.6.1883: Flags [.], ack 3161117396, win 83, options [nop,nop,TS val 1097918107 ecr 3793212586,nop,nop,sack 1 {3161117392:3161117396}], length 0
 00:00:10.906271 IP 10.0.0.8.45134 > 10.0.0.6.1883: Flags [P.], seq 462146972:462147367, ack 3161117396, win 83, options [nop,nop,TS val 1097918835 ecr 3793212586], length 395
 00:00:10.907715 IP 10.0.0.6.1883 > 10.0.0.8.45134: Flags [P.], seq 3161117396:3161117400, ack 462147367, win 85, options [nop,nop,TS val 3793213357 ecr 1097918835], length 4
 00:00:10.913125 IP 10.0.0.8.45134 > 10.0.0.6.1883: Flags [.], ack 3161117400, win 83, options [nop,nop,TS val 1097918843 ecr 3793213357], length 0
 00:00:10.913290 IP 10.0.0.8.45134 > 10.0.0.6.1883: Flags [P.], seq 462147367:462147371, ack 3161117400, win 83, options [nop,nop,TS val 1097918843 ecr 3793213357], length 4
 00:00:10.913733 IP 10.0.0.6.1883 > 10.0.0.8.45134: Flags [P.], seq 3161117400:3161117404, ack 462147371, win 85, options [nop,nop,TS val 3793213363 ecr 1097918843], length 4
 00:00:11.124887 IP 10.0.0.8.45134 > 10.0.0.6.1883: Flags [.], ack 3161117404, win 83, options [nop,nop,TS val 1097919056 ecr 3793213363], length 0
 00:00:11.909688 IP 10.0.0.8.45134 > 10.0.0.6.1883: Flags [P.], seq 462147371:462147373, ack 3161117404, win 83, options [nop,nop,TS val 1097919839 ecr 3793213363], length 2
 00:00:11.910385 IP 10.0.0.6.1883 > 10.0.0.8.45134: Flags [P.], seq 3161117404:3161117406, ack 462147373, win 85, options [nop,nop,TS val 3793214359 ecr 1097919839], length 2
 00:00:11.912111 IP 10.0.0.8.45134 > 10.0.0.6.1883: Flags [P.], seq 462147373:462147768, ack 3161117406, win 83, options [nop,nop,TS val 1097919843 ecr 3793214359], length 395
 00:00:11.912889 IP 10.0.0.6.1883 > 10.0.0.8.45134: Flags [P.], seq 3161117406:3161117410, ack 462147768, win 85, options [nop,nop,TS val 3793214362 ecr 1097919843], length 4
 00:00:11.915084 IP 10.0.0.8.45134 > 10.0.0.6.1883: Flags [P.], seq 462147768:462147772, ack 3161117410, win 83, options [nop,nop,TS val 1097919845 ecr 3793214362], length 4
 00:00:11.915460 IP 10.0.0.6.1883 > 10.0.0.8.45134: Flags [P.], seq 3161117410:3161117414, ack 462147772, win 85, options [nop,nop,TS val 3793214364 ecr 1097919845], length 4
 00:00:12.115512 IP 10.0.0.8.45134 > 10.0.0.6.1883: Flags [.], ack 3161117414, win 83, options [nop,nop,TS val 1097920046 ecr 3793214364], length 0
 00:00:12.919481 IP 10.0.0.8.45134 > 10.0.0.6.1883: Flags [P.], seq 462147772:462148167, ack 3161117414, win 83, options [nop,nop,TS val 1097920849 ecr 3793214364], length 395
 00:00:12.920635 IP 10.0.0.6.1883 > 10.0.0.8.45134: Flags [P.], seq 3161117414:3161117418, ack 462148167, win 85, options [nop,nop,TS val 3793215370 ecr 1097920849], length 4
 00:00:12.926471 IP 10.0.0.8.45134 > 10.0.0.6.1883: Flags [.], ack 3161117418, win 83, options [nop,nop,TS val 1097920857 ecr 3793215370], length 0
 00:00:12.926473 IP 10.0.0.8.45134 > 10.0.0.6.1883: Flags [P.], seq 462148167:462148171, ack 3161117418, win 83, options [nop,nop,TS val 1097920857 ecr 3793215370], length 4
 00:00:12.926813 IP 10.0.0.6.1883 > 10.0.0.8.45134: Flags [P.], seq 3161117418:3161117422, ack 462148171, win 85, options [nop,nop,TS val 3793215376 ecr 1097920857], length 4
 00:00:12.968353 IP 10.0.0.8.45134 > 10.0.0.6.1883: Flags [.], ack 3161117422, win 83, options [nop,nop,TS val 1097920899 ecr 3793215376], length 0
 00:00:13.921276 IP 10.0.0.8.45134 > 10.0.0.6.1883: Flags [P.], seq 462148171:462148566, ack 3161117422, win 83, options [nop,nop,TS val 1097921852 ecr 3793215376], length 395
 00:00:13.922190 IP 10.0.0.6.1883 > 10.0.0.8.45134: Flags [P.], seq 3161117422:3161117426, ack 462148566, win 85, options [nop,nop,TS val 3793216371 ecr 1097921852], length 4
 00:00:13.923470 IP 10.0.0.8.45134 > 10.0.0.6.1883: Flags [.], ack 3161117426, win 83, options [nop,nop,TS val 1097921854 ecr 3793216371], length 0
 00:00:13.923555 IP 10.0.0.8.45134 > 10.0.0.6.1883: Flags [P.], seq 462148566:462148570, ack 3161117426, win 83, options [nop,nop,TS val 1097921854 ecr 3793216371], length 4
 00:00:13.923814 IP 10.0.0.6.1883 > 10.0.0.8.45134: Flags [P.], seq 3161117426:3161117430, ack 462148570, win 85, options [nop,nop,TS val 3793216373 ecr 1097921854], length 4
 00:00:13.967920 IP 10.0.0.8.45134 > 10.0.0.6.1883: Flags [.], ack 3161117430, win 83, options [nop,nop,TS val 1097921899 ecr 3793216373], length 0
 00:00:14.584820 IP6 fe80::d4b5:52ff:feae:9ee7 > ff02::2: ICMP6, router solicitation, length 16
 00:00:14.923406 IP 10.0.0.8.45134 > 10.0.0.6.1883: Flags [P.], seq 462148570:462148965, ack 3161117430, win 83, options [nop,nop,TS val 1097922852 ecr 3793216373], length 395
 00:00:14.924188 IP 10.0.0.6.1883 > 10.0.0.8.45134: Flags [P.], seq 3161117430:3161117434, ack 462148965, win 85, options [nop,nop,TS val 3793217373 ecr 1097922852], length 4
 00:00:14.924934 IP 10.0.0.8.45134 > 10.0.0.6.1883: Flags [.], ack 3161117434, win 83, options [nop,nop,TS val 1097922856 ecr 3793217373], length 0
 00:00:14.925010 IP 10.0.0.8.45134 > 10.0.0.6.1883: Flags [P.], seq 462148965:462148969, ack 3161117434, win 83, options [nop,nop,TS val 1097922856 ecr 3793217373], length 4
 00:00:14.925229 IP 10.0.0.6.1883 > 10.0.0.8.45134: Flags [P.], seq 3161117434:3161117438, ack 462148969, win 85, options [nop,nop,TS val 3793217374 ecr 1097922856], length 4
 00:00:14.967645 IP 10.0.0.8.45134 > 10.0.0.6.1883: Flags [.], ack 3161117438, win 83, options [nop,nop,TS val 1097922898 ecr 3793217374], length 0
 00:00:15.091508 IP6 fe80::504d:64ff:febc:3dfa > ff02::2: ICMP6, router solicitation, length 16
 00:00:15.339113 IP6 fe80::3c64:cff:fedb:71e9 > ff02::2: ICMP6, router solicitation, length 16
 00:00:15.606706 IP6 fe80::9026:f2ff:fe25:9d6d > ff02::2: ICMP6, router solicitation, length 16
 00:00:15.863093 IP6 fe80::1c06:8dff:fe28:7ff8 > ff02::2: ICMP6, router solicitation, length 16
 00:00:15.922320 IP 10.0.0.8.45134 > 10.0.0.6.1883: Flags [P.], seq 462148969:462149364, ack 3161117438, win 83, options [nop,nop,TS val 1097923853 ecr 3793217374], length 395
 00:00:15.922675 IP 10.0.0.6.1883 > 10.0.0.8.45134: Flags [P.], seq 3161117438:3161117442, ack 462149364, win 85, options [nop,nop,TS val 3793218372 ecr 1097923853], length 4
 00:00:15.923535 IP 10.0.0.8.45134 > 10.0.0.6.1883: Flags [.], ack 3161117442, win 83, options [nop,nop,TS val 1097923854 ecr 3793218372], length 0
 00:00:15.923616 IP 10.0.0.8.45134 > 10.0.0.6.1883: Flags [P.], seq 462149364:462149368, ack 3161117442, win 83, options [nop,nop,TS val 1097923854 ecr 3793218372], length 4
 00:00:15.923745 IP 10.0.0.6.1883 > 10.0.0.8.45134: Flags [P.], seq 3161117442:3161117446, ack 462149368, win 85, options [nop,nop,TS val 3793218373 ecr 1097923854], length 4
 00:00:15.981704 IP 10.0.0.8.45134 > 10.0.0.6.1883: Flags [.], ack 3161117446, win 83, options [nop,nop,TS val 1097923912 ecr 3793218373], length 0
 00:00:16.127450 IP6 fe80::a8e7:3eff:fed5:a090 > ff02::2: ICMP6, router solicitation, length 16
 00:00:16.149470 IP6 fe80::9422:32ff:fe9e:9864 > ff02::2: ICMP6, router solicitation, length 16
 00:00:16.641966 IP6 fe80::cc72:84ff:fea1:1f02 > ff02::2: ICMP6, router solicitation, length 16
 00:00:16.908636 IP 10.0.0.8.45134 > 10.0.0.6.1883: Flags [P.], seq 462149368:462149370, ack 3161117446, win 83, options [nop,nop,TS val 1097924839 ecr 3793218373], length 2
 00:00:16.909002 IP 10.0.0.6.1883 > 10.0.0.8.45134: Flags [P.], seq 3161117446:3161117448, ack 462149370, win 85, options [nop,nop,TS val 3793219358 ecr 1097924839], length 2
 00:00:16.910026 IP 10.0.0.8.45134 > 10.0.0.6.1883: Flags [.], ack 3161117448, win 83, options [nop,nop,TS val 1097924840 ecr 3793219358], length 0
 00:00:16.925859 IP 10.0.0.8.45134 > 10.0.0.6.1883: Flags [P.], seq 462149370:462149765, ack 3161117448, win 83, options [nop,nop,TS val 1097924855 ecr 3793219358], length 395
 00:00:16.926850 IP 10.0.0.6.1883 > 10.0.0.8.45134: Flags [P.], seq 3161117448:3161117452, ack 462149765, win 85, options [nop,nop,TS val 3793219376 ecr 1097924855], length 4
 00:00:16.927634 IP 10.0.0.8.45134 > 10.0.0.6.1883: Flags [P.], seq 462149765:462149769, ack 3161117452, win 83, options [nop,nop,TS val 1097924858 ecr 3793219376], length 4
 00:00:16.927919 IP 10.0.0.6.1883 > 10.0.0.8.45134: Flags [P.], seq 3161117452:3161117456, ack 462149769, win 85, options [nop,nop,TS val 3793219377 ecr 1097924858], length 4
 00:00:16.972009 IP 10.0.0.8.45134 > 10.0.0.6.1883: Flags [.], ack 3161117456, win 83, options [nop,nop,TS val 1097924903 ecr 3793219377], length 0
 00:00:17.148579 IP6 fe80::14f7:e5ff:fec3:16ee > ff02::2: ICMP6, router solicitation, length 16
 00:00:17.926423 IP 10.0.0.8.45134 > 10.0.0.6.1883: Flags [P.], seq 462149769:462150164, ack 3161117456, win 83, options [nop,nop,TS val 1097925856 ecr 3793219377], length 395
 00:00:17.927184 IP 10.0.0.6.1883 > 10.0.0.8.45134: Flags [P.], seq 3161117456:3161117460, ack 462150164, win 85, options [nop,nop,TS val 3793220376 ecr 1097925856], length 4
 00:00:17.928559 IP 10.0.0.8.45134 > 10.0.0.6.1883: Flags [.], ack 3161117460, win 83, options [nop,nop,TS val 1097925859 ecr 3793220376], length 0
 00:00:17.928650 IP 10.0.0.8.45134 > 10.0.0.6.1883: Flags [P.], seq 462150164:462150168, ack 3161117460, win 83, options [nop,nop,TS val 1097925859 ecr 3793220376], length 4
 00:00:17.929078 IP 10.0.0.6.1883 > 10.0.0.8.45134: Flags [P.], seq 3161117460:3161117464, ack 462150168, win 85, options [nop,nop,TS val 3793220378 ecr 1097925859], length 4
 00:00:17.971552 IP 10.0.0.8.45134 > 10.0.0.6.1883: Flags [.], ack 3161117464, win 83, options [nop,nop,TS val 1097925902 ecr 3793220378], length 0
 00:00:18.928800 IP 10.0.0.8.45134 > 10.0.0.6.1883: Flags [P.], seq 462150168:462150563, ack 3161117464, win 83, options [nop,nop,TS val 1097926858 ecr 3793220378], length 395
 00:00:18.929449 IP 10.0.0.6.1883 > 10.0.0.8.45134: Flags [P.], seq 3161117464:3161117468, ack 462150563, win 85, options [nop,nop,TS val 3793221378 ecr 1097926858], length 4
 00:00:18.930777 IP 10.0.0.8.45134 > 10.0.0.6.1883: Flags [.], ack 3161117468, win 83, options [nop,nop,TS val 1097926861 ecr 3793221378], length 0
 00:00:18.930997 IP 10.0.0.8.45134 > 10.0.0.6.1883: Flags [P.], seq 462150563:462150567, ack 3161117468, win 83, options [nop,nop,TS val 1097926861 ecr 3793221378], length 4
 00:00:18.931323 IP 10.0.0.6.1883 > 10.0.0.8.45134: Flags [P.], seq 3161117468:3161117472, ack 462150567, win 85, options [nop,nop,TS val 3793221380 ecr 1097926861], length 4
 00:00:18.975656 IP 10.0.0.8.45134 > 10.0.0.6.1883: Flags [.], ack 3161117472, win 83, options [nop,nop,TS val 1097926907 ecr 3793221380], length 0
 00:00:19.928512 IP 10.0.0.8.45134 > 10.0.0.6.1883: Flags [P.], seq 462150567:462150962, ack 3161117472, win 83, options [nop,nop,TS val 1097927859 ecr 3793221380], length 395
 00:00:19.928737 IP 10.0.0.6.1883 > 10.0.0.8.45134: Flags [P.], seq 3161117472:3161117476, ack 462150962, win 85, options [nop,nop,TS val 3793222378 ecr 1097927859], length 4
 00:00:19.929245 IP 10.0.0.8.45134 > 10.0.0.6.1883: Flags [.], ack 3161117476, win 83, options [nop,nop,TS val 1097927860 ecr 3793222378], length 0
 00:00:19.929295 IP 10.0.0.8.45134 > 10.0.0.6.1883: Flags [P.], seq 462150962:462150966, ack 3161117476, win 83, options [nop,nop,TS val 1097927860 ecr 3793222378], length 4
 00:00:19.929398 IP 10.0.0.6.1883 > 10.0.0.8.45134: Flags [P.], seq 3161117476:3161117480, ack 462150966, win 85, options [nop,nop,TS val 3793222378 ecr 1097927860], length 4
 00:00:19.971966 IP 10.0.0.8.45134 > 10.0.0.6.1883: Flags [.], ack 3161117480, win 83, options [nop,nop,TS val 1097927903 ecr 3793222378], length 0
 00:00:20.192841 IP6 fe80::a810:1ff:fe5a:bd4b > ff02::2: ICMP6, router solicitation, length 16
 00:00:20.206024 IP6 fe80::8ad:8dff:febc:47c1 > ff02::2: ICMP6, router solicitation, length 16
 00:00:20.238739 IP6 fe80::e4d3:a1ff:fe0b:ebcb > ff02::2: ICMP6, router solicitation, length 16
 00:00:20.258667 IP6 fe80::70fc:2bff:fe24:fce6 > ff02::2: ICMP6, router solicitation, length 16
 00:00:20.265446 IP6 fe80::1815:cbff:fefb:ea10 > ff02::2: ICMP6, router solicitation, length 16
 00:00:20.932450 IP 10.0.0.8.45134 > 10.0.0.6.1883: Flags [P.], seq 462150966:462151361, ack 3161117480, win 83, options [nop,nop,TS val 1097928862 ecr 3793222378], length 395
 00:00:20.933534 IP 10.0.0.6.1883 > 10.0.0.8.45134: Flags [P.], seq 3161117480:3161117484, ack 462151361, win 85, options [nop,nop,TS val 3793223383 ecr 1097928862], length 4
 00:00:20.934224 IP 10.0.0.8.45134 > 10.0.0.6.1883: Flags [.], ack 3161117484, win 83, options [nop,nop,TS val 1097928865 ecr 3793223383], length 0
 00:00:20.934341 IP 10.0.0.8.45134 > 10.0.0.6.1883: Flags [P.], seq 462151361:462151365, ack 3161117484, win 83, options [nop,nop,TS val 1097928865 ecr 3793223383], length 4
 00:00:20.935015 IP 10.0.0.6.1883 > 10.0.0.8.45134: Flags [P.], seq 3161117484:3161117488, ack 462151365, win 85, options [nop,nop,TS val 3793223384 ecr 1097928865], length 4
 00:00:20.982335 IP 10.0.0.8.45134 > 10.0.0.6.1883: Flags [.], ack 3161117488, win 83, options [nop,nop,TS val 1097928913 ecr 3793223384], length 0
 00:00:21.911115 IP 10.0.0.8.45134 > 10.0.0.6.1883: Flags [P.], seq 462151365:462151367, ack 3161117488, win 83, options [nop,nop,TS val 1097929841 ecr 3793223384], length 2
 00:00:21.911892 IP 10.0.0.6.1883 > 10.0.0.8.45134: Flags [P.], seq 3161117488:3161117490, ack 462151367, win 85, options [nop,nop,TS val 3793224360 ecr 1097929841], length 2
 00:00:21.912744 IP 10.0.0.8.45134 > 10.0.0.6.1883: Flags [.], ack 3161117490, win 83, options [nop,nop,TS val 1097929843 ecr 3793224360], length 0
 00:00:21.934639 IP 10.0.0.8.45134 > 10.0.0.6.1883: Flags [P.], seq 462151367:462151762, ack 3161117490, win 83, options [nop,nop,TS val 1097929863 ecr 3793224360], length 395
 00:00:21.935180 IP 10.0.0.6.1883 > 10.0.0.8.45134: Flags [P.], seq 3161117490:3161117494, ack 462151762, win 85, options [nop,nop,TS val 3793224384 ecr 1097929863], length 4
 00:00:21.936289 IP 10.0.0.8.45134 > 10.0.0.6.1883: Flags [P.], seq 462151762:462151766, ack 3161117494, win 83, options [nop,nop,TS val 1097929867 ecr 3793224384], length 4
 00:00:21.937023 IP 10.0.0.6.1883 > 10.0.0.8.45134: Flags [P.], seq 3161117494:3161117498, ack 462151766, win 85, options [nop,nop,TS val 3793224386 ecr 1097929867], length 4
 00:00:21.979897 IP 10.0.0.8.45134 > 10.0.0.6.1883: Flags [.], ack 3161117498, win 83, options [nop,nop,TS val 1097929911 ecr 3793224386], length 0
 00:00:22.937093 IP 10.0.0.8.45134 > 10.0.0.6.1883: Flags [P.], seq 462151766:462152161, ack 3161117498, win 83, options [nop,nop,TS val 1097930867 ecr 3793224386], length 395
 00:00:22.938148 IP 10.0.0.6.1883 > 10.0.0.8.45134: Flags [P.], seq 3161117498:3161117502, ack 462152161, win 85, options [nop,nop,TS val 3793225387 ecr 1097930867], length 4
 00:00:22.939077 IP 10.0.0.8.45134 > 10.0.0.6.1883: Flags [.], ack 3161117502, win 83, options [nop,nop,TS val 1097930869 ecr 3793225387], length 0
 00:00:22.939186 IP 10.0.0.8.45134 > 10.0.0.6.1883: Flags [P.], seq 462152161:462152165, ack 3161117502, win 83, options [nop,nop,TS val 1097930870 ecr 3793225387], length 4
 00:00:22.939470 IP 10.0.0.6.1883 > 10.0.0.8.45134: Flags [P.], seq 3161117502:3161117506, ack 462152165, win 85, options [nop,nop,TS val 3793225388 ecr 1097930870], length 4
 00:00:22.983748 IP 10.0.0.8.45134 > 10.0.0.6.1883: Flags [.], ack 3161117506, win 83, options [nop,nop,TS val 1097930915 ecr 3793225388], length 0
 00:00:23.937206 IP 10.0.0.8.45134 > 10.0.0.6.1883: Flags [P.], seq 462152165:462152560, ack 3161117506, win 83, options [nop,nop,TS val 1097931868 ecr 3793225388], length 395
 00:00:23.937976 IP 10.0.0.6.1883 > 10.0.0.8.45134: Flags [P.], seq 3161117506:3161117510, ack 462152560, win 85, options [nop,nop,TS val 3793226387 ecr 1097931868], length 4
 00:00:23.941287 IP 10.0.0.8.45134 > 10.0.0.6.1883: Flags [.], ack 3161117510, win 83, options [nop,nop,TS val 1097931872 ecr 3793226387], length 0
 00:00:23.941494 IP 10.0.0.8.45134 > 10.0.0.6.1883: Flags [P.], seq 462152560:462152564, ack 3161117510, win 83, options [nop,nop,TS val 1097931872 ecr 3793226387], length 4
 00:00:23.941957 IP 10.0.0.6.1883 > 10.0.0.8.45134: Flags [P.], seq 3161117510:3161117514, ack 462152564, win 85, options [nop,nop,TS val 3793226391 ecr 1097931872], length 4
 00:00:23.983978 IP 10.0.0.8.45134 > 10.0.0.6.1883: Flags [.], ack 3161117514, win 83, options [nop,nop,TS val 1097931915 ecr 3793226391], length 0
 00:00:24.940076 IP 10.0.0.8.45134 > 10.0.0.6.1883: Flags [P.], seq 462152564:462152959, ack 3161117514, win 83, options [nop,nop,TS val 1097932870 ecr 3793226391], length 395
 00:00:24.941223 IP 10.0.0.6.1883 > 10.0.0.8.45134: Flags [P.], seq 3161117514:3161117518, ack 462152959, win 85, options [nop,nop,TS val 3793227390 ecr 1097932870], length 4
 00:00:24.941988 IP 10.0.0.8.45134 > 10.0.0.6.1883: Flags [.], ack 3161117518, win 83, options [nop,nop,TS val 1097932873 ecr 3793227390], length 0
 00:00:24.941989 IP 10.0.0.8.45134 > 10.0.0.6.1883: Flags [P.], seq 462152959:462152963, ack 3161117518, win 83, options [nop,nop,TS val 1097932873 ecr 3793227390], length 4
 00:00:24.942233 IP 10.0.0.6.1883 > 10.0.0.8.45134: Flags [P.], seq 3161117518:3161117522, ack 462152963, win 85, options [nop,nop,TS val 3793227391 ecr 1097932873], length 4
 00:00:24.983821 IP 10.0.0.8.45134 > 10.0.0.6.1883: Flags [.], ack 3161117522, win 83, options [nop,nop,TS val 1097932915 ecr 3793227391], length 0
 00:00:25.940357 IP 10.0.0.8.45134 > 10.0.0.6.1883: Flags [P.], seq 462152963:462153358, ack 3161117522, win 83, options [nop,nop,TS val 1097933871 ecr 3793227391], length 395
 00:00:25.940917 IP 10.0.0.6.1883 > 10.0.0.8.45134: Flags [P.], seq 3161117522:3161117526, ack 462153358, win 85, options [nop,nop,TS val 3793228390 ecr 1097933871], length 4
 00:00:25.941742 IP 10.0.0.8.45134 > 10.0.0.6.1883: Flags [.], ack 3161117526, win 83, options [nop,nop,TS val 1097933872 ecr 3793228390], length 0
 00:00:25.942070 IP 10.0.0.8.45134 > 10.0.0.6.1883: Flags [P.], seq 462153358:462153362, ack 3161117526, win 83, options [nop,nop,TS val 1097933872 ecr 3793228390], length 4
 00:00:25.942621 IP 10.0.0.6.1883 > 10.0.0.8.45134: Flags [P.], seq 3161117526:3161117530, ack 462153362, win 85, options [nop,nop,TS val 3793228392 ecr 1097933872], length 4
 00:00:25.983747 IP 10.0.0.8.45134 > 10.0.0.6.1883: Flags [.], ack 3161117530, win 83, options [nop,nop,TS val 1097933915 ecr 3793228392], length 0
 00:00:26.912090 IP 10.0.0.8.45134 > 10.0.0.6.1883: Flags [P.], seq 462153362:462153364, ack 3161117530, win 83, options [nop,nop,TS val 1097934843 ecr 3793228392], length 2
 00:00:26.912671 IP 10.0.0.6.1883 > 10.0.0.8.45134: Flags [P.], seq 3161117530:3161117532, ack 462153364, win 85, options [nop,nop,TS val 3793229362 ecr 1097934843], length 2
 00:00:26.913594 IP 10.0.0.8.45134 > 10.0.0.6.1883: Flags [.], ack 3161117532, win 83, options [nop,nop,TS val 1097934844 ecr 3793229362], length 0
 00:00:26.943098 IP 10.0.0.8.45134 > 10.0.0.6.1883: Flags [P.], seq 462153364:462153759, ack 3161117532, win 83, options [nop,nop,TS val 1097934873 ecr 3793229362], length 395
 00:00:26.944310 IP 10.0.0.6.1883 > 10.0.0.8.45134: Flags [P.], seq 3161117532:3161117536, ack 462153759, win 85, options [nop,nop,TS val 3793229393 ecr 1097934873], length 4
 00:00:26.945353 IP 10.0.0.8.45134 > 10.0.0.6.1883: Flags [P.], seq 462153759:462153763, ack 3161117536, win 83, options [nop,nop,TS val 1097934876 ecr 3793229393], length 4
 00:00:26.945620 IP 10.0.0.6.1883 > 10.0.0.8.45134: Flags [P.], seq 3161117536:3161117540, ack 462153763, win 85, options [nop,nop,TS val 3793229395 ecr 1097934876], length 4
 00:00:26.987956 IP 10.0.0.8.45134 > 10.0.0.6.1883: Flags [.], ack 3161117540, win 83, options [nop,nop,TS val 1097934919 ecr 3793229395], length 0
 00:00:27.944973 IP 10.0.0.8.45134 > 10.0.0.6.1883: Flags [P.], seq 462153763:462154158, ack 3161117540, win 83, options [nop,nop,TS val 1097935876 ecr 3793229395], length 395
 00:00:27.945711 IP 10.0.0.6.1883 > 10.0.0.8.45134: Flags [P.], seq 3161117540:3161117544, ack 462154158, win 85, options [nop,nop,TS val 3793230395 ecr 1097935876], length 4
 00:00:27.946818 IP 10.0.0.8.45134 > 10.0.0.6.1883: Flags [.], ack 3161117544, win 83, options [nop,nop,TS val 1097935877 ecr 3793230395], length 0
 00:00:27.947008 IP 10.0.0.8.45134 > 10.0.0.6.1883: Flags [P.], seq 462154158:462154162, ack 3161117544, win 83, options [nop,nop,TS val 1097935877 ecr 3793230395], length 4
 00:00:27.947856 IP 10.0.0.6.1883 > 10.0.0.8.45134: Flags [P.], seq 3161117544:3161117548, ack 462154162, win 85, options [nop,nop,TS val 3793230397 ecr 1097935877], length 4
 00:00:27.991733 IP 10.0.0.8.45134 > 10.0.0.6.1883: Flags [.], ack 3161117548, win 83, options [nop,nop,TS val 1097935923 ecr 3793230397], length 0
 00:00:28.945831 IP 10.0.0.8.45134 > 10.0.0.6.1883: Flags [P.], seq 462154162:462154557, ack 3161117548, win 83, options [nop,nop,TS val 1097936877 ecr 3793230397], length 395
 00:00:28.946402 IP 10.0.0.6.1883 > 10.0.0.8.45134: Flags [P.], seq 3161117548:3161117552, ack 462154557, win 85, options [nop,nop,TS val 3793231395 ecr 1097936877], length 4
 00:00:28.947493 IP 10.0.0.8.45134 > 10.0.0.6.1883: Flags [.], ack 3161117552, win 83, options [nop,nop,TS val 1097936878 ecr 3793231395], length 0
 00:00:28.947824 IP 10.0.0.8.45134 > 10.0.0.6.1883: Flags [P.], seq 462154557:462154561, ack 3161117552, win 83, options [nop,nop,TS val 1097936878 ecr 3793231395], length 4
 00:00:28.948195 IP 10.0.0.6.1883 > 10.0.0.8.45134: Flags [P.], seq 3161117552:3161117556, ack 462154561, win 85, options [nop,nop,TS val 3793231397 ecr 1097936878], length 4
 00:00:28.991776 IP 10.0.0.8.45134 > 10.0.0.6.1883: Flags [.], ack 3161117556, win 83, options [nop,nop,TS val 1097936923 ecr 3793231397], length 0
 00:00:29.946603 IP 10.0.0.8.45134 > 10.0.0.6.1883: Flags [P.], seq 462154561:462154956, ack 3161117556, win 83, options [nop,nop,TS val 1097937877 ecr 3793231397], length 395
 00:00:29.947277 IP 10.0.0.6.1883 > 10.0.0.8.45134: Flags [P.], seq 3161117556:3161117560, ack 462154956, win 85, options [nop,nop,TS val 3793232396 ecr 1097937877], length 4
 00:00:29.948378 IP 10.0.0.8.45134 > 10.0.0.6.1883: Flags [.], ack 3161117560, win 83, options [nop,nop,TS val 1097937879 ecr 3793232396], length 0
 00:00:29.948568 IP 10.0.0.8.45134 > 10.0.0.6.1883: Flags [P.], seq 462154956:462154960, ack 3161117560, win 83, options [nop,nop,TS val 1097937879 ecr 3793232396], length 4
 00:00:29.948827 IP 10.0.0.6.1883 > 10.0.0.8.45134: Flags [P.], seq 3161117560:3161117564, ack 462154960, win 85, options [nop,nop,TS val 3793232398 ecr 1097937879], length 4
 00:00:29.991766 IP 10.0.0.8.45134 > 10.0.0.6.1883: Flags [.], ack 3161117564, win 83, options [nop,nop,TS val 1097937923 ecr 3793232398], length 0
 00:00:30.947964 IP 10.0.0.8.45134 > 10.0.0.6.1883: Flags [P.], seq 462154960:462155355, ack 3161117564, win 83, options [nop,nop,TS val 1097938879 ecr 3793232398], length 395
 00:00:30.948547 IP 10.0.0.6.1883 > 10.0.0.8.45134: Flags [P.], seq 3161117564:3161117568, ack 462155355, win 85, options [nop,nop,TS val 3793233398 ecr 1097938879], length 4
 00:00:30.949579 IP 10.0.0.8.45134 > 10.0.0.6.1883: Flags [.], ack 3161117568, win 83, options [nop,nop,TS val 1097938880 ecr 3793233398], length 0
 00:00:30.949999 IP 10.0.0.8.45134 > 10.0.0.6.1883: Flags [P.], seq 462155355:462155359, ack 3161117568, win 83, options [nop,nop,TS val 1097938880 ecr 3793233398], length 4
 00:00:30.950368 IP 10.0.0.6.1883 > 10.0.0.8.45134: Flags [P.], seq 3161117568:3161117572, ack 462155359, win 85, options [nop,nop,TS val 3793233399 ecr 1097938880], length 4
 00:00:30.992235 IP 10.0.0.8.45134 > 10.0.0.6.1883: Flags [.], ack 3161117572, win 83, options [nop,nop,TS val 1097938923 ecr 3793233399], length 0
 00:00:31.951054 IP 10.0.0.8.45134 > 10.0.0.6.1883: Flags [P.], seq 462155359:462155754, ack 3161117572, win 83, options [nop,nop,TS val 1097939880 ecr 3793233399], length 395
 00:00:31.952443 IP 10.0.0.6.1883 > 10.0.0.8.45134: Flags [P.], seq 3161117572:3161117576, ack 462155754, win 85, options [nop,nop,TS val 3793234401 ecr 1097939880], length 4
 00:00:31.952977 IP 10.0.0.8.45134 > 10.0.0.6.1883: Flags [P.], seq 462155754:462155756, ack 3161117576, win 83, options [nop,nop,TS val 1097939884 ecr 3793234401], length 2
 00:00:31.953230 IP 10.0.0.6.1883 > 10.0.0.8.45134: Flags [P.], seq 3161117576:3161117578, ack 462155756, win 85, options [nop,nop,TS val 3793234402 ecr 1097939884], length 2
 00:00:31.954111 IP 10.0.0.8.45134 > 10.0.0.6.1883: Flags [P.], seq 462155756:462155760, ack 3161117578, win 83, options [nop,nop,TS val 1097939885 ecr 3793234402], length 4
 00:00:31.954593 IP 10.0.0.6.1883 > 10.0.0.8.45134: Flags [P.], seq 3161117578:3161117582, ack 462155760, win 85, options [nop,nop,TS val 3793234404 ecr 1097939885], length 4
 00:00:32.136662 IP 10.0.0.8.45134 > 10.0.0.6.1883: Flags [.], ack 3161117582, win 83, options [nop,nop,TS val 1097940067 ecr 3793234404], length 0
 00:00:32.952226 IP 10.0.0.8.45134 > 10.0.0.6.1883: Flags [P.], seq 462155760:462156155, ack 3161117582, win 83, options [nop,nop,TS val 1097940882 ecr 3793234404], length 395
 00:00:32.952772 IP 10.0.0.6.1883 > 10.0.0.8.45134: Flags [P.], seq 3161117582:3161117586, ack 462156155, win 85, options [nop,nop,TS val 3793235402 ecr 1097940882], length 4
 00:00:32.953933 IP 10.0.0.8.45134 > 10.0.0.6.1883: Flags [.], ack 3161117586, win 83, options [nop,nop,TS val 1097940884 ecr 3793235402], length 0
 00:00:32.954037 IP 10.0.0.8.45134 > 10.0.0.6.1883: Flags [P.], seq 462156155:462156159, ack 3161117586, win 83, options [nop,nop,TS val 1097940885 ecr 3793235402], length 4
 00:00:32.954295 IP 10.0.0.6.1883 > 10.0.0.8.45134: Flags [P.], seq 3161117586:3161117590, ack 462156159, win 85, options [nop,nop,TS val 3793235403 ecr 1097940885], length 4
 00:00:32.995925 IP 10.0.0.8.45134 > 10.0.0.6.1883: Flags [.], ack 3161117590, win 83, options [nop,nop,TS val 1097940927 ecr 3793235403], length 0
 00:00:33.953459 IP 10.0.0.8.45134 > 10.0.0.6.1883: Flags [P.], seq 462156159:462156554, ack 3161117590, win 83, options [nop,nop,TS val 1097941884 ecr 3793235403], length 395
 00:00:33.954197 IP 10.0.0.6.1883 > 10.0.0.8.45134: Flags [P.], seq 3161117590:3161117594, ack 462156554, win 85, options [nop,nop,TS val 3793236403 ecr 1097941884], length 4
 00:00:33.955825 IP 10.0.0.8.45134 > 10.0.0.6.1883: Flags [.], ack 3161117594, win 83, options [nop,nop,TS val 1097941886 ecr 3793236403], length 0
 00:00:33.955826 IP 10.0.0.8.45134 > 10.0.0.6.1883: Flags [P.], seq 462156554:462156558, ack 3161117594, win 83, options [nop,nop,TS val 1097941886 ecr 3793236403], length 4
 00:00:33.956377 IP 10.0.0.6.1883 > 10.0.0.8.45134: Flags [P.], seq 3161117594:3161117598, ack 462156558, win 85, options [nop,nop,TS val 3793236405 ecr 1097941886], length 4
 00:00:34.003596 IP 10.0.0.8.45134 > 10.0.0.6.1883: Flags [.], ack 3161117598, win 83, options [nop,nop,TS val 1097941934 ecr 3793236405], length 0
 00:00:34.954767 IP 10.0.0.8.45134 > 10.0.0.6.1883: Flags [P.], seq 462156558:462156953, ack 3161117598, win 83, options [nop,nop,TS val 1097942886 ecr 3793236405], length 395
 00:00:34.955252 IP 10.0.0.6.1883 > 10.0.0.8.45134: Flags [P.], seq 3161117598:3161117602, ack 462156953, win 85, options [nop,nop,TS val 3793237404 ecr 1097942886], length 4
 00:00:34.956348 IP 10.0.0.8.45134 > 10.0.0.6.1883: Flags [.], ack 3161117602, win 83, options [nop,nop,TS val 1097942887 ecr 3793237404], length 0
 00:00:34.956505 IP 10.0.0.8.45134 > 10.0.0.6.1883: Flags [P.], seq 462156953:462156957, ack 3161117602, win 83, options [nop,nop,TS val 1097942887 ecr 3793237404], length 4
 00:00:34.957408 IP 10.0.0.6.1883 > 10.0.0.8.45134: Flags [P.], seq 3161117602:3161117606, ack 462156957, win 85, options [nop,nop,TS val 3793237406 ecr 1097942887], length 4
 00:00:34.999898 IP 10.0.0.8.45134 > 10.0.0.6.1883: Flags [.], ack 3161117606, win 83, options [nop,nop,TS val 1097942931 ecr 3793237406], length 0
 00:00:35.955410 IP 10.0.0.8.45134 > 10.0.0.6.1883: Flags [P.], seq 462156957:462157352, ack 3161117606, win 83, options [nop,nop,TS val 1097943886 ecr 3793237406], length 395
 00:00:35.955759 IP 10.0.0.6.1883 > 10.0.0.8.45134: Flags [P.], seq 3161117606:3161117610, ack 462157352, win 85, options [nop,nop,TS val 3793238405 ecr 1097943886], length 4
 00:00:35.956044 IP 10.0.0.8.45134 > 10.0.0.6.1883: Flags [.], ack 3161117610, win 83, options [nop,nop,TS val 1097943887 ecr 3793238405], length 0
 00:00:35.956081 IP 10.0.0.8.45134 > 10.0.0.6.1883: Flags [P.], seq 462157352:462157356, ack 3161117610, win 83, options [nop,nop,TS val 1097943887 ecr 3793238405], length 4
 00:00:35.956145 IP 10.0.0.6.1883 > 10.0.0.8.45134: Flags [P.], seq 3161117610:3161117614, ack 462157356, win 85, options [nop,nop,TS val 3793238405 ecr 1097943887], length 4
 00:00:35.999650 IP 10.0.0.8.45134 > 10.0.0.6.1883: Flags [.], ack 3161117614, win 83, options [nop,nop,TS val 1097943931 ecr 3793238405], length 0
 00:00:36.951366 IP 10.0.0.8.45134 > 10.0.0.6.1883: Flags [P.], seq 462157356:462157358, ack 3161117614, win 83, options [nop,nop,TS val 1097944882 ecr 3793238405], length 2
 00:00:36.951696 IP 10.0.0.6.1883 > 10.0.0.8.45134: Flags [P.], seq 3161117614:3161117616, ack 462157358, win 85, options [nop,nop,TS val 3793239401 ecr 1097944882], length 2
 00:00:36.952402 IP 10.0.0.8.45134 > 10.0.0.6.1883: Flags [.], ack 3161117616, win 83, options [nop,nop,TS val 1097944883 ecr 3793239401], length 0
 00:00:36.956692 IP 10.0.0.8.45134 > 10.0.0.6.1883: Flags [P.], seq 462157358:462157753, ack 3161117616, win 83, options [nop,nop,TS val 1097944887 ecr 3793239401], length 395
 00:00:36.957192 IP 10.0.0.6.1883 > 10.0.0.8.45134: Flags [P.], seq 3161117616:3161117620, ack 462157753, win 85, options [nop,nop,TS val 3793239406 ecr 1097944887], length 4
 00:00:36.958205 IP 10.0.0.8.45134 > 10.0.0.6.1883: Flags [P.], seq 462157753:462157757, ack 3161117620, win 83, options [nop,nop,TS val 1097944889 ecr 3793239406], length 4
 00:00:36.958450 IP 10.0.0.6.1883 > 10.0.0.8.45134: Flags [P.], seq 3161117620:3161117624, ack 462157757, win 85, options [nop,nop,TS val 3793239407 ecr 1097944889], length 4
 00:00:37.000086 IP 10.0.0.8.45134 > 10.0.0.6.1883: Flags [.], ack 3161117624, win 83, options [nop,nop,TS val 1097944931 ecr 3793239407], length 0
 00:00:37.959419 IP 10.0.0.8.45134 > 10.0.0.6.1883: Flags [P.], seq 462157757:462158152, ack 3161117624, win 83, options [nop,nop,TS val 1097945889 ecr 3793239407], length 395
 00:00:37.962632 IP 10.0.0.6.1883 > 10.0.0.8.45134: Flags [P.], seq 3161117624:3161117628, ack 462158152, win 85, options [nop,nop,TS val 3793240409 ecr 1097945889], length 4
 00:00:37.967314 IP 10.0.0.8.45134 > 10.0.0.6.1883: Flags [.], ack 3161117628, win 83, options [nop,nop,TS val 1097945897 ecr 3793240409], length 0
 00:00:37.967936 IP 10.0.0.8.45134 > 10.0.0.6.1883: Flags [P.], seq 462158152:462158156, ack 3161117628, win 83, options [nop,nop,TS val 1097945898 ecr 3793240409], length 4
 00:00:37.968444 IP 10.0.0.6.1883 > 10.0.0.8.45134: Flags [P.], seq 3161117628:3161117632, ack 462158156, win 85, options [nop,nop,TS val 3793240417 ecr 1097945898], length 4
 00:00:38.186294 IP 10.0.0.8.45134 > 10.0.0.6.1883: Flags [.], ack 3161117632, win 83, options [nop,nop,TS val 1097946067 ecr 3793240417], length 0
 00:00:38.968242 IP 10.0.0.8.45134 > 10.0.0.6.1883: Flags [P.], seq 462158156:462158551, ack 3161117632, win 83, options [nop,nop,TS val 1097946899 ecr 3793240417], length 395
 00:00:38.968860 IP 10.0.0.6.1883 > 10.0.0.8.45134: Flags [P.], seq 3161117632:3161117636, ack 462158551, win 85, options [nop,nop,TS val 3793241418 ecr 1097946899], length 4
 00:00:38.969162 IP 10.0.0.8.45134 > 10.0.0.6.1883: Flags [.], ack 3161117636, win 83, options [nop,nop,TS val 1097946900 ecr 3793241418], length 0
 00:00:38.969665 IP 10.0.0.8.45134 > 10.0.0.6.1883: Flags [P.], seq 462158551:462158555, ack 3161117636, win 83, options [nop,nop,TS val 1097946900 ecr 3793241418], length 4
 00:00:38.969965 IP 10.0.0.6.1883 > 10.0.0.8.45134: Flags [P.], seq 3161117636:3161117640, ack 462158555, win 85, options [nop,nop,TS val 3793241419 ecr 1097946900], length 4
 00:00:39.014642 IP 10.0.0.8.45134 > 10.0.0.6.1883: Flags [.], ack 3161117640, win 83, options [nop,nop,TS val 1097946945 ecr 3793241419], length 0
