 00:00:00.000000 IP6 fe80::28d8:aff:fee9:65e7 > ff02::2: ICMP6, router solicitation, length 16
 00:00:00.010511 IP6 fe80::4c22:7cff:fe0d:c6f8 > ff02::2: ICMP6, router solicitation, length 16
 00:00:00.241850 IP6 fe80::7887:3bff:fecd:68ce > ff02::2: ICMP6, router solicitation, length 16
 00:00:00.520395 IP6 fe80::24ed:67ff:feed:cc0c > ff02::2: ICMP6, router solicitation, length 16
 00:00:00.534907 IP6 fe80::145b:c2ff:fee5:57a0 > ff02::2: ICMP6, router solicitation, length 16
 00:00:00.729968 IP6 fe80::a403:c1ff:fe25:b7c2 > ff02::2: ICMP6, router solicitation, length 16
 00:00:00.742591 IP6 fe80::4ca5:cbff:fe54:f79e > ff02::2: ICMP6, router solicitation, length 16
 00:00:00.788015 IP6 fe80::b4c0:9cff:fea0:7bdb > ff02::2: ICMP6, router solicitation, length 16
 00:00:00.798648 IP6 fe80::fc70:5dff:fe6b:ac82 > ff02::2: ICMP6, router solicitation, length 16
 00:00:00.807176 IP6 fe80::4059:deff:fed5:dd9a > ff02::2: ICMP6, router solicitation, length 16
 00:00:01.252215 IP6 fe80::ec10:eff:feb7:359d > ff02::2: ICMP6, router solicitation, length 16
 00:00:01.780987 IP6 fe80::34ab:9fff:fed6:a234 > ff02::2: ICMP6, router solicitation, length 16
 00:00:08.421881 ARP, Request who-has 10.0.0.6 tell 10.0.0.8, length 28
 00:00:08.422407 ARP, Reply 10.0.0.6 is-at a6:03:c1:25:b7:c2, length 28
 00:00:08.448486 IP 10.0.0.8.45208 > 10.0.0.6.1883: Flags [S], seq 3416062248, win 42340, options [mss 1460,sackOK,TS val 1098223277 ecr 0,nop,wscale 9], length 0
 00:00:08.448758 IP 10.0.0.6.1883 > 10.0.0.8.45208: Flags [S.], seq 2060252898, ack 3416062249, win 43440, options [mss 1460,sackOK,TS val 3793517848 ecr 1098223277,nop,wscale 9], length 0
 00:00:08.457388 IP 10.0.0.8.45208 > 10.0.0.6.1883: Flags [.], ack 2060252899, win 83, options [nop,nop,TS val 1098223338 ecr 3793517848], length 0
 00:00:08.461271 IP 10.0.0.8.45208 > 10.0.0.6.1883: Flags [P.], seq 3416062249:3416062269, ack 2060252899, win 83, options [nop,nop,TS val 1098223338 ecr 3793517848], length 20
 00:00:08.461346 IP 10.0.0.6.1883 > 10.0.0.8.45208: Flags [.], ack 3416062269, win 85, options [nop,nop,TS val 3793517861 ecr 1098223338], length 0
 00:00:08.463995 IP 10.0.0.6.1883 > 10.0.0.8.45208: Flags [P.], seq 2060252899:2060252903, ack 3416062269, win 85, options [nop,nop,TS val 3793517861 ecr 1098223338], length 4
 00:00:08.464218 IP 10.0.0.8.45208 > 10.0.0.6.1883: Flags [.], ack 2060252903, win 83, options [nop,nop,TS val 1098223345 ecr 3793517861], length 0
 00:00:08.464860 IP 10.0.0.8.45208 > 10.0.0.6.1883: Flags [P.], seq 3416062269:3416062333, ack 2060252903, win 83, options [nop,nop,TS val 1098223346 ecr 3793517861], length 64
 00:00:08.465336 IP 10.0.0.6.1883 > 10.0.0.8.45208: Flags [P.], seq 2060252903:2060252968, ack 3416062333, win 85, options [nop,nop,TS val 3793517865 ecr 1098223346], length 65
 00:00:08.465471 IP 10.0.0.8.45208 > 10.0.0.6.1883: Flags [P.], seq 3416062333:3416062728, ack 2060252968, win 83, options [nop,nop,TS val 1098223347 ecr 3793517865], length 395
 00:00:08.465614 IP 10.0.0.6.1883 > 10.0.0.8.45208: Flags [P.], seq 2060252968:2060252973, ack 3416062728, win 85, options [nop,nop,TS val 3793517865 ecr 1098223347], length 5
 00:00:08.572905 IP 10.0.0.8.45208 > 10.0.0.6.1883: Flags [.], ack 2060252973, win 83, options [nop,nop,TS val 1098223439 ecr 3793517865], length 0
 00:00:08.573068 IP 10.0.0.6.1883 > 10.0.0.8.45208: Flags [P.], seq 2060252973:2060252977, ack 3416062728, win 85, options [nop,nop,TS val 3793517972 ecr 1098223439], length 4
 00:00:08.591788 IP 10.0.0.8.45208 > 10.0.0.6.1883: Flags [.], ack 2060252977, win 83, options [nop,nop,TS val 1098223473 ecr 3793517972], length 0
 00:00:08.592797 IP 10.0.0.8.45208 > 10.0.0.6.1883: Flags [P.], seq 3416062728:3416062732, ack 2060252977, win 83, options [nop,nop,TS val 1098223473 ecr 3793517972], length 4
 00:00:08.593259 IP 10.0.0.6.1883 > 10.0.0.8.45208: Flags [P.], seq 2060252977:2060252981, ack 3416062732, win 85, options [nop,nop,TS val 3793517992 ecr 1098223473], length 4
 00:00:08.637463 IP 10.0.0.8.45208 > 10.0.0.6.1883: Flags [.], ack 2060252981, win 83, options [nop,nop,TS val 1098223518 ecr 3793517992], length 0
 00:00:09.399650 IP 10.0.0.8.45208 > 10.0.0.6.1883: Flags [P.], seq 3416062732:3416063127, ack 2060252981, win 83, options [nop,nop,TS val 1098224280 ecr 3793517992], length 395
 00:00:09.400628 IP 10.0.0.6.1883 > 10.0.0.8.45208: Flags [P.], seq 2060252981:2060252985, ack 3416063127, win 85, options [nop,nop,TS val 3793518800 ecr 1098224280], length 4
 00:00:09.401111 IP 10.0.0.8.45208 > 10.0.0.6.1883: Flags [.], ack 2060252985, win 83, options [nop,nop,TS val 1098224282 ecr 3793518800], length 0
 00:00:09.402282 IP 10.0.0.8.45208 > 10.0.0.6.1883: Flags [P.], seq 3416063127:3416063131, ack 2060252985, win 83, options [nop,nop,TS val 1098224282 ecr 3793518800], length 4
 00:00:09.402896 IP 10.0.0.6.1883 > 10.0.0.8.45208: Flags [P.], seq 2060252985:2060252989, ack 3416063131, win 85, options [nop,nop,TS val 3793518802 ecr 1098224282], length 4
 00:00:09.445545 IP 10.0.0.8.45208 > 10.0.0.6.1883: Flags [.], ack 2060252989, win 83, options [nop,nop,TS val 1098224327 ecr 3793518802], length 0
 00:00:10.400918 IP 10.0.0.8.45208 > 10.0.0.6.1883: Flags [P.], seq 3416063131:3416063526, ack 2060252989, win 83, options [nop,nop,TS val 1098225281 ecr 3793518802], length 395
 00:00:10.402145 IP 10.0.0.6.1883 > 10.0.0.8.45208: Flags [P.], seq 2060252989:2060252993, ack 3416063526, win 85, options [nop,nop,TS val 3793519801 ecr 1098225281], length 4
 00:00:10.402657 IP 10.0.0.8.45208 > 10.0.0.6.1883: Flags [.], ack 2060252993, win 83, options [nop,nop,TS val 1098225283 ecr 3793519801], length 0
 00:00:10.402747 IP 10.0.0.8.45208 > 10.0.0.6.1883: Flags [P.], seq 3416063526:3416063530, ack 2060252993, win 83, options [nop,nop,TS val 1098225284 ecr 3793519801], length 4
 00:00:10.403002 IP 10.0.0.6.1883 > 10.0.0.8.45208: Flags [P.], seq 2060252993:2060252997, ack 3416063530, win 85, options [nop,nop,TS val 3793519802 ecr 1098225284], length 4
 00:00:10.445734 IP 10.0.0.8.45208 > 10.0.0.6.1883: Flags [.], ack 2060252997, win 83, options [nop,nop,TS val 1098225327 ecr 3793519802], length 0
 00:00:11.402556 IP 10.0.0.8.45208 > 10.0.0.6.1883: Flags [P.], seq 3416063530:3416063925, ack 2060252997, win 83, options [nop,nop,TS val 1098226282 ecr 3793519802], length 395
 00:00:11.403445 IP 10.0.0.6.1883 > 10.0.0.8.45208: Flags [P.], seq 2060252997:2060253001, ack 3416063925, win 85, options [nop,nop,TS val 3793520803 ecr 1098226282], length 4
 00:00:11.404057 IP 10.0.0.8.45208 > 10.0.0.6.1883: Flags [.], ack 2060253001, win 83, options [nop,nop,TS val 1098226285 ecr 3793520803], length 0
 00:00:11.405308 IP 10.0.0.8.45208 > 10.0.0.6.1883: Flags [P.], seq 3416063925:3416063929, ack 2060253001, win 83, options [nop,nop,TS val 1098226285 ecr 3793520803], length 4
 00:00:11.405908 IP 10.0.0.6.1883 > 10.0.0.8.45208: Flags [P.], seq 2060253001:2060253005, ack 3416063929, win 85, options [nop,nop,TS val 3793520805 ecr 1098226285], length 4
 00:00:11.449504 IP 10.0.0.8.45208 > 10.0.0.6.1883: Flags [.], ack 2060253005, win 83, options [nop,nop,TS val 1098226331 ecr 3793520805], length 0
 00:00:12.401601 IP 10.0.0.8.45208 > 10.0.0.6.1883: Flags [P.], seq 3416063929:3416064324, ack 2060253005, win 83, options [nop,nop,TS val 1098227283 ecr 3793520805], length 395
 00:00:12.402336 IP 10.0.0.6.1883 > 10.0.0.8.45208: Flags [P.], seq 2060253005:2060253009, ack 3416064324, win 85, options [nop,nop,TS val 3793521802 ecr 1098227283], length 4
 00:00:12.402973 IP 10.0.0.8.45208 > 10.0.0.6.1883: Flags [.], ack 2060253009, win 83, options [nop,nop,TS val 1098227284 ecr 3793521802], length 0
 00:00:12.403076 IP 10.0.0.8.45208 > 10.0.0.6.1883: Flags [P.], seq 3416064324:3416064328, ack 2060253009, win 83, options [nop,nop,TS val 1098227284 ecr 3793521802], length 4
 00:00:12.403840 IP 10.0.0.6.1883 > 10.0.0.8.45208: Flags [P.], seq 2060253009:2060253013, ack 3416064328, win 85, options [nop,nop,TS val 3793521803 ecr 1098227284], length 4
 00:00:12.445575 IP 10.0.0.8.45208 > 10.0.0.6.1883: Flags [.], ack 2060253013, win 83, options [nop,nop,TS val 1098227327 ecr 3793521803], length 0
 00:00:13.402991 IP 10.0.0.8.45208 > 10.0.0.6.1883: Flags [P.], seq 3416064328:3416064723, ack 2060253013, win 83, options [nop,nop,TS val 1098228284 ecr 3793521803], length 395
 00:00:13.403596 IP 10.0.0.6.1883 > 10.0.0.8.45208: Flags [P.], seq 2060253013:2060253017, ack 3416064723, win 85, options [nop,nop,TS val 3793522803 ecr 1098228284], length 4
 00:00:13.404926 IP 10.0.0.8.45208 > 10.0.0.6.1883: Flags [P.], seq 3416064723:3416064727, ack 2060253017, win 83, options [nop,nop,TS val 1098228286 ecr 3793522803], length 4
 00:00:13.404900 IP 10.0.0.8.45208 > 10.0.0.6.1883: Flags [.], ack 2060253017, win 83, options [nop,nop,TS val 1098228285 ecr 3793522803], length 0
 00:00:13.405287 IP 10.0.0.6.1883 > 10.0.0.8.45208: Flags [P.], seq 2060253017:2060253021, ack 3416064727, win 85, options [nop,nop,TS val 3793522805 ecr 1098228286], length 4
 00:00:13.452389 IP 10.0.0.8.45208 > 10.0.0.6.1883: Flags [.], ack 2060253021, win 83, options [nop,nop,TS val 1098228333 ecr 3793522805], length 0
 00:00:13.470309 IP 10.0.0.8.45208 > 10.0.0.6.1883: Flags [P.], seq 3416064727:3416064729, ack 2060253021, win 83, options [nop,nop,TS val 1098228351 ecr 3793522805], length 2
 00:00:13.470481 IP 10.0.0.6.1883 > 10.0.0.8.45208: Flags [P.], seq 2060253021:2060253023, ack 3416064729, win 85, options [nop,nop,TS val 3793522870 ecr 1098228351], length 2
 00:00:13.471935 IP 10.0.0.8.45208 > 10.0.0.6.1883: Flags [.], ack 2060253023, win 83, options [nop,nop,TS val 1098228352 ecr 3793522870], length 0
 00:00:14.404228 IP 10.0.0.8.45208 > 10.0.0.6.1883: Flags [P.], seq 3416064729:3416065124, ack 2060253023, win 83, options [nop,nop,TS val 1098229285 ecr 3793522870], length 395
 00:00:14.406427 IP 10.0.0.6.1883 > 10.0.0.8.45208: Flags [P.], seq 2060253023:2060253027, ack 3416065124, win 85, options [nop,nop,TS val 3793523806 ecr 1098229285], length 4
 00:00:14.407311 IP 10.0.0.8.45208 > 10.0.0.6.1883: Flags [.], ack 2060253027, win 83, options [nop,nop,TS val 1098229288 ecr 3793523806], length 0
 00:00:14.408135 IP 10.0.0.8.45208 > 10.0.0.6.1883: Flags [P.], seq 3416065124:3416065128, ack 2060253027, win 83, options [nop,nop,TS val 1098229289 ecr 3793523806], length 4
 00:00:14.408810 IP 10.0.0.6.1883 > 10.0.0.8.45208: Flags [P.], seq 2060253027:2060253031, ack 3416065128, win 85, options [nop,nop,TS val 3793523808 ecr 1098229289], length 4
 00:00:14.449474 IP 10.0.0.8.45208 > 10.0.0.6.1883: Flags [.], ack 2060253031, win 83, options [nop,nop,TS val 1098229331 ecr 3793523808], length 0
 00:00:14.553858 IP6 fe80::f8d8:d0ff:fecb:3ecf > ff02::2: ICMP6, router solicitation, length 16
 00:00:15.345153 IP6 fe80::7887:3bff:fecd:68ce > ff02::2: ICMP6, router solicitation, length 16
 00:00:15.405655 IP 10.0.0.8.45208 > 10.0.0.6.1883: Flags [P.], seq 3416065128:3416065523, ack 2060253031, win 83, options [nop,nop,TS val 1098230287 ecr 3793523808], length 395
 00:00:15.406836 IP 10.0.0.6.1883 > 10.0.0.8.45208: Flags [P.], seq 2060253031:2060253035, ack 3416065523, win 85, options [nop,nop,TS val 3793524806 ecr 1098230287], length 4
 00:00:15.407247 IP 10.0.0.8.45208 > 10.0.0.6.1883: Flags [.], ack 2060253035, win 83, options [nop,nop,TS val 1098230288 ecr 3793524806], length 0
 00:00:15.408244 IP 10.0.0.8.45208 > 10.0.0.6.1883: Flags [P.], seq 3416065523:3416065527, ack 2060253035, win 83, options [nop,nop,TS val 1098230289 ecr 3793524806], length 4
 00:00:15.408384 IP 10.0.0.6.1883 > 10.0.0.8.45208: Flags [P.], seq 2060253035:2060253039, ack 3416065527, win 85, options [nop,nop,TS val 3793524808 ecr 1098230289], length 4
 00:00:15.474693 IP 10.0.0.8.45208 > 10.0.0.6.1883: Flags [.], ack 2060253039, win 83, options [nop,nop,TS val 1098230356 ecr 3793524808], length 0
 00:00:15.845407 IP6 fe80::28d8:aff:fee9:65e7 > ff02::2: ICMP6, router solicitation, length 16
 00:00:16.112965 IP6 fe80::fc70:5dff:fe6b:ac82 > ff02::2: ICMP6, router solicitation, length 16
 00:00:16.376575 IP6 fe80::845c:b1ff:fedf:bde0 > ff02::2: ICMP6, router solicitation, length 16
 00:00:16.395184 IP6 fe80::4c22:7cff:fe0d:c6f8 > ff02::2: ICMP6, router solicitation, length 16
 00:00:16.410108 IP 10.0.0.8.45208 > 10.0.0.6.1883: Flags [P.], seq 3416065527:3416065922, ack 2060253039, win 83, options [nop,nop,TS val 1098231291 ecr 3793524808], length 395
 00:00:16.410774 IP 10.0.0.6.1883 > 10.0.0.8.45208: Flags [P.], seq 2060253039:2060253043, ack 3416065922, win 85, options [nop,nop,TS val 3793525810 ecr 1098231291], length 4
 00:00:16.411234 IP 10.0.0.8.45208 > 10.0.0.6.1883: Flags [.], ack 2060253043, win 83, options [nop,nop,TS val 1098231292 ecr 3793525810], length 0
 00:00:16.411894 IP 10.0.0.8.45208 > 10.0.0.6.1883: Flags [P.], seq 3416065922:3416065926, ack 2060253043, win 83, options [nop,nop,TS val 1098231292 ecr 3793525810], length 4
 00:00:16.412213 IP 10.0.0.6.1883 > 10.0.0.8.45208: Flags [P.], seq 2060253043:2060253047, ack 3416065926, win 85, options [nop,nop,TS val 3793525811 ecr 1098231292], length 4
 00:00:16.453576 IP 10.0.0.8.45208 > 10.0.0.6.1883: Flags [.], ack 2060253047, win 83, options [nop,nop,TS val 1098231335 ecr 3793525811], length 0
 00:00:16.978122 IP6 fe80::a403:c1ff:fe25:b7c2 > ff02::2: ICMP6, router solicitation, length 16
 00:00:17.410801 IP 10.0.0.8.45208 > 10.0.0.6.1883: Flags [P.], seq 3416065926:3416066321, ack 2060253047, win 83, options [nop,nop,TS val 1098232292 ecr 3793525811], length 395
 00:00:17.411719 IP 10.0.0.6.1883 > 10.0.0.8.45208: Flags [P.], seq 2060253047:2060253051, ack 3416066321, win 85, options [nop,nop,TS val 3793526811 ecr 1098232292], length 4
 00:00:17.412646 IP 10.0.0.8.45208 > 10.0.0.6.1883: Flags [.], ack 2060253051, win 83, options [nop,nop,TS val 1098232293 ecr 3793526811], length 0
 00:00:17.412649 IP 10.0.0.8.45208 > 10.0.0.6.1883: Flags [P.], seq 3416066321:3416066325, ack 2060253051, win 83, options [nop,nop,TS val 1098232294 ecr 3793526811], length 4
 00:00:17.412954 IP 10.0.0.6.1883 > 10.0.0.8.45208: Flags [P.], seq 2060253051:2060253055, ack 3416066325, win 85, options [nop,nop,TS val 3793526812 ecr 1098232294], length 4
 00:00:17.457301 IP 10.0.0.8.45208 > 10.0.0.6.1883: Flags [.], ack 2060253055, win 83, options [nop,nop,TS val 1098232338 ecr 3793526812], length 0
 00:00:18.413329 IP 10.0.0.8.45208 > 10.0.0.6.1883: Flags [P.], seq 3416066325:3416066720, ack 2060253055, win 83, options [nop,nop,TS val 1098233294 ecr 3793526812], length 395
 00:00:18.414347 IP 10.0.0.6.1883 > 10.0.0.8.45208: Flags [P.], seq 2060253055:2060253059, ack 3416066720, win 85, options [nop,nop,TS val 3793527813 ecr 1098233294], length 4
 00:00:18.414729 IP 10.0.0.8.45208 > 10.0.0.6.1883: Flags [.], ack 2060253059, win 83, options [nop,nop,TS val 1098233296 ecr 3793527813], length 0
 00:00:18.415256 IP 10.0.0.8.45208 > 10.0.0.6.1883: Flags [P.], seq 3416066720:3416066724, ack 2060253059, win 83, options [nop,nop,TS val 1098233296 ecr 3793527813], length 4
 00:00:18.415553 IP 10.0.0.6.1883 > 10.0.0.8.45208: Flags [P.], seq 2060253059:2060253063, ack 3416066724, win 85, options [nop,nop,TS val 3793527815 ecr 1098233296], length 4
 00:00:18.430924 IP6 fe80::24ed:67ff:feed:cc0c > ff02::2: ICMP6, router solicitation, length 16
 00:00:18.442496 IP6 fe80::b4c0:9cff:fea0:7bdb > ff02::2: ICMP6, router solicitation, length 16
 00:00:18.452247 IP6 fe80::4059:deff:fed5:dd9a > ff02::2: ICMP6, router solicitation, length 16
 00:00:18.457777 IP 10.0.0.8.45208 > 10.0.0.6.1883: Flags [.], ack 2060253063, win 83, options [nop,nop,TS val 1098233338 ecr 3793527815], length 0
 00:00:18.463777 IP6 fe80::145b:c2ff:fee5:57a0 > ff02::2: ICMP6, router solicitation, length 16
 00:00:18.471418 IP 10.0.0.8.45208 > 10.0.0.6.1883: Flags [P.], seq 3416066724:3416066726, ack 2060253063, win 83, options [nop,nop,TS val 1098233352 ecr 3793527815], length 2
 00:00:18.471538 IP 10.0.0.6.1883 > 10.0.0.8.45208: Flags [P.], seq 2060253063:2060253065, ack 3416066726, win 85, options [nop,nop,TS val 3793527871 ecr 1098233352], length 2
 00:00:18.471743 IP 10.0.0.8.45208 > 10.0.0.6.1883: Flags [.], ack 2060253065, win 83, options [nop,nop,TS val 1098233353 ecr 3793527871], length 0
 00:00:19.414905 IP 10.0.0.8.45208 > 10.0.0.6.1883: Flags [P.], seq 3416066726:3416067121, ack 2060253065, win 83, options [nop,nop,TS val 1098234296 ecr 3793527871], length 395
 00:00:19.415411 IP 10.0.0.6.1883 > 10.0.0.8.45208: Flags [P.], seq 2060253065:2060253069, ack 3416067121, win 85, options [nop,nop,TS val 3793528815 ecr 1098234296], length 4
 00:00:19.416499 IP 10.0.0.8.45208 > 10.0.0.6.1883: Flags [.], ack 2060253069, win 83, options [nop,nop,TS val 1098234297 ecr 3793528815], length 0
 00:00:19.417349 IP 10.0.0.8.45208 > 10.0.0.6.1883: Flags [P.], seq 3416067121:3416067125, ack 2060253069, win 83, options [nop,nop,TS val 1098234298 ecr 3793528815], length 4
 00:00:19.417487 IP 10.0.0.6.1883 > 10.0.0.8.45208: Flags [P.], seq 2060253069:2060253073, ack 3416067125, win 85, options [nop,nop,TS val 3793528817 ecr 1098234298], length 4
 00:00:19.461533 IP 10.0.0.8.45208 > 10.0.0.6.1883: Flags [.], ack 2060253073, win 83, options [nop,nop,TS val 1098234343 ecr 3793528817], length 0
 00:00:20.416082 IP 10.0.0.8.45208 > 10.0.0.6.1883: Flags [P.], seq 3416067125:3416067520, ack 2060253073, win 83, options [nop,nop,TS val 1098235297 ecr 3793528817], length 395
 00:00:20.416589 IP 10.0.0.6.1883 > 10.0.0.8.45208: Flags [P.], seq 2060253073:2060253077, ack 3416067520, win 85, options [nop,nop,TS val 3793529816 ecr 1098235297], length 4
 00:00:20.417270 IP 10.0.0.8.45208 > 10.0.0.6.1883: Flags [.], ack 2060253077, win 83, options [nop,nop,TS val 1098235298 ecr 3793529816], length 0
 00:00:20.417272 IP 10.0.0.8.45208 > 10.0.0.6.1883: Flags [P.], seq 3416067520:3416067524, ack 2060253077, win 83, options [nop,nop,TS val 1098235298 ecr 3793529816], length 4
 00:00:20.417711 IP 10.0.0.6.1883 > 10.0.0.8.45208: Flags [P.], seq 2060253077:2060253081, ack 3416067524, win 85, options [nop,nop,TS val 3793529817 ecr 1098235298], length 4
 00:00:20.453073 IP6 fe80::4ca5:cbff:fe54:f79e > ff02::2: ICMP6, router solicitation, length 16
 00:00:20.461607 IP 10.0.0.8.45208 > 10.0.0.6.1883: Flags [.], ack 2060253081, win 83, options [nop,nop,TS val 1098235342 ecr 3793529817], length 0
 00:00:20.475013 IP6 fe80::ec10:eff:feb7:359d > ff02::2: ICMP6, router solicitation, length 16
 00:00:20.497625 IP6 fe80::34ab:9fff:fed6:a234 > ff02::2: ICMP6, router solicitation, length 16
 00:00:21.417522 IP 10.0.0.8.45208 > 10.0.0.6.1883: Flags [P.], seq 3416067524:3416067919, ack 2060253081, win 83, options [nop,nop,TS val 1098236298 ecr 3793529817], length 395
 00:00:21.418121 IP 10.0.0.6.1883 > 10.0.0.8.45208: Flags [P.], seq 2060253081:2060253085, ack 3416067919, win 85, options [nop,nop,TS val 3793530817 ecr 1098236298], length 4
 00:00:21.418278 IP 10.0.0.8.45208 > 10.0.0.6.1883: Flags [.], ack 2060253085, win 83, options [nop,nop,TS val 1098236299 ecr 3793530817], length 0
 00:00:21.418891 IP 10.0.0.8.45208 > 10.0.0.6.1883: Flags [P.], seq 3416067919:3416067923, ack 2060253085, win 83, options [nop,nop,TS val 1098236300 ecr 3793530817], length 4
 00:00:21.419226 IP 10.0.0.6.1883 > 10.0.0.8.45208: Flags [P.], seq 2060253085:2060253089, ack 3416067923, win 85, options [nop,nop,TS val 3793530818 ecr 1098236300], length 4
 00:00:21.461740 IP 10.0.0.8.45208 > 10.0.0.6.1883: Flags [.], ack 2060253089, win 83, options [nop,nop,TS val 1098236343 ecr 3793530818], length 0
 00:00:22.420107 IP 10.0.0.8.45208 > 10.0.0.6.1883: Flags [P.], seq 3416067923:3416068318, ack 2060253089, win 83, options [nop,nop,TS val 1098237300 ecr 3793530818], length 395
 00:00:22.421386 IP 10.0.0.6.1883 > 10.0.0.8.45208: Flags [P.], seq 2060253089:2060253093, ack 3416068318, win 85, options [nop,nop,TS val 3793531821 ecr 1098237300], length 4
 00:00:22.421902 IP 10.0.0.8.45208 > 10.0.0.6.1883: Flags [.], ack 2060253093, win 83, options [nop,nop,TS val 1098237303 ecr 3793531821], length 0
 00:00:22.423011 IP 10.0.0.8.45208 > 10.0.0.6.1883: Flags [P.], seq 3416068318:3416068322, ack 2060253093, win 83, options [nop,nop,TS val 1098237303 ecr 3793531821], length 4
 00:00:22.423577 IP 10.0.0.6.1883 > 10.0.0.8.45208: Flags [P.], seq 2060253093:2060253097, ack 3416068322, win 85, options [nop,nop,TS val 3793531823 ecr 1098237303], length 4
 00:00:22.465475 IP 10.0.0.8.45208 > 10.0.0.6.1883: Flags [.], ack 2060253097, win 83, options [nop,nop,TS val 1098237347 ecr 3793531823], length 0
 00:00:23.420649 IP 10.0.0.8.45208 > 10.0.0.6.1883: Flags [P.], seq 3416068322:3416068717, ack 2060253097, win 83, options [nop,nop,TS val 1098238302 ecr 3793531823], length 395
 00:00:23.421111 IP 10.0.0.6.1883 > 10.0.0.8.45208: Flags [P.], seq 2060253097:2060253101, ack 3416068717, win 85, options [nop,nop,TS val 3793532820 ecr 1098238302], length 4
 00:00:23.421597 IP 10.0.0.8.45208 > 10.0.0.6.1883: Flags [.], ack 2060253101, win 83, options [nop,nop,TS val 1098238303 ecr 3793532820], length 0
 00:00:23.421598 IP 10.0.0.8.45208 > 10.0.0.6.1883: Flags [P.], seq 3416068717:3416068721, ack 2060253101, win 83, options [nop,nop,TS val 1098238303 ecr 3793532820], length 4
 00:00:23.421896 IP 10.0.0.6.1883 > 10.0.0.8.45208: Flags [P.], seq 2060253101:2060253105, ack 3416068721, win 85, options [nop,nop,TS val 3793532821 ecr 1098238303], length 4
 00:00:23.472114 IP 10.0.0.8.45208 > 10.0.0.6.1883: Flags [.], ack 2060253105, win 83, options [nop,nop,TS val 1098238347 ecr 3793532821], length 0
 00:00:23.473555 IP 10.0.0.8.45208 > 10.0.0.6.1883: Flags [P.], seq 3416068721:3416068723, ack 2060253105, win 83, options [nop,nop,TS val 1098238354 ecr 3793532821], length 2
 00:00:23.473753 IP 10.0.0.6.1883 > 10.0.0.8.45208: Flags [P.], seq 2060253105:2060253107, ack 3416068723, win 85, options [nop,nop,TS val 3793532873 ecr 1098238354], length 2
 00:00:23.475071 IP 10.0.0.8.45208 > 10.0.0.6.1883: Flags [.], ack 2060253107, win 83, options [nop,nop,TS val 1098238356 ecr 3793532873], length 0
 00:00:24.422845 IP 10.0.0.8.45208 > 10.0.0.6.1883: Flags [P.], seq 3416068723:3416069118, ack 2060253107, win 83, options [nop,nop,TS val 1098239303 ecr 3793532873], length 395
 00:00:24.423602 IP 10.0.0.6.1883 > 10.0.0.8.45208: Flags [P.], seq 2060253107:2060253111, ack 3416069118, win 85, options [nop,nop,TS val 3793533823 ecr 1098239303], length 4
 00:00:24.424019 IP 10.0.0.8.45208 > 10.0.0.6.1883: Flags [.], ack 2060253111, win 83, options [nop,nop,TS val 1098239305 ecr 3793533823], length 0
 00:00:24.424021 IP 10.0.0.8.45208 > 10.0.0.6.1883: Flags [P.], seq 3416069118:3416069122, ack 2060253111, win 83, options [nop,nop,TS val 1098239305 ecr 3793533823], length 4
 00:00:24.424306 IP 10.0.0.6.1883 > 10.0.0.8.45208: Flags [P.], seq 2060253111:2060253115, ack 3416069122, win 85, options [nop,nop,TS val 3793533824 ecr 1098239305], length 4
 00:00:24.499011 IP 10.0.0.8.45208 > 10.0.0.6.1883: Flags [.], ack 2060253115, win 83, options [nop,nop,TS val 1098239380 ecr 3793533824], length 0
 00:00:25.442422 IP 10.0.0.8.45208 > 10.0.0.6.1883: Flags [P.], seq 3416069122:3416069517, ack 2060253115, win 83, options [nop,nop,TS val 1098240323 ecr 3793533824], length 395
 00:00:25.443083 IP 10.0.0.6.1883 > 10.0.0.8.45208: Flags [P.], seq 2060253115:2060253119, ack 3416069517, win 85, options [nop,nop,TS val 3793534842 ecr 1098240323], length 4
 00:00:25.444296 IP 10.0.0.8.45208 > 10.0.0.6.1883: Flags [.], ack 2060253119, win 83, options [nop,nop,TS val 1098240325 ecr 3793534842], length 0
 00:00:25.444747 IP 10.0.0.8.45208 > 10.0.0.6.1883: Flags [P.], seq 3416069517:3416069521, ack 2060253119, win 83, options [nop,nop,TS val 1098240326 ecr 3793534842], length 4
 00:00:25.444905 IP 10.0.0.6.1883 > 10.0.0.8.45208: Flags [P.], seq 2060253119:2060253123, ack 3416069521, win 85, options [nop,nop,TS val 3793534844 ecr 1098240326], length 4
 00:00:25.499831 IP 10.0.0.8.45208 > 10.0.0.6.1883: Flags [.], ack 2060253123, win 83, options [nop,nop,TS val 1098240381 ecr 3793534844], length 0
 00:00:26.510884 IP 10.0.0.8.45208 > 10.0.0.6.1883: Flags [P.], seq 3416069521:3416069916, ack 2060253123, win 83, options [nop,nop,TS val 1098241392 ecr 3793534844], length 395
 00:00:26.511428 IP 10.0.0.6.1883 > 10.0.0.8.45208: Flags [P.], seq 2060253123:2060253127, ack 3416069916, win 85, options [nop,nop,TS val 3793535911 ecr 1098241392], length 4
 00:00:26.512281 IP 10.0.0.8.45208 > 10.0.0.6.1883: Flags [.], ack 2060253127, win 83, options [nop,nop,TS val 1098241393 ecr 3793535911], length 0
 00:00:26.512282 IP 10.0.0.8.45208 > 10.0.0.6.1883: Flags [P.], seq 3416069916:3416069920, ack 2060253127, win 83, options [nop,nop,TS val 1098241393 ecr 3793535911], length 4
 00:00:26.512518 IP 10.0.0.6.1883 > 10.0.0.8.45208: Flags [P.], seq 2060253127:2060253131, ack 3416069920, win 85, options [nop,nop,TS val 3793535912 ecr 1098241393], length 4
 00:00:26.715346 IP 10.0.0.8.45208 > 10.0.0.6.1883: Flags [.], ack 2060253131, win 83, options [nop,nop,TS val 1098241596 ecr 3793535912], length 0
 00:00:27.511954 IP 10.0.0.8.45208 > 10.0.0.6.1883: Flags [P.], seq 3416069920:3416070315, ack 2060253131, win 83, options [nop,nop,TS val 1098242393 ecr 3793535912], length 395
 00:00:27.512996 IP 10.0.0.6.1883 > 10.0.0.8.45208: Flags [P.], seq 2060253131:2060253135, ack 3416070315, win 85, options [nop,nop,TS val 3793536912 ecr 1098242393], length 4
 00:00:27.513793 IP 10.0.0.8.45208 > 10.0.0.6.1883: Flags [.], ack 2060253135, win 83, options [nop,nop,TS val 1098242395 ecr 3793536912], length 0
 00:00:27.514364 IP 10.0.0.8.45208 > 10.0.0.6.1883: Flags [P.], seq 3416070315:3416070319, ack 2060253135, win 83, options [nop,nop,TS val 1098242395 ecr 3793536912], length 4
 00:00:27.514691 IP 10.0.0.6.1883 > 10.0.0.8.45208: Flags [P.], seq 2060253135:2060253139, ack 3416070319, win 85, options [nop,nop,TS val 3793536914 ecr 1098242395], length 4
 00:00:27.562546 IP 10.0.0.8.45208 > 10.0.0.6.1883: Flags [.], ack 2060253139, win 83, options [nop,nop,TS val 1098242444 ecr 3793536914], length 0
 00:00:28.766127 IP 10.0.0.8.45208 > 10.0.0.6.1883: Flags [P.], seq 3416070319:3416070714, ack 2060253139, win 83, options [nop,nop,TS val 1098243647 ecr 3793536914], length 395
 00:00:28.766848 IP 10.0.0.6.1883 > 10.0.0.8.45208: Flags [P.], seq 2060253139:2060253143, ack 3416070714, win 85, options [nop,nop,TS val 3793538166 ecr 1098243647], length 4
 00:00:28.767187 IP 10.0.0.8.45208 > 10.0.0.6.1883: Flags [P.], seq 3416070714:3416070716, ack 2060253143, win 83, options [nop,nop,TS val 1098243648 ecr 3793538166], length 2
 00:00:28.767445 IP 10.0.0.6.1883 > 10.0.0.8.45208: Flags [P.], seq 2060253143:2060253145, ack 3416070716, win 85, options [nop,nop,TS val 3793538167 ecr 1098243648], length 2
 00:00:28.768439 IP 10.0.0.8.45208 > 10.0.0.6.1883: Flags [P.], seq 3416070716:3416070720, ack 2060253145, win 83, options [nop,nop,TS val 1098243649 ecr 3793538167], length 4
 00:00:28.768694 IP 10.0.0.6.1883 > 10.0.0.8.45208: Flags [P.], seq 2060253145:2060253149, ack 3416070720, win 85, options [nop,nop,TS val 3793538168 ecr 1098243649], length 4
 00:00:28.816332 IP 10.0.0.8.45208 > 10.0.0.6.1883: Flags [.], ack 2060253149, win 83, options [nop,nop,TS val 1098243697 ecr 3793538168], length 0
 00:00:29.767175 IP 10.0.0.8.45208 > 10.0.0.6.1883: Flags [P.], seq 3416070720:3416071115, ack 2060253149, win 83, options [nop,nop,TS val 1098244648 ecr 3793538168], length 395
 00:00:29.767598 IP 10.0.0.6.1883 > 10.0.0.8.45208: Flags [P.], seq 2060253149:2060253153, ack 3416071115, win 85, options [nop,nop,TS val 3793539167 ecr 1098244648], length 4
 00:00:29.768302 IP 10.0.0.8.45208 > 10.0.0.6.1883: Flags [.], ack 2060253153, win 83, options [nop,nop,TS val 1098244649 ecr 3793539167], length 0
 00:00:29.768596 IP 10.0.0.8.45208 > 10.0.0.6.1883: Flags [P.], seq 3416071115:3416071119, ack 2060253153, win 83, options [nop,nop,TS val 1098244650 ecr 3793539167], length 4
 00:00:29.768832 IP 10.0.0.6.1883 > 10.0.0.8.45208: Flags [P.], seq 2060253153:2060253157, ack 3416071119, win 85, options [nop,nop,TS val 3793539168 ecr 1098244650], length 4
 00:00:29.809473 IP 10.0.0.8.45208 > 10.0.0.6.1883: Flags [.], ack 2060253157, win 83, options [nop,nop,TS val 1098244690 ecr 3793539168], length 0
 00:00:30.768063 IP 10.0.0.8.45208 > 10.0.0.6.1883: Flags [P.], seq 3416071119:3416071514, ack 2060253157, win 83, options [nop,nop,TS val 1098245649 ecr 3793539168], length 395
 00:00:30.768611 IP 10.0.0.6.1883 > 10.0.0.8.45208: Flags [P.], seq 2060253157:2060253161, ack 3416071514, win 85, options [nop,nop,TS val 3793540168 ecr 1098245649], length 4
 00:00:30.769307 IP 10.0.0.8.45208 > 10.0.0.6.1883: Flags [.], ack 2060253161, win 83, options [nop,nop,TS val 1098245650 ecr 3793540168], length 0
 00:00:30.769332 IP 10.0.0.8.45208 > 10.0.0.6.1883: Flags [P.], seq 3416071514:3416071518, ack 2060253161, win 83, options [nop,nop,TS val 1098245650 ecr 3793540168], length 4
 00:00:30.769626 IP 10.0.0.6.1883 > 10.0.0.8.45208: Flags [P.], seq 2060253161:2060253165, ack 3416071518, win 85, options [nop,nop,TS val 3793540169 ecr 1098245650], length 4
 00:00:30.813432 IP 10.0.0.8.45208 > 10.0.0.6.1883: Flags [.], ack 2060253165, win 83, options [nop,nop,TS val 1098245694 ecr 3793540169], length 0
 00:00:31.770984 IP 10.0.0.8.45208 > 10.0.0.6.1883: Flags [P.], seq 3416071518:3416071913, ack 2060253165, win 83, options [nop,nop,TS val 1098246651 ecr 3793540169], length 395
 00:00:31.771764 IP 10.0.0.6.1883 > 10.0.0.8.45208: Flags [P.], seq 2060253165:2060253169, ack 3416071913, win 85, options [nop,nop,TS val 3793541171 ecr 1098246651], length 4
 00:00:31.772425 IP 10.0.0.8.45208 > 10.0.0.6.1883: Flags [.], ack 2060253169, win 83, options [nop,nop,TS val 1098246653 ecr 3793541171], length 0
 00:00:31.773386 IP 10.0.0.8.45208 > 10.0.0.6.1883: Flags [P.], seq 3416071913:3416071917, ack 2060253169, win 83, options [nop,nop,TS val 1098246654 ecr 3793541171], length 4
 00:00:31.773620 IP 10.0.0.6.1883 > 10.0.0.8.45208: Flags [P.], seq 2060253169:2060253173, ack 3416071917, win 85, options [nop,nop,TS val 3793541173 ecr 1098246654], length 4
 00:00:31.817399 IP 10.0.0.8.45208 > 10.0.0.6.1883: Flags [.], ack 2060253173, win 83, options [nop,nop,TS val 1098246698 ecr 3793541173], length 0
 00:00:32.770752 IP 10.0.0.8.45208 > 10.0.0.6.1883: Flags [P.], seq 3416071917:3416072312, ack 2060253173, win 83, options [nop,nop,TS val 1098247652 ecr 3793541173], length 395
 00:00:32.771141 IP 10.0.0.6.1883 > 10.0.0.8.45208: Flags [P.], seq 2060253173:2060253177, ack 3416072312, win 85, options [nop,nop,TS val 3793542170 ecr 1098247652], length 4
 00:00:32.771653 IP 10.0.0.8.45208 > 10.0.0.6.1883: Flags [.], ack 2060253177, win 83, options [nop,nop,TS val 1098247653 ecr 3793542170], length 0
 00:00:32.771654 IP 10.0.0.8.45208 > 10.0.0.6.1883: Flags [P.], seq 3416072312:3416072316, ack 2060253177, win 83, options [nop,nop,TS val 1098247653 ecr 3793542170], length 4
 00:00:32.771850 IP 10.0.0.6.1883 > 10.0.0.8.45208: Flags [P.], seq 2060253177:2060253181, ack 3416072316, win 85, options [nop,nop,TS val 3793542171 ecr 1098247653], length 4
 00:00:32.813741 IP 10.0.0.8.45208 > 10.0.0.6.1883: Flags [.], ack 2060253181, win 83, options [nop,nop,TS val 1098247695 ecr 3793542171], length 0
 00:00:33.781706 IP 10.0.0.8.45208 > 10.0.0.6.1883: Flags [P.], seq 3416072316:3416072318, ack 2060253181, win 83, options [nop,nop,TS val 1098248663 ecr 3793542171], length 2
 00:00:33.781890 IP 10.0.0.6.1883 > 10.0.0.8.45208: Flags [P.], seq 2060253181:2060253183, ack 3416072318, win 85, options [nop,nop,TS val 3793543181 ecr 1098248663], length 2
 00:00:33.783682 IP 10.0.0.8.45208 > 10.0.0.6.1883: Flags [P.], seq 3416072318:3416072713, ack 2060253183, win 83, options [nop,nop,TS val 1098248664 ecr 3793543181], length 395
 00:00:33.784357 IP 10.0.0.6.1883 > 10.0.0.8.45208: Flags [P.], seq 2060253183:2060253187, ack 3416072713, win 85, options [nop,nop,TS val 3793543184 ecr 1098248664], length 4
 00:00:33.785089 IP 10.0.0.8.45208 > 10.0.0.6.1883: Flags [P.], seq 3416072713:3416072717, ack 2060253187, win 83, options [nop,nop,TS val 1098248666 ecr 3793543184], length 4
 00:00:33.785289 IP 10.0.0.6.1883 > 10.0.0.8.45208: Flags [P.], seq 2060253187:2060253191, ack 3416072717, win 85, options [nop,nop,TS val 3793543185 ecr 1098248666], length 4
 00:00:33.829478 IP 10.0.0.8.45208 > 10.0.0.6.1883: Flags [.], ack 2060253191, win 83, options [nop,nop,TS val 1098248710 ecr 3793543185], length 0
 00:00:34.782930 IP 10.0.0.8.45208 > 10.0.0.6.1883: Flags [P.], seq 3416072717:3416073112, ack 2060253191, win 83, options [nop,nop,TS val 1098249664 ecr 3793543185], length 395
 00:00:34.783444 IP 10.0.0.6.1883 > 10.0.0.8.45208: Flags [P.], seq 2060253191:2060253195, ack 3416073112, win 85, options [nop,nop,TS val 3793544182 ecr 1098249664], length 4
 00:00:34.784130 IP 10.0.0.8.45208 > 10.0.0.6.1883: Flags [.], ack 2060253195, win 83, options [nop,nop,TS val 1098249665 ecr 3793544182], length 0
 00:00:34.784346 IP 10.0.0.8.45208 > 10.0.0.6.1883: Flags [P.], seq 3416073112:3416073116, ack 2060253195, win 83, options [nop,nop,TS val 1098249665 ecr 3793544182], length 4
 00:00:34.784570 IP 10.0.0.6.1883 > 10.0.0.8.45208: Flags [P.], seq 2060253195:2060253199, ack 3416073116, win 85, options [nop,nop,TS val 3793544184 ecr 1098249665], length 4
 00:00:34.825754 IP 10.0.0.8.45208 > 10.0.0.6.1883: Flags [.], ack 2060253199, win 83, options [nop,nop,TS val 1098249707 ecr 3793544184], length 0
 00:00:35.784509 IP 10.0.0.8.45208 > 10.0.0.6.1883: Flags [P.], seq 3416073116:3416073511, ack 2060253199, win 83, options [nop,nop,TS val 1098250666 ecr 3793544184], length 395
 00:00:35.784711 IP 10.0.0.6.1883 > 10.0.0.8.45208: Flags [P.], seq 2060253199:2060253203, ack 3416073511, win 85, options [nop,nop,TS val 3793545184 ecr 1098250666], length 4
 00:00:35.785452 IP 10.0.0.8.45208 > 10.0.0.6.1883: Flags [.], ack 2060253203, win 83, options [nop,nop,TS val 1098250666 ecr 3793545184], length 0
 00:00:35.785585 IP 10.0.0.8.45208 > 10.0.0.6.1883: Flags [P.], seq 3416073511:3416073515, ack 2060253203, win 83, options [nop,nop,TS val 1098250666 ecr 3793545184], length 4
 00:00:35.785717 IP 10.0.0.6.1883 > 10.0.0.8.45208: Flags [P.], seq 2060253203:2060253207, ack 3416073515, win 85, options [nop,nop,TS val 3793545185 ecr 1098250666], length 4
 00:00:35.829489 IP 10.0.0.8.45208 > 10.0.0.6.1883: Flags [.], ack 2060253207, win 83, options [nop,nop,TS val 1098250710 ecr 3793545185], length 0
 00:00:36.798948 IP 10.0.0.8.45208 > 10.0.0.6.1883: Flags [P.], seq 3416073515:3416073910, ack 2060253207, win 83, options [nop,nop,TS val 1098251680 ecr 3793545185], length 395
 00:00:36.799715 IP 10.0.0.6.1883 > 10.0.0.8.45208: Flags [P.], seq 2060253207:2060253211, ack 3416073910, win 85, options [nop,nop,TS val 3793546199 ecr 1098251680], length 4
 00:00:36.800194 IP 10.0.0.8.45208 > 10.0.0.6.1883: Flags [.], ack 2060253211, win 83, options [nop,nop,TS val 1098251681 ecr 3793546199], length 0
 00:00:36.800196 IP 10.0.0.8.45208 > 10.0.0.6.1883: Flags [P.], seq 3416073910:3416073914, ack 2060253211, win 83, options [nop,nop,TS val 1098251681 ecr 3793546199], length 4
 00:00:36.800375 IP 10.0.0.6.1883 > 10.0.0.8.45208: Flags [P.], seq 2060253211:2060253215, ack 3416073914, win 85, options [nop,nop,TS val 3793546200 ecr 1098251681], length 4
 00:00:36.853785 IP 10.0.0.8.45208 > 10.0.0.6.1883: Flags [.], ack 2060253215, win 83, options [nop,nop,TS val 1098251735 ecr 3793546200], length 0
 00:00:37.799067 IP 10.0.0.8.45208 > 10.0.0.6.1883: Flags [P.], seq 3416073914:3416074309, ack 2060253215, win 83, options [nop,nop,TS val 1098252680 ecr 3793546200], length 395
 00:00:37.799288 IP 10.0.0.6.1883 > 10.0.0.8.45208: Flags [P.], seq 2060253215:2060253219, ack 3416074309, win 85, options [nop,nop,TS val 3793547198 ecr 1098252680], length 4
 00:00:37.799945 IP 10.0.0.8.45208 > 10.0.0.6.1883: Flags [.], ack 2060253219, win 83, options [nop,nop,TS val 1098252681 ecr 3793547198], length 0
 00:00:37.800019 IP 10.0.0.8.45208 > 10.0.0.6.1883: Flags [P.], seq 3416074309:3416074313, ack 2060253219, win 83, options [nop,nop,TS val 1098252681 ecr 3793547198], length 4
 00:00:37.800230 IP 10.0.0.6.1883 > 10.0.0.8.45208: Flags [P.], seq 2060253219:2060253223, ack 3416074313, win 85, options [nop,nop,TS val 3793547199 ecr 1098252681], length 4
 00:00:37.841733 IP 10.0.0.8.45208 > 10.0.0.6.1883: Flags [.], ack 2060253223, win 83, options [nop,nop,TS val 1098252723 ecr 3793547199], length 0
 00:00:38.790515 IP 10.0.0.8.45208 > 10.0.0.6.1883: Flags [P.], seq 3416074313:3416074315, ack 2060253223, win 83, options [nop,nop,TS val 1098253671 ecr 3793547199], length 2
 00:00:38.790773 IP 10.0.0.6.1883 > 10.0.0.8.45208: Flags [P.], seq 2060253223:2060253225, ack 3416074315, win 85, options [nop,nop,TS val 3793548190 ecr 1098253671], length 2
 00:00:38.791393 IP 10.0.0.8.45208 > 10.0.0.6.1883: Flags [.], ack 2060253225, win 83, options [nop,nop,TS val 1098253672 ecr 3793548190], length 0
 00:00:38.800416 IP 10.0.0.8.45208 > 10.0.0.6.1883: Flags [P.], seq 3416074315:3416074710, ack 2060253225, win 83, options [nop,nop,TS val 1098253681 ecr 3793548190], length 395
 00:00:38.800859 IP 10.0.0.6.1883 > 10.0.0.8.45208: Flags [P.], seq 2060253225:2060253229, ack 3416074710, win 85, options [nop,nop,TS val 3793548200 ecr 1098253681], length 4
 00:00:38.801659 IP 10.0.0.8.45208 > 10.0.0.6.1883: Flags [P.], seq 3416074710:3416074714, ack 2060253229, win 83, options [nop,nop,TS val 1098253683 ecr 3793548200], length 4
 00:00:38.802388 IP 10.0.0.6.1883 > 10.0.0.8.45208: Flags [P.], seq 2060253229:2060253233, ack 3416074714, win 85, options [nop,nop,TS val 3793548201 ecr 1098253683], length 4
 00:00:38.845413 IP 10.0.0.8.45208 > 10.0.0.6.1883: Flags [.], ack 2060253233, win 83, options [nop,nop,TS val 1098253726 ecr 3793548201], length 0
 00:00:39.804608 IP 10.0.0.8.45208 > 10.0.0.6.1883: Flags [P.], seq 3416074714:3416075109, ack 2060253233, win 83, options [nop,nop,TS val 1098254686 ecr 3793548201], length 395
 00:00:39.805290 IP 10.0.0.6.1883 > 10.0.0.8.45208: Flags [P.], seq 2060253233:2060253237, ack 3416075109, win 85, options [nop,nop,TS val 3793549205 ecr 1098254686], length 4
 00:00:39.806310 IP 10.0.0.8.45208 > 10.0.0.6.1883: Flags [.], ack 2060253237, win 83, options [nop,nop,TS val 1098254687 ecr 3793549205], length 0
 00:00:39.806354 IP 10.0.0.8.45208 > 10.0.0.6.1883: Flags [P.], seq 3416075109:3416075113, ack 2060253237, win 83, options [nop,nop,TS val 1098254687 ecr 3793549205], length 4
 00:00:39.806913 IP 10.0.0.6.1883 > 10.0.0.8.45208: Flags [P.], seq 2060253237:2060253241, ack 3416075113, win 85, options [nop,nop,TS val 3793549206 ecr 1098254687], length 4
 00:00:39.849497 IP 10.0.0.8.45208 > 10.0.0.6.1883: Flags [.], ack 2060253241, win 83, options [nop,nop,TS val 1098254731 ecr 3793549206], length 0
 00:00:40.814015 IP 10.0.0.8.45208 > 10.0.0.6.1883: Flags [P.], seq 3416075113:3416075508, ack 2060253241, win 83, options [nop,nop,TS val 1098255695 ecr 3793549206], length 395
 00:00:40.814724 IP 10.0.0.6.1883 > 10.0.0.8.45208: Flags [P.], seq 2060253241:2060253245, ack 3416075508, win 85, options [nop,nop,TS val 3793550214 ecr 1098255695], length 4
 00:00:40.815630 IP 10.0.0.8.45208 > 10.0.0.6.1883: Flags [.], ack 2060253245, win 83, options [nop,nop,TS val 1098255696 ecr 3793550214], length 0
 00:00:40.815640 IP 10.0.0.8.45208 > 10.0.0.6.1883: Flags [P.], seq 3416075508:3416075512, ack 2060253245, win 83, options [nop,nop,TS val 1098255697 ecr 3793550214], length 4
 00:00:40.815940 IP 10.0.0.6.1883 > 10.0.0.8.45208: Flags [P.], seq 2060253245:2060253249, ack 3416075512, win 85, options [nop,nop,TS val 3793550215 ecr 1098255697], length 4
