 00:00:00.000000 IP6 fe80::689b:35ff:fe93:9126 > ff02::2: ICMP6, router solicitation, length 16
 00:00:00.020736 IP6 fe80::4ca6:7aff:fe8a:184e > ff02::2: ICMP6, router solicitation, length 16
 00:00:00.499327 IP6 fe80::7432:87ff:fea2:c637 > ff02::2: ICMP6, router solicitation, length 16
 00:00:00.763684 IP6 fe80::b403:77ff:febd:ae44 > ff02::2: ICMP6, router solicitation, length 16
 00:00:01.245967 IP6 fe80::3c9f:2bff:fea8:a01c > ff02::2: ICMP6, router solicitation, length 16
 00:00:01.258675 IP6 fe80::9c4e:c1ff:fe8b:83fc > ff02::2: ICMP6, router solicitation, length 16
 00:00:02.306149 IP6 fe80::10a0:bcff:fedd:2a0f > ff02::2: ICMP6, router solicitation, length 16
 00:00:02.536298 IP6 fe80::c3d:8eff:fe25:1eda > ff02::2: ICMP6, router solicitation, length 16
 00:00:03.166703 ARP, Request who-has 10.0.0.6 tell 10.0.0.8, length 28
 00:00:03.168258 ARP, Reply 10.0.0.6 is-at 3e:9f:2b:a8:a0:1c, length 28
 00:00:03.194689 IP 10.0.0.8.45060 > 10.0.0.6.1883: Flags [S], seq 429226394, win 42340, options [mss 1460,sackOK,TS val 1097561382 ecr 0,nop,wscale 9], length 0
 00:00:03.195091 IP 10.0.0.6.1883 > 10.0.0.8.45060: Flags [S.], seq 320671082, ack 429226395, win 43440, options [mss 1460,sackOK,TS val 3792855950 ecr 1097561382,nop,wscale 9], length 0
 00:00:03.204134 IP 10.0.0.8.45060 > 10.0.0.6.1883: Flags [.], ack 320671083, win 83, options [nop,nop,TS val 1097561441 ecr 3792855950], length 0
 00:00:03.204275 IP 10.0.0.8.45060 > 10.0.0.6.1883: Flags [P.], seq 429226395:429226415, ack 320671083, win 83, options [nop,nop,TS val 1097561441 ecr 3792855950], length 20
 00:00:03.204362 IP 10.0.0.6.1883 > 10.0.0.8.45060: Flags [.], ack 429226415, win 85, options [nop,nop,TS val 3792855960 ecr 1097561441], length 0
 00:00:03.204729 IP 10.0.0.6.1883 > 10.0.0.8.45060: Flags [P.], seq 320671083:320671087, ack 429226415, win 85, options [nop,nop,TS val 3792855960 ecr 1097561441], length 4
 00:00:03.204991 IP 10.0.0.8.45060 > 10.0.0.6.1883: Flags [.], ack 320671087, win 83, options [nop,nop,TS val 1097561442 ecr 3792855960], length 0
 00:00:03.205315 IP 10.0.0.8.45060 > 10.0.0.6.1883: Flags [P.], seq 429226415:429226479, ack 320671087, win 83, options [nop,nop,TS val 1097561443 ecr 3792855960], length 64
 00:00:03.205870 IP 10.0.0.6.1883 > 10.0.0.8.45060: Flags [P.], seq 320671087:320671152, ack 429226479, win 85, options [nop,nop,TS val 3792855961 ecr 1097561443], length 65
 00:00:03.206197 IP 10.0.0.8.45060 > 10.0.0.6.1883: Flags [P.], seq 429226479:429226874, ack 320671152, win 83, options [nop,nop,TS val 1097561444 ecr 3792855961], length 395
 00:00:03.206296 IP 10.0.0.6.1883 > 10.0.0.8.45060: Flags [P.], seq 320671152:320671157, ack 429226874, win 85, options [nop,nop,TS val 3792855962 ecr 1097561444], length 5
 00:00:03.249129 IP 10.0.0.8.45060 > 10.0.0.6.1883: Flags [.], ack 320671157, win 83, options [nop,nop,TS val 1097561487 ecr 3792855962], length 0
 00:00:03.249171 IP 10.0.0.6.1883 > 10.0.0.8.45060: Flags [P.], seq 320671157:320671161, ack 429226874, win 85, options [nop,nop,TS val 3792856005 ecr 1097561487], length 4
 00:00:03.249384 IP 10.0.0.8.45060 > 10.0.0.6.1883: Flags [.], ack 320671161, win 83, options [nop,nop,TS val 1097561487 ecr 3792856005], length 0
 00:00:03.249912 IP 10.0.0.8.45060 > 10.0.0.6.1883: Flags [P.], seq 429226874:429226878, ack 320671161, win 83, options [nop,nop,TS val 1097561487 ecr 3792856005], length 4
 00:00:03.250366 IP 10.0.0.6.1883 > 10.0.0.8.45060: Flags [P.], seq 320671161:320671165, ack 429226878, win 85, options [nop,nop,TS val 3792856006 ecr 1097561487], length 4
 00:00:03.294150 IP 10.0.0.8.45060 > 10.0.0.6.1883: Flags [.], ack 320671165, win 83, options [nop,nop,TS val 1097561531 ecr 3792856006], length 0
 00:00:03.316657 IP6 fe80::fc5b:9cff:feb7:210b > ff02::2: ICMP6, router solicitation, length 16
 00:00:03.335732 IP6 fe80::b451:ebff:fe2c:297 > ff02::2: ICMP6, router solicitation, length 16
 00:00:04.151393 IP 10.0.0.8.45060 > 10.0.0.6.1883: Flags [P.], seq 429226878:429227273, ack 320671165, win 83, options [nop,nop,TS val 1097562388 ecr 3792856006], length 395
 00:00:04.152887 IP 10.0.0.6.1883 > 10.0.0.8.45060: Flags [P.], seq 320671165:320671169, ack 429227273, win 85, options [nop,nop,TS val 3792856908 ecr 1097562388], length 4
 00:00:04.153376 IP 10.0.0.8.45060 > 10.0.0.6.1883: Flags [.], ack 320671169, win 83, options [nop,nop,TS val 1097562391 ecr 3792856908], length 0
 00:00:04.154450 IP 10.0.0.8.45060 > 10.0.0.6.1883: Flags [P.], seq 429227273:429227277, ack 320671169, win 83, options [nop,nop,TS val 1097562391 ecr 3792856908], length 4
 00:00:04.155013 IP 10.0.0.6.1883 > 10.0.0.8.45060: Flags [P.], seq 320671169:320671173, ack 429227277, win 85, options [nop,nop,TS val 3792856910 ecr 1097562391], length 4
 00:00:04.201637 IP 10.0.0.8.45060 > 10.0.0.6.1883: Flags [.], ack 320671173, win 83, options [nop,nop,TS val 1097562435 ecr 3792856910], length 0
 00:00:05.184754 IP 10.0.0.8.45060 > 10.0.0.6.1883: Flags [P.], seq 429227277:429227672, ack 320671173, win 83, options [nop,nop,TS val 1097563422 ecr 3792856910], length 395
 00:00:05.185710 IP 10.0.0.6.1883 > 10.0.0.8.45060: Flags [P.], seq 320671173:320671177, ack 429227672, win 85, options [nop,nop,TS val 3792857941 ecr 1097563422], length 4
 00:00:05.185908 IP 10.0.0.8.45060 > 10.0.0.6.1883: Flags [.], ack 320671177, win 83, options [nop,nop,TS val 1097563423 ecr 3792857941], length 0
 00:00:05.186718 IP 10.0.0.8.45060 > 10.0.0.6.1883: Flags [P.], seq 429227672:429227676, ack 320671177, win 83, options [nop,nop,TS val 1097563424 ecr 3792857941], length 4
 00:00:05.186989 IP 10.0.0.6.1883 > 10.0.0.8.45060: Flags [P.], seq 320671177:320671181, ack 429227676, win 85, options [nop,nop,TS val 3792857942 ecr 1097563424], length 4
 00:00:05.343327 IP 10.0.0.8.45060 > 10.0.0.6.1883: Flags [.], ack 320671181, win 83, options [nop,nop,TS val 1097563467 ecr 3792857942], length 0
 00:00:05.375519 IP6 fe80::a0df:fbff:feee:3c85 > ff02::2: ICMP6, router solicitation, length 16
 00:00:05.400095 IP6 fe80::58e6:40ff:fec8:6824 > ff02::2: ICMP6, router solicitation, length 16
 00:00:05.403194 IP6 fe80::9cef:21ff:fe5f:287e > ff02::2: ICMP6, router solicitation, length 16
 00:00:06.186664 IP 10.0.0.8.45060 > 10.0.0.6.1883: Flags [P.], seq 429227676:429228071, ack 320671181, win 83, options [nop,nop,TS val 1097564424 ecr 3792857942], length 395
 00:00:06.187545 IP 10.0.0.6.1883 > 10.0.0.8.45060: Flags [P.], seq 320671181:320671185, ack 429228071, win 85, options [nop,nop,TS val 3792858943 ecr 1097564424], length 4
 00:00:06.343795 IP 10.0.0.8.45060 > 10.0.0.6.1883: Flags [.], ack 320671185, win 83, options [nop,nop,TS val 1097564581 ecr 3792858943], length 0
 00:00:06.344147 IP 10.0.0.8.45060 > 10.0.0.6.1883: Flags [P.], seq 429228071:429228075, ack 320671185, win 83, options [nop,nop,TS val 1097564581 ecr 3792858943], length 4
 00:00:06.344938 IP 10.0.0.6.1883 > 10.0.0.8.45060: Flags [P.], seq 320671185:320671189, ack 429228075, win 85, options [nop,nop,TS val 3792859100 ecr 1097564581], length 4
 00:00:06.397371 IP 10.0.0.8.45060 > 10.0.0.6.1883: Flags [.], ack 320671189, win 83, options [nop,nop,TS val 1097564635 ecr 3792859100], length 0
 00:00:07.422436 IP6 fe80::1c81:cbff:fe13:ee5d > ff02::2: ICMP6, router solicitation, length 16
 00:00:07.424623 IP 10.0.0.8.45060 > 10.0.0.6.1883: Flags [P.], seq 429228075:429228470, ack 320671189, win 83, options [nop,nop,TS val 1097565660 ecr 3792859100], length 395
 00:00:07.425344 IP 10.0.0.6.1883 > 10.0.0.8.45060: Flags [P.], seq 320671189:320671193, ack 429228470, win 85, options [nop,nop,TS val 3792860181 ecr 1097565660], length 4
 00:00:07.429511 IP 10.0.0.8.45060 > 10.0.0.6.1883: Flags [.], ack 320671193, win 83, options [nop,nop,TS val 1097565667 ecr 3792860181], length 0
 00:00:07.430115 IP 10.0.0.8.45060 > 10.0.0.6.1883: Flags [P.], seq 429228470:429228474, ack 320671193, win 83, options [nop,nop,TS val 1097565667 ecr 3792860181], length 4
 00:00:07.430959 IP 10.0.0.6.1883 > 10.0.0.8.45060: Flags [P.], seq 320671193:320671197, ack 429228474, win 85, options [nop,nop,TS val 3792860186 ecr 1097565667], length 4
 00:00:07.676989 IP 10.0.0.8.45060 > 10.0.0.6.1883: Flags [.], ack 320671197, win 83, options [nop,nop,TS val 1097565863 ecr 3792860186], length 0
 00:00:08.416058 IP 10.0.0.8.45060 > 10.0.0.6.1883: Flags [P.], seq 429228474:429228476, ack 320671197, win 83, options [nop,nop,TS val 1097566652 ecr 3792860186], length 2
 00:00:08.418038 IP 10.0.0.6.1883 > 10.0.0.8.45060: Flags [P.], seq 320671197:320671199, ack 429228476, win 85, options [nop,nop,TS val 3792861172 ecr 1097566652], length 2
 00:00:08.420777 IP 10.0.0.8.45060 > 10.0.0.6.1883: Flags [.], ack 320671199, win 83, options [nop,nop,TS val 1097566657 ecr 3792861172], length 0
 00:00:08.425599 IP 10.0.0.8.45060 > 10.0.0.6.1883: Flags [P.], seq 429228476:429228871, ack 320671199, win 83, options [nop,nop,TS val 1097566662 ecr 3792861172], length 395
 00:00:08.426191 IP 10.0.0.6.1883 > 10.0.0.8.45060: Flags [P.], seq 320671199:320671203, ack 429228871, win 85, options [nop,nop,TS val 3792861182 ecr 1097566662], length 4
 00:00:08.426681 IP 10.0.0.8.45060 > 10.0.0.6.1883: Flags [P.], seq 429228871:429228875, ack 320671203, win 83, options [nop,nop,TS val 1097566664 ecr 3792861182], length 4
 00:00:08.426774 IP 10.0.0.6.1883 > 10.0.0.8.45060: Flags [P.], seq 320671203:320671207, ack 429228875, win 85, options [nop,nop,TS val 3792861182 ecr 1097566664], length 4
 00:00:08.733401 IP 10.0.0.8.45060 > 10.0.0.6.1883: Flags [.], ack 320671207, win 83, options [nop,nop,TS val 1097566896 ecr 3792861182], length 0
 00:00:09.496907 IP 10.0.0.8.45060 > 10.0.0.6.1883: Flags [P.], seq 429228875:429229270, ack 320671207, win 83, options [nop,nop,TS val 1097567734 ecr 3792861182], length 395
 00:00:09.497604 IP 10.0.0.6.1883 > 10.0.0.8.45060: Flags [P.], seq 320671207:320671211, ack 429229270, win 85, options [nop,nop,TS val 3792862253 ecr 1097567734], length 4
 00:00:09.498806 IP 10.0.0.8.45060 > 10.0.0.6.1883: Flags [.], ack 320671211, win 83, options [nop,nop,TS val 1097567736 ecr 3792862253], length 0
 00:00:09.498863 IP 10.0.0.8.45060 > 10.0.0.6.1883: Flags [P.], seq 429229270:429229274, ack 320671211, win 83, options [nop,nop,TS val 1097567736 ecr 3792862253], length 4
 00:00:09.499124 IP 10.0.0.6.1883 > 10.0.0.8.45060: Flags [P.], seq 320671211:320671215, ack 429229274, win 85, options [nop,nop,TS val 3792862255 ecr 1097567736], length 4
 00:00:09.677078 IP 10.0.0.8.45060 > 10.0.0.6.1883: Flags [.], ack 320671215, win 83, options [nop,nop,TS val 1097567914 ecr 3792862255], length 0
 00:00:10.680343 IP 10.0.0.8.45060 > 10.0.0.6.1883: Flags [P.], seq 429229274:429229669, ack 320671215, win 83, options [nop,nop,TS val 1097568916 ecr 3792862255], length 395
 00:00:10.681460 IP 10.0.0.6.1883 > 10.0.0.8.45060: Flags [P.], seq 320671215:320671219, ack 429229669, win 85, options [nop,nop,TS val 3792863437 ecr 1097568916], length 4
 00:00:10.681748 IP 10.0.0.8.45060 > 10.0.0.6.1883: Flags [.], ack 320671219, win 83, options [nop,nop,TS val 1097568919 ecr 3792863437], length 0
 00:00:10.682017 IP 10.0.0.8.45060 > 10.0.0.6.1883: Flags [P.], seq 429229669:429229673, ack 320671219, win 83, options [nop,nop,TS val 1097568919 ecr 3792863437], length 4
 00:00:10.682111 IP 10.0.0.6.1883 > 10.0.0.8.45060: Flags [P.], seq 320671219:320671223, ack 429229673, win 85, options [nop,nop,TS val 3792863438 ecr 1097568919], length 4
 00:00:10.730620 IP 10.0.0.8.45060 > 10.0.0.6.1883: Flags [.], ack 320671223, win 83, options [nop,nop,TS val 1097568967 ecr 3792863438], length 0
 00:00:11.684930 IP 10.0.0.8.45060 > 10.0.0.6.1883: Flags [P.], seq 429229673:429230068, ack 320671223, win 83, options [nop,nop,TS val 1097569921 ecr 3792863438], length 395
 00:00:11.687051 IP 10.0.0.6.1883 > 10.0.0.8.45060: Flags [P.], seq 320671223:320671227, ack 429230068, win 85, options [nop,nop,TS val 3792864441 ecr 1097569921], length 4
 00:00:11.688683 IP 10.0.0.8.45060 > 10.0.0.6.1883: Flags [.], ack 320671227, win 83, options [nop,nop,TS val 1097569926 ecr 3792864441], length 0
 00:00:11.689300 IP 10.0.0.8.45060 > 10.0.0.6.1883: Flags [P.], seq 429230068:429230072, ack 320671227, win 83, options [nop,nop,TS val 1097569926 ecr 3792864441], length 4
 00:00:11.689572 IP 10.0.0.6.1883 > 10.0.0.8.45060: Flags [P.], seq 320671227:320671231, ack 429230072, win 85, options [nop,nop,TS val 3792864445 ecr 1097569926], length 4
 00:00:11.733246 IP 10.0.0.8.45060 > 10.0.0.6.1883: Flags [.], ack 320671231, win 83, options [nop,nop,TS val 1097569970 ecr 3792864445], length 0
 00:00:12.685921 IP 10.0.0.8.45060 > 10.0.0.6.1883: Flags [P.], seq 429230072:429230467, ack 320671231, win 83, options [nop,nop,TS val 1097570922 ecr 3792864445], length 395
 00:00:12.687500 IP 10.0.0.6.1883 > 10.0.0.8.45060: Flags [P.], seq 320671231:320671235, ack 429230467, win 85, options [nop,nop,TS val 3792865442 ecr 1097570922], length 4
 00:00:12.688409 IP 10.0.0.8.45060 > 10.0.0.6.1883: Flags [.], ack 320671235, win 83, options [nop,nop,TS val 1097570925 ecr 3792865442], length 0
 00:00:12.688557 IP 10.0.0.8.45060 > 10.0.0.6.1883: Flags [P.], seq 429230467:429230471, ack 320671235, win 83, options [nop,nop,TS val 1097570926 ecr 3792865442], length 4
 00:00:12.688779 IP 10.0.0.6.1883 > 10.0.0.8.45060: Flags [P.], seq 320671235:320671239, ack 429230471, win 85, options [nop,nop,TS val 3792865444 ecr 1097570926], length 4
 00:00:12.733367 IP 10.0.0.8.45060 > 10.0.0.6.1883: Flags [.], ack 320671239, win 83, options [nop,nop,TS val 1097570971 ecr 3792865444], length 0
 00:00:13.416796 IP 10.0.0.8.45060 > 10.0.0.6.1883: Flags [P.], seq 429230471:429230473, ack 320671239, win 83, options [nop,nop,TS val 1097571654 ecr 3792865444], length 2
 00:00:13.417182 IP 10.0.0.6.1883 > 10.0.0.8.45060: Flags [P.], seq 320671239:320671241, ack 429230473, win 85, options [nop,nop,TS val 3792866173 ecr 1097571654], length 2
 00:00:13.417740 IP 10.0.0.8.45060 > 10.0.0.6.1883: Flags [.], ack 320671241, win 83, options [nop,nop,TS val 1097571655 ecr 3792866173], length 0
 00:00:13.685956 IP 10.0.0.8.45060 > 10.0.0.6.1883: Flags [P.], seq 429230473:429230868, ack 320671241, win 83, options [nop,nop,TS val 1097571923 ecr 3792866173], length 395
 00:00:13.686535 IP 10.0.0.6.1883 > 10.0.0.8.45060: Flags [P.], seq 320671241:320671245, ack 429230868, win 85, options [nop,nop,TS val 3792866442 ecr 1097571923], length 4
 00:00:13.687237 IP 10.0.0.8.45060 > 10.0.0.6.1883: Flags [.], ack 320671245, win 83, options [nop,nop,TS val 1097571924 ecr 3792866442], length 0
 00:00:13.687488 IP 10.0.0.8.45060 > 10.0.0.6.1883: Flags [P.], seq 429230868:429230872, ack 320671245, win 83, options [nop,nop,TS val 1097571924 ecr 3792866442], length 4
 00:00:13.688054 IP 10.0.0.6.1883 > 10.0.0.8.45060: Flags [P.], seq 320671245:320671249, ack 429230872, win 85, options [nop,nop,TS val 3792866444 ecr 1097571924], length 4
 00:00:13.729124 IP 10.0.0.8.45060 > 10.0.0.6.1883: Flags [.], ack 320671249, win 83, options [nop,nop,TS val 1097571966 ecr 3792866444], length 0
 00:00:14.688530 IP 10.0.0.8.45060 > 10.0.0.6.1883: Flags [P.], seq 429230872:429231267, ack 320671249, win 83, options [nop,nop,TS val 1097572925 ecr 3792866444], length 395
 00:00:14.689880 IP 10.0.0.6.1883 > 10.0.0.8.45060: Flags [P.], seq 320671249:320671253, ack 429231267, win 85, options [nop,nop,TS val 3792867445 ecr 1097572925], length 4
 00:00:14.691778 IP 10.0.0.8.45060 > 10.0.0.6.1883: Flags [.], ack 320671253, win 83, options [nop,nop,TS val 1097572928 ecr 3792867445], length 0
 00:00:14.691993 IP 10.0.0.8.45060 > 10.0.0.6.1883: Flags [P.], seq 429231267:429231271, ack 320671253, win 83, options [nop,nop,TS val 1097572928 ecr 3792867445], length 4
 00:00:14.692411 IP 10.0.0.6.1883 > 10.0.0.8.45060: Flags [P.], seq 320671253:320671257, ack 429231271, win 85, options [nop,nop,TS val 3792867448 ecr 1097572928], length 4
 00:00:14.733384 IP 10.0.0.8.45060 > 10.0.0.6.1883: Flags [.], ack 320671257, win 83, options [nop,nop,TS val 1097572971 ecr 3792867448], length 0
 00:00:15.692132 IP 10.0.0.8.45060 > 10.0.0.6.1883: Flags [P.], seq 429231271:429231666, ack 320671257, win 83, options [nop,nop,TS val 1097573927 ecr 3792867448], length 395
 00:00:15.693421 IP 10.0.0.6.1883 > 10.0.0.8.45060: Flags [P.], seq 320671257:320671261, ack 429231666, win 85, options [nop,nop,TS val 3792868449 ecr 1097573927], length 4
 00:00:15.694581 IP 10.0.0.8.45060 > 10.0.0.6.1883: Flags [.], ack 320671261, win 83, options [nop,nop,TS val 1097573931 ecr 3792868449], length 0
 00:00:15.695229 IP 10.0.0.8.45060 > 10.0.0.6.1883: Flags [P.], seq 429231666:429231670, ack 320671261, win 83, options [nop,nop,TS val 1097573932 ecr 3792868449], length 4
 00:00:15.695999 IP 10.0.0.6.1883 > 10.0.0.8.45060: Flags [P.], seq 320671261:320671265, ack 429231670, win 85, options [nop,nop,TS val 3792868451 ecr 1097573932], length 4
 00:00:15.741175 IP 10.0.0.8.45060 > 10.0.0.6.1883: Flags [.], ack 320671265, win 83, options [nop,nop,TS val 1097573978 ecr 3792868451], length 0
 00:00:16.693447 IP 10.0.0.8.45060 > 10.0.0.6.1883: Flags [P.], seq 429231670:429232065, ack 320671265, win 83, options [nop,nop,TS val 1097574931 ecr 3792868451], length 395
 00:00:16.694178 IP 10.0.0.6.1883 > 10.0.0.8.45060: Flags [P.], seq 320671265:320671269, ack 429232065, win 85, options [nop,nop,TS val 3792869450 ecr 1097574931], length 4
 00:00:16.695546 IP 10.0.0.8.45060 > 10.0.0.6.1883: Flags [.], ack 320671269, win 83, options [nop,nop,TS val 1097574932 ecr 3792869450], length 0
 00:00:16.695738 IP 10.0.0.8.45060 > 10.0.0.6.1883: Flags [P.], seq 429232065:429232069, ack 320671269, win 83, options [nop,nop,TS val 1097574932 ecr 3792869450], length 4
 00:00:16.696379 IP 10.0.0.6.1883 > 10.0.0.8.45060: Flags [P.], seq 320671269:320671273, ack 429232069, win 85, options [nop,nop,TS val 3792869452 ecr 1097574932], length 4
 00:00:16.737335 IP 10.0.0.8.45060 > 10.0.0.6.1883: Flags [.], ack 320671273, win 83, options [nop,nop,TS val 1097574975 ecr 3792869452], length 0
 00:00:17.694401 IP 10.0.0.8.45060 > 10.0.0.6.1883: Flags [P.], seq 429232069:429232464, ack 320671273, win 83, options [nop,nop,TS val 1097575931 ecr 3792869452], length 395
 00:00:17.695190 IP 10.0.0.6.1883 > 10.0.0.8.45060: Flags [P.], seq 320671273:320671277, ack 429232464, win 85, options [nop,nop,TS val 3792870451 ecr 1097575931], length 4
 00:00:17.696143 IP 10.0.0.8.45060 > 10.0.0.6.1883: Flags [.], ack 320671277, win 83, options [nop,nop,TS val 1097575933 ecr 3792870451], length 0
 00:00:17.696244 IP 10.0.0.8.45060 > 10.0.0.6.1883: Flags [P.], seq 429232464:429232468, ack 320671277, win 83, options [nop,nop,TS val 1097575933 ecr 3792870451], length 4
 00:00:17.696494 IP 10.0.0.6.1883 > 10.0.0.8.45060: Flags [P.], seq 320671277:320671281, ack 429232468, win 85, options [nop,nop,TS val 3792870452 ecr 1097575933], length 4
 00:00:17.741212 IP 10.0.0.8.45060 > 10.0.0.6.1883: Flags [.], ack 320671281, win 83, options [nop,nop,TS val 1097575978 ecr 3792870452], length 0
 00:00:18.419379 IP 10.0.0.8.45060 > 10.0.0.6.1883: Flags [P.], seq 429232468:429232470, ack 320671281, win 83, options [nop,nop,TS val 1097576656 ecr 3792870452], length 2
 00:00:18.419729 IP 10.0.0.6.1883 > 10.0.0.8.45060: Flags [P.], seq 320671281:320671283, ack 429232470, win 85, options [nop,nop,TS val 3792871175 ecr 1097576656], length 2
 00:00:18.421157 IP 10.0.0.8.45060 > 10.0.0.6.1883: Flags [.], ack 320671283, win 83, options [nop,nop,TS val 1097576658 ecr 3792871175], length 0
 00:00:18.695774 IP 10.0.0.8.45060 > 10.0.0.6.1883: Flags [P.], seq 429232470:429232865, ack 320671283, win 83, options [nop,nop,TS val 1097576933 ecr 3792871175], length 395
 00:00:18.696776 IP 10.0.0.6.1883 > 10.0.0.8.45060: Flags [P.], seq 320671283:320671287, ack 429232865, win 85, options [nop,nop,TS val 3792871452 ecr 1097576933], length 4
 00:00:18.698296 IP 10.0.0.8.45060 > 10.0.0.6.1883: Flags [.], ack 320671287, win 83, options [nop,nop,TS val 1097576935 ecr 3792871452], length 0
 00:00:18.698389 IP 10.0.0.8.45060 > 10.0.0.6.1883: Flags [P.], seq 429232865:429232869, ack 320671287, win 83, options [nop,nop,TS val 1097576935 ecr 3792871452], length 4
 00:00:18.698927 IP 10.0.0.6.1883 > 10.0.0.8.45060: Flags [P.], seq 320671287:320671291, ack 429232869, win 85, options [nop,nop,TS val 3792871454 ecr 1097576935], length 4
 00:00:18.744525 IP 10.0.0.8.45060 > 10.0.0.6.1883: Flags [.], ack 320671291, win 83, options [nop,nop,TS val 1097576982 ecr 3792871454], length 0
 00:00:19.697665 IP 10.0.0.8.45060 > 10.0.0.6.1883: Flags [P.], seq 429232869:429233264, ack 320671291, win 83, options [nop,nop,TS val 1097577935 ecr 3792871454], length 395
 00:00:19.698355 IP 10.0.0.6.1883 > 10.0.0.8.45060: Flags [P.], seq 320671291:320671295, ack 429233264, win 85, options [nop,nop,TS val 3792872454 ecr 1097577935], length 4
 00:00:19.699172 IP 10.0.0.8.45060 > 10.0.0.6.1883: Flags [.], ack 320671295, win 83, options [nop,nop,TS val 1097577936 ecr 3792872454], length 0
 00:00:19.699714 IP 10.0.0.8.45060 > 10.0.0.6.1883: Flags [P.], seq 429233264:429233268, ack 320671295, win 83, options [nop,nop,TS val 1097577936 ecr 3792872454], length 4
 00:00:19.700721 IP 10.0.0.6.1883 > 10.0.0.8.45060: Flags [P.], seq 320671295:320671299, ack 429233268, win 85, options [nop,nop,TS val 3792872456 ecr 1097577936], length 4
 00:00:19.745267 IP 10.0.0.8.45060 > 10.0.0.6.1883: Flags [.], ack 320671299, win 83, options [nop,nop,TS val 1097577983 ecr 3792872456], length 0
 00:00:20.698258 IP 10.0.0.8.45060 > 10.0.0.6.1883: Flags [P.], seq 429233268:429233663, ack 320671299, win 83, options [nop,nop,TS val 1097578935 ecr 3792872456], length 395
 00:00:20.699255 IP 10.0.0.6.1883 > 10.0.0.8.45060: Flags [P.], seq 320671299:320671303, ack 429233663, win 85, options [nop,nop,TS val 3792873455 ecr 1097578935], length 4
 00:00:20.700638 IP 10.0.0.8.45060 > 10.0.0.6.1883: Flags [.], ack 320671303, win 83, options [nop,nop,TS val 1097578937 ecr 3792873455], length 0
 00:00:20.701088 IP 10.0.0.8.45060 > 10.0.0.6.1883: Flags [P.], seq 429233663:429233667, ack 320671303, win 83, options [nop,nop,TS val 1097578938 ecr 3792873455], length 4
 00:00:20.701510 IP 10.0.0.6.1883 > 10.0.0.8.45060: Flags [P.], seq 320671303:320671307, ack 429233667, win 85, options [nop,nop,TS val 3792873457 ecr 1097578938], length 4
 00:00:20.745579 IP 10.0.0.8.45060 > 10.0.0.6.1883: Flags [.], ack 320671307, win 83, options [nop,nop,TS val 1097578983 ecr 3792873457], length 0
 00:00:21.699952 IP 10.0.0.8.45060 > 10.0.0.6.1883: Flags [P.], seq 429233667:429234062, ack 320671307, win 83, options [nop,nop,TS val 1097579937 ecr 3792873457], length 395
 00:00:21.701145 IP 10.0.0.6.1883 > 10.0.0.8.45060: Flags [P.], seq 320671307:320671311, ack 429234062, win 85, options [nop,nop,TS val 3792874456 ecr 1097579937], length 4
 00:00:21.702743 IP 10.0.0.8.45060 > 10.0.0.6.1883: Flags [.], ack 320671311, win 83, options [nop,nop,TS val 1097579940 ecr 3792874456], length 0
 00:00:21.703440 IP 10.0.0.8.45060 > 10.0.0.6.1883: Flags [P.], seq 429234062:429234066, ack 320671311, win 83, options [nop,nop,TS val 1097579940 ecr 3792874456], length 4
 00:00:21.703530 IP 10.0.0.6.1883 > 10.0.0.8.45060: Flags [P.], seq 320671311:320671315, ack 429234066, win 85, options [nop,nop,TS val 3792874459 ecr 1097579940], length 4
 00:00:21.745172 IP 10.0.0.8.45060 > 10.0.0.6.1883: Flags [.], ack 320671315, win 83, options [nop,nop,TS val 1097579983 ecr 3792874459], length 0
 00:00:22.701462 IP 10.0.0.8.45060 > 10.0.0.6.1883: Flags [P.], seq 429234066:429234461, ack 320671315, win 83, options [nop,nop,TS val 1097580938 ecr 3792874459], length 395
 00:00:22.702575 IP 10.0.0.6.1883 > 10.0.0.8.45060: Flags [P.], seq 320671315:320671319, ack 429234461, win 85, options [nop,nop,TS val 3792875458 ecr 1097580938], length 4
 00:00:22.703409 IP 10.0.0.8.45060 > 10.0.0.6.1883: Flags [.], ack 320671319, win 83, options [nop,nop,TS val 1097580940 ecr 3792875458], length 0
 00:00:22.703534 IP 10.0.0.8.45060 > 10.0.0.6.1883: Flags [P.], seq 429234461:429234465, ack 320671319, win 83, options [nop,nop,TS val 1097580941 ecr 3792875458], length 4
 00:00:22.704354 IP 10.0.0.6.1883 > 10.0.0.8.45060: Flags [P.], seq 320671319:320671323, ack 429234465, win 85, options [nop,nop,TS val 3792875459 ecr 1097580941], length 4
 00:00:22.745458 IP 10.0.0.8.45060 > 10.0.0.6.1883: Flags [.], ack 320671323, win 83, options [nop,nop,TS val 1097580983 ecr 3792875459], length 0
 00:00:23.420457 IP 10.0.0.8.45060 > 10.0.0.6.1883: Flags [P.], seq 429234465:429234467, ack 320671323, win 83, options [nop,nop,TS val 1097581658 ecr 3792875459], length 2
 00:00:23.420785 IP 10.0.0.6.1883 > 10.0.0.8.45060: Flags [P.], seq 320671323:320671325, ack 429234467, win 85, options [nop,nop,TS val 3792876176 ecr 1097581658], length 2
 00:00:23.421662 IP 10.0.0.8.45060 > 10.0.0.6.1883: Flags [.], ack 320671325, win 83, options [nop,nop,TS val 1097581659 ecr 3792876176], length 0
 00:00:23.701923 IP 10.0.0.8.45060 > 10.0.0.6.1883: Flags [P.], seq 429234467:429234862, ack 320671325, win 83, options [nop,nop,TS val 1097581939 ecr 3792876176], length 395
 00:00:23.702535 IP 10.0.0.6.1883 > 10.0.0.8.45060: Flags [P.], seq 320671325:320671329, ack 429234862, win 85, options [nop,nop,TS val 3792876458 ecr 1097581939], length 4
 00:00:23.703502 IP 10.0.0.8.45060 > 10.0.0.6.1883: Flags [.], ack 320671329, win 83, options [nop,nop,TS val 1097581940 ecr 3792876458], length 0
 00:00:23.703662 IP 10.0.0.8.45060 > 10.0.0.6.1883: Flags [P.], seq 429234862:429234866, ack 320671329, win 83, options [nop,nop,TS val 1097581941 ecr 3792876458], length 4
 00:00:23.704200 IP 10.0.0.6.1883 > 10.0.0.8.45060: Flags [P.], seq 320671329:320671333, ack 429234866, win 85, options [nop,nop,TS val 3792876460 ecr 1097581941], length 4
 00:00:23.745159 IP 10.0.0.8.45060 > 10.0.0.6.1883: Flags [.], ack 320671333, win 83, options [nop,nop,TS val 1097581982 ecr 3792876460], length 0
 00:00:24.703419 IP 10.0.0.8.45060 > 10.0.0.6.1883: Flags [P.], seq 429234866:429235261, ack 320671333, win 83, options [nop,nop,TS val 1097582940 ecr 3792876460], length 395
 00:00:24.704305 IP 10.0.0.6.1883 > 10.0.0.8.45060: Flags [P.], seq 320671333:320671337, ack 429235261, win 85, options [nop,nop,TS val 3792877460 ecr 1097582940], length 4
 00:00:24.705737 IP 10.0.0.8.45060 > 10.0.0.6.1883: Flags [.], ack 320671337, win 83, options [nop,nop,TS val 1097582942 ecr 3792877460], length 0
 00:00:24.705793 IP 10.0.0.8.45060 > 10.0.0.6.1883: Flags [P.], seq 429235261:429235265, ack 320671337, win 83, options [nop,nop,TS val 1097582942 ecr 3792877460], length 4
 00:00:24.706753 IP 10.0.0.6.1883 > 10.0.0.8.45060: Flags [P.], seq 320671337:320671341, ack 429235265, win 85, options [nop,nop,TS val 3792877462 ecr 1097582942], length 4
 00:00:24.749284 IP 10.0.0.8.45060 > 10.0.0.6.1883: Flags [.], ack 320671341, win 83, options [nop,nop,TS val 1097582987 ecr 3792877462], length 0
 00:00:25.706195 IP 10.0.0.8.45060 > 10.0.0.6.1883: Flags [P.], seq 429235265:429235660, ack 320671341, win 83, options [nop,nop,TS val 1097583942 ecr 3792877462], length 395
 00:00:25.706946 IP 10.0.0.6.1883 > 10.0.0.8.45060: Flags [P.], seq 320671341:320671345, ack 429235660, win 85, options [nop,nop,TS val 3792878462 ecr 1097583942], length 4
 00:00:25.708798 IP 10.0.0.8.45060 > 10.0.0.6.1883: Flags [.], ack 320671345, win 83, options [nop,nop,TS val 1097583945 ecr 3792878462], length 0
 00:00:25.709006 IP 10.0.0.8.45060 > 10.0.0.6.1883: Flags [P.], seq 429235660:429235664, ack 320671345, win 83, options [nop,nop,TS val 1097583945 ecr 3792878462], length 4
 00:00:25.709321 IP 10.0.0.6.1883 > 10.0.0.8.45060: Flags [P.], seq 320671345:320671349, ack 429235664, win 85, options [nop,nop,TS val 3792878465 ecr 1097583945], length 4
 00:00:25.838187 IP 10.0.0.8.45060 > 10.0.0.6.1883: Flags [.], ack 320671349, win 83, options [nop,nop,TS val 1097584059 ecr 3792878465], length 0
 00:00:26.707904 IP 10.0.0.8.45060 > 10.0.0.6.1883: Flags [P.], seq 429235664:429236059, ack 320671349, win 83, options [nop,nop,TS val 1097584944 ecr 3792878465], length 395
 00:00:26.708615 IP 10.0.0.6.1883 > 10.0.0.8.45060: Flags [P.], seq 320671349:320671353, ack 429236059, win 85, options [nop,nop,TS val 3792879464 ecr 1097584944], length 4
 00:00:26.709547 IP 10.0.0.8.45060 > 10.0.0.6.1883: Flags [.], ack 320671353, win 83, options [nop,nop,TS val 1097584946 ecr 3792879464], length 0
 00:00:26.710485 IP 10.0.0.8.45060 > 10.0.0.6.1883: Flags [P.], seq 429236059:429236063, ack 320671353, win 83, options [nop,nop,TS val 1097584947 ecr 3792879464], length 4
 00:00:26.710826 IP 10.0.0.6.1883 > 10.0.0.8.45060: Flags [P.], seq 320671353:320671357, ack 429236063, win 85, options [nop,nop,TS val 3792879466 ecr 1097584947], length 4
 00:00:26.910832 IP 10.0.0.8.45060 > 10.0.0.6.1883: Flags [.], ack 320671357, win 83, options [nop,nop,TS val 1097585012 ecr 3792879466], length 0
 00:00:27.723166 IP 10.0.0.8.45060 > 10.0.0.6.1883: Flags [P.], seq 429236063:429236458, ack 320671357, win 83, options [nop,nop,TS val 1097585960 ecr 3792879466], length 395
 00:00:27.723827 IP 10.0.0.6.1883 > 10.0.0.8.45060: Flags [P.], seq 320671357:320671361, ack 429236458, win 85, options [nop,nop,TS val 3792880479 ecr 1097585960], length 4
 00:00:27.724490 IP 10.0.0.8.45060 > 10.0.0.6.1883: Flags [.], ack 320671361, win 83, options [nop,nop,TS val 1097585962 ecr 3792880479], length 0
 00:00:27.724592 IP 10.0.0.8.45060 > 10.0.0.6.1883: Flags [P.], seq 429236458:429236462, ack 320671361, win 83, options [nop,nop,TS val 1097585962 ecr 3792880479], length 4
 00:00:27.724927 IP 10.0.0.6.1883 > 10.0.0.8.45060: Flags [P.], seq 320671361:320671365, ack 429236462, win 85, options [nop,nop,TS val 3792880480 ecr 1097585962], length 4
 00:00:27.914367 IP 10.0.0.8.45060 > 10.0.0.6.1883: Flags [.], ack 320671365, win 83, options [nop,nop,TS val 1097586072 ecr 3792880480], length 0
 00:00:28.728214 IP 10.0.0.8.45060 > 10.0.0.6.1883: Flags [P.], seq 429236462:429236857, ack 320671365, win 83, options [nop,nop,TS val 1097586962 ecr 3792880480], length 395
 00:00:28.729132 IP 10.0.0.6.1883 > 10.0.0.8.45060: Flags [P.], seq 320671365:320671369, ack 429236857, win 85, options [nop,nop,TS val 3792881485 ecr 1097586962], length 4
 00:00:28.732799 IP 10.0.0.8.45060 > 10.0.0.6.1883: Flags [P.], seq 429236857:429236859, ack 320671369, win 83, options [nop,nop,TS val 1097586970 ecr 3792881485], length 2
 00:00:28.733358 IP 10.0.0.6.1883 > 10.0.0.8.45060: Flags [P.], seq 320671369:320671371, ack 429236859, win 85, options [nop,nop,TS val 3792881489 ecr 1097586970], length 2
 00:00:28.733845 IP 10.0.0.8.45060 > 10.0.0.6.1883: Flags [P.], seq 429236859:429236863, ack 320671371, win 83, options [nop,nop,TS val 1097586971 ecr 3792881489], length 4
 00:00:28.733965 IP 10.0.0.6.1883 > 10.0.0.8.45060: Flags [P.], seq 320671371:320671375, ack 429236863, win 85, options [nop,nop,TS val 3792881489 ecr 1097586971], length 4
 00:00:28.787292 IP 10.0.0.8.45060 > 10.0.0.6.1883: Flags [.], ack 320671375, win 83, options [nop,nop,TS val 1097587025 ecr 3792881489], length 0
 00:00:29.728613 IP 10.0.0.8.45060 > 10.0.0.6.1883: Flags [P.], seq 429236863:429237258, ack 320671375, win 83, options [nop,nop,TS val 1097587965 ecr 3792881489], length 395
 00:00:29.730134 IP 10.0.0.6.1883 > 10.0.0.8.45060: Flags [P.], seq 320671375:320671379, ack 429237258, win 85, options [nop,nop,TS val 3792882485 ecr 1097587965], length 4
 00:00:29.731259 IP 10.0.0.8.45060 > 10.0.0.6.1883: Flags [.], ack 320671379, win 83, options [nop,nop,TS val 1097587968 ecr 3792882485], length 0
 00:00:29.731882 IP 10.0.0.8.45060 > 10.0.0.6.1883: Flags [P.], seq 429237258:429237262, ack 320671379, win 83, options [nop,nop,TS val 1097587968 ecr 3792882485], length 4
 00:00:29.732240 IP 10.0.0.6.1883 > 10.0.0.8.45060: Flags [P.], seq 320671379:320671383, ack 429237262, win 85, options [nop,nop,TS val 3792882488 ecr 1097587968], length 4
 00:00:29.858032 IP 10.0.0.8.45060 > 10.0.0.6.1883: Flags [.], ack 320671383, win 83, options [nop,nop,TS val 1097588072 ecr 3792882488], length 0
 00:00:29.935493 IP6 fe80::689b:35ff:fe93:9126 > ff02::2: ICMP6, router solicitation, length 16
 00:00:29.939590 IP6 fe80::4ca6:7aff:fe8a:184e > ff02::2: ICMP6, router solicitation, length 16
 00:00:30.730946 IP 10.0.0.8.45060 > 10.0.0.6.1883: Flags [P.], seq 429237262:429237657, ack 320671383, win 83, options [nop,nop,TS val 1097588967 ecr 3792882488], length 395
 00:00:30.731703 IP 10.0.0.6.1883 > 10.0.0.8.45060: Flags [P.], seq 320671383:320671387, ack 429237657, win 85, options [nop,nop,TS val 3792883487 ecr 1097588967], length 4
 00:00:30.732437 IP 10.0.0.8.45060 > 10.0.0.6.1883: Flags [.], ack 320671387, win 83, options [nop,nop,TS val 1097588969 ecr 3792883487], length 0
 00:00:30.732571 IP 10.0.0.8.45060 > 10.0.0.6.1883: Flags [P.], seq 429237657:429237661, ack 320671387, win 83, options [nop,nop,TS val 1097588970 ecr 3792883487], length 4
 00:00:30.732878 IP 10.0.0.6.1883 > 10.0.0.8.45060: Flags [P.], seq 320671387:320671391, ack 429237661, win 85, options [nop,nop,TS val 3792883488 ecr 1097588970], length 4
 00:00:30.896758 IP 10.0.0.8.45060 > 10.0.0.6.1883: Flags [.], ack 320671391, win 83, options [nop,nop,TS val 1097589072 ecr 3792883488], length 0
 00:00:31.734124 IP 10.0.0.8.45060 > 10.0.0.6.1883: Flags [P.], seq 429237661:429238056, ack 320671391, win 83, options [nop,nop,TS val 1097589969 ecr 3792883488], length 395
 00:00:31.735847 IP 10.0.0.6.1883 > 10.0.0.8.45060: Flags [P.], seq 320671391:320671395, ack 429238056, win 85, options [nop,nop,TS val 3792884490 ecr 1097589969], length 4
 00:00:31.737900 IP 10.0.0.8.45060 > 10.0.0.6.1883: Flags [.], ack 320671395, win 83, options [nop,nop,TS val 1097589975 ecr 3792884490], length 0
 00:00:31.739033 IP 10.0.0.8.45060 > 10.0.0.6.1883: Flags [P.], seq 429238056:429238060, ack 320671395, win 83, options [nop,nop,TS val 1097589975 ecr 3792884490], length 4
 00:00:31.740092 IP 10.0.0.6.1883 > 10.0.0.8.45060: Flags [P.], seq 320671395:320671399, ack 429238060, win 85, options [nop,nop,TS val 3792884495 ecr 1097589975], length 4
 00:00:31.863100 IP 10.0.0.8.45060 > 10.0.0.6.1883: Flags [.], ack 320671399, win 83, options [nop,nop,TS val 1097590072 ecr 3792884495], length 0
 00:00:31.976060 IP6 fe80::9c4e:c1ff:fe8b:83fc > ff02::2: ICMP6, router solicitation, length 16
 00:00:32.004963 IP6 fe80::7432:87ff:fea2:c637 > ff02::2: ICMP6, router solicitation, length 16
 00:00:32.737500 IP 10.0.0.8.45060 > 10.0.0.6.1883: Flags [P.], seq 429238060:429238455, ack 320671399, win 83, options [nop,nop,TS val 1097590974 ecr 3792884495], length 395
 00:00:32.738352 IP 10.0.0.6.1883 > 10.0.0.8.45060: Flags [P.], seq 320671399:320671403, ack 429238455, win 85, options [nop,nop,TS val 3792885494 ecr 1097590974], length 4
 00:00:32.739116 IP 10.0.0.8.45060 > 10.0.0.6.1883: Flags [.], ack 320671403, win 83, options [nop,nop,TS val 1097590976 ecr 3792885494], length 0
 00:00:32.739844 IP 10.0.0.8.45060 > 10.0.0.6.1883: Flags [P.], seq 429238455:429238459, ack 320671403, win 83, options [nop,nop,TS val 1097590976 ecr 3792885494], length 4
 00:00:32.740153 IP 10.0.0.6.1883 > 10.0.0.8.45060: Flags [P.], seq 320671403:320671407, ack 429238459, win 85, options [nop,nop,TS val 3792885496 ecr 1097590976], length 4
 00:00:32.912284 IP 10.0.0.8.45060 > 10.0.0.6.1883: Flags [.], ack 320671407, win 83, options [nop,nop,TS val 1097591072 ecr 3792885496], length 0
 00:00:33.736929 IP 10.0.0.8.45060 > 10.0.0.6.1883: Flags [P.], seq 429238459:429238461, ack 320671407, win 83, options [nop,nop,TS val 1097591974 ecr 3792885496], length 2
 00:00:33.738235 IP 10.0.0.6.1883 > 10.0.0.8.45060: Flags [P.], seq 320671407:320671409, ack 429238461, win 85, options [nop,nop,TS val 3792886494 ecr 1097591974], length 2
 00:00:33.739022 IP 10.0.0.8.45060 > 10.0.0.6.1883: Flags [P.], seq 429238461:429238856, ack 320671409, win 83, options [nop,nop,TS val 1097591976 ecr 3792886494], length 395
 00:00:33.739661 IP 10.0.0.6.1883 > 10.0.0.8.45060: Flags [P.], seq 320671409:320671413, ack 429238856, win 85, options [nop,nop,TS val 3792886495 ecr 1097591976], length 4
 00:00:33.740682 IP 10.0.0.8.45060 > 10.0.0.6.1883: Flags [P.], seq 429238856:429238860, ack 320671413, win 83, options [nop,nop,TS val 1097591978 ecr 3792886495], length 4
 00:00:33.741267 IP 10.0.0.6.1883 > 10.0.0.8.45060: Flags [P.], seq 320671413:320671417, ack 429238860, win 85, options [nop,nop,TS val 3792886497 ecr 1097591978], length 4
 00:00:33.785804 IP 10.0.0.8.45060 > 10.0.0.6.1883: Flags [.], ack 320671417, win 83, options [nop,nop,TS val 1097592023 ecr 3792886497], length 0
 00:00:34.025153 IP6 fe80::3c9f:2bff:fea8:a01c > ff02::2: ICMP6, router solicitation, length 16
 00:00:34.080804 IP6 fe80::b403:77ff:febd:ae44 > ff02::2: ICMP6, router solicitation, length 16
 00:00:34.740394 IP 10.0.0.8.45060 > 10.0.0.6.1883: Flags [P.], seq 429238860:429239255, ack 320671417, win 83, options [nop,nop,TS val 1097592976 ecr 3792886497], length 395
 00:00:34.741864 IP 10.0.0.6.1883 > 10.0.0.8.45060: Flags [P.], seq 320671417:320671421, ack 429239255, win 85, options [nop,nop,TS val 3792887497 ecr 1097592976], length 4
 00:00:34.742339 IP 10.0.0.8.45060 > 10.0.0.6.1883: Flags [.], ack 320671421, win 83, options [nop,nop,TS val 1097592980 ecr 3792887497], length 0
 00:00:34.743894 IP 10.0.0.8.45060 > 10.0.0.6.1883: Flags [P.], seq 429239255:429239259, ack 320671421, win 83, options [nop,nop,TS val 1097592980 ecr 3792887497], length 4
 00:00:34.744326 IP 10.0.0.6.1883 > 10.0.0.8.45060: Flags [P.], seq 320671421:320671425, ack 429239259, win 85, options [nop,nop,TS val 3792887500 ecr 1097592980], length 4
 00:00:35.065958 IP 10.0.0.8.45060 > 10.0.0.6.1883: Flags [.], ack 320671425, win 83, options [nop,nop,TS val 1097593071 ecr 3792887500], length 0
 00:00:35.744285 IP 10.0.0.8.45060 > 10.0.0.6.1883: Flags [P.], seq 429239259:429239654, ack 320671425, win 83, options [nop,nop,TS val 1097593980 ecr 3792887500], length 395
 00:00:35.748892 IP 10.0.0.6.1883 > 10.0.0.8.45060: Flags [P.], seq 320671425:320671429, ack 429239654, win 85, options [nop,nop,TS val 3792888501 ecr 1097593980], length 4
 00:00:35.803964 IP 10.0.0.8.45060 > 10.0.0.6.1883: Flags [.], ack 320671429, win 83, options [nop,nop,TS val 1097594041 ecr 3792888501], length 0
 00:00:35.804153 IP 10.0.0.8.45060 > 10.0.0.6.1883: Flags [P.], seq 429239654:429239658, ack 320671429, win 83, options [nop,nop,TS val 1097594041 ecr 3792888501], length 4
 00:00:35.804988 IP 10.0.0.6.1883 > 10.0.0.8.45060: Flags [P.], seq 320671429:320671433, ack 429239658, win 85, options [nop,nop,TS val 3792888560 ecr 1097594041], length 4
 00:00:35.873499 IP 10.0.0.8.45060 > 10.0.0.6.1883: Flags [.], ack 320671433, win 83, options [nop,nop,TS val 1097594111 ecr 3792888560], length 0
 00:00:36.076656 IP6 fe80::c3d:8eff:fe25:1eda > ff02::2: ICMP6, router solicitation, length 16
 00:00:36.100597 IP6 fe80::10a0:bcff:fedd:2a0f > ff02::2: ICMP6, router solicitation, length 16
 00:00:36.118825 IP6 fe80::b451:ebff:fe2c:297 > ff02::2: ICMP6, router solicitation, length 16
 00:00:36.753045 IP 10.0.0.8.45060 > 10.0.0.6.1883: Flags [P.], seq 429239658:429240053, ack 320671433, win 83, options [nop,nop,TS val 1097594988 ecr 3792888560], length 395
 00:00:36.754027 IP 10.0.0.6.1883 > 10.0.0.8.45060: Flags [P.], seq 320671433:320671437, ack 429240053, win 85, options [nop,nop,TS val 3792889509 ecr 1097594988], length 4
 00:00:36.755305 IP 10.0.0.8.45060 > 10.0.0.6.1883: Flags [.], ack 320671437, win 83, options [nop,nop,TS val 1097594992 ecr 3792889509], length 0
 00:00:36.756960 IP 10.0.0.8.45060 > 10.0.0.6.1883: Flags [P.], seq 429240053:429240057, ack 320671437, win 83, options [nop,nop,TS val 1097594993 ecr 3792889509], length 4
