 00:00:00.000000 IP6 fe80::a0cb:c7ff:fef8:acb3 > ff02::2: ICMP6, router solicitation, length 16
 00:00:00.292380 IP6 fe80::f00f:86ff:fe39:cd30 > ff02::2: ICMP6, router solicitation, length 16
 00:00:00.302930 IP6 fe80::d8aa:83ff:feb8:8479 > ff02::2: ICMP6, router solicitation, length 16
 00:00:00.309969 IP6 fe80::c476:daff:fe33:eea9 > ff02::2: ICMP6, router solicitation, length 16
 00:00:00.318954 IP6 fe80::eca6:8dff:fe66:8972 > ff02::2: ICMP6, router solicitation, length 16
 00:00:01.056135 IP6 fe80::b810:83ff:fe82:9db2 > ff02::2: ICMP6, router solicitation, length 16
 00:00:01.066877 IP6 fe80::d8dd:1fff:fe8e:d335 > ff02::2: ICMP6, router solicitation, length 16
 00:00:01.290798 IP6 fe80::3c6d:ebff:fe17:7c45 > ff02::2: ICMP6, router solicitation, length 16
 00:00:01.332031 IP6 fe80::5490:d9ff:fe8b:3ae9 > ff02::2: ICMP6, router solicitation, length 16
 00:00:01.560922 IP6 fe80::68e2:f0ff:fee9:9369 > ff02::2: ICMP6, router solicitation, length 16
 00:00:01.805551 IP6 fe80::6880:53ff:feea:9f5 > ff02::2: ICMP6, router solicitation, length 16
 00:00:01.843876 IP6 fe80::b0a4:5eff:feb6:ad96 > ff02::2: ICMP6, router solicitation, length 16
 00:00:01.856873 IP6 fe80::38cb:5ff:fe92:1190 > ff02::2: ICMP6, router solicitation, length 16
 00:00:02.054256 IP6 fe80::c473:2bff:feff:e724 > ff02::2: ICMP6, router solicitation, length 16
 00:00:10.704456 ARP, Request who-has 10.0.0.6 tell 10.0.0.8, length 28
 00:00:10.704672 ARP, Reply 10.0.0.6 is-at 3e:6d:eb:17:7c:45, length 28
 00:00:10.725771 IP 10.0.0.8.45094 > 10.0.0.6.1883: Flags [S], seq 3391562714, win 42340, options [mss 1460,sackOK,TS val 1097761924 ecr 0,nop,wscale 9], length 0
 00:00:10.725844 IP 10.0.0.6.1883 > 10.0.0.8.45094: Flags [S.], seq 2512235009, ack 3391562715, win 43440, options [mss 1460,sackOK,TS val 3793056471 ecr 1097761924,nop,wscale 9], length 0
 00:00:10.737479 IP 10.0.0.8.45094 > 10.0.0.6.1883: Flags [.], ack 2512235010, win 83, options [nop,nop,TS val 1097761965 ecr 3793056471], length 0
 00:00:10.737612 IP 10.0.0.8.45094 > 10.0.0.6.1883: Flags [P.], seq 3391562715:3391562735, ack 2512235010, win 83, options [nop,nop,TS val 1097761965 ecr 3793056471], length 20
 00:00:10.737715 IP 10.0.0.6.1883 > 10.0.0.8.45094: Flags [.], ack 3391562735, win 85, options [nop,nop,TS val 3793056483 ecr 1097761965], length 0
 00:00:10.738237 IP 10.0.0.6.1883 > 10.0.0.8.45094: Flags [P.], seq 2512235010:2512235014, ack 3391562735, win 85, options [nop,nop,TS val 3793056483 ecr 1097761965], length 4
 00:00:10.738352 IP 10.0.0.8.45094 > 10.0.0.6.1883: Flags [.], ack 2512235014, win 83, options [nop,nop,TS val 1097761966 ecr 3793056483], length 0
 00:00:10.739050 IP 10.0.0.8.45094 > 10.0.0.6.1883: Flags [P.], seq 3391562735:3391562799, ack 2512235014, win 83, options [nop,nop,TS val 1097761966 ecr 3793056483], length 64
 00:00:10.740068 IP 10.0.0.6.1883 > 10.0.0.8.45094: Flags [P.], seq 2512235014:2512235079, ack 3391562799, win 85, options [nop,nop,TS val 3793056485 ecr 1097761966], length 65
 00:00:10.740343 IP 10.0.0.8.45094 > 10.0.0.6.1883: Flags [P.], seq 3391562799:3391563194, ack 2512235079, win 83, options [nop,nop,TS val 1097761968 ecr 3793056485], length 395
 00:00:10.740727 IP 10.0.0.6.1883 > 10.0.0.8.45094: Flags [P.], seq 2512235079:2512235084, ack 3391563194, win 85, options [nop,nop,TS val 3793056486 ecr 1097761968], length 5
 00:00:10.783225 IP 10.0.0.8.45094 > 10.0.0.6.1883: Flags [.], ack 2512235084, win 83, options [nop,nop,TS val 1097762011 ecr 3793056486], length 0
 00:00:10.783265 IP 10.0.0.6.1883 > 10.0.0.8.45094: Flags [P.], seq 2512235084:2512235088, ack 3391563194, win 85, options [nop,nop,TS val 3793056529 ecr 1097762011], length 4
 00:00:10.783386 IP 10.0.0.8.45094 > 10.0.0.6.1883: Flags [.], ack 2512235088, win 83, options [nop,nop,TS val 1097762011 ecr 3793056529], length 0
 00:00:10.784072 IP 10.0.0.8.45094 > 10.0.0.6.1883: Flags [P.], seq 3391563194:3391563198, ack 2512235088, win 83, options [nop,nop,TS val 1097762011 ecr 3793056529], length 4
 00:00:10.784263 IP 10.0.0.6.1883 > 10.0.0.8.45094: Flags [P.], seq 2512235088:2512235092, ack 3391563198, win 85, options [nop,nop,TS val 3793056530 ecr 1097762011], length 4
 00:00:10.853963 IP 10.0.0.8.45094 > 10.0.0.6.1883: Flags [.], ack 2512235092, win 83, options [nop,nop,TS val 1097762069 ecr 3793056530], length 0
 00:00:11.711950 IP 10.0.0.8.45094 > 10.0.0.6.1883: Flags [P.], seq 3391563198:3391563593, ack 2512235092, win 83, options [nop,nop,TS val 1097762938 ecr 3793056530], length 395
 00:00:11.714206 IP 10.0.0.6.1883 > 10.0.0.8.45094: Flags [P.], seq 2512235092:2512235096, ack 3391563593, win 85, options [nop,nop,TS val 3793057459 ecr 1097762938], length 4
 00:00:11.714657 IP 10.0.0.8.45094 > 10.0.0.6.1883: Flags [.], ack 2512235096, win 83, options [nop,nop,TS val 1097762942 ecr 3793057459], length 0
 00:00:11.715812 IP 10.0.0.8.45094 > 10.0.0.6.1883: Flags [P.], seq 3391563593:3391563597, ack 2512235096, win 83, options [nop,nop,TS val 1097762942 ecr 3793057459], length 4
 00:00:11.716456 IP 10.0.0.6.1883 > 10.0.0.8.45094: Flags [P.], seq 2512235096:2512235100, ack 3391563597, win 85, options [nop,nop,TS val 3793057462 ecr 1097762942], length 4
 00:00:11.779175 IP 10.0.0.8.45094 > 10.0.0.6.1883: Flags [.], ack 2512235100, win 83, options [nop,nop,TS val 1097763003 ecr 3793057462], length 0
 00:00:12.717297 IP 10.0.0.8.45094 > 10.0.0.6.1883: Flags [P.], seq 3391563597:3391563992, ack 2512235100, win 83, options [nop,nop,TS val 1097763943 ecr 3793057462], length 395
 00:00:12.718543 IP 10.0.0.6.1883 > 10.0.0.8.45094: Flags [P.], seq 2512235100:2512235104, ack 3391563992, win 85, options [nop,nop,TS val 3793058464 ecr 1097763943], length 4
 00:00:12.719000 IP 10.0.0.8.45094 > 10.0.0.6.1883: Flags [.], ack 2512235104, win 83, options [nop,nop,TS val 1097763946 ecr 3793058464], length 0
 00:00:12.720100 IP 10.0.0.8.45094 > 10.0.0.6.1883: Flags [P.], seq 3391563992:3391563996, ack 2512235104, win 83, options [nop,nop,TS val 1097763947 ecr 3793058464], length 4
 00:00:12.720650 IP 10.0.0.6.1883 > 10.0.0.8.45094: Flags [P.], seq 2512235104:2512235108, ack 3391563996, win 85, options [nop,nop,TS val 3793058466 ecr 1097763947], length 4
 00:00:12.859038 IP 10.0.0.8.45094 > 10.0.0.6.1883: Flags [.], ack 2512235108, win 83, options [nop,nop,TS val 1097763991 ecr 3793058466], length 0
 00:00:13.720738 IP 10.0.0.8.45094 > 10.0.0.6.1883: Flags [P.], seq 3391563996:3391564391, ack 2512235108, win 83, options [nop,nop,TS val 1097764947 ecr 3793058466], length 395
 00:00:13.721989 IP 10.0.0.6.1883 > 10.0.0.8.45094: Flags [P.], seq 2512235108:2512235112, ack 3391564391, win 85, options [nop,nop,TS val 3793059467 ecr 1097764947], length 4
 00:00:13.852885 IP 10.0.0.8.45094 > 10.0.0.6.1883: Flags [.], ack 2512235112, win 83, options [nop,nop,TS val 1097765080 ecr 3793059467], length 0
 00:00:13.853808 IP 10.0.0.8.45094 > 10.0.0.6.1883: Flags [P.], seq 3391564391:3391564395, ack 2512235112, win 83, options [nop,nop,TS val 1097765080 ecr 3793059467], length 4
 00:00:13.854359 IP 10.0.0.6.1883 > 10.0.0.8.45094: Flags [P.], seq 2512235112:2512235116, ack 3391564395, win 85, options [nop,nop,TS val 3793059600 ecr 1097765080], length 4
 00:00:14.042603 IP 10.0.0.8.45094 > 10.0.0.6.1883: Flags [.], ack 2512235116, win 83, options [nop,nop,TS val 1097765123 ecr 3793059600], length 0
 00:00:14.843644 IP 10.0.0.8.45094 > 10.0.0.6.1883: Flags [P.], seq 3391564395:3391564790, ack 2512235116, win 83, options [nop,nop,TS val 1097766070 ecr 3793059600], length 395
 00:00:14.844470 IP 10.0.0.6.1883 > 10.0.0.8.45094: Flags [P.], seq 2512235116:2512235120, ack 3391564790, win 85, options [nop,nop,TS val 3793060590 ecr 1097766070], length 4
 00:00:14.846232 IP 10.0.0.8.45094 > 10.0.0.6.1883: Flags [.], ack 2512235120, win 83, options [nop,nop,TS val 1097766072 ecr 3793060590], length 0
 00:00:14.846582 IP 10.0.0.8.45094 > 10.0.0.6.1883: Flags [P.], seq 3391564790:3391564794, ack 2512235120, win 83, options [nop,nop,TS val 1097766073 ecr 3793060590], length 4
 00:00:14.846964 IP 10.0.0.6.1883 > 10.0.0.8.45094: Flags [P.], seq 2512235120:2512235124, ack 3391564794, win 85, options [nop,nop,TS val 3793060592 ecr 1097766073], length 4
 00:00:14.873193 IP6 fe80::f00f:86ff:fe39:cd30 > ff02::2: ICMP6, router solicitation, length 16
 00:00:14.898516 IP 10.0.0.8.45094 > 10.0.0.6.1883: Flags [.], ack 2512235124, win 83, options [nop,nop,TS val 1097766118 ecr 3793060592], length 0
 00:00:15.104040 IP6 fe80::a0cb:c7ff:fef8:acb3 > ff02::2: ICMP6, router solicitation, length 16
 00:00:15.383697 IP6 fe80::eca6:8dff:fe66:8972 > ff02::2: ICMP6, router solicitation, length 16
 00:00:15.649936 IP6 fe80::c476:daff:fe33:eea9 > ff02::2: ICMP6, router solicitation, length 16
 00:00:15.659087 IP6 fe80::d8aa:83ff:feb8:8479 > ff02::2: ICMP6, router solicitation, length 16
 00:00:15.741040 IP 10.0.0.8.45094 > 10.0.0.6.1883: Flags [P.], seq 3391564794:3391564796, ack 2512235124, win 83, options [nop,nop,TS val 1097766967 ecr 3793060592], length 2
 00:00:15.741514 IP 10.0.0.6.1883 > 10.0.0.8.45094: Flags [P.], seq 2512235124:2512235126, ack 3391564796, win 85, options [nop,nop,TS val 3793061487 ecr 1097766967], length 2
 00:00:15.742259 IP 10.0.0.8.45094 > 10.0.0.6.1883: Flags [.], ack 2512235126, win 83, options [nop,nop,TS val 1097766969 ecr 3793061487], length 0
 00:00:15.852433 IP 10.0.0.8.45094 > 10.0.0.6.1883: Flags [P.], seq 3391564796:3391565191, ack 2512235126, win 83, options [nop,nop,TS val 1097767079 ecr 3793061487], length 395
 00:00:15.853055 IP 10.0.0.6.1883 > 10.0.0.8.45094: Flags [P.], seq 2512235126:2512235130, ack 3391565191, win 85, options [nop,nop,TS val 3793061598 ecr 1097767079], length 4
 00:00:15.853695 IP 10.0.0.8.45094 > 10.0.0.6.1883: Flags [.], ack 2512235130, win 83, options [nop,nop,TS val 1097767081 ecr 3793061598], length 0
 00:00:15.854201 IP 10.0.0.8.45094 > 10.0.0.6.1883: Flags [P.], seq 3391565191:3391565195, ack 2512235130, win 83, options [nop,nop,TS val 1097767081 ecr 3793061598], length 4
 00:00:15.854557 IP 10.0.0.6.1883 > 10.0.0.8.45094: Flags [P.], seq 2512235130:2512235134, ack 3391565195, win 85, options [nop,nop,TS val 3793061600 ecr 1097767081], length 4
 00:00:15.899368 IP 10.0.0.8.45094 > 10.0.0.6.1883: Flags [.], ack 2512235134, win 83, options [nop,nop,TS val 1097767123 ecr 3793061600], length 0
 00:00:16.864645 IP 10.0.0.8.45094 > 10.0.0.6.1883: Flags [P.], seq 3391565195:3391565590, ack 2512235134, win 83, options [nop,nop,TS val 1097768092 ecr 3793061600], length 395
 00:00:16.866180 IP 10.0.0.6.1883 > 10.0.0.8.45094: Flags [P.], seq 2512235134:2512235138, ack 3391565590, win 85, options [nop,nop,TS val 3793062611 ecr 1097768092], length 4
 00:00:16.867397 IP 10.0.0.8.45094 > 10.0.0.6.1883: Flags [.], ack 2512235138, win 83, options [nop,nop,TS val 1097768094 ecr 3793062611], length 0
 00:00:16.867883 IP 10.0.0.8.45094 > 10.0.0.6.1883: Flags [P.], seq 3391565590:3391565594, ack 2512235138, win 83, options [nop,nop,TS val 1097768095 ecr 3793062611], length 4
 00:00:16.868410 IP 10.0.0.6.1883 > 10.0.0.8.45094: Flags [P.], seq 2512235138:2512235142, ack 3391565594, win 85, options [nop,nop,TS val 3793062614 ecr 1097768095], length 4
 00:00:16.895115 IP6 fe80::3c6d:ebff:fe17:7c45 > ff02::2: ICMP6, router solicitation, length 16
 00:00:16.915248 IP 10.0.0.8.45094 > 10.0.0.6.1883: Flags [.], ack 2512235142, win 83, options [nop,nop,TS val 1097768142 ecr 3793062614], length 0
 00:00:17.682284 IP6 fe80::68e2:f0ff:fee9:9369 > ff02::2: ICMP6, router solicitation, length 16
 00:00:17.685598 IP6 fe80::b0a4:5eff:feb6:ad96 > ff02::2: ICMP6, router solicitation, length 16
 00:00:17.868269 IP 10.0.0.8.45094 > 10.0.0.6.1883: Flags [P.], seq 3391565594:3391565989, ack 2512235142, win 83, options [nop,nop,TS val 1097769093 ecr 3793062614], length 395
 00:00:17.869278 IP 10.0.0.6.1883 > 10.0.0.8.45094: Flags [P.], seq 2512235142:2512235146, ack 3391565989, win 85, options [nop,nop,TS val 3793063614 ecr 1097769093], length 4
 00:00:17.870847 IP 10.0.0.8.45094 > 10.0.0.6.1883: Flags [.], ack 2512235146, win 83, options [nop,nop,TS val 1097769097 ecr 3793063614], length 0
 00:00:17.871120 IP 10.0.0.8.45094 > 10.0.0.6.1883: Flags [P.], seq 3391565989:3391565993, ack 2512235146, win 83, options [nop,nop,TS val 1097769097 ecr 3793063614], length 4
 00:00:17.871513 IP 10.0.0.6.1883 > 10.0.0.8.45094: Flags [P.], seq 2512235146:2512235150, ack 3391565993, win 85, options [nop,nop,TS val 3793063617 ecr 1097769097], length 4
 00:00:17.915596 IP 10.0.0.8.45094 > 10.0.0.6.1883: Flags [.], ack 2512235150, win 83, options [nop,nop,TS val 1097769143 ecr 3793063617], length 0
 00:00:18.868140 IP 10.0.0.8.45094 > 10.0.0.6.1883: Flags [P.], seq 3391565993:3391566388, ack 2512235150, win 83, options [nop,nop,TS val 1097770094 ecr 3793063617], length 395
 00:00:18.869816 IP 10.0.0.6.1883 > 10.0.0.8.45094: Flags [P.], seq 2512235150:2512235154, ack 3391566388, win 85, options [nop,nop,TS val 3793064615 ecr 1097770094], length 4
 00:00:18.870556 IP 10.0.0.8.45094 > 10.0.0.6.1883: Flags [.], ack 2512235154, win 83, options [nop,nop,TS val 1097770098 ecr 3793064615], length 0
 00:00:18.871401 IP 10.0.0.8.45094 > 10.0.0.6.1883: Flags [P.], seq 3391566388:3391566392, ack 2512235154, win 83, options [nop,nop,TS val 1097770098 ecr 3793064615], length 4
 00:00:18.871864 IP 10.0.0.6.1883 > 10.0.0.8.45094: Flags [P.], seq 2512235154:2512235158, ack 3391566392, win 85, options [nop,nop,TS val 3793064617 ecr 1097770098], length 4
 00:00:18.915934 IP 10.0.0.8.45094 > 10.0.0.6.1883: Flags [.], ack 2512235158, win 83, options [nop,nop,TS val 1097770143 ecr 3793064617], length 0
 00:00:19.211255 IP6 fe80::5490:d9ff:fe8b:3ae9 > ff02::2: ICMP6, router solicitation, length 16
 00:00:19.244944 IP6 fe80::b810:83ff:fe82:9db2 > ff02::2: ICMP6, router solicitation, length 16
 00:00:19.258564 IP6 fe80::38cb:5ff:fe92:1190 > ff02::2: ICMP6, router solicitation, length 16
 00:00:19.264966 IP6 fe80::d8dd:1fff:fe8e:d335 > ff02::2: ICMP6, router solicitation, length 16
 00:00:19.868103 IP 10.0.0.8.45094 > 10.0.0.6.1883: Flags [P.], seq 3391566392:3391566787, ack 2512235158, win 83, options [nop,nop,TS val 1097771095 ecr 3793064617], length 395
 00:00:19.868780 IP 10.0.0.6.1883 > 10.0.0.8.45094: Flags [P.], seq 2512235158:2512235162, ack 3391566787, win 85, options [nop,nop,TS val 3793065614 ecr 1097771095], length 4
 00:00:19.869781 IP 10.0.0.8.45094 > 10.0.0.6.1883: Flags [.], ack 2512235162, win 83, options [nop,nop,TS val 1097771096 ecr 3793065614], length 0
 00:00:19.870216 IP 10.0.0.8.45094 > 10.0.0.6.1883: Flags [P.], seq 3391566787:3391566791, ack 2512235162, win 83, options [nop,nop,TS val 1097771097 ecr 3793065614], length 4
 00:00:19.871004 IP 10.0.0.6.1883 > 10.0.0.8.45094: Flags [P.], seq 2512235162:2512235166, ack 3391566791, win 85, options [nop,nop,TS val 3793065616 ecr 1097771097], length 4
 00:00:20.036042 IP 10.0.0.8.45094 > 10.0.0.6.1883: Flags [.], ack 2512235166, win 83, options [nop,nop,TS val 1097771143 ecr 3793065616], length 0
 00:00:20.744454 IP 10.0.0.8.45094 > 10.0.0.6.1883: Flags [P.], seq 3391566791:3391566793, ack 2512235166, win 83, options [nop,nop,TS val 1097771971 ecr 3793065616], length 2
 00:00:20.744586 IP 10.0.0.6.1883 > 10.0.0.8.45094: Flags [P.], seq 2512235166:2512235168, ack 3391566793, win 85, options [nop,nop,TS val 3793066490 ecr 1097771971], length 2
 00:00:20.747439 IP 10.0.0.8.45094 > 10.0.0.6.1883: Flags [.], ack 2512235168, win 83, options [nop,nop,TS val 1097771975 ecr 3793066490], length 0
 00:00:20.871190 IP 10.0.0.8.45094 > 10.0.0.6.1883: Flags [P.], seq 3391566793:3391567188, ack 2512235168, win 83, options [nop,nop,TS val 1097772097 ecr 3793066490], length 395
 00:00:20.873358 IP 10.0.0.6.1883 > 10.0.0.8.45094: Flags [P.], seq 2512235168:2512235172, ack 3391567188, win 85, options [nop,nop,TS val 3793066618 ecr 1097772097], length 4
 00:00:21.019212 IP 10.0.0.8.45094 > 10.0.0.6.1883: Flags [.], ack 2512235172, win 83, options [nop,nop,TS val 1097772245 ecr 3793066618], length 0
 00:00:21.019387 IP 10.0.0.8.45094 > 10.0.0.6.1883: Flags [P.], seq 3391567188:3391567192, ack 2512235172, win 83, options [nop,nop,TS val 1097772245 ecr 3793066618], length 4
 00:00:21.019743 IP 10.0.0.6.1883 > 10.0.0.8.45094: Flags [P.], seq 2512235172:2512235176, ack 3391567192, win 85, options [nop,nop,TS val 3793066765 ecr 1097772245], length 4
 00:00:21.211213 IP 10.0.0.8.45094 > 10.0.0.6.1883: Flags [.], ack 2512235176, win 83, options [nop,nop,TS val 1097772420 ecr 3793066765], length 0
 00:00:21.259148 IP6 fe80::6880:53ff:feea:9f5 > ff02::2: ICMP6, router solicitation, length 16
 00:00:21.283941 IP6 fe80::c473:2bff:feff:e724 > ff02::2: ICMP6, router solicitation, length 16
 00:00:21.881751 IP 10.0.0.8.45094 > 10.0.0.6.1883: Flags [P.], seq 3391567192:3391567587, ack 2512235176, win 83, options [nop,nop,TS val 1097773109 ecr 3793066765], length 395
 00:00:21.882556 IP 10.0.0.6.1883 > 10.0.0.8.45094: Flags [P.], seq 2512235176:2512235180, ack 3391567587, win 85, options [nop,nop,TS val 3793067628 ecr 1097773109], length 4
 00:00:21.883090 IP 10.0.0.8.45094 > 10.0.0.6.1883: Flags [.], ack 2512235180, win 83, options [nop,nop,TS val 1097773110 ecr 3793067628], length 0
 00:00:21.883234 IP 10.0.0.8.45094 > 10.0.0.6.1883: Flags [P.], seq 3391567587:3391567591, ack 2512235180, win 83, options [nop,nop,TS val 1097773110 ecr 3793067628], length 4
 00:00:21.883462 IP 10.0.0.6.1883 > 10.0.0.8.45094: Flags [P.], seq 2512235180:2512235184, ack 3391567591, win 85, options [nop,nop,TS val 3793067629 ecr 1097773110], length 4
 00:00:21.931310 IP 10.0.0.8.45094 > 10.0.0.6.1883: Flags [.], ack 2512235184, win 83, options [nop,nop,TS val 1097773158 ecr 3793067629], length 0
 00:00:22.883118 IP 10.0.0.8.45094 > 10.0.0.6.1883: Flags [P.], seq 3391567591:3391567986, ack 2512235184, win 83, options [nop,nop,TS val 1097774110 ecr 3793067629], length 395
 00:00:22.883809 IP 10.0.0.6.1883 > 10.0.0.8.45094: Flags [P.], seq 2512235184:2512235188, ack 3391567986, win 85, options [nop,nop,TS val 3793068629 ecr 1097774110], length 4
 00:00:22.885334 IP 10.0.0.8.45094 > 10.0.0.6.1883: Flags [.], ack 2512235188, win 83, options [nop,nop,TS val 1097774112 ecr 3793068629], length 0
 00:00:22.885518 IP 10.0.0.8.45094 > 10.0.0.6.1883: Flags [P.], seq 3391567986:3391567990, ack 2512235188, win 83, options [nop,nop,TS val 1097774112 ecr 3793068629], length 4
 00:00:22.885948 IP 10.0.0.6.1883 > 10.0.0.8.45094: Flags [P.], seq 2512235188:2512235192, ack 3391567990, win 85, options [nop,nop,TS val 3793068631 ecr 1097774112], length 4
 00:00:22.931427 IP 10.0.0.8.45094 > 10.0.0.6.1883: Flags [.], ack 2512235192, win 83, options [nop,nop,TS val 1097774159 ecr 3793068631], length 0
 00:00:23.884507 IP 10.0.0.8.45094 > 10.0.0.6.1883: Flags [P.], seq 3391567990:3391568385, ack 2512235192, win 83, options [nop,nop,TS val 1097775111 ecr 3793068631], length 395
 00:00:23.885393 IP 10.0.0.6.1883 > 10.0.0.8.45094: Flags [P.], seq 2512235192:2512235196, ack 3391568385, win 85, options [nop,nop,TS val 3793069631 ecr 1097775111], length 4
 00:00:23.886682 IP 10.0.0.8.45094 > 10.0.0.6.1883: Flags [.], ack 2512235196, win 83, options [nop,nop,TS val 1097775114 ecr 3793069631], length 0
 00:00:23.886994 IP 10.0.0.8.45094 > 10.0.0.6.1883: Flags [P.], seq 3391568385:3391568389, ack 2512235196, win 83, options [nop,nop,TS val 1097775114 ecr 3793069631], length 4
 00:00:23.887471 IP 10.0.0.6.1883 > 10.0.0.8.45094: Flags [P.], seq 2512235196:2512235200, ack 3391568389, win 85, options [nop,nop,TS val 3793069633 ecr 1097775114], length 4
 00:00:23.931433 IP 10.0.0.8.45094 > 10.0.0.6.1883: Flags [.], ack 2512235200, win 83, options [nop,nop,TS val 1097775159 ecr 3793069633], length 0
 00:00:24.888193 IP 10.0.0.8.45094 > 10.0.0.6.1883: Flags [P.], seq 3391568389:3391568784, ack 2512235200, win 83, options [nop,nop,TS val 1097776114 ecr 3793069633], length 395
 00:00:24.888964 IP 10.0.0.6.1883 > 10.0.0.8.45094: Flags [P.], seq 2512235200:2512235204, ack 3391568784, win 85, options [nop,nop,TS val 3793070634 ecr 1097776114], length 4
 00:00:24.998532 IP 10.0.0.8.45094 > 10.0.0.6.1883: Flags [.], ack 2512235204, win 83, options [nop,nop,TS val 1097776225 ecr 3793070634], length 0
 00:00:24.999737 IP 10.0.0.8.45094 > 10.0.0.6.1883: Flags [P.], seq 3391568784:3391568788, ack 2512235204, win 83, options [nop,nop,TS val 1097776226 ecr 3793070634], length 4
 00:00:25.000300 IP 10.0.0.6.1883 > 10.0.0.8.45094: Flags [P.], seq 2512235204:2512235208, ack 3391568788, win 85, options [nop,nop,TS val 3793070746 ecr 1097776226], length 4
 00:00:25.051689 IP 10.0.0.8.45094 > 10.0.0.6.1883: Flags [.], ack 2512235208, win 83, options [nop,nop,TS val 1097776279 ecr 3793070746], length 0
 00:00:25.751319 IP 10.0.0.8.45094 > 10.0.0.6.1883: Flags [P.], seq 3391568788:3391568790, ack 2512235208, win 83, options [nop,nop,TS val 1097776977 ecr 3793070746], length 2
 00:00:25.751689 IP 10.0.0.6.1883 > 10.0.0.8.45094: Flags [P.], seq 2512235208:2512235210, ack 3391568790, win 85, options [nop,nop,TS val 3793071497 ecr 1097776977], length 2
 00:00:25.753189 IP 10.0.0.8.45094 > 10.0.0.6.1883: Flags [.], ack 2512235210, win 83, options [nop,nop,TS val 1097776980 ecr 3793071497], length 0
 00:00:25.890464 IP 10.0.0.8.45094 > 10.0.0.6.1883: Flags [P.], seq 3391568790:3391569185, ack 2512235210, win 83, options [nop,nop,TS val 1097777116 ecr 3793071497], length 395
 00:00:25.891197 IP 10.0.0.6.1883 > 10.0.0.8.45094: Flags [P.], seq 2512235210:2512235214, ack 3391569185, win 85, options [nop,nop,TS val 3793071637 ecr 1097777116], length 4
 00:00:25.896204 IP 10.0.0.8.45094 > 10.0.0.6.1883: Flags [.], ack 2512235214, win 83, options [nop,nop,TS val 1097777123 ecr 3793071637], length 0
 00:00:25.896806 IP 10.0.0.8.45094 > 10.0.0.6.1883: Flags [P.], seq 3391569185:3391569189, ack 2512235214, win 83, options [nop,nop,TS val 1097777123 ecr 3793071637], length 4
 00:00:25.897086 IP 10.0.0.6.1883 > 10.0.0.8.45094: Flags [P.], seq 2512235214:2512235218, ack 3391569189, win 85, options [nop,nop,TS val 3793071642 ecr 1097777123], length 4
 00:00:25.996463 IP 10.0.0.8.45094 > 10.0.0.6.1883: Flags [.], ack 2512235218, win 83, options [nop,nop,TS val 1097777224 ecr 3793071642], length 0
 00:00:26.902938 IP 10.0.0.8.45094 > 10.0.0.6.1883: Flags [P.], seq 3391569189:3391569584, ack 2512235218, win 83, options [nop,nop,TS val 1097778130 ecr 3793071642], length 395
 00:00:26.903455 IP 10.0.0.6.1883 > 10.0.0.8.45094: Flags [P.], seq 2512235218:2512235222, ack 3391569584, win 85, options [nop,nop,TS val 3793072649 ecr 1097778130], length 4
 00:00:26.903924 IP 10.0.0.8.45094 > 10.0.0.6.1883: Flags [.], ack 2512235222, win 83, options [nop,nop,TS val 1097778131 ecr 3793072649], length 0
 00:00:26.903925 IP 10.0.0.8.45094 > 10.0.0.6.1883: Flags [P.], seq 3391569584:3391569588, ack 2512235222, win 83, options [nop,nop,TS val 1097778131 ecr 3793072649], length 4
 00:00:26.904305 IP 10.0.0.6.1883 > 10.0.0.8.45094: Flags [P.], seq 2512235222:2512235226, ack 3391569588, win 85, options [nop,nop,TS val 3793072650 ecr 1097778131], length 4
 00:00:27.039684 IP 10.0.0.8.45094 > 10.0.0.6.1883: Flags [.], ack 2512235226, win 83, options [nop,nop,TS val 1097778243 ecr 3793072650], length 0
 00:00:27.906110 IP 10.0.0.8.45094 > 10.0.0.6.1883: Flags [P.], seq 3391569588:3391569983, ack 2512235226, win 83, options [nop,nop,TS val 1097779133 ecr 3793072650], length 395
 00:00:27.906736 IP 10.0.0.6.1883 > 10.0.0.8.45094: Flags [P.], seq 2512235226:2512235230, ack 3391569983, win 85, options [nop,nop,TS val 3793073652 ecr 1097779133], length 4
 00:00:27.999334 IP 10.0.0.8.45094 > 10.0.0.6.1883: Flags [.], ack 2512235230, win 83, options [nop,nop,TS val 1097779226 ecr 3793073652], length 0
 00:00:28.000076 IP 10.0.0.8.45094 > 10.0.0.6.1883: Flags [P.], seq 3391569983:3391569987, ack 2512235230, win 83, options [nop,nop,TS val 1097779227 ecr 3793073652], length 4
 00:00:28.000318 IP 10.0.0.6.1883 > 10.0.0.8.45094: Flags [P.], seq 2512235230:2512235234, ack 3391569987, win 85, options [nop,nop,TS val 3793073746 ecr 1097779227], length 4
 00:00:28.199731 IP 10.0.0.8.45094 > 10.0.0.6.1883: Flags [.], ack 2512235234, win 83, options [nop,nop,TS val 1097779425 ecr 3793073746], length 0
 00:00:28.907709 IP 10.0.0.8.45094 > 10.0.0.6.1883: Flags [P.], seq 3391569987:3391570382, ack 2512235234, win 83, options [nop,nop,TS val 1097780134 ecr 3793073746], length 395
 00:00:28.908351 IP 10.0.0.6.1883 > 10.0.0.8.45094: Flags [P.], seq 2512235234:2512235238, ack 3391570382, win 85, options [nop,nop,TS val 3793074654 ecr 1097780134], length 4
 00:00:28.908766 IP 10.0.0.8.45094 > 10.0.0.6.1883: Flags [.], ack 2512235238, win 83, options [nop,nop,TS val 1097780136 ecr 3793074654], length 0
 00:00:28.908827 IP 10.0.0.8.45094 > 10.0.0.6.1883: Flags [P.], seq 3391570382:3391570386, ack 2512235238, win 83, options [nop,nop,TS val 1097780136 ecr 3793074654], length 4
 00:00:28.909493 IP 10.0.0.6.1883 > 10.0.0.8.45094: Flags [P.], seq 2512235238:2512235242, ack 3391570386, win 85, options [nop,nop,TS val 3793074654 ecr 1097780136], length 4
 00:00:29.085684 IP 10.0.0.8.45094 > 10.0.0.6.1883: Flags [.], ack 2512235242, win 83, options [nop,nop,TS val 1097780251 ecr 3793074654], length 0
 00:00:29.912158 IP 10.0.0.8.45094 > 10.0.0.6.1883: Flags [P.], seq 3391570386:3391570781, ack 2512235242, win 83, options [nop,nop,TS val 1097781138 ecr 3793074654], length 395
 00:00:29.914902 IP 10.0.0.6.1883 > 10.0.0.8.45094: Flags [P.], seq 2512235242:2512235246, ack 3391570781, win 85, options [nop,nop,TS val 3793075658 ecr 1097781138], length 4
 00:00:29.919273 IP 10.0.0.8.45094 > 10.0.0.6.1883: Flags [.], ack 2512235246, win 83, options [nop,nop,TS val 1097781146 ecr 3793075658], length 0
 00:00:29.920581 IP 10.0.0.8.45094 > 10.0.0.6.1883: Flags [P.], seq 3391570781:3391570785, ack 2512235246, win 83, options [nop,nop,TS val 1097781147 ecr 3793075658], length 4
 00:00:29.921458 IP 10.0.0.6.1883 > 10.0.0.8.45094: Flags [P.], seq 2512235246:2512235250, ack 3391570785, win 85, options [nop,nop,TS val 3793075667 ecr 1097781147], length 4
 00:00:30.031700 IP 10.0.0.8.45094 > 10.0.0.6.1883: Flags [.], ack 2512235250, win 83, options [nop,nop,TS val 1097781251 ecr 3793075667], length 0
 00:00:30.842801 IP 10.0.0.8.45094 > 10.0.0.6.1883: Flags [P.], seq 3391570785:3391570787, ack 2512235250, win 83, options [nop,nop,TS val 1097782069 ecr 3793075667], length 2
 00:00:30.843440 IP 10.0.0.6.1883 > 10.0.0.8.45094: Flags [P.], seq 2512235250:2512235252, ack 3391570787, win 85, options [nop,nop,TS val 3793076589 ecr 1097782069], length 2
 00:00:30.844895 IP 10.0.0.8.45094 > 10.0.0.6.1883: Flags [.], ack 2512235252, win 83, options [nop,nop,TS val 1097782071 ecr 3793076589], length 0
 00:00:30.913622 IP 10.0.0.8.45094 > 10.0.0.6.1883: Flags [P.], seq 3391570787:3391571182, ack 2512235252, win 83, options [nop,nop,TS val 1097782140 ecr 3793076589], length 395
 00:00:30.914716 IP 10.0.0.6.1883 > 10.0.0.8.45094: Flags [P.], seq 2512235252:2512235256, ack 3391571182, win 85, options [nop,nop,TS val 3793076660 ecr 1097782140], length 4
 00:00:30.917224 IP 10.0.0.8.45094 > 10.0.0.6.1883: Flags [.], ack 2512235256, win 83, options [nop,nop,TS val 1097782143 ecr 3793076660], length 0
 00:00:30.918086 IP 10.0.0.8.45094 > 10.0.0.6.1883: Flags [P.], seq 3391571182:3391571186, ack 2512235256, win 83, options [nop,nop,TS val 1097782144 ecr 3793076660], length 4
 00:00:30.918400 IP 10.0.0.6.1883 > 10.0.0.8.45094: Flags [P.], seq 2512235256:2512235260, ack 3391571186, win 85, options [nop,nop,TS val 3793076664 ecr 1097782144], length 4
 00:00:30.965134 IP 10.0.0.8.45094 > 10.0.0.6.1883: Flags [.], ack 2512235260, win 83, options [nop,nop,TS val 1097782187 ecr 3793076664], length 0
 00:00:31.948820 IP 10.0.0.8.45094 > 10.0.0.6.1883: Flags [P.], seq 3391571186:3391571581, ack 2512235260, win 83, options [nop,nop,TS val 1097783176 ecr 3793076664], length 395
 00:00:31.949679 IP 10.0.0.6.1883 > 10.0.0.8.45094: Flags [P.], seq 2512235260:2512235264, ack 3391571581, win 85, options [nop,nop,TS val 3793077695 ecr 1097783176], length 4
 00:00:31.950499 IP 10.0.0.8.45094 > 10.0.0.6.1883: Flags [.], ack 2512235264, win 83, options [nop,nop,TS val 1097783177 ecr 3793077695], length 0
 00:00:31.950854 IP 10.0.0.8.45094 > 10.0.0.6.1883: Flags [P.], seq 3391571581:3391571585, ack 2512235264, win 83, options [nop,nop,TS val 1097783177 ecr 3793077695], length 4
 00:00:31.951180 IP 10.0.0.6.1883 > 10.0.0.8.45094: Flags [P.], seq 2512235264:2512235268, ack 3391571585, win 85, options [nop,nop,TS val 3793077696 ecr 1097783177], length 4
 00:00:31.995176 IP 10.0.0.8.45094 > 10.0.0.6.1883: Flags [.], ack 2512235268, win 83, options [nop,nop,TS val 1097783223 ecr 3793077696], length 0
 00:00:32.952100 IP 10.0.0.8.45094 > 10.0.0.6.1883: Flags [P.], seq 3391571585:3391571980, ack 2512235268, win 83, options [nop,nop,TS val 1097784179 ecr 3793077696], length 395
 00:00:32.953060 IP 10.0.0.6.1883 > 10.0.0.8.45094: Flags [P.], seq 2512235268:2512235272, ack 3391571980, win 85, options [nop,nop,TS val 3793078698 ecr 1097784179], length 4
 00:00:32.953774 IP 10.0.0.8.45094 > 10.0.0.6.1883: Flags [.], ack 2512235272, win 83, options [nop,nop,TS val 1097784181 ecr 3793078698], length 0
 00:00:32.954073 IP 10.0.0.8.45094 > 10.0.0.6.1883: Flags [P.], seq 3391571980:3391571984, ack 2512235272, win 83, options [nop,nop,TS val 1097784181 ecr 3793078698], length 4
 00:00:32.954973 IP 10.0.0.6.1883 > 10.0.0.8.45094: Flags [P.], seq 2512235272:2512235276, ack 3391571984, win 85, options [nop,nop,TS val 3793078700 ecr 1097784181], length 4
 00:00:32.999359 IP 10.0.0.8.45094 > 10.0.0.6.1883: Flags [.], ack 2512235276, win 83, options [nop,nop,TS val 1097784227 ecr 3793078700], length 0
 00:00:33.953320 IP 10.0.0.8.45094 > 10.0.0.6.1883: Flags [P.], seq 3391571984:3391572379, ack 2512235276, win 83, options [nop,nop,TS val 1097785180 ecr 3793078700], length 395
 00:00:33.954235 IP 10.0.0.6.1883 > 10.0.0.8.45094: Flags [P.], seq 2512235276:2512235280, ack 3391572379, win 85, options [nop,nop,TS val 3793079699 ecr 1097785180], length 4
 00:00:33.955563 IP 10.0.0.8.45094 > 10.0.0.6.1883: Flags [.], ack 2512235280, win 83, options [nop,nop,TS val 1097785182 ecr 3793079699], length 0
 00:00:33.956274 IP 10.0.0.8.45094 > 10.0.0.6.1883: Flags [P.], seq 3391572379:3391572383, ack 2512235280, win 83, options [nop,nop,TS val 1097785183 ecr 3793079699], length 4
 00:00:33.956590 IP 10.0.0.6.1883 > 10.0.0.8.45094: Flags [P.], seq 2512235280:2512235284, ack 3391572383, win 85, options [nop,nop,TS val 3793079702 ecr 1097785183], length 4
 00:00:33.999692 IP 10.0.0.8.45094 > 10.0.0.6.1883: Flags [.], ack 2512235284, win 83, options [nop,nop,TS val 1097785227 ecr 3793079702], length 0
 00:00:34.953548 IP 10.0.0.8.45094 > 10.0.0.6.1883: Flags [P.], seq 3391572383:3391572778, ack 2512235284, win 83, options [nop,nop,TS val 1097786181 ecr 3793079702], length 395
 00:00:34.954312 IP 10.0.0.6.1883 > 10.0.0.8.45094: Flags [P.], seq 2512235284:2512235288, ack 3391572778, win 85, options [nop,nop,TS val 3793080700 ecr 1097786181], length 4
 00:00:34.954964 IP 10.0.0.8.45094 > 10.0.0.6.1883: Flags [.], ack 2512235288, win 83, options [nop,nop,TS val 1097786182 ecr 3793080700], length 0
 00:00:34.955161 IP 10.0.0.8.45094 > 10.0.0.6.1883: Flags [P.], seq 3391572778:3391572782, ack 2512235288, win 83, options [nop,nop,TS val 1097786182 ecr 3793080700], length 4
 00:00:34.955776 IP 10.0.0.6.1883 > 10.0.0.8.45094: Flags [P.], seq 2512235288:2512235292, ack 3391572782, win 85, options [nop,nop,TS val 3793080701 ecr 1097786182], length 4
 00:00:34.999295 IP 10.0.0.8.45094 > 10.0.0.6.1883: Flags [.], ack 2512235292, win 83, options [nop,nop,TS val 1097786226 ecr 3793080701], length 0
 00:00:35.844128 IP 10.0.0.8.45094 > 10.0.0.6.1883: Flags [P.], seq 3391572782:3391572784, ack 2512235292, win 83, options [nop,nop,TS val 1097787071 ecr 3793080701], length 2
 00:00:35.844581 IP 10.0.0.6.1883 > 10.0.0.8.45094: Flags [P.], seq 2512235292:2512235294, ack 3391572784, win 85, options [nop,nop,TS val 3793081590 ecr 1097787071], length 2
 00:00:35.845993 IP 10.0.0.8.45094 > 10.0.0.6.1883: Flags [.], ack 2512235294, win 83, options [nop,nop,TS val 1097787072 ecr 3793081590], length 0
 00:00:35.955047 IP 10.0.0.8.45094 > 10.0.0.6.1883: Flags [P.], seq 3391572784:3391573179, ack 2512235294, win 83, options [nop,nop,TS val 1097787182 ecr 3793081590], length 395
 00:00:35.955910 IP 10.0.0.6.1883 > 10.0.0.8.45094: Flags [P.], seq 2512235294:2512235298, ack 3391573179, win 85, options [nop,nop,TS val 3793081701 ecr 1097787182], length 4
 00:00:35.956501 IP 10.0.0.8.45094 > 10.0.0.6.1883: Flags [.], ack 2512235298, win 83, options [nop,nop,TS val 1097787184 ecr 3793081701], length 0
 00:00:35.956664 IP 10.0.0.8.45094 > 10.0.0.6.1883: Flags [P.], seq 3391573179:3391573183, ack 2512235298, win 83, options [nop,nop,TS val 1097787184 ecr 3793081701], length 4
 00:00:35.957167 IP 10.0.0.6.1883 > 10.0.0.8.45094: Flags [P.], seq 2512235298:2512235302, ack 3391573183, win 85, options [nop,nop,TS val 3793081702 ecr 1097787184], length 4
 00:00:35.999754 IP 10.0.0.8.45094 > 10.0.0.6.1883: Flags [.], ack 2512235302, win 83, options [nop,nop,TS val 1097787227 ecr 3793081702], length 0
 00:00:36.956508 IP 10.0.0.8.45094 > 10.0.0.6.1883: Flags [P.], seq 3391573183:3391573578, ack 2512235302, win 83, options [nop,nop,TS val 1097788183 ecr 3793081702], length 395
 00:00:36.957075 IP 10.0.0.6.1883 > 10.0.0.8.45094: Flags [P.], seq 2512235302:2512235306, ack 3391573578, win 85, options [nop,nop,TS val 3793082702 ecr 1097788183], length 4
 00:00:36.958070 IP 10.0.0.8.45094 > 10.0.0.6.1883: Flags [.], ack 2512235306, win 83, options [nop,nop,TS val 1097788185 ecr 3793082702], length 0
 00:00:36.958073 IP 10.0.0.8.45094 > 10.0.0.6.1883: Flags [P.], seq 3391573578:3391573582, ack 2512235306, win 83, options [nop,nop,TS val 1097788185 ecr 3793082702], length 4
 00:00:36.958786 IP 10.0.0.6.1883 > 10.0.0.8.45094: Flags [P.], seq 2512235306:2512235310, ack 3391573582, win 85, options [nop,nop,TS val 3793082704 ecr 1097788185], length 4
 00:00:37.003225 IP 10.0.0.8.45094 > 10.0.0.6.1883: Flags [.], ack 2512235310, win 83, options [nop,nop,TS val 1097788230 ecr 3793082704], length 0
 00:00:37.961948 IP 10.0.0.8.45094 > 10.0.0.6.1883: Flags [P.], seq 3391573582:3391573977, ack 2512235310, win 83, options [nop,nop,TS val 1097789189 ecr 3793082704], length 395
 00:00:37.962295 IP 10.0.0.6.1883 > 10.0.0.8.45094: Flags [P.], seq 2512235310:2512235314, ack 3391573977, win 85, options [nop,nop,TS val 3793083708 ecr 1097789189], length 4
 00:00:37.963261 IP 10.0.0.8.45094 > 10.0.0.6.1883: Flags [.], ack 2512235314, win 83, options [nop,nop,TS val 1097789190 ecr 3793083708], length 0
 00:00:37.963308 IP 10.0.0.8.45094 > 10.0.0.6.1883: Flags [P.], seq 3391573977:3391573981, ack 2512235314, win 83, options [nop,nop,TS val 1097789190 ecr 3793083708], length 4
 00:00:37.963535 IP 10.0.0.6.1883 > 10.0.0.8.45094: Flags [P.], seq 2512235314:2512235318, ack 3391573981, win 85, options [nop,nop,TS val 3793083709 ecr 1097789190], length 4
 00:00:38.007523 IP 10.0.0.8.45094 > 10.0.0.6.1883: Flags [.], ack 2512235318, win 83, options [nop,nop,TS val 1097789235 ecr 3793083709], length 0
 00:00:38.964007 IP 10.0.0.8.45094 > 10.0.0.6.1883: Flags [P.], seq 3391573981:3391574376, ack 2512235318, win 83, options [nop,nop,TS val 1097790191 ecr 3793083709], length 395
 00:00:38.964753 IP 10.0.0.6.1883 > 10.0.0.8.45094: Flags [P.], seq 2512235318:2512235322, ack 3391574376, win 85, options [nop,nop,TS val 3793084710 ecr 1097790191], length 4
 00:00:38.965910 IP 10.0.0.8.45094 > 10.0.0.6.1883: Flags [.], ack 2512235322, win 83, options [nop,nop,TS val 1097790192 ecr 3793084710], length 0
 00:00:38.966312 IP 10.0.0.8.45094 > 10.0.0.6.1883: Flags [P.], seq 3391574376:3391574380, ack 2512235322, win 83, options [nop,nop,TS val 1097790193 ecr 3793084710], length 4
 00:00:38.966589 IP 10.0.0.6.1883 > 10.0.0.8.45094: Flags [P.], seq 2512235322:2512235326, ack 3391574380, win 85, options [nop,nop,TS val 3793084712 ecr 1097790193], length 4
 00:00:39.007462 IP 10.0.0.8.45094 > 10.0.0.6.1883: Flags [.], ack 2512235326, win 83, options [nop,nop,TS val 1097790235 ecr 3793084712], length 0
 00:00:39.966750 IP 10.0.0.8.45094 > 10.0.0.6.1883: Flags [P.], seq 3391574380:3391574775, ack 2512235326, win 83, options [nop,nop,TS val 1097791194 ecr 3793084712], length 395
 00:00:39.967474 IP 10.0.0.6.1883 > 10.0.0.8.45094: Flags [P.], seq 2512235326:2512235330, ack 3391574775, win 85, options [nop,nop,TS val 3793085713 ecr 1097791194], length 4
 00:00:39.968268 IP 10.0.0.8.45094 > 10.0.0.6.1883: Flags [.], ack 2512235330, win 83, options [nop,nop,TS val 1097791195 ecr 3793085713], length 0
 00:00:39.968269 IP 10.0.0.8.45094 > 10.0.0.6.1883: Flags [P.], seq 3391574775:3391574779, ack 2512235330, win 83, options [nop,nop,TS val 1097791195 ecr 3793085713], length 4
 00:00:39.969328 IP 10.0.0.6.1883 > 10.0.0.8.45094: Flags [P.], seq 2512235330:2512235334, ack 3391574779, win 85, options [nop,nop,TS val 3793085715 ecr 1097791195], length 4
 00:00:40.011446 IP 10.0.0.8.45094 > 10.0.0.6.1883: Flags [.], ack 2512235334, win 83, options [nop,nop,TS val 1097791239 ecr 3793085715], length 0
 00:00:40.845486 IP 10.0.0.8.45094 > 10.0.0.6.1883: Flags [P.], seq 3391574779:3391574781, ack 2512235334, win 83, options [nop,nop,TS val 1097792072 ecr 3793085715], length 2
 00:00:40.845811 IP 10.0.0.6.1883 > 10.0.0.8.45094: Flags [P.], seq 2512235334:2512235336, ack 3391574781, win 85, options [nop,nop,TS val 3793086591 ecr 1097792072], length 2
 00:00:40.846591 IP 10.0.0.8.45094 > 10.0.0.6.1883: Flags [.], ack 2512235336, win 83, options [nop,nop,TS val 1097792073 ecr 3793086591], length 0
 00:00:40.991718 IP 10.0.0.8.45094 > 10.0.0.6.1883: Flags [P.], seq 3391574781:3391575176, ack 2512235336, win 83, options [nop,nop,TS val 1097792219 ecr 3793086591], length 395
 00:00:40.992374 IP 10.0.0.6.1883 > 10.0.0.8.45094: Flags [P.], seq 2512235336:2512235340, ack 3391575176, win 85, options [nop,nop,TS val 3793086738 ecr 1097792219], length 4
 00:00:40.992961 IP 10.0.0.8.45094 > 10.0.0.6.1883: Flags [.], ack 2512235340, win 83, options [nop,nop,TS val 1097792220 ecr 3793086738], length 0
 00:00:40.993191 IP 10.0.0.8.45094 > 10.0.0.6.1883: Flags [P.], seq 3391575176:3391575180, ack 2512235340, win 83, options [nop,nop,TS val 1097792220 ecr 3793086738], length 4
 00:00:40.993557 IP 10.0.0.6.1883 > 10.0.0.8.45094: Flags [P.], seq 2512235340:2512235344, ack 3391575180, win 85, options [nop,nop,TS val 3793086739 ecr 1097792220], length 4
 00:00:41.035375 IP 10.0.0.8.45094 > 10.0.0.6.1883: Flags [.], ack 2512235344, win 83, options [nop,nop,TS val 1097792262 ecr 3793086739], length 0
 00:00:42.002969 IP 10.0.0.8.45094 > 10.0.0.6.1883: Flags [P.], seq 3391575180:3391575575, ack 2512235344, win 83, options [nop,nop,TS val 1097793230 ecr 3793086739], length 395
 00:00:42.003203 IP 10.0.0.6.1883 > 10.0.0.8.45094: Flags [P.], seq 2512235344:2512235348, ack 3391575575, win 85, options [nop,nop,TS val 3793087749 ecr 1097793230], length 4
 00:00:42.003544 IP 10.0.0.8.45094 > 10.0.0.6.1883: Flags [.], ack 2512235348, win 83, options [nop,nop,TS val 1097793231 ecr 3793087749], length 0
 00:00:42.003592 IP 10.0.0.8.45094 > 10.0.0.6.1883: Flags [P.], seq 3391575575:3391575579, ack 2512235348, win 83, options [nop,nop,TS val 1097793231 ecr 3793087749], length 4
 00:00:42.003749 IP 10.0.0.6.1883 > 10.0.0.8.45094: Flags [P.], seq 2512235348:2512235352, ack 3391575579, win 85, options [nop,nop,TS val 3793087749 ecr 1097793231], length 4
 00:00:42.049611 IP 10.0.0.8.45094 > 10.0.0.6.1883: Flags [.], ack 2512235352, win 83, options [nop,nop,TS val 1097793277 ecr 3793087749], length 0
