00:00:02.649103 IP 10.0.0.6.1883 > 10.0.0.8.44828: Flags [S.], seq 1598809727, ack 313949054, win 43440, options [mss 1460,sackOK,TS val 3791197145 ecr 1095902584,nop,wscale 9], length 0
00:00:02.657798 IP 10.0.0.6.1883 > 10.0.0.8.44828: Flags [.], ack 313949074, win 85, options [nop,nop,TS val 3791197154 ecr 1095902636], length 0
00:00:02.658325 IP 10.0.0.6.1883 > 10.0.0.8.44828: Flags [P.], seq 1598809728:1598809732, ack 313949074, win 85, options [nop,nop,TS val 3791197154 ecr 1095902636], length 4
00:00:02.659590 IP 10.0.0.6.1883 > 10.0.0.8.44828: Flags [P.], seq 1598809732:1598809797, ack 313949138, win 85, options [nop,nop,TS val 3791197156 ecr 1095902637], length 65
00:00:02.660076 IP 10.0.0.6.1883 > 10.0.0.8.44828: Flags [P.], seq 1598809797:1598809802, ack 313949533, win 85, options [nop,nop,TS val 3791197156 ecr 1095902638], length 5
00:00:02.706796 IP 10.0.0.6.1883 > 10.0.0.8.44828: Flags [P.], seq 1598809802:1598809806, ack 313949533, win 85, options [nop,nop,TS val 3791197203 ecr 1095902685], length 4
00:00:02.708737 IP 10.0.0.6.1883 > 10.0.0.8.44828: Flags [P.], seq 1598809806:1598809810, ack 313949537, win 85, options [nop,nop,TS val 3791197205 ecr 1095902686], length 4
00:00:03.612441 IP 10.0.0.6.1883 > 10.0.0.8.44828: Flags [P.], seq 1598809810:1598809814, ack 313949932, win 85, options [nop,nop,TS val 3791198108 ecr 1095903588], length 4
00:00:03.615355 IP 10.0.0.6.1883 > 10.0.0.8.44828: Flags [P.], seq 1598809814:1598809818, ack 313949936, win 85, options [nop,nop,TS val 3791198111 ecr 1095903591], length 4
00:00:04.613821 IP 10.0.0.6.1883 > 10.0.0.8.44828: Flags [P.], seq 1598809818:1598809822, ack 313950331, win 85, options [nop,nop,TS val 3791199109 ecr 1095904588], length 4
00:00:04.617465 IP 10.0.0.6.1883 > 10.0.0.8.44828: Flags [P.], seq 1598809822:1598809826, ack 313950335, win 85, options [nop,nop,TS val 3791199113 ecr 1095904592], length 4
00:00:05.616458 IP 10.0.0.6.1883 > 10.0.0.8.44828: Flags [P.], seq 1598809826:1598809830, ack 313950730, win 85, options [nop,nop,TS val 3791200111 ecr 1095905589], length 4
00:00:05.619826 IP 10.0.0.6.1883 > 10.0.0.8.44828: Flags [P.], seq 1598809830:1598809834, ack 313950734, win 85, options [nop,nop,TS val 3791200114 ecr 1095905594], length 4
00:00:06.617763 IP 10.0.0.6.1883 > 10.0.0.8.44828: Flags [P.], seq 1598809834:1598809838, ack 313951129, win 85, options [nop,nop,TS val 3791201112 ecr 1095906591], length 4
00:00:06.620676 IP 10.0.0.6.1883 > 10.0.0.8.44828: Flags [P.], seq 1598809838:1598809842, ack 313951133, win 85, options [nop,nop,TS val 3791201115 ecr 1095906594], length 4
00:00:07.620387 IP 10.0.0.6.1883 > 10.0.0.8.44828: Flags [P.], seq 1598809842:1598809846, ack 313951528, win 85, options [nop,nop,TS val 3791202114 ecr 1095907593], length 4
00:00:07.623096 IP 10.0.0.6.1883 > 10.0.0.8.44828: Flags [P.], seq 1598809846:1598809850, ack 313951532, win 85, options [nop,nop,TS val 3791202116 ecr 1095907597], length 4
00:00:07.666729 IP 10.0.0.6.1883 > 10.0.0.8.44828: Flags [P.], seq 1598809850:1598809852, ack 313951534, win 85, options [nop,nop,TS val 3791202160 ecr 1095907639], length 2
00:00:08.623814 IP 10.0.0.6.1883 > 10.0.0.8.44828: Flags [P.], seq 1598809852:1598809856, ack 313951929, win 85, options [nop,nop,TS val 3791203117 ecr 1095908594], length 4
00:00:08.627085 IP 10.0.0.6.1883 > 10.0.0.8.44828: Flags [P.], seq 1598809856:1598809860, ack 313951933, win 85, options [nop,nop,TS val 3791203120 ecr 1095908600], length 4
00:00:09.622465 IP 10.0.0.6.1883 > 10.0.0.8.44828: Flags [P.], seq 1598809860:1598809864, ack 313952328, win 85, options [nop,nop,TS val 3791204115 ecr 1095909595], length 4
00:00:09.624288 IP 10.0.0.6.1883 > 10.0.0.8.44828: Flags [P.], seq 1598809864:1598809868, ack 313952332, win 85, options [nop,nop,TS val 3791204117 ecr 1095909598], length 4
00:00:10.624413 IP 10.0.0.6.1883 > 10.0.0.8.44828: Flags [P.], seq 1598809868:1598809872, ack 313952727, win 85, options [nop,nop,TS val 3791205116 ecr 1095910597], length 4
00:00:10.627934 IP 10.0.0.6.1883 > 10.0.0.8.44828: Flags [P.], seq 1598809872:1598809876, ack 313952731, win 85, options [nop,nop,TS val 3791205120 ecr 1095910600], length 4
00:00:11.626013 IP 10.0.0.6.1883 > 10.0.0.8.44828: Flags [P.], seq 1598809876:1598809880, ack 313953126, win 85, options [nop,nop,TS val 3791206118 ecr 1095911598], length 4
00:00:11.627922 IP 10.0.0.6.1883 > 10.0.0.8.44828: Flags [P.], seq 1598809880:1598809884, ack 313953130, win 85, options [nop,nop,TS val 3791206120 ecr 1095911600], length 4
00:00:12.626977 IP 10.0.0.6.1883 > 10.0.0.8.44828: Flags [P.], seq 1598809884:1598809888, ack 313953525, win 85, options [nop,nop,TS val 3791207118 ecr 1095912598], length 4
00:00:12.628626 IP 10.0.0.6.1883 > 10.0.0.8.44828: Flags [P.], seq 1598809888:1598809892, ack 313953529, win 85, options [nop,nop,TS val 3791207120 ecr 1095912601], length 4
00:00:12.666060 IP 10.0.0.6.1883 > 10.0.0.8.44828: Flags [P.], seq 1598809892:1598809894, ack 313953531, win 85, options [nop,nop,TS val 3791207157 ecr 1095912638], length 2
00:00:13.626794 IP 10.0.0.6.1883 > 10.0.0.8.44828: Flags [P.], seq 1598809894:1598809898, ack 313953926, win 85, options [nop,nop,TS val 3791208117 ecr 1095913598], length 4
00:00:13.632410 IP 10.0.0.6.1883 > 10.0.0.8.44828: Flags [P.], seq 1598809898:1598809902, ack 313953930, win 85, options [nop,nop,TS val 3791208122 ecr 1095913603], length 4
00:00:14.629264 IP 10.0.0.6.1883 > 10.0.0.8.44828: Flags [P.], seq 1598809902:1598809906, ack 313954325, win 85, options [nop,nop,TS val 3791209119 ecr 1095914599], length 4
00:00:14.632153 IP 10.0.0.6.1883 > 10.0.0.8.44828: Flags [P.], seq 1598809906:1598809910, ack 313954329, win 85, options [nop,nop,TS val 3791209122 ecr 1095914602], length 4
00:00:15.630095 IP 10.0.0.6.1883 > 10.0.0.8.44828: Flags [P.], seq 1598809910:1598809914, ack 313954724, win 85, options [nop,nop,TS val 3791210120 ecr 1095915599], length 4
00:00:15.632190 IP 10.0.0.6.1883 > 10.0.0.8.44828: Flags [P.], seq 1598809914:1598809918, ack 313954728, win 85, options [nop,nop,TS val 3791210122 ecr 1095915602], length 4
00:00:16.630686 IP 10.0.0.6.1883 > 10.0.0.8.44828: Flags [P.], seq 1598809918:1598809922, ack 313955123, win 85, options [nop,nop,TS val 3791211120 ecr 1095916601], length 4
00:00:16.633041 IP 10.0.0.6.1883 > 10.0.0.8.44828: Flags [P.], seq 1598809922:1598809926, ack 313955127, win 85, options [nop,nop,TS val 3791211122 ecr 1095916603], length 4
00:00:17.645646 IP 10.0.0.6.1883 > 10.0.0.8.44828: Flags [P.], seq 1598809926:1598809930, ack 313955522, win 85, options [nop,nop,TS val 3791212122 ecr 1095917602], length 4
00:00:17.721117 IP 10.0.0.6.1883 > 10.0.0.8.44828: Flags [P.], seq 1598809930:1598809932, ack 313955524, win 85, options [nop,nop,TS val 3791212210 ecr 1095917690], length 2
00:00:17.735775 IP 10.0.0.6.1883 > 10.0.0.8.44828: Flags [P.], seq 1598809932:1598809936, ack 313955528, win 85, options [nop,nop,TS val 3791212224 ecr 1095917704], length 4
00:00:18.639709 IP 10.0.0.6.1883 > 10.0.0.8.44828: Flags [P.], seq 1598809936:1598809940, ack 313955923, win 85, options [nop,nop,TS val 3791213128 ecr 1095918605], length 4
00:00:18.643849 IP 10.0.0.6.1883 > 10.0.0.8.44828: Flags [P.], seq 1598809940:1598809944, ack 313955927, win 85, options [nop,nop,TS val 3791213131 ecr 1095918613], length 4
00:00:19.761770 IP 10.0.0.6.1883 > 10.0.0.8.44828: Flags [P.], seq 1598809944:1598809948, ack 313956322, win 85, options [nop,nop,TS val 3791214249 ecr 1095919729], length 4
00:00:19.766994 IP 10.0.0.6.1883 > 10.0.0.8.44828: Flags [P.], seq 1598809948:1598809952, ack 313956326, win 85, options [nop,nop,TS val 3791214255 ecr 1095919735], length 4
00:00:20.122485 IP 10.0.0.6.1883 > 10.0.0.8.44828: Flags [P.], seq 1598809948:1598809952, ack 313956326, win 85, options [nop,nop,TS val 3791214610 ecr 1095919735], length 4
00:00:20.765166 IP 10.0.0.6.1883 > 10.0.0.8.44828: Flags [P.], seq 1598809952:1598809956, ack 313956721, win 85, options [nop,nop,TS val 3791215252 ecr 1095920732], length 4
00:00:20.767740 IP 10.0.0.6.1883 > 10.0.0.8.44828: Flags [P.], seq 1598809956:1598809960, ack 313956725, win 85, options [nop,nop,TS val 3791215255 ecr 1095920735], length 4
00:00:21.765991 IP 10.0.0.6.1883 > 10.0.0.8.44828: Flags [P.], seq 1598809960:1598809964, ack 313957120, win 85, options [nop,nop,TS val 3791216253 ecr 1095921733], length 4
00:00:21.772026 IP 10.0.0.6.1883 > 10.0.0.8.44828: Flags [P.], seq 1598809964:1598809968, ack 313957124, win 85, options [nop,nop,TS val 3791216259 ecr 1095921739], length 4
00:00:22.770607 IP 10.0.0.6.1883 > 10.0.0.8.44828: Flags [P.], seq 1598809968:1598809972, ack 313957519, win 85, options [nop,nop,TS val 3791217257 ecr 1095922737], length 4
00:00:22.773023 IP 10.0.0.6.1883 > 10.0.0.8.44828: Flags [P.], seq 1598809972:1598809974, ack 313957521, win 85, options [nop,nop,TS val 3791217259 ecr 1095922739], length 2
00:00:22.775336 IP 10.0.0.6.1883 > 10.0.0.8.44828: Flags [P.], seq 1598809974:1598809978, ack 313957525, win 85, options [nop,nop,TS val 3791217261 ecr 1095922742], length 4
00:00:23.774775 IP 10.0.0.6.1883 > 10.0.0.8.44828: Flags [P.], seq 1598809978:1598809982, ack 313957920, win 85, options [nop,nop,TS val 3791218260 ecr 1095923740], length 4
00:00:23.777190 IP 10.0.0.6.1883 > 10.0.0.8.44828: Flags [P.], seq 1598809982:1598809986, ack 313957924, win 85, options [nop,nop,TS val 3791218263 ecr 1095923743], length 4
00:00:24.778330 IP 10.0.0.6.1883 > 10.0.0.8.44828: Flags [P.], seq 1598809986:1598809990, ack 313958319, win 85, options [nop,nop,TS val 3791219263 ecr 1095924743], length 4
00:00:24.779852 IP 10.0.0.6.1883 > 10.0.0.8.44828: Flags [P.], seq 1598809990:1598809994, ack 313958323, win 85, options [nop,nop,TS val 3791219265 ecr 1095924747], length 4
00:00:25.779101 IP 10.0.0.6.1883 > 10.0.0.8.44828: Flags [P.], seq 1598809994:1598809998, ack 313958718, win 85, options [nop,nop,TS val 3791220264 ecr 1095925743], length 4
00:00:25.781471 IP 10.0.0.6.1883 > 10.0.0.8.44828: Flags [P.], seq 1598809998:1598810002, ack 313958722, win 85, options [nop,nop,TS val 3791220266 ecr 1095925747], length 4
00:00:26.796484 IP 10.0.0.6.1883 > 10.0.0.8.44828: Flags [P.], seq 1598810002:1598810006, ack 313959117, win 85, options [nop,nop,TS val 3791221281 ecr 1095926761], length 4
00:00:26.798329 IP 10.0.0.6.1883 > 10.0.0.8.44828: Flags [P.], seq 1598810006:1598810010, ack 313959121, win 85, options [nop,nop,TS val 3791221282 ecr 1095926763], length 4
00:00:27.841538 IP 10.0.0.6.1883 > 10.0.0.8.44828: Flags [P.], seq 1598810010:1598810014, ack 313959516, win 85, options [nop,nop,TS val 3791222325 ecr 1095927805], length 4
00:00:27.842793 IP 10.0.0.6.1883 > 10.0.0.8.44828: Flags [P.], seq 1598810014:1598810016, ack 313959518, win 85, options [nop,nop,TS val 3791222326 ecr 1095927808], length 2
00:00:27.844081 IP 10.0.0.6.1883 > 10.0.0.8.44828: Flags [P.], seq 1598810016:1598810020, ack 313959522, win 85, options [nop,nop,TS val 3791222328 ecr 1095927809], length 4
00:00:28.841930 IP 10.0.0.6.1883 > 10.0.0.8.44828: Flags [P.], seq 1598810020:1598810024, ack 313959917, win 85, options [nop,nop,TS val 3791223325 ecr 1095928806], length 4
00:00:28.844349 IP 10.0.0.6.1883 > 10.0.0.8.44828: Flags [P.], seq 1598810024:1598810028, ack 313959921, win 85, options [nop,nop,TS val 3791223327 ecr 1095928809], length 4
00:00:29.843332 IP 10.0.0.6.1883 > 10.0.0.8.44828: Flags [P.], seq 1598810028:1598810032, ack 313960316, win 85, options [nop,nop,TS val 3791224326 ecr 1095929807], length 4
00:00:29.845699 IP 10.0.0.6.1883 > 10.0.0.8.44828: Flags [P.], seq 1598810032:1598810036, ack 313960320, win 85, options [nop,nop,TS val 3791224328 ecr 1095929809], length 4
00:00:30.844685 IP 10.0.0.6.1883 > 10.0.0.8.44828: Flags [P.], seq 1598810036:1598810040, ack 313960715, win 85, options [nop,nop,TS val 3791225327 ecr 1095930808], length 4
00:00:30.846571 IP 10.0.0.6.1883 > 10.0.0.8.44828: Flags [P.], seq 1598810040:1598810044, ack 313960719, win 85, options [nop,nop,TS val 3791225329 ecr 1095930810], length 4
00:00:31.846130 IP 10.0.0.6.1883 > 10.0.0.8.44828: Flags [P.], seq 1598810044:1598810048, ack 313961114, win 85, options [nop,nop,TS val 3791226328 ecr 1095931809], length 4
00:00:31.848051 IP 10.0.0.6.1883 > 10.0.0.8.44828: Flags [P.], seq 1598810048:1598810052, ack 313961118, win 85, options [nop,nop,TS val 3791226330 ecr 1095931811], length 4
00:00:32.843451 IP 10.0.0.6.1883 > 10.0.0.8.44828: Flags [P.], seq 1598810052:1598810054, ack 313961120, win 85, options [nop,nop,TS val 3791227324 ecr 1095932806], length 2
00:00:32.846945 IP 10.0.0.6.1883 > 10.0.0.8.44828: Flags [P.], seq 1598810054:1598810058, ack 313961515, win 85, options [nop,nop,TS val 3791227328 ecr 1095932808], length 4
00:00:32.847441 IP 10.0.0.6.1883 > 10.0.0.8.44828: Flags [P.], seq 1598810058:1598810062, ack 313961519, win 85, options [nop,nop,TS val 3791227329 ecr 1095932810], length 4
00:00:33.847806 IP 10.0.0.6.1883 > 10.0.0.8.44828: Flags [P.], seq 1598810062:1598810066, ack 313961914, win 85, options [nop,nop,TS val 3791228328 ecr 1095933809], length 4
00:00:33.849820 IP 10.0.0.6.1883 > 10.0.0.8.44828: Flags [P.], seq 1598810066:1598810070, ack 313961918, win 85, options [nop,nop,TS val 3791228330 ecr 1095933811], length 4
00:00:34.849182 IP 10.0.0.6.1883 > 10.0.0.8.44828: Flags [P.], seq 1598810070:1598810074, ack 313962313, win 85, options [nop,nop,TS val 3791229329 ecr 1095934810], length 4
00:00:34.851396 IP 10.0.0.6.1883 > 10.0.0.8.44828: Flags [P.], seq 1598810074:1598810078, ack 313962317, win 85, options [nop,nop,TS val 3791229331 ecr 1095934813], length 4
00:00:35.849492 IP 10.0.0.6.1883 > 10.0.0.8.44828: Flags [P.], seq 1598810078:1598810082, ack 313962712, win 85, options [nop,nop,TS val 3791230329 ecr 1095935810], length 4
00:00:35.851119 IP 10.0.0.6.1883 > 10.0.0.8.44828: Flags [P.], seq 1598810082:1598810086, ack 313962716, win 85, options [nop,nop,TS val 3791230331 ecr 1095935812], length 4
00:00:36.850337 IP 10.0.0.6.1883 > 10.0.0.8.44828: Flags [P.], seq 1598810086:1598810090, ack 313963111, win 85, options [nop,nop,TS val 3791231329 ecr 1095936811], length 4
00:00:36.852088 IP 10.0.0.6.1883 > 10.0.0.8.44828: Flags [P.], seq 1598810090:1598810094, ack 313963115, win 85, options [nop,nop,TS val 3791231331 ecr 1095936813], length 4
00:00:37.845048 IP 10.0.0.6.1883 > 10.0.0.8.44828: Flags [P.], seq 1598810094:1598810096, ack 313963117, win 85, options [nop,nop,TS val 3791232323 ecr 1095937805], length 2
00:00:37.851753 IP 10.0.0.6.1883 > 10.0.0.8.44828: Flags [P.], seq 1598810096:1598810100, ack 313963512, win 85, options [nop,nop,TS val 3791232330 ecr 1095937811], length 4
00:00:37.853390 IP 10.0.0.6.1883 > 10.0.0.8.44828: Flags [P.], seq 1598810100:1598810104, ack 313963516, win 85, options [nop,nop,TS val 3791232332 ecr 1095937813], length 4
00:00:38.852880 IP 10.0.0.6.1883 > 10.0.0.8.44828: Flags [P.], seq 1598810104:1598810108, ack 313963911, win 85, options [nop,nop,TS val 3791233331 ecr 1095938812], length 4
00:00:38.854415 IP 10.0.0.6.1883 > 10.0.0.8.44828: Flags [P.], seq 1598810108:1598810112, ack 313963915, win 85, options [nop,nop,TS val 3791233333 ecr 1095938814], length 4
00:00:39.853989 IP 10.0.0.6.1883 > 10.0.0.8.44828: Flags [P.], seq 1598810112:1598810116, ack 313964310, win 85, options [nop,nop,TS val 3791234332 ecr 1095939812], length 4
00:00:39.856118 IP 10.0.0.6.1883 > 10.0.0.8.44828: Flags [P.], seq 1598810116:1598810120, ack 313964314, win 85, options [nop,nop,TS val 3791234334 ecr 1095939815], length 4
00:00:40.855673 IP 10.0.0.6.1883 > 10.0.0.8.44828: Flags [P.], seq 1598810120:1598810124, ack 313964709, win 85, options [nop,nop,TS val 3791235333 ecr 1095940814], length 4
00:00:40.857338 IP 10.0.0.6.1883 > 10.0.0.8.44828: Flags [P.], seq 1598810124:1598810128, ack 313964713, win 85, options [nop,nop,TS val 3791235334 ecr 1095940815], length 4
00:00:41.857122 IP 10.0.0.6.1883 > 10.0.0.8.44828: Flags [P.], seq 1598810128:1598810132, ack 313965108, win 85, options [nop,nop,TS val 3791236334 ecr 1095941815], length 4
00:00:41.859103 IP 10.0.0.6.1883 > 10.0.0.8.44828: Flags [P.], seq 1598810132:1598810136, ack 313965112, win 85, options [nop,nop,TS val 3791236336 ecr 1095941817], length 4
00:00:42.846247 IP 10.0.0.6.1883 > 10.0.0.8.44828: Flags [P.], seq 1598810136:1598810138, ack 313965114, win 85, options [nop,nop,TS val 3791237322 ecr 1095942804], length 2
00:00:42.859140 IP 10.0.0.6.1883 > 10.0.0.8.44828: Flags [P.], seq 1598810138:1598810142, ack 313965509, win 85, options [nop,nop,TS val 3791237335 ecr 1095942816], length 4
00:00:42.860718 IP 10.0.0.6.1883 > 10.0.0.8.44828: Flags [P.], seq 1598810142:1598810146, ack 313965513, win 85, options [nop,nop,TS val 3791237337 ecr 1095942818], length 4
00:00:43.860898 IP 10.0.0.6.1883 > 10.0.0.8.44828: Flags [P.], seq 1598810146:1598810150, ack 313965908, win 85, options [nop,nop,TS val 3791238336 ecr 1095943817], length 4
00:00:43.862644 IP 10.0.0.6.1883 > 10.0.0.8.44828: Flags [P.], seq 1598810150:1598810154, ack 313965912, win 85, options [nop,nop,TS val 3791238338 ecr 1095943820], length 4
00:00:44.861691 IP 10.0.0.6.1883 > 10.0.0.8.44828: Flags [P.], seq 1598810154:1598810158, ack 313966307, win 85, options [nop,nop,TS val 3791239337 ecr 1095944818], length 4
00:00:44.863883 IP 10.0.0.6.1883 > 10.0.0.8.44828: Flags [P.], seq 1598810158:1598810162, ack 313966311, win 85, options [nop,nop,TS val 3791239339 ecr 1095944820], length 4
00:00:45.862301 IP 10.0.0.6.1883 > 10.0.0.8.44828: Flags [P.], seq 1598810162:1598810166, ack 313966706, win 85, options [nop,nop,TS val 3791240337 ecr 1095945818], length 4
00:00:45.863700 IP 10.0.0.6.1883 > 10.0.0.8.44828: Flags [P.], seq 1598810166:1598810170, ack 313966710, win 85, options [nop,nop,TS val 3791240338 ecr 1095945819], length 4
00:00:46.877338 IP 10.0.0.6.1883 > 10.0.0.8.44828: Flags [P.], seq 1598810170:1598810174, ack 313967105, win 85, options [nop,nop,TS val 3791241351 ecr 1095946832], length 4
00:00:46.879344 IP 10.0.0.6.1883 > 10.0.0.8.44828: Flags [P.], seq 1598810174:1598810178, ack 313967109, win 85, options [nop,nop,TS val 3791241353 ecr 1095946834], length 4
00:00:47.847150 IP 10.0.0.6.1883 > 10.0.0.8.44828: Flags [P.], seq 1598810178:1598810180, ack 313967111, win 85, options [nop,nop,TS val 3791242321 ecr 1095947802], length 2
00:00:47.879459 IP 10.0.0.6.1883 > 10.0.0.8.44828: Flags [P.], seq 1598810180:1598810184, ack 313967506, win 85, options [nop,nop,TS val 3791242353 ecr 1095947834], length 4
00:00:47.881612 IP 10.0.0.6.1883 > 10.0.0.8.44828: Flags [P.], seq 1598810184:1598810188, ack 313967510, win 85, options [nop,nop,TS val 3791242355 ecr 1095947836], length 4
00:00:48.902187 IP 10.0.0.6.1883 > 10.0.0.8.44828: Flags [P.], seq 1598810188:1598810192, ack 313967905, win 85, options [nop,nop,TS val 3791243372 ecr 1095948853], length 4
00:00:48.903584 IP 10.0.0.6.1883 > 10.0.0.8.44828: Flags [P.], seq 1598810192:1598810196, ack 313967909, win 85, options [nop,nop,TS val 3791243377 ecr 1095948858], length 4
00:00:49.901232 IP 10.0.0.6.1883 > 10.0.0.8.44828: Flags [P.], seq 1598810196:1598810200, ack 313968304, win 85, options [nop,nop,TS val 3791244374 ecr 1095949854], length 4
00:00:49.903636 IP 10.0.0.6.1883 > 10.0.0.8.44828: Flags [P.], seq 1598810200:1598810204, ack 313968308, win 85, options [nop,nop,TS val 3791244376 ecr 1095949857], length 4
00:00:50.901703 IP 10.0.0.6.1883 > 10.0.0.8.44828: Flags [P.], seq 1598810204:1598810208, ack 313968703, win 85, options [nop,nop,TS val 3791245374 ecr 1095950855], length 4
00:00:50.903296 IP 10.0.0.6.1883 > 10.0.0.8.44828: Flags [P.], seq 1598810208:1598810212, ack 313968707, win 85, options [nop,nop,TS val 3791245375 ecr 1095950857], length 4
00:00:51.903034 IP 10.0.0.6.1883 > 10.0.0.8.44828: Flags [P.], seq 1598810212:1598810216, ack 313969102, win 85, options [nop,nop,TS val 3791246375 ecr 1095951856], length 4
00:00:51.904562 IP 10.0.0.6.1883 > 10.0.0.8.44828: Flags [P.], seq 1598810216:1598810220, ack 313969106, win 85, options [nop,nop,TS val 3791246376 ecr 1095951857], length 4
00:00:52.915486 IP 10.0.0.6.1883 > 10.0.0.8.44828: Flags [P.], seq 1598810220:1598810224, ack 313969501, win 85, options [nop,nop,TS val 3791247387 ecr 1095952868], length 4
00:00:52.917496 IP 10.0.0.6.1883 > 10.0.0.8.44828: Flags [P.], seq 1598810224:1598810226, ack 313969503, win 85, options [nop,nop,TS val 3791247388 ecr 1095952869], length 2
00:00:52.918516 IP 10.0.0.6.1883 > 10.0.0.8.44828: Flags [P.], seq 1598810226:1598810230, ack 313969507, win 85, options [nop,nop,TS val 3791247390 ecr 1095952871], length 4
00:00:53.924726 IP 10.0.0.6.1883 > 10.0.0.8.44828: Flags [P.], seq 1598810230:1598810234, ack 313969902, win 85, options [nop,nop,TS val 3791248395 ecr 1095953876], length 4
00:00:53.926542 IP 10.0.0.6.1883 > 10.0.0.8.44828: Flags [P.], seq 1598810234:1598810238, ack 313969906, win 85, options [nop,nop,TS val 3791248397 ecr 1095953878], length 4
00:00:54.932264 IP 10.0.0.6.1883 > 10.0.0.8.44828: Flags [P.], seq 1598810238:1598810242, ack 313970301, win 85, options [nop,nop,TS val 3791249402 ecr 1095954883], length 4
00:00:54.934282 IP 10.0.0.6.1883 > 10.0.0.8.44828: Flags [P.], seq 1598810242:1598810246, ack 313970305, win 85, options [nop,nop,TS val 3791249404 ecr 1095954886], length 4
00:00:55.934384 IP 10.0.0.6.1883 > 10.0.0.8.44828: Flags [P.], seq 1598810246:1598810250, ack 313970700, win 85, options [nop,nop,TS val 3791250404 ecr 1095955885], length 4
00:00:55.937763 IP 10.0.0.6.1883 > 10.0.0.8.44828: Flags [P.], seq 1598810250:1598810254, ack 313970704, win 85, options [nop,nop,TS val 3791250407 ecr 1095955887], length 4
00:00:56.935124 IP 10.0.0.6.1883 > 10.0.0.8.44828: Flags [P.], seq 1598810254:1598810258, ack 313971099, win 85, options [nop,nop,TS val 3791251404 ecr 1095956885], length 4
00:00:56.936765 IP 10.0.0.6.1883 > 10.0.0.8.44828: Flags [P.], seq 1598810258:1598810262, ack 313971103, win 85, options [nop,nop,TS val 3791251406 ecr 1095956887], length 4
00:00:57.915698 IP 10.0.0.6.1883 > 10.0.0.8.44828: Flags [P.], seq 1598810262:1598810264, ack 313971105, win 85, options [nop,nop,TS val 3791252384 ecr 1095957866], length 2
00:00:57.935530 IP 10.0.0.6.1883 > 10.0.0.8.44828: Flags [P.], seq 1598810264:1598810268, ack 313971500, win 85, options [nop,nop,TS val 3791252404 ecr 1095957886], length 4
00:00:57.936264 IP 10.0.0.6.1883 > 10.0.0.8.44828: Flags [P.], seq 1598810268:1598810272, ack 313971504, win 85, options [nop,nop,TS val 3791252405 ecr 1095957887], length 4
00:00:58.942135 IP 10.0.0.6.1883 > 10.0.0.8.44828: Flags [P.], seq 1598810272:1598810276, ack 313971899, win 85, options [nop,nop,TS val 3791253410 ecr 1095958891], length 4
00:00:58.943901 IP 10.0.0.6.1883 > 10.0.0.8.44828: Flags [P.], seq 1598810276:1598810280, ack 313971903, win 85, options [nop,nop,TS val 3791253412 ecr 1095958893], length 4
00:00:59.942026 IP 10.0.0.6.1883 > 10.0.0.8.44828: Flags [P.], seq 1598810280:1598810284, ack 313972298, win 85, options [nop,nop,TS val 3791254410 ecr 1095959891], length 4
00:00:59.942932 IP 10.0.0.6.1883 > 10.0.0.8.44828: Flags [P.], seq 1598810284:1598810288, ack 313972302, win 85, options [nop,nop,TS val 3791254411 ecr 1095959892], length 4
00:01:00.945535 IP 10.0.0.6.1883 > 10.0.0.8.44828: Flags [P.], seq 1598810288:1598810292, ack 313972697, win 85, options [nop,nop,TS val 3791255412 ecr 1095960892], length 4
00:01:00.949479 IP 10.0.0.6.1883 > 10.0.0.8.44828: Flags [P.], seq 1598810292:1598810296, ack 313972701, win 85, options [nop,nop,TS val 3791255416 ecr 1095960896], length 4
00:01:01.946154 IP 10.0.0.6.1883 > 10.0.0.8.44828: Flags [P.], seq 1598810296:1598810300, ack 313973096, win 85, options [nop,nop,TS val 3791256413 ecr 1095961893], length 4
00:01:01.948006 IP 10.0.0.6.1883 > 10.0.0.8.44828: Flags [P.], seq 1598810300:1598810304, ack 313973100, win 85, options [nop,nop,TS val 3791256415 ecr 1095961895], length 4
00:01:02.918309 IP 10.0.0.6.1883 > 10.0.0.8.44828: Flags [P.], seq 1598810304:1598810306, ack 313973102, win 85, options [nop,nop,TS val 3791257384 ecr 1095962865], length 2
00:01:02.948293 IP 10.0.0.6.1883 > 10.0.0.8.44828: Flags [P.], seq 1598810306:1598810310, ack 313973497, win 85, options [nop,nop,TS val 3791257414 ecr 1095962894], length 4
00:01:02.950122 IP 10.0.0.6.1883 > 10.0.0.8.44828: Flags [P.], seq 1598810310:1598810314, ack 313973501, win 85, options [nop,nop,TS val 3791257416 ecr 1095962897], length 4
00:01:03.950180 IP 10.0.0.6.1883 > 10.0.0.8.44828: Flags [P.], seq 1598810314:1598810318, ack 313973896, win 85, options [nop,nop,TS val 3791258416 ecr 1095963895], length 4
00:01:03.952688 IP 10.0.0.6.1883 > 10.0.0.8.44828: Flags [P.], seq 1598810318:1598810322, ack 313973900, win 85, options [nop,nop,TS val 3791258418 ecr 1095963899], length 4
00:01:04.950955 IP 10.0.0.6.1883 > 10.0.0.8.44828: Flags [P.], seq 1598810322:1598810326, ack 313974295, win 85, options [nop,nop,TS val 3791259416 ecr 1095964896], length 4
00:01:04.952595 IP 10.0.0.6.1883 > 10.0.0.8.44828: Flags [P.], seq 1598810326:1598810330, ack 313974299, win 85, options [nop,nop,TS val 3791259418 ecr 1095964899], length 4
00:01:05.953514 IP 10.0.0.6.1883 > 10.0.0.8.44828: Flags [P.], seq 1598810330:1598810334, ack 313974694, win 85, options [nop,nop,TS val 3791260418 ecr 1095965899], length 4
00:01:05.954093 IP 10.0.0.6.1883 > 10.0.0.8.44828: Flags [P.], seq 1598810334:1598810338, ack 313974698, win 85, options [nop,nop,TS val 3791260419 ecr 1095965900], length 4
00:01:06.954039 IP 10.0.0.6.1883 > 10.0.0.8.44828: Flags [P.], seq 1598810338:1598810342, ack 313975093, win 85, options [nop,nop,TS val 3791261418 ecr 1095966899], length 4
00:01:06.954863 IP 10.0.0.6.1883 > 10.0.0.8.44828: Flags [P.], seq 1598810342:1598810346, ack 313975097, win 85, options [nop,nop,TS val 3791261419 ecr 1095966901], length 4
00:01:07.918930 IP 10.0.0.6.1883 > 10.0.0.8.44828: Flags [P.], seq 1598810346:1598810348, ack 313975099, win 85, options [nop,nop,TS val 3791262382 ecr 1095967863], length 2
00:01:07.956547 IP 10.0.0.6.1883 > 10.0.0.8.44828: Flags [P.], seq 1598810348:1598810352, ack 313975494, win 85, options [nop,nop,TS val 3791262420 ecr 1095967900], length 4
00:01:07.958682 IP 10.0.0.6.1883 > 10.0.0.8.44828: Flags [P.], seq 1598810352:1598810356, ack 313975498, win 85, options [nop,nop,TS val 3791262422 ecr 1095967903], length 4
00:01:08.956200 IP 10.0.0.6.1883 > 10.0.0.8.44828: Flags [P.], seq 1598810356:1598810360, ack 313975893, win 85, options [nop,nop,TS val 3791263419 ecr 1095968900], length 4
00:01:08.957726 IP 10.0.0.6.1883 > 10.0.0.8.44828: Flags [P.], seq 1598810360:1598810364, ack 313975897, win 85, options [nop,nop,TS val 3791263421 ecr 1095968902], length 4
00:01:09.958528 IP 10.0.0.6.1883 > 10.0.0.8.44828: Flags [P.], seq 1598810364:1598810368, ack 313976292, win 85, options [nop,nop,TS val 3791264421 ecr 1095969901], length 4
00:01:09.960436 IP 10.0.0.6.1883 > 10.0.0.8.44828: Flags [P.], seq 1598810368:1598810372, ack 313976296, win 85, options [nop,nop,TS val 3791264422 ecr 1095969904], length 4
00:01:10.960660 IP 10.0.0.6.1883 > 10.0.0.8.44828: Flags [P.], seq 1598810372:1598810376, ack 313976691, win 85, options [nop,nop,TS val 3791265423 ecr 1095970903], length 4
00:01:10.962389 IP 10.0.0.6.1883 > 10.0.0.8.44828: Flags [P.], seq 1598810376:1598810380, ack 313976695, win 85, options [nop,nop,TS val 3791265424 ecr 1095970905], length 4
00:01:11.961518 IP 10.0.0.6.1883 > 10.0.0.8.44828: Flags [P.], seq 1598810380:1598810384, ack 313977090, win 85, options [nop,nop,TS val 3791266423 ecr 1095971904], length 4
00:01:11.962280 IP 10.0.0.6.1883 > 10.0.0.8.44828: Flags [P.], seq 1598810384:1598810388, ack 313977094, win 85, options [nop,nop,TS val 3791266424 ecr 1095971905], length 4
00:01:12.919755 IP 10.0.0.6.1883 > 10.0.0.8.44828: Flags [P.], seq 1598810388:1598810390, ack 313977096, win 85, options [nop,nop,TS val 3791267381 ecr 1095972862], length 2
00:01:12.962963 IP 10.0.0.6.1883 > 10.0.0.8.44828: Flags [P.], seq 1598810390:1598810394, ack 313977491, win 85, options [nop,nop,TS val 3791267424 ecr 1095972905], length 4
00:01:12.965224 IP 10.0.0.6.1883 > 10.0.0.8.44828: Flags [P.], seq 1598810394:1598810398, ack 313977495, win 85, options [nop,nop,TS val 3791267426 ecr 1095972907], length 4
00:01:13.964132 IP 10.0.0.6.1883 > 10.0.0.8.44828: Flags [P.], seq 1598810398:1598810402, ack 313977890, win 85, options [nop,nop,TS val 3791268425 ecr 1095973906], length 4
00:01:13.966031 IP 10.0.0.6.1883 > 10.0.0.8.44828: Flags [P.], seq 1598810402:1598810406, ack 313977894, win 85, options [nop,nop,TS val 3791268427 ecr 1095973908], length 4
00:01:14.965840 IP 10.0.0.6.1883 > 10.0.0.8.44828: Flags [P.], seq 1598810406:1598810410, ack 313978289, win 85, options [nop,nop,TS val 3791269426 ecr 1095974907], length 4
00:01:14.967775 IP 10.0.0.6.1883 > 10.0.0.8.44828: Flags [P.], seq 1598810410:1598810414, ack 313978293, win 85, options [nop,nop,TS val 3791269428 ecr 1095974909], length 4
00:01:15.966684 IP 10.0.0.6.1883 > 10.0.0.8.44828: Flags [P.], seq 1598810414:1598810418, ack 313978688, win 85, options [nop,nop,TS val 3791270426 ecr 1095975907], length 4
00:01:15.968118 IP 10.0.0.6.1883 > 10.0.0.8.44828: Flags [P.], seq 1598810418:1598810422, ack 313978692, win 85, options [nop,nop,TS val 3791270428 ecr 1095975909], length 4
00:01:16.968479 IP 10.0.0.6.1883 > 10.0.0.8.44828: Flags [P.], seq 1598810422:1598810426, ack 313979087, win 85, options [nop,nop,TS val 3791271428 ecr 1095976908], length 4
00:01:16.970280 IP 10.0.0.6.1883 > 10.0.0.8.44828: Flags [P.], seq 1598810426:1598810430, ack 313979091, win 85, options [nop,nop,TS val 3791271429 ecr 1095976911], length 4
00:01:17.922105 IP 10.0.0.6.1883 > 10.0.0.8.44828: Flags [P.], seq 1598810430:1598810432, ack 313979093, win 85, options [nop,nop,TS val 3791272381 ecr 1095977862], length 2
00:01:17.970207 IP 10.0.0.6.1883 > 10.0.0.8.44828: Flags [P.], seq 1598810432:1598810436, ack 313979488, win 85, options [nop,nop,TS val 3791272429 ecr 1095977910], length 4
00:01:17.972145 IP 10.0.0.6.1883 > 10.0.0.8.44828: Flags [P.], seq 1598810436:1598810440, ack 313979492, win 85, options [nop,nop,TS val 3791272431 ecr 1095977912], length 4
00:01:18.971691 IP 10.0.0.6.1883 > 10.0.0.8.44828: Flags [P.], seq 1598810440:1598810444, ack 313979887, win 85, options [nop,nop,TS val 3791273430 ecr 1095978911], length 4
00:01:18.973665 IP 10.0.0.6.1883 > 10.0.0.8.44828: Flags [P.], seq 1598810444:1598810448, ack 313979891, win 85, options [nop,nop,TS val 3791273432 ecr 1095978913], length 4
00:01:19.973486 IP 10.0.0.6.1883 > 10.0.0.8.44828: Flags [P.], seq 1598810448:1598810452, ack 313980286, win 85, options [nop,nop,TS val 3791274431 ecr 1095979912], length 4
00:01:19.975194 IP 10.0.0.6.1883 > 10.0.0.8.44828: Flags [P.], seq 1598810452:1598810456, ack 313980290, win 85, options [nop,nop,TS val 3791274433 ecr 1095979914], length 4
00:01:20.974811 IP 10.0.0.6.1883 > 10.0.0.8.44828: Flags [P.], seq 1598810456:1598810460, ack 313980685, win 85, options [nop,nop,TS val 3791275432 ecr 1095980913], length 4
00:01:20.976325 IP 10.0.0.6.1883 > 10.0.0.8.44828: Flags [P.], seq 1598810460:1598810464, ack 313980689, win 85, options [nop,nop,TS val 3791275433 ecr 1095980915], length 4
00:01:21.978174 IP 10.0.0.6.1883 > 10.0.0.8.44828: Flags [P.], seq 1598810464:1598810468, ack 313981084, win 85, options [nop,nop,TS val 3791276435 ecr 1095981916], length 4
00:01:21.979835 IP 10.0.0.6.1883 > 10.0.0.8.44828: Flags [P.], seq 1598810468:1598810472, ack 313981088, win 85, options [nop,nop,TS val 3791276436 ecr 1095981918], length 4
00:01:22.923292 IP 10.0.0.6.1883 > 10.0.0.8.44828: Flags [P.], seq 1598810472:1598810474, ack 313981090, win 85, options [nop,nop,TS val 3791277379 ecr 1095982861], length 2
00:01:22.980019 IP 10.0.0.6.1883 > 10.0.0.8.44828: Flags [P.], seq 1598810474:1598810478, ack 313981485, win 85, options [nop,nop,TS val 3791277436 ecr 1095982917], length 4
00:01:22.982577 IP 10.0.0.6.1883 > 10.0.0.8.44828: Flags [P.], seq 1598810478:1598810482, ack 313981489, win 85, options [nop,nop,TS val 3791277438 ecr 1095982919], length 4
00:01:23.980868 IP 10.0.0.6.1883 > 10.0.0.8.44828: Flags [P.], seq 1598810482:1598810486, ack 313981884, win 85, options [nop,nop,TS val 3791278436 ecr 1095983917], length 4
00:01:23.982599 IP 10.0.0.6.1883 > 10.0.0.8.44828: Flags [P.], seq 1598810486:1598810490, ack 313981888, win 85, options [nop,nop,TS val 3791278438 ecr 1095983920], length 4
00:01:24.981464 IP 10.0.0.6.1883 > 10.0.0.8.44828: Flags [P.], seq 1598810490:1598810494, ack 313982283, win 85, options [nop,nop,TS val 3791279437 ecr 1095984917], length 4
00:01:24.983077 IP 10.0.0.6.1883 > 10.0.0.8.44828: Flags [P.], seq 1598810494:1598810498, ack 313982287, win 85, options [nop,nop,TS val 3791279438 ecr 1095984920], length 4
00:01:25.982829 IP 10.0.0.6.1883 > 10.0.0.8.44828: Flags [P.], seq 1598810498:1598810502, ack 313982682, win 85, options [nop,nop,TS val 3791280437 ecr 1095985918], length 4
00:01:25.984566 IP 10.0.0.6.1883 > 10.0.0.8.44828: Flags [P.], seq 1598810502:1598810506, ack 313982686, win 85, options [nop,nop,TS val 3791280439 ecr 1095985921], length 4
00:01:26.983678 IP 10.0.0.6.1883 > 10.0.0.8.44828: Flags [P.], seq 1598810506:1598810510, ack 313983081, win 85, options [nop,nop,TS val 3791281438 ecr 1095986919], length 4
00:01:26.985473 IP 10.0.0.6.1883 > 10.0.0.8.44828: Flags [P.], seq 1598810510:1598810514, ack 313983085, win 85, options [nop,nop,TS val 3791281440 ecr 1095986921], length 4
00:01:27.924441 IP 10.0.0.6.1883 > 10.0.0.8.44828: Flags [P.], seq 1598810514:1598810516, ack 313983087, win 85, options [nop,nop,TS val 3791282378 ecr 1095987859], length 2
00:01:27.984960 IP 10.0.0.6.1883 > 10.0.0.8.44828: Flags [P.], seq 1598810516:1598810520, ack 313983482, win 85, options [nop,nop,TS val 3791282438 ecr 1095987919], length 4
00:01:27.986854 IP 10.0.0.6.1883 > 10.0.0.8.44828: Flags [P.], seq 1598810520:1598810524, ack 313983486, win 85, options [nop,nop,TS val 3791282440 ecr 1095987922], length 4
00:01:28.986254 IP 10.0.0.6.1883 > 10.0.0.8.44828: Flags [P.], seq 1598810524:1598810528, ack 313983881, win 85, options [nop,nop,TS val 3791283439 ecr 1095988920], length 4
00:01:28.987978 IP 10.0.0.6.1883 > 10.0.0.8.44828: Flags [P.], seq 1598810528:1598810532, ack 313983885, win 85, options [nop,nop,TS val 3791283441 ecr 1095988923], length 4
00:01:29.988095 IP 10.0.0.6.1883 > 10.0.0.8.44828: Flags [P.], seq 1598810532:1598810536, ack 313984280, win 85, options [nop,nop,TS val 3791284441 ecr 1095989922], length 4
00:01:29.990301 IP 10.0.0.6.1883 > 10.0.0.8.44828: Flags [P.], seq 1598810536:1598810540, ack 313984284, win 85, options [nop,nop,TS val 3791284443 ecr 1095989924], length 4
00:01:30.989602 IP 10.0.0.6.1883 > 10.0.0.8.44828: Flags [P.], seq 1598810540:1598810544, ack 313984679, win 85, options [nop,nop,TS val 3791285442 ecr 1095990922], length 4
00:01:30.991232 IP 10.0.0.6.1883 > 10.0.0.8.44828: Flags [P.], seq 1598810544:1598810548, ack 313984683, win 85, options [nop,nop,TS val 3791285443 ecr 1095990925], length 4
00:01:31.990972 IP 10.0.0.6.1883 > 10.0.0.8.44828: Flags [P.], seq 1598810548:1598810552, ack 313985078, win 85, options [nop,nop,TS val 3791286442 ecr 1095991924], length 4
00:01:31.993588 IP 10.0.0.6.1883 > 10.0.0.8.44828: Flags [P.], seq 1598810552:1598810556, ack 313985082, win 85, options [nop,nop,TS val 3791286445 ecr 1095991926], length 4
00:01:32.925672 IP 10.0.0.6.1883 > 10.0.0.8.44828: Flags [P.], seq 1598810556:1598810558, ack 313985084, win 85, options [nop,nop,TS val 3791287377 ecr 1095992858], length 2
00:01:32.992575 IP 10.0.0.6.1883 > 10.0.0.8.44828: Flags [P.], seq 1598810558:1598810562, ack 313985479, win 85, options [nop,nop,TS val 3791287444 ecr 1095992925], length 4
00:01:32.993519 IP 10.0.0.6.1883 > 10.0.0.8.44828: Flags [P.], seq 1598810562:1598810566, ack 313985483, win 85, options [nop,nop,TS val 3791287445 ecr 1095992926], length 4
00:01:33.995584 IP 10.0.0.6.1883 > 10.0.0.8.44828: Flags [P.], seq 1598810566:1598810570, ack 313985878, win 85, options [nop,nop,TS val 3791288446 ecr 1095993926], length 4
00:01:33.998591 IP 10.0.0.6.1883 > 10.0.0.8.44828: Flags [P.], seq 1598810570:1598810574, ack 313985882, win 85, options [nop,nop,TS val 3791288449 ecr 1095993929], length 4
00:01:34.996234 IP 10.0.0.6.1883 > 10.0.0.8.44828: Flags [P.], seq 1598810574:1598810578, ack 313986277, win 85, options [nop,nop,TS val 3791289446 ecr 1095994927], length 4
00:01:34.997626 IP 10.0.0.6.1883 > 10.0.0.8.44828: Flags [P.], seq 1598810578:1598810582, ack 313986281, win 85, options [nop,nop,TS val 3791289448 ecr 1095994929], length 4
00:01:36.001441 IP 10.0.0.6.1883 > 10.0.0.8.44828: Flags [P.], seq 1598810582:1598810586, ack 313986676, win 85, options [nop,nop,TS val 3791290451 ecr 1095995930], length 4
00:01:36.004951 IP 10.0.0.6.1883 > 10.0.0.8.44828: Flags [P.], seq 1598810586:1598810590, ack 313986680, win 85, options [nop,nop,TS val 3791290454 ecr 1095995934], length 4
00:01:37.002795 IP 10.0.0.6.1883 > 10.0.0.8.44828: Flags [P.], seq 1598810590:1598810594, ack 313987075, win 85, options [nop,nop,TS val 3791291452 ecr 1095996931], length 4
00:01:37.003801 IP 10.0.0.6.1883 > 10.0.0.8.44828: Flags [P.], seq 1598810594:1598810598, ack 313987079, win 85, options [nop,nop,TS val 3791291453 ecr 1095996934], length 4
00:01:37.927960 IP 10.0.0.6.1883 > 10.0.0.8.44828: Flags [P.], seq 1598810598:1598810600, ack 313987081, win 85, options [nop,nop,TS val 3791292376 ecr 1095997857], length 2
00:01:38.004401 IP 10.0.0.6.1883 > 10.0.0.8.44828: Flags [P.], seq 1598810600:1598810604, ack 313987476, win 85, options [nop,nop,TS val 3791292453 ecr 1095997933], length 4
00:01:38.005255 IP 10.0.0.6.1883 > 10.0.0.8.44828: Flags [P.], seq 1598810604:1598810608, ack 313987480, win 85, options [nop,nop,TS val 3791292454 ecr 1095997935], length 4
00:01:39.004185 IP 10.0.0.6.1883 > 10.0.0.8.44828: Flags [P.], seq 1598810608:1598810612, ack 313987875, win 85, options [nop,nop,TS val 3791293452 ecr 1095998933], length 4
00:01:39.007139 IP 10.0.0.6.1883 > 10.0.0.8.44828: Flags [P.], seq 1598810612:1598810616, ack 313987879, win 85, options [nop,nop,TS val 3791293455 ecr 1095998936], length 4
00:01:40.006216 IP 10.0.0.6.1883 > 10.0.0.8.44828: Flags [P.], seq 1598810616:1598810620, ack 313988274, win 85, options [nop,nop,TS val 3791294454 ecr 1095999935], length 4
00:01:40.008093 IP 10.0.0.6.1883 > 10.0.0.8.44828: Flags [P.], seq 1598810620:1598810624, ack 313988278, win 85, options [nop,nop,TS val 3791294456 ecr 1095999937], length 4
00:01:41.008824 IP 10.0.0.6.1883 > 10.0.0.8.44828: Flags [P.], seq 1598810624:1598810628, ack 313988673, win 85, options [nop,nop,TS val 3791295456 ecr 1096000936], length 4
00:01:41.010627 IP 10.0.0.6.1883 > 10.0.0.8.44828: Flags [P.], seq 1598810628:1598810632, ack 313988677, win 85, options [nop,nop,TS val 3791295458 ecr 1096000938], length 4
00:01:42.010317 IP 10.0.0.6.1883 > 10.0.0.8.44828: Flags [P.], seq 1598810632:1598810636, ack 313989072, win 85, options [nop,nop,TS val 3791296456 ecr 1096001937], length 4
00:01:42.012260 IP 10.0.0.6.1883 > 10.0.0.8.44828: Flags [P.], seq 1598810636:1598810640, ack 313989076, win 85, options [nop,nop,TS val 3791296459 ecr 1096001939], length 4
00:01:42.930066 IP 10.0.0.6.1883 > 10.0.0.8.44828: Flags [P.], seq 1598810640:1598810642, ack 313989078, win 85, options [nop,nop,TS val 3791297376 ecr 1096002856], length 2
00:01:47.944944 IP 10.0.0.6.1883 > 10.0.0.8.44828: Flags [P.], seq 1598810642:1598810644, ack 313989080, win 85, options [nop,nop,TS val 3791302388 ecr 1096007868], length 2
00:01:52.949919 IP 10.0.0.6.1883 > 10.0.0.8.44828: Flags [P.], seq 1598810644:1598810646, ack 313989082, win 85, options [nop,nop,TS val 3791307391 ecr 1096012868], length 2
00:01:57.952374 IP 10.0.0.6.1883 > 10.0.0.8.44828: Flags [P.], seq 1598810646:1598810648, ack 313989084, win 85, options [nop,nop,TS val 3791312391 ecr 1096017871], length 2
00:02:00.195247 IP 10.0.0.6.1883 > 10.0.0.8.44828: Flags [F.], seq 1598810648, ack 313989085, win 85, options [nop,nop,TS val 3791314632 ecr 1096020111], length 0