00:00:11.646602 IP 10.0.0.6.1883 > 10.0.0.8.44794: Flags [S.], seq 2377296846, ack 3098033964, win 43440, options [mss 1460,sackOK,TS val 3791005290 ecr 1095710717,nop,wscale 9], length 0
00:00:11.654952 IP 10.0.0.6.1883 > 10.0.0.8.44794: Flags [.], ack 3098033984, win 85, options [nop,nop,TS val 3791005299 ecr 1095710780], length 0
00:00:11.655053 IP 10.0.0.6.1883 > 10.0.0.8.44794: Flags [P.], seq 2377296847:2377296851, ack 3098033984, win 85, options [nop,nop,TS val 3791005299 ecr 1095710780], length 4
00:00:11.664498 IP 10.0.0.6.1883 > 10.0.0.8.44794: Flags [P.], seq 2377296851:2377296916, ack 3098034048, win 85, options [nop,nop,TS val 3791005308 ecr 1095710789], length 65
00:00:11.665501 IP 10.0.0.6.1883 > 10.0.0.8.44794: Flags [P.], seq 2377296916:2377296921, ack 3098034443, win 85, options [nop,nop,TS val 3791005309 ecr 1095710791], length 5
00:00:11.709802 IP 10.0.0.6.1883 > 10.0.0.8.44794: Flags [P.], seq 2377296921:2377296925, ack 3098034443, win 85, options [nop,nop,TS val 3791005354 ecr 1095710835], length 4
00:00:11.712382 IP 10.0.0.6.1883 > 10.0.0.8.44794: Flags [P.], seq 2377296925:2377296929, ack 3098034447, win 85, options [nop,nop,TS val 3791005356 ecr 1095710836], length 4
00:00:12.597631 IP 10.0.0.6.1883 > 10.0.0.8.44794: Flags [P.], seq 2377296929:2377296933, ack 3098034842, win 85, options [nop,nop,TS val 3791006239 ecr 1095711719], length 4
00:00:12.599562 IP 10.0.0.6.1883 > 10.0.0.8.44794: Flags [P.], seq 2377296933:2377296937, ack 3098034846, win 85, options [nop,nop,TS val 3791006242 ecr 1095711724], length 4
00:00:13.686318 IP 10.0.0.6.1883 > 10.0.0.8.44794: Flags [P.], seq 2377296937:2377296941, ack 3098035241, win 85, options [nop,nop,TS val 3791007329 ecr 1095712809], length 4
00:00:13.688048 IP 10.0.0.6.1883 > 10.0.0.8.44794: Flags [P.], seq 2377296941:2377296945, ack 3098035245, win 85, options [nop,nop,TS val 3791007331 ecr 1095712812], length 4
00:00:14.687979 IP 10.0.0.6.1883 > 10.0.0.8.44794: Flags [P.], seq 2377296945:2377296949, ack 3098035640, win 85, options [nop,nop,TS val 3791008330 ecr 1095713810], length 4
00:00:14.690536 IP 10.0.0.6.1883 > 10.0.0.8.44794: Flags [P.], seq 2377296949:2377296953, ack 3098035644, win 85, options [nop,nop,TS val 3791008333 ecr 1095713813], length 4
00:00:15.688994 IP 10.0.0.6.1883 > 10.0.0.8.44794: Flags [P.], seq 2377296953:2377296957, ack 3098036039, win 85, options [nop,nop,TS val 3791009330 ecr 1095714811], length 4
00:00:15.691664 IP 10.0.0.6.1883 > 10.0.0.8.44794: Flags [P.], seq 2377296957:2377296961, ack 3098036043, win 85, options [nop,nop,TS val 3791009333 ecr 1095714814], length 4
00:00:16.667162 IP 10.0.0.6.1883 > 10.0.0.8.44794: Flags [P.], seq 2377296961:2377296963, ack 3098036045, win 85, options [nop,nop,TS val 3791010308 ecr 1095715789], length 2
00:00:16.691014 IP 10.0.0.6.1883 > 10.0.0.8.44794: Flags [P.], seq 2377296963:2377296967, ack 3098036440, win 85, options [nop,nop,TS val 3791010332 ecr 1095715812], length 4
00:00:16.693027 IP 10.0.0.6.1883 > 10.0.0.8.44794: Flags [P.], seq 2377296967:2377296971, ack 3098036444, win 85, options [nop,nop,TS val 3791010334 ecr 1095715815], length 4
00:00:17.693969 IP 10.0.0.6.1883 > 10.0.0.8.44794: Flags [P.], seq 2377296971:2377296975, ack 3098036839, win 85, options [nop,nop,TS val 3791011334 ecr 1095716813], length 4
00:00:17.695148 IP 10.0.0.6.1883 > 10.0.0.8.44794: Flags [P.], seq 2377296975:2377296979, ack 3098036843, win 85, options [nop,nop,TS val 3791011336 ecr 1095716817], length 4
00:00:18.693389 IP 10.0.0.6.1883 > 10.0.0.8.44794: Flags [P.], seq 2377296979:2377296983, ack 3098037238, win 85, options [nop,nop,TS val 3791012334 ecr 1095717815], length 4
00:00:18.695173 IP 10.0.0.6.1883 > 10.0.0.8.44794: Flags [P.], seq 2377296983:2377296987, ack 3098037242, win 85, options [nop,nop,TS val 3791012335 ecr 1095717816], length 4
00:00:19.695138 IP 10.0.0.6.1883 > 10.0.0.8.44794: Flags [P.], seq 2377296987:2377296991, ack 3098037637, win 85, options [nop,nop,TS val 3791013335 ecr 1095718816], length 4
00:00:19.697341 IP 10.0.0.6.1883 > 10.0.0.8.44794: Flags [P.], seq 2377296991:2377296995, ack 3098037641, win 85, options [nop,nop,TS val 3791013337 ecr 1095718818], length 4
00:00:20.696571 IP 10.0.0.6.1883 > 10.0.0.8.44794: Flags [P.], seq 2377296995:2377296999, ack 3098038036, win 85, options [nop,nop,TS val 3791014336 ecr 1095719817], length 4
00:00:20.698411 IP 10.0.0.6.1883 > 10.0.0.8.44794: Flags [P.], seq 2377296999:2377297003, ack 3098038040, win 85, options [nop,nop,TS val 3791014338 ecr 1095719819], length 4
00:00:21.667500 IP 10.0.0.6.1883 > 10.0.0.8.44794: Flags [P.], seq 2377297003:2377297005, ack 3098038042, win 85, options [nop,nop,TS val 3791015306 ecr 1095720788], length 2
00:00:21.701152 IP 10.0.0.6.1883 > 10.0.0.8.44794: Flags [P.], seq 2377297005:2377297009, ack 3098038437, win 85, options [nop,nop,TS val 3791015340 ecr 1095720820], length 4
00:00:21.703292 IP 10.0.0.6.1883 > 10.0.0.8.44794: Flags [P.], seq 2377297009:2377297013, ack 3098038441, win 85, options [nop,nop,TS val 3791015342 ecr 1095720822], length 4
00:00:22.716569 IP 10.0.0.6.1883 > 10.0.0.8.44794: Flags [P.], seq 2377297013:2377297017, ack 3098038836, win 85, options [nop,nop,TS val 3791016343 ecr 1095721822], length 4
00:00:22.718971 IP 10.0.0.6.1883 > 10.0.0.8.44794: Flags [P.], seq 2377297017:2377297021, ack 3098038840, win 85, options [nop,nop,TS val 3791016357 ecr 1095721837], length 4
00:00:23.729865 IP 10.0.0.6.1883 > 10.0.0.8.44794: Flags [P.], seq 2377297021:2377297025, ack 3098039235, win 85, options [nop,nop,TS val 3791017365 ecr 1095722844], length 4
00:00:23.735333 IP 10.0.0.6.1883 > 10.0.0.8.44794: Flags [P.], seq 2377297025:2377297029, ack 3098039239, win 85, options [nop,nop,TS val 3791017373 ecr 1095722853], length 4
00:00:24.736110 IP 10.0.0.6.1883 > 10.0.0.8.44794: Flags [P.], seq 2377297029:2377297033, ack 3098039634, win 85, options [nop,nop,TS val 3791018372 ecr 1095723851], length 4
00:00:24.743608 IP 10.0.0.6.1883 > 10.0.0.8.44794: Flags [P.], seq 2377297033:2377297037, ack 3098039638, win 85, options [nop,nop,TS val 3791018381 ecr 1095723861], length 4
00:00:25.740877 IP 10.0.0.6.1883 > 10.0.0.8.44794: Flags [P.], seq 2377297037:2377297041, ack 3098040033, win 85, options [nop,nop,TS val 3791019377 ecr 1095724856], length 4
00:00:25.745116 IP 10.0.0.6.1883 > 10.0.0.8.44794: Flags [P.], seq 2377297041:2377297045, ack 3098040037, win 85, options [nop,nop,TS val 3791019382 ecr 1095724862], length 4
00:00:26.743841 IP 10.0.0.6.1883 > 10.0.0.8.44794: Flags [P.], seq 2377297045:2377297047, ack 3098040039, win 85, options [nop,nop,TS val 3791020380 ecr 1095725860], length 2
00:00:26.748699 IP 10.0.0.6.1883 > 10.0.0.8.44794: Flags [P.], seq 2377297047:2377297051, ack 3098040434, win 85, options [nop,nop,TS val 3791020385 ecr 1095725865], length 4
00:00:26.751146 IP 10.0.0.6.1883 > 10.0.0.8.44794: Flags [P.], seq 2377297051:2377297055, ack 3098040438, win 85, options [nop,nop,TS val 3791020387 ecr 1095725868], length 4
00:00:27.747470 IP 10.0.0.6.1883 > 10.0.0.8.44794: Flags [P.], seq 2377297055:2377297059, ack 3098040833, win 85, options [nop,nop,TS val 3791021383 ecr 1095726862], length 4
00:00:27.751721 IP 10.0.0.6.1883 > 10.0.0.8.44794: Flags [P.], seq 2377297059:2377297063, ack 3098040837, win 85, options [nop,nop,TS val 3791021387 ecr 1095726868], length 4
00:00:28.749343 IP 10.0.0.6.1883 > 10.0.0.8.44794: Flags [P.], seq 2377297063:2377297067, ack 3098041232, win 85, options [nop,nop,TS val 3791022384 ecr 1095727865], length 4
00:00:28.750570 IP 10.0.0.6.1883 > 10.0.0.8.44794: Flags [P.], seq 2377297067:2377297071, ack 3098041236, win 85, options [nop,nop,TS val 3791022386 ecr 1095727867], length 4
00:00:29.754230 IP 10.0.0.6.1883 > 10.0.0.8.44794: Flags [P.], seq 2377297071:2377297075, ack 3098041631, win 85, options [nop,nop,TS val 3791023389 ecr 1095728869], length 4
00:00:29.759193 IP 10.0.0.6.1883 > 10.0.0.8.44794: Flags [P.], seq 2377297075:2377297079, ack 3098041635, win 85, options [nop,nop,TS val 3791023394 ecr 1095728875], length 4
00:00:30.755641 IP 10.0.0.6.1883 > 10.0.0.8.44794: Flags [P.], seq 2377297079:2377297083, ack 3098042030, win 85, options [nop,nop,TS val 3791024390 ecr 1095729869], length 4
00:00:30.758926 IP 10.0.0.6.1883 > 10.0.0.8.44794: Flags [P.], seq 2377297083:2377297087, ack 3098042034, win 85, options [nop,nop,TS val 3791024393 ecr 1095729873], length 4
00:00:31.179125 IP 10.0.0.6.1883 > 10.0.0.8.44794: Flags [P.], seq 2377297083:2377297087, ack 3098042034, win 85, options [nop,nop,TS val 3791024794 ecr 1095729873], length 4
00:00:31.746556 IP 10.0.0.6.1883 > 10.0.0.8.44794: Flags [P.], seq 2377297087:2377297089, ack 3098042036, win 85, options [nop,nop,TS val 3791025380 ecr 1095730860], length 2
00:00:31.758351 IP 10.0.0.6.1883 > 10.0.0.8.44794: Flags [P.], seq 2377297089:2377297093, ack 3098042431, win 85, options [nop,nop,TS val 3791025392 ecr 1095730873], length 4
00:00:31.761066 IP 10.0.0.6.1883 > 10.0.0.8.44794: Flags [P.], seq 2377297093:2377297097, ack 3098042435, win 85, options [nop,nop,TS val 3791025395 ecr 1095730876], length 4
00:00:32.764588 IP 10.0.0.6.1883 > 10.0.0.8.44794: Flags [P.], seq 2377297097:2377297101, ack 3098042830, win 85, options [nop,nop,TS val 3791026398 ecr 1095731879], length 4
00:00:32.765372 IP 10.0.0.6.1883 > 10.0.0.8.44794: Flags [P.], seq 2377297101:2377297105, ack 3098042834, win 85, options [nop,nop,TS val 3791026399 ecr 1095731880], length 4
00:00:33.770059 IP 10.0.0.6.1883 > 10.0.0.8.44794: Flags [P.], seq 2377297105:2377297109, ack 3098043229, win 85, options [nop,nop,TS val 3791027403 ecr 1095732883], length 4
00:00:33.776300 IP 10.0.0.6.1883 > 10.0.0.8.44794: Flags [P.], seq 2377297109:2377297113, ack 3098043233, win 85, options [nop,nop,TS val 3791027409 ecr 1095732889], length 4
00:00:34.775582 IP 10.0.0.6.1883 > 10.0.0.8.44794: Flags [P.], seq 2377297113:2377297117, ack 3098043628, win 85, options [nop,nop,TS val 3791028407 ecr 1095733887], length 4
00:00:34.785289 IP 10.0.0.6.1883 > 10.0.0.8.44794: Flags [P.], seq 2377297117:2377297121, ack 3098043632, win 85, options [nop,nop,TS val 3791028414 ecr 1095733894], length 4
00:00:35.776592 IP 10.0.0.6.1883 > 10.0.0.8.44794: Flags [P.], seq 2377297121:2377297125, ack 3098044027, win 85, options [nop,nop,TS val 3791029408 ecr 1095734887], length 4
00:00:35.781669 IP 10.0.0.6.1883 > 10.0.0.8.44794: Flags [P.], seq 2377297125:2377297129, ack 3098044031, win 85, options [nop,nop,TS val 3791029413 ecr 1095734894], length 4
00:00:36.798668 IP 10.0.0.6.1883 > 10.0.0.8.44794: Flags [P.], seq 2377297129:2377297131, ack 3098044033, win 85, options [nop,nop,TS val 3791030430 ecr 1095735910], length 2
00:00:36.802887 IP 10.0.0.6.1883 > 10.0.0.8.44794: Flags [P.], seq 2377297131:2377297135, ack 3098044428, win 85, options [nop,nop,TS val 3791030432 ecr 1095735913], length 4
00:00:36.805980 IP 10.0.0.6.1883 > 10.0.0.8.44794: Flags [P.], seq 2377297135:2377297139, ack 3098044432, win 85, options [nop,nop,TS val 3791030437 ecr 1095735918], length 4
00:00:37.802582 IP 10.0.0.6.1883 > 10.0.0.8.44794: Flags [P.], seq 2377297139:2377297143, ack 3098044827, win 85, options [nop,nop,TS val 3791031433 ecr 1095736912], length 4
00:00:37.804403 IP 10.0.0.6.1883 > 10.0.0.8.44794: Flags [P.], seq 2377297143:2377297147, ack 3098044831, win 85, options [nop,nop,TS val 3791031435 ecr 1095736916], length 4
00:00:38.803733 IP 10.0.0.6.1883 > 10.0.0.8.44794: Flags [P.], seq 2377297147:2377297151, ack 3098045226, win 85, options [nop,nop,TS val 3791032434 ecr 1095737915], length 4
00:00:38.806097 IP 10.0.0.6.1883 > 10.0.0.8.44794: Flags [P.], seq 2377297151:2377297155, ack 3098045230, win 85, options [nop,nop,TS val 3791032436 ecr 1095737917], length 4
00:00:39.809219 IP 10.0.0.6.1883 > 10.0.0.8.44794: Flags [P.], seq 2377297155:2377297159, ack 3098045625, win 85, options [nop,nop,TS val 3791033439 ecr 1095738919], length 4
00:00:39.811854 IP 10.0.0.6.1883 > 10.0.0.8.44794: Flags [P.], seq 2377297159:2377297163, ack 3098045629, win 85, options [nop,nop,TS val 3791033442 ecr 1095738922], length 4
00:00:40.982879 IP 10.0.0.6.1883 > 10.0.0.8.44794: Flags [P.], seq 2377297163:2377297167, ack 3098046024, win 85, options [nop,nop,TS val 3791034612 ecr 1095740093], length 4
00:00:41.166819 IP 10.0.0.6.1883 > 10.0.0.8.44794: Flags [P.], seq 2377297167:2377297171, ack 3098046028, win 85, options [nop,nop,TS val 3791034796 ecr 1095740276], length 4
00:00:41.908691 IP 10.0.0.6.1883 > 10.0.0.8.44794: Flags [P.], seq 2377297171:2377297173, ack 3098046030, win 85, options [nop,nop,TS val 3791035537 ecr 1095741018], length 2
00:00:42.016798 IP 10.0.0.6.1883 > 10.0.0.8.44794: Flags [P.], seq 2377297173:2377297177, ack 3098046425, win 85, options [nop,nop,TS val 3791035645 ecr 1095741125], length 4
00:00:42.018328 IP 10.0.0.6.1883 > 10.0.0.8.44794: Flags [P.], seq 2377297177:2377297181, ack 3098046429, win 85, options [nop,nop,TS val 3791035647 ecr 1095741128], length 4
00:00:43.027759 IP 10.0.0.6.1883 > 10.0.0.8.44794: Flags [P.], seq 2377297181:2377297185, ack 3098046824, win 85, options [nop,nop,TS val 3791036656 ecr 1095742136], length 4
00:00:43.029235 IP 10.0.0.6.1883 > 10.0.0.8.44794: Flags [P.], seq 2377297185:2377297189, ack 3098046828, win 85, options [nop,nop,TS val 3791036657 ecr 1095742138], length 4
00:00:44.027332 IP 10.0.0.6.1883 > 10.0.0.8.44794: Flags [P.], seq 2377297189:2377297193, ack 3098047223, win 85, options [nop,nop,TS val 3791037655 ecr 1095743136], length 4
00:00:44.027865 IP 10.0.0.6.1883 > 10.0.0.8.44794: Flags [P.], seq 2377297193:2377297197, ack 3098047227, win 85, options [nop,nop,TS val 3791037656 ecr 1095743137], length 4
00:00:45.029990 IP 10.0.0.6.1883 > 10.0.0.8.44794: Flags [P.], seq 2377297197:2377297201, ack 3098047622, win 85, options [nop,nop,TS val 3791038657 ecr 1095744137], length 4
00:00:45.032098 IP 10.0.0.6.1883 > 10.0.0.8.44794: Flags [P.], seq 2377297201:2377297205, ack 3098047626, win 85, options [nop,nop,TS val 3791038659 ecr 1095744140], length 4
00:00:46.030547 IP 10.0.0.6.1883 > 10.0.0.8.44794: Flags [P.], seq 2377297205:2377297209, ack 3098048021, win 85, options [nop,nop,TS val 3791039657 ecr 1095745137], length 4
00:00:46.032141 IP 10.0.0.6.1883 > 10.0.0.8.44794: Flags [P.], seq 2377297209:2377297213, ack 3098048025, win 85, options [nop,nop,TS val 3791039659 ecr 1095745140], length 4
00:00:46.919763 IP 10.0.0.6.1883 > 10.0.0.8.44794: Flags [P.], seq 2377297213:2377297215, ack 3098048027, win 85, options [nop,nop,TS val 3791040546 ecr 1095746026], length 2
00:00:47.032771 IP 10.0.0.6.1883 > 10.0.0.8.44794: Flags [P.], seq 2377297215:2377297219, ack 3098048422, win 85, options [nop,nop,TS val 3791040659 ecr 1095746138], length 4
00:00:47.034963 IP 10.0.0.6.1883 > 10.0.0.8.44794: Flags [P.], seq 2377297219:2377297223, ack 3098048426, win 85, options [nop,nop,TS val 3791040661 ecr 1095746142], length 4
00:00:48.034957 IP 10.0.0.6.1883 > 10.0.0.8.44794: Flags [P.], seq 2377297223:2377297227, ack 3098048821, win 85, options [nop,nop,TS val 3791041660 ecr 1095747140], length 4
00:00:48.037429 IP 10.0.0.6.1883 > 10.0.0.8.44794: Flags [P.], seq 2377297227:2377297231, ack 3098048825, win 85, options [nop,nop,TS val 3791041663 ecr 1095747143], length 4
00:00:49.038158 IP 10.0.0.6.1883 > 10.0.0.8.44794: Flags [P.], seq 2377297231:2377297235, ack 3098049220, win 85, options [nop,nop,TS val 3791042663 ecr 1095748143], length 4
00:00:49.040480 IP 10.0.0.6.1883 > 10.0.0.8.44794: Flags [P.], seq 2377297235:2377297239, ack 3098049224, win 85, options [nop,nop,TS val 3791042665 ecr 1095748146], length 4
00:00:50.146101 IP 10.0.0.6.1883 > 10.0.0.8.44794: Flags [P.], seq 2377297239:2377297243, ack 3098049619, win 85, options [nop,nop,TS val 3791043771 ecr 1095749251], length 4
00:00:50.148037 IP 10.0.0.6.1883 > 10.0.0.8.44794: Flags [P.], seq 2377297243:2377297247, ack 3098049623, win 85, options [nop,nop,TS val 3791043773 ecr 1095749254], length 4
00:00:51.171104 IP 10.0.0.6.1883 > 10.0.0.8.44794: Flags [P.], seq 2377297247:2377297251, ack 3098050018, win 85, options [nop,nop,TS val 3791044795 ecr 1095750275], length 4
00:00:51.173017 IP 10.0.0.6.1883 > 10.0.0.8.44794: Flags [P.], seq 2377297251:2377297255, ack 3098050022, win 85, options [nop,nop,TS val 3791044797 ecr 1095750278], length 4
00:00:51.991385 IP 10.0.0.6.1883 > 10.0.0.8.44794: Flags [P.], seq 2377297255:2377297257, ack 3098050024, win 85, options [nop,nop,TS val 3791045615 ecr 1095751096], length 2
00:00:52.173708 IP 10.0.0.6.1883 > 10.0.0.8.44794: Flags [P.], seq 2377297257:2377297261, ack 3098050419, win 85, options [nop,nop,TS val 3791045797 ecr 1095751278], length 4
00:00:52.175404 IP 10.0.0.6.1883 > 10.0.0.8.44794: Flags [P.], seq 2377297261:2377297265, ack 3098050423, win 85, options [nop,nop,TS val 3791045799 ecr 1095751280], length 4
00:00:53.178188 IP 10.0.0.6.1883 > 10.0.0.8.44794: Flags [P.], seq 2377297265:2377297269, ack 3098050818, win 85, options [nop,nop,TS val 3791046801 ecr 1095752282], length 4
00:00:53.181627 IP 10.0.0.6.1883 > 10.0.0.8.44794: Flags [P.], seq 2377297269:2377297273, ack 3098050822, win 85, options [nop,nop,TS val 3791046805 ecr 1095752285], length 4
00:00:53.589049 IP 10.0.0.6.1883 > 10.0.0.8.44794: Flags [P.], seq 2377297269:2377297273, ack 3098050822, win 85, options [nop,nop,TS val 3791047212 ecr 1095752285], length 4
00:00:54.179083 IP 10.0.0.6.1883 > 10.0.0.8.44794: Flags [P.], seq 2377297273:2377297277, ack 3098051217, win 85, options [nop,nop,TS val 3791047802 ecr 1095753282], length 4
00:00:54.181685 IP 10.0.0.6.1883 > 10.0.0.8.44794: Flags [P.], seq 2377297277:2377297281, ack 3098051221, win 85, options [nop,nop,TS val 3791047804 ecr 1095753285], length 4
00:00:55.198447 IP 10.0.0.6.1883 > 10.0.0.8.44794: Flags [P.], seq 2377297281:2377297285, ack 3098051616, win 85, options [nop,nop,TS val 3791048820 ecr 1095754301], length 4
00:00:55.201419 IP 10.0.0.6.1883 > 10.0.0.8.44794: Flags [P.], seq 2377297285:2377297289, ack 3098051620, win 85, options [nop,nop,TS val 3791048823 ecr 1095754304], length 4
00:00:56.289028 IP 10.0.0.6.1883 > 10.0.0.8.44794: Flags [P.], seq 2377297289:2377297293, ack 3098052015, win 85, options [nop,nop,TS val 3791049910 ecr 1095755390], length 4
00:00:56.292044 IP 10.0.0.6.1883 > 10.0.0.8.44794: Flags [P.], seq 2377297293:2377297297, ack 3098052019, win 85, options [nop,nop,TS val 3791049913 ecr 1095755394], length 4
00:00:56.995985 IP 10.0.0.6.1883 > 10.0.0.8.44794: Flags [P.], seq 2377297297:2377297299, ack 3098052021, win 85, options [nop,nop,TS val 3791050617 ecr 1095756097], length 2
00:00:57.420789 IP 10.0.0.6.1883 > 10.0.0.8.44794: Flags [P.], seq 2377297299:2377297303, ack 3098052416, win 85, options [nop,nop,TS val 3791051042 ecr 1095756522], length 4
00:00:57.422687 IP 10.0.0.6.1883 > 10.0.0.8.44794: Flags [P.], seq 2377297303:2377297307, ack 3098052420, win 85, options [nop,nop,TS val 3791051043 ecr 1095756524], length 4
00:00:59.176766 IP 10.0.0.6.1883 > 10.0.0.8.44794: Flags [P.], seq 2377297307:2377297311, ack 3098052815, win 85, options [nop,nop,TS val 3791052797 ecr 1095758276], length 4
00:00:59.180072 IP 10.0.0.6.1883 > 10.0.0.8.44794: Flags [P.], seq 2377297311:2377297315, ack 3098052819, win 85, options [nop,nop,TS val 3791052800 ecr 1095758281], length 4
00:01:00.177579 IP 10.0.0.6.1883 > 10.0.0.8.44794: Flags [P.], seq 2377297315:2377297319, ack 3098053214, win 85, options [nop,nop,TS val 3791053797 ecr 1095759278], length 4
00:01:00.180395 IP 10.0.0.6.1883 > 10.0.0.8.44794: Flags [P.], seq 2377297319:2377297323, ack 3098053218, win 85, options [nop,nop,TS val 3791053800 ecr 1095759280], length 4
00:01:01.185419 IP 10.0.0.6.1883 > 10.0.0.8.44794: Flags [P.], seq 2377297323:2377297327, ack 3098053613, win 85, options [nop,nop,TS val 3791054804 ecr 1095760284], length 4
00:01:01.197719 IP 10.0.0.6.1883 > 10.0.0.8.44794: Flags [P.], seq 2377297327:2377297331, ack 3098053617, win 85, options [nop,nop,TS val 3791054816 ecr 1095760296], length 4
00:01:01.997502 IP 10.0.0.6.1883 > 10.0.0.8.44794: Flags [P.], seq 2377297331:2377297333, ack 3098053619, win 85, options [nop,nop,TS val 3791055616 ecr 1095761097], length 2
00:01:02.192403 IP 10.0.0.6.1883 > 10.0.0.8.44794: Flags [P.], seq 2377297333:2377297337, ack 3098054014, win 85, options [nop,nop,TS val 3791055811 ecr 1095761291], length 4
00:01:02.194529 IP 10.0.0.6.1883 > 10.0.0.8.44794: Flags [P.], seq 2377297337:2377297341, ack 3098054018, win 85, options [nop,nop,TS val 3791055812 ecr 1095761293], length 4
00:01:03.198033 IP 10.0.0.6.1883 > 10.0.0.8.44794: Flags [P.], seq 2377297341:2377297345, ack 3098054413, win 85, options [nop,nop,TS val 3791056816 ecr 1095762297], length 4
00:01:03.200805 IP 10.0.0.6.1883 > 10.0.0.8.44794: Flags [P.], seq 2377297345:2377297349, ack 3098054417, win 85, options [nop,nop,TS val 3791056819 ecr 1095762300], length 4
00:01:04.203333 IP 10.0.0.6.1883 > 10.0.0.8.44794: Flags [P.], seq 2377297349:2377297353, ack 3098054812, win 85, options [nop,nop,TS val 3791057821 ecr 1095763301], length 4
00:01:04.204982 IP 10.0.0.6.1883 > 10.0.0.8.44794: Flags [P.], seq 2377297353:2377297357, ack 3098054816, win 85, options [nop,nop,TS val 3791057822 ecr 1095763303], length 4
00:01:05.208924 IP 10.0.0.6.1883 > 10.0.0.8.44794: Flags [P.], seq 2377297357:2377297361, ack 3098055211, win 85, options [nop,nop,TS val 3791058826 ecr 1095764302], length 4
00:01:05.212585 IP 10.0.0.6.1883 > 10.0.0.8.44794: Flags [P.], seq 2377297361:2377297365, ack 3098055215, win 85, options [nop,nop,TS val 3791058829 ecr 1095764310], length 4
00:01:06.208008 IP 10.0.0.6.1883 > 10.0.0.8.44794: Flags [P.], seq 2377297365:2377297369, ack 3098055610, win 85, options [nop,nop,TS val 3791059824 ecr 1095765304], length 4
00:01:06.209246 IP 10.0.0.6.1883 > 10.0.0.8.44794: Flags [P.], seq 2377297369:2377297373, ack 3098055614, win 85, options [nop,nop,TS val 3791059826 ecr 1095765307], length 4
00:01:07.001028 IP 10.0.0.6.1883 > 10.0.0.8.44794: Flags [P.], seq 2377297373:2377297375, ack 3098055616, win 85, options [nop,nop,TS val 3791060617 ecr 1095766096], length 2
00:01:07.208636 IP 10.0.0.6.1883 > 10.0.0.8.44794: Flags [P.], seq 2377297375:2377297379, ack 3098056011, win 85, options [nop,nop,TS val 3791060825 ecr 1095766304], length 4
00:01:07.210127 IP 10.0.0.6.1883 > 10.0.0.8.44794: Flags [P.], seq 2377297379:2377297383, ack 3098056015, win 85, options [nop,nop,TS val 3791060826 ecr 1095766307], length 4
00:01:08.208482 IP 10.0.0.6.1883 > 10.0.0.8.44794: Flags [P.], seq 2377297383:2377297387, ack 3098056410, win 85, options [nop,nop,TS val 3791061824 ecr 1095767305], length 4
00:01:08.210112 IP 10.0.0.6.1883 > 10.0.0.8.44794: Flags [P.], seq 2377297387:2377297391, ack 3098056414, win 85, options [nop,nop,TS val 3791061826 ecr 1095767307], length 4
00:01:09.210358 IP 10.0.0.6.1883 > 10.0.0.8.44794: Flags [P.], seq 2377297391:2377297395, ack 3098056809, win 85, options [nop,nop,TS val 3791062825 ecr 1095768306], length 4
00:01:09.211795 IP 10.0.0.6.1883 > 10.0.0.8.44794: Flags [P.], seq 2377297395:2377297399, ack 3098056813, win 85, options [nop,nop,TS val 3791062827 ecr 1095768308], length 4
00:01:10.212028 IP 10.0.0.6.1883 > 10.0.0.8.44794: Flags [P.], seq 2377297399:2377297403, ack 3098057208, win 85, options [nop,nop,TS val 3791063826 ecr 1095769307], length 4
00:01:10.213279 IP 10.0.0.6.1883 > 10.0.0.8.44794: Flags [P.], seq 2377297403:2377297407, ack 3098057212, win 85, options [nop,nop,TS val 3791063828 ecr 1095769309], length 4
00:01:11.214514 IP 10.0.0.6.1883 > 10.0.0.8.44794: Flags [P.], seq 2377297407:2377297411, ack 3098057607, win 85, options [nop,nop,TS val 3791064828 ecr 1095770309], length 4
00:01:11.219021 IP 10.0.0.6.1883 > 10.0.0.8.44794: Flags [P.], seq 2377297411:2377297415, ack 3098057611, win 85, options [nop,nop,TS val 3791064832 ecr 1095770312], length 4
00:01:12.000446 IP 10.0.0.6.1883 > 10.0.0.8.44794: Flags [P.], seq 2377297415:2377297417, ack 3098057613, win 85, options [nop,nop,TS val 3791065614 ecr 1095771095], length 2
00:01:12.215425 IP 10.0.0.6.1883 > 10.0.0.8.44794: Flags [P.], seq 2377297417:2377297421, ack 3098058008, win 85, options [nop,nop,TS val 3791065829 ecr 1095771309], length 4
00:01:12.216924 IP 10.0.0.6.1883 > 10.0.0.8.44794: Flags [P.], seq 2377297421:2377297425, ack 3098058012, win 85, options [nop,nop,TS val 3791065830 ecr 1095771311], length 4
00:01:13.216653 IP 10.0.0.6.1883 > 10.0.0.8.44794: Flags [P.], seq 2377297425:2377297429, ack 3098058407, win 85, options [nop,nop,TS val 3791066830 ecr 1095772309], length 4
00:01:13.218524 IP 10.0.0.6.1883 > 10.0.0.8.44794: Flags [P.], seq 2377297429:2377297433, ack 3098058411, win 85, options [nop,nop,TS val 3791066831 ecr 1095772312], length 4
00:01:14.217806 IP 10.0.0.6.1883 > 10.0.0.8.44794: Flags [P.], seq 2377297433:2377297437, ack 3098058806, win 85, options [nop,nop,TS val 3791067830 ecr 1095773310], length 4
00:01:14.219754 IP 10.0.0.6.1883 > 10.0.0.8.44794: Flags [P.], seq 2377297437:2377297441, ack 3098058810, win 85, options [nop,nop,TS val 3791067832 ecr 1095773313], length 4
00:01:15.219152 IP 10.0.0.6.1883 > 10.0.0.8.44794: Flags [P.], seq 2377297441:2377297445, ack 3098059205, win 85, options [nop,nop,TS val 3791068831 ecr 1095774311], length 4
00:01:15.221024 IP 10.0.0.6.1883 > 10.0.0.8.44794: Flags [P.], seq 2377297445:2377297449, ack 3098059209, win 85, options [nop,nop,TS val 3791068833 ecr 1095774314], length 4
00:01:16.219895 IP 10.0.0.6.1883 > 10.0.0.8.44794: Flags [P.], seq 2377297449:2377297453, ack 3098059604, win 85, options [nop,nop,TS val 3791069831 ecr 1095775311], length 4
00:01:16.221906 IP 10.0.0.6.1883 > 10.0.0.8.44794: Flags [P.], seq 2377297453:2377297457, ack 3098059608, win 85, options [nop,nop,TS val 3791069833 ecr 1095775314], length 4
00:01:17.001308 IP 10.0.0.6.1883 > 10.0.0.8.44794: Flags [P.], seq 2377297457:2377297459, ack 3098059610, win 85, options [nop,nop,TS val 3791070612 ecr 1095776093], length 2
00:01:17.220460 IP 10.0.0.6.1883 > 10.0.0.8.44794: Flags [P.], seq 2377297459:2377297463, ack 3098060005, win 85, options [nop,nop,TS val 3791070831 ecr 1095776312], length 4
00:01:17.222031 IP 10.0.0.6.1883 > 10.0.0.8.44794: Flags [P.], seq 2377297463:2377297467, ack 3098060009, win 85, options [nop,nop,TS val 3791070833 ecr 1095776314], length 4
00:01:18.222341 IP 10.0.0.6.1883 > 10.0.0.8.44794: Flags [P.], seq 2377297467:2377297471, ack 3098060404, win 85, options [nop,nop,TS val 3791071833 ecr 1095777312], length 4
00:01:18.224189 IP 10.0.0.6.1883 > 10.0.0.8.44794: Flags [P.], seq 2377297471:2377297475, ack 3098060408, win 85, options [nop,nop,TS val 3791071834 ecr 1095777315], length 4
00:01:19.224425 IP 10.0.0.6.1883 > 10.0.0.8.44794: Flags [P.], seq 2377297475:2377297479, ack 3098060803, win 85, options [nop,nop,TS val 3791072834 ecr 1095778314], length 4
00:01:19.226295 IP 10.0.0.6.1883 > 10.0.0.8.44794: Flags [P.], seq 2377297479:2377297483, ack 3098060807, win 85, options [nop,nop,TS val 3791072836 ecr 1095778317], length 4
00:01:20.225822 IP 10.0.0.6.1883 > 10.0.0.8.44794: Flags [P.], seq 2377297483:2377297487, ack 3098061202, win 85, options [nop,nop,TS val 3791073835 ecr 1095779315], length 4
00:01:20.227369 IP 10.0.0.6.1883 > 10.0.0.8.44794: Flags [P.], seq 2377297487:2377297491, ack 3098061206, win 85, options [nop,nop,TS val 3791073837 ecr 1095779318], length 4
00:01:21.225276 IP 10.0.0.6.1883 > 10.0.0.8.44794: Flags [P.], seq 2377297491:2377297495, ack 3098061601, win 85, options [nop,nop,TS val 3791074834 ecr 1095780315], length 4
00:01:21.227546 IP 10.0.0.6.1883 > 10.0.0.8.44794: Flags [P.], seq 2377297495:2377297499, ack 3098061605, win 85, options [nop,nop,TS val 3791074837 ecr 1095780317], length 4
00:01:22.003791 IP 10.0.0.6.1883 > 10.0.0.8.44794: Flags [P.], seq 2377297499:2377297501, ack 3098061607, win 85, options [nop,nop,TS val 3791075612 ecr 1095781093], length 2
00:01:22.227627 IP 10.0.0.6.1883 > 10.0.0.8.44794: Flags [P.], seq 2377297501:2377297505, ack 3098062002, win 85, options [nop,nop,TS val 3791075836 ecr 1095781316], length 4
00:01:22.228206 IP 10.0.0.6.1883 > 10.0.0.8.44794: Flags [P.], seq 2377297505:2377297509, ack 3098062006, win 85, options [nop,nop,TS val 3791075837 ecr 1095781318], length 4
00:01:23.228544 IP 10.0.0.6.1883 > 10.0.0.8.44794: Flags [P.], seq 2377297509:2377297513, ack 3098062401, win 85, options [nop,nop,TS val 3791076836 ecr 1095782317], length 4
00:01:23.231775 IP 10.0.0.6.1883 > 10.0.0.8.44794: Flags [P.], seq 2377297513:2377297517, ack 3098062405, win 85, options [nop,nop,TS val 3791076840 ecr 1095782320], length 4
00:01:24.229232 IP 10.0.0.6.1883 > 10.0.0.8.44794: Flags [P.], seq 2377297517:2377297521, ack 3098062800, win 85, options [nop,nop,TS val 3791077837 ecr 1095783317], length 4
00:01:24.230552 IP 10.0.0.6.1883 > 10.0.0.8.44794: Flags [P.], seq 2377297521:2377297525, ack 3098062804, win 85, options [nop,nop,TS val 3791077838 ecr 1095783319], length 4
00:01:25.230303 IP 10.0.0.6.1883 > 10.0.0.8.44794: Flags [P.], seq 2377297525:2377297529, ack 3098063199, win 85, options [nop,nop,TS val 3791078837 ecr 1095784318], length 4
00:01:25.231771 IP 10.0.0.6.1883 > 10.0.0.8.44794: Flags [P.], seq 2377297529:2377297533, ack 3098063203, win 85, options [nop,nop,TS val 3791078839 ecr 1095784320], length 4
00:01:26.238465 IP 10.0.0.6.1883 > 10.0.0.8.44794: Flags [P.], seq 2377297533:2377297537, ack 3098063598, win 85, options [nop,nop,TS val 3791079845 ecr 1095785326], length 4
00:01:26.240397 IP 10.0.0.6.1883 > 10.0.0.8.44794: Flags [P.], seq 2377297537:2377297541, ack 3098063602, win 85, options [nop,nop,TS val 3791079847 ecr 1095785328], length 4
00:01:27.004865 IP 10.0.0.6.1883 > 10.0.0.8.44794: Flags [P.], seq 2377297541:2377297543, ack 3098063604, win 85, options [nop,nop,TS val 3791080611 ecr 1095786092], length 2
00:01:27.244042 IP 10.0.0.6.1883 > 10.0.0.8.44794: Flags [P.], seq 2377297543:2377297547, ack 3098063999, win 85, options [nop,nop,TS val 3791080850 ecr 1095786330], length 4
00:01:27.245939 IP 10.0.0.6.1883 > 10.0.0.8.44794: Flags [P.], seq 2377297547:2377297551, ack 3098064003, win 85, options [nop,nop,TS val 3791080852 ecr 1095786333], length 4
00:01:28.245228 IP 10.0.0.6.1883 > 10.0.0.8.44794: Flags [P.], seq 2377297551:2377297555, ack 3098064398, win 85, options [nop,nop,TS val 3791081851 ecr 1095787331], length 4
00:01:28.247030 IP 10.0.0.6.1883 > 10.0.0.8.44794: Flags [P.], seq 2377297555:2377297559, ack 3098064402, win 85, options [nop,nop,TS val 3791081852 ecr 1095787333], length 4
00:01:29.245096 IP 10.0.0.6.1883 > 10.0.0.8.44794: Flags [P.], seq 2377297559:2377297563, ack 3098064797, win 85, options [nop,nop,TS val 3791082850 ecr 1095788331], length 4
00:01:29.246056 IP 10.0.0.6.1883 > 10.0.0.8.44794: Flags [P.], seq 2377297563:2377297567, ack 3098064801, win 85, options [nop,nop,TS val 3791082851 ecr 1095788333], length 4
00:01:30.254198 IP 10.0.0.6.1883 > 10.0.0.8.44794: Flags [P.], seq 2377297567:2377297571, ack 3098065196, win 85, options [nop,nop,TS val 3791083859 ecr 1095789340], length 4
00:01:30.255578 IP 10.0.0.6.1883 > 10.0.0.8.44794: Flags [P.], seq 2377297571:2377297575, ack 3098065200, win 85, options [nop,nop,TS val 3791083860 ecr 1095789341], length 4
00:01:31.260362 IP 10.0.0.6.1883 > 10.0.0.8.44794: Flags [P.], seq 2377297575:2377297579, ack 3098065595, win 85, options [nop,nop,TS val 3791084864 ecr 1095790345], length 4
00:01:31.262181 IP 10.0.0.6.1883 > 10.0.0.8.44794: Flags [P.], seq 2377297579:2377297583, ack 3098065599, win 85, options [nop,nop,TS val 3791084866 ecr 1095790347], length 4
00:01:32.006720 IP 10.0.0.6.1883 > 10.0.0.8.44794: Flags [P.], seq 2377297583:2377297585, ack 3098065601, win 85, options [nop,nop,TS val 3791085610 ecr 1095791091], length 2
00:01:32.262052 IP 10.0.0.6.1883 > 10.0.0.8.44794: Flags [P.], seq 2377297585:2377297589, ack 3098065996, win 85, options [nop,nop,TS val 3791085865 ecr 1095791346], length 4
00:01:32.264011 IP 10.0.0.6.1883 > 10.0.0.8.44794: Flags [P.], seq 2377297589:2377297593, ack 3098066000, win 85, options [nop,nop,TS val 3791085867 ecr 1095791348], length 4
00:01:33.263637 IP 10.0.0.6.1883 > 10.0.0.8.44794: Flags [P.], seq 2377297593:2377297597, ack 3098066395, win 85, options [nop,nop,TS val 3791086867 ecr 1095792348], length 4
00:01:33.265201 IP 10.0.0.6.1883 > 10.0.0.8.44794: Flags [P.], seq 2377297597:2377297601, ack 3098066399, win 85, options [nop,nop,TS val 3791086868 ecr 1095792349], length 4
00:01:34.264709 IP 10.0.0.6.1883 > 10.0.0.8.44794: Flags [P.], seq 2377297601:2377297605, ack 3098066794, win 85, options [nop,nop,TS val 3791087867 ecr 1095793348], length 4
00:01:34.266679 IP 10.0.0.6.1883 > 10.0.0.8.44794: Flags [P.], seq 2377297605:2377297609, ack 3098066798, win 85, options [nop,nop,TS val 3791087869 ecr 1095793350], length 4
00:01:35.266775 IP 10.0.0.6.1883 > 10.0.0.8.44794: Flags [P.], seq 2377297609:2377297613, ack 3098067193, win 85, options [nop,nop,TS val 3791088869 ecr 1095794348], length 4
00:01:35.267890 IP 10.0.0.6.1883 > 10.0.0.8.44794: Flags [P.], seq 2377297613:2377297617, ack 3098067197, win 85, options [nop,nop,TS val 3791088870 ecr 1095794351], length 4
00:01:36.268243 IP 10.0.0.6.1883 > 10.0.0.8.44794: Flags [P.], seq 2377297617:2377297621, ack 3098067592, win 85, options [nop,nop,TS val 3791089870 ecr 1095795349], length 4
00:01:36.269183 IP 10.0.0.6.1883 > 10.0.0.8.44794: Flags [P.], seq 2377297621:2377297625, ack 3098067596, win 85, options [nop,nop,TS val 3791089871 ecr 1095795352], length 4
00:01:37.008828 IP 10.0.0.6.1883 > 10.0.0.8.44794: Flags [P.], seq 2377297625:2377297627, ack 3098067598, win 85, options [nop,nop,TS val 3791090610 ecr 1095796091], length 2
00:01:37.270301 IP 10.0.0.6.1883 > 10.0.0.8.44794: Flags [P.], seq 2377297627:2377297631, ack 3098067993, win 85, options [nop,nop,TS val 3791090871 ecr 1095796350], length 4
00:01:37.271419 IP 10.0.0.6.1883 > 10.0.0.8.44794: Flags [P.], seq 2377297631:2377297635, ack 3098067997, win 85, options [nop,nop,TS val 3791090872 ecr 1095796354], length 4
00:01:38.270660 IP 10.0.0.6.1883 > 10.0.0.8.44794: Flags [P.], seq 2377297635:2377297639, ack 3098068392, win 85, options [nop,nop,TS val 3791091871 ecr 1095797351], length 4
00:01:38.273512 IP 10.0.0.6.1883 > 10.0.0.8.44794: Flags [P.], seq 2377297639:2377297643, ack 3098068396, win 85, options [nop,nop,TS val 3791091874 ecr 1095797354], length 4
00:01:39.274128 IP 10.0.0.6.1883 > 10.0.0.8.44794: Flags [P.], seq 2377297643:2377297647, ack 3098068791, win 85, options [nop,nop,TS val 3791092874 ecr 1095798353], length 4
00:01:39.275765 IP 10.0.0.6.1883 > 10.0.0.8.44794: Flags [P.], seq 2377297647:2377297651, ack 3098068795, win 85, options [nop,nop,TS val 3791092876 ecr 1095798357], length 4
00:01:40.276406 IP 10.0.0.6.1883 > 10.0.0.8.44794: Flags [P.], seq 2377297651:2377297655, ack 3098069190, win 85, options [nop,nop,TS val 3791093875 ecr 1095799355], length 4
00:01:40.278504 IP 10.0.0.6.1883 > 10.0.0.8.44794: Flags [P.], seq 2377297655:2377297659, ack 3098069194, win 85, options [nop,nop,TS val 3791093878 ecr 1095799358], length 4
00:01:41.276633 IP 10.0.0.6.1883 > 10.0.0.8.44794: Flags [P.], seq 2377297659:2377297663, ack 3098069589, win 85, options [nop,nop,TS val 3791094876 ecr 1095800356], length 4
00:01:41.278484 IP 10.0.0.6.1883 > 10.0.0.8.44794: Flags [P.], seq 2377297663:2377297667, ack 3098069593, win 85, options [nop,nop,TS val 3791094877 ecr 1095800358], length 4
00:01:42.012188 IP 10.0.0.6.1883 > 10.0.0.8.44794: Flags [P.], seq 2377297667:2377297669, ack 3098069595, win 85, options [nop,nop,TS val 3791095611 ecr 1095801091], length 2
00:01:42.278790 IP 10.0.0.6.1883 > 10.0.0.8.44794: Flags [P.], seq 2377297669:2377297673, ack 3098069990, win 85, options [nop,nop,TS val 3791095877 ecr 1095801357], length 4
00:01:42.279417 IP 10.0.0.6.1883 > 10.0.0.8.44794: Flags [P.], seq 2377297673:2377297677, ack 3098069994, win 85, options [nop,nop,TS val 3791095878 ecr 1095801360], length 4
00:01:43.280417 IP 10.0.0.6.1883 > 10.0.0.8.44794: Flags [P.], seq 2377297677:2377297681, ack 3098070389, win 85, options [nop,nop,TS val 3791096878 ecr 1095802359], length 4
00:01:43.282327 IP 10.0.0.6.1883 > 10.0.0.8.44794: Flags [P.], seq 2377297681:2377297685, ack 3098070393, win 85, options [nop,nop,TS val 3791096880 ecr 1095802361], length 4
00:01:44.282446 IP 10.0.0.6.1883 > 10.0.0.8.44794: Flags [P.], seq 2377297685:2377297689, ack 3098070788, win 85, options [nop,nop,TS val 3791097880 ecr 1095803359], length 4
00:01:44.284201 IP 10.0.0.6.1883 > 10.0.0.8.44794: Flags [P.], seq 2377297689:2377297693, ack 3098070792, win 85, options [nop,nop,TS val 3791097882 ecr 1095803362], length 4
00:01:45.281984 IP 10.0.0.6.1883 > 10.0.0.8.44794: Flags [P.], seq 2377297693:2377297697, ack 3098071187, win 85, options [nop,nop,TS val 3791098879 ecr 1095804360], length 4
00:01:45.283369 IP 10.0.0.6.1883 > 10.0.0.8.44794: Flags [P.], seq 2377297697:2377297701, ack 3098071191, win 85, options [nop,nop,TS val 3791098880 ecr 1095804361], length 4
00:01:46.283339 IP 10.0.0.6.1883 > 10.0.0.8.44794: Flags [P.], seq 2377297701:2377297705, ack 3098071586, win 85, options [nop,nop,TS val 3791099880 ecr 1095805361], length 4
00:01:46.285452 IP 10.0.0.6.1883 > 10.0.0.8.44794: Flags [P.], seq 2377297705:2377297709, ack 3098071590, win 85, options [nop,nop,TS val 3791099882 ecr 1095805363], length 4
00:01:47.013230 IP 10.0.0.6.1883 > 10.0.0.8.44794: Flags [P.], seq 2377297709:2377297711, ack 3098071592, win 85, options [nop,nop,TS val 3791100609 ecr 1095806091], length 2
00:01:47.284235 IP 10.0.0.6.1883 > 10.0.0.8.44794: Flags [P.], seq 2377297711:2377297715, ack 3098071987, win 85, options [nop,nop,TS val 3791100880 ecr 1095806361], length 4
00:01:47.284906 IP 10.0.0.6.1883 > 10.0.0.8.44794: Flags [P.], seq 2377297715:2377297719, ack 3098071991, win 85, options [nop,nop,TS val 3791100881 ecr 1095806362], length 4
00:01:48.286414 IP 10.0.0.6.1883 > 10.0.0.8.44794: Flags [P.], seq 2377297719:2377297723, ack 3098072386, win 85, options [nop,nop,TS val 3791101882 ecr 1095807362], length 4
00:01:48.288031 IP 10.0.0.6.1883 > 10.0.0.8.44794: Flags [P.], seq 2377297723:2377297727, ack 3098072390, win 85, options [nop,nop,TS val 3791101883 ecr 1095807364], length 4
00:01:49.291617 IP 10.0.0.6.1883 > 10.0.0.8.44794: Flags [P.], seq 2377297727:2377297731, ack 3098072785, win 85, options [nop,nop,TS val 3791102887 ecr 1095808366], length 4
00:01:49.293409 IP 10.0.0.6.1883 > 10.0.0.8.44794: Flags [P.], seq 2377297731:2377297735, ack 3098072789, win 85, options [nop,nop,TS val 3791102888 ecr 1095808369], length 4
00:01:50.292415 IP 10.0.0.6.1883 > 10.0.0.8.44794: Flags [P.], seq 2377297735:2377297739, ack 3098073184, win 85, options [nop,nop,TS val 3791103887 ecr 1095809367], length 4
00:01:50.294398 IP 10.0.0.6.1883 > 10.0.0.8.44794: Flags [P.], seq 2377297739:2377297743, ack 3098073188, win 85, options [nop,nop,TS val 3791103889 ecr 1095809370], length 4
00:01:51.294046 IP 10.0.0.6.1883 > 10.0.0.8.44794: Flags [P.], seq 2377297743:2377297747, ack 3098073583, win 85, options [nop,nop,TS val 3791104888 ecr 1095810368], length 4
00:01:51.295681 IP 10.0.0.6.1883 > 10.0.0.8.44794: Flags [P.], seq 2377297747:2377297751, ack 3098073587, win 85, options [nop,nop,TS val 3791104890 ecr 1095810370], length 4
00:01:52.015294 IP 10.0.0.6.1883 > 10.0.0.8.44794: Flags [P.], seq 2377297751:2377297753, ack 3098073589, win 85, options [nop,nop,TS val 3791105609 ecr 1095811089], length 2
00:01:52.294617 IP 10.0.0.6.1883 > 10.0.0.8.44794: Flags [P.], seq 2377297753:2377297757, ack 3098073984, win 85, options [nop,nop,TS val 3791105888 ecr 1095811368], length 4
00:01:52.296356 IP 10.0.0.6.1883 > 10.0.0.8.44794: Flags [P.], seq 2377297757:2377297761, ack 3098073988, win 85, options [nop,nop,TS val 3791105890 ecr 1095811371], length 4
00:01:57.020354 IP 10.0.0.6.1883 > 10.0.0.8.44794: Flags [P.], seq 2377297761:2377297763, ack 3098073990, win 85, options [nop,nop,TS val 3791110611 ecr 1095816092], length 2
00:02:02.022479 IP 10.0.0.6.1883 > 10.0.0.8.44794: Flags [P.], seq 2377297763:2377297765, ack 3098073992, win 85, options [nop,nop,TS val 3791115611 ecr 1095821091], length 2
00:02:07.033796 IP 10.0.0.6.1883 > 10.0.0.8.44794: Flags [P.], seq 2377297765:2377297767, ack 3098073994, win 85, options [nop,nop,TS val 3791120620 ecr 1095826100], length 2
00:02:12.051397 IP 10.0.0.6.1883 > 10.0.0.8.44794: Flags [P.], seq 2377297767:2377297769, ack 3098073996, win 85, options [nop,nop,TS val 3791125635 ecr 1095831115], length 2
00:02:17.053152 IP 10.0.0.6.1883 > 10.0.0.8.44794: Flags [P.], seq 2377297769:2377297771, ack 3098073998, win 85, options [nop,nop,TS val 3791130634 ecr 1095836114], length 2
00:02:19.149494 IP 10.0.0.6.1883 > 10.0.0.8.44794: Flags [F.], seq 2377297771, ack 3098073999, win 85, options [nop,nop,TS val 3791132729 ecr 1095838210], length 0