00:00:11.723016 IP 10.0.0.6.1883 > 10.0.0.8.44862: Flags [S.], seq 715574814, ack 756101428, win 43440, options [mss 1460,sackOK,TS val 3791384813 ecr 1096090263,nop,wscale 9], length 0
00:00:11.734203 IP 10.0.0.6.1883 > 10.0.0.8.44862: Flags [.], ack 756101448, win 85, options [nop,nop,TS val 3791384825 ecr 1096090306], length 0
00:00:11.734642 IP 10.0.0.6.1883 > 10.0.0.8.44862: Flags [P.], seq 715574815:715574819, ack 756101448, win 85, options [nop,nop,TS val 3791384825 ecr 1096090306], length 4
00:00:11.736149 IP 10.0.0.6.1883 > 10.0.0.8.44862: Flags [P.], seq 715574819:715574884, ack 756101512, win 85, options [nop,nop,TS val 3791384827 ecr 1096090307], length 65
00:00:11.736387 IP 10.0.0.6.1883 > 10.0.0.8.44862: Flags [P.], seq 715574884:715574889, ack 756101907, win 85, options [nop,nop,TS val 3791384827 ecr 1096090309], length 5
00:00:11.781029 IP 10.0.0.6.1883 > 10.0.0.8.44862: Flags [P.], seq 715574889:715574893, ack 756101907, win 85, options [nop,nop,TS val 3791384872 ecr 1096090350], length 4
00:00:11.796004 IP 10.0.0.6.1883 > 10.0.0.8.44862: Flags [P.], seq 715574893:715574897, ack 756101911, win 85, options [nop,nop,TS val 3791384886 ecr 1096090367], length 4
00:00:12.694356 IP 10.0.0.6.1883 > 10.0.0.8.44862: Flags [P.], seq 715574897:715574901, ack 756102306, win 85, options [nop,nop,TS val 3791385784 ecr 1096091264], length 4
00:00:12.695167 IP 10.0.0.6.1883 > 10.0.0.8.44862: Flags [P.], seq 715574901:715574905, ack 756102310, win 85, options [nop,nop,TS val 3791385785 ecr 1096091267], length 4
00:00:13.695514 IP 10.0.0.6.1883 > 10.0.0.8.44862: Flags [P.], seq 715574905:715574909, ack 756102705, win 85, options [nop,nop,TS val 3791386785 ecr 1096092265], length 4
00:00:13.697535 IP 10.0.0.6.1883 > 10.0.0.8.44862: Flags [P.], seq 715574909:715574913, ack 756102709, win 85, options [nop,nop,TS val 3791386787 ecr 1096092268], length 4
00:00:14.697784 IP 10.0.0.6.1883 > 10.0.0.8.44862: Flags [P.], seq 715574913:715574917, ack 756103104, win 85, options [nop,nop,TS val 3791387787 ecr 1096093266], length 4
00:00:14.700015 IP 10.0.0.6.1883 > 10.0.0.8.44862: Flags [P.], seq 715574917:715574921, ack 756103108, win 85, options [nop,nop,TS val 3791387789 ecr 1096093270], length 4
00:00:15.697031 IP 10.0.0.6.1883 > 10.0.0.8.44862: Flags [P.], seq 715574921:715574925, ack 756103503, win 85, options [nop,nop,TS val 3791388786 ecr 1096094267], length 4
00:00:15.698491 IP 10.0.0.6.1883 > 10.0.0.8.44862: Flags [P.], seq 715574925:715574929, ack 756103507, win 85, options [nop,nop,TS val 3791388787 ecr 1096094268], length 4
00:00:16.698290 IP 10.0.0.6.1883 > 10.0.0.8.44862: Flags [P.], seq 715574929:715574933, ack 756103902, win 85, options [nop,nop,TS val 3791389786 ecr 1096095267], length 4
00:00:16.698868 IP 10.0.0.6.1883 > 10.0.0.8.44862: Flags [P.], seq 715574933:715574937, ack 756103906, win 85, options [nop,nop,TS val 3791389787 ecr 1096095269], length 4
00:00:16.738120 IP 10.0.0.6.1883 > 10.0.0.8.44862: Flags [P.], seq 715574937:715574939, ack 756103908, win 85, options [nop,nop,TS val 3791389826 ecr 1096095307], length 2
00:00:17.700039 IP 10.0.0.6.1883 > 10.0.0.8.44862: Flags [P.], seq 715574939:715574943, ack 756104303, win 85, options [nop,nop,TS val 3791390788 ecr 1096096269], length 4
00:00:17.700823 IP 10.0.0.6.1883 > 10.0.0.8.44862: Flags [P.], seq 715574943:715574947, ack 756104307, win 85, options [nop,nop,TS val 3791390788 ecr 1096096270], length 4
00:00:18.703089 IP 10.0.0.6.1883 > 10.0.0.8.44862: Flags [P.], seq 715574947:715574951, ack 756104702, win 85, options [nop,nop,TS val 3791391790 ecr 1096097271], length 4
00:00:18.705403 IP 10.0.0.6.1883 > 10.0.0.8.44862: Flags [P.], seq 715574951:715574955, ack 756104706, win 85, options [nop,nop,TS val 3791391792 ecr 1096097273], length 4
00:00:19.703780 IP 10.0.0.6.1883 > 10.0.0.8.44862: Flags [P.], seq 715574955:715574959, ack 756105101, win 85, options [nop,nop,TS val 3791392790 ecr 1096098271], length 4
00:00:19.705559 IP 10.0.0.6.1883 > 10.0.0.8.44862: Flags [P.], seq 715574959:715574963, ack 756105105, win 85, options [nop,nop,TS val 3791392792 ecr 1096098273], length 4
00:00:20.705917 IP 10.0.0.6.1883 > 10.0.0.8.44862: Flags [P.], seq 715574963:715574967, ack 756105500, win 85, options [nop,nop,TS val 3791393792 ecr 1096099273], length 4
00:00:20.706955 IP 10.0.0.6.1883 > 10.0.0.8.44862: Flags [P.], seq 715574967:715574971, ack 756105504, win 85, options [nop,nop,TS val 3791393793 ecr 1096099274], length 4
00:00:21.706868 IP 10.0.0.6.1883 > 10.0.0.8.44862: Flags [P.], seq 715574971:715574975, ack 756105899, win 85, options [nop,nop,TS val 3791394792 ecr 1096100273], length 4
00:00:21.708766 IP 10.0.0.6.1883 > 10.0.0.8.44862: Flags [P.], seq 715574975:715574979, ack 756105903, win 85, options [nop,nop,TS val 3791394794 ecr 1096100275], length 4
00:00:21.745521 IP 10.0.0.6.1883 > 10.0.0.8.44862: Flags [P.], seq 715574979:715574981, ack 756105905, win 85, options [nop,nop,TS val 3791394831 ecr 1096100313], length 2
00:00:22.707467 IP 10.0.0.6.1883 > 10.0.0.8.44862: Flags [P.], seq 715574981:715574985, ack 756106300, win 85, options [nop,nop,TS val 3791395792 ecr 1096101274], length 4
00:00:22.708787 IP 10.0.0.6.1883 > 10.0.0.8.44862: Flags [P.], seq 715574985:715574989, ack 756106304, win 85, options [nop,nop,TS val 3791395794 ecr 1096101275], length 4
00:00:23.778284 IP 10.0.0.6.1883 > 10.0.0.8.44862: Flags [P.], seq 715574989:715574993, ack 756106699, win 85, options [nop,nop,TS val 3791396863 ecr 1096102344], length 4
00:00:23.779461 IP 10.0.0.6.1883 > 10.0.0.8.44862: Flags [P.], seq 715574993:715574997, ack 756106703, win 85, options [nop,nop,TS val 3791396864 ecr 1096102346], length 4
00:00:24.812830 IP 10.0.0.6.1883 > 10.0.0.8.44862: Flags [P.], seq 715574997:715575001, ack 756107098, win 85, options [nop,nop,TS val 3791397897 ecr 1096103378], length 4
00:00:24.814301 IP 10.0.0.6.1883 > 10.0.0.8.44862: Flags [P.], seq 715575001:715575005, ack 756107102, win 85, options [nop,nop,TS val 3791397898 ecr 1096103380], length 4
00:00:25.817555 IP 10.0.0.6.1883 > 10.0.0.8.44862: Flags [P.], seq 715575005:715575009, ack 756107497, win 85, options [nop,nop,TS val 3791398901 ecr 1096104382], length 4
00:00:25.819201 IP 10.0.0.6.1883 > 10.0.0.8.44862: Flags [P.], seq 715575009:715575013, ack 756107501, win 85, options [nop,nop,TS val 3791398903 ecr 1096104384], length 4
00:00:27.115769 IP 10.0.0.6.1883 > 10.0.0.8.44862: Flags [P.], seq 715575013:715575017, ack 756107896, win 85, options [nop,nop,TS val 3791400199 ecr 1096105680], length 4
00:00:27.117103 IP 10.0.0.6.1883 > 10.0.0.8.44862: Flags [P.], seq 715575017:715575019, ack 756107898, win 85, options [nop,nop,TS val 3791400200 ecr 1096105681], length 2
00:00:27.118640 IP 10.0.0.6.1883 > 10.0.0.8.44862: Flags [P.], seq 715575019:715575023, ack 756107902, win 85, options [nop,nop,TS val 3791400201 ecr 1096105682], length 4
00:00:28.202506 IP 10.0.0.6.1883 > 10.0.0.8.44862: Flags [P.], seq 715575023:715575027, ack 756108297, win 85, options [nop,nop,TS val 3791401285 ecr 1096106766], length 4
00:00:28.203739 IP 10.0.0.6.1883 > 10.0.0.8.44862: Flags [P.], seq 715575027:715575031, ack 756108301, win 85, options [nop,nop,TS val 3791401286 ecr 1096106767], length 4
00:00:29.203692 IP 10.0.0.6.1883 > 10.0.0.8.44862: Flags [P.], seq 715575031:715575035, ack 756108696, win 85, options [nop,nop,TS val 3791402285 ecr 1096107766], length 4
00:00:29.205051 IP 10.0.0.6.1883 > 10.0.0.8.44862: Flags [P.], seq 715575035:715575039, ack 756108700, win 85, options [nop,nop,TS val 3791402287 ecr 1096107768], length 4
00:00:30.206451 IP 10.0.0.6.1883 > 10.0.0.8.44862: Flags [P.], seq 715575039:715575043, ack 756109095, win 85, options [nop,nop,TS val 3791403288 ecr 1096108767], length 4
00:00:30.208436 IP 10.0.0.6.1883 > 10.0.0.8.44862: Flags [P.], seq 715575043:715575047, ack 756109099, win 85, options [nop,nop,TS val 3791403290 ecr 1096108770], length 4
00:00:30.527223 IP 10.0.0.6.1883 > 10.0.0.8.44862: Flags [P.], seq 715575043:715575047, ack 756109099, win 85, options [nop,nop,TS val 3791403608 ecr 1096108770], length 4
00:00:31.545400 IP 10.0.0.6.1883 > 10.0.0.8.44862: Flags [P.], seq 715575047:715575051, ack 756109494, win 85, options [nop,nop,TS val 3791404626 ecr 1096110106], length 4
00:00:31.545999 IP 10.0.0.6.1883 > 10.0.0.8.44862: Flags [P.], seq 715575051:715575055, ack 756109498, win 85, options [nop,nop,TS val 3791404627 ecr 1096110108], length 4
00:00:32.118839 IP 10.0.0.6.1883 > 10.0.0.8.44862: Flags [P.], seq 715575055:715575057, ack 756109500, win 85, options [nop,nop,TS val 3791405199 ecr 1096110679], length 2
00:00:32.712881 IP 10.0.0.6.1883 > 10.0.0.8.44862: Flags [P.], seq 715575057:715575061, ack 756109895, win 85, options [nop,nop,TS val 3791405793 ecr 1096111274], length 4
00:00:32.717347 IP 10.0.0.6.1883 > 10.0.0.8.44862: Flags [P.], seq 715575061:715575065, ack 756109899, win 85, options [nop,nop,TS val 3791405797 ecr 1096111275], length 4
00:00:33.098640 IP 10.0.0.6.1883 > 10.0.0.8.44862: Flags [P.], seq 715575061:715575065, ack 756109899, win 85, options [nop,nop,TS val 3791406178 ecr 1096111275], length 4
00:00:33.714609 IP 10.0.0.6.1883 > 10.0.0.8.44862: Flags [P.], seq 715575065:715575069, ack 756110294, win 85, options [nop,nop,TS val 3791406794 ecr 1096112275], length 4
00:00:33.715753 IP 10.0.0.6.1883 > 10.0.0.8.44862: Flags [P.], seq 715575069:715575073, ack 756110298, win 85, options [nop,nop,TS val 3791406795 ecr 1096112277], length 4
00:00:35.053029 IP 10.0.0.6.1883 > 10.0.0.8.44862: Flags [P.], seq 715575073:715575077, ack 756110693, win 85, options [nop,nop,TS val 3791408132 ecr 1096113612], length 4
00:00:35.053919 IP 10.0.0.6.1883 > 10.0.0.8.44862: Flags [P.], seq 715575077:715575081, ack 756110697, win 85, options [nop,nop,TS val 3791408133 ecr 1096113614], length 4
00:00:36.054977 IP 10.0.0.6.1883 > 10.0.0.8.44862: Flags [P.], seq 715575081:715575085, ack 756111092, win 85, options [nop,nop,TS val 3791409133 ecr 1096114614], length 4
00:00:36.056637 IP 10.0.0.6.1883 > 10.0.0.8.44862: Flags [P.], seq 715575085:715575089, ack 756111096, win 85, options [nop,nop,TS val 3791409135 ecr 1096114616], length 4
00:00:37.100682 IP 10.0.0.6.1883 > 10.0.0.8.44862: Flags [P.], seq 715575089:715575093, ack 756111491, win 85, options [nop,nop,TS val 3791410178 ecr 1096115659], length 4
00:00:37.101889 IP 10.0.0.6.1883 > 10.0.0.8.44862: Flags [P.], seq 715575093:715575097, ack 756111495, win 85, options [nop,nop,TS val 3791410180 ecr 1096115661], length 4
00:00:37.301320 IP 10.0.0.6.1883 > 10.0.0.8.44862: Flags [P.], seq 715575097:715575099, ack 756111497, win 85, options [nop,nop,TS val 3791410379 ecr 1096115861], length 2
00:00:38.124271 IP 10.0.0.6.1883 > 10.0.0.8.44862: Flags [P.], seq 715575099:715575103, ack 756111892, win 85, options [nop,nop,TS val 3791411202 ecr 1096116682], length 4
00:00:38.125348 IP 10.0.0.6.1883 > 10.0.0.8.44862: Flags [P.], seq 715575103:715575107, ack 756111896, win 85, options [nop,nop,TS val 3791411203 ecr 1096116684], length 4
00:00:39.325815 IP 10.0.0.6.1883 > 10.0.0.8.44862: Flags [P.], seq 715575107:715575111, ack 756112291, win 85, options [nop,nop,TS val 3791412403 ecr 1096117882], length 4
00:00:39.327267 IP 10.0.0.6.1883 > 10.0.0.8.44862: Flags [P.], seq 715575111:715575115, ack 756112295, win 85, options [nop,nop,TS val 3791412404 ecr 1096117885], length 4
00:00:40.326986 IP 10.0.0.6.1883 > 10.0.0.8.44862: Flags [P.], seq 715575115:715575119, ack 756112690, win 85, options [nop,nop,TS val 3791413403 ecr 1096118884], length 4
00:00:40.329397 IP 10.0.0.6.1883 > 10.0.0.8.44862: Flags [P.], seq 715575119:715575123, ack 756112694, win 85, options [nop,nop,TS val 3791413406 ecr 1096118887], length 4
00:00:41.341527 IP 10.0.0.6.1883 > 10.0.0.8.44862: Flags [P.], seq 715575123:715575127, ack 756113089, win 85, options [nop,nop,TS val 3791414417 ecr 1096119899], length 4
00:00:41.342254 IP 10.0.0.6.1883 > 10.0.0.8.44862: Flags [P.], seq 715575127:715575131, ack 756113093, win 85, options [nop,nop,TS val 3791414418 ecr 1096119900], length 4
00:00:42.344738 IP 10.0.0.6.1883 > 10.0.0.8.44862: Flags [P.], seq 715575131:715575133, ack 756113095, win 85, options [nop,nop,TS val 3791415420 ecr 1096120901], length 2
00:00:42.345642 IP 10.0.0.6.1883 > 10.0.0.8.44862: Flags [P.], seq 715575133:715575137, ack 756113490, win 85, options [nop,nop,TS val 3791415421 ecr 1096120902], length 4
00:00:42.347385 IP 10.0.0.6.1883 > 10.0.0.8.44862: Flags [P.], seq 715575137:715575141, ack 756113494, win 85, options [nop,nop,TS val 3791415423 ecr 1096120904], length 4
00:00:43.345656 IP 10.0.0.6.1883 > 10.0.0.8.44862: Flags [P.], seq 715575141:715575145, ack 756113889, win 85, options [nop,nop,TS val 3791416420 ecr 1096121902], length 4
00:00:43.347076 IP 10.0.0.6.1883 > 10.0.0.8.44862: Flags [P.], seq 715575145:715575149, ack 756113893, win 85, options [nop,nop,TS val 3791416422 ecr 1096121903], length 4
00:00:44.348173 IP 10.0.0.6.1883 > 10.0.0.8.44862: Flags [P.], seq 715575149:715575153, ack 756114288, win 85, options [nop,nop,TS val 3791417422 ecr 1096122903], length 4
00:00:44.349563 IP 10.0.0.6.1883 > 10.0.0.8.44862: Flags [P.], seq 715575153:715575157, ack 756114292, win 85, options [nop,nop,TS val 3791417424 ecr 1096122905], length 4
00:00:45.377772 IP 10.0.0.6.1883 > 10.0.0.8.44862: Flags [P.], seq 715575157:715575161, ack 756114687, win 85, options [nop,nop,TS val 3791418451 ecr 1096123932], length 4
00:00:45.379118 IP 10.0.0.6.1883 > 10.0.0.8.44862: Flags [P.], seq 715575161:715575165, ack 756114691, win 85, options [nop,nop,TS val 3791418453 ecr 1096123934], length 4
00:00:46.379979 IP 10.0.0.6.1883 > 10.0.0.8.44862: Flags [P.], seq 715575165:715575169, ack 756115086, win 85, options [nop,nop,TS val 3791419453 ecr 1096124934], length 4
00:00:46.380735 IP 10.0.0.6.1883 > 10.0.0.8.44862: Flags [P.], seq 715575169:715575173, ack 756115090, win 85, options [nop,nop,TS val 3791419454 ecr 1096124936], length 4
00:00:47.345242 IP 10.0.0.6.1883 > 10.0.0.8.44862: Flags [P.], seq 715575173:715575175, ack 756115092, win 85, options [nop,nop,TS val 3791420418 ecr 1096125899], length 2
00:00:47.382137 IP 10.0.0.6.1883 > 10.0.0.8.44862: Flags [P.], seq 715575175:715575179, ack 756115487, win 85, options [nop,nop,TS val 3791420455 ecr 1096125935], length 4
00:00:47.386118 IP 10.0.0.6.1883 > 10.0.0.8.44862: Flags [P.], seq 715575179:715575183, ack 756115491, win 85, options [nop,nop,TS val 3791420459 ecr 1096125940], length 4
00:00:48.384327 IP 10.0.0.6.1883 > 10.0.0.8.44862: Flags [P.], seq 715575183:715575187, ack 756115886, win 85, options [nop,nop,TS val 3791421457 ecr 1096126937], length 4
00:00:48.386532 IP 10.0.0.6.1883 > 10.0.0.8.44862: Flags [P.], seq 715575187:715575191, ack 756115890, win 85, options [nop,nop,TS val 3791421459 ecr 1096126939], length 4
00:00:49.384927 IP 10.0.0.6.1883 > 10.0.0.8.44862: Flags [P.], seq 715575191:715575195, ack 756116285, win 85, options [nop,nop,TS val 3791422457 ecr 1096127937], length 4
00:00:49.386470 IP 10.0.0.6.1883 > 10.0.0.8.44862: Flags [P.], seq 715575195:715575199, ack 756116289, win 85, options [nop,nop,TS val 3791422458 ecr 1096127940], length 4
00:00:50.386245 IP 10.0.0.6.1883 > 10.0.0.8.44862: Flags [P.], seq 715575199:715575203, ack 756116684, win 85, options [nop,nop,TS val 3791423457 ecr 1096128938], length 4
00:00:50.387507 IP 10.0.0.6.1883 > 10.0.0.8.44862: Flags [P.], seq 715575203:715575207, ack 756116688, win 85, options [nop,nop,TS val 3791423459 ecr 1096128940], length 4
00:00:51.393331 IP 10.0.0.6.1883 > 10.0.0.8.44862: Flags [P.], seq 715575207:715575211, ack 756117083, win 85, options [nop,nop,TS val 3791424464 ecr 1096129945], length 4
00:00:51.397655 IP 10.0.0.6.1883 > 10.0.0.8.44862: Flags [P.], seq 715575211:715575215, ack 756117087, win 85, options [nop,nop,TS val 3791424468 ecr 1096129949], length 4
00:00:52.347890 IP 10.0.0.6.1883 > 10.0.0.8.44862: Flags [P.], seq 715575215:715575217, ack 756117089, win 85, options [nop,nop,TS val 3791425418 ecr 1096130898], length 2
00:00:52.397925 IP 10.0.0.6.1883 > 10.0.0.8.44862: Flags [P.], seq 715575217:715575221, ack 756117484, win 85, options [nop,nop,TS val 3791425468 ecr 1096130946], length 4
00:00:52.399004 IP 10.0.0.6.1883 > 10.0.0.8.44862: Flags [P.], seq 715575221:715575225, ack 756117488, win 85, options [nop,nop,TS val 3791425469 ecr 1096130951], length 4
00:00:53.396896 IP 10.0.0.6.1883 > 10.0.0.8.44862: Flags [P.], seq 715575225:715575229, ack 756117883, win 85, options [nop,nop,TS val 3791426467 ecr 1096131948], length 4
00:00:53.397403 IP 10.0.0.6.1883 > 10.0.0.8.44862: Flags [P.], seq 715575229:715575233, ack 756117887, win 85, options [nop,nop,TS val 3791426467 ecr 1096131949], length 4
00:00:54.443411 IP 10.0.0.6.1883 > 10.0.0.8.44862: Flags [P.], seq 715575233:715575237, ack 756118282, win 85, options [nop,nop,TS val 3791427513 ecr 1096132993], length 4
00:00:54.444922 IP 10.0.0.6.1883 > 10.0.0.8.44862: Flags [P.], seq 715575237:715575241, ack 756118286, win 85, options [nop,nop,TS val 3791427514 ecr 1096132996], length 4
00:00:55.443280 IP 10.0.0.6.1883 > 10.0.0.8.44862: Flags [P.], seq 715575241:715575245, ack 756118681, win 85, options [nop,nop,TS val 3791428512 ecr 1096133993], length 4
00:00:55.443952 IP 10.0.0.6.1883 > 10.0.0.8.44862: Flags [P.], seq 715575245:715575249, ack 756118685, win 85, options [nop,nop,TS val 3791428513 ecr 1096133994], length 4
00:00:56.451090 IP 10.0.0.6.1883 > 10.0.0.8.44862: Flags [P.], seq 715575249:715575253, ack 756119080, win 85, options [nop,nop,TS val 3791429519 ecr 1096135000], length 4
00:00:56.452493 IP 10.0.0.6.1883 > 10.0.0.8.44862: Flags [P.], seq 715575253:715575257, ack 756119084, win 85, options [nop,nop,TS val 3791429521 ecr 1096135002], length 4
00:00:57.347465 IP 10.0.0.6.1883 > 10.0.0.8.44862: Flags [P.], seq 715575257:715575259, ack 756119086, win 85, options [nop,nop,TS val 3791430415 ecr 1096135897], length 2
00:00:57.453555 IP 10.0.0.6.1883 > 10.0.0.8.44862: Flags [P.], seq 715575259:715575263, ack 756119481, win 85, options [nop,nop,TS val 3791430521 ecr 1096136002], length 4
00:00:57.454647 IP 10.0.0.6.1883 > 10.0.0.8.44862: Flags [P.], seq 715575263:715575267, ack 756119485, win 85, options [nop,nop,TS val 3791430522 ecr 1096136004], length 4
00:00:58.454272 IP 10.0.0.6.1883 > 10.0.0.8.44862: Flags [P.], seq 715575267:715575271, ack 756119880, win 85, options [nop,nop,TS val 3791431521 ecr 1096137003], length 4
00:00:58.454891 IP 10.0.0.6.1883 > 10.0.0.8.44862: Flags [P.], seq 715575271:715575275, ack 756119884, win 85, options [nop,nop,TS val 3791431522 ecr 1096137004], length 4
00:00:59.455029 IP 10.0.0.6.1883 > 10.0.0.8.44862: Flags [P.], seq 715575275:715575279, ack 756120279, win 85, options [nop,nop,TS val 3791432522 ecr 1096138003], length 4
00:00:59.455774 IP 10.0.0.6.1883 > 10.0.0.8.44862: Flags [P.], seq 715575279:715575283, ack 756120283, win 85, options [nop,nop,TS val 3791432522 ecr 1096138004], length 4
00:01:00.456242 IP 10.0.0.6.1883 > 10.0.0.8.44862: Flags [P.], seq 715575283:715575287, ack 756120678, win 85, options [nop,nop,TS val 3791433522 ecr 1096139004], length 4
00:01:00.457585 IP 10.0.0.6.1883 > 10.0.0.8.44862: Flags [P.], seq 715575287:715575291, ack 756120682, win 85, options [nop,nop,TS val 3791433524 ecr 1096139005], length 4
00:01:01.456870 IP 10.0.0.6.1883 > 10.0.0.8.44862: Flags [P.], seq 715575291:715575295, ack 756121077, win 85, options [nop,nop,TS val 3791434522 ecr 1096140004], length 4
00:01:01.457835 IP 10.0.0.6.1883 > 10.0.0.8.44862: Flags [P.], seq 715575295:715575299, ack 756121081, win 85, options [nop,nop,TS val 3791434523 ecr 1096140005], length 4
00:01:02.349310 IP 10.0.0.6.1883 > 10.0.0.8.44862: Flags [P.], seq 715575299:715575301, ack 756121083, win 85, options [nop,nop,TS val 3791435414 ecr 1096140896], length 2
00:01:02.458165 IP 10.0.0.6.1883 > 10.0.0.8.44862: Flags [P.], seq 715575301:715575305, ack 756121478, win 85, options [nop,nop,TS val 3791435523 ecr 1096141005], length 4
00:01:02.458741 IP 10.0.0.6.1883 > 10.0.0.8.44862: Flags [P.], seq 715575305:715575309, ack 756121482, win 85, options [nop,nop,TS val 3791435524 ecr 1096141006], length 4
00:01:03.460049 IP 10.0.0.6.1883 > 10.0.0.8.44862: Flags [P.], seq 715575309:715575313, ack 756121877, win 85, options [nop,nop,TS val 3791436525 ecr 1096142006], length 4
00:01:03.461659 IP 10.0.0.6.1883 > 10.0.0.8.44862: Flags [P.], seq 715575313:715575317, ack 756121881, win 85, options [nop,nop,TS val 3791436526 ecr 1096142007], length 4
00:01:04.463253 IP 10.0.0.6.1883 > 10.0.0.8.44862: Flags [P.], seq 715575317:715575321, ack 756122276, win 85, options [nop,nop,TS val 3791437527 ecr 1096143007], length 4
00:01:04.465480 IP 10.0.0.6.1883 > 10.0.0.8.44862: Flags [P.], seq 715575321:715575325, ack 756122280, win 85, options [nop,nop,TS val 3791437530 ecr 1096143010], length 4
00:01:05.464128 IP 10.0.0.6.1883 > 10.0.0.8.44862: Flags [P.], seq 715575325:715575329, ack 756122675, win 85, options [nop,nop,TS val 3791438528 ecr 1096144009], length 4
00:01:05.465766 IP 10.0.0.6.1883 > 10.0.0.8.44862: Flags [P.], seq 715575329:715575333, ack 756122679, win 85, options [nop,nop,TS val 3791438529 ecr 1096144011], length 4
00:01:06.463403 IP 10.0.0.6.1883 > 10.0.0.8.44862: Flags [P.], seq 715575333:715575337, ack 756123074, win 85, options [nop,nop,TS val 3791439527 ecr 1096145008], length 4
00:01:06.463718 IP 10.0.0.6.1883 > 10.0.0.8.44862: Flags [P.], seq 715575337:715575341, ack 756123078, win 85, options [nop,nop,TS val 3791439527 ecr 1096145009], length 4
00:01:07.351466 IP 10.0.0.6.1883 > 10.0.0.8.44862: Flags [P.], seq 715575341:715575343, ack 756123080, win 85, options [nop,nop,TS val 3791440415 ecr 1096145896], length 2
00:01:07.465473 IP 10.0.0.6.1883 > 10.0.0.8.44862: Flags [P.], seq 715575343:715575347, ack 756123475, win 85, options [nop,nop,TS val 3791440529 ecr 1096146010], length 4
00:01:07.466072 IP 10.0.0.6.1883 > 10.0.0.8.44862: Flags [P.], seq 715575347:715575351, ack 756123479, win 85, options [nop,nop,TS val 3791440529 ecr 1096146011], length 4
00:01:08.465525 IP 10.0.0.6.1883 > 10.0.0.8.44862: Flags [P.], seq 715575351:715575355, ack 756123874, win 85, options [nop,nop,TS val 3791441529 ecr 1096147011], length 4
00:01:08.466049 IP 10.0.0.6.1883 > 10.0.0.8.44862: Flags [P.], seq 715575355:715575359, ack 756123878, win 85, options [nop,nop,TS val 3791441529 ecr 1096147011], length 4
00:01:09.466510 IP 10.0.0.6.1883 > 10.0.0.8.44862: Flags [P.], seq 715575359:715575363, ack 756124273, win 85, options [nop,nop,TS val 3791442530 ecr 1096148012], length 4
00:01:09.466938 IP 10.0.0.6.1883 > 10.0.0.8.44862: Flags [P.], seq 715575363:715575367, ack 756124277, win 85, options [nop,nop,TS val 3791442530 ecr 1096148012], length 4
00:01:10.467441 IP 10.0.0.6.1883 > 10.0.0.8.44862: Flags [P.], seq 715575367:715575371, ack 756124672, win 85, options [nop,nop,TS val 3791443531 ecr 1096149012], length 4
00:01:10.467860 IP 10.0.0.6.1883 > 10.0.0.8.44862: Flags [P.], seq 715575371:715575375, ack 756124676, win 85, options [nop,nop,TS val 3791443531 ecr 1096149013], length 4
00:01:11.468679 IP 10.0.0.6.1883 > 10.0.0.8.44862: Flags [P.], seq 715575375:715575379, ack 756125071, win 85, options [nop,nop,TS val 3791444532 ecr 1096150014], length 4
00:01:11.469116 IP 10.0.0.6.1883 > 10.0.0.8.44862: Flags [P.], seq 715575379:715575383, ack 756125075, win 85, options [nop,nop,TS val 3791444532 ecr 1096150014], length 4
00:01:12.361070 IP 10.0.0.6.1883 > 10.0.0.8.44862: Flags [P.], seq 715575383:715575385, ack 756125077, win 85, options [nop,nop,TS val 3791445424 ecr 1096150906], length 2
00:01:12.469980 IP 10.0.0.6.1883 > 10.0.0.8.44862: Flags [P.], seq 715575385:715575389, ack 756125472, win 85, options [nop,nop,TS val 3791445533 ecr 1096151015], length 4
00:01:12.470260 IP 10.0.0.6.1883 > 10.0.0.8.44862: Flags [P.], seq 715575389:715575393, ack 756125476, win 85, options [nop,nop,TS val 3791445534 ecr 1096151015], length 4
00:01:13.471128 IP 10.0.0.6.1883 > 10.0.0.8.44862: Flags [P.], seq 715575393:715575397, ack 756125871, win 85, options [nop,nop,TS val 3791446535 ecr 1096152016], length 4
00:01:13.471321 IP 10.0.0.6.1883 > 10.0.0.8.44862: Flags [P.], seq 715575397:715575401, ack 756125875, win 85, options [nop,nop,TS val 3791446535 ecr 1096152017], length 4
00:01:14.489053 IP 10.0.0.6.1883 > 10.0.0.8.44862: Flags [P.], seq 715575401:715575405, ack 756126270, win 85, options [nop,nop,TS val 3791447552 ecr 1096153034], length 4
00:01:14.489722 IP 10.0.0.6.1883 > 10.0.0.8.44862: Flags [P.], seq 715575405:715575409, ack 756126274, win 85, options [nop,nop,TS val 3791447553 ecr 1096153035], length 4
00:01:15.490936 IP 10.0.0.6.1883 > 10.0.0.8.44862: Flags [P.], seq 715575409:715575413, ack 756126669, win 85, options [nop,nop,TS val 3791448554 ecr 1096154035], length 4
00:01:15.491996 IP 10.0.0.6.1883 > 10.0.0.8.44862: Flags [P.], seq 715575413:715575417, ack 756126673, win 85, options [nop,nop,TS val 3791448555 ecr 1096154037], length 4
00:01:16.492021 IP 10.0.0.6.1883 > 10.0.0.8.44862: Flags [P.], seq 715575417:715575421, ack 756127068, win 85, options [nop,nop,TS val 3791449555 ecr 1096155037], length 4
00:01:16.492450 IP 10.0.0.6.1883 > 10.0.0.8.44862: Flags [P.], seq 715575421:715575425, ack 756127072, win 85, options [nop,nop,TS val 3791449556 ecr 1096155038], length 4
00:01:17.363046 IP 10.0.0.6.1883 > 10.0.0.8.44862: Flags [P.], seq 715575425:715575427, ack 756127074, win 85, options [nop,nop,TS val 3791450426 ecr 1096155908], length 2
00:01:17.493183 IP 10.0.0.6.1883 > 10.0.0.8.44862: Flags [P.], seq 715575427:715575431, ack 756127469, win 85, options [nop,nop,TS val 3791450557 ecr 1096156038], length 4
00:01:17.493661 IP 10.0.0.6.1883 > 10.0.0.8.44862: Flags [P.], seq 715575431:715575435, ack 756127473, win 85, options [nop,nop,TS val 3791450557 ecr 1096156039], length 4
00:01:18.493872 IP 10.0.0.6.1883 > 10.0.0.8.44862: Flags [P.], seq 715575435:715575439, ack 756127868, win 85, options [nop,nop,TS val 3791451557 ecr 1096157039], length 4
00:01:18.494489 IP 10.0.0.6.1883 > 10.0.0.8.44862: Flags [P.], seq 715575439:715575443, ack 756127872, win 85, options [nop,nop,TS val 3791451558 ecr 1096157039], length 4
00:01:19.494335 IP 10.0.0.6.1883 > 10.0.0.8.44862: Flags [P.], seq 715575443:715575447, ack 756128267, win 85, options [nop,nop,TS val 3791452558 ecr 1096158039], length 4
00:01:19.495002 IP 10.0.0.6.1883 > 10.0.0.8.44862: Flags [P.], seq 715575447:715575451, ack 756128271, win 85, options [nop,nop,TS val 3791452558 ecr 1096158040], length 4
00:01:20.495628 IP 10.0.0.6.1883 > 10.0.0.8.44862: Flags [P.], seq 715575451:715575455, ack 756128666, win 85, options [nop,nop,TS val 3791453559 ecr 1096159041], length 4
00:01:20.496269 IP 10.0.0.6.1883 > 10.0.0.8.44862: Flags [P.], seq 715575455:715575459, ack 756128670, win 85, options [nop,nop,TS val 3791453560 ecr 1096159041], length 4
00:01:21.497465 IP 10.0.0.6.1883 > 10.0.0.8.44862: Flags [P.], seq 715575459:715575463, ack 756129065, win 85, options [nop,nop,TS val 3791454561 ecr 1096160042], length 4
00:01:21.497806 IP 10.0.0.6.1883 > 10.0.0.8.44862: Flags [P.], seq 715575463:715575467, ack 756129069, win 85, options [nop,nop,TS val 3791454561 ecr 1096160043], length 4
00:01:22.364471 IP 10.0.0.6.1883 > 10.0.0.8.44862: Flags [P.], seq 715575467:715575469, ack 756129071, win 85, options [nop,nop,TS val 3791455428 ecr 1096160909], length 2
00:01:22.499614 IP 10.0.0.6.1883 > 10.0.0.8.44862: Flags [P.], seq 715575469:715575473, ack 756129466, win 85, options [nop,nop,TS val 3791455563 ecr 1096161044], length 4
00:01:22.500214 IP 10.0.0.6.1883 > 10.0.0.8.44862: Flags [P.], seq 715575473:715575477, ack 756129470, win 85, options [nop,nop,TS val 3791455564 ecr 1096161045], length 4
00:01:23.501695 IP 10.0.0.6.1883 > 10.0.0.8.44862: Flags [P.], seq 715575477:715575481, ack 756129865, win 85, options [nop,nop,TS val 3791456565 ecr 1096162046], length 4
00:01:23.502375 IP 10.0.0.6.1883 > 10.0.0.8.44862: Flags [P.], seq 715575481:715575485, ack 756129869, win 85, options [nop,nop,TS val 3791456566 ecr 1096162048], length 4
00:01:24.503392 IP 10.0.0.6.1883 > 10.0.0.8.44862: Flags [P.], seq 715575485:715575489, ack 756130264, win 85, options [nop,nop,TS val 3791457567 ecr 1096163048], length 4
00:01:24.504058 IP 10.0.0.6.1883 > 10.0.0.8.44862: Flags [P.], seq 715575489:715575493, ack 756130268, win 85, options [nop,nop,TS val 3791457567 ecr 1096163049], length 4
00:01:25.506187 IP 10.0.0.6.1883 > 10.0.0.8.44862: Flags [P.], seq 715575493:715575497, ack 756130663, win 85, options [nop,nop,TS val 3791458570 ecr 1096164049], length 4
00:01:25.507042 IP 10.0.0.6.1883 > 10.0.0.8.44862: Flags [P.], seq 715575497:715575501, ack 756130667, win 85, options [nop,nop,TS val 3791458570 ecr 1096164052], length 4
00:01:26.506332 IP 10.0.0.6.1883 > 10.0.0.8.44862: Flags [P.], seq 715575501:715575505, ack 756131062, win 85, options [nop,nop,TS val 3791459570 ecr 1096165050], length 4
00:01:26.507291 IP 10.0.0.6.1883 > 10.0.0.8.44862: Flags [P.], seq 715575505:715575509, ack 756131066, win 85, options [nop,nop,TS val 3791459571 ecr 1096165052], length 4
00:01:27.370119 IP 10.0.0.6.1883 > 10.0.0.8.44862: Flags [P.], seq 715575509:715575511, ack 756131068, win 85, options [nop,nop,TS val 3791460434 ecr 1096165914], length 2
00:01:27.507216 IP 10.0.0.6.1883 > 10.0.0.8.44862: Flags [P.], seq 715575511:715575515, ack 756131463, win 85, options [nop,nop,TS val 3791460571 ecr 1096166052], length 4
00:01:27.507532 IP 10.0.0.6.1883 > 10.0.0.8.44862: Flags [P.], seq 715575515:715575519, ack 756131467, win 85, options [nop,nop,TS val 3791460571 ecr 1096166053], length 4
00:01:28.508317 IP 10.0.0.6.1883 > 10.0.0.8.44862: Flags [P.], seq 715575519:715575523, ack 756131862, win 85, options [nop,nop,TS val 3791461572 ecr 1096167053], length 4
00:01:28.508876 IP 10.0.0.6.1883 > 10.0.0.8.44862: Flags [P.], seq 715575523:715575527, ack 756131866, win 85, options [nop,nop,TS val 3791461572 ecr 1096167054], length 4
00:01:29.508919 IP 10.0.0.6.1883 > 10.0.0.8.44862: Flags [P.], seq 715575527:715575531, ack 756132261, win 85, options [nop,nop,TS val 3791462572 ecr 1096168054], length 4
00:01:29.509243 IP 10.0.0.6.1883 > 10.0.0.8.44862: Flags [P.], seq 715575531:715575535, ack 756132265, win 85, options [nop,nop,TS val 3791462573 ecr 1096168055], length 4
00:01:30.509615 IP 10.0.0.6.1883 > 10.0.0.8.44862: Flags [P.], seq 715575535:715575539, ack 756132660, win 85, options [nop,nop,TS val 3791463573 ecr 1096169055], length 4
00:01:30.509936 IP 10.0.0.6.1883 > 10.0.0.8.44862: Flags [P.], seq 715575539:715575543, ack 756132664, win 85, options [nop,nop,TS val 3791463573 ecr 1096169055], length 4
00:01:31.511826 IP 10.0.0.6.1883 > 10.0.0.8.44862: Flags [P.], seq 715575543:715575547, ack 756133059, win 85, options [nop,nop,TS val 3791464575 ecr 1096170056], length 4
00:01:31.512603 IP 10.0.0.6.1883 > 10.0.0.8.44862: Flags [P.], seq 715575547:715575551, ack 756133063, win 85, options [nop,nop,TS val 3791464576 ecr 1096170058], length 4
00:01:32.370617 IP 10.0.0.6.1883 > 10.0.0.8.44862: Flags [P.], seq 715575551:715575553, ack 756133065, win 85, options [nop,nop,TS val 3791465434 ecr 1096170915], length 2
00:01:32.513741 IP 10.0.0.6.1883 > 10.0.0.8.44862: Flags [P.], seq 715575553:715575557, ack 756133460, win 85, options [nop,nop,TS val 3791465577 ecr 1096171058], length 4
00:01:32.514514 IP 10.0.0.6.1883 > 10.0.0.8.44862: Flags [P.], seq 715575557:715575561, ack 756133464, win 85, options [nop,nop,TS val 3791465578 ecr 1096171060], length 4
00:01:33.515068 IP 10.0.0.6.1883 > 10.0.0.8.44862: Flags [P.], seq 715575561:715575565, ack 756133859, win 85, options [nop,nop,TS val 3791466578 ecr 1096172060], length 4
00:01:33.516796 IP 10.0.0.6.1883 > 10.0.0.8.44862: Flags [P.], seq 715575565:715575569, ack 756133863, win 85, options [nop,nop,TS val 3791466580 ecr 1096172061], length 4
00:01:34.516385 IP 10.0.0.6.1883 > 10.0.0.8.44862: Flags [P.], seq 715575569:715575573, ack 756134258, win 85, options [nop,nop,TS val 3791467580 ecr 1096173061], length 4
00:01:34.516961 IP 10.0.0.6.1883 > 10.0.0.8.44862: Flags [P.], seq 715575573:715575577, ack 756134262, win 85, options [nop,nop,TS val 3791467580 ecr 1096173062], length 4
00:01:35.517927 IP 10.0.0.6.1883 > 10.0.0.8.44862: Flags [P.], seq 715575577:715575581, ack 756134657, win 85, options [nop,nop,TS val 3791468581 ecr 1096174063], length 4
00:01:35.518567 IP 10.0.0.6.1883 > 10.0.0.8.44862: Flags [P.], seq 715575581:715575585, ack 756134661, win 85, options [nop,nop,TS val 3791468582 ecr 1096174064], length 4
00:01:36.519005 IP 10.0.0.6.1883 > 10.0.0.8.44862: Flags [P.], seq 715575585:715575589, ack 756135056, win 85, options [nop,nop,TS val 3791469582 ecr 1096175064], length 4
00:01:36.519420 IP 10.0.0.6.1883 > 10.0.0.8.44862: Flags [P.], seq 715575589:715575593, ack 756135060, win 85, options [nop,nop,TS val 3791469583 ecr 1096175065], length 4
00:01:37.372170 IP 10.0.0.6.1883 > 10.0.0.8.44862: Flags [P.], seq 715575593:715575595, ack 756135062, win 85, options [nop,nop,TS val 3791470436 ecr 1096175917], length 2
00:01:37.520169 IP 10.0.0.6.1883 > 10.0.0.8.44862: Flags [P.], seq 715575595:715575599, ack 756135457, win 85, options [nop,nop,TS val 3791470584 ecr 1096176065], length 4
00:01:37.520616 IP 10.0.0.6.1883 > 10.0.0.8.44862: Flags [P.], seq 715575599:715575603, ack 756135461, win 85, options [nop,nop,TS val 3791470584 ecr 1096176066], length 4
00:01:38.521296 IP 10.0.0.6.1883 > 10.0.0.8.44862: Flags [P.], seq 715575603:715575607, ack 756135856, win 85, options [nop,nop,TS val 3791471585 ecr 1096177066], length 4
00:01:38.521675 IP 10.0.0.6.1883 > 10.0.0.8.44862: Flags [P.], seq 715575607:715575611, ack 756135860, win 85, options [nop,nop,TS val 3791471585 ecr 1096177067], length 4
00:01:39.523015 IP 10.0.0.6.1883 > 10.0.0.8.44862: Flags [P.], seq 715575611:715575615, ack 756136255, win 85, options [nop,nop,TS val 3791472586 ecr 1096178068], length 4
00:01:39.523490 IP 10.0.0.6.1883 > 10.0.0.8.44862: Flags [P.], seq 715575615:715575619, ack 756136259, win 85, options [nop,nop,TS val 3791472587 ecr 1096178069], length 4
00:01:40.523483 IP 10.0.0.6.1883 > 10.0.0.8.44862: Flags [P.], seq 715575619:715575623, ack 756136654, win 85, options [nop,nop,TS val 3791473587 ecr 1096179069], length 4
00:01:40.523825 IP 10.0.0.6.1883 > 10.0.0.8.44862: Flags [P.], seq 715575623:715575627, ack 756136658, win 85, options [nop,nop,TS val 3791473587 ecr 1096179069], length 4
00:01:41.524947 IP 10.0.0.6.1883 > 10.0.0.8.44862: Flags [P.], seq 715575627:715575631, ack 756137053, win 85, options [nop,nop,TS val 3791474588 ecr 1096180070], length 4
00:01:41.525532 IP 10.0.0.6.1883 > 10.0.0.8.44862: Flags [P.], seq 715575631:715575635, ack 756137057, win 85, options [nop,nop,TS val 3791474589 ecr 1096180071], length 4
00:01:42.374736 IP 10.0.0.6.1883 > 10.0.0.8.44862: Flags [P.], seq 715575635:715575637, ack 756137059, win 85, options [nop,nop,TS val 3791475438 ecr 1096180920], length 2
00:01:42.526775 IP 10.0.0.6.1883 > 10.0.0.8.44862: Flags [P.], seq 715575637:715575641, ack 756137454, win 85, options [nop,nop,TS val 3791475590 ecr 1096181071], length 4
00:01:42.527332 IP 10.0.0.6.1883 > 10.0.0.8.44862: Flags [P.], seq 715575641:715575645, ack 756137458, win 85, options [nop,nop,TS val 3791475591 ecr 1096181073], length 4
00:01:43.528553 IP 10.0.0.6.1883 > 10.0.0.8.44862: Flags [P.], seq 715575645:715575649, ack 756137853, win 85, options [nop,nop,TS val 3791476592 ecr 1096182073], length 4
00:01:43.529836 IP 10.0.0.6.1883 > 10.0.0.8.44862: Flags [P.], seq 715575649:715575653, ack 756137857, win 85, options [nop,nop,TS val 3791476593 ecr 1096182074], length 4
00:01:44.529109 IP 10.0.0.6.1883 > 10.0.0.8.44862: Flags [P.], seq 715575653:715575657, ack 756138252, win 85, options [nop,nop,TS val 3791477592 ecr 1096183074], length 4
00:01:44.529487 IP 10.0.0.6.1883 > 10.0.0.8.44862: Flags [P.], seq 715575657:715575661, ack 756138256, win 85, options [nop,nop,TS val 3791477593 ecr 1096183075], length 4
00:01:45.530449 IP 10.0.0.6.1883 > 10.0.0.8.44862: Flags [P.], seq 715575661:715575665, ack 756138651, win 85, options [nop,nop,TS val 3791478594 ecr 1096184075], length 4
00:01:45.531212 IP 10.0.0.6.1883 > 10.0.0.8.44862: Flags [P.], seq 715575665:715575669, ack 756138655, win 85, options [nop,nop,TS val 3791478595 ecr 1096184076], length 4
00:01:46.531252 IP 10.0.0.6.1883 > 10.0.0.8.44862: Flags [P.], seq 715575669:715575673, ack 756139050, win 85, options [nop,nop,TS val 3791479595 ecr 1096185076], length 4
00:01:46.531937 IP 10.0.0.6.1883 > 10.0.0.8.44862: Flags [P.], seq 715575673:715575677, ack 756139054, win 85, options [nop,nop,TS val 3791479595 ecr 1096185077], length 4
00:01:47.377335 IP 10.0.0.6.1883 > 10.0.0.8.44862: Flags [P.], seq 715575677:715575679, ack 756139056, win 85, options [nop,nop,TS val 3791480441 ecr 1096185921], length 2
00:01:47.532985 IP 10.0.0.6.1883 > 10.0.0.8.44862: Flags [P.], seq 715575679:715575683, ack 756139451, win 85, options [nop,nop,TS val 3791480596 ecr 1096186077], length 4
00:01:47.533728 IP 10.0.0.6.1883 > 10.0.0.8.44862: Flags [P.], seq 715575683:715575687, ack 756139455, win 85, options [nop,nop,TS val 3791480597 ecr 1096186079], length 4
00:01:48.534544 IP 10.0.0.6.1883 > 10.0.0.8.44862: Flags [P.], seq 715575687:715575691, ack 756139850, win 85, options [nop,nop,TS val 3791481598 ecr 1096187079], length 4
00:01:48.536160 IP 10.0.0.6.1883 > 10.0.0.8.44862: Flags [P.], seq 715575691:715575695, ack 756139854, win 85, options [nop,nop,TS val 3791481600 ecr 1096187081], length 4
00:01:49.536759 IP 10.0.0.6.1883 > 10.0.0.8.44862: Flags [P.], seq 715575695:715575699, ack 756140249, win 85, options [nop,nop,TS val 3791482600 ecr 1096188080], length 4
00:01:49.537577 IP 10.0.0.6.1883 > 10.0.0.8.44862: Flags [P.], seq 715575699:715575703, ack 756140253, win 85, options [nop,nop,TS val 3791482601 ecr 1096188083], length 4
00:01:50.538454 IP 10.0.0.6.1883 > 10.0.0.8.44862: Flags [P.], seq 715575703:715575707, ack 756140648, win 85, options [nop,nop,TS val 3791483602 ecr 1096189082], length 4
00:01:50.539922 IP 10.0.0.6.1883 > 10.0.0.8.44862: Flags [P.], seq 715575707:715575711, ack 756140652, win 85, options [nop,nop,TS val 3791483603 ecr 1096189085], length 4
00:01:51.539788 IP 10.0.0.6.1883 > 10.0.0.8.44862: Flags [P.], seq 715575711:715575715, ack 756141047, win 85, options [nop,nop,TS val 3791484603 ecr 1096190084], length 4
00:01:51.541164 IP 10.0.0.6.1883 > 10.0.0.8.44862: Flags [P.], seq 715575715:715575719, ack 756141051, win 85, options [nop,nop,TS val 3791484605 ecr 1096190086], length 4
00:01:52.378660 IP 10.0.0.6.1883 > 10.0.0.8.44862: Flags [P.], seq 715575719:715575721, ack 756141053, win 85, options [nop,nop,TS val 3791485442 ecr 1096190924], length 2
00:01:52.540171 IP 10.0.0.6.1883 > 10.0.0.8.44862: Flags [P.], seq 715575721:715575725, ack 756141448, win 85, options [nop,nop,TS val 3791485604 ecr 1096191085], length 4
00:01:52.540791 IP 10.0.0.6.1883 > 10.0.0.8.44862: Flags [P.], seq 715575725:715575729, ack 756141452, win 85, options [nop,nop,TS val 3791485604 ecr 1096191086], length 4
00:01:55.123591 IP 10.0.0.6.1883 > 10.0.0.8.44862: Flags [F.], seq 715575729, ack 756141453, win 85, options [nop,nop,TS val 3791488187 ecr 1096193668], length 0