00:00:11.977510 IP 10.0.0.6.1883 > 10.0.0.8.44720: Flags [S.], seq 3368043293, ack 3038682130, win 43440, options [mss 1460,sackOK,TS val 3790539902 ecr 1095245317,nop,wscale 9], length 0
00:00:11.985284 IP 10.0.0.6.1883 > 10.0.0.8.44720: Flags [.], ack 3038682150, win 85, options [nop,nop,TS val 3790539910 ecr 1095245392], length 0
00:00:11.985768 IP 10.0.0.6.1883 > 10.0.0.8.44720: Flags [P.], seq 3368043294:3368043298, ack 3038682150, win 85, options [nop,nop,TS val 3790539910 ecr 1095245392], length 4
00:00:11.987514 IP 10.0.0.6.1883 > 10.0.0.8.44720: Flags [P.], seq 3368043298:3368043363, ack 3038682214, win 85, options [nop,nop,TS val 3790539912 ecr 1095245393], length 65
00:00:11.987980 IP 10.0.0.6.1883 > 10.0.0.8.44720: Flags [P.], seq 3368043363:3368043368, ack 3038682609, win 85, options [nop,nop,TS val 3790539913 ecr 1095245395], length 5
00:00:12.029753 IP 10.0.0.6.1883 > 10.0.0.8.44720: Flags [P.], seq 3368043368:3368043372, ack 3038682609, win 85, options [nop,nop,TS val 3790539955 ecr 1095245436], length 4
00:00:12.033174 IP 10.0.0.6.1883 > 10.0.0.8.44720: Flags [P.], seq 3368043372:3368043376, ack 3038682613, win 85, options [nop,nop,TS val 3790539957 ecr 1095245437], length 4
00:00:13.153111 IP 10.0.0.6.1883 > 10.0.0.8.44720: Flags [P.], seq 3368043376:3368043380, ack 3038683008, win 85, options [nop,nop,TS val 3790541077 ecr 1095246557], length 4
00:00:13.154298 IP 10.0.0.6.1883 > 10.0.0.8.44720: Flags [P.], seq 3368043380:3368043384, ack 3038683012, win 85, options [nop,nop,TS val 3790541079 ecr 1095246560], length 4
00:00:14.157439 IP 10.0.0.6.1883 > 10.0.0.8.44720: Flags [P.], seq 3368043384:3368043388, ack 3038683407, win 85, options [nop,nop,TS val 3790542081 ecr 1095247560], length 4
00:00:14.158426 IP 10.0.0.6.1883 > 10.0.0.8.44720: Flags [P.], seq 3368043388:3368043392, ack 3038683411, win 85, options [nop,nop,TS val 3790542082 ecr 1095247564], length 4
00:00:15.157895 IP 10.0.0.6.1883 > 10.0.0.8.44720: Flags [P.], seq 3368043392:3368043396, ack 3038683806, win 85, options [nop,nop,TS val 3790543081 ecr 1095248562], length 4
00:00:15.160444 IP 10.0.0.6.1883 > 10.0.0.8.44720: Flags [P.], seq 3368043396:3368043400, ack 3038683810, win 85, options [nop,nop,TS val 3790543083 ecr 1095248564], length 4
00:00:16.161161 IP 10.0.0.6.1883 > 10.0.0.8.44720: Flags [P.], seq 3368043400:3368043404, ack 3038684205, win 85, options [nop,nop,TS val 3790544084 ecr 1095249564], length 4
00:00:16.165570 IP 10.0.0.6.1883 > 10.0.0.8.44720: Flags [P.], seq 3368043404:3368043408, ack 3038684209, win 85, options [nop,nop,TS val 3790544088 ecr 1095249567], length 4
00:00:16.989700 IP 10.0.0.6.1883 > 10.0.0.8.44720: Flags [P.], seq 3368043408:3368043410, ack 3038684211, win 85, options [nop,nop,TS val 3790544912 ecr 1095250392], length 2
00:00:17.161740 IP 10.0.0.6.1883 > 10.0.0.8.44720: Flags [P.], seq 3368043410:3368043414, ack 3038684606, win 85, options [nop,nop,TS val 3790545084 ecr 1095250564], length 4
00:00:17.164205 IP 10.0.0.6.1883 > 10.0.0.8.44720: Flags [P.], seq 3368043414:3368043418, ack 3038684610, win 85, options [nop,nop,TS val 3790545086 ecr 1095250567], length 4
00:00:18.162651 IP 10.0.0.6.1883 > 10.0.0.8.44720: Flags [P.], seq 3368043418:3368043422, ack 3038685005, win 85, options [nop,nop,TS val 3790546084 ecr 1095251565], length 4
00:00:18.164183 IP 10.0.0.6.1883 > 10.0.0.8.44720: Flags [P.], seq 3368043422:3368043426, ack 3038685009, win 85, options [nop,nop,TS val 3790546086 ecr 1095251567], length 4
00:00:19.164177 IP 10.0.0.6.1883 > 10.0.0.8.44720: Flags [P.], seq 3368043426:3368043430, ack 3038685404, win 85, options [nop,nop,TS val 3790547085 ecr 1095252567], length 4
00:00:19.165792 IP 10.0.0.6.1883 > 10.0.0.8.44720: Flags [P.], seq 3368043430:3368043434, ack 3038685408, win 85, options [nop,nop,TS val 3790547087 ecr 1095252568], length 4
00:00:20.165165 IP 10.0.0.6.1883 > 10.0.0.8.44720: Flags [P.], seq 3368043434:3368043438, ack 3038685803, win 85, options [nop,nop,TS val 3790548086 ecr 1095253567], length 4
00:00:20.166547 IP 10.0.0.6.1883 > 10.0.0.8.44720: Flags [P.], seq 3368043438:3368043442, ack 3038685807, win 85, options [nop,nop,TS val 3790548087 ecr 1095253569], length 4
00:00:21.166305 IP 10.0.0.6.1883 > 10.0.0.8.44720: Flags [P.], seq 3368043442:3368043446, ack 3038686202, win 85, options [nop,nop,TS val 3790549087 ecr 1095254568], length 4
00:00:21.167582 IP 10.0.0.6.1883 > 10.0.0.8.44720: Flags [P.], seq 3368043446:3368043450, ack 3038686206, win 85, options [nop,nop,TS val 3790549088 ecr 1095254569], length 4
00:00:21.989432 IP 10.0.0.6.1883 > 10.0.0.8.44720: Flags [P.], seq 3368043450:3368043452, ack 3038686208, win 85, options [nop,nop,TS val 3790549909 ecr 1095255390], length 2
00:00:22.167069 IP 10.0.0.6.1883 > 10.0.0.8.44720: Flags [P.], seq 3368043452:3368043456, ack 3038686603, win 85, options [nop,nop,TS val 3790550087 ecr 1095255568], length 4
00:00:22.168498 IP 10.0.0.6.1883 > 10.0.0.8.44720: Flags [P.], seq 3368043456:3368043460, ack 3038686607, win 85, options [nop,nop,TS val 3790550088 ecr 1095255570], length 4
00:00:23.167806 IP 10.0.0.6.1883 > 10.0.0.8.44720: Flags [P.], seq 3368043460:3368043464, ack 3038687002, win 85, options [nop,nop,TS val 3790551087 ecr 1095256568], length 4
00:00:23.169568 IP 10.0.0.6.1883 > 10.0.0.8.44720: Flags [P.], seq 3368043464:3368043468, ack 3038687006, win 85, options [nop,nop,TS val 3790551089 ecr 1095256570], length 4
00:00:24.168975 IP 10.0.0.6.1883 > 10.0.0.8.44720: Flags [P.], seq 3368043468:3368043472, ack 3038687401, win 85, options [nop,nop,TS val 3790552088 ecr 1095257569], length 4
00:00:24.170704 IP 10.0.0.6.1883 > 10.0.0.8.44720: Flags [P.], seq 3368043472:3368043476, ack 3038687405, win 85, options [nop,nop,TS val 3790552089 ecr 1095257570], length 4
00:00:25.170035 IP 10.0.0.6.1883 > 10.0.0.8.44720: Flags [P.], seq 3368043476:3368043480, ack 3038687800, win 85, options [nop,nop,TS val 3790553088 ecr 1095258569], length 4
00:00:25.172084 IP 10.0.0.6.1883 > 10.0.0.8.44720: Flags [P.], seq 3368043480:3368043484, ack 3038687804, win 85, options [nop,nop,TS val 3790553090 ecr 1095258571], length 4
00:00:26.171172 IP 10.0.0.6.1883 > 10.0.0.8.44720: Flags [P.], seq 3368043484:3368043488, ack 3038688199, win 85, options [nop,nop,TS val 3790554089 ecr 1095259570], length 4
00:00:26.173260 IP 10.0.0.6.1883 > 10.0.0.8.44720: Flags [P.], seq 3368043488:3368043492, ack 3038688203, win 85, options [nop,nop,TS val 3790554091 ecr 1095259572], length 4
00:00:26.991763 IP 10.0.0.6.1883 > 10.0.0.8.44720: Flags [P.], seq 3368043492:3368043494, ack 3038688205, win 85, options [nop,nop,TS val 3790554909 ecr 1095260390], length 2
00:00:27.173573 IP 10.0.0.6.1883 > 10.0.0.8.44720: Flags [P.], seq 3368043494:3368043498, ack 3038688600, win 85, options [nop,nop,TS val 3790555091 ecr 1095260572], length 4
00:00:27.175399 IP 10.0.0.6.1883 > 10.0.0.8.44720: Flags [P.], seq 3368043498:3368043502, ack 3038688604, win 85, options [nop,nop,TS val 3790555093 ecr 1095260574], length 4
00:00:28.174827 IP 10.0.0.6.1883 > 10.0.0.8.44720: Flags [P.], seq 3368043502:3368043506, ack 3038688999, win 85, options [nop,nop,TS val 3790556092 ecr 1095261573], length 4
00:00:28.176686 IP 10.0.0.6.1883 > 10.0.0.8.44720: Flags [P.], seq 3368043506:3368043510, ack 3038689003, win 85, options [nop,nop,TS val 3790556093 ecr 1095261574], length 4
00:00:29.178992 IP 10.0.0.6.1883 > 10.0.0.8.44720: Flags [P.], seq 3368043510:3368043514, ack 3038689398, win 85, options [nop,nop,TS val 3790557095 ecr 1095262576], length 4
00:00:29.180995 IP 10.0.0.6.1883 > 10.0.0.8.44720: Flags [P.], seq 3368043514:3368043518, ack 3038689402, win 85, options [nop,nop,TS val 3790557097 ecr 1095262578], length 4
00:00:30.180325 IP 10.0.0.6.1883 > 10.0.0.8.44720: Flags [P.], seq 3368043518:3368043522, ack 3038689797, win 85, options [nop,nop,TS val 3790558096 ecr 1095263577], length 4
00:00:30.182260 IP 10.0.0.6.1883 > 10.0.0.8.44720: Flags [P.], seq 3368043522:3368043526, ack 3038689801, win 85, options [nop,nop,TS val 3790558098 ecr 1095263578], length 4
00:00:31.182913 IP 10.0.0.6.1883 > 10.0.0.8.44720: Flags [P.], seq 3368043526:3368043530, ack 3038690196, win 85, options [nop,nop,TS val 3790559098 ecr 1095264579], length 4
00:00:31.183629 IP 10.0.0.6.1883 > 10.0.0.8.44720: Flags [P.], seq 3368043530:3368043534, ack 3038690200, win 85, options [nop,nop,TS val 3790559099 ecr 1095264581], length 4
00:00:31.992872 IP 10.0.0.6.1883 > 10.0.0.8.44720: Flags [P.], seq 3368043534:3368043536, ack 3038690202, win 85, options [nop,nop,TS val 3790559908 ecr 1095265389], length 2
00:00:32.185001 IP 10.0.0.6.1883 > 10.0.0.8.44720: Flags [P.], seq 3368043536:3368043540, ack 3038690597, win 85, options [nop,nop,TS val 3790560100 ecr 1095265581], length 4
00:00:32.186776 IP 10.0.0.6.1883 > 10.0.0.8.44720: Flags [P.], seq 3368043540:3368043544, ack 3038690601, win 85, options [nop,nop,TS val 3790560101 ecr 1095265583], length 4
00:00:33.185534 IP 10.0.0.6.1883 > 10.0.0.8.44720: Flags [P.], seq 3368043544:3368043548, ack 3038690996, win 85, options [nop,nop,TS val 3790561100 ecr 1095266581], length 4
00:00:33.186270 IP 10.0.0.6.1883 > 10.0.0.8.44720: Flags [P.], seq 3368043548:3368043552, ack 3038691000, win 85, options [nop,nop,TS val 3790561101 ecr 1095266582], length 4
00:00:34.187513 IP 10.0.0.6.1883 > 10.0.0.8.44720: Flags [P.], seq 3368043552:3368043556, ack 3038691395, win 85, options [nop,nop,TS val 3790562101 ecr 1095267582], length 4
00:00:34.189398 IP 10.0.0.6.1883 > 10.0.0.8.44720: Flags [P.], seq 3368043556:3368043560, ack 3038691399, win 85, options [nop,nop,TS val 3790562103 ecr 1095267584], length 4
00:00:35.189748 IP 10.0.0.6.1883 > 10.0.0.8.44720: Flags [P.], seq 3368043560:3368043564, ack 3038691794, win 85, options [nop,nop,TS val 3790563103 ecr 1095268584], length 4
00:00:35.191362 IP 10.0.0.6.1883 > 10.0.0.8.44720: Flags [P.], seq 3368043564:3368043568, ack 3038691798, win 85, options [nop,nop,TS val 3790563105 ecr 1095268586], length 4
00:00:36.190978 IP 10.0.0.6.1883 > 10.0.0.8.44720: Flags [P.], seq 3368043568:3368043572, ack 3038692193, win 85, options [nop,nop,TS val 3790564104 ecr 1095269585], length 4
00:00:36.192700 IP 10.0.0.6.1883 > 10.0.0.8.44720: Flags [P.], seq 3368043572:3368043576, ack 3038692197, win 85, options [nop,nop,TS val 3790564105 ecr 1095269586], length 4
00:00:36.994179 IP 10.0.0.6.1883 > 10.0.0.8.44720: Flags [P.], seq 3368043576:3368043578, ack 3038692199, win 85, options [nop,nop,TS val 3790564907 ecr 1095270388], length 2
00:00:37.192139 IP 10.0.0.6.1883 > 10.0.0.8.44720: Flags [P.], seq 3368043578:3368043582, ack 3038692594, win 85, options [nop,nop,TS val 3790565104 ecr 1095270586], length 4
00:00:37.197226 IP 10.0.0.6.1883 > 10.0.0.8.44720: Flags [P.], seq 3368043582:3368043586, ack 3038692598, win 85, options [nop,nop,TS val 3790565109 ecr 1095270588], length 4
00:00:38.193454 IP 10.0.0.6.1883 > 10.0.0.8.44720: Flags [P.], seq 3368043586:3368043590, ack 3038692993, win 85, options [nop,nop,TS val 3790566105 ecr 1095271586], length 4
00:00:38.194977 IP 10.0.0.6.1883 > 10.0.0.8.44720: Flags [P.], seq 3368043590:3368043594, ack 3038692997, win 85, options [nop,nop,TS val 3790566107 ecr 1095271588], length 4
00:00:39.194918 IP 10.0.0.6.1883 > 10.0.0.8.44720: Flags [P.], seq 3368043594:3368043598, ack 3038693392, win 85, options [nop,nop,TS val 3790567106 ecr 1095272587], length 4
00:00:39.196494 IP 10.0.0.6.1883 > 10.0.0.8.44720: Flags [P.], seq 3368043598:3368043602, ack 3038693396, win 85, options [nop,nop,TS val 3790567108 ecr 1095272589], length 4
00:00:40.196973 IP 10.0.0.6.1883 > 10.0.0.8.44720: Flags [P.], seq 3368043602:3368043606, ack 3038693791, win 85, options [nop,nop,TS val 3790568108 ecr 1095273588], length 4
00:00:40.198723 IP 10.0.0.6.1883 > 10.0.0.8.44720: Flags [P.], seq 3368043606:3368043610, ack 3038693795, win 85, options [nop,nop,TS val 3790568109 ecr 1095273590], length 4
00:00:41.197435 IP 10.0.0.6.1883 > 10.0.0.8.44720: Flags [P.], seq 3368043610:3368043614, ack 3038694190, win 85, options [nop,nop,TS val 3790569108 ecr 1095274589], length 4
00:00:41.199931 IP 10.0.0.6.1883 > 10.0.0.8.44720: Flags [P.], seq 3368043614:3368043618, ack 3038694194, win 85, options [nop,nop,TS val 3790569110 ecr 1095274591], length 4
00:00:41.996789 IP 10.0.0.6.1883 > 10.0.0.8.44720: Flags [P.], seq 3368043618:3368043620, ack 3038694196, win 85, options [nop,nop,TS val 3790569907 ecr 1095275387], length 2
00:00:42.199398 IP 10.0.0.6.1883 > 10.0.0.8.44720: Flags [P.], seq 3368043620:3368043624, ack 3038694591, win 85, options [nop,nop,TS val 3790570109 ecr 1095275590], length 4
00:00:42.201048 IP 10.0.0.6.1883 > 10.0.0.8.44720: Flags [P.], seq 3368043624:3368043628, ack 3038694595, win 85, options [nop,nop,TS val 3790570110 ecr 1095275592], length 4
00:00:43.201107 IP 10.0.0.6.1883 > 10.0.0.8.44720: Flags [P.], seq 3368043628:3368043632, ack 3038694990, win 85, options [nop,nop,TS val 3790571110 ecr 1095276590], length 4
00:00:43.202998 IP 10.0.0.6.1883 > 10.0.0.8.44720: Flags [P.], seq 3368043632:3368043636, ack 3038694994, win 85, options [nop,nop,TS val 3790571112 ecr 1095276593], length 4
00:00:44.204656 IP 10.0.0.6.1883 > 10.0.0.8.44720: Flags [P.], seq 3368043636:3368043640, ack 3038695389, win 85, options [nop,nop,TS val 3790572113 ecr 1095277594], length 4
00:00:44.207545 IP 10.0.0.6.1883 > 10.0.0.8.44720: Flags [P.], seq 3368043640:3368043644, ack 3038695393, win 85, options [nop,nop,TS val 3790572116 ecr 1095277596], length 4
00:00:45.204614 IP 10.0.0.6.1883 > 10.0.0.8.44720: Flags [P.], seq 3368043644:3368043648, ack 3038695788, win 85, options [nop,nop,TS val 3790573113 ecr 1095278594], length 4
00:00:45.205767 IP 10.0.0.6.1883 > 10.0.0.8.44720: Flags [P.], seq 3368043648:3368043652, ack 3038695792, win 85, options [nop,nop,TS val 3790573114 ecr 1095278596], length 4
00:00:46.205173 IP 10.0.0.6.1883 > 10.0.0.8.44720: Flags [P.], seq 3368043652:3368043656, ack 3038696187, win 85, options [nop,nop,TS val 3790574113 ecr 1095279595], length 4
00:00:46.205623 IP 10.0.0.6.1883 > 10.0.0.8.44720: Flags [P.], seq 3368043656:3368043660, ack 3038696191, win 85, options [nop,nop,TS val 3790574113 ecr 1095279595], length 4
00:00:46.998020 IP 10.0.0.6.1883 > 10.0.0.8.44720: Flags [P.], seq 3368043660:3368043662, ack 3038696193, win 85, options [nop,nop,TS val 3790574905 ecr 1095280387], length 2
00:00:47.206826 IP 10.0.0.6.1883 > 10.0.0.8.44720: Flags [P.], seq 3368043662:3368043666, ack 3038696588, win 85, options [nop,nop,TS val 3790575114 ecr 1095280595], length 4
00:00:47.208903 IP 10.0.0.6.1883 > 10.0.0.8.44720: Flags [P.], seq 3368043666:3368043670, ack 3038696592, win 85, options [nop,nop,TS val 3790575116 ecr 1095280596], length 4
00:00:48.207787 IP 10.0.0.6.1883 > 10.0.0.8.44720: Flags [P.], seq 3368043670:3368043674, ack 3038696987, win 85, options [nop,nop,TS val 3790576114 ecr 1095281596], length 4
00:00:48.209641 IP 10.0.0.6.1883 > 10.0.0.8.44720: Flags [P.], seq 3368043674:3368043678, ack 3038696991, win 85, options [nop,nop,TS val 3790576116 ecr 1095281597], length 4
00:00:49.208987 IP 10.0.0.6.1883 > 10.0.0.8.44720: Flags [P.], seq 3368043678:3368043682, ack 3038697386, win 85, options [nop,nop,TS val 3790577115 ecr 1095282596], length 4
00:00:49.210667 IP 10.0.0.6.1883 > 10.0.0.8.44720: Flags [P.], seq 3368043682:3368043686, ack 3038697390, win 85, options [nop,nop,TS val 3790577117 ecr 1095282598], length 4
00:00:50.211035 IP 10.0.0.6.1883 > 10.0.0.8.44720: Flags [P.], seq 3368043686:3368043690, ack 3038697785, win 85, options [nop,nop,TS val 3790578117 ecr 1095283597], length 4
00:00:50.212576 IP 10.0.0.6.1883 > 10.0.0.8.44720: Flags [P.], seq 3368043690:3368043694, ack 3038697789, win 85, options [nop,nop,TS val 3790578118 ecr 1095283599], length 4
00:00:51.213067 IP 10.0.0.6.1883 > 10.0.0.8.44720: Flags [P.], seq 3368043694:3368043698, ack 3038698184, win 85, options [nop,nop,TS val 3790579117 ecr 1095284597], length 4
00:00:51.249257 IP 10.0.0.6.1883 > 10.0.0.8.44720: Flags [P.], seq 3368043698:3368043702, ack 3038698188, win 85, options [nop,nop,TS val 3790579151 ecr 1095284630], length 4
00:00:51.710251 IP 10.0.0.6.1883 > 10.0.0.8.44720: Flags [P.], seq 3368043698:3368043702, ack 3038698188, win 85, options [nop,nop,TS val 3790579615 ecr 1095284630], length 4
00:00:52.031178 IP 10.0.0.6.1883 > 10.0.0.8.44720: Flags [P.], seq 3368043702:3368043704, ack 3038698190, win 85, options [nop,nop,TS val 3790579935 ecr 1095285417], length 2
00:00:52.213444 IP 10.0.0.6.1883 > 10.0.0.8.44720: Flags [P.], seq 3368043704:3368043708, ack 3038698585, win 85, options [nop,nop,TS val 3790580118 ecr 1095285598], length 4
00:00:52.215334 IP 10.0.0.6.1883 > 10.0.0.8.44720: Flags [P.], seq 3368043708:3368043712, ack 3038698589, win 85, options [nop,nop,TS val 3790580120 ecr 1095285601], length 4
00:00:53.213892 IP 10.0.0.6.1883 > 10.0.0.8.44720: Flags [P.], seq 3368043712:3368043716, ack 3038698984, win 85, options [nop,nop,TS val 3790581118 ecr 1095286599], length 4
00:00:53.215597 IP 10.0.0.6.1883 > 10.0.0.8.44720: Flags [P.], seq 3368043716:3368043720, ack 3038698988, win 85, options [nop,nop,TS val 3790581120 ecr 1095286601], length 4
00:00:54.218400 IP 10.0.0.6.1883 > 10.0.0.8.44720: Flags [P.], seq 3368043720:3368043724, ack 3038699383, win 85, options [nop,nop,TS val 3790582122 ecr 1095287603], length 4
00:00:54.220394 IP 10.0.0.6.1883 > 10.0.0.8.44720: Flags [P.], seq 3368043724:3368043728, ack 3038699387, win 85, options [nop,nop,TS val 3790582124 ecr 1095287605], length 4
00:00:55.218887 IP 10.0.0.6.1883 > 10.0.0.8.44720: Flags [P.], seq 3368043728:3368043732, ack 3038699782, win 85, options [nop,nop,TS val 3790583122 ecr 1095288603], length 4
00:00:55.220445 IP 10.0.0.6.1883 > 10.0.0.8.44720: Flags [P.], seq 3368043732:3368043736, ack 3038699786, win 85, options [nop,nop,TS val 3790583124 ecr 1095288605], length 4
00:00:56.220732 IP 10.0.0.6.1883 > 10.0.0.8.44720: Flags [P.], seq 3368043736:3368043740, ack 3038700181, win 85, options [nop,nop,TS val 3790584123 ecr 1095289604], length 4
00:00:56.222300 IP 10.0.0.6.1883 > 10.0.0.8.44720: Flags [P.], seq 3368043740:3368043744, ack 3038700185, win 85, options [nop,nop,TS val 3790584125 ecr 1095289606], length 4
00:00:57.031434 IP 10.0.0.6.1883 > 10.0.0.8.44720: Flags [P.], seq 3368043744:3368043746, ack 3038700187, win 85, options [nop,nop,TS val 3790584934 ecr 1095290415], length 2
00:00:57.224364 IP 10.0.0.6.1883 > 10.0.0.8.44720: Flags [P.], seq 3368043746:3368043750, ack 3038700582, win 85, options [nop,nop,TS val 3790585127 ecr 1095290608], length 4
00:00:57.226188 IP 10.0.0.6.1883 > 10.0.0.8.44720: Flags [P.], seq 3368043750:3368043754, ack 3038700586, win 85, options [nop,nop,TS val 3790585128 ecr 1095290609], length 4
00:00:58.225902 IP 10.0.0.6.1883 > 10.0.0.8.44720: Flags [P.], seq 3368043754:3368043758, ack 3038700981, win 85, options [nop,nop,TS val 3790586128 ecr 1095291609], length 4
00:00:58.227875 IP 10.0.0.6.1883 > 10.0.0.8.44720: Flags [P.], seq 3368043758:3368043762, ack 3038700985, win 85, options [nop,nop,TS val 3790586129 ecr 1095291610], length 4
00:00:59.226794 IP 10.0.0.6.1883 > 10.0.0.8.44720: Flags [P.], seq 3368043762:3368043766, ack 3038701380, win 85, options [nop,nop,TS val 3790587128 ecr 1095292609], length 4
00:00:59.228365 IP 10.0.0.6.1883 > 10.0.0.8.44720: Flags [P.], seq 3368043766:3368043770, ack 3038701384, win 85, options [nop,nop,TS val 3790587129 ecr 1095292610], length 4
00:01:00.227860 IP 10.0.0.6.1883 > 10.0.0.8.44720: Flags [P.], seq 3368043770:3368043774, ack 3038701779, win 85, options [nop,nop,TS val 3790588129 ecr 1095293610], length 4
00:01:00.229835 IP 10.0.0.6.1883 > 10.0.0.8.44720: Flags [P.], seq 3368043774:3368043778, ack 3038701783, win 85, options [nop,nop,TS val 3790588130 ecr 1095293611], length 4
00:01:01.229427 IP 10.0.0.6.1883 > 10.0.0.8.44720: Flags [P.], seq 3368043778:3368043782, ack 3038702178, win 85, options [nop,nop,TS val 3790589130 ecr 1095294610], length 4
00:01:01.231338 IP 10.0.0.6.1883 > 10.0.0.8.44720: Flags [P.], seq 3368043782:3368043786, ack 3038702182, win 85, options [nop,nop,TS val 3790589131 ecr 1095294612], length 4
00:01:02.033462 IP 10.0.0.6.1883 > 10.0.0.8.44720: Flags [P.], seq 3368043786:3368043788, ack 3038702184, win 85, options [nop,nop,TS val 3790589933 ecr 1095295414], length 2
00:01:02.230424 IP 10.0.0.6.1883 > 10.0.0.8.44720: Flags [P.], seq 3368043788:3368043792, ack 3038702579, win 85, options [nop,nop,TS val 3790590130 ecr 1095295611], length 4
00:01:02.231890 IP 10.0.0.6.1883 > 10.0.0.8.44720: Flags [P.], seq 3368043792:3368043796, ack 3038702583, win 85, options [nop,nop,TS val 3790590132 ecr 1095295613], length 4
00:01:03.232393 IP 10.0.0.6.1883 > 10.0.0.8.44720: Flags [P.], seq 3368043796:3368043800, ack 3038702978, win 85, options [nop,nop,TS val 3790591132 ecr 1095296613], length 4
00:01:03.234394 IP 10.0.0.6.1883 > 10.0.0.8.44720: Flags [P.], seq 3368043800:3368043804, ack 3038702982, win 85, options [nop,nop,TS val 3790591134 ecr 1095296614], length 4
00:01:04.235696 IP 10.0.0.6.1883 > 10.0.0.8.44720: Flags [P.], seq 3368043804:3368043808, ack 3038703377, win 85, options [nop,nop,TS val 3790592134 ecr 1095297614], length 4
00:01:04.238319 IP 10.0.0.6.1883 > 10.0.0.8.44720: Flags [P.], seq 3368043808:3368043812, ack 3038703381, win 85, options [nop,nop,TS val 3790592137 ecr 1095297617], length 4
00:01:05.235800 IP 10.0.0.6.1883 > 10.0.0.8.44720: Flags [P.], seq 3368043812:3368043816, ack 3038703776, win 85, options [nop,nop,TS val 3790593134 ecr 1095298615], length 4
00:01:05.239247 IP 10.0.0.6.1883 > 10.0.0.8.44720: Flags [P.], seq 3368043816:3368043820, ack 3038703780, win 85, options [nop,nop,TS val 3790593137 ecr 1095298617], length 4
00:01:06.236671 IP 10.0.0.6.1883 > 10.0.0.8.44720: Flags [P.], seq 3368043820:3368043824, ack 3038704175, win 85, options [nop,nop,TS val 3790594134 ecr 1095299615], length 4
00:01:06.239073 IP 10.0.0.6.1883 > 10.0.0.8.44720: Flags [P.], seq 3368043824:3368043828, ack 3038704179, win 85, options [nop,nop,TS val 3790594137 ecr 1095299617], length 4
00:01:07.035706 IP 10.0.0.6.1883 > 10.0.0.8.44720: Flags [P.], seq 3368043828:3368043830, ack 3038704181, win 85, options [nop,nop,TS val 3790594933 ecr 1095300414], length 2
00:01:07.236956 IP 10.0.0.6.1883 > 10.0.0.8.44720: Flags [P.], seq 3368043830:3368043834, ack 3038704576, win 85, options [nop,nop,TS val 3790595134 ecr 1095300615], length 4
00:01:07.238637 IP 10.0.0.6.1883 > 10.0.0.8.44720: Flags [P.], seq 3368043834:3368043838, ack 3038704580, win 85, options [nop,nop,TS val 3790595136 ecr 1095300617], length 4
00:01:08.237868 IP 10.0.0.6.1883 > 10.0.0.8.44720: Flags [P.], seq 3368043838:3368043842, ack 3038704975, win 85, options [nop,nop,TS val 3790596135 ecr 1095301616], length 4
00:01:08.239418 IP 10.0.0.6.1883 > 10.0.0.8.44720: Flags [P.], seq 3368043842:3368043846, ack 3038704979, win 85, options [nop,nop,TS val 3790596136 ecr 1095301617], length 4
00:01:09.239347 IP 10.0.0.6.1883 > 10.0.0.8.44720: Flags [P.], seq 3368043846:3368043850, ack 3038705374, win 85, options [nop,nop,TS val 3790597136 ecr 1095302617], length 4
00:01:09.241160 IP 10.0.0.6.1883 > 10.0.0.8.44720: Flags [P.], seq 3368043850:3368043854, ack 3038705378, win 85, options [nop,nop,TS val 3790597137 ecr 1095302618], length 4
00:01:10.240274 IP 10.0.0.6.1883 > 10.0.0.8.44720: Flags [P.], seq 3368043854:3368043858, ack 3038705773, win 85, options [nop,nop,TS val 3790598136 ecr 1095303617], length 4
00:01:10.242219 IP 10.0.0.6.1883 > 10.0.0.8.44720: Flags [P.], seq 3368043858:3368043862, ack 3038705777, win 85, options [nop,nop,TS val 3790598138 ecr 1095303618], length 4
00:01:11.241622 IP 10.0.0.6.1883 > 10.0.0.8.44720: Flags [P.], seq 3368043862:3368043866, ack 3038706172, win 85, options [nop,nop,TS val 3790599137 ecr 1095304618], length 4
00:01:11.243341 IP 10.0.0.6.1883 > 10.0.0.8.44720: Flags [P.], seq 3368043866:3368043870, ack 3038706176, win 85, options [nop,nop,TS val 3790599138 ecr 1095304619], length 4
00:01:12.037768 IP 10.0.0.6.1883 > 10.0.0.8.44720: Flags [P.], seq 3368043870:3368043872, ack 3038706178, win 85, options [nop,nop,TS val 3790599932 ecr 1095305414], length 2
00:01:12.243572 IP 10.0.0.6.1883 > 10.0.0.8.44720: Flags [P.], seq 3368043872:3368043876, ack 3038706573, win 85, options [nop,nop,TS val 3790600138 ecr 1095305619], length 4
00:01:12.245835 IP 10.0.0.6.1883 > 10.0.0.8.44720: Flags [P.], seq 3368043876:3368043880, ack 3038706577, win 85, options [nop,nop,TS val 3790600140 ecr 1095305622], length 4
00:01:13.245008 IP 10.0.0.6.1883 > 10.0.0.8.44720: Flags [P.], seq 3368043880:3368043884, ack 3038706972, win 85, options [nop,nop,TS val 3790601139 ecr 1095306620], length 4
00:01:13.246990 IP 10.0.0.6.1883 > 10.0.0.8.44720: Flags [P.], seq 3368043884:3368043888, ack 3038706976, win 85, options [nop,nop,TS val 3790601141 ecr 1095306622], length 4
00:01:14.245966 IP 10.0.0.6.1883 > 10.0.0.8.44720: Flags [P.], seq 3368043888:3368043892, ack 3038707371, win 85, options [nop,nop,TS val 3790602140 ecr 1095307621], length 4
00:01:14.248155 IP 10.0.0.6.1883 > 10.0.0.8.44720: Flags [P.], seq 3368043892:3368043896, ack 3038707375, win 85, options [nop,nop,TS val 3790602142 ecr 1095307623], length 4
00:01:15.248243 IP 10.0.0.6.1883 > 10.0.0.8.44720: Flags [P.], seq 3368043896:3368043900, ack 3038707770, win 85, options [nop,nop,TS val 3790603141 ecr 1095308622], length 4
00:01:15.250234 IP 10.0.0.6.1883 > 10.0.0.8.44720: Flags [P.], seq 3368043900:3368043904, ack 3038707774, win 85, options [nop,nop,TS val 3790603143 ecr 1095308625], length 4
00:01:16.249357 IP 10.0.0.6.1883 > 10.0.0.8.44720: Flags [P.], seq 3368043904:3368043908, ack 3038708169, win 85, options [nop,nop,TS val 3790604142 ecr 1095309623], length 4
00:01:16.251058 IP 10.0.0.6.1883 > 10.0.0.8.44720: Flags [P.], seq 3368043908:3368043912, ack 3038708173, win 85, options [nop,nop,TS val 3790604144 ecr 1095309625], length 4
00:01:17.038936 IP 10.0.0.6.1883 > 10.0.0.8.44720: Flags [P.], seq 3368043912:3368043914, ack 3038708175, win 85, options [nop,nop,TS val 3790604931 ecr 1095310413], length 2
00:01:17.250381 IP 10.0.0.6.1883 > 10.0.0.8.44720: Flags [P.], seq 3368043914:3368043918, ack 3038708570, win 85, options [nop,nop,TS val 3790605143 ecr 1095310624], length 4
00:01:17.252143 IP 10.0.0.6.1883 > 10.0.0.8.44720: Flags [P.], seq 3368043918:3368043922, ack 3038708574, win 85, options [nop,nop,TS val 3790605144 ecr 1095310625], length 4
00:01:18.255988 IP 10.0.0.6.1883 > 10.0.0.8.44720: Flags [P.], seq 3368043922:3368043926, ack 3038708969, win 85, options [nop,nop,TS val 3790606145 ecr 1095311625], length 4
00:01:18.261699 IP 10.0.0.6.1883 > 10.0.0.8.44720: Flags [P.], seq 3368043926:3368043930, ack 3038708973, win 85, options [nop,nop,TS val 3790606153 ecr 1095311634], length 4
00:01:19.316367 IP 10.0.0.6.1883 > 10.0.0.8.44720: Flags [P.], seq 3368043930:3368043934, ack 3038709368, win 85, options [nop,nop,TS val 3790607207 ecr 1095312688], length 4
00:01:19.318128 IP 10.0.0.6.1883 > 10.0.0.8.44720: Flags [P.], seq 3368043934:3368043938, ack 3038709372, win 85, options [nop,nop,TS val 3790607209 ecr 1095312690], length 4
00:01:20.319340 IP 10.0.0.6.1883 > 10.0.0.8.44720: Flags [P.], seq 3368043938:3368043942, ack 3038709767, win 85, options [nop,nop,TS val 3790608210 ecr 1095313690], length 4
00:01:20.324991 IP 10.0.0.6.1883 > 10.0.0.8.44720: Flags [P.], seq 3368043942:3368043946, ack 3038709771, win 85, options [nop,nop,TS val 3790608212 ecr 1095313693], length 4
00:01:20.842602 IP 10.0.0.6.1883 > 10.0.0.8.44720: Flags [P.], seq 3368043942:3368043946, ack 3038709771, win 85, options [nop,nop,TS val 3790608593 ecr 1095313693], length 4
00:01:21.365516 IP 10.0.0.6.1883 > 10.0.0.8.44720: Flags [P.], seq 3368043946:3368043950, ack 3038710166, win 85, options [nop,nop,TS val 3790609255 ecr 1095314736], length 4
00:01:21.367922 IP 10.0.0.6.1883 > 10.0.0.8.44720: Flags [P.], seq 3368043950:3368043954, ack 3038710170, win 85, options [nop,nop,TS val 3790609258 ecr 1095314738], length 4
00:01:22.117878 IP 10.0.0.6.1883 > 10.0.0.8.44720: Flags [P.], seq 3368043954:3368043956, ack 3038710172, win 85, options [nop,nop,TS val 3790610007 ecr 1095315487], length 2
00:01:22.367594 IP 10.0.0.6.1883 > 10.0.0.8.44720: Flags [P.], seq 3368043956:3368043960, ack 3038710567, win 85, options [nop,nop,TS val 3790610257 ecr 1095315737], length 4
00:01:22.369841 IP 10.0.0.6.1883 > 10.0.0.8.44720: Flags [P.], seq 3368043960:3368043964, ack 3038710571, win 85, options [nop,nop,TS val 3790610259 ecr 1095315740], length 4
00:01:23.368191 IP 10.0.0.6.1883 > 10.0.0.8.44720: Flags [P.], seq 3368043964:3368043968, ack 3038710966, win 85, options [nop,nop,TS val 3790611257 ecr 1095316737], length 4
00:01:23.370018 IP 10.0.0.6.1883 > 10.0.0.8.44720: Flags [P.], seq 3368043968:3368043972, ack 3038710970, win 85, options [nop,nop,TS val 3790611259 ecr 1095316740], length 4
00:01:24.369319 IP 10.0.0.6.1883 > 10.0.0.8.44720: Flags [P.], seq 3368043972:3368043976, ack 3038711365, win 85, options [nop,nop,TS val 3790612258 ecr 1095317738], length 4
00:01:24.370520 IP 10.0.0.6.1883 > 10.0.0.8.44720: Flags [P.], seq 3368043976:3368043980, ack 3038711369, win 85, options [nop,nop,TS val 3790612259 ecr 1095317741], length 4
00:01:25.370797 IP 10.0.0.6.1883 > 10.0.0.8.44720: Flags [P.], seq 3368043980:3368043984, ack 3038711764, win 85, options [nop,nop,TS val 3790613259 ecr 1095318739], length 4
00:01:25.372502 IP 10.0.0.6.1883 > 10.0.0.8.44720: Flags [P.], seq 3368043984:3368043988, ack 3038711768, win 85, options [nop,nop,TS val 3790613261 ecr 1095318741], length 4
00:01:26.373625 IP 10.0.0.6.1883 > 10.0.0.8.44720: Flags [P.], seq 3368043988:3368043992, ack 3038712163, win 85, options [nop,nop,TS val 3790614261 ecr 1095319740], length 4
00:01:26.375200 IP 10.0.0.6.1883 > 10.0.0.8.44720: Flags [P.], seq 3368043992:3368043996, ack 3038712167, win 85, options [nop,nop,TS val 3790614263 ecr 1095319744], length 4
00:01:27.147751 IP 10.0.0.6.1883 > 10.0.0.8.44720: Flags [P.], seq 3368043996:3368043998, ack 3038712169, win 85, options [nop,nop,TS val 3790615035 ecr 1095320515], length 2
00:01:27.374274 IP 10.0.0.6.1883 > 10.0.0.8.44720: Flags [P.], seq 3368043998:3368044002, ack 3038712564, win 85, options [nop,nop,TS val 3790615261 ecr 1095320741], length 4
00:01:27.376221 IP 10.0.0.6.1883 > 10.0.0.8.44720: Flags [P.], seq 3368044002:3368044006, ack 3038712568, win 85, options [nop,nop,TS val 3790615263 ecr 1095320744], length 4
00:01:28.374894 IP 10.0.0.6.1883 > 10.0.0.8.44720: Flags [P.], seq 3368044006:3368044010, ack 3038712963, win 85, options [nop,nop,TS val 3790616261 ecr 1095321742], length 4
00:01:28.375801 IP 10.0.0.6.1883 > 10.0.0.8.44720: Flags [P.], seq 3368044010:3368044014, ack 3038712967, win 85, options [nop,nop,TS val 3790616263 ecr 1095321744], length 4
00:01:29.375959 IP 10.0.0.6.1883 > 10.0.0.8.44720: Flags [P.], seq 3368044014:3368044018, ack 3038713362, win 85, options [nop,nop,TS val 3790617262 ecr 1095322742], length 4
00:01:29.377505 IP 10.0.0.6.1883 > 10.0.0.8.44720: Flags [P.], seq 3368044018:3368044022, ack 3038713366, win 85, options [nop,nop,TS val 3790617264 ecr 1095322745], length 4
00:01:30.377008 IP 10.0.0.6.1883 > 10.0.0.8.44720: Flags [P.], seq 3368044022:3368044026, ack 3038713761, win 85, options [nop,nop,TS val 3790618263 ecr 1095323743], length 4
00:01:30.378844 IP 10.0.0.6.1883 > 10.0.0.8.44720: Flags [P.], seq 3368044026:3368044030, ack 3038713765, win 85, options [nop,nop,TS val 3790618264 ecr 1095323745], length 4
00:01:31.378151 IP 10.0.0.6.1883 > 10.0.0.8.44720: Flags [P.], seq 3368044030:3368044034, ack 3038714160, win 85, options [nop,nop,TS val 3790619263 ecr 1095324743], length 4
00:01:31.379778 IP 10.0.0.6.1883 > 10.0.0.8.44720: Flags [P.], seq 3368044034:3368044038, ack 3038714164, win 85, options [nop,nop,TS val 3790619265 ecr 1095324746], length 4
00:01:32.148284 IP 10.0.0.6.1883 > 10.0.0.8.44720: Flags [P.], seq 3368044038:3368044040, ack 3038714166, win 85, options [nop,nop,TS val 3790620033 ecr 1095325514], length 2
00:01:32.378998 IP 10.0.0.6.1883 > 10.0.0.8.44720: Flags [P.], seq 3368044040:3368044044, ack 3038714561, win 85, options [nop,nop,TS val 3790620263 ecr 1095325744], length 4
00:01:32.381203 IP 10.0.0.6.1883 > 10.0.0.8.44720: Flags [P.], seq 3368044044:3368044048, ack 3038714565, win 85, options [nop,nop,TS val 3790620266 ecr 1095325746], length 4
00:01:33.379686 IP 10.0.0.6.1883 > 10.0.0.8.44720: Flags [P.], seq 3368044048:3368044052, ack 3038714960, win 85, options [nop,nop,TS val 3790621264 ecr 1095326744], length 4
00:01:33.382287 IP 10.0.0.6.1883 > 10.0.0.8.44720: Flags [P.], seq 3368044052:3368044056, ack 3038714964, win 85, options [nop,nop,TS val 3790621266 ecr 1095326747], length 4
00:01:34.381176 IP 10.0.0.6.1883 > 10.0.0.8.44720: Flags [P.], seq 3368044056:3368044060, ack 3038715359, win 85, options [nop,nop,TS val 3790622265 ecr 1095327745], length 4
00:01:34.383227 IP 10.0.0.6.1883 > 10.0.0.8.44720: Flags [P.], seq 3368044060:3368044064, ack 3038715363, win 85, options [nop,nop,TS val 3790622266 ecr 1095327748], length 4
00:01:35.381805 IP 10.0.0.6.1883 > 10.0.0.8.44720: Flags [P.], seq 3368044064:3368044068, ack 3038715758, win 85, options [nop,nop,TS val 3790623265 ecr 1095328745], length 4
00:01:35.383734 IP 10.0.0.6.1883 > 10.0.0.8.44720: Flags [P.], seq 3368044068:3368044072, ack 3038715762, win 85, options [nop,nop,TS val 3790623267 ecr 1095328748], length 4
00:01:36.383926 IP 10.0.0.6.1883 > 10.0.0.8.44720: Flags [P.], seq 3368044072:3368044076, ack 3038716157, win 85, options [nop,nop,TS val 3790624267 ecr 1095329747], length 4
00:01:36.385789 IP 10.0.0.6.1883 > 10.0.0.8.44720: Flags [P.], seq 3368044076:3368044080, ack 3038716161, win 85, options [nop,nop,TS val 3790624268 ecr 1095329749], length 4
00:01:37.150948 IP 10.0.0.6.1883 > 10.0.0.8.44720: Flags [P.], seq 3368044080:3368044082, ack 3038716163, win 85, options [nop,nop,TS val 3790625033 ecr 1095330514], length 2
00:01:37.384612 IP 10.0.0.6.1883 > 10.0.0.8.44720: Flags [P.], seq 3368044082:3368044086, ack 3038716558, win 85, options [nop,nop,TS val 3790625267 ecr 1095330747], length 4
00:01:37.386615 IP 10.0.0.6.1883 > 10.0.0.8.44720: Flags [P.], seq 3368044086:3368044090, ack 3038716562, win 85, options [nop,nop,TS val 3790625269 ecr 1095330750], length 4
00:01:38.385610 IP 10.0.0.6.1883 > 10.0.0.8.44720: Flags [P.], seq 3368044090:3368044094, ack 3038716957, win 85, options [nop,nop,TS val 3790626267 ecr 1095331748], length 4
00:01:38.386545 IP 10.0.0.6.1883 > 10.0.0.8.44720: Flags [P.], seq 3368044094:3368044098, ack 3038716961, win 85, options [nop,nop,TS val 3790626268 ecr 1095331750], length 4
00:01:39.392156 IP 10.0.0.6.1883 > 10.0.0.8.44720: Flags [P.], seq 3368044098:3368044102, ack 3038717356, win 85, options [nop,nop,TS val 3790627273 ecr 1095332753], length 4
00:01:39.393343 IP 10.0.0.6.1883 > 10.0.0.8.44720: Flags [P.], seq 3368044102:3368044106, ack 3038717360, win 85, options [nop,nop,TS val 3790627274 ecr 1095332756], length 4
00:01:40.395408 IP 10.0.0.6.1883 > 10.0.0.8.44720: Flags [P.], seq 3368044106:3368044110, ack 3038717755, win 85, options [nop,nop,TS val 3790628276 ecr 1095333756], length 4
00:01:40.397654 IP 10.0.0.6.1883 > 10.0.0.8.44720: Flags [P.], seq 3368044110:3368044114, ack 3038717759, win 85, options [nop,nop,TS val 3790628278 ecr 1095333759], length 4
00:01:41.399485 IP 10.0.0.6.1883 > 10.0.0.8.44720: Flags [P.], seq 3368044114:3368044118, ack 3038718154, win 85, options [nop,nop,TS val 3790629280 ecr 1095334761], length 4
00:01:41.401008 IP 10.0.0.6.1883 > 10.0.0.8.44720: Flags [P.], seq 3368044118:3368044122, ack 3038718158, win 85, options [nop,nop,TS val 3790629281 ecr 1095334762], length 4
00:01:42.152796 IP 10.0.0.6.1883 > 10.0.0.8.44720: Flags [P.], seq 3368044122:3368044124, ack 3038718160, win 85, options [nop,nop,TS val 3790630033 ecr 1095335514], length 2
00:01:42.404111 IP 10.0.0.6.1883 > 10.0.0.8.44720: Flags [P.], seq 3368044124:3368044128, ack 3038718555, win 85, options [nop,nop,TS val 3790630283 ecr 1095335762], length 4
00:01:42.406911 IP 10.0.0.6.1883 > 10.0.0.8.44720: Flags [P.], seq 3368044128:3368044132, ack 3038718559, win 85, options [nop,nop,TS val 3790630286 ecr 1095335767], length 4
00:01:43.405351 IP 10.0.0.6.1883 > 10.0.0.8.44720: Flags [P.], seq 3368044132:3368044136, ack 3038718954, win 85, options [nop,nop,TS val 3790631285 ecr 1095336763], length 4
00:01:43.610413 IP 10.0.0.6.1883 > 10.0.0.8.44720: Flags [.], ack 3038718954, win 85, options [nop,nop,TS val 3790631490 ecr 1095336971,nop,nop,sack 1 {3038718559:3038718954}], length 0
00:01:43.613178 IP 10.0.0.6.1883 > 10.0.0.8.44720: Flags [.], ack 3038718958, win 85, options [nop,nop,TS val 3790631492 ecr 1095336973], length 0
00:01:43.613600 IP 10.0.0.6.1883 > 10.0.0.8.44720: Flags [P.], seq 3368044136:3368044140, ack 3038718958, win 85, options [nop,nop,TS val 3790631493 ecr 1095336973], length 4
00:01:44.404620 IP 10.0.0.6.1883 > 10.0.0.8.44720: Flags [P.], seq 3368044140:3368044144, ack 3038719353, win 85, options [nop,nop,TS val 3790632283 ecr 1095337763], length 4
00:01:44.406897 IP 10.0.0.6.1883 > 10.0.0.8.44720: Flags [P.], seq 3368044144:3368044148, ack 3038719357, win 85, options [nop,nop,TS val 3790632285 ecr 1095337766], length 4
00:01:45.406513 IP 10.0.0.6.1883 > 10.0.0.8.44720: Flags [P.], seq 3368044148:3368044152, ack 3038719752, win 85, options [nop,nop,TS val 3790633285 ecr 1095338764], length 4
00:01:45.408317 IP 10.0.0.6.1883 > 10.0.0.8.44720: Flags [P.], seq 3368044152:3368044156, ack 3038719756, win 85, options [nop,nop,TS val 3790633286 ecr 1095338767], length 4
00:01:46.408777 IP 10.0.0.6.1883 > 10.0.0.8.44720: Flags [P.], seq 3368044156:3368044160, ack 3038720151, win 85, options [nop,nop,TS val 3790634286 ecr 1095339765], length 4
00:01:46.411533 IP 10.0.0.6.1883 > 10.0.0.8.44720: Flags [P.], seq 3368044160:3368044164, ack 3038720155, win 85, options [nop,nop,TS val 3790634289 ecr 1095339769], length 4
00:01:47.155727 IP 10.0.0.6.1883 > 10.0.0.8.44720: Flags [P.], seq 3368044164:3368044166, ack 3038720157, win 85, options [nop,nop,TS val 3790635033 ecr 1095340513], length 2
00:01:47.411273 IP 10.0.0.6.1883 > 10.0.0.8.44720: Flags [P.], seq 3368044166:3368044170, ack 3038720552, win 85, options [nop,nop,TS val 3790635288 ecr 1095340768], length 4
00:01:47.413195 IP 10.0.0.6.1883 > 10.0.0.8.44720: Flags [P.], seq 3368044170:3368044174, ack 3038720556, win 85, options [nop,nop,TS val 3790635290 ecr 1095340771], length 4
00:01:48.411037 IP 10.0.0.6.1883 > 10.0.0.8.44720: Flags [P.], seq 3368044174:3368044178, ack 3038720951, win 85, options [nop,nop,TS val 3790636287 ecr 1095341768], length 4
00:01:48.412810 IP 10.0.0.6.1883 > 10.0.0.8.44720: Flags [P.], seq 3368044178:3368044182, ack 3038720955, win 85, options [nop,nop,TS val 3790636289 ecr 1095341771], length 4
00:01:49.413041 IP 10.0.0.6.1883 > 10.0.0.8.44720: Flags [P.], seq 3368044182:3368044186, ack 3038721350, win 85, options [nop,nop,TS val 3790637289 ecr 1095342770], length 4
00:01:49.414981 IP 10.0.0.6.1883 > 10.0.0.8.44720: Flags [P.], seq 3368044186:3368044190, ack 3038721354, win 85, options [nop,nop,TS val 3790637291 ecr 1095342772], length 4
00:01:50.414833 IP 10.0.0.6.1883 > 10.0.0.8.44720: Flags [P.], seq 3368044190:3368044194, ack 3038721749, win 85, options [nop,nop,TS val 3790638290 ecr 1095343771], length 4
00:01:50.416693 IP 10.0.0.6.1883 > 10.0.0.8.44720: Flags [P.], seq 3368044194:3368044198, ack 3038721753, win 85, options [nop,nop,TS val 3790638292 ecr 1095343774], length 4
00:01:51.426816 IP 10.0.0.6.1883 > 10.0.0.8.44720: Flags [P.], seq 3368044198:3368044202, ack 3038722148, win 85, options [nop,nop,TS val 3790639302 ecr 1095344783], length 4
00:01:51.428489 IP 10.0.0.6.1883 > 10.0.0.8.44720: Flags [P.], seq 3368044202:3368044206, ack 3038722152, win 85, options [nop,nop,TS val 3790639304 ecr 1095344785], length 4
00:01:52.156652 IP 10.0.0.6.1883 > 10.0.0.8.44720: Flags [P.], seq 3368044206:3368044208, ack 3038722154, win 85, options [nop,nop,TS val 3790640031 ecr 1095345512], length 2
00:01:57.159289 IP 10.0.0.6.1883 > 10.0.0.8.44720: Flags [P.], seq 3368044208:3368044210, ack 3038722156, win 85, options [nop,nop,TS val 3790645031 ecr 1095350512], length 2
00:01:59.468356 IP 10.0.0.6.1883 > 10.0.0.8.44720: Flags [F.], seq 3368044210, ack 3038722157, win 85, options [nop,nop,TS val 3790647339 ecr 1095352820], length 0