00:00:09.322824 IP 10.0.0.6.1883 > 10.0.0.8.44754: Flags [S.], seq 150917953, ack 1011595975, win 43440, options [mss 1460,sackOK,TS val 3790740932 ecr 1095446381,nop,wscale 9], length 0
00:00:09.334005 IP 10.0.0.6.1883 > 10.0.0.8.44754: Flags [.], ack 1011595995, win 85, options [nop,nop,TS val 3790740943 ecr 1095446425], length 0
00:00:09.334189 IP 10.0.0.6.1883 > 10.0.0.8.44754: Flags [P.], seq 150917954:150917958, ack 1011595995, win 85, options [nop,nop,TS val 3790740943 ecr 1095446425], length 4
00:00:09.337328 IP 10.0.0.6.1883 > 10.0.0.8.44754: Flags [P.], seq 150917958:150918023, ack 1011596059, win 85, options [nop,nop,TS val 3790740946 ecr 1095446428], length 65
00:00:09.337894 IP 10.0.0.6.1883 > 10.0.0.8.44754: Flags [P.], seq 150918023:150918028, ack 1011596454, win 85, options [nop,nop,TS val 3790740947 ecr 1095446429], length 5
00:00:09.393553 IP 10.0.0.6.1883 > 10.0.0.8.44754: Flags [P.], seq 150918028:150918032, ack 1011596454, win 85, options [nop,nop,TS val 3790741003 ecr 1095446472], length 4
00:00:09.394469 IP 10.0.0.6.1883 > 10.0.0.8.44754: Flags [P.], seq 150918032:150918036, ack 1011596458, win 85, options [nop,nop,TS val 3790741004 ecr 1095446485], length 4
00:00:10.295477 IP 10.0.0.6.1883 > 10.0.0.8.44754: Flags [P.], seq 150918036:150918040, ack 1011596853, win 85, options [nop,nop,TS val 3790741904 ecr 1095447384], length 4
00:00:10.301303 IP 10.0.0.6.1883 > 10.0.0.8.44754: Flags [P.], seq 150918040:150918044, ack 1011596857, win 85, options [nop,nop,TS val 3790741910 ecr 1095447390], length 4
00:00:11.340336 IP 10.0.0.6.1883 > 10.0.0.8.44754: Flags [P.], seq 150918044:150918048, ack 1011597252, win 85, options [nop,nop,TS val 3790742948 ecr 1095448429], length 4
00:00:11.342469 IP 10.0.0.6.1883 > 10.0.0.8.44754: Flags [P.], seq 150918048:150918052, ack 1011597256, win 85, options [nop,nop,TS val 3790742950 ecr 1095448432], length 4
00:00:11.622972 IP 10.0.0.6.1883 > 10.0.0.8.44754: Flags [P.], seq 150918048:150918052, ack 1011597256, win 85, options [nop,nop,TS val 3790743231 ecr 1095448432], length 4
00:00:12.345478 IP 10.0.0.6.1883 > 10.0.0.8.44754: Flags [P.], seq 150918052:150918056, ack 1011597651, win 85, options [nop,nop,TS val 3790743953 ecr 1095449433], length 4
00:00:12.348910 IP 10.0.0.6.1883 > 10.0.0.8.44754: Flags [P.], seq 150918056:150918060, ack 1011597655, win 85, options [nop,nop,TS val 3790743956 ecr 1095449437], length 4
00:00:13.348500 IP 10.0.0.6.1883 > 10.0.0.8.44754: Flags [P.], seq 150918060:150918064, ack 1011598050, win 85, options [nop,nop,TS val 3790744955 ecr 1095450435], length 4
00:00:13.350365 IP 10.0.0.6.1883 > 10.0.0.8.44754: Flags [P.], seq 150918064:150918068, ack 1011598054, win 85, options [nop,nop,TS val 3790744958 ecr 1095450439], length 4
00:00:14.348994 IP 10.0.0.6.1883 > 10.0.0.8.44754: Flags [P.], seq 150918068:150918070, ack 1011598056, win 85, options [nop,nop,TS val 3790745954 ecr 1095451434], length 2
00:00:14.351598 IP 10.0.0.6.1883 > 10.0.0.8.44754: Flags [P.], seq 150918070:150918074, ack 1011598451, win 85, options [nop,nop,TS val 3790745958 ecr 1095451439], length 4
00:00:14.354024 IP 10.0.0.6.1883 > 10.0.0.8.44754: Flags [P.], seq 150918074:150918078, ack 1011598455, win 85, options [nop,nop,TS val 3790745960 ecr 1095451441], length 4
00:00:15.350581 IP 10.0.0.6.1883 > 10.0.0.8.44754: Flags [P.], seq 150918078:150918082, ack 1011598850, win 85, options [nop,nop,TS val 3790746957 ecr 1095452437], length 4
00:00:15.352273 IP 10.0.0.6.1883 > 10.0.0.8.44754: Flags [P.], seq 150918082:150918086, ack 1011598854, win 85, options [nop,nop,TS val 3790746958 ecr 1095452439], length 4
00:00:16.359246 IP 10.0.0.6.1883 > 10.0.0.8.44754: Flags [P.], seq 150918086:150918090, ack 1011599249, win 85, options [nop,nop,TS val 3790747965 ecr 1095453444], length 4
00:00:16.362374 IP 10.0.0.6.1883 > 10.0.0.8.44754: Flags [P.], seq 150918090:150918094, ack 1011599253, win 85, options [nop,nop,TS val 3790747968 ecr 1095453448], length 4
00:00:16.724642 IP 10.0.0.6.1883 > 10.0.0.8.44754: Flags [P.], seq 150918090:150918094, ack 1011599253, win 85, options [nop,nop,TS val 3790748298 ecr 1095453448], length 4
00:00:17.368101 IP 10.0.0.6.1883 > 10.0.0.8.44754: Flags [P.], seq 150918094:150918098, ack 1011599648, win 85, options [nop,nop,TS val 3790748973 ecr 1095454452], length 4
00:00:17.388597 IP 10.0.0.6.1883 > 10.0.0.8.44754: Flags [P.], seq 150918098:150918102, ack 1011599652, win 85, options [nop,nop,TS val 3790748994 ecr 1095454474], length 4
00:00:18.374546 IP 10.0.0.6.1883 > 10.0.0.8.44754: Flags [P.], seq 150918102:150918106, ack 1011600047, win 85, options [nop,nop,TS val 3790749979 ecr 1095455460], length 4
00:00:18.379222 IP 10.0.0.6.1883 > 10.0.0.8.44754: Flags [P.], seq 150918106:150918110, ack 1011600051, win 85, options [nop,nop,TS val 3790749984 ecr 1095455465], length 4
00:00:19.349712 IP 10.0.0.6.1883 > 10.0.0.8.44754: Flags [P.], seq 150918110:150918112, ack 1011600053, win 85, options [nop,nop,TS val 3790750953 ecr 1095456434], length 2
00:00:19.378733 IP 10.0.0.6.1883 > 10.0.0.8.44754: Flags [P.], seq 150918112:150918116, ack 1011600448, win 85, options [nop,nop,TS val 3790750981 ecr 1095456462], length 4
00:00:19.381071 IP 10.0.0.6.1883 > 10.0.0.8.44754: Flags [P.], seq 150918116:150918120, ack 1011600452, win 85, options [nop,nop,TS val 3790750985 ecr 1095456466], length 4
00:00:20.397965 IP 10.0.0.6.1883 > 10.0.0.8.44754: Flags [P.], seq 150918120:150918124, ack 1011600847, win 85, options [nop,nop,TS val 3790752001 ecr 1095457481], length 4
00:00:20.400144 IP 10.0.0.6.1883 > 10.0.0.8.44754: Flags [P.], seq 150918124:150918128, ack 1011600851, win 85, options [nop,nop,TS val 3790752004 ecr 1095457484], length 4
00:00:21.400068 IP 10.0.0.6.1883 > 10.0.0.8.44754: Flags [P.], seq 150918128:150918132, ack 1011601246, win 85, options [nop,nop,TS val 3790753003 ecr 1095458483], length 4
00:00:21.402145 IP 10.0.0.6.1883 > 10.0.0.8.44754: Flags [P.], seq 150918132:150918136, ack 1011601250, win 85, options [nop,nop,TS val 3790753005 ecr 1095458486], length 4
00:00:22.403875 IP 10.0.0.6.1883 > 10.0.0.8.44754: Flags [P.], seq 150918136:150918140, ack 1011601645, win 85, options [nop,nop,TS val 3790754006 ecr 1095459486], length 4
00:00:22.406788 IP 10.0.0.6.1883 > 10.0.0.8.44754: Flags [P.], seq 150918140:150918144, ack 1011601649, win 85, options [nop,nop,TS val 3790754009 ecr 1095459490], length 4
00:00:22.869381 IP 10.0.0.6.1883 > 10.0.0.8.44754: Flags [P.], seq 150918140:150918144, ack 1011601649, win 85, options [nop,nop,TS val 3790754472 ecr 1095459490], length 4
00:00:23.407099 IP 10.0.0.6.1883 > 10.0.0.8.44754: Flags [P.], seq 150918144:150918148, ack 1011602044, win 85, options [nop,nop,TS val 3790755009 ecr 1095460489], length 4
00:00:23.411375 IP 10.0.0.6.1883 > 10.0.0.8.44754: Flags [P.], seq 150918148:150918152, ack 1011602048, win 85, options [nop,nop,TS val 3790755013 ecr 1095460494], length 4
00:00:24.404937 IP 10.0.0.6.1883 > 10.0.0.8.44754: Flags [P.], seq 150918152:150918154, ack 1011602050, win 85, options [nop,nop,TS val 3790756007 ecr 1095461488], length 2
00:00:24.407514 IP 10.0.0.6.1883 > 10.0.0.8.44754: Flags [P.], seq 150918154:150918158, ack 1011602445, win 85, options [nop,nop,TS val 3790756009 ecr 1095461490], length 4
00:00:24.408684 IP 10.0.0.6.1883 > 10.0.0.8.44754: Flags [P.], seq 150918158:150918162, ack 1011602449, win 85, options [nop,nop,TS val 3790756010 ecr 1095461491], length 4
00:00:25.408504 IP 10.0.0.6.1883 > 10.0.0.8.44754: Flags [P.], seq 150918162:150918166, ack 1011602844, win 85, options [nop,nop,TS val 3790757010 ecr 1095462490], length 4
00:00:25.410259 IP 10.0.0.6.1883 > 10.0.0.8.44754: Flags [P.], seq 150918166:150918170, ack 1011602848, win 85, options [nop,nop,TS val 3790757011 ecr 1095462492], length 4
00:00:26.412601 IP 10.0.0.6.1883 > 10.0.0.8.44754: Flags [P.], seq 150918170:150918174, ack 1011603243, win 85, options [nop,nop,TS val 3790758012 ecr 1095463492], length 4
00:00:26.415411 IP 10.0.0.6.1883 > 10.0.0.8.44754: Flags [P.], seq 150918174:150918178, ack 1011603247, win 85, options [nop,nop,TS val 3790758016 ecr 1095463497], length 4
00:00:27.413697 IP 10.0.0.6.1883 > 10.0.0.8.44754: Flags [P.], seq 150918178:150918182, ack 1011603642, win 85, options [nop,nop,TS val 3790759014 ecr 1095464494], length 4
00:00:27.420025 IP 10.0.0.6.1883 > 10.0.0.8.44754: Flags [P.], seq 150918182:150918186, ack 1011603646, win 85, options [nop,nop,TS val 3790759020 ecr 1095464502], length 4
00:00:28.415773 IP 10.0.0.6.1883 > 10.0.0.8.44754: Flags [P.], seq 150918186:150918190, ack 1011604041, win 85, options [nop,nop,TS val 3790760015 ecr 1095465494], length 4
00:00:28.416891 IP 10.0.0.6.1883 > 10.0.0.8.44754: Flags [P.], seq 150918190:150918194, ack 1011604045, win 85, options [nop,nop,TS val 3790760016 ecr 1095465498], length 4
00:00:29.407294 IP 10.0.0.6.1883 > 10.0.0.8.44754: Flags [P.], seq 150918194:150918196, ack 1011604047, win 85, options [nop,nop,TS val 3790761006 ecr 1095466487], length 2
00:00:29.415497 IP 10.0.0.6.1883 > 10.0.0.8.44754: Flags [P.], seq 150918196:150918200, ack 1011604442, win 85, options [nop,nop,TS val 3790761015 ecr 1095466495], length 4
00:00:29.417025 IP 10.0.0.6.1883 > 10.0.0.8.44754: Flags [P.], seq 150918200:150918204, ack 1011604446, win 85, options [nop,nop,TS val 3790761016 ecr 1095466497], length 4
00:00:30.416803 IP 10.0.0.6.1883 > 10.0.0.8.44754: Flags [P.], seq 150918204:150918208, ack 1011604841, win 85, options [nop,nop,TS val 3790762015 ecr 1095467495], length 4
00:00:30.418286 IP 10.0.0.6.1883 > 10.0.0.8.44754: Flags [P.], seq 150918208:150918212, ack 1011604845, win 85, options [nop,nop,TS val 3790762017 ecr 1095467498], length 4
00:00:31.415608 IP 10.0.0.6.1883 > 10.0.0.8.44754: Flags [P.], seq 150918212:150918216, ack 1011605240, win 85, options [nop,nop,TS val 3790763014 ecr 1095468495], length 4
00:00:31.417416 IP 10.0.0.6.1883 > 10.0.0.8.44754: Flags [P.], seq 150918216:150918220, ack 1011605244, win 85, options [nop,nop,TS val 3790763016 ecr 1095468497], length 4
00:00:32.420395 IP 10.0.0.6.1883 > 10.0.0.8.44754: Flags [P.], seq 150918220:150918224, ack 1011605639, win 85, options [nop,nop,TS val 3790764017 ecr 1095469496], length 4
00:00:32.489232 IP 10.0.0.6.1883 > 10.0.0.8.44754: Flags [P.], seq 150918224:150918228, ack 1011605643, win 85, options [nop,nop,TS val 3790764087 ecr 1095469567], length 4
00:00:33.420250 IP 10.0.0.6.1883 > 10.0.0.8.44754: Flags [P.], seq 150918228:150918232, ack 1011606038, win 85, options [nop,nop,TS val 3790765017 ecr 1095470497], length 4
00:00:33.422386 IP 10.0.0.6.1883 > 10.0.0.8.44754: Flags [P.], seq 150918232:150918236, ack 1011606042, win 85, options [nop,nop,TS val 3790765019 ecr 1095470500], length 4
00:00:34.408662 IP 10.0.0.6.1883 > 10.0.0.8.44754: Flags [P.], seq 150918236:150918238, ack 1011606044, win 85, options [nop,nop,TS val 3790766005 ecr 1095471486], length 2
00:00:34.421889 IP 10.0.0.6.1883 > 10.0.0.8.44754: Flags [P.], seq 150918238:150918242, ack 1011606439, win 85, options [nop,nop,TS val 3790766018 ecr 1095471498], length 4
00:00:34.423726 IP 10.0.0.6.1883 > 10.0.0.8.44754: Flags [P.], seq 150918242:150918246, ack 1011606443, win 85, options [nop,nop,TS val 3790766020 ecr 1095471501], length 4
00:00:35.422491 IP 10.0.0.6.1883 > 10.0.0.8.44754: Flags [P.], seq 150918246:150918250, ack 1011606838, win 85, options [nop,nop,TS val 3790767018 ecr 1095472499], length 4
00:00:35.424147 IP 10.0.0.6.1883 > 10.0.0.8.44754: Flags [P.], seq 150918250:150918254, ack 1011606842, win 85, options [nop,nop,TS val 3790767020 ecr 1095472501], length 4
00:00:36.424225 IP 10.0.0.6.1883 > 10.0.0.8.44754: Flags [P.], seq 150918254:150918258, ack 1011607237, win 85, options [nop,nop,TS val 3790768020 ecr 1095473499], length 4
00:00:36.425600 IP 10.0.0.6.1883 > 10.0.0.8.44754: Flags [P.], seq 150918258:150918262, ack 1011607241, win 85, options [nop,nop,TS val 3790768021 ecr 1095473502], length 4
00:00:37.425210 IP 10.0.0.6.1883 > 10.0.0.8.44754: Flags [P.], seq 150918262:150918266, ack 1011607636, win 85, options [nop,nop,TS val 3790769020 ecr 1095474500], length 4
00:00:37.426936 IP 10.0.0.6.1883 > 10.0.0.8.44754: Flags [P.], seq 150918266:150918270, ack 1011607640, win 85, options [nop,nop,TS val 3790769022 ecr 1095474503], length 4
00:00:38.425378 IP 10.0.0.6.1883 > 10.0.0.8.44754: Flags [P.], seq 150918270:150918274, ack 1011608035, win 85, options [nop,nop,TS val 3790770020 ecr 1095475501], length 4
00:00:38.427152 IP 10.0.0.6.1883 > 10.0.0.8.44754: Flags [P.], seq 150918274:150918278, ack 1011608039, win 85, options [nop,nop,TS val 3790770022 ecr 1095475503], length 4
00:00:39.409757 IP 10.0.0.6.1883 > 10.0.0.8.44754: Flags [P.], seq 150918278:150918280, ack 1011608041, win 85, options [nop,nop,TS val 3790771004 ecr 1095476485], length 2
00:00:39.428378 IP 10.0.0.6.1883 > 10.0.0.8.44754: Flags [P.], seq 150918280:150918284, ack 1011608436, win 85, options [nop,nop,TS val 3790771022 ecr 1095476503], length 4
00:00:39.429323 IP 10.0.0.6.1883 > 10.0.0.8.44754: Flags [P.], seq 150918284:150918288, ack 1011608440, win 85, options [nop,nop,TS val 3790771023 ecr 1095476505], length 4
00:00:40.433438 IP 10.0.0.6.1883 > 10.0.0.8.44754: Flags [P.], seq 150918288:150918292, ack 1011608835, win 85, options [nop,nop,TS val 3790772027 ecr 1095477508], length 4
00:00:40.434909 IP 10.0.0.6.1883 > 10.0.0.8.44754: Flags [P.], seq 150918292:150918296, ack 1011608839, win 85, options [nop,nop,TS val 3790772028 ecr 1095477509], length 4
00:00:41.434859 IP 10.0.0.6.1883 > 10.0.0.8.44754: Flags [P.], seq 150918296:150918300, ack 1011609234, win 85, options [nop,nop,TS val 3790773028 ecr 1095478509], length 4
00:00:41.436674 IP 10.0.0.6.1883 > 10.0.0.8.44754: Flags [P.], seq 150918300:150918304, ack 1011609238, win 85, options [nop,nop,TS val 3790773030 ecr 1095478511], length 4
00:00:42.435991 IP 10.0.0.6.1883 > 10.0.0.8.44754: Flags [P.], seq 150918304:150918308, ack 1011609633, win 85, options [nop,nop,TS val 3790774028 ecr 1095479509], length 4
00:00:42.437847 IP 10.0.0.6.1883 > 10.0.0.8.44754: Flags [P.], seq 150918308:150918312, ack 1011609637, win 85, options [nop,nop,TS val 3790774030 ecr 1095479511], length 4
00:00:43.437368 IP 10.0.0.6.1883 > 10.0.0.8.44754: Flags [P.], seq 150918312:150918316, ack 1011610032, win 85, options [nop,nop,TS val 3790775029 ecr 1095480510], length 4
00:00:43.438746 IP 10.0.0.6.1883 > 10.0.0.8.44754: Flags [P.], seq 150918316:150918320, ack 1011610036, win 85, options [nop,nop,TS val 3790775031 ecr 1095480512], length 4
00:00:44.412346 IP 10.0.0.6.1883 > 10.0.0.8.44754: Flags [P.], seq 150918320:150918322, ack 1011610038, win 85, options [nop,nop,TS val 3790776004 ecr 1095481485], length 2
00:00:44.438281 IP 10.0.0.6.1883 > 10.0.0.8.44754: Flags [P.], seq 150918322:150918326, ack 1011610433, win 85, options [nop,nop,TS val 3790776030 ecr 1095481511], length 4
00:00:44.440054 IP 10.0.0.6.1883 > 10.0.0.8.44754: Flags [P.], seq 150918326:150918330, ack 1011610437, win 85, options [nop,nop,TS val 3790776032 ecr 1095481513], length 4
00:00:45.442442 IP 10.0.0.6.1883 > 10.0.0.8.44754: Flags [P.], seq 150918330:150918334, ack 1011610832, win 85, options [nop,nop,TS val 3790777033 ecr 1095482514], length 4
00:00:45.443682 IP 10.0.0.6.1883 > 10.0.0.8.44754: Flags [P.], seq 150918334:150918338, ack 1011610836, win 85, options [nop,nop,TS val 3790777035 ecr 1095482516], length 4
00:00:46.443871 IP 10.0.0.6.1883 > 10.0.0.8.44754: Flags [P.], seq 150918338:150918342, ack 1011611231, win 85, options [nop,nop,TS val 3790778034 ecr 1095483516], length 4
00:00:46.445520 IP 10.0.0.6.1883 > 10.0.0.8.44754: Flags [P.], seq 150918342:150918346, ack 1011611235, win 85, options [nop,nop,TS val 3790778036 ecr 1095483517], length 4
00:00:47.450133 IP 10.0.0.6.1883 > 10.0.0.8.44754: Flags [P.], seq 150918346:150918350, ack 1011611630, win 85, options [nop,nop,TS val 3790779040 ecr 1095484521], length 4
00:00:47.450958 IP 10.0.0.6.1883 > 10.0.0.8.44754: Flags [P.], seq 150918350:150918354, ack 1011611634, win 85, options [nop,nop,TS val 3790779041 ecr 1095484523], length 4
00:00:48.451664 IP 10.0.0.6.1883 > 10.0.0.8.44754: Flags [P.], seq 150918354:150918358, ack 1011612029, win 85, options [nop,nop,TS val 3790780041 ecr 1095485522], length 4
00:00:48.453276 IP 10.0.0.6.1883 > 10.0.0.8.44754: Flags [P.], seq 150918358:150918362, ack 1011612033, win 85, options [nop,nop,TS val 3790780043 ecr 1095485524], length 4
00:00:49.413309 IP 10.0.0.6.1883 > 10.0.0.8.44754: Flags [P.], seq 150918362:150918364, ack 1011612035, win 85, options [nop,nop,TS val 3790781002 ecr 1095486484], length 2
00:00:49.452967 IP 10.0.0.6.1883 > 10.0.0.8.44754: Flags [P.], seq 150918364:150918368, ack 1011612430, win 85, options [nop,nop,TS val 3790781042 ecr 1095486523], length 4
00:00:49.454317 IP 10.0.0.6.1883 > 10.0.0.8.44754: Flags [P.], seq 150918368:150918372, ack 1011612434, win 85, options [nop,nop,TS val 3790781043 ecr 1095486525], length 4
00:00:50.454849 IP 10.0.0.6.1883 > 10.0.0.8.44754: Flags [P.], seq 150918372:150918376, ack 1011612829, win 85, options [nop,nop,TS val 3790782043 ecr 1095487524], length 4
00:00:50.457076 IP 10.0.0.6.1883 > 10.0.0.8.44754: Flags [P.], seq 150918376:150918380, ack 1011612833, win 85, options [nop,nop,TS val 3790782045 ecr 1095487527], length 4
00:00:51.456049 IP 10.0.0.6.1883 > 10.0.0.8.44754: Flags [P.], seq 150918380:150918384, ack 1011613228, win 85, options [nop,nop,TS val 3790783044 ecr 1095488525], length 4
00:00:51.457569 IP 10.0.0.6.1883 > 10.0.0.8.44754: Flags [P.], seq 150918384:150918388, ack 1011613232, win 85, options [nop,nop,TS val 3790783045 ecr 1095488527], length 4
00:00:52.457294 IP 10.0.0.6.1883 > 10.0.0.8.44754: Flags [P.], seq 150918388:150918392, ack 1011613627, win 85, options [nop,nop,TS val 3790784045 ecr 1095489526], length 4
00:00:52.458336 IP 10.0.0.6.1883 > 10.0.0.8.44754: Flags [P.], seq 150918392:150918396, ack 1011613631, win 85, options [nop,nop,TS val 3790784046 ecr 1095489528], length 4
00:00:53.458457 IP 10.0.0.6.1883 > 10.0.0.8.44754: Flags [P.], seq 150918396:150918400, ack 1011614026, win 85, options [nop,nop,TS val 3790785045 ecr 1095490527], length 4
00:00:53.460105 IP 10.0.0.6.1883 > 10.0.0.8.44754: Flags [P.], seq 150918400:150918404, ack 1011614030, win 85, options [nop,nop,TS val 3790785047 ecr 1095490528], length 4
00:00:54.415432 IP 10.0.0.6.1883 > 10.0.0.8.44754: Flags [P.], seq 150918404:150918406, ack 1011614032, win 85, options [nop,nop,TS val 3790786002 ecr 1095491483], length 2
00:00:54.459463 IP 10.0.0.6.1883 > 10.0.0.8.44754: Flags [P.], seq 150918406:150918410, ack 1011614427, win 85, options [nop,nop,TS val 3790786046 ecr 1095491527], length 4
00:00:54.461103 IP 10.0.0.6.1883 > 10.0.0.8.44754: Flags [P.], seq 150918410:150918414, ack 1011614431, win 85, options [nop,nop,TS val 3790786048 ecr 1095491529], length 4
00:00:55.460767 IP 10.0.0.6.1883 > 10.0.0.8.44754: Flags [P.], seq 150918414:150918418, ack 1011614826, win 85, options [nop,nop,TS val 3790787047 ecr 1095492528], length 4
00:00:55.462212 IP 10.0.0.6.1883 > 10.0.0.8.44754: Flags [P.], seq 150918418:150918422, ack 1011614830, win 85, options [nop,nop,TS val 3790787048 ecr 1095492530], length 4
00:00:56.461223 IP 10.0.0.6.1883 > 10.0.0.8.44754: Flags [P.], seq 150918422:150918426, ack 1011615225, win 85, options [nop,nop,TS val 3790788047 ecr 1095493528], length 4
00:00:56.462842 IP 10.0.0.6.1883 > 10.0.0.8.44754: Flags [P.], seq 150918426:150918430, ack 1011615229, win 85, options [nop,nop,TS val 3790788048 ecr 1095493530], length 4
00:00:57.462194 IP 10.0.0.6.1883 > 10.0.0.8.44754: Flags [P.], seq 150918430:150918434, ack 1011615624, win 85, options [nop,nop,TS val 3790789047 ecr 1095494528], length 4
00:00:57.463667 IP 10.0.0.6.1883 > 10.0.0.8.44754: Flags [P.], seq 150918434:150918438, ack 1011615628, win 85, options [nop,nop,TS val 3790789049 ecr 1095494530], length 4
00:00:58.463177 IP 10.0.0.6.1883 > 10.0.0.8.44754: Flags [P.], seq 150918438:150918442, ack 1011616023, win 85, options [nop,nop,TS val 3790790048 ecr 1095495529], length 4
00:00:58.464870 IP 10.0.0.6.1883 > 10.0.0.8.44754: Flags [P.], seq 150918442:150918446, ack 1011616027, win 85, options [nop,nop,TS val 3790790049 ecr 1095495530], length 4
00:00:59.417596 IP 10.0.0.6.1883 > 10.0.0.8.44754: Flags [P.], seq 150918446:150918448, ack 1011616029, win 85, options [nop,nop,TS val 3790791002 ecr 1095496483], length 2
00:00:59.464345 IP 10.0.0.6.1883 > 10.0.0.8.44754: Flags [P.], seq 150918448:150918452, ack 1011616424, win 85, options [nop,nop,TS val 3790791048 ecr 1095496530], length 4
00:00:59.465844 IP 10.0.0.6.1883 > 10.0.0.8.44754: Flags [P.], seq 150918452:150918456, ack 1011616428, win 85, options [nop,nop,TS val 3790791050 ecr 1095496531], length 4
00:01:00.482944 IP 10.0.0.6.1883 > 10.0.0.8.44754: Flags [P.], seq 150918456:150918460, ack 1011616823, win 85, options [nop,nop,TS val 3790792066 ecr 1095497548], length 4
00:01:00.485445 IP 10.0.0.6.1883 > 10.0.0.8.44754: Flags [P.], seq 150918460:150918464, ack 1011616827, win 85, options [nop,nop,TS val 3790792069 ecr 1095497549], length 4
00:01:01.483792 IP 10.0.0.6.1883 > 10.0.0.8.44754: Flags [P.], seq 150918464:150918468, ack 1011617222, win 85, options [nop,nop,TS val 3790793067 ecr 1095498548], length 4
00:01:01.485078 IP 10.0.0.6.1883 > 10.0.0.8.44754: Flags [P.], seq 150918468:150918472, ack 1011617226, win 85, options [nop,nop,TS val 3790793068 ecr 1095498549], length 4
00:01:02.486000 IP 10.0.0.6.1883 > 10.0.0.8.44754: Flags [P.], seq 150918472:150918476, ack 1011617621, win 85, options [nop,nop,TS val 3790794068 ecr 1095499549], length 4
00:01:02.487327 IP 10.0.0.6.1883 > 10.0.0.8.44754: Flags [P.], seq 150918476:150918480, ack 1011617625, win 85, options [nop,nop,TS val 3790794070 ecr 1095499551], length 4
00:01:03.493150 IP 10.0.0.6.1883 > 10.0.0.8.44754: Flags [P.], seq 150918480:150918484, ack 1011618020, win 85, options [nop,nop,TS val 3790795075 ecr 1095500556], length 4
00:01:03.493996 IP 10.0.0.6.1883 > 10.0.0.8.44754: Flags [P.], seq 150918484:150918488, ack 1011618024, win 85, options [nop,nop,TS val 3790795076 ecr 1095500558], length 4
00:01:04.418546 IP 10.0.0.6.1883 > 10.0.0.8.44754: Flags [P.], seq 150918488:150918490, ack 1011618026, win 85, options [nop,nop,TS val 3790796000 ecr 1095501482], length 2
00:01:04.493841 IP 10.0.0.6.1883 > 10.0.0.8.44754: Flags [P.], seq 150918490:150918494, ack 1011618421, win 85, options [nop,nop,TS val 3790796075 ecr 1095501556], length 4
00:01:04.495237 IP 10.0.0.6.1883 > 10.0.0.8.44754: Flags [P.], seq 150918494:150918498, ack 1011618425, win 85, options [nop,nop,TS val 3790796077 ecr 1095501558], length 4
00:01:05.494747 IP 10.0.0.6.1883 > 10.0.0.8.44754: Flags [P.], seq 150918498:150918502, ack 1011618820, win 85, options [nop,nop,TS val 3790797076 ecr 1095502557], length 4
00:01:05.495998 IP 10.0.0.6.1883 > 10.0.0.8.44754: Flags [P.], seq 150918502:150918506, ack 1011618824, win 85, options [nop,nop,TS val 3790797077 ecr 1095502558], length 4
00:01:06.495323 IP 10.0.0.6.1883 > 10.0.0.8.44754: Flags [P.], seq 150918506:150918510, ack 1011619219, win 85, options [nop,nop,TS val 3790798076 ecr 1095503557], length 4
00:01:06.496856 IP 10.0.0.6.1883 > 10.0.0.8.44754: Flags [P.], seq 150918510:150918514, ack 1011619223, win 85, options [nop,nop,TS val 3790798077 ecr 1095503559], length 4
00:01:07.496719 IP 10.0.0.6.1883 > 10.0.0.8.44754: Flags [P.], seq 150918514:150918518, ack 1011619618, win 85, options [nop,nop,TS val 3790799077 ecr 1095504558], length 4
00:01:07.498269 IP 10.0.0.6.1883 > 10.0.0.8.44754: Flags [P.], seq 150918518:150918522, ack 1011619622, win 85, options [nop,nop,TS val 3790799078 ecr 1095504560], length 4
00:01:08.497904 IP 10.0.0.6.1883 > 10.0.0.8.44754: Flags [P.], seq 150918522:150918526, ack 1011620017, win 85, options [nop,nop,TS val 3790800077 ecr 1095505559], length 4
00:01:08.499212 IP 10.0.0.6.1883 > 10.0.0.8.44754: Flags [P.], seq 150918526:150918530, ack 1011620021, win 85, options [nop,nop,TS val 3790800079 ecr 1095505560], length 4
00:01:09.420352 IP 10.0.0.6.1883 > 10.0.0.8.44754: Flags [P.], seq 150918530:150918532, ack 1011620023, win 85, options [nop,nop,TS val 3790800999 ecr 1095506481], length 2
00:01:09.499504 IP 10.0.0.6.1883 > 10.0.0.8.44754: Flags [P.], seq 150918532:150918536, ack 1011620418, win 85, options [nop,nop,TS val 3790801078 ecr 1095506560], length 4
00:01:09.501226 IP 10.0.0.6.1883 > 10.0.0.8.44754: Flags [P.], seq 150918536:150918540, ack 1011620422, win 85, options [nop,nop,TS val 3790801080 ecr 1095506562], length 4
00:01:10.500963 IP 10.0.0.6.1883 > 10.0.0.8.44754: Flags [P.], seq 150918540:150918544, ack 1011620817, win 85, options [nop,nop,TS val 3790802080 ecr 1095507560], length 4
00:01:10.502513 IP 10.0.0.6.1883 > 10.0.0.8.44754: Flags [P.], seq 150918544:150918548, ack 1011620821, win 85, options [nop,nop,TS val 3790802081 ecr 1095507562], length 4
00:01:11.501227 IP 10.0.0.6.1883 > 10.0.0.8.44754: Flags [P.], seq 150918548:150918552, ack 1011621216, win 85, options [nop,nop,TS val 3790803079 ecr 1095508560], length 4
00:01:11.502711 IP 10.0.0.6.1883 > 10.0.0.8.44754: Flags [P.], seq 150918552:150918556, ack 1011621220, win 85, options [nop,nop,TS val 3790803081 ecr 1095508563], length 4
00:01:12.502828 IP 10.0.0.6.1883 > 10.0.0.8.44754: Flags [P.], seq 150918556:150918560, ack 1011621615, win 85, options [nop,nop,TS val 3790804080 ecr 1095509561], length 4
00:01:12.504467 IP 10.0.0.6.1883 > 10.0.0.8.44754: Flags [P.], seq 150918560:150918564, ack 1011621619, win 85, options [nop,nop,TS val 3790804082 ecr 1095509563], length 4
00:01:13.504638 IP 10.0.0.6.1883 > 10.0.0.8.44754: Flags [P.], seq 150918564:150918568, ack 1011622014, win 85, options [nop,nop,TS val 3790805082 ecr 1095510562], length 4
00:01:13.506059 IP 10.0.0.6.1883 > 10.0.0.8.44754: Flags [P.], seq 150918568:150918572, ack 1011622018, win 85, options [nop,nop,TS val 3790805083 ecr 1095510564], length 4
00:01:14.420951 IP 10.0.0.6.1883 > 10.0.0.8.44754: Flags [P.], seq 150918572:150918574, ack 1011622020, win 85, options [nop,nop,TS val 3790805997 ecr 1095511479], length 2
00:01:14.505238 IP 10.0.0.6.1883 > 10.0.0.8.44754: Flags [P.], seq 150918574:150918578, ack 1011622415, win 85, options [nop,nop,TS val 3790806082 ecr 1095511563], length 4
00:01:14.506953 IP 10.0.0.6.1883 > 10.0.0.8.44754: Flags [P.], seq 150918578:150918582, ack 1011622419, win 85, options [nop,nop,TS val 3790806083 ecr 1095511565], length 4
00:01:15.506655 IP 10.0.0.6.1883 > 10.0.0.8.44754: Flags [P.], seq 150918582:150918586, ack 1011622814, win 85, options [nop,nop,TS val 3790807083 ecr 1095512564], length 4
00:01:15.508098 IP 10.0.0.6.1883 > 10.0.0.8.44754: Flags [P.], seq 150918586:150918590, ack 1011622818, win 85, options [nop,nop,TS val 3790807084 ecr 1095512566], length 4
00:01:16.507762 IP 10.0.0.6.1883 > 10.0.0.8.44754: Flags [P.], seq 150918590:150918594, ack 1011623213, win 85, options [nop,nop,TS val 3790808083 ecr 1095513564], length 4
00:01:16.509500 IP 10.0.0.6.1883 > 10.0.0.8.44754: Flags [P.], seq 150918594:150918598, ack 1011623217, win 85, options [nop,nop,TS val 3790808085 ecr 1095513566], length 4
00:01:17.509347 IP 10.0.0.6.1883 > 10.0.0.8.44754: Flags [P.], seq 150918598:150918602, ack 1011623612, win 85, options [nop,nop,TS val 3790809084 ecr 1095514565], length 4
00:01:17.511188 IP 10.0.0.6.1883 > 10.0.0.8.44754: Flags [P.], seq 150918602:150918606, ack 1011623616, win 85, options [nop,nop,TS val 3790809086 ecr 1095514567], length 4
00:01:18.509945 IP 10.0.0.6.1883 > 10.0.0.8.44754: Flags [P.], seq 150918606:150918610, ack 1011624011, win 85, options [nop,nop,TS val 3790810084 ecr 1095515565], length 4
00:01:18.511309 IP 10.0.0.6.1883 > 10.0.0.8.44754: Flags [P.], seq 150918610:150918614, ack 1011624015, win 85, options [nop,nop,TS val 3790810086 ecr 1095515567], length 4
00:01:19.425444 IP 10.0.0.6.1883 > 10.0.0.8.44754: Flags [P.], seq 150918614:150918616, ack 1011624017, win 85, options [nop,nop,TS val 3790810999 ecr 1095516481], length 2
00:01:19.511816 IP 10.0.0.6.1883 > 10.0.0.8.44754: Flags [P.], seq 150918616:150918620, ack 1011624412, win 85, options [nop,nop,TS val 3790811086 ecr 1095516567], length 4
00:01:19.513376 IP 10.0.0.6.1883 > 10.0.0.8.44754: Flags [P.], seq 150918620:150918624, ack 1011624416, win 85, options [nop,nop,TS val 3790811087 ecr 1095516569], length 4
00:01:20.513872 IP 10.0.0.6.1883 > 10.0.0.8.44754: Flags [P.], seq 150918624:150918628, ack 1011624811, win 85, options [nop,nop,TS val 3790812087 ecr 1095517568], length 4
00:01:20.515156 IP 10.0.0.6.1883 > 10.0.0.8.44754: Flags [P.], seq 150918628:150918632, ack 1011624815, win 85, options [nop,nop,TS val 3790812089 ecr 1095517570], length 4
00:01:21.515858 IP 10.0.0.6.1883 > 10.0.0.8.44754: Flags [P.], seq 150918632:150918636, ack 1011625210, win 85, options [nop,nop,TS val 3790813089 ecr 1095518570], length 4
00:01:21.517321 IP 10.0.0.6.1883 > 10.0.0.8.44754: Flags [P.], seq 150918636:150918640, ack 1011625214, win 85, options [nop,nop,TS val 3790813090 ecr 1095518572], length 4
00:01:22.517729 IP 10.0.0.6.1883 > 10.0.0.8.44754: Flags [P.], seq 150918640:150918644, ack 1011625609, win 85, options [nop,nop,TS val 3790814090 ecr 1095519571], length 4
00:01:22.519648 IP 10.0.0.6.1883 > 10.0.0.8.44754: Flags [P.], seq 150918644:150918648, ack 1011625613, win 85, options [nop,nop,TS val 3790814092 ecr 1095519573], length 4
00:01:23.518506 IP 10.0.0.6.1883 > 10.0.0.8.44754: Flags [P.], seq 150918648:150918652, ack 1011626008, win 85, options [nop,nop,TS val 3790815090 ecr 1095520571], length 4
00:01:23.519986 IP 10.0.0.6.1883 > 10.0.0.8.44754: Flags [P.], seq 150918652:150918656, ack 1011626012, win 85, options [nop,nop,TS val 3790815092 ecr 1095520573], length 4
00:01:24.428280 IP 10.0.0.6.1883 > 10.0.0.8.44754: Flags [P.], seq 150918656:150918658, ack 1011626014, win 85, options [nop,nop,TS val 3790816000 ecr 1095521481], length 2
00:01:24.518849 IP 10.0.0.6.1883 > 10.0.0.8.44754: Flags [P.], seq 150918658:150918662, ack 1011626409, win 85, options [nop,nop,TS val 3790816090 ecr 1095521572], length 4
00:01:24.520360 IP 10.0.0.6.1883 > 10.0.0.8.44754: Flags [P.], seq 150918662:150918666, ack 1011626413, win 85, options [nop,nop,TS val 3790816092 ecr 1095521573], length 4
00:01:25.521556 IP 10.0.0.6.1883 > 10.0.0.8.44754: Flags [P.], seq 150918666:150918670, ack 1011626808, win 85, options [nop,nop,TS val 3790817092 ecr 1095522573], length 4
00:01:25.523112 IP 10.0.0.6.1883 > 10.0.0.8.44754: Flags [P.], seq 150918670:150918674, ack 1011626812, win 85, options [nop,nop,TS val 3790817094 ecr 1095522576], length 4
00:01:26.536021 IP 10.0.0.6.1883 > 10.0.0.8.44754: Flags [P.], seq 150918674:150918678, ack 1011627207, win 85, options [nop,nop,TS val 3790818107 ecr 1095523587], length 4
00:01:26.537809 IP 10.0.0.6.1883 > 10.0.0.8.44754: Flags [P.], seq 150918678:150918682, ack 1011627211, win 85, options [nop,nop,TS val 3790818108 ecr 1095523589], length 4
00:01:27.541009 IP 10.0.0.6.1883 > 10.0.0.8.44754: Flags [P.], seq 150918682:150918686, ack 1011627606, win 85, options [nop,nop,TS val 3790819110 ecr 1095524589], length 4
00:01:27.544384 IP 10.0.0.6.1883 > 10.0.0.8.44754: Flags [P.], seq 150918686:150918690, ack 1011627610, win 85, options [nop,nop,TS val 3790819114 ecr 1095524595], length 4
00:01:27.837599 IP 10.0.0.6.1883 > 10.0.0.8.44754: Flags [P.], seq 150918686:150918690, ack 1011627610, win 85, options [nop,nop,TS val 3790819407 ecr 1095524595], length 4
00:01:28.904444 IP 10.0.0.6.1883 > 10.0.0.8.44754: Flags [P.], seq 150918690:150918694, ack 1011628005, win 85, options [nop,nop,TS val 3790820471 ecr 1095525951], length 4
00:01:28.916988 IP 10.0.0.6.1883 > 10.0.0.8.44754: Flags [P.], seq 150918694:150918698, ack 1011628009, win 85, options [nop,nop,TS val 3790820486 ecr 1095525968], length 4
00:01:29.430013 IP 10.0.0.6.1883 > 10.0.0.8.44754: Flags [P.], seq 150918698:150918700, ack 1011628011, win 85, options [nop,nop,TS val 3790820999 ecr 1095526480], length 2
00:01:29.902807 IP 10.0.0.6.1883 > 10.0.0.8.44754: Flags [P.], seq 150918700:150918704, ack 1011628406, win 85, options [nop,nop,TS val 3790821471 ecr 1095526952], length 4
00:01:29.905009 IP 10.0.0.6.1883 > 10.0.0.8.44754: Flags [P.], seq 150918704:150918708, ack 1011628410, win 85, options [nop,nop,TS val 3790821474 ecr 1095526955], length 4
00:01:30.902839 IP 10.0.0.6.1883 > 10.0.0.8.44754: Flags [P.], seq 150918708:150918712, ack 1011628805, win 85, options [nop,nop,TS val 3790822471 ecr 1095527952], length 4
00:01:30.904651 IP 10.0.0.6.1883 > 10.0.0.8.44754: Flags [P.], seq 150918712:150918716, ack 1011628809, win 85, options [nop,nop,TS val 3790822473 ecr 1095527955], length 4
00:01:31.904845 IP 10.0.0.6.1883 > 10.0.0.8.44754: Flags [P.], seq 150918716:150918720, ack 1011629204, win 85, options [nop,nop,TS val 3790823473 ecr 1095528953], length 4
00:01:31.906247 IP 10.0.0.6.1883 > 10.0.0.8.44754: Flags [P.], seq 150918720:150918724, ack 1011629208, win 85, options [nop,nop,TS val 3790823474 ecr 1095528955], length 4
00:01:32.905785 IP 10.0.0.6.1883 > 10.0.0.8.44754: Flags [P.], seq 150918724:150918728, ack 1011629603, win 85, options [nop,nop,TS val 3790824473 ecr 1095529954], length 4
00:01:32.906972 IP 10.0.0.6.1883 > 10.0.0.8.44754: Flags [P.], seq 150918728:150918732, ack 1011629607, win 85, options [nop,nop,TS val 3790824474 ecr 1095529956], length 4
00:01:33.908404 IP 10.0.0.6.1883 > 10.0.0.8.44754: Flags [P.], seq 150918732:150918736, ack 1011630002, win 85, options [nop,nop,TS val 3790825475 ecr 1095530956], length 4
00:01:33.910134 IP 10.0.0.6.1883 > 10.0.0.8.44754: Flags [P.], seq 150918736:150918740, ack 1011630006, win 85, options [nop,nop,TS val 3790825477 ecr 1095530958], length 4
00:01:34.432049 IP 10.0.0.6.1883 > 10.0.0.8.44754: Flags [P.], seq 150918740:150918742, ack 1011630008, win 85, options [nop,nop,TS val 3790825999 ecr 1095531480], length 2
00:01:34.908684 IP 10.0.0.6.1883 > 10.0.0.8.44754: Flags [P.], seq 150918742:150918746, ack 1011630403, win 85, options [nop,nop,TS val 3790826475 ecr 1095531957], length 4
00:01:34.909462 IP 10.0.0.6.1883 > 10.0.0.8.44754: Flags [P.], seq 150918746:150918750, ack 1011630407, win 85, options [nop,nop,TS val 3790826476 ecr 1095531957], length 4
00:01:35.913636 IP 10.0.0.6.1883 > 10.0.0.8.44754: Flags [P.], seq 150918750:150918754, ack 1011630802, win 85, options [nop,nop,TS val 3790827479 ecr 1095532960], length 4
00:01:35.915355 IP 10.0.0.6.1883 > 10.0.0.8.44754: Flags [P.], seq 150918754:150918758, ack 1011630806, win 85, options [nop,nop,TS val 3790827481 ecr 1095532963], length 4
00:01:36.914610 IP 10.0.0.6.1883 > 10.0.0.8.44754: Flags [P.], seq 150918758:150918762, ack 1011631201, win 85, options [nop,nop,TS val 3790828480 ecr 1095533961], length 4
00:01:36.916734 IP 10.0.0.6.1883 > 10.0.0.8.44754: Flags [P.], seq 150918762:150918766, ack 1011631205, win 85, options [nop,nop,TS val 3790828482 ecr 1095533963], length 4
00:01:37.915792 IP 10.0.0.6.1883 > 10.0.0.8.44754: Flags [P.], seq 150918766:150918770, ack 1011631600, win 85, options [nop,nop,TS val 3790829481 ecr 1095534962], length 4
00:01:37.917082 IP 10.0.0.6.1883 > 10.0.0.8.44754: Flags [P.], seq 150918770:150918774, ack 1011631604, win 85, options [nop,nop,TS val 3790829482 ecr 1095534963], length 4
00:01:38.918001 IP 10.0.0.6.1883 > 10.0.0.8.44754: Flags [P.], seq 150918774:150918778, ack 1011631999, win 85, options [nop,nop,TS val 3790830482 ecr 1095535963], length 4
00:01:38.919726 IP 10.0.0.6.1883 > 10.0.0.8.44754: Flags [P.], seq 150918778:150918782, ack 1011632003, win 85, options [nop,nop,TS val 3790830484 ecr 1095535965], length 4
00:01:39.433750 IP 10.0.0.6.1883 > 10.0.0.8.44754: Flags [P.], seq 150918782:150918784, ack 1011632005, win 85, options [nop,nop,TS val 3790830998 ecr 1095536479], length 2
00:01:39.919375 IP 10.0.0.6.1883 > 10.0.0.8.44754: Flags [P.], seq 150918784:150918788, ack 1011632400, win 85, options [nop,nop,TS val 3790831483 ecr 1095536964], length 4
00:01:39.920863 IP 10.0.0.6.1883 > 10.0.0.8.44754: Flags [P.], seq 150918788:150918792, ack 1011632404, win 85, options [nop,nop,TS val 3790831485 ecr 1095536966], length 4
00:01:40.929365 IP 10.0.0.6.1883 > 10.0.0.8.44754: Flags [P.], seq 150918792:150918796, ack 1011632799, win 85, options [nop,nop,TS val 3790832493 ecr 1095537974], length 4
00:01:40.931163 IP 10.0.0.6.1883 > 10.0.0.8.44754: Flags [P.], seq 150918796:150918800, ack 1011632803, win 85, options [nop,nop,TS val 3790832494 ecr 1095537976], length 4
00:01:41.930862 IP 10.0.0.6.1883 > 10.0.0.8.44754: Flags [P.], seq 150918800:150918804, ack 1011633198, win 85, options [nop,nop,TS val 3790833494 ecr 1095538975], length 4
00:01:41.933114 IP 10.0.0.6.1883 > 10.0.0.8.44754: Flags [P.], seq 150918804:150918808, ack 1011633202, win 85, options [nop,nop,TS val 3790833496 ecr 1095538977], length 4
00:01:42.932689 IP 10.0.0.6.1883 > 10.0.0.8.44754: Flags [P.], seq 150918808:150918812, ack 1011633597, win 85, options [nop,nop,TS val 3790834495 ecr 1095539976], length 4
00:01:42.934467 IP 10.0.0.6.1883 > 10.0.0.8.44754: Flags [P.], seq 150918812:150918816, ack 1011633601, win 85, options [nop,nop,TS val 3790834497 ecr 1095539978], length 4
00:01:43.933694 IP 10.0.0.6.1883 > 10.0.0.8.44754: Flags [P.], seq 150918816:150918820, ack 1011633996, win 85, options [nop,nop,TS val 3790835495 ecr 1095540976], length 4
00:01:43.935480 IP 10.0.0.6.1883 > 10.0.0.8.44754: Flags [P.], seq 150918820:150918824, ack 1011634000, win 85, options [nop,nop,TS val 3790835497 ecr 1095540979], length 4
00:01:44.443486 IP 10.0.0.6.1883 > 10.0.0.8.44754: Flags [P.], seq 150918824:150918826, ack 1011634002, win 85, options [nop,nop,TS val 3790836005 ecr 1095541486], length 2
00:01:44.934597 IP 10.0.0.6.1883 > 10.0.0.8.44754: Flags [P.], seq 150918826:150918830, ack 1011634397, win 85, options [nop,nop,TS val 3790836496 ecr 1095541977], length 4
00:01:44.936265 IP 10.0.0.6.1883 > 10.0.0.8.44754: Flags [P.], seq 150918830:150918834, ack 1011634401, win 85, options [nop,nop,TS val 3790836497 ecr 1095541978], length 4
00:01:45.936000 IP 10.0.0.6.1883 > 10.0.0.8.44754: Flags [P.], seq 150918834:150918838, ack 1011634796, win 85, options [nop,nop,TS val 3790837497 ecr 1095542978], length 4
00:01:45.937689 IP 10.0.0.6.1883 > 10.0.0.8.44754: Flags [P.], seq 150918838:150918842, ack 1011634800, win 85, options [nop,nop,TS val 3790837498 ecr 1095542979], length 4
00:01:46.938222 IP 10.0.0.6.1883 > 10.0.0.8.44754: Flags [P.], seq 150918842:150918846, ack 1011635195, win 85, options [nop,nop,TS val 3790838498 ecr 1095543979], length 4
00:01:46.940134 IP 10.0.0.6.1883 > 10.0.0.8.44754: Flags [P.], seq 150918846:150918850, ack 1011635199, win 85, options [nop,nop,TS val 3790838500 ecr 1095543982], length 4
00:01:47.939880 IP 10.0.0.6.1883 > 10.0.0.8.44754: Flags [P.], seq 150918850:150918854, ack 1011635594, win 85, options [nop,nop,TS val 3790839500 ecr 1095544981], length 4
00:01:47.941477 IP 10.0.0.6.1883 > 10.0.0.8.44754: Flags [P.], seq 150918854:150918858, ack 1011635598, win 85, options [nop,nop,TS val 3790839501 ecr 1095544983], length 4
00:01:48.941953 IP 10.0.0.6.1883 > 10.0.0.8.44754: Flags [P.], seq 150918858:150918862, ack 1011635993, win 85, options [nop,nop,TS val 3790840501 ecr 1095545982], length 4
00:01:48.943888 IP 10.0.0.6.1883 > 10.0.0.8.44754: Flags [P.], seq 150918862:150918866, ack 1011635997, win 85, options [nop,nop,TS val 3790840503 ecr 1095545984], length 4
00:01:49.445262 IP 10.0.0.6.1883 > 10.0.0.8.44754: Flags [P.], seq 150918866:150918868, ack 1011635999, win 85, options [nop,nop,TS val 3790841004 ecr 1095546486], length 2
00:01:51.349063 IP 10.0.0.6.1883 > 10.0.0.8.44754: Flags [F.], seq 150918868, ack 1011636000, win 85, options [nop,nop,TS val 3790842907 ecr 1095548388], length 0