00:00:00.196166 IP 10.0.0.6.1883 > 10.0.0.11.33524: Flags [S.], seq 2935243003, ack 3664464587, win 43440, options [mss 1460,sackOK,TS val 2016598441 ecr 3459724218,nop,wscale 9], length 0
00:00:00.351742 IP 10.0.0.6.1883 > 10.0.0.11.33524: Flags [.], ack 3664464607, win 85, options [nop,nop,TS val 2016598597 ecr 3459724572], length 0
00:00:00.352405 IP 10.0.0.6.1883 > 10.0.0.11.33524: Flags [P.], seq 2935243004:2935243008, ack 3664464607, win 85, options [nop,nop,TS val 2016598598 ecr 3459724572], length 4
00:00:00.480331 IP 10.0.0.6.1883 > 10.0.0.11.33524: Flags [P.], seq 2935243008:2935243073, ack 3664464671, win 85, options [nop,nop,TS val 2016598724 ecr 3459724702], length 65
00:00:00.618947 IP 10.0.0.6.1883 > 10.0.0.11.33524: Flags [P.], seq 2935243073:2935243078, ack 3664465066, win 85, options [nop,nop,TS val 2016598864 ecr 3459724840], length 5
00:00:00.790634 IP 10.0.0.6.1883 > 10.0.0.11.33524: Flags [P.], seq 2935243078:2935243082, ack 3664465066, win 85, options [nop,nop,TS val 2016599032 ecr 3459725008], length 4
00:00:00.912793 IP 10.0.0.6.1883 > 10.0.0.11.33524: Flags [P.], seq 2935243082:2935243086, ack 3664465070, win 85, options [nop,nop,TS val 2016599158 ecr 3459725137], length 4
00:00:01.034955 IP 10.0.0.6.1883 > 10.0.0.11.33524: Flags [P.], seq 2935243086:2935243090, ack 3664465465, win 85, options [nop,nop,TS val 2016599280 ecr 3459725259], length 4
00:00:01.162783 IP 10.0.0.6.1883 > 10.0.0.11.33524: Flags [P.], seq 2935243090:2935243094, ack 3664465469, win 85, options [nop,nop,TS val 2016599408 ecr 3459725387], length 4
00:00:02.035006 IP 10.0.0.6.1883 > 10.0.0.11.33524: Flags [P.], seq 2935243094:2935243098, ack 3664465864, win 85, options [nop,nop,TS val 2016600278 ecr 3459726256], length 4
00:00:02.157238 IP 10.0.0.6.1883 > 10.0.0.11.33524: Flags [P.], seq 2935243098:2935243102, ack 3664465868, win 85, options [nop,nop,TS val 2016600403 ecr 3459726382], length 4
00:00:03.035832 IP 10.0.0.6.1883 > 10.0.0.11.33524: Flags [P.], seq 2935243102:2935243106, ack 3664466263, win 85, options [nop,nop,TS val 2016601281 ecr 3459727260], length 4
00:00:03.162256 IP 10.0.0.6.1883 > 10.0.0.11.33524: Flags [P.], seq 2935243106:2935243110, ack 3664466267, win 85, options [nop,nop,TS val 2016601407 ecr 3459727386], length 4
00:00:04.053510 IP 10.0.0.6.1883 > 10.0.0.11.33524: Flags [P.], seq 2935243110:2935243114, ack 3664466662, win 85, options [nop,nop,TS val 2016602299 ecr 3459728276], length 4
00:00:04.183958 IP 10.0.0.6.1883 > 10.0.0.11.33524: Flags [P.], seq 2935243114:2935243118, ack 3664466666, win 85, options [nop,nop,TS val 2016602429 ecr 3459728401], length 4
00:00:05.055927 IP 10.0.0.6.1883 > 10.0.0.11.33524: Flags [P.], seq 2935243118:2935243122, ack 3664467061, win 85, options [nop,nop,TS val 2016603301 ecr 3459729278], length 4
00:00:05.191946 IP 10.0.0.6.1883 > 10.0.0.11.33524: Flags [P.], seq 2935243122:2935243126, ack 3664467065, win 85, options [nop,nop,TS val 2016603435 ecr 3459729402], length 4
00:00:05.484305 IP 10.0.0.6.1883 > 10.0.0.11.33524: Flags [P.], seq 2935243126:2935243128, ack 3664467067, win 85, options [nop,nop,TS val 2016603729 ecr 3459729703], length 2
00:00:06.055438 IP 10.0.0.6.1883 > 10.0.0.11.33524: Flags [P.], seq 2935243128:2935243132, ack 3664467462, win 85, options [nop,nop,TS val 2016604301 ecr 3459730279], length 4
00:00:06.177497 IP 10.0.0.6.1883 > 10.0.0.11.33524: Flags [P.], seq 2935243132:2935243136, ack 3664467466, win 85, options [nop,nop,TS val 2016604423 ecr 3459730402], length 4
00:00:07.060003 IP 10.0.0.6.1883 > 10.0.0.11.33524: Flags [P.], seq 2935243136:2935243140, ack 3664467861, win 85, options [nop,nop,TS val 2016605305 ecr 3459731280], length 4
00:00:07.182551 IP 10.0.0.6.1883 > 10.0.0.11.33524: Flags [P.], seq 2935243140:2935243144, ack 3664467865, win 85, options [nop,nop,TS val 2016605428 ecr 3459731407], length 4
00:00:08.057665 IP 10.0.0.6.1883 > 10.0.0.11.33524: Flags [P.], seq 2935243144:2935243148, ack 3664468260, win 85, options [nop,nop,TS val 2016606303 ecr 3459732281], length 4
00:00:08.180236 IP 10.0.0.6.1883 > 10.0.0.11.33524: Flags [P.], seq 2935243148:2935243152, ack 3664468264, win 85, options [nop,nop,TS val 2016606425 ecr 3459732404], length 4
00:00:09.059010 IP 10.0.0.6.1883 > 10.0.0.11.33524: Flags [P.], seq 2935243152:2935243156, ack 3664468659, win 85, options [nop,nop,TS val 2016607304 ecr 3459733283], length 4
00:00:09.198088 IP 10.0.0.6.1883 > 10.0.0.11.33524: Flags [P.], seq 2935243156:2935243160, ack 3664468663, win 85, options [nop,nop,TS val 2016607441 ecr 3459733405], length 4
00:00:10.059990 IP 10.0.0.6.1883 > 10.0.0.11.33524: Flags [P.], seq 2935243160:2935243164, ack 3664469058, win 85, options [nop,nop,TS val 2016608305 ecr 3459734284], length 4
00:00:10.199273 IP 10.0.0.6.1883 > 10.0.0.11.33524: Flags [P.], seq 2935243164:2935243168, ack 3664469062, win 85, options [nop,nop,TS val 2016608439 ecr 3459734407], length 4
00:00:10.490848 IP 10.0.0.6.1883 > 10.0.0.11.33524: Flags [P.], seq 2935243168:2935243170, ack 3664469064, win 85, options [nop,nop,TS val 2016608736 ecr 3459734704], length 2
00:00:11.061451 IP 10.0.0.6.1883 > 10.0.0.11.33524: Flags [P.], seq 2935243170:2935243174, ack 3664469459, win 85, options [nop,nop,TS val 2016609307 ecr 3459735285], length 4
00:00:11.183458 IP 10.0.0.6.1883 > 10.0.0.11.33524: Flags [P.], seq 2935243174:2935243178, ack 3664469463, win 85, options [nop,nop,TS val 2016609429 ecr 3459735408], length 4
00:00:12.062977 IP 10.0.0.6.1883 > 10.0.0.11.33524: Flags [P.], seq 2935243178:2935243182, ack 3664469858, win 85, options [nop,nop,TS val 2016610308 ecr 3459736287], length 4
00:00:12.184775 IP 10.0.0.6.1883 > 10.0.0.11.33524: Flags [P.], seq 2935243182:2935243186, ack 3664469862, win 85, options [nop,nop,TS val 2016610430 ecr 3459736409], length 4
00:00:13.064196 IP 10.0.0.6.1883 > 10.0.0.11.33524: Flags [P.], seq 2935243186:2935243190, ack 3664470257, win 85, options [nop,nop,TS val 2016611310 ecr 3459737288], length 4
00:00:13.189387 IP 10.0.0.6.1883 > 10.0.0.11.33524: Flags [P.], seq 2935243190:2935243194, ack 3664470261, win 85, options [nop,nop,TS val 2016611434 ecr 3459737410], length 4
00:00:14.065716 IP 10.0.0.6.1883 > 10.0.0.11.33524: Flags [P.], seq 2935243194:2935243198, ack 3664470656, win 85, options [nop,nop,TS val 2016612311 ecr 3459738289], length 4
00:00:14.187394 IP 10.0.0.6.1883 > 10.0.0.11.33524: Flags [P.], seq 2935243198:2935243202, ack 3664470660, win 85, options [nop,nop,TS val 2016612433 ecr 3459738412], length 4
00:00:15.068169 IP 10.0.0.6.1883 > 10.0.0.11.33524: Flags [P.], seq 2935243202:2935243206, ack 3664471055, win 85, options [nop,nop,TS val 2016613313 ecr 3459739290], length 4
00:00:15.192841 IP 10.0.0.6.1883 > 10.0.0.11.33524: Flags [P.], seq 2935243206:2935243210, ack 3664471059, win 85, options [nop,nop,TS val 2016613436 ecr 3459739414], length 4
00:00:15.490724 IP 10.0.0.6.1883 > 10.0.0.11.33524: Flags [P.], seq 2935243210:2935243212, ack 3664471061, win 85, options [nop,nop,TS val 2016613736 ecr 3459739706], length 2
00:00:16.068462 IP 10.0.0.6.1883 > 10.0.0.11.33524: Flags [P.], seq 2935243212:2935243216, ack 3664471456, win 85, options [nop,nop,TS val 2016614314 ecr 3459740291], length 4
00:00:16.190753 IP 10.0.0.6.1883 > 10.0.0.11.33524: Flags [P.], seq 2935243216:2935243220, ack 3664471460, win 85, options [nop,nop,TS val 2016614436 ecr 3459740415], length 4
00:00:17.068752 IP 10.0.0.6.1883 > 10.0.0.11.33524: Flags [P.], seq 2935243220:2935243224, ack 3664471855, win 85, options [nop,nop,TS val 2016615314 ecr 3459741292], length 4
00:00:17.191143 IP 10.0.0.6.1883 > 10.0.0.11.33524: Flags [P.], seq 2935243224:2935243228, ack 3664471859, win 85, options [nop,nop,TS val 2016615436 ecr 3459741415], length 4
00:00:18.087791 IP 10.0.0.6.1883 > 10.0.0.11.33524: Flags [P.], seq 2935243228:2935243232, ack 3664472254, win 85, options [nop,nop,TS val 2016616333 ecr 3459742311], length 4
00:00:18.210152 IP 10.0.0.6.1883 > 10.0.0.11.33524: Flags [P.], seq 2935243232:2935243236, ack 3664472258, win 85, options [nop,nop,TS val 2016616455 ecr 3459742434], length 4
00:00:19.088390 IP 10.0.0.6.1883 > 10.0.0.11.33524: Flags [P.], seq 2935243236:2935243240, ack 3664472653, win 85, options [nop,nop,TS val 2016617334 ecr 3459743313], length 4
00:00:19.213497 IP 10.0.0.6.1883 > 10.0.0.11.33524: Flags [P.], seq 2935243240:2935243244, ack 3664472657, win 85, options [nop,nop,TS val 2016617459 ecr 3459743435], length 4
00:00:20.090140 IP 10.0.0.6.1883 > 10.0.0.11.33524: Flags [P.], seq 2935243244:2935243248, ack 3664473052, win 85, options [nop,nop,TS val 2016618336 ecr 3459744314], length 4
00:00:20.214784 IP 10.0.0.6.1883 > 10.0.0.11.33524: Flags [P.], seq 2935243248:2935243252, ack 3664473056, win 85, options [nop,nop,TS val 2016618457 ecr 3459744436], length 4
00:00:20.489375 IP 10.0.0.6.1883 > 10.0.0.11.33524: Flags [P.], seq 2935243252:2935243254, ack 3664473058, win 85, options [nop,nop,TS val 2016618735 ecr 3459744707], length 2
00:00:21.091218 IP 10.0.0.6.1883 > 10.0.0.11.33524: Flags [P.], seq 2935243254:2935243258, ack 3664473453, win 85, options [nop,nop,TS val 2016619337 ecr 3459745315], length 4
00:00:21.215270 IP 10.0.0.6.1883 > 10.0.0.11.33524: Flags [P.], seq 2935243258:2935243262, ack 3664473457, win 85, options [nop,nop,TS val 2016619461 ecr 3459745438], length 4
00:00:22.095688 IP 10.0.0.6.1883 > 10.0.0.11.33524: Flags [P.], seq 2935243262:2935243266, ack 3664473852, win 85, options [nop,nop,TS val 2016620341 ecr 3459746316], length 4
00:00:22.217827 IP 10.0.0.6.1883 > 10.0.0.11.33524: Flags [P.], seq 2935243266:2935243270, ack 3664473856, win 85, options [nop,nop,TS val 2016620463 ecr 3459746442], length 4
00:00:23.094128 IP 10.0.0.6.1883 > 10.0.0.11.33524: Flags [P.], seq 2935243270:2935243274, ack 3664474251, win 85, options [nop,nop,TS val 2016621340 ecr 3459747318], length 4
00:00:23.216783 IP 10.0.0.6.1883 > 10.0.0.11.33524: Flags [P.], seq 2935243274:2935243278, ack 3664474255, win 85, options [nop,nop,TS val 2016621462 ecr 3459747440], length 4
00:00:24.101776 IP 10.0.0.6.1883 > 10.0.0.11.33524: Flags [P.], seq 2935243278:2935243282, ack 3664474650, win 85, options [nop,nop,TS val 2016622347 ecr 3459748320], length 4
00:00:24.230618 IP 10.0.0.6.1883 > 10.0.0.11.33524: Flags [P.], seq 2935243282:2935243286, ack 3664474654, win 85, options [nop,nop,TS val 2016622470 ecr 3459748450], length 4
00:00:25.102554 IP 10.0.0.6.1883 > 10.0.0.11.33524: Flags [P.], seq 2935243286:2935243290, ack 3664475049, win 85, options [nop,nop,TS val 2016623346 ecr 3459749324], length 4
00:00:25.234304 IP 10.0.0.6.1883 > 10.0.0.11.33524: Flags [P.], seq 2935243290:2935243294, ack 3664475053, win 85, options [nop,nop,TS val 2016623479 ecr 3459749458], length 4
00:00:25.504613 IP 10.0.0.6.1883 > 10.0.0.11.33524: Flags [P.], seq 2935243294:2935243296, ack 3664475055, win 85, options [nop,nop,TS val 2016623750 ecr 3459749709], length 2
00:00:26.101183 IP 10.0.0.6.1883 > 10.0.0.11.33524: Flags [P.], seq 2935243296:2935243300, ack 3664475450, win 85, options [nop,nop,TS val 2016624347 ecr 3459750325], length 4
00:00:26.225871 IP 10.0.0.6.1883 > 10.0.0.11.33524: Flags [P.], seq 2935243300:2935243304, ack 3664475454, win 85, options [nop,nop,TS val 2016624471 ecr 3459750447], length 4
00:00:27.104898 IP 10.0.0.6.1883 > 10.0.0.11.33524: Flags [P.], seq 2935243304:2935243308, ack 3664475849, win 85, options [nop,nop,TS val 2016625350 ecr 3459751328], length 4
00:00:27.226915 IP 10.0.0.6.1883 > 10.0.0.11.33524: Flags [P.], seq 2935243308:2935243312, ack 3664475853, win 85, options [nop,nop,TS val 2016625472 ecr 3459751451], length 4
00:00:28.108368 IP 10.0.0.6.1883 > 10.0.0.11.33524: Flags [P.], seq 2935243312:2935243316, ack 3664476248, win 85, options [nop,nop,TS val 2016626354 ecr 3459752329], length 4
00:00:28.233332 IP 10.0.0.6.1883 > 10.0.0.11.33524: Flags [P.], seq 2935243316:2935243320, ack 3664476252, win 85, options [nop,nop,TS val 2016626479 ecr 3459752458], length 4
00:00:29.110597 IP 10.0.0.6.1883 > 10.0.0.11.33524: Flags [P.], seq 2935243320:2935243324, ack 3664476647, win 85, options [nop,nop,TS val 2016627354 ecr 3459753330], length 4
00:00:29.232462 IP 10.0.0.6.1883 > 10.0.0.11.33524: Flags [P.], seq 2935243324:2935243328, ack 3664476651, win 85, options [nop,nop,TS val 2016627478 ecr 3459753457], length 4
00:00:30.110043 IP 10.0.0.6.1883 > 10.0.0.11.33524: Flags [P.], seq 2935243328:2935243332, ack 3664477046, win 85, options [nop,nop,TS val 2016628355 ecr 3459754332], length 4
00:00:30.232099 IP 10.0.0.6.1883 > 10.0.0.11.33524: Flags [P.], seq 2935243332:2935243336, ack 3664477050, win 85, options [nop,nop,TS val 2016628477 ecr 3459754456], length 4
00:00:30.488383 IP 10.0.0.6.1883 > 10.0.0.11.33524: Flags [P.], seq 2935243336:2935243338, ack 3664477052, win 85, options [nop,nop,TS val 2016628734 ecr 3459754711], length 2
00:00:31.108588 IP 10.0.0.6.1883 > 10.0.0.11.33524: Flags [P.], seq 2935243338:2935243342, ack 3664477447, win 85, options [nop,nop,TS val 2016629354 ecr 3459755333], length 4
00:00:31.230983 IP 10.0.0.6.1883 > 10.0.0.11.33524: Flags [P.], seq 2935243342:2935243346, ack 3664477451, win 85, options [nop,nop,TS val 2016629476 ecr 3459755455], length 4
00:00:32.110331 IP 10.0.0.6.1883 > 10.0.0.11.33524: Flags [P.], seq 2935243346:2935243350, ack 3664477846, win 85, options [nop,nop,TS val 2016630356 ecr 3459756334], length 4
00:00:32.235548 IP 10.0.0.6.1883 > 10.0.0.11.33524: Flags [P.], seq 2935243350:2935243354, ack 3664477850, win 85, options [nop,nop,TS val 2016630477 ecr 3459756457], length 4
00:00:33.111564 IP 10.0.0.6.1883 > 10.0.0.11.33524: Flags [P.], seq 2935243354:2935243358, ack 3664478245, win 85, options [nop,nop,TS val 2016631357 ecr 3459757336], length 4
00:00:33.233734 IP 10.0.0.6.1883 > 10.0.0.11.33524: Flags [P.], seq 2935243358:2935243362, ack 3664478249, win 85, options [nop,nop,TS val 2016631479 ecr 3459757458], length 4
00:00:34.112226 IP 10.0.0.6.1883 > 10.0.0.11.33524: Flags [P.], seq 2935243362:2935243366, ack 3664478644, win 85, options [nop,nop,TS val 2016632358 ecr 3459758337], length 4
00:00:34.237138 IP 10.0.0.6.1883 > 10.0.0.11.33524: Flags [P.], seq 2935243366:2935243370, ack 3664478648, win 85, options [nop,nop,TS val 2016632482 ecr 3459758458], length 4
00:00:35.112975 IP 10.0.0.6.1883 > 10.0.0.11.33524: Flags [P.], seq 2935243370:2935243374, ack 3664479043, win 85, options [nop,nop,TS val 2016633359 ecr 3459759338], length 4
00:00:35.240053 IP 10.0.0.6.1883 > 10.0.0.11.33524: Flags [P.], seq 2935243374:2935243378, ack 3664479047, win 85, options [nop,nop,TS val 2016633486 ecr 3459759459], length 4
00:00:35.487375 IP 10.0.0.6.1883 > 10.0.0.11.33524: Flags [P.], seq 2935243378:2935243380, ack 3664479049, win 85, options [nop,nop,TS val 2016633732 ecr 3459759712], length 2
00:00:36.118154 IP 10.0.0.6.1883 > 10.0.0.11.33524: Flags [P.], seq 2935243380:2935243384, ack 3664479444, win 85, options [nop,nop,TS val 2016634360 ecr 3459760339], length 4
00:00:36.240582 IP 10.0.0.6.1883 > 10.0.0.11.33524: Flags [P.], seq 2935243384:2935243388, ack 3664479448, win 85, options [nop,nop,TS val 2016634486 ecr 3459760465], length 4
00:00:37.115925 IP 10.0.0.6.1883 > 10.0.0.11.33524: Flags [P.], seq 2935243388:2935243392, ack 3664479843, win 85, options [nop,nop,TS val 2016635361 ecr 3459761340], length 4
00:00:37.241283 IP 10.0.0.6.1883 > 10.0.0.11.33524: Flags [P.], seq 2935243392:2935243396, ack 3664479847, win 85, options [nop,nop,TS val 2016635486 ecr 3459761465], length 4
00:00:38.121549 IP 10.0.0.6.1883 > 10.0.0.11.33524: Flags [P.], seq 2935243396:2935243400, ack 3664480242, win 85, options [nop,nop,TS val 2016636367 ecr 3459762344], length 4
00:00:38.243329 IP 10.0.0.6.1883 > 10.0.0.11.33524: Flags [P.], seq 2935243400:2935243404, ack 3664480246, win 85, options [nop,nop,TS val 2016636489 ecr 3459762468], length 4
00:00:39.121193 IP 10.0.0.6.1883 > 10.0.0.11.33524: Flags [P.], seq 2935243404:2935243408, ack 3664480641, win 85, options [nop,nop,TS val 2016637367 ecr 3459763346], length 4
00:00:39.247050 IP 10.0.0.6.1883 > 10.0.0.11.33524: Flags [P.], seq 2935243408:2935243412, ack 3664480645, win 85, options [nop,nop,TS val 2016637492 ecr 3459763469], length 4
00:00:40.126204 IP 10.0.0.6.1883 > 10.0.0.11.33524: Flags [P.], seq 2935243412:2935243416, ack 3664481040, win 85, options [nop,nop,TS val 2016638371 ecr 3459764348], length 4
00:00:40.251287 IP 10.0.0.6.1883 > 10.0.0.11.33524: Flags [P.], seq 2935243416:2935243420, ack 3664481044, win 85, options [nop,nop,TS val 2016638497 ecr 3459764476], length 4
00:00:40.488901 IP 10.0.0.6.1883 > 10.0.0.11.33524: Flags [P.], seq 2935243420:2935243422, ack 3664481046, win 85, options [nop,nop,TS val 2016638734 ecr 3459764713], length 2
00:00:41.127079 IP 10.0.0.6.1883 > 10.0.0.11.33524: Flags [P.], seq 2935243422:2935243426, ack 3664481441, win 85, options [nop,nop,TS val 2016639372 ecr 3459765350], length 4
00:00:41.253728 IP 10.0.0.6.1883 > 10.0.0.11.33524: Flags [P.], seq 2935243426:2935243430, ack 3664481445, win 85, options [nop,nop,TS val 2016639499 ecr 3459765478], length 4
00:00:42.127144 IP 10.0.0.6.1883 > 10.0.0.11.33524: Flags [P.], seq 2935243430:2935243434, ack 3664481840, win 85, options [nop,nop,TS val 2016640373 ecr 3459766351], length 4
00:00:42.251806 IP 10.0.0.6.1883 > 10.0.0.11.33524: Flags [P.], seq 2935243434:2935243438, ack 3664481844, win 85, options [nop,nop,TS val 2016640497 ecr 3459766476], length 4
00:00:43.129513 IP 10.0.0.6.1883 > 10.0.0.11.33524: Flags [P.], seq 2935243438:2935243442, ack 3664482239, win 85, options [nop,nop,TS val 2016641375 ecr 3459767353], length 4
00:00:43.252001 IP 10.0.0.6.1883 > 10.0.0.11.33524: Flags [P.], seq 2935243442:2935243446, ack 3664482243, win 85, options [nop,nop,TS val 2016641497 ecr 3459767476], length 4
00:00:44.129452 IP 10.0.0.6.1883 > 10.0.0.11.33524: Flags [P.], seq 2935243446:2935243450, ack 3664482638, win 85, options [nop,nop,TS val 2016642375 ecr 3459768354], length 4
00:00:44.256498 IP 10.0.0.6.1883 > 10.0.0.11.33524: Flags [P.], seq 2935243450:2935243454, ack 3664482642, win 85, options [nop,nop,TS val 2016642502 ecr 3459768481], length 4
00:00:45.132338 IP 10.0.0.6.1883 > 10.0.0.11.33524: Flags [P.], seq 2935243454:2935243458, ack 3664483037, win 85, options [nop,nop,TS val 2016643378 ecr 3459769355], length 4
00:00:45.253924 IP 10.0.0.6.1883 > 10.0.0.11.33524: Flags [P.], seq 2935243458:2935243462, ack 3664483041, win 85, options [nop,nop,TS val 2016643499 ecr 3459769478], length 4
00:00:45.489722 IP 10.0.0.6.1883 > 10.0.0.11.33524: Flags [P.], seq 2935243462:2935243464, ack 3664483043, win 85, options [nop,nop,TS val 2016643735 ecr 3459769714], length 2
00:00:46.134985 IP 10.0.0.6.1883 > 10.0.0.11.33524: Flags [P.], seq 2935243464:2935243468, ack 3664483438, win 85, options [nop,nop,TS val 2016644380 ecr 3459770356], length 4
00:00:46.256977 IP 10.0.0.6.1883 > 10.0.0.11.33524: Flags [P.], seq 2935243468:2935243472, ack 3664483442, win 85, options [nop,nop,TS val 2016644502 ecr 3459770481], length 4
00:00:47.135079 IP 10.0.0.6.1883 > 10.0.0.11.33524: Flags [P.], seq 2935243472:2935243476, ack 3664483837, win 85, options [nop,nop,TS val 2016645378 ecr 3459771357], length 4
00:00:47.257156 IP 10.0.0.6.1883 > 10.0.0.11.33524: Flags [P.], seq 2935243476:2935243480, ack 3664483841, win 85, options [nop,nop,TS val 2016645502 ecr 3459771481], length 4
00:00:48.134653 IP 10.0.0.6.1883 > 10.0.0.11.33524: Flags [P.], seq 2935243480:2935243484, ack 3664484236, win 85, options [nop,nop,TS val 2016646380 ecr 3459772359], length 4
00:00:48.268047 IP 10.0.0.6.1883 > 10.0.0.11.33524: Flags [P.], seq 2935243484:2935243488, ack 3664484240, win 85, options [nop,nop,TS val 2016646513 ecr 3459772489], length 4
00:00:49.142417 IP 10.0.0.6.1883 > 10.0.0.11.33524: Flags [P.], seq 2935243488:2935243492, ack 3664484635, win 85, options [nop,nop,TS val 2016647387 ecr 3459773366], length 4
00:00:49.264326 IP 10.0.0.6.1883 > 10.0.0.11.33524: Flags [P.], seq 2935243492:2935243496, ack 3664484639, win 85, options [nop,nop,TS val 2016647510 ecr 3459773489], length 4
00:00:50.142837 IP 10.0.0.6.1883 > 10.0.0.11.33524: Flags [P.], seq 2935243496:2935243500, ack 3664485034, win 85, options [nop,nop,TS val 2016648388 ecr 3459774367], length 4
00:00:50.272026 IP 10.0.0.6.1883 > 10.0.0.11.33524: Flags [P.], seq 2935243500:2935243504, ack 3664485038, win 85, options [nop,nop,TS val 2016648517 ecr 3459774493], length 4
00:00:50.502422 IP 10.0.0.6.1883 > 10.0.0.11.33524: Flags [P.], seq 2935243504:2935243506, ack 3664485040, win 85, options [nop,nop,TS val 2016648746 ecr 3459774716], length 2
00:00:51.147654 IP 10.0.0.6.1883 > 10.0.0.11.33524: Flags [P.], seq 2935243506:2935243510, ack 3664485435, win 85, options [nop,nop,TS val 2016649393 ecr 3459775368], length 4
00:00:51.268855 IP 10.0.0.6.1883 > 10.0.0.11.33524: Flags [P.], seq 2935243510:2935243514, ack 3664485439, win 85, options [nop,nop,TS val 2016649514 ecr 3459775494], length 4
00:00:52.144619 IP 10.0.0.6.1883 > 10.0.0.11.33524: Flags [P.], seq 2935243514:2935243518, ack 3664485834, win 85, options [nop,nop,TS val 2016650390 ecr 3459776369], length 4
00:00:52.268764 IP 10.0.0.6.1883 > 10.0.0.11.33524: Flags [P.], seq 2935243518:2935243522, ack 3664485838, win 85, options [nop,nop,TS val 2016650514 ecr 3459776494], length 4
00:00:53.146130 IP 10.0.0.6.1883 > 10.0.0.11.33524: Flags [P.], seq 2935243522:2935243526, ack 3664486233, win 85, options [nop,nop,TS val 2016651391 ecr 3459777370], length 4
00:00:53.267987 IP 10.0.0.6.1883 > 10.0.0.11.33524: Flags [P.], seq 2935243526:2935243530, ack 3664486237, win 85, options [nop,nop,TS val 2016651513 ecr 3459777492], length 4
00:00:54.147104 IP 10.0.0.6.1883 > 10.0.0.11.33524: Flags [P.], seq 2935243530:2935243534, ack 3664486632, win 85, options [nop,nop,TS val 2016652392 ecr 3459778371], length 4
00:00:54.269268 IP 10.0.0.6.1883 > 10.0.0.11.33524: Flags [P.], seq 2935243534:2935243538, ack 3664486636, win 85, options [nop,nop,TS val 2016652515 ecr 3459778494], length 4
00:00:55.150565 IP 10.0.0.6.1883 > 10.0.0.11.33524: Flags [P.], seq 2935243538:2935243542, ack 3664487031, win 85, options [nop,nop,TS val 2016653396 ecr 3459779372], length 4
00:00:55.272289 IP 10.0.0.6.1883 > 10.0.0.11.33524: Flags [P.], seq 2935243542:2935243546, ack 3664487035, win 85, options [nop,nop,TS val 2016653518 ecr 3459779497], length 4
00:00:55.496537 IP 10.0.0.6.1883 > 10.0.0.11.33524: Flags [P.], seq 2935243546:2935243548, ack 3664487037, win 85, options [nop,nop,TS val 2016653738 ecr 3459779718], length 2
00:00:56.151981 IP 10.0.0.6.1883 > 10.0.0.11.33524: Flags [P.], seq 2935243548:2935243552, ack 3664487432, win 85, options [nop,nop,TS val 2016654394 ecr 3459780373], length 4
00:00:56.273406 IP 10.0.0.6.1883 > 10.0.0.11.33524: Flags [P.], seq 2935243552:2935243556, ack 3664487436, win 85, options [nop,nop,TS val 2016654519 ecr 3459780498], length 4
00:00:57.152139 IP 10.0.0.6.1883 > 10.0.0.11.33524: Flags [P.], seq 2935243556:2935243560, ack 3664487831, win 85, options [nop,nop,TS val 2016655397 ecr 3459781374], length 4
00:00:57.274279 IP 10.0.0.6.1883 > 10.0.0.11.33524: Flags [P.], seq 2935243560:2935243564, ack 3664487835, win 85, options [nop,nop,TS val 2016655519 ecr 3459781499], length 4
00:00:58.151094 IP 10.0.0.6.1883 > 10.0.0.11.33524: Flags [P.], seq 2935243564:2935243568, ack 3664488230, win 85, options [nop,nop,TS val 2016656396 ecr 3459782376], length 4
00:00:58.273603 IP 10.0.0.6.1883 > 10.0.0.11.33524: Flags [P.], seq 2935243568:2935243572, ack 3664488234, win 85, options [nop,nop,TS val 2016656519 ecr 3459782498], length 4
00:00:59.153470 IP 10.0.0.6.1883 > 10.0.0.11.33524: Flags [P.], seq 2935243572:2935243576, ack 3664488629, win 85, options [nop,nop,TS val 2016657399 ecr 3459783378], length 4
00:00:59.275120 IP 10.0.0.6.1883 > 10.0.0.11.33524: Flags [P.], seq 2935243576:2935243580, ack 3664488633, win 85, options [nop,nop,TS val 2016657521 ecr 3459783500], length 4
00:01:00.158312 IP 10.0.0.6.1883 > 10.0.0.11.33524: Flags [P.], seq 2935243580:2935243584, ack 3664489028, win 85, options [nop,nop,TS val 2016658404 ecr 3459784380], length 4
00:01:00.280168 IP 10.0.0.6.1883 > 10.0.0.11.33524: Flags [P.], seq 2935243584:2935243588, ack 3664489032, win 85, options [nop,nop,TS val 2016658525 ecr 3459784505], length 4
00:01:00.495077 IP 10.0.0.6.1883 > 10.0.0.11.33524: Flags [P.], seq 2935243588:2935243590, ack 3664489034, win 85, options [nop,nop,TS val 2016658740 ecr 3459784720], length 2
00:01:01.161375 IP 10.0.0.6.1883 > 10.0.0.11.33524: Flags [P.], seq 2935243590:2935243594, ack 3664489429, win 85, options [nop,nop,TS val 2016659407 ecr 3459785382], length 4
00:01:01.284052 IP 10.0.0.6.1883 > 10.0.0.11.33524: Flags [P.], seq 2935243594:2935243598, ack 3664489433, win 85, options [nop,nop,TS val 2016659529 ecr 3459785508], length 4
00:01:02.159395 IP 10.0.0.6.1883 > 10.0.0.11.33524: Flags [P.], seq 2935243598:2935243602, ack 3664489828, win 85, options [nop,nop,TS val 2016660405 ecr 3459786383], length 4
00:01:02.284666 IP 10.0.0.6.1883 > 10.0.0.11.33524: Flags [P.], seq 2935243602:2935243606, ack 3664489832, win 85, options [nop,nop,TS val 2016660530 ecr 3459786506], length 4
00:01:03.162496 IP 10.0.0.6.1883 > 10.0.0.11.33524: Flags [P.], seq 2935243606:2935243610, ack 3664490227, win 85, options [nop,nop,TS val 2016661408 ecr 3459787385], length 4
00:01:03.284016 IP 10.0.0.6.1883 > 10.0.0.11.33524: Flags [P.], seq 2935243610:2935243614, ack 3664490231, win 85, options [nop,nop,TS val 2016661529 ecr 3459787509], length 4
00:01:04.162747 IP 10.0.0.6.1883 > 10.0.0.11.33524: Flags [P.], seq 2935243614:2935243618, ack 3664490626, win 85, options [nop,nop,TS val 2016662408 ecr 3459788387], length 4
00:01:04.285067 IP 10.0.0.6.1883 > 10.0.0.11.33524: Flags [P.], seq 2935243618:2935243622, ack 3664490630, win 85, options [nop,nop,TS val 2016662530 ecr 3459788509], length 4
00:01:05.167524 IP 10.0.0.6.1883 > 10.0.0.11.33524: Flags [P.], seq 2935243622:2935243626, ack 3664491025, win 85, options [nop,nop,TS val 2016663413 ecr 3459789389], length 4
00:01:05.289824 IP 10.0.0.6.1883 > 10.0.0.11.33524: Flags [P.], seq 2935243626:2935243630, ack 3664491029, win 85, options [nop,nop,TS val 2016663535 ecr 3459789514], length 4
00:01:05.496615 IP 10.0.0.6.1883 > 10.0.0.11.33524: Flags [P.], seq 2935243630:2935243632, ack 3664491031, win 85, options [nop,nop,TS val 2016663742 ecr 3459789721], length 2
00:01:06.166614 IP 10.0.0.6.1883 > 10.0.0.11.33524: Flags [P.], seq 2935243632:2935243636, ack 3664491426, win 85, options [nop,nop,TS val 2016664412 ecr 3459790390], length 4
00:01:06.288830 IP 10.0.0.6.1883 > 10.0.0.11.33524: Flags [P.], seq 2935243636:2935243640, ack 3664491430, win 85, options [nop,nop,TS val 2016664534 ecr 3459790513], length 4
00:01:07.166680 IP 10.0.0.6.1883 > 10.0.0.11.33524: Flags [P.], seq 2935243640:2935243644, ack 3664491825, win 85, options [nop,nop,TS val 2016665412 ecr 3459791391], length 4
00:01:07.288929 IP 10.0.0.6.1883 > 10.0.0.11.33524: Flags [P.], seq 2935243644:2935243648, ack 3664491829, win 85, options [nop,nop,TS val 2016665534 ecr 3459791514], length 4
00:01:08.172790 IP 10.0.0.6.1883 > 10.0.0.11.33524: Flags [P.], seq 2935243648:2935243652, ack 3664492224, win 85, options [nop,nop,TS val 2016666418 ecr 3459792395], length 4
00:01:08.295102 IP 10.0.0.6.1883 > 10.0.0.11.33524: Flags [P.], seq 2935243652:2935243656, ack 3664492228, win 85, options [nop,nop,TS val 2016666540 ecr 3459792519], length 4
00:01:09.171911 IP 10.0.0.6.1883 > 10.0.0.11.33524: Flags [P.], seq 2935243656:2935243660, ack 3664492623, win 85, options [nop,nop,TS val 2016667417 ecr 3459793396], length 4
00:01:09.294125 IP 10.0.0.6.1883 > 10.0.0.11.33524: Flags [P.], seq 2935243660:2935243664, ack 3664492627, win 85, options [nop,nop,TS val 2016667540 ecr 3459793518], length 4
00:01:10.172801 IP 10.0.0.6.1883 > 10.0.0.11.33524: Flags [P.], seq 2935243664:2935243668, ack 3664493022, win 85, options [nop,nop,TS val 2016668418 ecr 3459794397], length 4
00:01:10.295037 IP 10.0.0.6.1883 > 10.0.0.11.33524: Flags [P.], seq 2935243668:2935243672, ack 3664493026, win 85, options [nop,nop,TS val 2016668540 ecr 3459794520], length 4
00:01:10.502942 IP 10.0.0.6.1883 > 10.0.0.11.33524: Flags [P.], seq 2935243672:2935243674, ack 3664493028, win 85, options [nop,nop,TS val 2016668748 ecr 3459794722], length 2
00:01:11.176835 IP 10.0.0.6.1883 > 10.0.0.11.33524: Flags [P.], seq 2935243674:2935243678, ack 3664493423, win 85, options [nop,nop,TS val 2016669422 ecr 3459795400], length 4
00:01:11.298577 IP 10.0.0.6.1883 > 10.0.0.11.33524: Flags [P.], seq 2935243678:2935243682, ack 3664493427, win 85, options [nop,nop,TS val 2016669544 ecr 3459795523], length 4
00:01:12.187756 IP 10.0.0.6.1883 > 10.0.0.11.33524: Flags [P.], seq 2935243682:2935243686, ack 3664493822, win 85, options [nop,nop,TS val 2016670433 ecr 3459796401], length 4
00:01:12.314391 IP 10.0.0.6.1883 > 10.0.0.11.33524: Flags [P.], seq 2935243686:2935243690, ack 3664493826, win 85, options [nop,nop,TS val 2016670560 ecr 3459796539], length 4
00:01:13.180712 IP 10.0.0.6.1883 > 10.0.0.11.33524: Flags [P.], seq 2935243690:2935243694, ack 3664494221, win 85, options [nop,nop,TS val 2016671425 ecr 3459797404], length 4
00:01:13.303110 IP 10.0.0.6.1883 > 10.0.0.11.33524: Flags [P.], seq 2935243694:2935243698, ack 3664494225, win 85, options [nop,nop,TS val 2016671548 ecr 3459797527], length 4
00:01:14.184418 IP 10.0.0.6.1883 > 10.0.0.11.33524: Flags [P.], seq 2935243698:2935243702, ack 3664494620, win 85, options [nop,nop,TS val 2016672426 ecr 3459798405], length 4
00:01:14.310331 IP 10.0.0.6.1883 > 10.0.0.11.33524: Flags [P.], seq 2935243702:2935243706, ack 3664494624, win 85, options [nop,nop,TS val 2016672556 ecr 3459798531], length 4
00:01:15.181896 IP 10.0.0.6.1883 > 10.0.0.11.33524: Flags [P.], seq 2935243706:2935243710, ack 3664495019, win 85, options [nop,nop,TS val 2016673427 ecr 3459799406], length 4
00:01:15.307258 IP 10.0.0.6.1883 > 10.0.0.11.33524: Flags [P.], seq 2935243710:2935243714, ack 3664495023, win 85, options [nop,nop,TS val 2016673553 ecr 3459799528], length 4
00:01:15.499173 IP 10.0.0.6.1883 > 10.0.0.11.33524: Flags [P.], seq 2935243714:2935243716, ack 3664495025, win 85, options [nop,nop,TS val 2016673744 ecr 3459799724], length 2
00:01:16.183542 IP 10.0.0.6.1883 > 10.0.0.11.33524: Flags [P.], seq 2935243716:2935243720, ack 3664495420, win 85, options [nop,nop,TS val 2016674429 ecr 3459800408], length 4
00:01:16.306060 IP 10.0.0.6.1883 > 10.0.0.11.33524: Flags [P.], seq 2935243720:2935243724, ack 3664495424, win 85, options [nop,nop,TS val 2016674551 ecr 3459800530], length 4
00:01:17.187401 IP 10.0.0.6.1883 > 10.0.0.11.33524: Flags [P.], seq 2935243724:2935243728, ack 3664495819, win 85, options [nop,nop,TS val 2016675433 ecr 3459801410], length 4
00:01:17.309444 IP 10.0.0.6.1883 > 10.0.0.11.33524: Flags [P.], seq 2935243728:2935243732, ack 3664495823, win 85, options [nop,nop,TS val 2016675555 ecr 3459801534], length 4
00:01:18.188720 IP 10.0.0.6.1883 > 10.0.0.11.33524: Flags [P.], seq 2935243732:2935243736, ack 3664496218, win 85, options [nop,nop,TS val 2016676433 ecr 3459802411], length 4
00:01:18.310876 IP 10.0.0.6.1883 > 10.0.0.11.33524: Flags [P.], seq 2935243736:2935243740, ack 3664496222, win 85, options [nop,nop,TS val 2016676556 ecr 3459802535], length 4
00:01:19.191877 IP 10.0.0.6.1883 > 10.0.0.11.33524: Flags [P.], seq 2935243740:2935243744, ack 3664496617, win 85, options [nop,nop,TS val 2016677437 ecr 3459803416], length 4
00:01:19.316766 IP 10.0.0.6.1883 > 10.0.0.11.33524: Flags [P.], seq 2935243744:2935243748, ack 3664496621, win 85, options [nop,nop,TS val 2016677562 ecr 3459803538], length 4
00:01:20.193804 IP 10.0.0.6.1883 > 10.0.0.11.33524: Flags [P.], seq 2935243748:2935243752, ack 3664497016, win 85, options [nop,nop,TS val 2016678439 ecr 3459804418], length 4
00:01:20.315972 IP 10.0.0.6.1883 > 10.0.0.11.33524: Flags [P.], seq 2935243752:2935243756, ack 3664497020, win 85, options [nop,nop,TS val 2016678561 ecr 3459804540], length 4
00:01:20.501593 IP 10.0.0.6.1883 > 10.0.0.11.33524: Flags [P.], seq 2935243756:2935243758, ack 3664497022, win 85, options [nop,nop,TS val 2016678746 ecr 3459804725], length 2
00:01:21.195345 IP 10.0.0.6.1883 > 10.0.0.11.33524: Flags [P.], seq 2935243758:2935243762, ack 3664497417, win 85, options [nop,nop,TS val 2016679440 ecr 3459805419], length 4
00:01:21.317781 IP 10.0.0.6.1883 > 10.0.0.11.33524: Flags [P.], seq 2935243762:2935243766, ack 3664497421, win 85, options [nop,nop,TS val 2016679563 ecr 3459805542], length 4
00:01:22.196203 IP 10.0.0.6.1883 > 10.0.0.11.33524: Flags [P.], seq 2935243766:2935243770, ack 3664497816, win 85, options [nop,nop,TS val 2016680442 ecr 3459806421], length 4
00:01:22.320376 IP 10.0.0.6.1883 > 10.0.0.11.33524: Flags [P.], seq 2935243770:2935243774, ack 3664497820, win 85, options [nop,nop,TS val 2016680566 ecr 3459806542], length 4
00:01:23.200300 IP 10.0.0.6.1883 > 10.0.0.11.33524: Flags [P.], seq 2935243774:2935243778, ack 3664498215, win 85, options [nop,nop,TS val 2016681446 ecr 3459807424], length 4
00:01:23.322400 IP 10.0.0.6.1883 > 10.0.0.11.33524: Flags [P.], seq 2935243778:2935243782, ack 3664498219, win 85, options [nop,nop,TS val 2016681568 ecr 3459807547], length 4
00:01:24.200926 IP 10.0.0.6.1883 > 10.0.0.11.33524: Flags [P.], seq 2935243782:2935243786, ack 3664498614, win 85, options [nop,nop,TS val 2016682446 ecr 3459808425], length 4
00:01:24.322813 IP 10.0.0.6.1883 > 10.0.0.11.33524: Flags [P.], seq 2935243786:2935243790, ack 3664498618, win 85, options [nop,nop,TS val 2016682568 ecr 3459808547], length 4
00:01:25.202415 IP 10.0.0.6.1883 > 10.0.0.11.33524: Flags [P.], seq 2935243790:2935243794, ack 3664499013, win 85, options [nop,nop,TS val 2016683448 ecr 3459809427], length 4
00:01:25.324531 IP 10.0.0.6.1883 > 10.0.0.11.33524: Flags [P.], seq 2935243794:2935243798, ack 3664499017, win 85, options [nop,nop,TS val 2016683570 ecr 3459809549], length 4
00:01:25.502239 IP 10.0.0.6.1883 > 10.0.0.11.33524: Flags [P.], seq 2935243798:2935243800, ack 3664499019, win 85, options [nop,nop,TS val 2016683748 ecr 3459809726], length 2
00:01:26.204350 IP 10.0.0.6.1883 > 10.0.0.11.33524: Flags [P.], seq 2935243800:2935243804, ack 3664499414, win 85, options [nop,nop,TS val 2016684450 ecr 3459810429], length 4
00:01:26.330231 IP 10.0.0.6.1883 > 10.0.0.11.33524: Flags [P.], seq 2935243804:2935243808, ack 3664499418, win 85, options [nop,nop,TS val 2016684576 ecr 3459810551], length 4
00:01:27.206848 IP 10.0.0.6.1883 > 10.0.0.11.33524: Flags [P.], seq 2935243808:2935243812, ack 3664499813, win 85, options [nop,nop,TS val 2016685452 ecr 3459811431], length 4
00:01:27.329151 IP 10.0.0.6.1883 > 10.0.0.11.33524: Flags [P.], seq 2935243812:2935243816, ack 3664499817, win 85, options [nop,nop,TS val 2016685574 ecr 3459811553], length 4
00:01:28.207557 IP 10.0.0.6.1883 > 10.0.0.11.33524: Flags [P.], seq 2935243816:2935243820, ack 3664500212, win 85, options [nop,nop,TS val 2016686453 ecr 3459812432], length 4
00:01:28.332428 IP 10.0.0.6.1883 > 10.0.0.11.33524: Flags [P.], seq 2935243820:2935243824, ack 3664500216, win 85, options [nop,nop,TS val 2016686578 ecr 3459812557], length 4
00:01:29.217701 IP 10.0.0.6.1883 > 10.0.0.11.33524: Flags [P.], seq 2935243824:2935243828, ack 3664500611, win 85, options [nop,nop,TS val 2016687463 ecr 3459813433], length 4
00:01:29.339994 IP 10.0.0.6.1883 > 10.0.0.11.33524: Flags [P.], seq 2935243828:2935243832, ack 3664500615, win 85, options [nop,nop,TS val 2016687585 ecr 3459813564], length 4
00:01:30.210926 IP 10.0.0.6.1883 > 10.0.0.11.33524: Flags [P.], seq 2935243832:2935243836, ack 3664501010, win 85, options [nop,nop,TS val 2016688456 ecr 3459814434], length 4
00:01:30.333224 IP 10.0.0.6.1883 > 10.0.0.11.33524: Flags [P.], seq 2935243836:2935243840, ack 3664501014, win 85, options [nop,nop,TS val 2016688579 ecr 3459814558], length 4
00:01:30.506218 IP 10.0.0.6.1883 > 10.0.0.11.33524: Flags [P.], seq 2935243840:2935243842, ack 3664501016, win 85, options [nop,nop,TS val 2016688750 ecr 3459814728], length 2
00:01:31.218145 IP 10.0.0.6.1883 > 10.0.0.11.33524: Flags [P.], seq 2935243842:2935243846, ack 3664501411, win 85, options [nop,nop,TS val 2016689463 ecr 3459815438], length 4
00:01:31.340157 IP 10.0.0.6.1883 > 10.0.0.11.33524: Flags [P.], seq 2935243846:2935243850, ack 3664501415, win 85, options [nop,nop,TS val 2016689585 ecr 3459815564], length 4
00:01:32.217310 IP 10.0.0.6.1883 > 10.0.0.11.33524: Flags [P.], seq 2935243850:2935243854, ack 3664501810, win 85, options [nop,nop,TS val 2016690462 ecr 3459816441], length 4
00:01:32.339652 IP 10.0.0.6.1883 > 10.0.0.11.33524: Flags [P.], seq 2935243854:2935243858, ack 3664501814, win 85, options [nop,nop,TS val 2016690585 ecr 3459816564], length 4
00:01:33.222236 IP 10.0.0.6.1883 > 10.0.0.11.33524: Flags [P.], seq 2935243858:2935243862, ack 3664502209, win 85, options [nop,nop,TS val 2016691468 ecr 3459817443], length 4
00:01:33.344268 IP 10.0.0.6.1883 > 10.0.0.11.33524: Flags [P.], seq 2935243862:2935243866, ack 3664502213, win 85, options [nop,nop,TS val 2016691589 ecr 3459817569], length 4
00:01:34.223445 IP 10.0.0.6.1883 > 10.0.0.11.33524: Flags [P.], seq 2935243866:2935243870, ack 3664502608, win 85, options [nop,nop,TS val 2016692469 ecr 3459818444], length 4
00:01:34.345339 IP 10.0.0.6.1883 > 10.0.0.11.33524: Flags [P.], seq 2935243870:2935243874, ack 3664502612, win 85, options [nop,nop,TS val 2016692591 ecr 3459818570], length 4
00:01:35.223252 IP 10.0.0.6.1883 > 10.0.0.11.33524: Flags [P.], seq 2935243874:2935243878, ack 3664503007, win 85, options [nop,nop,TS val 2016693467 ecr 3459819445], length 4
00:01:35.345210 IP 10.0.0.6.1883 > 10.0.0.11.33524: Flags [P.], seq 2935243878:2935243882, ack 3664503011, win 85, options [nop,nop,TS val 2016693591 ecr 3459819570], length 4
00:01:35.511303 IP 10.0.0.6.1883 > 10.0.0.11.33524: Flags [P.], seq 2935243882:2935243884, ack 3664503013, win 85, options [nop,nop,TS val 2016693756 ecr 3459819730], length 2
00:01:36.222074 IP 10.0.0.6.1883 > 10.0.0.11.33524: Flags [P.], seq 2935243884:2935243888, ack 3664503408, win 85, options [nop,nop,TS val 2016694467 ecr 3459820446], length 4
00:01:36.343839 IP 10.0.0.6.1883 > 10.0.0.11.33524: Flags [P.], seq 2935243888:2935243892, ack 3664503412, win 85, options [nop,nop,TS val 2016694589 ecr 3459820568], length 4
00:01:37.225981 IP 10.0.0.6.1883 > 10.0.0.11.33524: Flags [P.], seq 2935243892:2935243896, ack 3664503807, win 85, options [nop,nop,TS val 2016695471 ecr 3459821450], length 4
00:01:37.350568 IP 10.0.0.6.1883 > 10.0.0.11.33524: Flags [P.], seq 2935243896:2935243900, ack 3664503811, win 85, options [nop,nop,TS val 2016695593 ecr 3459821572], length 4
00:01:38.229570 IP 10.0.0.6.1883 > 10.0.0.11.33524: Flags [P.], seq 2935243900:2935243904, ack 3664504206, win 85, options [nop,nop,TS val 2016696472 ecr 3459822451], length 4
00:01:38.354468 IP 10.0.0.6.1883 > 10.0.0.11.33524: Flags [P.], seq 2935243904:2935243908, ack 3664504210, win 85, options [nop,nop,TS val 2016696600 ecr 3459822576], length 4
00:01:39.227614 IP 10.0.0.6.1883 > 10.0.0.11.33524: Flags [P.], seq 2935243908:2935243912, ack 3664504605, win 85, options [nop,nop,TS val 2016697473 ecr 3459823452], length 4
00:01:39.350267 IP 10.0.0.6.1883 > 10.0.0.11.33524: Flags [P.], seq 2935243912:2935243916, ack 3664504609, win 85, options [nop,nop,TS val 2016697596 ecr 3459823574], length 4
00:01:40.506944 IP 10.0.0.6.1883 > 10.0.0.11.33524: Flags [P.], seq 2935243916:2935243918, ack 3664504611, win 85, options [nop,nop,TS val 2016698752 ecr 3459824731], length 2
00:01:45.512854 IP 10.0.0.6.1883 > 10.0.0.11.33524: Flags [P.], seq 2935243918:2935243920, ack 3664504613, win 85, options [nop,nop,TS val 2016703754 ecr 3459829733], length 2
00:01:49.293751 IP 10.0.0.6.1883 > 10.0.0.11.33524: Flags [F.], seq 2935243920, ack 3664504614, win 85, options [nop,nop,TS val 2016707539 ecr 3459833518], length 0