00:00:07.827217 IP 10.0.0.6.1883 > 10.0.0.8.45174: Flags [S.], seq 3711507008, ack 2446303793, win 43440, options [mss 1460,sackOK,TS val 3793353871 ecr 1098059295,nop,wscale 9], length 0
00:00:07.835800 IP 10.0.0.6.1883 > 10.0.0.8.45174: Flags [.], ack 2446303813, win 85, options [nop,nop,TS val 3793353880 ecr 1098059361], length 0
00:00:07.836111 IP 10.0.0.6.1883 > 10.0.0.8.45174: Flags [P.], seq 3711507009:3711507013, ack 2446303813, win 85, options [nop,nop,TS val 3793353880 ecr 1098059361], length 4
00:00:07.848378 IP 10.0.0.6.1883 > 10.0.0.8.45174: Flags [P.], seq 3711507013:3711507078, ack 2446303877, win 85, options [nop,nop,TS val 3793353889 ecr 1098059370], length 65
00:00:07.851393 IP 10.0.0.6.1883 > 10.0.0.8.45174: Flags [P.], seq 3711507078:3711507083, ack 2446304272, win 85, options [nop,nop,TS val 3793353895 ecr 1098059377], length 5
00:00:07.965326 IP 10.0.0.6.1883 > 10.0.0.8.45174: Flags [P.], seq 3711507083:3711507087, ack 2446304272, win 85, options [nop,nop,TS val 3793353940 ecr 1098059422], length 4
00:00:07.968080 IP 10.0.0.6.1883 > 10.0.0.8.45174: Flags [P.], seq 3711507087:3711507091, ack 2446304276, win 85, options [nop,nop,TS val 3793354012 ecr 1098059492], length 4
00:00:08.781532 IP 10.0.0.6.1883 > 10.0.0.8.45174: Flags [P.], seq 3711507091:3711507095, ack 2446304671, win 85, options [nop,nop,TS val 3793354826 ecr 1098060306], length 4
00:00:08.784407 IP 10.0.0.6.1883 > 10.0.0.8.45174: Flags [P.], seq 3711507095:3711507099, ack 2446304675, win 85, options [nop,nop,TS val 3793354828 ecr 1098060309], length 4
00:00:09.816941 IP 10.0.0.6.1883 > 10.0.0.8.45174: Flags [P.], seq 3711507099:3711507103, ack 2446305070, win 85, options [nop,nop,TS val 3793355861 ecr 1098061340], length 4
00:00:09.896642 IP 10.0.0.6.1883 > 10.0.0.8.45174: Flags [P.], seq 3711507103:3711507107, ack 2446305074, win 85, options [nop,nop,TS val 3793355939 ecr 1098061418], length 4
00:00:10.820229 IP 10.0.0.6.1883 > 10.0.0.8.45174: Flags [P.], seq 3711507107:3711507111, ack 2446305469, win 85, options [nop,nop,TS val 3793356863 ecr 1098062342], length 4
00:00:10.862282 IP 10.0.0.6.1883 > 10.0.0.8.45174: Flags [P.], seq 3711507111:3711507115, ack 2446305473, win 85, options [nop,nop,TS val 3793356906 ecr 1098062386], length 4
00:00:11.831154 IP 10.0.0.6.1883 > 10.0.0.8.45174: Flags [P.], seq 3711507115:3711507119, ack 2446305868, win 85, options [nop,nop,TS val 3793357875 ecr 1098063354], length 4
00:00:11.834371 IP 10.0.0.6.1883 > 10.0.0.8.45174: Flags [P.], seq 3711507119:3711507123, ack 2446305872, win 85, options [nop,nop,TS val 3793357878 ecr 1098063358], length 4
00:00:12.868789 IP 10.0.0.6.1883 > 10.0.0.8.45174: Flags [P.], seq 3711507123:3711507125, ack 2446305874, win 85, options [nop,nop,TS val 3793358913 ecr 1098064393], length 2
00:00:12.871165 IP 10.0.0.6.1883 > 10.0.0.8.45174: Flags [P.], seq 3711507125:3711507129, ack 2446306269, win 85, options [nop,nop,TS val 3793358915 ecr 1098064396], length 4
00:00:12.873097 IP 10.0.0.6.1883 > 10.0.0.8.45174: Flags [P.], seq 3711507129:3711507133, ack 2446306273, win 85, options [nop,nop,TS val 3793358917 ecr 1098064398], length 4
00:00:13.928297 IP 10.0.0.6.1883 > 10.0.0.8.45174: Flags [P.], seq 3711507133:3711507137, ack 2446306668, win 85, options [nop,nop,TS val 3793359972 ecr 1098065453], length 4
00:00:13.929784 IP 10.0.0.6.1883 > 10.0.0.8.45174: Flags [P.], seq 3711507137:3711507141, ack 2446306672, win 85, options [nop,nop,TS val 3793359974 ecr 1098065455], length 4
00:00:14.931350 IP 10.0.0.6.1883 > 10.0.0.8.45174: Flags [P.], seq 3711507141:3711507145, ack 2446307067, win 85, options [nop,nop,TS val 3793360975 ecr 1098066456], length 4
00:00:15.082133 IP 10.0.0.6.1883 > 10.0.0.8.45174: Flags [P.], seq 3711507145:3711507149, ack 2446307071, win 85, options [nop,nop,TS val 3793361126 ecr 1098066607], length 4
00:00:15.938729 IP 10.0.0.6.1883 > 10.0.0.8.45174: Flags [P.], seq 3711507149:3711507153, ack 2446307466, win 85, options [nop,nop,TS val 3793361983 ecr 1098067462], length 4
00:00:15.940976 IP 10.0.0.6.1883 > 10.0.0.8.45174: Flags [P.], seq 3711507153:3711507157, ack 2446307470, win 85, options [nop,nop,TS val 3793361985 ecr 1098067466], length 4
00:00:16.939112 IP 10.0.0.6.1883 > 10.0.0.8.45174: Flags [P.], seq 3711507157:3711507161, ack 2446307865, win 85, options [nop,nop,TS val 3793362983 ecr 1098068463], length 4
00:00:16.941577 IP 10.0.0.6.1883 > 10.0.0.8.45174: Flags [P.], seq 3711507161:3711507165, ack 2446307869, win 85, options [nop,nop,TS val 3793362985 ecr 1098068466], length 4
00:00:17.875805 IP 10.0.0.6.1883 > 10.0.0.8.45174: Flags [P.], seq 3711507165:3711507167, ack 2446307871, win 85, options [nop,nop,TS val 3793363920 ecr 1098069400], length 2
00:00:17.941688 IP 10.0.0.6.1883 > 10.0.0.8.45174: Flags [P.], seq 3711507167:3711507171, ack 2446308266, win 85, options [nop,nop,TS val 3793363986 ecr 1098069464], length 4
00:00:17.943519 IP 10.0.0.6.1883 > 10.0.0.8.45174: Flags [P.], seq 3711507171:3711507175, ack 2446308270, win 85, options [nop,nop,TS val 3793363987 ecr 1098069468], length 4
00:00:18.941359 IP 10.0.0.6.1883 > 10.0.0.8.45174: Flags [P.], seq 3711507175:3711507179, ack 2446308665, win 85, options [nop,nop,TS val 3793364985 ecr 1098070465], length 4
00:00:18.942947 IP 10.0.0.6.1883 > 10.0.0.8.45174: Flags [P.], seq 3711507179:3711507183, ack 2446308669, win 85, options [nop,nop,TS val 3793364987 ecr 1098070468], length 4
00:00:19.948433 IP 10.0.0.6.1883 > 10.0.0.8.45174: Flags [P.], seq 3711507183:3711507187, ack 2446309064, win 85, options [nop,nop,TS val 3793365992 ecr 1098071473], length 4
00:00:19.963397 IP 10.0.0.6.1883 > 10.0.0.8.45174: Flags [P.], seq 3711507187:3711507191, ack 2446309068, win 85, options [nop,nop,TS val 3793366007 ecr 1098071485], length 4
00:00:20.951038 IP 10.0.0.6.1883 > 10.0.0.8.45174: Flags [P.], seq 3711507191:3711507195, ack 2446309463, win 85, options [nop,nop,TS val 3793366995 ecr 1098072474], length 4
00:00:20.953808 IP 10.0.0.6.1883 > 10.0.0.8.45174: Flags [P.], seq 3711507195:3711507199, ack 2446309467, win 85, options [nop,nop,TS val 3793366998 ecr 1098072478], length 4
00:00:21.951685 IP 10.0.0.6.1883 > 10.0.0.8.45174: Flags [P.], seq 3711507199:3711507203, ack 2446309862, win 85, options [nop,nop,TS val 3793367996 ecr 1098073476], length 4
00:00:21.953891 IP 10.0.0.6.1883 > 10.0.0.8.45174: Flags [P.], seq 3711507203:3711507207, ack 2446309866, win 85, options [nop,nop,TS val 3793367998 ecr 1098073479], length 4
00:00:22.875941 IP 10.0.0.6.1883 > 10.0.0.8.45174: Flags [P.], seq 3711507207:3711507209, ack 2446309868, win 85, options [nop,nop,TS val 3793368920 ecr 1098074400], length 2
00:00:23.019052 IP 10.0.0.6.1883 > 10.0.0.8.45174: Flags [P.], seq 3711507209:3711507213, ack 2446310263, win 85, options [nop,nop,TS val 3793369063 ecr 1098074542], length 4
00:00:23.022393 IP 10.0.0.6.1883 > 10.0.0.8.45174: Flags [P.], seq 3711507213:3711507217, ack 2446310267, win 85, options [nop,nop,TS val 3793369067 ecr 1098074547], length 4
00:00:23.369754 IP 10.0.0.6.1883 > 10.0.0.8.45174: Flags [P.], seq 3711507213:3711507217, ack 2446310267, win 85, options [nop,nop,TS val 3793369338 ecr 1098074547], length 4
00:00:24.024562 IP 10.0.0.6.1883 > 10.0.0.8.45174: Flags [P.], seq 3711507217:3711507221, ack 2446310662, win 85, options [nop,nop,TS val 3793370068 ecr 1098075547], length 4
00:00:24.034466 IP 10.0.0.6.1883 > 10.0.0.8.45174: Flags [P.], seq 3711507221:3711507225, ack 2446310666, win 85, options [nop,nop,TS val 3793370078 ecr 1098075559], length 4
00:00:25.026035 IP 10.0.0.6.1883 > 10.0.0.8.45174: Flags [P.], seq 3711507225:3711507229, ack 2446311061, win 85, options [nop,nop,TS val 3793371070 ecr 1098076549], length 4
00:00:25.032208 IP 10.0.0.6.1883 > 10.0.0.8.45174: Flags [P.], seq 3711507229:3711507233, ack 2446311065, win 85, options [nop,nop,TS val 3793371076 ecr 1098076557], length 4
00:00:26.028242 IP 10.0.0.6.1883 > 10.0.0.8.45174: Flags [P.], seq 3711507233:3711507237, ack 2446311460, win 85, options [nop,nop,TS val 3793372072 ecr 1098077552], length 4
00:00:26.030612 IP 10.0.0.6.1883 > 10.0.0.8.45174: Flags [P.], seq 3711507237:3711507241, ack 2446311464, win 85, options [nop,nop,TS val 3793372074 ecr 1098077555], length 4
00:00:27.035955 IP 10.0.0.6.1883 > 10.0.0.8.45174: Flags [P.], seq 3711507241:3711507245, ack 2446311859, win 85, options [nop,nop,TS val 3793373079 ecr 1098078556], length 4
00:00:27.039088 IP 10.0.0.6.1883 > 10.0.0.8.45174: Flags [P.], seq 3711507245:3711507249, ack 2446311863, win 85, options [nop,nop,TS val 3793373083 ecr 1098078564], length 4
00:00:27.878153 IP 10.0.0.6.1883 > 10.0.0.8.45174: Flags [P.], seq 3711507249:3711507251, ack 2446311865, win 85, options [nop,nop,TS val 3793373922 ecr 1098079403], length 2
00:00:28.035844 IP 10.0.0.6.1883 > 10.0.0.8.45174: Flags [P.], seq 3711507251:3711507255, ack 2446312260, win 85, options [nop,nop,TS val 3793374079 ecr 1098079559], length 4
00:00:28.041789 IP 10.0.0.6.1883 > 10.0.0.8.45174: Flags [P.], seq 3711507255:3711507259, ack 2446312264, win 85, options [nop,nop,TS val 3793374086 ecr 1098079566], length 4
00:00:29.037422 IP 10.0.0.6.1883 > 10.0.0.8.45174: Flags [P.], seq 3711507259:3711507263, ack 2446312659, win 85, options [nop,nop,TS val 3793375082 ecr 1098080561], length 4
00:00:29.039953 IP 10.0.0.6.1883 > 10.0.0.8.45174: Flags [P.], seq 3711507263:3711507267, ack 2446312663, win 85, options [nop,nop,TS val 3793375084 ecr 1098080564], length 4
00:00:30.038241 IP 10.0.0.6.1883 > 10.0.0.8.45174: Flags [P.], seq 3711507267:3711507271, ack 2446313058, win 85, options [nop,nop,TS val 3793376082 ecr 1098081562], length 4
00:00:30.040712 IP 10.0.0.6.1883 > 10.0.0.8.45174: Flags [P.], seq 3711507271:3711507275, ack 2446313062, win 85, options [nop,nop,TS val 3793376084 ecr 1098081565], length 4
00:00:31.039290 IP 10.0.0.6.1883 > 10.0.0.8.45174: Flags [P.], seq 3711507275:3711507279, ack 2446313457, win 85, options [nop,nop,TS val 3793377083 ecr 1098082564], length 4
00:00:31.043052 IP 10.0.0.6.1883 > 10.0.0.8.45174: Flags [P.], seq 3711507279:3711507283, ack 2446313461, win 85, options [nop,nop,TS val 3793377087 ecr 1098082567], length 4
00:00:32.040513 IP 10.0.0.6.1883 > 10.0.0.8.45174: Flags [P.], seq 3711507283:3711507287, ack 2446313856, win 85, options [nop,nop,TS val 3793378085 ecr 1098083565], length 4
00:00:32.042281 IP 10.0.0.6.1883 > 10.0.0.8.45174: Flags [P.], seq 3711507287:3711507291, ack 2446313860, win 85, options [nop,nop,TS val 3793378086 ecr 1098083567], length 4
00:00:32.879152 IP 10.0.0.6.1883 > 10.0.0.8.45174: Flags [P.], seq 3711507291:3711507293, ack 2446313862, win 85, options [nop,nop,TS val 3793378923 ecr 1098084404], length 2
00:00:33.042174 IP 10.0.0.6.1883 > 10.0.0.8.45174: Flags [P.], seq 3711507293:3711507297, ack 2446314257, win 85, options [nop,nop,TS val 3793379086 ecr 1098084567], length 4
00:00:33.043685 IP 10.0.0.6.1883 > 10.0.0.8.45174: Flags [P.], seq 3711507297:3711507301, ack 2446314261, win 85, options [nop,nop,TS val 3793379088 ecr 1098084569], length 4
00:00:34.043834 IP 10.0.0.6.1883 > 10.0.0.8.45174: Flags [P.], seq 3711507301:3711507305, ack 2446314656, win 85, options [nop,nop,TS val 3793380088 ecr 1098085569], length 4
00:00:34.045369 IP 10.0.0.6.1883 > 10.0.0.8.45174: Flags [P.], seq 3711507305:3711507309, ack 2446314660, win 85, options [nop,nop,TS val 3793380089 ecr 1098085571], length 4
00:00:35.048153 IP 10.0.0.6.1883 > 10.0.0.8.45174: Flags [P.], seq 3711507309:3711507313, ack 2446315055, win 85, options [nop,nop,TS val 3793381092 ecr 1098086573], length 4
00:00:35.049791 IP 10.0.0.6.1883 > 10.0.0.8.45174: Flags [P.], seq 3711507313:3711507317, ack 2446315059, win 85, options [nop,nop,TS val 3793381094 ecr 1098086575], length 4
00:00:36.048852 IP 10.0.0.6.1883 > 10.0.0.8.45174: Flags [P.], seq 3711507317:3711507321, ack 2446315454, win 85, options [nop,nop,TS val 3793382093 ecr 1098087574], length 4
00:00:36.050790 IP 10.0.0.6.1883 > 10.0.0.8.45174: Flags [P.], seq 3711507321:3711507325, ack 2446315458, win 85, options [nop,nop,TS val 3793382095 ecr 1098087576], length 4
00:00:37.049654 IP 10.0.0.6.1883 > 10.0.0.8.45174: Flags [P.], seq 3711507325:3711507329, ack 2446315853, win 85, options [nop,nop,TS val 3793383094 ecr 1098088575], length 4
00:00:37.051714 IP 10.0.0.6.1883 > 10.0.0.8.45174: Flags [P.], seq 3711507329:3711507333, ack 2446315857, win 85, options [nop,nop,TS val 3793383096 ecr 1098088577], length 4
00:00:37.880906 IP 10.0.0.6.1883 > 10.0.0.8.45174: Flags [P.], seq 3711507333:3711507335, ack 2446315859, win 85, options [nop,nop,TS val 3793383925 ecr 1098089406], length 2
00:00:38.050950 IP 10.0.0.6.1883 > 10.0.0.8.45174: Flags [P.], seq 3711507335:3711507339, ack 2446316254, win 85, options [nop,nop,TS val 3793384095 ecr 1098089576], length 4
00:00:38.052899 IP 10.0.0.6.1883 > 10.0.0.8.45174: Flags [P.], seq 3711507339:3711507343, ack 2446316258, win 85, options [nop,nop,TS val 3793384097 ecr 1098089578], length 4
00:00:39.051822 IP 10.0.0.6.1883 > 10.0.0.8.45174: Flags [P.], seq 3711507343:3711507347, ack 2446316653, win 85, options [nop,nop,TS val 3793385096 ecr 1098090577], length 4
00:00:39.053831 IP 10.0.0.6.1883 > 10.0.0.8.45174: Flags [P.], seq 3711507347:3711507351, ack 2446316657, win 85, options [nop,nop,TS val 3793385098 ecr 1098090579], length 4
00:00:40.053331 IP 10.0.0.6.1883 > 10.0.0.8.45174: Flags [P.], seq 3711507351:3711507355, ack 2446317052, win 85, options [nop,nop,TS val 3793386097 ecr 1098091578], length 4
00:00:40.055306 IP 10.0.0.6.1883 > 10.0.0.8.45174: Flags [P.], seq 3711507355:3711507359, ack 2446317056, win 85, options [nop,nop,TS val 3793386099 ecr 1098091580], length 4
00:00:41.054680 IP 10.0.0.6.1883 > 10.0.0.8.45174: Flags [P.], seq 3711507359:3711507363, ack 2446317451, win 85, options [nop,nop,TS val 3793387099 ecr 1098092580], length 4
00:00:41.056432 IP 10.0.0.6.1883 > 10.0.0.8.45174: Flags [P.], seq 3711507363:3711507367, ack 2446317455, win 85, options [nop,nop,TS val 3793387100 ecr 1098092581], length 4
00:00:42.057763 IP 10.0.0.6.1883 > 10.0.0.8.45174: Flags [P.], seq 3711507367:3711507371, ack 2446317850, win 85, options [nop,nop,TS val 3793388102 ecr 1098093581], length 4
00:00:42.060224 IP 10.0.0.6.1883 > 10.0.0.8.45174: Flags [P.], seq 3711507371:3711507375, ack 2446317854, win 85, options [nop,nop,TS val 3793388104 ecr 1098093585], length 4
00:00:42.884116 IP 10.0.0.6.1883 > 10.0.0.8.45174: Flags [P.], seq 3711507375:3711507377, ack 2446317856, win 85, options [nop,nop,TS val 3793388928 ecr 1098094407], length 2
00:00:43.061314 IP 10.0.0.6.1883 > 10.0.0.8.45174: Flags [P.], seq 3711507377:3711507381, ack 2446318251, win 85, options [nop,nop,TS val 3793389104 ecr 1098094583], length 4
00:00:43.065518 IP 10.0.0.6.1883 > 10.0.0.8.45174: Flags [P.], seq 3711507381:3711507385, ack 2446318255, win 85, options [nop,nop,TS val 3793389110 ecr 1098094590], length 4
00:00:44.061676 IP 10.0.0.6.1883 > 10.0.0.8.45174: Flags [P.], seq 3711507385:3711507389, ack 2446318650, win 85, options [nop,nop,TS val 3793390105 ecr 1098095584], length 4
00:00:44.069361 IP 10.0.0.6.1883 > 10.0.0.8.45174: Flags [P.], seq 3711507389:3711507393, ack 2446318654, win 85, options [nop,nop,TS val 3793390113 ecr 1098095594], length 4
00:00:45.072709 IP 10.0.0.6.1883 > 10.0.0.8.45174: Flags [P.], seq 3711507393:3711507397, ack 2446319049, win 85, options [nop,nop,TS val 3793391117 ecr 1098096596], length 4
00:00:45.075134 IP 10.0.0.6.1883 > 10.0.0.8.45174: Flags [P.], seq 3711507397:3711507401, ack 2446319053, win 85, options [nop,nop,TS val 3793391119 ecr 1098096600], length 4
00:00:46.075459 IP 10.0.0.6.1883 > 10.0.0.8.45174: Flags [P.], seq 3711507401:3711507405, ack 2446319448, win 85, options [nop,nop,TS val 3793392119 ecr 1098097598], length 4
00:00:46.078326 IP 10.0.0.6.1883 > 10.0.0.8.45174: Flags [P.], seq 3711507405:3711507409, ack 2446319452, win 85, options [nop,nop,TS val 3793392122 ecr 1098097603], length 4
00:00:47.075494 IP 10.0.0.6.1883 > 10.0.0.8.45174: Flags [P.], seq 3711507409:3711507413, ack 2446319847, win 85, options [nop,nop,TS val 3793393120 ecr 1098098599], length 4
00:00:47.076766 IP 10.0.0.6.1883 > 10.0.0.8.45174: Flags [P.], seq 3711507413:3711507417, ack 2446319851, win 85, options [nop,nop,TS val 3793393121 ecr 1098098602], length 4
00:00:47.884698 IP 10.0.0.6.1883 > 10.0.0.8.45174: Flags [P.], seq 3711507417:3711507419, ack 2446319853, win 85, options [nop,nop,TS val 3793393929 ecr 1098099409], length 2
00:00:48.077731 IP 10.0.0.6.1883 > 10.0.0.8.45174: Flags [P.], seq 3711507419:3711507423, ack 2446320248, win 85, options [nop,nop,TS val 3793394122 ecr 1098099602], length 4
00:00:48.079754 IP 10.0.0.6.1883 > 10.0.0.8.45174: Flags [P.], seq 3711507423:3711507427, ack 2446320252, win 85, options [nop,nop,TS val 3793394123 ecr 1098099605], length 4
00:00:48.552953 IP 10.0.0.6.1883 > 10.0.0.8.45174: Flags [P.], seq 3711507423:3711507427, ack 2446320252, win 85, options [nop,nop,TS val 3793394587 ecr 1098099605], length 4
00:00:49.082737 IP 10.0.0.6.1883 > 10.0.0.8.45174: Flags [P.], seq 3711507427:3711507431, ack 2446320647, win 85, options [nop,nop,TS val 3793395127 ecr 1098100607], length 4
00:00:49.086589 IP 10.0.0.6.1883 > 10.0.0.8.45174: Flags [P.], seq 3711507431:3711507435, ack 2446320651, win 85, options [nop,nop,TS val 3793395130 ecr 1098100611], length 4
00:00:50.107794 IP 10.0.0.6.1883 > 10.0.0.8.45174: Flags [P.], seq 3711507435:3711507439, ack 2446321046, win 85, options [nop,nop,TS val 3793396152 ecr 1098101632], length 4
00:00:50.108820 IP 10.0.0.6.1883 > 10.0.0.8.45174: Flags [P.], seq 3711507439:3711507443, ack 2446321050, win 85, options [nop,nop,TS val 3793396153 ecr 1098101634], length 4
00:00:51.109882 IP 10.0.0.6.1883 > 10.0.0.8.45174: Flags [P.], seq 3711507443:3711507447, ack 2446321445, win 85, options [nop,nop,TS val 3793397154 ecr 1098102633], length 4
00:00:51.112163 IP 10.0.0.6.1883 > 10.0.0.8.45174: Flags [P.], seq 3711507447:3711507451, ack 2446321449, win 85, options [nop,nop,TS val 3793397156 ecr 1098102637], length 4
00:00:52.112739 IP 10.0.0.6.1883 > 10.0.0.8.45174: Flags [P.], seq 3711507451:3711507455, ack 2446321844, win 85, options [nop,nop,TS val 3793398157 ecr 1098103636], length 4
00:00:52.122459 IP 10.0.0.6.1883 > 10.0.0.8.45174: Flags [P.], seq 3711507455:3711507459, ack 2446321848, win 85, options [nop,nop,TS val 3793398166 ecr 1098103647], length 4
00:00:52.565827 IP 10.0.0.6.1883 > 10.0.0.8.45174: Flags [P.], seq 3711507455:3711507459, ack 2446321848, win 85, options [nop,nop,TS val 3793398610 ecr 1098103647], length 4
00:00:52.898124 IP 10.0.0.6.1883 > 10.0.0.8.45174: Flags [P.], seq 3711507459:3711507461, ack 2446321850, win 85, options [nop,nop,TS val 3793398942 ecr 1098104422], length 2
00:00:53.140330 IP 10.0.0.6.1883 > 10.0.0.8.45174: Flags [P.], seq 3711507461:3711507465, ack 2446322245, win 85, options [nop,nop,TS val 3793399184 ecr 1098104665], length 4
00:00:53.143638 IP 10.0.0.6.1883 > 10.0.0.8.45174: Flags [P.], seq 3711507465:3711507469, ack 2446322249, win 85, options [nop,nop,TS val 3793399188 ecr 1098104669], length 4
00:00:54.148508 IP 10.0.0.6.1883 > 10.0.0.8.45174: Flags [P.], seq 3711507469:3711507473, ack 2446322644, win 85, options [nop,nop,TS val 3793400190 ecr 1098105670], length 4
00:00:54.163066 IP 10.0.0.6.1883 > 10.0.0.8.45174: Flags [P.], seq 3711507473:3711507477, ack 2446322648, win 85, options [nop,nop,TS val 3793400207 ecr 1098105687], length 4
00:00:55.168205 IP 10.0.0.6.1883 > 10.0.0.8.45174: Flags [P.], seq 3711507477:3711507481, ack 2446323043, win 85, options [nop,nop,TS val 3793401212 ecr 1098106692], length 4
00:00:55.170293 IP 10.0.0.6.1883 > 10.0.0.8.45174: Flags [P.], seq 3711507481:3711507485, ack 2446323047, win 85, options [nop,nop,TS val 3793401214 ecr 1098106695], length 4
00:00:56.168845 IP 10.0.0.6.1883 > 10.0.0.8.45174: Flags [P.], seq 3711507485:3711507489, ack 2446323442, win 85, options [nop,nop,TS val 3793402213 ecr 1098107694], length 4
00:00:56.171175 IP 10.0.0.6.1883 > 10.0.0.8.45174: Flags [P.], seq 3711507489:3711507493, ack 2446323446, win 85, options [nop,nop,TS val 3793402215 ecr 1098107696], length 4
00:00:57.170760 IP 10.0.0.6.1883 > 10.0.0.8.45174: Flags [P.], seq 3711507493:3711507497, ack 2446323841, win 85, options [nop,nop,TS val 3793403215 ecr 1098108696], length 4
00:00:57.172286 IP 10.0.0.6.1883 > 10.0.0.8.45174: Flags [P.], seq 3711507497:3711507501, ack 2446323845, win 85, options [nop,nop,TS val 3793403216 ecr 1098108698], length 4
00:00:57.902066 IP 10.0.0.6.1883 > 10.0.0.8.45174: Flags [P.], seq 3711507501:3711507503, ack 2446323847, win 85, options [nop,nop,TS val 3793403946 ecr 1098109427], length 2
00:00:58.172014 IP 10.0.0.6.1883 > 10.0.0.8.45174: Flags [P.], seq 3711507503:3711507507, ack 2446324242, win 85, options [nop,nop,TS val 3793404216 ecr 1098109697], length 4
00:00:58.173592 IP 10.0.0.6.1883 > 10.0.0.8.45174: Flags [P.], seq 3711507507:3711507511, ack 2446324246, win 85, options [nop,nop,TS val 3793404218 ecr 1098109699], length 4
00:00:59.173002 IP 10.0.0.6.1883 > 10.0.0.8.45174: Flags [P.], seq 3711507511:3711507515, ack 2446324641, win 85, options [nop,nop,TS val 3793405217 ecr 1098110698], length 4
00:00:59.174804 IP 10.0.0.6.1883 > 10.0.0.8.45174: Flags [P.], seq 3711507515:3711507519, ack 2446324645, win 85, options [nop,nop,TS val 3793405219 ecr 1098110700], length 4
00:01:00.174122 IP 10.0.0.6.1883 > 10.0.0.8.45174: Flags [P.], seq 3711507519:3711507523, ack 2446325040, win 85, options [nop,nop,TS val 3793406218 ecr 1098111699], length 4
00:01:00.176244 IP 10.0.0.6.1883 > 10.0.0.8.45174: Flags [P.], seq 3711507523:3711507527, ack 2446325044, win 85, options [nop,nop,TS val 3793406220 ecr 1098111702], length 4
00:01:01.176741 IP 10.0.0.6.1883 > 10.0.0.8.45174: Flags [P.], seq 3711507527:3711507531, ack 2446325439, win 85, options [nop,nop,TS val 3793407221 ecr 1098112701], length 4
00:01:01.178619 IP 10.0.0.6.1883 > 10.0.0.8.45174: Flags [P.], seq 3711507531:3711507535, ack 2446325443, win 85, options [nop,nop,TS val 3793407223 ecr 1098112704], length 4
00:01:02.178208 IP 10.0.0.6.1883 > 10.0.0.8.45174: Flags [P.], seq 3711507535:3711507539, ack 2446325838, win 85, options [nop,nop,TS val 3793408222 ecr 1098113703], length 4
00:01:02.180308 IP 10.0.0.6.1883 > 10.0.0.8.45174: Flags [P.], seq 3711507539:3711507543, ack 2446325842, win 85, options [nop,nop,TS val 3793408224 ecr 1098113706], length 4
00:01:02.903115 IP 10.0.0.6.1883 > 10.0.0.8.45174: Flags [P.], seq 3711507543:3711507545, ack 2446325844, win 85, options [nop,nop,TS val 3793408947 ecr 1098114428], length 2
00:01:03.178966 IP 10.0.0.6.1883 > 10.0.0.8.45174: Flags [P.], seq 3711507545:3711507549, ack 2446326239, win 85, options [nop,nop,TS val 3793409223 ecr 1098114704], length 4
00:01:03.181353 IP 10.0.0.6.1883 > 10.0.0.8.45174: Flags [P.], seq 3711507549:3711507553, ack 2446326243, win 85, options [nop,nop,TS val 3793409225 ecr 1098114706], length 4
00:01:04.180343 IP 10.0.0.6.1883 > 10.0.0.8.45174: Flags [P.], seq 3711507553:3711507557, ack 2446326638, win 85, options [nop,nop,TS val 3793410224 ecr 1098115705], length 4
00:01:04.182378 IP 10.0.0.6.1883 > 10.0.0.8.45174: Flags [P.], seq 3711507557:3711507561, ack 2446326642, win 85, options [nop,nop,TS val 3793410226 ecr 1098115708], length 4
00:01:05.181761 IP 10.0.0.6.1883 > 10.0.0.8.45174: Flags [P.], seq 3711507561:3711507565, ack 2446327037, win 85, options [nop,nop,TS val 3793411226 ecr 1098116707], length 4
00:01:05.183677 IP 10.0.0.6.1883 > 10.0.0.8.45174: Flags [P.], seq 3711507565:3711507569, ack 2446327041, win 85, options [nop,nop,TS val 3793411228 ecr 1098116709], length 4
00:01:06.228628 IP 10.0.0.6.1883 > 10.0.0.8.45174: Flags [P.], seq 3711507569:3711507573, ack 2446327436, win 85, options [nop,nop,TS val 3793412230 ecr 1098117709], length 4
00:01:06.291459 IP 10.0.0.6.1883 > 10.0.0.8.45174: Flags [P.], seq 3711507573:3711507577, ack 2446327440, win 85, options [nop,nop,TS val 3793412335 ecr 1098117816], length 4
00:01:07.294173 IP 10.0.0.6.1883 > 10.0.0.8.45174: Flags [P.], seq 3711507577:3711507581, ack 2446327835, win 85, options [nop,nop,TS val 3793413338 ecr 1098118818], length 4
00:01:07.300982 IP 10.0.0.6.1883 > 10.0.0.8.45174: Flags [P.], seq 3711507581:3711507585, ack 2446327839, win 85, options [nop,nop,TS val 3793413345 ecr 1098118825], length 4
00:01:07.906156 IP 10.0.0.6.1883 > 10.0.0.8.45174: Flags [P.], seq 3711507585:3711507587, ack 2446327841, win 85, options [nop,nop,TS val 3793413950 ecr 1098119431], length 2
00:01:08.296513 IP 10.0.0.6.1883 > 10.0.0.8.45174: Flags [P.], seq 3711507587:3711507591, ack 2446328236, win 85, options [nop,nop,TS val 3793414340 ecr 1098119820], length 4
00:01:08.300924 IP 10.0.0.6.1883 > 10.0.0.8.45174: Flags [P.], seq 3711507591:3711507595, ack 2446328240, win 85, options [nop,nop,TS val 3793414345 ecr 1098119825], length 4
00:01:09.297973 IP 10.0.0.6.1883 > 10.0.0.8.45174: Flags [P.], seq 3711507595:3711507599, ack 2446328635, win 85, options [nop,nop,TS val 3793415341 ecr 1098120821], length 4
00:01:09.307317 IP 10.0.0.6.1883 > 10.0.0.8.45174: Flags [P.], seq 3711507599:3711507603, ack 2446328639, win 85, options [nop,nop,TS val 3793415351 ecr 1098120832], length 4
00:01:10.328317 IP 10.0.0.6.1883 > 10.0.0.8.45174: Flags [P.], seq 3711507603:3711507607, ack 2446329034, win 85, options [nop,nop,TS val 3793416372 ecr 1098121852], length 4
00:01:10.334067 IP 10.0.0.6.1883 > 10.0.0.8.45174: Flags [P.], seq 3711507607:3711507611, ack 2446329038, win 85, options [nop,nop,TS val 3793416377 ecr 1098121859], length 4
00:01:11.340562 IP 10.0.0.6.1883 > 10.0.0.8.45174: Flags [P.], seq 3711507611:3711507615, ack 2446329433, win 85, options [nop,nop,TS val 3793417382 ecr 1098122862], length 4
00:01:11.348563 IP 10.0.0.6.1883 > 10.0.0.8.45174: Flags [P.], seq 3711507615:3711507619, ack 2446329437, win 85, options [nop,nop,TS val 3793417393 ecr 1098122873], length 4
00:01:12.342365 IP 10.0.0.6.1883 > 10.0.0.8.45174: Flags [P.], seq 3711507619:3711507623, ack 2446329832, win 85, options [nop,nop,TS val 3793418386 ecr 1098123867], length 4
00:01:12.344773 IP 10.0.0.6.1883 > 10.0.0.8.45174: Flags [P.], seq 3711507623:3711507627, ack 2446329836, win 85, options [nop,nop,TS val 3793418389 ecr 1098123870], length 4
00:01:12.953530 IP 10.0.0.6.1883 > 10.0.0.8.45174: Flags [P.], seq 3711507627:3711507629, ack 2446329838, win 85, options [nop,nop,TS val 3793418997 ecr 1098124477], length 2
00:01:13.541676 IP 10.0.0.6.1883 > 10.0.0.8.45174: Flags [P.], seq 3711507629:3711507633, ack 2446330233, win 85, options [nop,nop,TS val 3793419586 ecr 1098125065], length 4
00:01:13.561416 IP 10.0.0.6.1883 > 10.0.0.8.45174: Flags [P.], seq 3711507633:3711507637, ack 2446330237, win 85, options [nop,nop,TS val 3793419605 ecr 1098125083], length 4
00:01:14.587613 IP 10.0.0.6.1883 > 10.0.0.8.45174: Flags [P.], seq 3711507637:3711507641, ack 2446330632, win 85, options [nop,nop,TS val 3793420631 ecr 1098126112], length 4
00:01:14.591310 IP 10.0.0.6.1883 > 10.0.0.8.45174: Flags [P.], seq 3711507641:3711507645, ack 2446330636, win 85, options [nop,nop,TS val 3793420635 ecr 1098126115], length 4
00:01:15.594019 IP 10.0.0.6.1883 > 10.0.0.8.45174: Flags [P.], seq 3711507645:3711507649, ack 2446331031, win 85, options [nop,nop,TS val 3793421638 ecr 1098127118], length 4
00:01:15.606915 IP 10.0.0.6.1883 > 10.0.0.8.45174: Flags [P.], seq 3711507649:3711507653, ack 2446331035, win 85, options [nop,nop,TS val 3793421651 ecr 1098127131], length 4
00:01:16.631659 IP 10.0.0.6.1883 > 10.0.0.8.45174: Flags [P.], seq 3711507653:3711507657, ack 2446331430, win 85, options [nop,nop,TS val 3793422675 ecr 1098128155], length 4
00:01:16.636588 IP 10.0.0.6.1883 > 10.0.0.8.45174: Flags [P.], seq 3711507657:3711507661, ack 2446331434, win 85, options [nop,nop,TS val 3793422680 ecr 1098128160], length 4
00:01:17.655764 IP 10.0.0.6.1883 > 10.0.0.8.45174: Flags [P.], seq 3711507661:3711507665, ack 2446331829, win 85, options [nop,nop,TS val 3793423700 ecr 1098129179], length 4
00:01:17.701526 IP 10.0.0.6.1883 > 10.0.0.8.45174: Flags [P.], seq 3711507665:3711507669, ack 2446331833, win 85, options [nop,nop,TS val 3793423745 ecr 1098129225], length 4
00:01:17.976611 IP 10.0.0.6.1883 > 10.0.0.8.45174: Flags [P.], seq 3711507669:3711507671, ack 2446331835, win 85, options [nop,nop,TS val 3793424021 ecr 1098129501], length 2
00:01:18.664424 IP 10.0.0.6.1883 > 10.0.0.8.45174: Flags [P.], seq 3711507671:3711507675, ack 2446332230, win 85, options [nop,nop,TS val 3793424708 ecr 1098130188], length 4
00:01:18.667130 IP 10.0.0.6.1883 > 10.0.0.8.45174: Flags [P.], seq 3711507675:3711507679, ack 2446332234, win 85, options [nop,nop,TS val 3793424711 ecr 1098130192], length 4
00:01:19.664956 IP 10.0.0.6.1883 > 10.0.0.8.45174: Flags [P.], seq 3711507679:3711507683, ack 2446332629, win 85, options [nop,nop,TS val 3793425709 ecr 1098131189], length 4
00:01:19.666750 IP 10.0.0.6.1883 > 10.0.0.8.45174: Flags [P.], seq 3711507683:3711507687, ack 2446332633, win 85, options [nop,nop,TS val 3793425711 ecr 1098131192], length 4
00:01:20.665655 IP 10.0.0.6.1883 > 10.0.0.8.45174: Flags [P.], seq 3711507687:3711507691, ack 2446333028, win 85, options [nop,nop,TS val 3793426710 ecr 1098132190], length 4
00:01:20.667637 IP 10.0.0.6.1883 > 10.0.0.8.45174: Flags [P.], seq 3711507691:3711507695, ack 2446333032, win 85, options [nop,nop,TS val 3793426711 ecr 1098132192], length 4
00:01:21.670313 IP 10.0.0.6.1883 > 10.0.0.8.45174: Flags [P.], seq 3711507695:3711507699, ack 2446333427, win 85, options [nop,nop,TS val 3793427714 ecr 1098133195], length 4
00:01:21.671647 IP 10.0.0.6.1883 > 10.0.0.8.45174: Flags [P.], seq 3711507699:3711507703, ack 2446333431, win 85, options [nop,nop,TS val 3793427716 ecr 1098133197], length 4
00:01:22.674442 IP 10.0.0.6.1883 > 10.0.0.8.45174: Flags [P.], seq 3711507703:3711507707, ack 2446333826, win 85, options [nop,nop,TS val 3793428718 ecr 1098134200], length 4
00:01:22.676034 IP 10.0.0.6.1883 > 10.0.0.8.45174: Flags [P.], seq 3711507707:3711507711, ack 2446333830, win 85, options [nop,nop,TS val 3793428720 ecr 1098134201], length 4
00:01:22.988102 IP 10.0.0.6.1883 > 10.0.0.8.45174: Flags [P.], seq 3711507711:3711507713, ack 2446333832, win 85, options [nop,nop,TS val 3793429032 ecr 1098134513], length 2
00:01:23.681326 IP 10.0.0.6.1883 > 10.0.0.8.45174: Flags [P.], seq 3711507713:3711507717, ack 2446334227, win 85, options [nop,nop,TS val 3793429725 ecr 1098135206], length 4
00:01:23.683061 IP 10.0.0.6.1883 > 10.0.0.8.45174: Flags [P.], seq 3711507717:3711507721, ack 2446334231, win 85, options [nop,nop,TS val 3793429727 ecr 1098135209], length 4
00:01:24.683881 IP 10.0.0.6.1883 > 10.0.0.8.45174: Flags [P.], seq 3711507721:3711507725, ack 2446334626, win 85, options [nop,nop,TS val 3793430728 ecr 1098136207], length 4
00:01:24.685093 IP 10.0.0.6.1883 > 10.0.0.8.45174: Flags [P.], seq 3711507725:3711507729, ack 2446334630, win 85, options [nop,nop,TS val 3793430729 ecr 1098136210], length 4
00:01:25.682358 IP 10.0.0.6.1883 > 10.0.0.8.45174: Flags [P.], seq 3711507729:3711507733, ack 2446335025, win 85, options [nop,nop,TS val 3793431726 ecr 1098137207], length 4
00:01:25.685155 IP 10.0.0.6.1883 > 10.0.0.8.45174: Flags [P.], seq 3711507733:3711507737, ack 2446335029, win 85, options [nop,nop,TS val 3793431729 ecr 1098137210], length 4
00:01:26.686224 IP 10.0.0.6.1883 > 10.0.0.8.45174: Flags [P.], seq 3711507737:3711507741, ack 2446335424, win 85, options [nop,nop,TS val 3793432730 ecr 1098138211], length 4
00:01:26.689635 IP 10.0.0.6.1883 > 10.0.0.8.45174: Flags [P.], seq 3711507741:3711507745, ack 2446335428, win 85, options [nop,nop,TS val 3793432733 ecr 1098138213], length 4
00:01:27.691902 IP 10.0.0.6.1883 > 10.0.0.8.45174: Flags [P.], seq 3711507745:3711507749, ack 2446335823, win 85, options [nop,nop,TS val 3793433736 ecr 1098139216], length 4
00:01:27.693796 IP 10.0.0.6.1883 > 10.0.0.8.45174: Flags [P.], seq 3711507749:3711507753, ack 2446335827, win 85, options [nop,nop,TS val 3793433738 ecr 1098139219], length 4
00:01:27.995903 IP 10.0.0.6.1883 > 10.0.0.8.45174: Flags [P.], seq 3711507753:3711507755, ack 2446335829, win 85, options [nop,nop,TS val 3793434040 ecr 1098139520], length 2
00:01:28.694635 IP 10.0.0.6.1883 > 10.0.0.8.45174: Flags [P.], seq 3711507755:3711507759, ack 2446336224, win 85, options [nop,nop,TS val 3793434739 ecr 1098140218], length 4
00:01:28.696910 IP 10.0.0.6.1883 > 10.0.0.8.45174: Flags [P.], seq 3711507759:3711507763, ack 2446336228, win 85, options [nop,nop,TS val 3793434741 ecr 1098140221], length 4
00:01:29.002347 IP 10.0.0.6.1883 > 10.0.0.8.45174: Flags [P.], seq 3711507759:3711507763, ack 2446336228, win 85, options [nop,nop,TS val 3793435046 ecr 1098140221], length 4
00:01:29.719044 IP 10.0.0.6.1883 > 10.0.0.8.45174: Flags [P.], seq 3711507763:3711507767, ack 2446336623, win 85, options [nop,nop,TS val 3793435760 ecr 1098141240], length 4
00:01:29.729799 IP 10.0.0.6.1883 > 10.0.0.8.45174: Flags [P.], seq 3711507767:3711507771, ack 2446336627, win 85, options [nop,nop,TS val 3793435773 ecr 1098141251], length 4
00:01:30.735703 IP 10.0.0.6.1883 > 10.0.0.8.45174: Flags [P.], seq 3711507771:3711507775, ack 2446337022, win 85, options [nop,nop,TS val 3793436780 ecr 1098142260], length 4
00:01:30.738148 IP 10.0.0.6.1883 > 10.0.0.8.45174: Flags [P.], seq 3711507775:3711507779, ack 2446337026, win 85, options [nop,nop,TS val 3793436782 ecr 1098142263], length 4
00:01:31.740758 IP 10.0.0.6.1883 > 10.0.0.8.45174: Flags [P.], seq 3711507779:3711507783, ack 2446337421, win 85, options [nop,nop,TS val 3793437785 ecr 1098143264], length 4
00:01:31.747068 IP 10.0.0.6.1883 > 10.0.0.8.45174: Flags [P.], seq 3711507783:3711507787, ack 2446337425, win 85, options [nop,nop,TS val 3793437791 ecr 1098143271], length 4
00:01:32.742287 IP 10.0.0.6.1883 > 10.0.0.8.45174: Flags [P.], seq 3711507787:3711507791, ack 2446337820, win 85, options [nop,nop,TS val 3793438786 ecr 1098144265], length 4
00:01:32.748133 IP 10.0.0.6.1883 > 10.0.0.8.45174: Flags [P.], seq 3711507791:3711507795, ack 2446337824, win 85, options [nop,nop,TS val 3793438792 ecr 1098144273], length 4
00:01:33.000297 IP 10.0.0.6.1883 > 10.0.0.8.45174: Flags [P.], seq 3711507795:3711507797, ack 2446337826, win 85, options [nop,nop,TS val 3793439042 ecr 1098144522], length 2
00:01:33.747863 IP 10.0.0.6.1883 > 10.0.0.8.45174: Flags [P.], seq 3711507797:3711507801, ack 2446338221, win 85, options [nop,nop,TS val 3793439792 ecr 1098145271], length 4
00:01:33.752545 IP 10.0.0.6.1883 > 10.0.0.8.45174: Flags [P.], seq 3711507801:3711507805, ack 2446338225, win 85, options [nop,nop,TS val 3793439797 ecr 1098145277], length 4
00:01:34.193148 IP 10.0.0.6.1883 > 10.0.0.8.45174: Flags [P.], seq 3711507801:3711507805, ack 2446338225, win 85, options [nop,nop,TS val 3793440170 ecr 1098145277], length 4
00:01:34.792162 IP 10.0.0.6.1883 > 10.0.0.8.45174: Flags [P.], seq 3711507805:3711507809, ack 2446338620, win 85, options [nop,nop,TS val 3793440836 ecr 1098146316], length 4
00:01:34.796648 IP 10.0.0.6.1883 > 10.0.0.8.45174: Flags [P.], seq 3711507809:3711507813, ack 2446338624, win 85, options [nop,nop,TS val 3793440841 ecr 1098146321], length 4
00:01:35.832488 IP 10.0.0.6.1883 > 10.0.0.8.45174: Flags [P.], seq 3711507813:3711507817, ack 2446339019, win 85, options [nop,nop,TS val 3793441876 ecr 1098147355], length 4
00:01:35.839317 IP 10.0.0.6.1883 > 10.0.0.8.45174: Flags [P.], seq 3711507817:3711507821, ack 2446339023, win 85, options [nop,nop,TS val 3793441883 ecr 1098147363], length 4
00:01:36.263136 IP 10.0.0.6.1883 > 10.0.0.8.45174: Flags [P.], seq 3711507817:3711507821, ack 2446339023, win 85, options [nop,nop,TS val 3793442289 ecr 1098147363], length 4
00:01:36.836006 IP 10.0.0.6.1883 > 10.0.0.8.45174: Flags [P.], seq 3711507821:3711507825, ack 2446339418, win 85, options [nop,nop,TS val 3793442878 ecr 1098148358], length 4
00:01:36.841150 IP 10.0.0.6.1883 > 10.0.0.8.45174: Flags [P.], seq 3711507825:3711507829, ack 2446339422, win 85, options [nop,nop,TS val 3793442885 ecr 1098148365], length 4
00:01:37.834736 IP 10.0.0.6.1883 > 10.0.0.8.45174: Flags [P.], seq 3711507829:3711507833, ack 2446339817, win 85, options [nop,nop,TS val 3793443878 ecr 1098149359], length 4
00:01:37.836669 IP 10.0.0.6.1883 > 10.0.0.8.45174: Flags [P.], seq 3711507833:3711507837, ack 2446339821, win 85, options [nop,nop,TS val 3793443881 ecr 1098149362], length 4
00:01:38.004512 IP 10.0.0.6.1883 > 10.0.0.8.45174: Flags [P.], seq 3711507837:3711507839, ack 2446339823, win 85, options [nop,nop,TS val 3793444049 ecr 1098149529], length 2
00:01:38.837715 IP 10.0.0.6.1883 > 10.0.0.8.45174: Flags [P.], seq 3711507839:3711507843, ack 2446340218, win 85, options [nop,nop,TS val 3793444881 ecr 1098150362], length 4
00:01:38.842046 IP 10.0.0.6.1883 > 10.0.0.8.45174: Flags [P.], seq 3711507843:3711507847, ack 2446340222, win 85, options [nop,nop,TS val 3793444886 ecr 1098150367], length 4
00:01:39.340283 IP 10.0.0.6.1883 > 10.0.0.8.45174: Flags [P.], seq 3711507843:3711507847, ack 2446340222, win 85, options [nop,nop,TS val 3793445383 ecr 1098150367], length 4
00:01:39.845393 IP 10.0.0.6.1883 > 10.0.0.8.45174: Flags [P.], seq 3711507847:3711507851, ack 2446340617, win 85, options [nop,nop,TS val 3793445889 ecr 1098151368], length 4
00:01:39.849546 IP 10.0.0.6.1883 > 10.0.0.8.45174: Flags [P.], seq 3711507851:3711507855, ack 2446340621, win 85, options [nop,nop,TS val 3793445893 ecr 1098151372], length 4
00:01:40.848018 IP 10.0.0.6.1883 > 10.0.0.8.45174: Flags [P.], seq 3711507855:3711507859, ack 2446341016, win 85, options [nop,nop,TS val 3793446892 ecr 1098152372], length 4
00:01:40.850458 IP 10.0.0.6.1883 > 10.0.0.8.45174: Flags [P.], seq 3711507859:3711507863, ack 2446341020, win 85, options [nop,nop,TS val 3793446894 ecr 1098152375], length 4
00:01:41.856259 IP 10.0.0.6.1883 > 10.0.0.8.45174: Flags [P.], seq 3711507863:3711507867, ack 2446341415, win 85, options [nop,nop,TS val 3793447899 ecr 1098153379], length 4
00:01:41.860373 IP 10.0.0.6.1883 > 10.0.0.8.45174: Flags [P.], seq 3711507867:3711507871, ack 2446341419, win 85, options [nop,nop,TS val 3793447904 ecr 1098153385], length 4
00:01:42.858375 IP 10.0.0.6.1883 > 10.0.0.8.45174: Flags [P.], seq 3711507871:3711507875, ack 2446341814, win 85, options [nop,nop,TS val 3793448902 ecr 1098154382], length 4
00:01:42.862090 IP 10.0.0.6.1883 > 10.0.0.8.45174: Flags [P.], seq 3711507875:3711507879, ack 2446341818, win 85, options [nop,nop,TS val 3793448906 ecr 1098154387], length 4
00:01:43.006904 IP 10.0.0.6.1883 > 10.0.0.8.45174: Flags [P.], seq 3711507879:3711507881, ack 2446341820, win 85, options [nop,nop,TS val 3793449051 ecr 1098154531], length 2
00:01:43.860879 IP 10.0.0.6.1883 > 10.0.0.8.45174: Flags [P.], seq 3711507881:3711507885, ack 2446342215, win 85, options [nop,nop,TS val 3793449905 ecr 1098155385], length 4
00:01:43.868695 IP 10.0.0.6.1883 > 10.0.0.8.45174: Flags [P.], seq 3711507885:3711507889, ack 2446342219, win 85, options [nop,nop,TS val 3793449913 ecr 1098155394], length 4
00:01:44.862447 IP 10.0.0.6.1883 > 10.0.0.8.45174: Flags [P.], seq 3711507889:3711507893, ack 2446342614, win 85, options [nop,nop,TS val 3793450906 ecr 1098156387], length 4
00:01:44.864174 IP 10.0.0.6.1883 > 10.0.0.8.45174: Flags [P.], seq 3711507893:3711507897, ack 2446342618, win 85, options [nop,nop,TS val 3793450908 ecr 1098156389], length 4
00:01:45.865941 IP 10.0.0.6.1883 > 10.0.0.8.45174: Flags [P.], seq 3711507897:3711507901, ack 2446343013, win 85, options [nop,nop,TS val 3793451910 ecr 1098157391], length 4
00:01:45.867736 IP 10.0.0.6.1883 > 10.0.0.8.45174: Flags [P.], seq 3711507901:3711507905, ack 2446343017, win 85, options [nop,nop,TS val 3793451912 ecr 1098157393], length 4
00:01:46.866867 IP 10.0.0.6.1883 > 10.0.0.8.45174: Flags [P.], seq 3711507905:3711507909, ack 2446343412, win 85, options [nop,nop,TS val 3793452911 ecr 1098158392], length 4
00:01:46.869046 IP 10.0.0.6.1883 > 10.0.0.8.45174: Flags [P.], seq 3711507909:3711507913, ack 2446343416, win 85, options [nop,nop,TS val 3793452913 ecr 1098158394], length 4
00:01:47.868471 IP 10.0.0.6.1883 > 10.0.0.8.45174: Flags [P.], seq 3711507913:3711507917, ack 2446343811, win 85, options [nop,nop,TS val 3793453912 ecr 1098159393], length 4
00:01:47.870373 IP 10.0.0.6.1883 > 10.0.0.8.45174: Flags [P.], seq 3711507917:3711507921, ack 2446343815, win 85, options [nop,nop,TS val 3793453914 ecr 1098159396], length 4
00:01:48.015738 IP 10.0.0.6.1883 > 10.0.0.8.45174: Flags [P.], seq 3711507921:3711507923, ack 2446343817, win 85, options [nop,nop,TS val 3793454060 ecr 1098159541], length 2
00:01:49.833657 IP 10.0.0.6.1883 > 10.0.0.8.45174: Flags [F.], seq 3711507923, ack 2446343818, win 85, options [nop,nop,TS val 3793455878 ecr 1098161358], length 0