00:00:06.880682 IP 10.0.0.6.1883 > 10.0.0.8.45134: Flags [S.], seq 3161117289, ack 462145292, win 43440, options [mss 1460,sackOK,TS val 3793209330 ecr 1097914775,nop,wscale 9], length 0
00:00:06.891960 IP 10.0.0.6.1883 > 10.0.0.8.45134: Flags [.], ack 462145312, win 85, options [nop,nop,TS val 3793209341 ecr 1097914822], length 0
00:00:06.892247 IP 10.0.0.6.1883 > 10.0.0.8.45134: Flags [P.], seq 3161117290:3161117294, ack 462145312, win 85, options [nop,nop,TS val 3793209341 ecr 1097914822], length 4
00:00:06.894154 IP 10.0.0.6.1883 > 10.0.0.8.45134: Flags [P.], seq 3161117294:3161117359, ack 462145376, win 85, options [nop,nop,TS val 3793209343 ecr 1097914824], length 65
00:00:06.894718 IP 10.0.0.6.1883 > 10.0.0.8.45134: Flags [P.], seq 3161117359:3161117364, ack 462145771, win 85, options [nop,nop,TS val 3793209344 ecr 1097914825], length 5
00:00:06.947622 IP 10.0.0.6.1883 > 10.0.0.8.45134: Flags [P.], seq 3161117364:3161117368, ack 462145771, win 85, options [nop,nop,TS val 3793209396 ecr 1097914867], length 4
00:00:06.979059 IP 10.0.0.6.1883 > 10.0.0.8.45134: Flags [P.], seq 3161117368:3161117372, ack 462145775, win 85, options [nop,nop,TS val 3793209428 ecr 1097914909], length 4
00:00:07.848699 IP 10.0.0.6.1883 > 10.0.0.8.45134: Flags [P.], seq 3161117372:3161117376, ack 462146170, win 85, options [nop,nop,TS val 3793210298 ecr 1097915777], length 4
00:00:07.851158 IP 10.0.0.6.1883 > 10.0.0.8.45134: Flags [P.], seq 3161117376:3161117380, ack 462146174, win 85, options [nop,nop,TS val 3793210300 ecr 1097915780], length 4
00:00:08.850790 IP 10.0.0.6.1883 > 10.0.0.8.45134: Flags [P.], seq 3161117380:3161117384, ack 462146569, win 85, options [nop,nop,TS val 3793211300 ecr 1097916780], length 4
00:00:08.852158 IP 10.0.0.6.1883 > 10.0.0.8.45134: Flags [P.], seq 3161117384:3161117388, ack 462146573, win 85, options [nop,nop,TS val 3793211301 ecr 1097916782], length 4
00:00:09.897329 IP 10.0.0.6.1883 > 10.0.0.8.45134: Flags [P.], seq 3161117388:3161117392, ack 462146968, win 85, options [nop,nop,TS val 3793212346 ecr 1097917826], length 4
00:00:09.899583 IP 10.0.0.6.1883 > 10.0.0.8.45134: Flags [P.], seq 3161117392:3161117396, ack 462146972, win 85, options [nop,nop,TS val 3793212349 ecr 1097917829], length 4
00:00:10.136765 IP 10.0.0.6.1883 > 10.0.0.8.45134: Flags [P.], seq 3161117392:3161117396, ack 462146972, win 85, options [nop,nop,TS val 3793212586 ecr 1097917829], length 4
00:00:10.907715 IP 10.0.0.6.1883 > 10.0.0.8.45134: Flags [P.], seq 3161117396:3161117400, ack 462147367, win 85, options [nop,nop,TS val 3793213357 ecr 1097918835], length 4
00:00:10.913733 IP 10.0.0.6.1883 > 10.0.0.8.45134: Flags [P.], seq 3161117400:3161117404, ack 462147371, win 85, options [nop,nop,TS val 3793213363 ecr 1097918843], length 4
00:00:11.910385 IP 10.0.0.6.1883 > 10.0.0.8.45134: Flags [P.], seq 3161117404:3161117406, ack 462147373, win 85, options [nop,nop,TS val 3793214359 ecr 1097919839], length 2
00:00:11.912889 IP 10.0.0.6.1883 > 10.0.0.8.45134: Flags [P.], seq 3161117406:3161117410, ack 462147768, win 85, options [nop,nop,TS val 3793214362 ecr 1097919843], length 4
00:00:11.915460 IP 10.0.0.6.1883 > 10.0.0.8.45134: Flags [P.], seq 3161117410:3161117414, ack 462147772, win 85, options [nop,nop,TS val 3793214364 ecr 1097919845], length 4
00:00:12.920635 IP 10.0.0.6.1883 > 10.0.0.8.45134: Flags [P.], seq 3161117414:3161117418, ack 462148167, win 85, options [nop,nop,TS val 3793215370 ecr 1097920849], length 4
00:00:12.926813 IP 10.0.0.6.1883 > 10.0.0.8.45134: Flags [P.], seq 3161117418:3161117422, ack 462148171, win 85, options [nop,nop,TS val 3793215376 ecr 1097920857], length 4
00:00:13.922190 IP 10.0.0.6.1883 > 10.0.0.8.45134: Flags [P.], seq 3161117422:3161117426, ack 462148566, win 85, options [nop,nop,TS val 3793216371 ecr 1097921852], length 4
00:00:13.923814 IP 10.0.0.6.1883 > 10.0.0.8.45134: Flags [P.], seq 3161117426:3161117430, ack 462148570, win 85, options [nop,nop,TS val 3793216373 ecr 1097921854], length 4
00:00:14.924188 IP 10.0.0.6.1883 > 10.0.0.8.45134: Flags [P.], seq 3161117430:3161117434, ack 462148965, win 85, options [nop,nop,TS val 3793217373 ecr 1097922852], length 4
00:00:14.925229 IP 10.0.0.6.1883 > 10.0.0.8.45134: Flags [P.], seq 3161117434:3161117438, ack 462148969, win 85, options [nop,nop,TS val 3793217374 ecr 1097922856], length 4
00:00:15.922675 IP 10.0.0.6.1883 > 10.0.0.8.45134: Flags [P.], seq 3161117438:3161117442, ack 462149364, win 85, options [nop,nop,TS val 3793218372 ecr 1097923853], length 4
00:00:15.923745 IP 10.0.0.6.1883 > 10.0.0.8.45134: Flags [P.], seq 3161117442:3161117446, ack 462149368, win 85, options [nop,nop,TS val 3793218373 ecr 1097923854], length 4
00:00:16.909002 IP 10.0.0.6.1883 > 10.0.0.8.45134: Flags [P.], seq 3161117446:3161117448, ack 462149370, win 85, options [nop,nop,TS val 3793219358 ecr 1097924839], length 2
00:00:16.926850 IP 10.0.0.6.1883 > 10.0.0.8.45134: Flags [P.], seq 3161117448:3161117452, ack 462149765, win 85, options [nop,nop,TS val 3793219376 ecr 1097924855], length 4
00:00:16.927919 IP 10.0.0.6.1883 > 10.0.0.8.45134: Flags [P.], seq 3161117452:3161117456, ack 462149769, win 85, options [nop,nop,TS val 3793219377 ecr 1097924858], length 4
00:00:17.927184 IP 10.0.0.6.1883 > 10.0.0.8.45134: Flags [P.], seq 3161117456:3161117460, ack 462150164, win 85, options [nop,nop,TS val 3793220376 ecr 1097925856], length 4
00:00:17.929078 IP 10.0.0.6.1883 > 10.0.0.8.45134: Flags [P.], seq 3161117460:3161117464, ack 462150168, win 85, options [nop,nop,TS val 3793220378 ecr 1097925859], length 4
00:00:18.929449 IP 10.0.0.6.1883 > 10.0.0.8.45134: Flags [P.], seq 3161117464:3161117468, ack 462150563, win 85, options [nop,nop,TS val 3793221378 ecr 1097926858], length 4
00:00:18.931323 IP 10.0.0.6.1883 > 10.0.0.8.45134: Flags [P.], seq 3161117468:3161117472, ack 462150567, win 85, options [nop,nop,TS val 3793221380 ecr 1097926861], length 4
00:00:19.928737 IP 10.0.0.6.1883 > 10.0.0.8.45134: Flags [P.], seq 3161117472:3161117476, ack 462150962, win 85, options [nop,nop,TS val 3793222378 ecr 1097927859], length 4
00:00:19.929398 IP 10.0.0.6.1883 > 10.0.0.8.45134: Flags [P.], seq 3161117476:3161117480, ack 462150966, win 85, options [nop,nop,TS val 3793222378 ecr 1097927860], length 4
00:00:20.933534 IP 10.0.0.6.1883 > 10.0.0.8.45134: Flags [P.], seq 3161117480:3161117484, ack 462151361, win 85, options [nop,nop,TS val 3793223383 ecr 1097928862], length 4
00:00:20.935015 IP 10.0.0.6.1883 > 10.0.0.8.45134: Flags [P.], seq 3161117484:3161117488, ack 462151365, win 85, options [nop,nop,TS val 3793223384 ecr 1097928865], length 4
00:00:21.911892 IP 10.0.0.6.1883 > 10.0.0.8.45134: Flags [P.], seq 3161117488:3161117490, ack 462151367, win 85, options [nop,nop,TS val 3793224360 ecr 1097929841], length 2
00:00:21.935180 IP 10.0.0.6.1883 > 10.0.0.8.45134: Flags [P.], seq 3161117490:3161117494, ack 462151762, win 85, options [nop,nop,TS val 3793224384 ecr 1097929863], length 4
00:00:21.937023 IP 10.0.0.6.1883 > 10.0.0.8.45134: Flags [P.], seq 3161117494:3161117498, ack 462151766, win 85, options [nop,nop,TS val 3793224386 ecr 1097929867], length 4
00:00:22.938148 IP 10.0.0.6.1883 > 10.0.0.8.45134: Flags [P.], seq 3161117498:3161117502, ack 462152161, win 85, options [nop,nop,TS val 3793225387 ecr 1097930867], length 4
00:00:22.939470 IP 10.0.0.6.1883 > 10.0.0.8.45134: Flags [P.], seq 3161117502:3161117506, ack 462152165, win 85, options [nop,nop,TS val 3793225388 ecr 1097930870], length 4
00:00:23.937976 IP 10.0.0.6.1883 > 10.0.0.8.45134: Flags [P.], seq 3161117506:3161117510, ack 462152560, win 85, options [nop,nop,TS val 3793226387 ecr 1097931868], length 4
00:00:23.941957 IP 10.0.0.6.1883 > 10.0.0.8.45134: Flags [P.], seq 3161117510:3161117514, ack 462152564, win 85, options [nop,nop,TS val 3793226391 ecr 1097931872], length 4
00:00:24.941223 IP 10.0.0.6.1883 > 10.0.0.8.45134: Flags [P.], seq 3161117514:3161117518, ack 462152959, win 85, options [nop,nop,TS val 3793227390 ecr 1097932870], length 4
00:00:24.942233 IP 10.0.0.6.1883 > 10.0.0.8.45134: Flags [P.], seq 3161117518:3161117522, ack 462152963, win 85, options [nop,nop,TS val 3793227391 ecr 1097932873], length 4
00:00:25.940917 IP 10.0.0.6.1883 > 10.0.0.8.45134: Flags [P.], seq 3161117522:3161117526, ack 462153358, win 85, options [nop,nop,TS val 3793228390 ecr 1097933871], length 4
00:00:25.942621 IP 10.0.0.6.1883 > 10.0.0.8.45134: Flags [P.], seq 3161117526:3161117530, ack 462153362, win 85, options [nop,nop,TS val 3793228392 ecr 1097933872], length 4
00:00:26.912671 IP 10.0.0.6.1883 > 10.0.0.8.45134: Flags [P.], seq 3161117530:3161117532, ack 462153364, win 85, options [nop,nop,TS val 3793229362 ecr 1097934843], length 2
00:00:26.944310 IP 10.0.0.6.1883 > 10.0.0.8.45134: Flags [P.], seq 3161117532:3161117536, ack 462153759, win 85, options [nop,nop,TS val 3793229393 ecr 1097934873], length 4
00:00:26.945620 IP 10.0.0.6.1883 > 10.0.0.8.45134: Flags [P.], seq 3161117536:3161117540, ack 462153763, win 85, options [nop,nop,TS val 3793229395 ecr 1097934876], length 4
00:00:27.945711 IP 10.0.0.6.1883 > 10.0.0.8.45134: Flags [P.], seq 3161117540:3161117544, ack 462154158, win 85, options [nop,nop,TS val 3793230395 ecr 1097935876], length 4
00:00:27.947856 IP 10.0.0.6.1883 > 10.0.0.8.45134: Flags [P.], seq 3161117544:3161117548, ack 462154162, win 85, options [nop,nop,TS val 3793230397 ecr 1097935877], length 4
00:00:28.946402 IP 10.0.0.6.1883 > 10.0.0.8.45134: Flags [P.], seq 3161117548:3161117552, ack 462154557, win 85, options [nop,nop,TS val 3793231395 ecr 1097936877], length 4
00:00:28.948195 IP 10.0.0.6.1883 > 10.0.0.8.45134: Flags [P.], seq 3161117552:3161117556, ack 462154561, win 85, options [nop,nop,TS val 3793231397 ecr 1097936878], length 4
00:00:29.947277 IP 10.0.0.6.1883 > 10.0.0.8.45134: Flags [P.], seq 3161117556:3161117560, ack 462154956, win 85, options [nop,nop,TS val 3793232396 ecr 1097937877], length 4
00:00:29.948827 IP 10.0.0.6.1883 > 10.0.0.8.45134: Flags [P.], seq 3161117560:3161117564, ack 462154960, win 85, options [nop,nop,TS val 3793232398 ecr 1097937879], length 4
00:00:30.948547 IP 10.0.0.6.1883 > 10.0.0.8.45134: Flags [P.], seq 3161117564:3161117568, ack 462155355, win 85, options [nop,nop,TS val 3793233398 ecr 1097938879], length 4
00:00:30.950368 IP 10.0.0.6.1883 > 10.0.0.8.45134: Flags [P.], seq 3161117568:3161117572, ack 462155359, win 85, options [nop,nop,TS val 3793233399 ecr 1097938880], length 4
00:00:31.952443 IP 10.0.0.6.1883 > 10.0.0.8.45134: Flags [P.], seq 3161117572:3161117576, ack 462155754, win 85, options [nop,nop,TS val 3793234401 ecr 1097939880], length 4
00:00:31.953230 IP 10.0.0.6.1883 > 10.0.0.8.45134: Flags [P.], seq 3161117576:3161117578, ack 462155756, win 85, options [nop,nop,TS val 3793234402 ecr 1097939884], length 2
00:00:31.954593 IP 10.0.0.6.1883 > 10.0.0.8.45134: Flags [P.], seq 3161117578:3161117582, ack 462155760, win 85, options [nop,nop,TS val 3793234404 ecr 1097939885], length 4
00:00:32.952772 IP 10.0.0.6.1883 > 10.0.0.8.45134: Flags [P.], seq 3161117582:3161117586, ack 462156155, win 85, options [nop,nop,TS val 3793235402 ecr 1097940882], length 4
00:00:32.954295 IP 10.0.0.6.1883 > 10.0.0.8.45134: Flags [P.], seq 3161117586:3161117590, ack 462156159, win 85, options [nop,nop,TS val 3793235403 ecr 1097940885], length 4
00:00:33.954197 IP 10.0.0.6.1883 > 10.0.0.8.45134: Flags [P.], seq 3161117590:3161117594, ack 462156554, win 85, options [nop,nop,TS val 3793236403 ecr 1097941884], length 4
00:00:33.956377 IP 10.0.0.6.1883 > 10.0.0.8.45134: Flags [P.], seq 3161117594:3161117598, ack 462156558, win 85, options [nop,nop,TS val 3793236405 ecr 1097941886], length 4
00:00:34.955252 IP 10.0.0.6.1883 > 10.0.0.8.45134: Flags [P.], seq 3161117598:3161117602, ack 462156953, win 85, options [nop,nop,TS val 3793237404 ecr 1097942886], length 4
00:00:34.957408 IP 10.0.0.6.1883 > 10.0.0.8.45134: Flags [P.], seq 3161117602:3161117606, ack 462156957, win 85, options [nop,nop,TS val 3793237406 ecr 1097942887], length 4
00:00:35.955759 IP 10.0.0.6.1883 > 10.0.0.8.45134: Flags [P.], seq 3161117606:3161117610, ack 462157352, win 85, options [nop,nop,TS val 3793238405 ecr 1097943886], length 4
00:00:35.956145 IP 10.0.0.6.1883 > 10.0.0.8.45134: Flags [P.], seq 3161117610:3161117614, ack 462157356, win 85, options [nop,nop,TS val 3793238405 ecr 1097943887], length 4
00:00:36.951696 IP 10.0.0.6.1883 > 10.0.0.8.45134: Flags [P.], seq 3161117614:3161117616, ack 462157358, win 85, options [nop,nop,TS val 3793239401 ecr 1097944882], length 2
00:00:36.957192 IP 10.0.0.6.1883 > 10.0.0.8.45134: Flags [P.], seq 3161117616:3161117620, ack 462157753, win 85, options [nop,nop,TS val 3793239406 ecr 1097944887], length 4
00:00:36.958450 IP 10.0.0.6.1883 > 10.0.0.8.45134: Flags [P.], seq 3161117620:3161117624, ack 462157757, win 85, options [nop,nop,TS val 3793239407 ecr 1097944889], length 4
00:00:37.962632 IP 10.0.0.6.1883 > 10.0.0.8.45134: Flags [P.], seq 3161117624:3161117628, ack 462158152, win 85, options [nop,nop,TS val 3793240409 ecr 1097945889], length 4
00:00:37.968444 IP 10.0.0.6.1883 > 10.0.0.8.45134: Flags [P.], seq 3161117628:3161117632, ack 462158156, win 85, options [nop,nop,TS val 3793240417 ecr 1097945898], length 4
00:00:38.968860 IP 10.0.0.6.1883 > 10.0.0.8.45134: Flags [P.], seq 3161117632:3161117636, ack 462158551, win 85, options [nop,nop,TS val 3793241418 ecr 1097946899], length 4
00:00:38.969965 IP 10.0.0.6.1883 > 10.0.0.8.45134: Flags [P.], seq 3161117636:3161117640, ack 462158555, win 85, options [nop,nop,TS val 3793241419 ecr 1097946900], length 4
00:00:39.971116 IP 10.0.0.6.1883 > 10.0.0.8.45134: Flags [P.], seq 3161117640:3161117644, ack 462158950, win 85, options [nop,nop,TS val 3793242420 ecr 1097947900], length 4
00:00:39.978800 IP 10.0.0.6.1883 > 10.0.0.8.45134: Flags [P.], seq 3161117644:3161117648, ack 462158954, win 85, options [nop,nop,TS val 3793242426 ecr 1097947907], length 4
00:00:40.973757 IP 10.0.0.6.1883 > 10.0.0.8.45134: Flags [P.], seq 3161117648:3161117652, ack 462159349, win 85, options [nop,nop,TS val 3793243422 ecr 1097948902], length 4
00:00:40.978646 IP 10.0.0.6.1883 > 10.0.0.8.45134: Flags [P.], seq 3161117652:3161117656, ack 462159353, win 85, options [nop,nop,TS val 3793243427 ecr 1097948909], length 4
00:00:41.970307 IP 10.0.0.6.1883 > 10.0.0.8.45134: Flags [P.], seq 3161117656:3161117658, ack 462159355, win 85, options [nop,nop,TS val 3793244419 ecr 1097949900], length 2
00:00:41.972674 IP 10.0.0.6.1883 > 10.0.0.8.45134: Flags [P.], seq 3161117658:3161117662, ack 462159750, win 85, options [nop,nop,TS val 3793244422 ecr 1097949903], length 4
00:00:41.976230 IP 10.0.0.6.1883 > 10.0.0.8.45134: Flags [P.], seq 3161117662:3161117666, ack 462159754, win 85, options [nop,nop,TS val 3793244425 ecr 1097949905], length 4
00:00:42.975665 IP 10.0.0.6.1883 > 10.0.0.8.45134: Flags [P.], seq 3161117666:3161117670, ack 462160149, win 85, options [nop,nop,TS val 3793245425 ecr 1097950904], length 4
00:00:42.976959 IP 10.0.0.6.1883 > 10.0.0.8.45134: Flags [P.], seq 3161117670:3161117674, ack 462160153, win 85, options [nop,nop,TS val 3793245426 ecr 1097950907], length 4
00:00:43.979890 IP 10.0.0.6.1883 > 10.0.0.8.45134: Flags [P.], seq 3161117674:3161117678, ack 462160548, win 85, options [nop,nop,TS val 3793246429 ecr 1097951908], length 4
00:00:43.981427 IP 10.0.0.6.1883 > 10.0.0.8.45134: Flags [P.], seq 3161117678:3161117682, ack 462160552, win 85, options [nop,nop,TS val 3793246430 ecr 1097951911], length 4
00:00:44.981178 IP 10.0.0.6.1883 > 10.0.0.8.45134: Flags [P.], seq 3161117682:3161117686, ack 462160947, win 85, options [nop,nop,TS val 3793247430 ecr 1097952910], length 4
00:00:44.984156 IP 10.0.0.6.1883 > 10.0.0.8.45134: Flags [P.], seq 3161117686:3161117690, ack 462160951, win 85, options [nop,nop,TS val 3793247433 ecr 1097952913], length 4
00:00:45.982402 IP 10.0.0.6.1883 > 10.0.0.8.45134: Flags [P.], seq 3161117690:3161117694, ack 462161346, win 85, options [nop,nop,TS val 3793248431 ecr 1097953910], length 4
00:00:45.984430 IP 10.0.0.6.1883 > 10.0.0.8.45134: Flags [P.], seq 3161117694:3161117698, ack 462161350, win 85, options [nop,nop,TS val 3793248433 ecr 1097953914], length 4
00:00:46.974147 IP 10.0.0.6.1883 > 10.0.0.8.45134: Flags [P.], seq 3161117698:3161117700, ack 462161352, win 85, options [nop,nop,TS val 3793249423 ecr 1097954902], length 2
00:00:46.983304 IP 10.0.0.6.1883 > 10.0.0.8.45134: Flags [P.], seq 3161117700:3161117704, ack 462161747, win 85, options [nop,nop,TS val 3793249432 ecr 1097954912], length 4
00:00:46.986676 IP 10.0.0.6.1883 > 10.0.0.8.45134: Flags [P.], seq 3161117704:3161117708, ack 462161751, win 85, options [nop,nop,TS val 3793249435 ecr 1097954915], length 4
00:00:47.986149 IP 10.0.0.6.1883 > 10.0.0.8.45134: Flags [P.], seq 3161117708:3161117712, ack 462162146, win 85, options [nop,nop,TS val 3793250435 ecr 1097955914], length 4
00:00:47.989126 IP 10.0.0.6.1883 > 10.0.0.8.45134: Flags [P.], seq 3161117712:3161117716, ack 462162150, win 85, options [nop,nop,TS val 3793250438 ecr 1097955918], length 4
00:00:48.985881 IP 10.0.0.6.1883 > 10.0.0.8.45134: Flags [P.], seq 3161117716:3161117720, ack 462162545, win 85, options [nop,nop,TS val 3793251435 ecr 1097956916], length 4
00:00:48.986861 IP 10.0.0.6.1883 > 10.0.0.8.45134: Flags [P.], seq 3161117720:3161117724, ack 462162549, win 85, options [nop,nop,TS val 3793251436 ecr 1097956917], length 4
00:00:49.986576 IP 10.0.0.6.1883 > 10.0.0.8.45134: Flags [P.], seq 3161117724:3161117728, ack 462162944, win 85, options [nop,nop,TS val 3793252436 ecr 1097957917], length 4
00:00:49.988780 IP 10.0.0.6.1883 > 10.0.0.8.45134: Flags [P.], seq 3161117728:3161117732, ack 462162948, win 85, options [nop,nop,TS val 3793252438 ecr 1097957918], length 4
00:00:50.988328 IP 10.0.0.6.1883 > 10.0.0.8.45134: Flags [P.], seq 3161117732:3161117736, ack 462163343, win 85, options [nop,nop,TS val 3793253437 ecr 1097958918], length 4
00:00:50.989768 IP 10.0.0.6.1883 > 10.0.0.8.45134: Flags [P.], seq 3161117736:3161117740, ack 462163347, win 85, options [nop,nop,TS val 3793253439 ecr 1097958920], length 4
00:00:51.975384 IP 10.0.0.6.1883 > 10.0.0.8.45134: Flags [P.], seq 3161117740:3161117742, ack 462163349, win 85, options [nop,nop,TS val 3793254424 ecr 1097959904], length 2
00:00:51.989304 IP 10.0.0.6.1883 > 10.0.0.8.45134: Flags [P.], seq 3161117742:3161117746, ack 462163744, win 85, options [nop,nop,TS val 3793254438 ecr 1097959919], length 4
00:00:51.992211 IP 10.0.0.6.1883 > 10.0.0.8.45134: Flags [P.], seq 3161117746:3161117750, ack 462163748, win 85, options [nop,nop,TS val 3793254441 ecr 1097959921], length 4
00:00:52.990324 IP 10.0.0.6.1883 > 10.0.0.8.45134: Flags [P.], seq 3161117750:3161117754, ack 462164143, win 85, options [nop,nop,TS val 3793255439 ecr 1097960919], length 4
00:00:52.992107 IP 10.0.0.6.1883 > 10.0.0.8.45134: Flags [P.], seq 3161117754:3161117758, ack 462164147, win 85, options [nop,nop,TS val 3793255441 ecr 1097960922], length 4
00:00:53.995353 IP 10.0.0.6.1883 > 10.0.0.8.45134: Flags [P.], seq 3161117758:3161117762, ack 462164542, win 85, options [nop,nop,TS val 3793256444 ecr 1097961925], length 4
00:00:54.170003 IP 10.0.0.6.1883 > 10.0.0.8.45134: Flags [P.], seq 3161117762:3161117766, ack 462164546, win 85, options [nop,nop,TS val 3793256619 ecr 1097962099], length 4
00:00:54.997727 IP 10.0.0.6.1883 > 10.0.0.8.45134: Flags [P.], seq 3161117766:3161117770, ack 462164941, win 85, options [nop,nop,TS val 3793257447 ecr 1097962927], length 4
00:00:54.999755 IP 10.0.0.6.1883 > 10.0.0.8.45134: Flags [P.], seq 3161117770:3161117774, ack 462164945, win 85, options [nop,nop,TS val 3793257449 ecr 1097962929], length 4
00:00:55.999903 IP 10.0.0.6.1883 > 10.0.0.8.45134: Flags [P.], seq 3161117774:3161117778, ack 462165340, win 85, options [nop,nop,TS val 3793258449 ecr 1097963929], length 4
00:00:56.002145 IP 10.0.0.6.1883 > 10.0.0.8.45134: Flags [P.], seq 3161117778:3161117782, ack 462165344, win 85, options [nop,nop,TS val 3793258451 ecr 1097963932], length 4
00:00:57.000818 IP 10.0.0.6.1883 > 10.0.0.8.45134: Flags [P.], seq 3161117782:3161117786, ack 462165739, win 85, options [nop,nop,TS val 3793259450 ecr 1097964930], length 4
00:00:57.003511 IP 10.0.0.6.1883 > 10.0.0.8.45134: Flags [P.], seq 3161117786:3161117788, ack 462165741, win 85, options [nop,nop,TS val 3793259452 ecr 1097964933], length 2
00:00:57.004988 IP 10.0.0.6.1883 > 10.0.0.8.45134: Flags [P.], seq 3161117788:3161117792, ack 462165745, win 85, options [nop,nop,TS val 3793259454 ecr 1097964935], length 4
00:00:58.004995 IP 10.0.0.6.1883 > 10.0.0.8.45134: Flags [P.], seq 3161117792:3161117796, ack 462166140, win 85, options [nop,nop,TS val 3793260454 ecr 1097965934], length 4
00:00:58.006791 IP 10.0.0.6.1883 > 10.0.0.8.45134: Flags [P.], seq 3161117796:3161117800, ack 462166144, win 85, options [nop,nop,TS val 3793260456 ecr 1097965937], length 4
00:00:59.007894 IP 10.0.0.6.1883 > 10.0.0.8.45134: Flags [P.], seq 3161117800:3161117804, ack 462166539, win 85, options [nop,nop,TS val 3793261457 ecr 1097966937], length 4
00:00:59.016226 IP 10.0.0.6.1883 > 10.0.0.8.45134: Flags [P.], seq 3161117804:3161117808, ack 462166543, win 85, options [nop,nop,TS val 3793261465 ecr 1097966946], length 4
00:01:00.009985 IP 10.0.0.6.1883 > 10.0.0.8.45134: Flags [P.], seq 3161117808:3161117812, ack 462166938, win 85, options [nop,nop,TS val 3793262459 ecr 1097967939], length 4
00:01:00.011192 IP 10.0.0.6.1883 > 10.0.0.8.45134: Flags [P.], seq 3161117812:3161117816, ack 462166942, win 85, options [nop,nop,TS val 3793262460 ecr 1097967942], length 4
00:01:01.324124 IP 10.0.0.6.1883 > 10.0.0.8.45134: Flags [P.], seq 3161117816:3161117820, ack 462167337, win 85, options [nop,nop,TS val 3793263773 ecr 1097969251], length 4
00:01:01.332855 IP 10.0.0.6.1883 > 10.0.0.8.45134: Flags [P.], seq 3161117820:3161117824, ack 462167341, win 85, options [nop,nop,TS val 3793263782 ecr 1097969262], length 4
00:01:02.012909 IP 10.0.0.6.1883 > 10.0.0.8.45134: Flags [P.], seq 3161117824:3161117826, ack 462167343, win 85, options [nop,nop,TS val 3793264461 ecr 1097969942], length 2
00:01:02.321555 IP 10.0.0.6.1883 > 10.0.0.8.45134: Flags [P.], seq 3161117826:3161117830, ack 462167738, win 85, options [nop,nop,TS val 3793264770 ecr 1097970251], length 4
00:01:02.323647 IP 10.0.0.6.1883 > 10.0.0.8.45134: Flags [P.], seq 3161117830:3161117834, ack 462167742, win 85, options [nop,nop,TS val 3793264773 ecr 1097970254], length 4
00:01:03.321714 IP 10.0.0.6.1883 > 10.0.0.8.45134: Flags [P.], seq 3161117834:3161117838, ack 462168137, win 85, options [nop,nop,TS val 3793265771 ecr 1097971252], length 4
00:01:03.322916 IP 10.0.0.6.1883 > 10.0.0.8.45134: Flags [P.], seq 3161117838:3161117842, ack 462168141, win 85, options [nop,nop,TS val 3793265772 ecr 1097971254], length 4
00:01:04.327507 IP 10.0.0.6.1883 > 10.0.0.8.45134: Flags [P.], seq 3161117842:3161117846, ack 462168536, win 85, options [nop,nop,TS val 3793266776 ecr 1097972257], length 4
00:01:04.329135 IP 10.0.0.6.1883 > 10.0.0.8.45134: Flags [P.], seq 3161117846:3161117850, ack 462168540, win 85, options [nop,nop,TS val 3793266778 ecr 1097972259], length 4
00:01:05.331111 IP 10.0.0.6.1883 > 10.0.0.8.45134: Flags [P.], seq 3161117850:3161117854, ack 462168935, win 85, options [nop,nop,TS val 3793267780 ecr 1097973259], length 4
00:01:05.336708 IP 10.0.0.6.1883 > 10.0.0.8.45134: Flags [P.], seq 3161117854:3161117858, ack 462168939, win 85, options [nop,nop,TS val 3793267785 ecr 1097973266], length 4
00:01:06.332252 IP 10.0.0.6.1883 > 10.0.0.8.45134: Flags [P.], seq 3161117858:3161117862, ack 462169334, win 85, options [nop,nop,TS val 3793268781 ecr 1097974262], length 4
00:01:06.339014 IP 10.0.0.6.1883 > 10.0.0.8.45134: Flags [P.], seq 3161117862:3161117866, ack 462169338, win 85, options [nop,nop,TS val 3793268788 ecr 1097974269], length 4
00:01:07.042607 IP 10.0.0.6.1883 > 10.0.0.8.45134: Flags [P.], seq 3161117866:3161117868, ack 462169340, win 85, options [nop,nop,TS val 3793269492 ecr 1097974972], length 2
00:01:07.334953 IP 10.0.0.6.1883 > 10.0.0.8.45134: Flags [P.], seq 3161117868:3161117872, ack 462169735, win 85, options [nop,nop,TS val 3793269783 ecr 1097975263], length 4
00:01:07.338028 IP 10.0.0.6.1883 > 10.0.0.8.45134: Flags [P.], seq 3161117872:3161117876, ack 462169739, win 85, options [nop,nop,TS val 3793269787 ecr 1097975267], length 4
00:01:08.336098 IP 10.0.0.6.1883 > 10.0.0.8.45134: Flags [P.], seq 3161117876:3161117880, ack 462170134, win 85, options [nop,nop,TS val 3793270785 ecr 1097976265], length 4
00:01:08.337901 IP 10.0.0.6.1883 > 10.0.0.8.45134: Flags [P.], seq 3161117880:3161117884, ack 462170138, win 85, options [nop,nop,TS val 3793270787 ecr 1097976268], length 4
00:01:09.347665 IP 10.0.0.6.1883 > 10.0.0.8.45134: Flags [P.], seq 3161117884:3161117888, ack 462170533, win 85, options [nop,nop,TS val 3793271797 ecr 1097977276], length 4
00:01:09.349416 IP 10.0.0.6.1883 > 10.0.0.8.45134: Flags [P.], seq 3161117888:3161117892, ack 462170537, win 85, options [nop,nop,TS val 3793271798 ecr 1097977279], length 4
00:01:10.351281 IP 10.0.0.6.1883 > 10.0.0.8.45134: Flags [P.], seq 3161117892:3161117896, ack 462170932, win 85, options [nop,nop,TS val 3793272800 ecr 1097978279], length 4
00:01:10.353470 IP 10.0.0.6.1883 > 10.0.0.8.45134: Flags [P.], seq 3161117896:3161117900, ack 462170936, win 85, options [nop,nop,TS val 3793272802 ecr 1097978283], length 4
00:01:11.352472 IP 10.0.0.6.1883 > 10.0.0.8.45134: Flags [P.], seq 3161117900:3161117904, ack 462171331, win 85, options [nop,nop,TS val 3793273801 ecr 1097979281], length 4
00:01:11.355391 IP 10.0.0.6.1883 > 10.0.0.8.45134: Flags [P.], seq 3161117904:3161117908, ack 462171335, win 85, options [nop,nop,TS val 3793273804 ecr 1097979285], length 4
00:01:12.137783 IP 10.0.0.6.1883 > 10.0.0.8.45134: Flags [P.], seq 3161117908:3161117910, ack 462171337, win 85, options [nop,nop,TS val 3793274587 ecr 1097980067], length 2
00:01:12.355134 IP 10.0.0.6.1883 > 10.0.0.8.45134: Flags [P.], seq 3161117910:3161117914, ack 462171732, win 85, options [nop,nop,TS val 3793274804 ecr 1097980285], length 4
00:01:12.356309 IP 10.0.0.6.1883 > 10.0.0.8.45134: Flags [P.], seq 3161117914:3161117918, ack 462171736, win 85, options [nop,nop,TS val 3793274805 ecr 1097980287], length 4
00:01:13.357993 IP 10.0.0.6.1883 > 10.0.0.8.45134: Flags [P.], seq 3161117918:3161117922, ack 462172131, win 85, options [nop,nop,TS val 3793275807 ecr 1097981287], length 4
00:01:13.361237 IP 10.0.0.6.1883 > 10.0.0.8.45134: Flags [P.], seq 3161117922:3161117926, ack 462172135, win 85, options [nop,nop,TS val 3793275810 ecr 1097981291], length 4
00:01:14.362717 IP 10.0.0.6.1883 > 10.0.0.8.45134: Flags [P.], seq 3161117926:3161117930, ack 462172530, win 85, options [nop,nop,TS val 3793276812 ecr 1097982292], length 4
00:01:14.365801 IP 10.0.0.6.1883 > 10.0.0.8.45134: Flags [P.], seq 3161117930:3161117934, ack 462172534, win 85, options [nop,nop,TS val 3793276815 ecr 1097982295], length 4
00:01:15.366625 IP 10.0.0.6.1883 > 10.0.0.8.45134: Flags [P.], seq 3161117934:3161117938, ack 462172929, win 85, options [nop,nop,TS val 3793277814 ecr 1097983294], length 4
00:01:15.371350 IP 10.0.0.6.1883 > 10.0.0.8.45134: Flags [P.], seq 3161117938:3161117942, ack 462172933, win 85, options [nop,nop,TS val 3793277820 ecr 1097983301], length 4
00:01:16.366528 IP 10.0.0.6.1883 > 10.0.0.8.45134: Flags [P.], seq 3161117942:3161117946, ack 462173328, win 85, options [nop,nop,TS val 3793278815 ecr 1097984296], length 4
00:01:16.368848 IP 10.0.0.6.1883 > 10.0.0.8.45134: Flags [P.], seq 3161117946:3161117950, ack 462173332, win 85, options [nop,nop,TS val 3793278818 ecr 1097984298], length 4
00:01:17.137428 IP 10.0.0.6.1883 > 10.0.0.8.45134: Flags [P.], seq 3161117950:3161117952, ack 462173334, win 85, options [nop,nop,TS val 3793279586 ecr 1097985067], length 2
00:01:17.369237 IP 10.0.0.6.1883 > 10.0.0.8.45134: Flags [P.], seq 3161117952:3161117956, ack 462173729, win 85, options [nop,nop,TS val 3793279817 ecr 1097985299], length 4
00:01:17.371253 IP 10.0.0.6.1883 > 10.0.0.8.45134: Flags [P.], seq 3161117956:3161117960, ack 462173733, win 85, options [nop,nop,TS val 3793279820 ecr 1097985301], length 4
00:01:18.372243 IP 10.0.0.6.1883 > 10.0.0.8.45134: Flags [P.], seq 3161117960:3161117964, ack 462174128, win 85, options [nop,nop,TS val 3793280821 ecr 1097986301], length 4
00:01:18.373875 IP 10.0.0.6.1883 > 10.0.0.8.45134: Flags [P.], seq 3161117964:3161117968, ack 462174132, win 85, options [nop,nop,TS val 3793280823 ecr 1097986304], length 4
00:01:19.377331 IP 10.0.0.6.1883 > 10.0.0.8.45134: Flags [P.], seq 3161117968:3161117972, ack 462174527, win 85, options [nop,nop,TS val 3793281826 ecr 1097987305], length 4
00:01:19.379402 IP 10.0.0.6.1883 > 10.0.0.8.45134: Flags [P.], seq 3161117972:3161117976, ack 462174531, win 85, options [nop,nop,TS val 3793281828 ecr 1097987309], length 4
00:01:20.378895 IP 10.0.0.6.1883 > 10.0.0.8.45134: Flags [P.], seq 3161117976:3161117980, ack 462174926, win 85, options [nop,nop,TS val 3793282828 ecr 1097988307], length 4
00:01:20.380977 IP 10.0.0.6.1883 > 10.0.0.8.45134: Flags [P.], seq 3161117980:3161117984, ack 462174930, win 85, options [nop,nop,TS val 3793282830 ecr 1097988311], length 4
00:01:21.379509 IP 10.0.0.6.1883 > 10.0.0.8.45134: Flags [P.], seq 3161117984:3161117988, ack 462175325, win 85, options [nop,nop,TS val 3793283828 ecr 1097989309], length 4
00:01:21.381416 IP 10.0.0.6.1883 > 10.0.0.8.45134: Flags [P.], seq 3161117988:3161117992, ack 462175329, win 85, options [nop,nop,TS val 3793283830 ecr 1097989311], length 4
00:01:22.139400 IP 10.0.0.6.1883 > 10.0.0.8.45134: Flags [P.], seq 3161117992:3161117994, ack 462175331, win 85, options [nop,nop,TS val 3793284588 ecr 1097990069], length 2
00:01:22.380884 IP 10.0.0.6.1883 > 10.0.0.8.45134: Flags [P.], seq 3161117994:3161117998, ack 462175726, win 85, options [nop,nop,TS val 3793284830 ecr 1097990310], length 4
00:01:22.382588 IP 10.0.0.6.1883 > 10.0.0.8.45134: Flags [P.], seq 3161117998:3161118002, ack 462175730, win 85, options [nop,nop,TS val 3793284832 ecr 1097990312], length 4
00:01:23.383101 IP 10.0.0.6.1883 > 10.0.0.8.45134: Flags [P.], seq 3161118002:3161118006, ack 462176125, win 85, options [nop,nop,TS val 3793285832 ecr 1097991312], length 4
00:01:23.384708 IP 10.0.0.6.1883 > 10.0.0.8.45134: Flags [P.], seq 3161118006:3161118010, ack 462176129, win 85, options [nop,nop,TS val 3793285834 ecr 1097991315], length 4
00:01:24.384536 IP 10.0.0.6.1883 > 10.0.0.8.45134: Flags [P.], seq 3161118010:3161118014, ack 462176524, win 85, options [nop,nop,TS val 3793286833 ecr 1097992313], length 4
00:01:24.386165 IP 10.0.0.6.1883 > 10.0.0.8.45134: Flags [P.], seq 3161118014:3161118018, ack 462176528, win 85, options [nop,nop,TS val 3793286835 ecr 1097992316], length 4
00:01:25.385722 IP 10.0.0.6.1883 > 10.0.0.8.45134: Flags [P.], seq 3161118018:3161118022, ack 462176923, win 85, options [nop,nop,TS val 3793287835 ecr 1097993315], length 4
00:01:25.387607 IP 10.0.0.6.1883 > 10.0.0.8.45134: Flags [P.], seq 3161118022:3161118026, ack 462176927, win 85, options [nop,nop,TS val 3793287837 ecr 1097993317], length 4
00:01:26.388191 IP 10.0.0.6.1883 > 10.0.0.8.45134: Flags [P.], seq 3161118026:3161118030, ack 462177322, win 85, options [nop,nop,TS val 3793288837 ecr 1097994316], length 4
00:01:26.390279 IP 10.0.0.6.1883 > 10.0.0.8.45134: Flags [P.], seq 3161118030:3161118034, ack 462177326, win 85, options [nop,nop,TS val 3793288839 ecr 1097994320], length 4
00:01:27.144412 IP 10.0.0.6.1883 > 10.0.0.8.45134: Flags [P.], seq 3161118034:3161118036, ack 462177328, win 85, options [nop,nop,TS val 3793289593 ecr 1097995073], length 2
00:01:27.388883 IP 10.0.0.6.1883 > 10.0.0.8.45134: Flags [P.], seq 3161118036:3161118040, ack 462177723, win 85, options [nop,nop,TS val 3793289838 ecr 1097995318], length 4
00:01:27.431302 IP 10.0.0.6.1883 > 10.0.0.8.45134: Flags [P.], seq 3161118040:3161118044, ack 462177727, win 85, options [nop,nop,TS val 3793289880 ecr 1097995361], length 4
00:01:28.390758 IP 10.0.0.6.1883 > 10.0.0.8.45134: Flags [P.], seq 3161118044:3161118048, ack 462178122, win 85, options [nop,nop,TS val 3793290840 ecr 1097996320], length 4
00:01:28.392031 IP 10.0.0.6.1883 > 10.0.0.8.45134: Flags [P.], seq 3161118048:3161118052, ack 462178126, win 85, options [nop,nop,TS val 3793290841 ecr 1097996323], length 4
00:01:29.391645 IP 10.0.0.6.1883 > 10.0.0.8.45134: Flags [P.], seq 3161118052:3161118056, ack 462178521, win 85, options [nop,nop,TS val 3793291841 ecr 1097997321], length 4
00:01:29.392768 IP 10.0.0.6.1883 > 10.0.0.8.45134: Flags [P.], seq 3161118056:3161118060, ack 462178525, win 85, options [nop,nop,TS val 3793291842 ecr 1097997323], length 4
00:01:30.393117 IP 10.0.0.6.1883 > 10.0.0.8.45134: Flags [P.], seq 3161118060:3161118064, ack 462178920, win 85, options [nop,nop,TS val 3793292842 ecr 1097998323], length 4
00:01:30.394529 IP 10.0.0.6.1883 > 10.0.0.8.45134: Flags [P.], seq 3161118064:3161118068, ack 462178924, win 85, options [nop,nop,TS val 3793292844 ecr 1097998325], length 4
00:01:31.405614 IP 10.0.0.6.1883 > 10.0.0.8.45134: Flags [P.], seq 3161118068:3161118072, ack 462179319, win 85, options [nop,nop,TS val 3793293855 ecr 1097999335], length 4
00:01:31.407739 IP 10.0.0.6.1883 > 10.0.0.8.45134: Flags [P.], seq 3161118072:3161118076, ack 462179323, win 85, options [nop,nop,TS val 3793293856 ecr 1097999338], length 4
00:01:32.144347 IP 10.0.0.6.1883 > 10.0.0.8.45134: Flags [P.], seq 3161118076:3161118078, ack 462179325, win 85, options [nop,nop,TS val 3793294593 ecr 1098000075], length 2
00:01:32.409804 IP 10.0.0.6.1883 > 10.0.0.8.45134: Flags [P.], seq 3161118078:3161118082, ack 462179720, win 85, options [nop,nop,TS val 3793294859 ecr 1098000340], length 4
00:01:32.411179 IP 10.0.0.6.1883 > 10.0.0.8.45134: Flags [P.], seq 3161118082:3161118086, ack 462179724, win 85, options [nop,nop,TS val 3793294860 ecr 1098000342], length 4
00:01:33.411035 IP 10.0.0.6.1883 > 10.0.0.8.45134: Flags [P.], seq 3161118086:3161118090, ack 462180119, win 85, options [nop,nop,TS val 3793295860 ecr 1098001341], length 4
00:01:33.412424 IP 10.0.0.6.1883 > 10.0.0.8.45134: Flags [P.], seq 3161118090:3161118094, ack 462180123, win 85, options [nop,nop,TS val 3793295861 ecr 1098001343], length 4
00:01:34.412507 IP 10.0.0.6.1883 > 10.0.0.8.45134: Flags [P.], seq 3161118094:3161118098, ack 462180518, win 85, options [nop,nop,TS val 3793296861 ecr 1098002343], length 4
00:01:34.414013 IP 10.0.0.6.1883 > 10.0.0.8.45134: Flags [P.], seq 3161118098:3161118102, ack 462180522, win 85, options [nop,nop,TS val 3793296863 ecr 1098002344], length 4
00:01:35.413702 IP 10.0.0.6.1883 > 10.0.0.8.45134: Flags [P.], seq 3161118102:3161118106, ack 462180917, win 85, options [nop,nop,TS val 3793297863 ecr 1098003344], length 4
00:01:35.415295 IP 10.0.0.6.1883 > 10.0.0.8.45134: Flags [P.], seq 3161118106:3161118110, ack 462180921, win 85, options [nop,nop,TS val 3793297864 ecr 1098003346], length 4
00:01:36.414310 IP 10.0.0.6.1883 > 10.0.0.8.45134: Flags [P.], seq 3161118110:3161118114, ack 462181316, win 85, options [nop,nop,TS val 3793298863 ecr 1098004344], length 4
00:01:36.415948 IP 10.0.0.6.1883 > 10.0.0.8.45134: Flags [P.], seq 3161118114:3161118118, ack 462181320, win 85, options [nop,nop,TS val 3793298865 ecr 1098004346], length 4
00:01:37.145674 IP 10.0.0.6.1883 > 10.0.0.8.45134: Flags [P.], seq 3161118118:3161118120, ack 462181322, win 85, options [nop,nop,TS val 3793299595 ecr 1098005076], length 2
00:01:37.415944 IP 10.0.0.6.1883 > 10.0.0.8.45134: Flags [P.], seq 3161118120:3161118124, ack 462181717, win 85, options [nop,nop,TS val 3793299865 ecr 1098005346], length 4
00:01:37.417424 IP 10.0.0.6.1883 > 10.0.0.8.45134: Flags [P.], seq 3161118124:3161118128, ack 462181721, win 85, options [nop,nop,TS val 3793299866 ecr 1098005348], length 4
00:01:38.427170 IP 10.0.0.6.1883 > 10.0.0.8.45134: Flags [P.], seq 3161118128:3161118132, ack 462182116, win 85, options [nop,nop,TS val 3793300876 ecr 1098006357], length 4
00:01:38.428546 IP 10.0.0.6.1883 > 10.0.0.8.45134: Flags [P.], seq 3161118132:3161118136, ack 462182120, win 85, options [nop,nop,TS val 3793300878 ecr 1098006359], length 4
00:01:39.428726 IP 10.0.0.6.1883 > 10.0.0.8.45134: Flags [P.], seq 3161118136:3161118140, ack 462182515, win 85, options [nop,nop,TS val 3793301878 ecr 1098007359], length 4
00:01:39.430248 IP 10.0.0.6.1883 > 10.0.0.8.45134: Flags [P.], seq 3161118140:3161118144, ack 462182519, win 85, options [nop,nop,TS val 3793301879 ecr 1098007360], length 4
00:01:40.434355 IP 10.0.0.6.1883 > 10.0.0.8.45134: Flags [P.], seq 3161118144:3161118148, ack 462182914, win 85, options [nop,nop,TS val 3793302883 ecr 1098008364], length 4
00:01:40.436761 IP 10.0.0.6.1883 > 10.0.0.8.45134: Flags [P.], seq 3161118148:3161118152, ack 462182918, win 85, options [nop,nop,TS val 3793302886 ecr 1098008367], length 4
00:01:41.443325 IP 10.0.0.6.1883 > 10.0.0.8.45134: Flags [P.], seq 3161118152:3161118156, ack 462183313, win 85, options [nop,nop,TS val 3793303892 ecr 1098009372], length 4
00:01:41.445074 IP 10.0.0.6.1883 > 10.0.0.8.45134: Flags [P.], seq 3161118156:3161118160, ack 462183317, win 85, options [nop,nop,TS val 3793303894 ecr 1098009375], length 4
00:01:42.147049 IP 10.0.0.6.1883 > 10.0.0.8.45134: Flags [P.], seq 3161118160:3161118162, ack 462183319, win 85, options [nop,nop,TS val 3793304596 ecr 1098010077], length 2
00:01:42.443162 IP 10.0.0.6.1883 > 10.0.0.8.45134: Flags [P.], seq 3161118162:3161118166, ack 462183714, win 85, options [nop,nop,TS val 3793304892 ecr 1098010373], length 4
00:01:42.444888 IP 10.0.0.6.1883 > 10.0.0.8.45134: Flags [P.], seq 3161118166:3161118170, ack 462183718, win 85, options [nop,nop,TS val 3793304894 ecr 1098010375], length 4
00:01:43.446185 IP 10.0.0.6.1883 > 10.0.0.8.45134: Flags [P.], seq 3161118170:3161118174, ack 462184113, win 85, options [nop,nop,TS val 3793305895 ecr 1098011376], length 4
00:01:43.447871 IP 10.0.0.6.1883 > 10.0.0.8.45134: Flags [P.], seq 3161118174:3161118178, ack 462184117, win 85, options [nop,nop,TS val 3793305897 ecr 1098011378], length 4
00:01:44.447076 IP 10.0.0.6.1883 > 10.0.0.8.45134: Flags [P.], seq 3161118178:3161118182, ack 462184512, win 85, options [nop,nop,TS val 3793306896 ecr 1098012377], length 4
00:01:44.448690 IP 10.0.0.6.1883 > 10.0.0.8.45134: Flags [P.], seq 3161118182:3161118186, ack 462184516, win 85, options [nop,nop,TS val 3793306898 ecr 1098012379], length 4
00:01:45.448704 IP 10.0.0.6.1883 > 10.0.0.8.45134: Flags [P.], seq 3161118186:3161118190, ack 462184911, win 85, options [nop,nop,TS val 3793307898 ecr 1098013379], length 4
00:01:45.450450 IP 10.0.0.6.1883 > 10.0.0.8.45134: Flags [P.], seq 3161118190:3161118194, ack 462184915, win 85, options [nop,nop,TS val 3793307899 ecr 1098013381], length 4
00:01:46.449279 IP 10.0.0.6.1883 > 10.0.0.8.45134: Flags [P.], seq 3161118194:3161118198, ack 462185310, win 85, options [nop,nop,TS val 3793308898 ecr 1098014379], length 4
00:01:46.450823 IP 10.0.0.6.1883 > 10.0.0.8.45134: Flags [P.], seq 3161118198:3161118202, ack 462185314, win 85, options [nop,nop,TS val 3793308900 ecr 1098014381], length 4
00:01:47.149188 IP 10.0.0.6.1883 > 10.0.0.8.45134: Flags [P.], seq 3161118202:3161118204, ack 462185316, win 85, options [nop,nop,TS val 3793309598 ecr 1098015079], length 2
00:01:47.997039 IP 10.0.0.6.1883 > 10.0.0.8.45134: Flags [F.], seq 3161118204, ack 462185317, win 85, options [nop,nop,TS val 3793310445 ecr 1098015926], length 0