00:00:08.448758 IP 10.0.0.6.1883 > 10.0.0.8.45208: Flags [S.], seq 2060252898, ack 3416062249, win 43440, options [mss 1460,sackOK,TS val 3793517848 ecr 1098223277,nop,wscale 9], length 0
00:00:08.461346 IP 10.0.0.6.1883 > 10.0.0.8.45208: Flags [.], ack 3416062269, win 85, options [nop,nop,TS val 3793517861 ecr 1098223338], length 0
00:00:08.463995 IP 10.0.0.6.1883 > 10.0.0.8.45208: Flags [P.], seq 2060252899:2060252903, ack 3416062269, win 85, options [nop,nop,TS val 3793517861 ecr 1098223338], length 4
00:00:08.465336 IP 10.0.0.6.1883 > 10.0.0.8.45208: Flags [P.], seq 2060252903:2060252968, ack 3416062333, win 85, options [nop,nop,TS val 3793517865 ecr 1098223346], length 65
00:00:08.465614 IP 10.0.0.6.1883 > 10.0.0.8.45208: Flags [P.], seq 2060252968:2060252973, ack 3416062728, win 85, options [nop,nop,TS val 3793517865 ecr 1098223347], length 5
00:00:08.573068 IP 10.0.0.6.1883 > 10.0.0.8.45208: Flags [P.], seq 2060252973:2060252977, ack 3416062728, win 85, options [nop,nop,TS val 3793517972 ecr 1098223439], length 4
00:00:08.593259 IP 10.0.0.6.1883 > 10.0.0.8.45208: Flags [P.], seq 2060252977:2060252981, ack 3416062732, win 85, options [nop,nop,TS val 3793517992 ecr 1098223473], length 4
00:00:09.400628 IP 10.0.0.6.1883 > 10.0.0.8.45208: Flags [P.], seq 2060252981:2060252985, ack 3416063127, win 85, options [nop,nop,TS val 3793518800 ecr 1098224280], length 4
00:00:09.402896 IP 10.0.0.6.1883 > 10.0.0.8.45208: Flags [P.], seq 2060252985:2060252989, ack 3416063131, win 85, options [nop,nop,TS val 3793518802 ecr 1098224282], length 4
00:00:10.402145 IP 10.0.0.6.1883 > 10.0.0.8.45208: Flags [P.], seq 2060252989:2060252993, ack 3416063526, win 85, options [nop,nop,TS val 3793519801 ecr 1098225281], length 4
00:00:10.403002 IP 10.0.0.6.1883 > 10.0.0.8.45208: Flags [P.], seq 2060252993:2060252997, ack 3416063530, win 85, options [nop,nop,TS val 3793519802 ecr 1098225284], length 4
00:00:11.403445 IP 10.0.0.6.1883 > 10.0.0.8.45208: Flags [P.], seq 2060252997:2060253001, ack 3416063925, win 85, options [nop,nop,TS val 3793520803 ecr 1098226282], length 4
00:00:11.405908 IP 10.0.0.6.1883 > 10.0.0.8.45208: Flags [P.], seq 2060253001:2060253005, ack 3416063929, win 85, options [nop,nop,TS val 3793520805 ecr 1098226285], length 4
00:00:12.402336 IP 10.0.0.6.1883 > 10.0.0.8.45208: Flags [P.], seq 2060253005:2060253009, ack 3416064324, win 85, options [nop,nop,TS val 3793521802 ecr 1098227283], length 4
00:00:12.403840 IP 10.0.0.6.1883 > 10.0.0.8.45208: Flags [P.], seq 2060253009:2060253013, ack 3416064328, win 85, options [nop,nop,TS val 3793521803 ecr 1098227284], length 4
00:00:13.403596 IP 10.0.0.6.1883 > 10.0.0.8.45208: Flags [P.], seq 2060253013:2060253017, ack 3416064723, win 85, options [nop,nop,TS val 3793522803 ecr 1098228284], length 4
00:00:13.405287 IP 10.0.0.6.1883 > 10.0.0.8.45208: Flags [P.], seq 2060253017:2060253021, ack 3416064727, win 85, options [nop,nop,TS val 3793522805 ecr 1098228286], length 4
00:00:13.470481 IP 10.0.0.6.1883 > 10.0.0.8.45208: Flags [P.], seq 2060253021:2060253023, ack 3416064729, win 85, options [nop,nop,TS val 3793522870 ecr 1098228351], length 2
00:00:14.406427 IP 10.0.0.6.1883 > 10.0.0.8.45208: Flags [P.], seq 2060253023:2060253027, ack 3416065124, win 85, options [nop,nop,TS val 3793523806 ecr 1098229285], length 4
00:00:14.408810 IP 10.0.0.6.1883 > 10.0.0.8.45208: Flags [P.], seq 2060253027:2060253031, ack 3416065128, win 85, options [nop,nop,TS val 3793523808 ecr 1098229289], length 4
00:00:15.406836 IP 10.0.0.6.1883 > 10.0.0.8.45208: Flags [P.], seq 2060253031:2060253035, ack 3416065523, win 85, options [nop,nop,TS val 3793524806 ecr 1098230287], length 4
00:00:15.408384 IP 10.0.0.6.1883 > 10.0.0.8.45208: Flags [P.], seq 2060253035:2060253039, ack 3416065527, win 85, options [nop,nop,TS val 3793524808 ecr 1098230289], length 4
00:00:16.410774 IP 10.0.0.6.1883 > 10.0.0.8.45208: Flags [P.], seq 2060253039:2060253043, ack 3416065922, win 85, options [nop,nop,TS val 3793525810 ecr 1098231291], length 4
00:00:16.412213 IP 10.0.0.6.1883 > 10.0.0.8.45208: Flags [P.], seq 2060253043:2060253047, ack 3416065926, win 85, options [nop,nop,TS val 3793525811 ecr 1098231292], length 4
00:00:17.411719 IP 10.0.0.6.1883 > 10.0.0.8.45208: Flags [P.], seq 2060253047:2060253051, ack 3416066321, win 85, options [nop,nop,TS val 3793526811 ecr 1098232292], length 4
00:00:17.412954 IP 10.0.0.6.1883 > 10.0.0.8.45208: Flags [P.], seq 2060253051:2060253055, ack 3416066325, win 85, options [nop,nop,TS val 3793526812 ecr 1098232294], length 4
00:00:18.414347 IP 10.0.0.6.1883 > 10.0.0.8.45208: Flags [P.], seq 2060253055:2060253059, ack 3416066720, win 85, options [nop,nop,TS val 3793527813 ecr 1098233294], length 4
00:00:18.415553 IP 10.0.0.6.1883 > 10.0.0.8.45208: Flags [P.], seq 2060253059:2060253063, ack 3416066724, win 85, options [nop,nop,TS val 3793527815 ecr 1098233296], length 4
00:00:18.471538 IP 10.0.0.6.1883 > 10.0.0.8.45208: Flags [P.], seq 2060253063:2060253065, ack 3416066726, win 85, options [nop,nop,TS val 3793527871 ecr 1098233352], length 2
00:00:19.415411 IP 10.0.0.6.1883 > 10.0.0.8.45208: Flags [P.], seq 2060253065:2060253069, ack 3416067121, win 85, options [nop,nop,TS val 3793528815 ecr 1098234296], length 4
00:00:19.417487 IP 10.0.0.6.1883 > 10.0.0.8.45208: Flags [P.], seq 2060253069:2060253073, ack 3416067125, win 85, options [nop,nop,TS val 3793528817 ecr 1098234298], length 4
00:00:20.416589 IP 10.0.0.6.1883 > 10.0.0.8.45208: Flags [P.], seq 2060253073:2060253077, ack 3416067520, win 85, options [nop,nop,TS val 3793529816 ecr 1098235297], length 4
00:00:20.417711 IP 10.0.0.6.1883 > 10.0.0.8.45208: Flags [P.], seq 2060253077:2060253081, ack 3416067524, win 85, options [nop,nop,TS val 3793529817 ecr 1098235298], length 4
00:00:21.418121 IP 10.0.0.6.1883 > 10.0.0.8.45208: Flags [P.], seq 2060253081:2060253085, ack 3416067919, win 85, options [nop,nop,TS val 3793530817 ecr 1098236298], length 4
00:00:21.419226 IP 10.0.0.6.1883 > 10.0.0.8.45208: Flags [P.], seq 2060253085:2060253089, ack 3416067923, win 85, options [nop,nop,TS val 3793530818 ecr 1098236300], length 4
00:00:22.421386 IP 10.0.0.6.1883 > 10.0.0.8.45208: Flags [P.], seq 2060253089:2060253093, ack 3416068318, win 85, options [nop,nop,TS val 3793531821 ecr 1098237300], length 4
00:00:22.423577 IP 10.0.0.6.1883 > 10.0.0.8.45208: Flags [P.], seq 2060253093:2060253097, ack 3416068322, win 85, options [nop,nop,TS val 3793531823 ecr 1098237303], length 4
00:00:23.421111 IP 10.0.0.6.1883 > 10.0.0.8.45208: Flags [P.], seq 2060253097:2060253101, ack 3416068717, win 85, options [nop,nop,TS val 3793532820 ecr 1098238302], length 4
00:00:23.421896 IP 10.0.0.6.1883 > 10.0.0.8.45208: Flags [P.], seq 2060253101:2060253105, ack 3416068721, win 85, options [nop,nop,TS val 3793532821 ecr 1098238303], length 4
00:00:23.473753 IP 10.0.0.6.1883 > 10.0.0.8.45208: Flags [P.], seq 2060253105:2060253107, ack 3416068723, win 85, options [nop,nop,TS val 3793532873 ecr 1098238354], length 2
00:00:24.423602 IP 10.0.0.6.1883 > 10.0.0.8.45208: Flags [P.], seq 2060253107:2060253111, ack 3416069118, win 85, options [nop,nop,TS val 3793533823 ecr 1098239303], length 4
00:00:24.424306 IP 10.0.0.6.1883 > 10.0.0.8.45208: Flags [P.], seq 2060253111:2060253115, ack 3416069122, win 85, options [nop,nop,TS val 3793533824 ecr 1098239305], length 4
00:00:25.443083 IP 10.0.0.6.1883 > 10.0.0.8.45208: Flags [P.], seq 2060253115:2060253119, ack 3416069517, win 85, options [nop,nop,TS val 3793534842 ecr 1098240323], length 4
00:00:25.444905 IP 10.0.0.6.1883 > 10.0.0.8.45208: Flags [P.], seq 2060253119:2060253123, ack 3416069521, win 85, options [nop,nop,TS val 3793534844 ecr 1098240326], length 4
00:00:26.511428 IP 10.0.0.6.1883 > 10.0.0.8.45208: Flags [P.], seq 2060253123:2060253127, ack 3416069916, win 85, options [nop,nop,TS val 3793535911 ecr 1098241392], length 4
00:00:26.512518 IP 10.0.0.6.1883 > 10.0.0.8.45208: Flags [P.], seq 2060253127:2060253131, ack 3416069920, win 85, options [nop,nop,TS val 3793535912 ecr 1098241393], length 4
00:00:27.512996 IP 10.0.0.6.1883 > 10.0.0.8.45208: Flags [P.], seq 2060253131:2060253135, ack 3416070315, win 85, options [nop,nop,TS val 3793536912 ecr 1098242393], length 4
00:00:27.514691 IP 10.0.0.6.1883 > 10.0.0.8.45208: Flags [P.], seq 2060253135:2060253139, ack 3416070319, win 85, options [nop,nop,TS val 3793536914 ecr 1098242395], length 4
00:00:28.766848 IP 10.0.0.6.1883 > 10.0.0.8.45208: Flags [P.], seq 2060253139:2060253143, ack 3416070714, win 85, options [nop,nop,TS val 3793538166 ecr 1098243647], length 4
00:00:28.767445 IP 10.0.0.6.1883 > 10.0.0.8.45208: Flags [P.], seq 2060253143:2060253145, ack 3416070716, win 85, options [nop,nop,TS val 3793538167 ecr 1098243648], length 2
00:00:28.768694 IP 10.0.0.6.1883 > 10.0.0.8.45208: Flags [P.], seq 2060253145:2060253149, ack 3416070720, win 85, options [nop,nop,TS val 3793538168 ecr 1098243649], length 4
00:00:29.767598 IP 10.0.0.6.1883 > 10.0.0.8.45208: Flags [P.], seq 2060253149:2060253153, ack 3416071115, win 85, options [nop,nop,TS val 3793539167 ecr 1098244648], length 4
00:00:29.768832 IP 10.0.0.6.1883 > 10.0.0.8.45208: Flags [P.], seq 2060253153:2060253157, ack 3416071119, win 85, options [nop,nop,TS val 3793539168 ecr 1098244650], length 4
00:00:30.768611 IP 10.0.0.6.1883 > 10.0.0.8.45208: Flags [P.], seq 2060253157:2060253161, ack 3416071514, win 85, options [nop,nop,TS val 3793540168 ecr 1098245649], length 4
00:00:30.769626 IP 10.0.0.6.1883 > 10.0.0.8.45208: Flags [P.], seq 2060253161:2060253165, ack 3416071518, win 85, options [nop,nop,TS val 3793540169 ecr 1098245650], length 4
00:00:31.771764 IP 10.0.0.6.1883 > 10.0.0.8.45208: Flags [P.], seq 2060253165:2060253169, ack 3416071913, win 85, options [nop,nop,TS val 3793541171 ecr 1098246651], length 4
00:00:31.773620 IP 10.0.0.6.1883 > 10.0.0.8.45208: Flags [P.], seq 2060253169:2060253173, ack 3416071917, win 85, options [nop,nop,TS val 3793541173 ecr 1098246654], length 4
00:00:32.771141 IP 10.0.0.6.1883 > 10.0.0.8.45208: Flags [P.], seq 2060253173:2060253177, ack 3416072312, win 85, options [nop,nop,TS val 3793542170 ecr 1098247652], length 4
00:00:32.771850 IP 10.0.0.6.1883 > 10.0.0.8.45208: Flags [P.], seq 2060253177:2060253181, ack 3416072316, win 85, options [nop,nop,TS val 3793542171 ecr 1098247653], length 4
00:00:33.781890 IP 10.0.0.6.1883 > 10.0.0.8.45208: Flags [P.], seq 2060253181:2060253183, ack 3416072318, win 85, options [nop,nop,TS val 3793543181 ecr 1098248663], length 2
00:00:33.784357 IP 10.0.0.6.1883 > 10.0.0.8.45208: Flags [P.], seq 2060253183:2060253187, ack 3416072713, win 85, options [nop,nop,TS val 3793543184 ecr 1098248664], length 4
00:00:33.785289 IP 10.0.0.6.1883 > 10.0.0.8.45208: Flags [P.], seq 2060253187:2060253191, ack 3416072717, win 85, options [nop,nop,TS val 3793543185 ecr 1098248666], length 4
00:00:34.783444 IP 10.0.0.6.1883 > 10.0.0.8.45208: Flags [P.], seq 2060253191:2060253195, ack 3416073112, win 85, options [nop,nop,TS val 3793544182 ecr 1098249664], length 4
00:00:34.784570 IP 10.0.0.6.1883 > 10.0.0.8.45208: Flags [P.], seq 2060253195:2060253199, ack 3416073116, win 85, options [nop,nop,TS val 3793544184 ecr 1098249665], length 4
00:00:35.784711 IP 10.0.0.6.1883 > 10.0.0.8.45208: Flags [P.], seq 2060253199:2060253203, ack 3416073511, win 85, options [nop,nop,TS val 3793545184 ecr 1098250666], length 4
00:00:35.785717 IP 10.0.0.6.1883 > 10.0.0.8.45208: Flags [P.], seq 2060253203:2060253207, ack 3416073515, win 85, options [nop,nop,TS val 3793545185 ecr 1098250666], length 4
00:00:36.799715 IP 10.0.0.6.1883 > 10.0.0.8.45208: Flags [P.], seq 2060253207:2060253211, ack 3416073910, win 85, options [nop,nop,TS val 3793546199 ecr 1098251680], length 4
00:00:36.800375 IP 10.0.0.6.1883 > 10.0.0.8.45208: Flags [P.], seq 2060253211:2060253215, ack 3416073914, win 85, options [nop,nop,TS val 3793546200 ecr 1098251681], length 4
00:00:37.799288 IP 10.0.0.6.1883 > 10.0.0.8.45208: Flags [P.], seq 2060253215:2060253219, ack 3416074309, win 85, options [nop,nop,TS val 3793547198 ecr 1098252680], length 4
00:00:37.800230 IP 10.0.0.6.1883 > 10.0.0.8.45208: Flags [P.], seq 2060253219:2060253223, ack 3416074313, win 85, options [nop,nop,TS val 3793547199 ecr 1098252681], length 4
00:00:38.790773 IP 10.0.0.6.1883 > 10.0.0.8.45208: Flags [P.], seq 2060253223:2060253225, ack 3416074315, win 85, options [nop,nop,TS val 3793548190 ecr 1098253671], length 2
00:00:38.800859 IP 10.0.0.6.1883 > 10.0.0.8.45208: Flags [P.], seq 2060253225:2060253229, ack 3416074710, win 85, options [nop,nop,TS val 3793548200 ecr 1098253681], length 4
00:00:38.802388 IP 10.0.0.6.1883 > 10.0.0.8.45208: Flags [P.], seq 2060253229:2060253233, ack 3416074714, win 85, options [nop,nop,TS val 3793548201 ecr 1098253683], length 4
00:00:39.805290 IP 10.0.0.6.1883 > 10.0.0.8.45208: Flags [P.], seq 2060253233:2060253237, ack 3416075109, win 85, options [nop,nop,TS val 3793549205 ecr 1098254686], length 4
00:00:39.806913 IP 10.0.0.6.1883 > 10.0.0.8.45208: Flags [P.], seq 2060253237:2060253241, ack 3416075113, win 85, options [nop,nop,TS val 3793549206 ecr 1098254687], length 4
00:00:40.814724 IP 10.0.0.6.1883 > 10.0.0.8.45208: Flags [P.], seq 2060253241:2060253245, ack 3416075508, win 85, options [nop,nop,TS val 3793550214 ecr 1098255695], length 4
00:00:40.815940 IP 10.0.0.6.1883 > 10.0.0.8.45208: Flags [P.], seq 2060253245:2060253249, ack 3416075512, win 85, options [nop,nop,TS val 3793550215 ecr 1098255697], length 4
00:00:41.816919 IP 10.0.0.6.1883 > 10.0.0.8.45208: Flags [P.], seq 2060253249:2060253253, ack 3416075907, win 85, options [nop,nop,TS val 3793551216 ecr 1098256696], length 4
00:00:41.818407 IP 10.0.0.6.1883 > 10.0.0.8.45208: Flags [P.], seq 2060253253:2060253257, ack 3416075911, win 85, options [nop,nop,TS val 3793551218 ecr 1098256699], length 4
00:00:42.839063 IP 10.0.0.6.1883 > 10.0.0.8.45208: Flags [P.], seq 2060253257:2060253261, ack 3416076306, win 85, options [nop,nop,TS val 3793552238 ecr 1098257719], length 4
00:00:42.840368 IP 10.0.0.6.1883 > 10.0.0.8.45208: Flags [P.], seq 2060253261:2060253265, ack 3416076310, win 85, options [nop,nop,TS val 3793552240 ecr 1098257721], length 4
00:00:43.840745 IP 10.0.0.6.1883 > 10.0.0.8.45208: Flags [P.], seq 2060253265:2060253269, ack 3416076705, win 85, options [nop,nop,TS val 3793553240 ecr 1098258721], length 4
00:00:43.841556 IP 10.0.0.6.1883 > 10.0.0.8.45208: Flags [P.], seq 2060253269:2060253271, ack 3416076707, win 85, options [nop,nop,TS val 3793553241 ecr 1098258722], length 2
00:00:43.843515 IP 10.0.0.6.1883 > 10.0.0.8.45208: Flags [P.], seq 2060253271:2060253275, ack 3416076711, win 85, options [nop,nop,TS val 3793553243 ecr 1098258724], length 4
00:00:44.845073 IP 10.0.0.6.1883 > 10.0.0.8.45208: Flags [P.], seq 2060253275:2060253279, ack 3416077106, win 85, options [nop,nop,TS val 3793554244 ecr 1098259726], length 4
00:00:44.845937 IP 10.0.0.6.1883 > 10.0.0.8.45208: Flags [P.], seq 2060253279:2060253283, ack 3416077110, win 85, options [nop,nop,TS val 3793554245 ecr 1098259727], length 4
00:00:45.846309 IP 10.0.0.6.1883 > 10.0.0.8.45208: Flags [P.], seq 2060253283:2060253287, ack 3416077505, win 85, options [nop,nop,TS val 3793555246 ecr 1098260727], length 4
00:00:45.847017 IP 10.0.0.6.1883 > 10.0.0.8.45208: Flags [P.], seq 2060253287:2060253291, ack 3416077509, win 85, options [nop,nop,TS val 3793555246 ecr 1098260728], length 4
00:00:46.857360 IP 10.0.0.6.1883 > 10.0.0.8.45208: Flags [P.], seq 2060253291:2060253295, ack 3416077904, win 85, options [nop,nop,TS val 3793556257 ecr 1098261738], length 4
00:00:46.857967 IP 10.0.0.6.1883 > 10.0.0.8.45208: Flags [P.], seq 2060253295:2060253299, ack 3416077908, win 85, options [nop,nop,TS val 3793556257 ecr 1098261739], length 4
00:00:47.858287 IP 10.0.0.6.1883 > 10.0.0.8.45208: Flags [P.], seq 2060253299:2060253303, ack 3416078303, win 85, options [nop,nop,TS val 3793557258 ecr 1098262739], length 4
00:00:47.859255 IP 10.0.0.6.1883 > 10.0.0.8.45208: Flags [P.], seq 2060253303:2060253307, ack 3416078307, win 85, options [nop,nop,TS val 3793557258 ecr 1098262740], length 4
00:00:48.842192 IP 10.0.0.6.1883 > 10.0.0.8.45208: Flags [P.], seq 2060253307:2060253309, ack 3416078309, win 85, options [nop,nop,TS val 3793558241 ecr 1098263723], length 2
00:00:48.859265 IP 10.0.0.6.1883 > 10.0.0.8.45208: Flags [P.], seq 2060253309:2060253313, ack 3416078704, win 85, options [nop,nop,TS val 3793558258 ecr 1098263740], length 4
00:00:48.860607 IP 10.0.0.6.1883 > 10.0.0.8.45208: Flags [P.], seq 2060253313:2060253317, ack 3416078708, win 85, options [nop,nop,TS val 3793558260 ecr 1098263741], length 4
00:00:49.860663 IP 10.0.0.6.1883 > 10.0.0.8.45208: Flags [P.], seq 2060253317:2060253321, ack 3416079103, win 85, options [nop,nop,TS val 3793559260 ecr 1098264741], length 4
00:00:49.862076 IP 10.0.0.6.1883 > 10.0.0.8.45208: Flags [P.], seq 2060253321:2060253325, ack 3416079107, win 85, options [nop,nop,TS val 3793559261 ecr 1098264743], length 4
00:00:50.861474 IP 10.0.0.6.1883 > 10.0.0.8.45208: Flags [P.], seq 2060253325:2060253329, ack 3416079502, win 85, options [nop,nop,TS val 3793560261 ecr 1098265742], length 4
00:00:50.862555 IP 10.0.0.6.1883 > 10.0.0.8.45208: Flags [P.], seq 2060253329:2060253333, ack 3416079506, win 85, options [nop,nop,TS val 3793560262 ecr 1098265743], length 4
00:00:51.863783 IP 10.0.0.6.1883 > 10.0.0.8.45208: Flags [P.], seq 2060253333:2060253337, ack 3416079901, win 85, options [nop,nop,TS val 3793561263 ecr 1098266744], length 4
00:00:51.865052 IP 10.0.0.6.1883 > 10.0.0.8.45208: Flags [P.], seq 2060253337:2060253341, ack 3416079905, win 85, options [nop,nop,TS val 3793561264 ecr 1098266746], length 4
00:00:53.183441 IP 10.0.0.6.1883 > 10.0.0.8.45208: Flags [P.], seq 2060253341:2060253345, ack 3416080300, win 85, options [nop,nop,TS val 3793562583 ecr 1098268064], length 4
00:00:53.184480 IP 10.0.0.6.1883 > 10.0.0.8.45208: Flags [P.], seq 2060253345:2060253349, ack 3416080304, win 85, options [nop,nop,TS val 3793562584 ecr 1098268065], length 4
00:00:54.171101 IP 10.0.0.6.1883 > 10.0.0.8.45208: Flags [P.], seq 2060253349:2060253351, ack 3416080306, win 85, options [nop,nop,TS val 3793563570 ecr 1098269052], length 2
00:00:54.185896 IP 10.0.0.6.1883 > 10.0.0.8.45208: Flags [P.], seq 2060253351:2060253355, ack 3416080701, win 85, options [nop,nop,TS val 3793563585 ecr 1098269066], length 4
00:00:54.187135 IP 10.0.0.6.1883 > 10.0.0.8.45208: Flags [P.], seq 2060253355:2060253359, ack 3416080705, win 85, options [nop,nop,TS val 3793563586 ecr 1098269068], length 4
00:00:55.227750 IP 10.0.0.6.1883 > 10.0.0.8.45208: Flags [P.], seq 2060253359:2060253363, ack 3416081100, win 85, options [nop,nop,TS val 3793564627 ecr 1098270108], length 4
00:00:55.229007 IP 10.0.0.6.1883 > 10.0.0.8.45208: Flags [P.], seq 2060253363:2060253367, ack 3416081104, win 85, options [nop,nop,TS val 3793564628 ecr 1098270110], length 4
00:00:56.259378 IP 10.0.0.6.1883 > 10.0.0.8.45208: Flags [P.], seq 2060253367:2060253371, ack 3416081499, win 85, options [nop,nop,TS val 3793565659 ecr 1098271140], length 4
00:00:56.260607 IP 10.0.0.6.1883 > 10.0.0.8.45208: Flags [P.], seq 2060253371:2060253375, ack 3416081503, win 85, options [nop,nop,TS val 3793565660 ecr 1098271141], length 4
00:00:57.308287 IP 10.0.0.6.1883 > 10.0.0.8.45208: Flags [P.], seq 2060253375:2060253379, ack 3416081898, win 85, options [nop,nop,TS val 3793566708 ecr 1098272188], length 4
00:00:57.311240 IP 10.0.0.6.1883 > 10.0.0.8.45208: Flags [P.], seq 2060253379:2060253383, ack 3416081902, win 85, options [nop,nop,TS val 3793566710 ecr 1098272191], length 4
00:00:58.366296 IP 10.0.0.6.1883 > 10.0.0.8.45208: Flags [P.], seq 2060253383:2060253387, ack 3416082297, win 85, options [nop,nop,TS val 3793567766 ecr 1098273246], length 4
00:00:58.367253 IP 10.0.0.6.1883 > 10.0.0.8.45208: Flags [P.], seq 2060253387:2060253391, ack 3416082301, win 85, options [nop,nop,TS val 3793567766 ecr 1098273248], length 4
00:00:59.186139 IP 10.0.0.6.1883 > 10.0.0.8.45208: Flags [P.], seq 2060253391:2060253393, ack 3416082303, win 85, options [nop,nop,TS val 3793568585 ecr 1098274067], length 2
00:00:59.366080 IP 10.0.0.6.1883 > 10.0.0.8.45208: Flags [P.], seq 2060253393:2060253397, ack 3416082698, win 85, options [nop,nop,TS val 3793568765 ecr 1098274246], length 4
00:00:59.366718 IP 10.0.0.6.1883 > 10.0.0.8.45208: Flags [P.], seq 2060253397:2060253401, ack 3416082702, win 85, options [nop,nop,TS val 3793568766 ecr 1098274248], length 4
00:01:00.376037 IP 10.0.0.6.1883 > 10.0.0.8.45208: Flags [P.], seq 2060253401:2060253405, ack 3416083097, win 85, options [nop,nop,TS val 3793569775 ecr 1098275256], length 4
00:01:00.377585 IP 10.0.0.6.1883 > 10.0.0.8.45208: Flags [P.], seq 2060253405:2060253409, ack 3416083101, win 85, options [nop,nop,TS val 3793569777 ecr 1098275258], length 4
00:01:01.385740 IP 10.0.0.6.1883 > 10.0.0.8.45208: Flags [P.], seq 2060253409:2060253413, ack 3416083496, win 85, options [nop,nop,TS val 3793570785 ecr 1098276266], length 4
00:01:01.388157 IP 10.0.0.6.1883 > 10.0.0.8.45208: Flags [P.], seq 2060253413:2060253417, ack 3416083500, win 85, options [nop,nop,TS val 3793570787 ecr 1098276268], length 4
00:01:02.401480 IP 10.0.0.6.1883 > 10.0.0.8.45208: Flags [P.], seq 2060253417:2060253421, ack 3416083895, win 85, options [nop,nop,TS val 3793571801 ecr 1098277282], length 4
00:01:02.402186 IP 10.0.0.6.1883 > 10.0.0.8.45208: Flags [P.], seq 2060253421:2060253425, ack 3416083899, win 85, options [nop,nop,TS val 3793571801 ecr 1098277283], length 4
00:01:03.413766 IP 10.0.0.6.1883 > 10.0.0.8.45208: Flags [P.], seq 2060253425:2060253429, ack 3416084294, win 85, options [nop,nop,TS val 3793572813 ecr 1098278294], length 4
00:01:03.414383 IP 10.0.0.6.1883 > 10.0.0.8.45208: Flags [P.], seq 2060253429:2060253433, ack 3416084298, win 85, options [nop,nop,TS val 3793572814 ecr 1098278295], length 4
00:01:04.194319 IP 10.0.0.6.1883 > 10.0.0.8.45208: Flags [P.], seq 2060253433:2060253435, ack 3416084300, win 85, options [nop,nop,TS val 3793573594 ecr 1098279075], length 2
00:01:04.419952 IP 10.0.0.6.1883 > 10.0.0.8.45208: Flags [P.], seq 2060253435:2060253439, ack 3416084695, win 85, options [nop,nop,TS val 3793573819 ecr 1098279300], length 4
00:01:04.420765 IP 10.0.0.6.1883 > 10.0.0.8.45208: Flags [P.], seq 2060253439:2060253443, ack 3416084699, win 85, options [nop,nop,TS val 3793573820 ecr 1098279302], length 4
00:01:05.437913 IP 10.0.0.6.1883 > 10.0.0.8.45208: Flags [P.], seq 2060253443:2060253447, ack 3416085094, win 85, options [nop,nop,TS val 3793574837 ecr 1098280318], length 4
00:01:05.439045 IP 10.0.0.6.1883 > 10.0.0.8.45208: Flags [P.], seq 2060253447:2060253451, ack 3416085098, win 85, options [nop,nop,TS val 3793574838 ecr 1098280320], length 4
00:01:06.439615 IP 10.0.0.6.1883 > 10.0.0.8.45208: Flags [P.], seq 2060253451:2060253455, ack 3416085493, win 85, options [nop,nop,TS val 3793575839 ecr 1098281320], length 4
00:01:06.440253 IP 10.0.0.6.1883 > 10.0.0.8.45208: Flags [P.], seq 2060253455:2060253459, ack 3416085497, win 85, options [nop,nop,TS val 3793575839 ecr 1098281321], length 4
00:01:07.441510 IP 10.0.0.6.1883 > 10.0.0.8.45208: Flags [P.], seq 2060253459:2060253463, ack 3416085892, win 85, options [nop,nop,TS val 3793576841 ecr 1098282322], length 4
00:01:07.442045 IP 10.0.0.6.1883 > 10.0.0.8.45208: Flags [P.], seq 2060253463:2060253467, ack 3416085896, win 85, options [nop,nop,TS val 3793576841 ecr 1098282323], length 4
00:01:08.443297 IP 10.0.0.6.1883 > 10.0.0.8.45208: Flags [P.], seq 2060253467:2060253471, ack 3416086291, win 85, options [nop,nop,TS val 3793577843 ecr 1098283324], length 4
00:01:08.444624 IP 10.0.0.6.1883 > 10.0.0.8.45208: Flags [P.], seq 2060253471:2060253475, ack 3416086295, win 85, options [nop,nop,TS val 3793577844 ecr 1098283325], length 4
00:01:09.232533 IP 10.0.0.6.1883 > 10.0.0.8.45208: Flags [P.], seq 2060253475:2060253477, ack 3416086297, win 85, options [nop,nop,TS val 3793578632 ecr 1098284113], length 2
00:01:09.456000 IP 10.0.0.6.1883 > 10.0.0.8.45208: Flags [P.], seq 2060253477:2060253481, ack 3416086692, win 85, options [nop,nop,TS val 3793578855 ecr 1098284336], length 4
00:01:09.456794 IP 10.0.0.6.1883 > 10.0.0.8.45208: Flags [P.], seq 2060253481:2060253485, ack 3416086696, win 85, options [nop,nop,TS val 3793578856 ecr 1098284338], length 4
00:01:10.764237 IP 10.0.0.6.1883 > 10.0.0.8.45208: Flags [P.], seq 2060253485:2060253489, ack 3416087091, win 85, options [nop,nop,TS val 3793580163 ecr 1098285643], length 4
00:01:10.765395 IP 10.0.0.6.1883 > 10.0.0.8.45208: Flags [P.], seq 2060253489:2060253493, ack 3416087095, win 85, options [nop,nop,TS val 3793580165 ecr 1098285646], length 4
00:01:11.203699 IP 10.0.0.6.1883 > 10.0.0.8.45208: Flags [P.], seq 2060253489:2060253493, ack 3416087095, win 85, options [nop,nop,TS val 3793580581 ecr 1098285646], length 4
00:01:11.770090 IP 10.0.0.6.1883 > 10.0.0.8.45208: Flags [P.], seq 2060253493:2060253497, ack 3416087490, win 85, options [nop,nop,TS val 3793581169 ecr 1098286648], length 4
00:01:11.979110 IP 10.0.0.6.1883 > 10.0.0.8.45208: Flags [.], ack 3416087490, win 85, options [nop,nop,TS val 3793581378 ecr 1098286860,nop,nop,sack 1 {3416087095:3416087490}], length 0
00:01:11.979443 IP 10.0.0.6.1883 > 10.0.0.8.45208: Flags [.], ack 3416087494, win 85, options [nop,nop,TS val 3793581378 ecr 1098286860], length 0
00:01:11.979849 IP 10.0.0.6.1883 > 10.0.0.8.45208: Flags [P.], seq 2060253497:2060253501, ack 3416087494, win 85, options [nop,nop,TS val 3793581379 ecr 1098286860], length 4
00:01:12.769062 IP 10.0.0.6.1883 > 10.0.0.8.45208: Flags [P.], seq 2060253501:2060253505, ack 3416087889, win 85, options [nop,nop,TS val 3793582168 ecr 1098287649], length 4
00:01:12.770569 IP 10.0.0.6.1883 > 10.0.0.8.45208: Flags [P.], seq 2060253505:2060253509, ack 3416087893, win 85, options [nop,nop,TS val 3793582170 ecr 1098287651], length 4
00:01:13.771883 IP 10.0.0.6.1883 > 10.0.0.8.45208: Flags [P.], seq 2060253509:2060253513, ack 3416088288, win 85, options [nop,nop,TS val 3793583171 ecr 1098288652], length 4
00:01:13.773089 IP 10.0.0.6.1883 > 10.0.0.8.45208: Flags [P.], seq 2060253513:2060253517, ack 3416088292, win 85, options [nop,nop,TS val 3793583172 ecr 1098288654], length 4
00:01:14.233613 IP 10.0.0.6.1883 > 10.0.0.8.45208: Flags [P.], seq 2060253517:2060253519, ack 3416088294, win 85, options [nop,nop,TS val 3793583633 ecr 1098289114], length 2
00:01:14.772669 IP 10.0.0.6.1883 > 10.0.0.8.45208: Flags [P.], seq 2060253519:2060253523, ack 3416088689, win 85, options [nop,nop,TS val 3793584172 ecr 1098289653], length 4
00:01:14.773461 IP 10.0.0.6.1883 > 10.0.0.8.45208: Flags [P.], seq 2060253523:2060253527, ack 3416088693, win 85, options [nop,nop,TS val 3793584173 ecr 1098289654], length 4
00:01:15.774446 IP 10.0.0.6.1883 > 10.0.0.8.45208: Flags [P.], seq 2060253527:2060253531, ack 3416089088, win 85, options [nop,nop,TS val 3793585174 ecr 1098290655], length 4
00:01:15.775624 IP 10.0.0.6.1883 > 10.0.0.8.45208: Flags [P.], seq 2060253531:2060253535, ack 3416089092, win 85, options [nop,nop,TS val 3793585175 ecr 1098290656], length 4
00:01:16.775870 IP 10.0.0.6.1883 > 10.0.0.8.45208: Flags [P.], seq 2060253535:2060253539, ack 3416089487, win 85, options [nop,nop,TS val 3793586175 ecr 1098291656], length 4
00:01:16.777196 IP 10.0.0.6.1883 > 10.0.0.8.45208: Flags [P.], seq 2060253539:2060253543, ack 3416089491, win 85, options [nop,nop,TS val 3793586176 ecr 1098291657], length 4
00:01:17.777258 IP 10.0.0.6.1883 > 10.0.0.8.45208: Flags [P.], seq 2060253543:2060253547, ack 3416089886, win 85, options [nop,nop,TS val 3793587176 ecr 1098292658], length 4
00:01:17.779295 IP 10.0.0.6.1883 > 10.0.0.8.45208: Flags [P.], seq 2060253547:2060253551, ack 3416089890, win 85, options [nop,nop,TS val 3793587179 ecr 1098292659], length 4
00:01:18.781684 IP 10.0.0.6.1883 > 10.0.0.8.45208: Flags [P.], seq 2060253551:2060253555, ack 3416090285, win 85, options [nop,nop,TS val 3793588181 ecr 1098293662], length 4
00:01:18.783681 IP 10.0.0.6.1883 > 10.0.0.8.45208: Flags [P.], seq 2060253555:2060253559, ack 3416090289, win 85, options [nop,nop,TS val 3793588183 ecr 1098293664], length 4
00:01:19.236516 IP 10.0.0.6.1883 > 10.0.0.8.45208: Flags [P.], seq 2060253559:2060253561, ack 3416090291, win 85, options [nop,nop,TS val 3793588636 ecr 1098294116], length 2
00:01:19.785469 IP 10.0.0.6.1883 > 10.0.0.8.45208: Flags [P.], seq 2060253561:2060253565, ack 3416090686, win 85, options [nop,nop,TS val 3793589185 ecr 1098294664], length 4
00:01:19.786221 IP 10.0.0.6.1883 > 10.0.0.8.45208: Flags [P.], seq 2060253565:2060253569, ack 3416090690, win 85, options [nop,nop,TS val 3793589185 ecr 1098294667], length 4
00:01:20.787160 IP 10.0.0.6.1883 > 10.0.0.8.45208: Flags [P.], seq 2060253569:2060253573, ack 3416091085, win 85, options [nop,nop,TS val 3793590186 ecr 1098295666], length 4
00:01:20.790033 IP 10.0.0.6.1883 > 10.0.0.8.45208: Flags [P.], seq 2060253573:2060253577, ack 3416091089, win 85, options [nop,nop,TS val 3793590189 ecr 1098295669], length 4
00:01:21.787998 IP 10.0.0.6.1883 > 10.0.0.8.45208: Flags [P.], seq 2060253577:2060253581, ack 3416091484, win 85, options [nop,nop,TS val 3793591187 ecr 1098296667], length 4
00:01:21.788645 IP 10.0.0.6.1883 > 10.0.0.8.45208: Flags [P.], seq 2060253581:2060253585, ack 3416091488, win 85, options [nop,nop,TS val 3793591188 ecr 1098296670], length 4
00:01:22.789314 IP 10.0.0.6.1883 > 10.0.0.8.45208: Flags [P.], seq 2060253585:2060253589, ack 3416091883, win 85, options [nop,nop,TS val 3793592189 ecr 1098297668], length 4
00:01:22.790034 IP 10.0.0.6.1883 > 10.0.0.8.45208: Flags [P.], seq 2060253589:2060253593, ack 3416091887, win 85, options [nop,nop,TS val 3793592189 ecr 1098297671], length 4
00:01:23.791351 IP 10.0.0.6.1883 > 10.0.0.8.45208: Flags [P.], seq 2060253593:2060253597, ack 3416092282, win 85, options [nop,nop,TS val 3793593191 ecr 1098298670], length 4
00:01:23.792242 IP 10.0.0.6.1883 > 10.0.0.8.45208: Flags [P.], seq 2060253597:2060253601, ack 3416092286, win 85, options [nop,nop,TS val 3793593191 ecr 1098298673], length 4
00:01:24.237704 IP 10.0.0.6.1883 > 10.0.0.8.45208: Flags [P.], seq 2060253601:2060253603, ack 3416092288, win 85, options [nop,nop,TS val 3793593637 ecr 1098299117], length 2
00:01:24.790558 IP 10.0.0.6.1883 > 10.0.0.8.45208: Flags [P.], seq 2060253603:2060253607, ack 3416092683, win 85, options [nop,nop,TS val 3793594190 ecr 1098299671], length 4
00:01:24.792641 IP 10.0.0.6.1883 > 10.0.0.8.45208: Flags [P.], seq 2060253607:2060253611, ack 3416092687, win 85, options [nop,nop,TS val 3793594192 ecr 1098299673], length 4
00:01:25.791134 IP 10.0.0.6.1883 > 10.0.0.8.45208: Flags [P.], seq 2060253611:2060253615, ack 3416093082, win 85, options [nop,nop,TS val 3793595190 ecr 1098300671], length 4
00:01:25.791841 IP 10.0.0.6.1883 > 10.0.0.8.45208: Flags [P.], seq 2060253615:2060253619, ack 3416093086, win 85, options [nop,nop,TS val 3793595191 ecr 1098300673], length 4
00:01:26.792630 IP 10.0.0.6.1883 > 10.0.0.8.45208: Flags [P.], seq 2060253619:2060253623, ack 3416093481, win 85, options [nop,nop,TS val 3793596192 ecr 1098301673], length 4
00:01:26.793403 IP 10.0.0.6.1883 > 10.0.0.8.45208: Flags [P.], seq 2060253623:2060253627, ack 3416093485, win 85, options [nop,nop,TS val 3793596193 ecr 1098301674], length 4
00:01:27.935010 IP 10.0.0.6.1883 > 10.0.0.8.45208: Flags [P.], seq 2060253627:2060253631, ack 3416093880, win 85, options [nop,nop,TS val 3793597334 ecr 1098302815], length 4
00:01:27.936668 IP 10.0.0.6.1883 > 10.0.0.8.45208: Flags [P.], seq 2060253631:2060253635, ack 3416093884, win 85, options [nop,nop,TS val 3793597336 ecr 1098302817], length 4
00:01:28.181660 IP 10.0.0.6.1883 > 10.0.0.8.45208: Flags [P.], seq 2060253631:2060253635, ack 3416093884, win 85, options [nop,nop,TS val 3793597581 ecr 1098302817], length 4
00:01:28.936712 IP 10.0.0.6.1883 > 10.0.0.8.45208: Flags [P.], seq 2060253635:2060253639, ack 3416094279, win 85, options [nop,nop,TS val 3793598336 ecr 1098303817], length 4
00:01:28.937977 IP 10.0.0.6.1883 > 10.0.0.8.45208: Flags [P.], seq 2060253639:2060253643, ack 3416094283, win 85, options [nop,nop,TS val 3793598337 ecr 1098303818], length 4
00:01:29.239254 IP 10.0.0.6.1883 > 10.0.0.8.45208: Flags [P.], seq 2060253643:2060253645, ack 3416094285, win 85, options [nop,nop,TS val 3793598638 ecr 1098304119], length 2
00:01:29.936891 IP 10.0.0.6.1883 > 10.0.0.8.45208: Flags [P.], seq 2060253645:2060253649, ack 3416094680, win 85, options [nop,nop,TS val 3793599336 ecr 1098304817], length 4
00:01:29.938171 IP 10.0.0.6.1883 > 10.0.0.8.45208: Flags [P.], seq 2060253649:2060253653, ack 3416094684, win 85, options [nop,nop,TS val 3793599337 ecr 1098304819], length 4
00:01:30.938237 IP 10.0.0.6.1883 > 10.0.0.8.45208: Flags [P.], seq 2060253653:2060253657, ack 3416095079, win 85, options [nop,nop,TS val 3793600337 ecr 1098305819], length 4
00:01:30.939267 IP 10.0.0.6.1883 > 10.0.0.8.45208: Flags [P.], seq 2060253657:2060253661, ack 3416095083, win 85, options [nop,nop,TS val 3793600338 ecr 1098305820], length 4
00:01:31.939600 IP 10.0.0.6.1883 > 10.0.0.8.45208: Flags [P.], seq 2060253661:2060253665, ack 3416095478, win 85, options [nop,nop,TS val 3793601339 ecr 1098306820], length 4
00:01:31.940290 IP 10.0.0.6.1883 > 10.0.0.8.45208: Flags [P.], seq 2060253665:2060253669, ack 3416095482, win 85, options [nop,nop,TS val 3793601340 ecr 1098306821], length 4
00:01:32.941190 IP 10.0.0.6.1883 > 10.0.0.8.45208: Flags [P.], seq 2060253669:2060253673, ack 3416095877, win 85, options [nop,nop,TS val 3793602340 ecr 1098307821], length 4
00:01:32.942479 IP 10.0.0.6.1883 > 10.0.0.8.45208: Flags [P.], seq 2060253673:2060253677, ack 3416095881, win 85, options [nop,nop,TS val 3793602342 ecr 1098307823], length 4
00:01:33.942643 IP 10.0.0.6.1883 > 10.0.0.8.45208: Flags [P.], seq 2060253677:2060253681, ack 3416096276, win 85, options [nop,nop,TS val 3793603342 ecr 1098308823], length 4
00:01:33.944776 IP 10.0.0.6.1883 > 10.0.0.8.45208: Flags [P.], seq 2060253681:2060253685, ack 3416096280, win 85, options [nop,nop,TS val 3793603344 ecr 1098308826], length 4
00:01:34.240431 IP 10.0.0.6.1883 > 10.0.0.8.45208: Flags [P.], seq 2060253685:2060253687, ack 3416096282, win 85, options [nop,nop,TS val 3793603639 ecr 1098309121], length 2
00:01:34.947657 IP 10.0.0.6.1883 > 10.0.0.8.45208: Flags [P.], seq 2060253687:2060253691, ack 3416096677, win 85, options [nop,nop,TS val 3793604347 ecr 1098309828], length 4
00:01:34.948117 IP 10.0.0.6.1883 > 10.0.0.8.45208: Flags [P.], seq 2060253691:2060253695, ack 3416096681, win 85, options [nop,nop,TS val 3793604347 ecr 1098309829], length 4
00:01:35.949911 IP 10.0.0.6.1883 > 10.0.0.8.45208: Flags [P.], seq 2060253695:2060253699, ack 3416097076, win 85, options [nop,nop,TS val 3793605349 ecr 1098310830], length 4
00:01:35.952021 IP 10.0.0.6.1883 > 10.0.0.8.45208: Flags [P.], seq 2060253699:2060253703, ack 3416097080, win 85, options [nop,nop,TS val 3793605351 ecr 1098310833], length 4
00:01:36.953941 IP 10.0.0.6.1883 > 10.0.0.8.45208: Flags [P.], seq 2060253703:2060253707, ack 3416097475, win 85, options [nop,nop,TS val 3793606353 ecr 1098311833], length 4
00:01:36.955985 IP 10.0.0.6.1883 > 10.0.0.8.45208: Flags [P.], seq 2060253707:2060253711, ack 3416097479, win 85, options [nop,nop,TS val 3793606355 ecr 1098311836], length 4
00:01:37.954065 IP 10.0.0.6.1883 > 10.0.0.8.45208: Flags [P.], seq 2060253711:2060253715, ack 3416097874, win 85, options [nop,nop,TS val 3793607353 ecr 1098312834], length 4
00:01:37.955947 IP 10.0.0.6.1883 > 10.0.0.8.45208: Flags [P.], seq 2060253715:2060253719, ack 3416097878, win 85, options [nop,nop,TS val 3793607355 ecr 1098312837], length 4
00:01:38.957992 IP 10.0.0.6.1883 > 10.0.0.8.45208: Flags [P.], seq 2060253719:2060253723, ack 3416098273, win 85, options [nop,nop,TS val 3793608357 ecr 1098313838], length 4
00:01:38.959596 IP 10.0.0.6.1883 > 10.0.0.8.45208: Flags [P.], seq 2060253723:2060253727, ack 3416098277, win 85, options [nop,nop,TS val 3793608359 ecr 1098313840], length 4
00:01:39.241531 IP 10.0.0.6.1883 > 10.0.0.8.45208: Flags [P.], seq 2060253727:2060253729, ack 3416098279, win 85, options [nop,nop,TS val 3793608641 ecr 1098314122], length 2
00:01:39.959532 IP 10.0.0.6.1883 > 10.0.0.8.45208: Flags [P.], seq 2060253729:2060253733, ack 3416098674, win 85, options [nop,nop,TS val 3793609359 ecr 1098314840], length 4
00:01:39.960093 IP 10.0.0.6.1883 > 10.0.0.8.45208: Flags [P.], seq 2060253733:2060253737, ack 3416098678, win 85, options [nop,nop,TS val 3793609359 ecr 1098314841], length 4
00:01:40.960370 IP 10.0.0.6.1883 > 10.0.0.8.45208: Flags [P.], seq 2060253737:2060253741, ack 3416099073, win 85, options [nop,nop,TS val 3793610360 ecr 1098315841], length 4
00:01:40.961188 IP 10.0.0.6.1883 > 10.0.0.8.45208: Flags [P.], seq 2060253741:2060253745, ack 3416099077, win 85, options [nop,nop,TS val 3793610360 ecr 1098315842], length 4
00:01:41.961995 IP 10.0.0.6.1883 > 10.0.0.8.45208: Flags [P.], seq 2060253745:2060253749, ack 3416099472, win 85, options [nop,nop,TS val 3793611361 ecr 1098316842], length 4
00:01:41.963141 IP 10.0.0.6.1883 > 10.0.0.8.45208: Flags [P.], seq 2060253749:2060253753, ack 3416099476, win 85, options [nop,nop,TS val 3793611362 ecr 1098316844], length 4
00:01:42.963845 IP 10.0.0.6.1883 > 10.0.0.8.45208: Flags [P.], seq 2060253753:2060253757, ack 3416099871, win 85, options [nop,nop,TS val 3793612363 ecr 1098317844], length 4
00:01:42.964537 IP 10.0.0.6.1883 > 10.0.0.8.45208: Flags [P.], seq 2060253757:2060253761, ack 3416099875, win 85, options [nop,nop,TS val 3793612364 ecr 1098317846], length 4
00:01:43.966510 IP 10.0.0.6.1883 > 10.0.0.8.45208: Flags [P.], seq 2060253761:2060253765, ack 3416100270, win 85, options [nop,nop,TS val 3793613366 ecr 1098318845], length 4
00:01:43.968977 IP 10.0.0.6.1883 > 10.0.0.8.45208: Flags [P.], seq 2060253765:2060253769, ack 3416100274, win 85, options [nop,nop,TS val 3793613368 ecr 1098318849], length 4
00:01:44.244403 IP 10.0.0.6.1883 > 10.0.0.8.45208: Flags [P.], seq 2060253769:2060253771, ack 3416100276, win 85, options [nop,nop,TS val 3793613644 ecr 1098319124], length 2
00:01:44.967528 IP 10.0.0.6.1883 > 10.0.0.8.45208: Flags [P.], seq 2060253771:2060253775, ack 3416100671, win 85, options [nop,nop,TS val 3793614367 ecr 1098319847], length 4
00:01:44.969213 IP 10.0.0.6.1883 > 10.0.0.8.45208: Flags [P.], seq 2060253775:2060253779, ack 3416100675, win 85, options [nop,nop,TS val 3793614368 ecr 1098319850], length 4
00:01:46.183366 IP 10.0.0.6.1883 > 10.0.0.8.45208: Flags [P.], seq 2060253779:2060253783, ack 3416101070, win 85, options [nop,nop,TS val 3793615583 ecr 1098321064], length 4
00:01:46.184716 IP 10.0.0.6.1883 > 10.0.0.8.45208: Flags [P.], seq 2060253783:2060253787, ack 3416101074, win 85, options [nop,nop,TS val 3793615584 ecr 1098321066], length 4
00:01:47.228608 IP 10.0.0.6.1883 > 10.0.0.8.45208: Flags [P.], seq 2060253787:2060253791, ack 3416101469, win 85, options [nop,nop,TS val 3793616628 ecr 1098322109], length 4
00:01:47.229198 IP 10.0.0.6.1883 > 10.0.0.8.45208: Flags [P.], seq 2060253791:2060253795, ack 3416101473, win 85, options [nop,nop,TS val 3793616628 ecr 1098322110], length 4
00:01:48.366727 IP 10.0.0.6.1883 > 10.0.0.8.45208: Flags [P.], seq 2060253795:2060253799, ack 3416101868, win 85, options [nop,nop,TS val 3793617766 ecr 1098323245], length 4
00:01:48.367903 IP 10.0.0.6.1883 > 10.0.0.8.45208: Flags [P.], seq 2060253799:2060253803, ack 3416101872, win 85, options [nop,nop,TS val 3793617767 ecr 1098323249], length 4
00:01:49.272499 IP 10.0.0.6.1883 > 10.0.0.8.45208: Flags [P.], seq 2060253803:2060253805, ack 3416101874, win 85, options [nop,nop,TS val 3793618672 ecr 1098324153], length 2
00:01:49.366276 IP 10.0.0.6.1883 > 10.0.0.8.45208: Flags [P.], seq 2060253805:2060253809, ack 3416102269, win 85, options [nop,nop,TS val 3793618766 ecr 1098324247], length 4
00:01:49.367396 IP 10.0.0.6.1883 > 10.0.0.8.45208: Flags [P.], seq 2060253809:2060253813, ack 3416102273, win 85, options [nop,nop,TS val 3793618767 ecr 1098324248], length 4
00:01:50.684810 IP 10.0.0.6.1883 > 10.0.0.8.45208: Flags [F.], seq 2060253813, ack 3416102274, win 85, options [nop,nop,TS val 3793620084 ecr 1098325565], length 0