00:00:03.195091 IP 10.0.0.6.1883 > 10.0.0.8.45060: Flags [S.], seq 320671082, ack 429226395, win 43440, options [mss 1460,sackOK,TS val 3792855950 ecr 1097561382,nop,wscale 9], length 0
00:00:03.204362 IP 10.0.0.6.1883 > 10.0.0.8.45060: Flags [.], ack 429226415, win 85, options [nop,nop,TS val 3792855960 ecr 1097561441], length 0
00:00:03.204729 IP 10.0.0.6.1883 > 10.0.0.8.45060: Flags [P.], seq 320671083:320671087, ack 429226415, win 85, options [nop,nop,TS val 3792855960 ecr 1097561441], length 4
00:00:03.205870 IP 10.0.0.6.1883 > 10.0.0.8.45060: Flags [P.], seq 320671087:320671152, ack 429226479, win 85, options [nop,nop,TS val 3792855961 ecr 1097561443], length 65
00:00:03.206296 IP 10.0.0.6.1883 > 10.0.0.8.45060: Flags [P.], seq 320671152:320671157, ack 429226874, win 85, options [nop,nop,TS val 3792855962 ecr 1097561444], length 5
00:00:03.249171 IP 10.0.0.6.1883 > 10.0.0.8.45060: Flags [P.], seq 320671157:320671161, ack 429226874, win 85, options [nop,nop,TS val 3792856005 ecr 1097561487], length 4
00:00:03.250366 IP 10.0.0.6.1883 > 10.0.0.8.45060: Flags [P.], seq 320671161:320671165, ack 429226878, win 85, options [nop,nop,TS val 3792856006 ecr 1097561487], length 4
00:00:04.152887 IP 10.0.0.6.1883 > 10.0.0.8.45060: Flags [P.], seq 320671165:320671169, ack 429227273, win 85, options [nop,nop,TS val 3792856908 ecr 1097562388], length 4
00:00:04.155013 IP 10.0.0.6.1883 > 10.0.0.8.45060: Flags [P.], seq 320671169:320671173, ack 429227277, win 85, options [nop,nop,TS val 3792856910 ecr 1097562391], length 4
00:00:05.185710 IP 10.0.0.6.1883 > 10.0.0.8.45060: Flags [P.], seq 320671173:320671177, ack 429227672, win 85, options [nop,nop,TS val 3792857941 ecr 1097563422], length 4
00:00:05.186989 IP 10.0.0.6.1883 > 10.0.0.8.45060: Flags [P.], seq 320671177:320671181, ack 429227676, win 85, options [nop,nop,TS val 3792857942 ecr 1097563424], length 4
00:00:06.187545 IP 10.0.0.6.1883 > 10.0.0.8.45060: Flags [P.], seq 320671181:320671185, ack 429228071, win 85, options [nop,nop,TS val 3792858943 ecr 1097564424], length 4
00:00:06.344938 IP 10.0.0.6.1883 > 10.0.0.8.45060: Flags [P.], seq 320671185:320671189, ack 429228075, win 85, options [nop,nop,TS val 3792859100 ecr 1097564581], length 4
00:00:07.425344 IP 10.0.0.6.1883 > 10.0.0.8.45060: Flags [P.], seq 320671189:320671193, ack 429228470, win 85, options [nop,nop,TS val 3792860181 ecr 1097565660], length 4
00:00:07.430959 IP 10.0.0.6.1883 > 10.0.0.8.45060: Flags [P.], seq 320671193:320671197, ack 429228474, win 85, options [nop,nop,TS val 3792860186 ecr 1097565667], length 4
00:00:08.418038 IP 10.0.0.6.1883 > 10.0.0.8.45060: Flags [P.], seq 320671197:320671199, ack 429228476, win 85, options [nop,nop,TS val 3792861172 ecr 1097566652], length 2
00:00:08.426191 IP 10.0.0.6.1883 > 10.0.0.8.45060: Flags [P.], seq 320671199:320671203, ack 429228871, win 85, options [nop,nop,TS val 3792861182 ecr 1097566662], length 4
00:00:08.426774 IP 10.0.0.6.1883 > 10.0.0.8.45060: Flags [P.], seq 320671203:320671207, ack 429228875, win 85, options [nop,nop,TS val 3792861182 ecr 1097566664], length 4
00:00:09.497604 IP 10.0.0.6.1883 > 10.0.0.8.45060: Flags [P.], seq 320671207:320671211, ack 429229270, win 85, options [nop,nop,TS val 3792862253 ecr 1097567734], length 4
00:00:09.499124 IP 10.0.0.6.1883 > 10.0.0.8.45060: Flags [P.], seq 320671211:320671215, ack 429229274, win 85, options [nop,nop,TS val 3792862255 ecr 1097567736], length 4
00:00:10.681460 IP 10.0.0.6.1883 > 10.0.0.8.45060: Flags [P.], seq 320671215:320671219, ack 429229669, win 85, options [nop,nop,TS val 3792863437 ecr 1097568916], length 4
00:00:10.682111 IP 10.0.0.6.1883 > 10.0.0.8.45060: Flags [P.], seq 320671219:320671223, ack 429229673, win 85, options [nop,nop,TS val 3792863438 ecr 1097568919], length 4
00:00:11.687051 IP 10.0.0.6.1883 > 10.0.0.8.45060: Flags [P.], seq 320671223:320671227, ack 429230068, win 85, options [nop,nop,TS val 3792864441 ecr 1097569921], length 4
00:00:11.689572 IP 10.0.0.6.1883 > 10.0.0.8.45060: Flags [P.], seq 320671227:320671231, ack 429230072, win 85, options [nop,nop,TS val 3792864445 ecr 1097569926], length 4
00:00:12.687500 IP 10.0.0.6.1883 > 10.0.0.8.45060: Flags [P.], seq 320671231:320671235, ack 429230467, win 85, options [nop,nop,TS val 3792865442 ecr 1097570922], length 4
00:00:12.688779 IP 10.0.0.6.1883 > 10.0.0.8.45060: Flags [P.], seq 320671235:320671239, ack 429230471, win 85, options [nop,nop,TS val 3792865444 ecr 1097570926], length 4
00:00:13.417182 IP 10.0.0.6.1883 > 10.0.0.8.45060: Flags [P.], seq 320671239:320671241, ack 429230473, win 85, options [nop,nop,TS val 3792866173 ecr 1097571654], length 2
00:00:13.686535 IP 10.0.0.6.1883 > 10.0.0.8.45060: Flags [P.], seq 320671241:320671245, ack 429230868, win 85, options [nop,nop,TS val 3792866442 ecr 1097571923], length 4
00:00:13.688054 IP 10.0.0.6.1883 > 10.0.0.8.45060: Flags [P.], seq 320671245:320671249, ack 429230872, win 85, options [nop,nop,TS val 3792866444 ecr 1097571924], length 4
00:00:14.689880 IP 10.0.0.6.1883 > 10.0.0.8.45060: Flags [P.], seq 320671249:320671253, ack 429231267, win 85, options [nop,nop,TS val 3792867445 ecr 1097572925], length 4
00:00:14.692411 IP 10.0.0.6.1883 > 10.0.0.8.45060: Flags [P.], seq 320671253:320671257, ack 429231271, win 85, options [nop,nop,TS val 3792867448 ecr 1097572928], length 4
00:00:15.693421 IP 10.0.0.6.1883 > 10.0.0.8.45060: Flags [P.], seq 320671257:320671261, ack 429231666, win 85, options [nop,nop,TS val 3792868449 ecr 1097573927], length 4
00:00:15.695999 IP 10.0.0.6.1883 > 10.0.0.8.45060: Flags [P.], seq 320671261:320671265, ack 429231670, win 85, options [nop,nop,TS val 3792868451 ecr 1097573932], length 4
00:00:16.694178 IP 10.0.0.6.1883 > 10.0.0.8.45060: Flags [P.], seq 320671265:320671269, ack 429232065, win 85, options [nop,nop,TS val 3792869450 ecr 1097574931], length 4
00:00:16.696379 IP 10.0.0.6.1883 > 10.0.0.8.45060: Flags [P.], seq 320671269:320671273, ack 429232069, win 85, options [nop,nop,TS val 3792869452 ecr 1097574932], length 4
00:00:17.695190 IP 10.0.0.6.1883 > 10.0.0.8.45060: Flags [P.], seq 320671273:320671277, ack 429232464, win 85, options [nop,nop,TS val 3792870451 ecr 1097575931], length 4
00:00:17.696494 IP 10.0.0.6.1883 > 10.0.0.8.45060: Flags [P.], seq 320671277:320671281, ack 429232468, win 85, options [nop,nop,TS val 3792870452 ecr 1097575933], length 4
00:00:18.419729 IP 10.0.0.6.1883 > 10.0.0.8.45060: Flags [P.], seq 320671281:320671283, ack 429232470, win 85, options [nop,nop,TS val 3792871175 ecr 1097576656], length 2
00:00:18.696776 IP 10.0.0.6.1883 > 10.0.0.8.45060: Flags [P.], seq 320671283:320671287, ack 429232865, win 85, options [nop,nop,TS val 3792871452 ecr 1097576933], length 4
00:00:18.698927 IP 10.0.0.6.1883 > 10.0.0.8.45060: Flags [P.], seq 320671287:320671291, ack 429232869, win 85, options [nop,nop,TS val 3792871454 ecr 1097576935], length 4
00:00:19.698355 IP 10.0.0.6.1883 > 10.0.0.8.45060: Flags [P.], seq 320671291:320671295, ack 429233264, win 85, options [nop,nop,TS val 3792872454 ecr 1097577935], length 4
00:00:19.700721 IP 10.0.0.6.1883 > 10.0.0.8.45060: Flags [P.], seq 320671295:320671299, ack 429233268, win 85, options [nop,nop,TS val 3792872456 ecr 1097577936], length 4
00:00:20.699255 IP 10.0.0.6.1883 > 10.0.0.8.45060: Flags [P.], seq 320671299:320671303, ack 429233663, win 85, options [nop,nop,TS val 3792873455 ecr 1097578935], length 4
00:00:20.701510 IP 10.0.0.6.1883 > 10.0.0.8.45060: Flags [P.], seq 320671303:320671307, ack 429233667, win 85, options [nop,nop,TS val 3792873457 ecr 1097578938], length 4
00:00:21.701145 IP 10.0.0.6.1883 > 10.0.0.8.45060: Flags [P.], seq 320671307:320671311, ack 429234062, win 85, options [nop,nop,TS val 3792874456 ecr 1097579937], length 4
00:00:21.703530 IP 10.0.0.6.1883 > 10.0.0.8.45060: Flags [P.], seq 320671311:320671315, ack 429234066, win 85, options [nop,nop,TS val 3792874459 ecr 1097579940], length 4
00:00:22.702575 IP 10.0.0.6.1883 > 10.0.0.8.45060: Flags [P.], seq 320671315:320671319, ack 429234461, win 85, options [nop,nop,TS val 3792875458 ecr 1097580938], length 4
00:00:22.704354 IP 10.0.0.6.1883 > 10.0.0.8.45060: Flags [P.], seq 320671319:320671323, ack 429234465, win 85, options [nop,nop,TS val 3792875459 ecr 1097580941], length 4
00:00:23.420785 IP 10.0.0.6.1883 > 10.0.0.8.45060: Flags [P.], seq 320671323:320671325, ack 429234467, win 85, options [nop,nop,TS val 3792876176 ecr 1097581658], length 2
00:00:23.702535 IP 10.0.0.6.1883 > 10.0.0.8.45060: Flags [P.], seq 320671325:320671329, ack 429234862, win 85, options [nop,nop,TS val 3792876458 ecr 1097581939], length 4
00:00:23.704200 IP 10.0.0.6.1883 > 10.0.0.8.45060: Flags [P.], seq 320671329:320671333, ack 429234866, win 85, options [nop,nop,TS val 3792876460 ecr 1097581941], length 4
00:00:24.704305 IP 10.0.0.6.1883 > 10.0.0.8.45060: Flags [P.], seq 320671333:320671337, ack 429235261, win 85, options [nop,nop,TS val 3792877460 ecr 1097582940], length 4
00:00:24.706753 IP 10.0.0.6.1883 > 10.0.0.8.45060: Flags [P.], seq 320671337:320671341, ack 429235265, win 85, options [nop,nop,TS val 3792877462 ecr 1097582942], length 4
00:00:25.706946 IP 10.0.0.6.1883 > 10.0.0.8.45060: Flags [P.], seq 320671341:320671345, ack 429235660, win 85, options [nop,nop,TS val 3792878462 ecr 1097583942], length 4
00:00:25.709321 IP 10.0.0.6.1883 > 10.0.0.8.45060: Flags [P.], seq 320671345:320671349, ack 429235664, win 85, options [nop,nop,TS val 3792878465 ecr 1097583945], length 4
00:00:26.708615 IP 10.0.0.6.1883 > 10.0.0.8.45060: Flags [P.], seq 320671349:320671353, ack 429236059, win 85, options [nop,nop,TS val 3792879464 ecr 1097584944], length 4
00:00:26.710826 IP 10.0.0.6.1883 > 10.0.0.8.45060: Flags [P.], seq 320671353:320671357, ack 429236063, win 85, options [nop,nop,TS val 3792879466 ecr 1097584947], length 4
00:00:27.723827 IP 10.0.0.6.1883 > 10.0.0.8.45060: Flags [P.], seq 320671357:320671361, ack 429236458, win 85, options [nop,nop,TS val 3792880479 ecr 1097585960], length 4
00:00:27.724927 IP 10.0.0.6.1883 > 10.0.0.8.45060: Flags [P.], seq 320671361:320671365, ack 429236462, win 85, options [nop,nop,TS val 3792880480 ecr 1097585962], length 4
00:00:28.729132 IP 10.0.0.6.1883 > 10.0.0.8.45060: Flags [P.], seq 320671365:320671369, ack 429236857, win 85, options [nop,nop,TS val 3792881485 ecr 1097586962], length 4
00:00:28.733358 IP 10.0.0.6.1883 > 10.0.0.8.45060: Flags [P.], seq 320671369:320671371, ack 429236859, win 85, options [nop,nop,TS val 3792881489 ecr 1097586970], length 2
00:00:28.733965 IP 10.0.0.6.1883 > 10.0.0.8.45060: Flags [P.], seq 320671371:320671375, ack 429236863, win 85, options [nop,nop,TS val 3792881489 ecr 1097586971], length 4
00:00:29.730134 IP 10.0.0.6.1883 > 10.0.0.8.45060: Flags [P.], seq 320671375:320671379, ack 429237258, win 85, options [nop,nop,TS val 3792882485 ecr 1097587965], length 4
00:00:29.732240 IP 10.0.0.6.1883 > 10.0.0.8.45060: Flags [P.], seq 320671379:320671383, ack 429237262, win 85, options [nop,nop,TS val 3792882488 ecr 1097587968], length 4
00:00:30.731703 IP 10.0.0.6.1883 > 10.0.0.8.45060: Flags [P.], seq 320671383:320671387, ack 429237657, win 85, options [nop,nop,TS val 3792883487 ecr 1097588967], length 4
00:00:30.732878 IP 10.0.0.6.1883 > 10.0.0.8.45060: Flags [P.], seq 320671387:320671391, ack 429237661, win 85, options [nop,nop,TS val 3792883488 ecr 1097588970], length 4
00:00:31.735847 IP 10.0.0.6.1883 > 10.0.0.8.45060: Flags [P.], seq 320671391:320671395, ack 429238056, win 85, options [nop,nop,TS val 3792884490 ecr 1097589969], length 4
00:00:31.740092 IP 10.0.0.6.1883 > 10.0.0.8.45060: Flags [P.], seq 320671395:320671399, ack 429238060, win 85, options [nop,nop,TS val 3792884495 ecr 1097589975], length 4
00:00:32.738352 IP 10.0.0.6.1883 > 10.0.0.8.45060: Flags [P.], seq 320671399:320671403, ack 429238455, win 85, options [nop,nop,TS val 3792885494 ecr 1097590974], length 4
00:00:32.740153 IP 10.0.0.6.1883 > 10.0.0.8.45060: Flags [P.], seq 320671403:320671407, ack 429238459, win 85, options [nop,nop,TS val 3792885496 ecr 1097590976], length 4
00:00:33.738235 IP 10.0.0.6.1883 > 10.0.0.8.45060: Flags [P.], seq 320671407:320671409, ack 429238461, win 85, options [nop,nop,TS val 3792886494 ecr 1097591974], length 2
00:00:33.739661 IP 10.0.0.6.1883 > 10.0.0.8.45060: Flags [P.], seq 320671409:320671413, ack 429238856, win 85, options [nop,nop,TS val 3792886495 ecr 1097591976], length 4
00:00:33.741267 IP 10.0.0.6.1883 > 10.0.0.8.45060: Flags [P.], seq 320671413:320671417, ack 429238860, win 85, options [nop,nop,TS val 3792886497 ecr 1097591978], length 4
00:00:34.741864 IP 10.0.0.6.1883 > 10.0.0.8.45060: Flags [P.], seq 320671417:320671421, ack 429239255, win 85, options [nop,nop,TS val 3792887497 ecr 1097592976], length 4
00:00:34.744326 IP 10.0.0.6.1883 > 10.0.0.8.45060: Flags [P.], seq 320671421:320671425, ack 429239259, win 85, options [nop,nop,TS val 3792887500 ecr 1097592980], length 4
00:00:35.748892 IP 10.0.0.6.1883 > 10.0.0.8.45060: Flags [P.], seq 320671425:320671429, ack 429239654, win 85, options [nop,nop,TS val 3792888501 ecr 1097593980], length 4
00:00:35.804988 IP 10.0.0.6.1883 > 10.0.0.8.45060: Flags [P.], seq 320671429:320671433, ack 429239658, win 85, options [nop,nop,TS val 3792888560 ecr 1097594041], length 4
00:00:36.754027 IP 10.0.0.6.1883 > 10.0.0.8.45060: Flags [P.], seq 320671433:320671437, ack 429240053, win 85, options [nop,nop,TS val 3792889509 ecr 1097594988], length 4
00:00:36.758353 IP 10.0.0.6.1883 > 10.0.0.8.45060: Flags [P.], seq 320671437:320671441, ack 429240057, win 85, options [nop,nop,TS val 3792889513 ecr 1097594993], length 4
00:00:37.756770 IP 10.0.0.6.1883 > 10.0.0.8.45060: Flags [P.], seq 320671441:320671445, ack 429240452, win 85, options [nop,nop,TS val 3792890511 ecr 1097595989], length 4
00:00:37.789237 IP 10.0.0.6.1883 > 10.0.0.8.45060: Flags [P.], seq 320671445:320671449, ack 429240456, win 85, options [nop,nop,TS val 3792890545 ecr 1097596026], length 4
00:00:38.786504 IP 10.0.0.6.1883 > 10.0.0.8.45060: Flags [P.], seq 320671449:320671451, ack 429240458, win 85, options [nop,nop,TS val 3792891542 ecr 1097597022], length 2
00:00:38.788203 IP 10.0.0.6.1883 > 10.0.0.8.45060: Flags [P.], seq 320671451:320671455, ack 429240853, win 85, options [nop,nop,TS val 3792891543 ecr 1097597025], length 4
00:00:38.791057 IP 10.0.0.6.1883 > 10.0.0.8.45060: Flags [P.], seq 320671455:320671459, ack 429240857, win 85, options [nop,nop,TS val 3792891546 ecr 1097597027], length 4
00:00:39.801111 IP 10.0.0.6.1883 > 10.0.0.8.45060: Flags [P.], seq 320671459:320671463, ack 429241252, win 85, options [nop,nop,TS val 3792892555 ecr 1097598035], length 4
00:00:39.869148 IP 10.0.0.6.1883 > 10.0.0.8.45060: Flags [P.], seq 320671463:320671467, ack 429241256, win 85, options [nop,nop,TS val 3792892625 ecr 1097598105], length 4
00:00:40.803357 IP 10.0.0.6.1883 > 10.0.0.8.45060: Flags [P.], seq 320671467:320671471, ack 429241651, win 85, options [nop,nop,TS val 3792893559 ecr 1097599039], length 4
00:00:40.805006 IP 10.0.0.6.1883 > 10.0.0.8.45060: Flags [P.], seq 320671471:320671475, ack 429241655, win 85, options [nop,nop,TS val 3792893560 ecr 1097599042], length 4
00:00:41.805025 IP 10.0.0.6.1883 > 10.0.0.8.45060: Flags [P.], seq 320671475:320671479, ack 429242050, win 85, options [nop,nop,TS val 3792894560 ecr 1097600041], length 4
00:00:41.806421 IP 10.0.0.6.1883 > 10.0.0.8.45060: Flags [P.], seq 320671479:320671483, ack 429242054, win 85, options [nop,nop,TS val 3792894562 ecr 1097600043], length 4
00:00:42.818397 IP 10.0.0.6.1883 > 10.0.0.8.45060: Flags [P.], seq 320671483:320671487, ack 429242449, win 85, options [nop,nop,TS val 3792895574 ecr 1097601055], length 4
00:00:42.820201 IP 10.0.0.6.1883 > 10.0.0.8.45060: Flags [P.], seq 320671487:320671491, ack 429242453, win 85, options [nop,nop,TS val 3792895575 ecr 1097601056], length 4
00:00:43.785708 IP 10.0.0.6.1883 > 10.0.0.8.45060: Flags [P.], seq 320671491:320671493, ack 429242455, win 85, options [nop,nop,TS val 3792896541 ecr 1097602022], length 2
00:00:43.820414 IP 10.0.0.6.1883 > 10.0.0.8.45060: Flags [P.], seq 320671493:320671497, ack 429242850, win 85, options [nop,nop,TS val 3792896576 ecr 1097602057], length 4
00:00:43.822198 IP 10.0.0.6.1883 > 10.0.0.8.45060: Flags [P.], seq 320671497:320671501, ack 429242854, win 85, options [nop,nop,TS val 3792896578 ecr 1097602058], length 4
00:00:44.822800 IP 10.0.0.6.1883 > 10.0.0.8.45060: Flags [P.], seq 320671501:320671505, ack 429243249, win 85, options [nop,nop,TS val 3792897578 ecr 1097603059], length 4
00:00:44.824454 IP 10.0.0.6.1883 > 10.0.0.8.45060: Flags [P.], seq 320671505:320671509, ack 429243253, win 85, options [nop,nop,TS val 3792897580 ecr 1097603061], length 4
00:00:45.824980 IP 10.0.0.6.1883 > 10.0.0.8.45060: Flags [P.], seq 320671509:320671513, ack 429243648, win 85, options [nop,nop,TS val 3792898580 ecr 1097604061], length 4
00:00:45.826789 IP 10.0.0.6.1883 > 10.0.0.8.45060: Flags [P.], seq 320671513:320671517, ack 429243652, win 85, options [nop,nop,TS val 3792898582 ecr 1097604063], length 4
00:00:46.826630 IP 10.0.0.6.1883 > 10.0.0.8.45060: Flags [P.], seq 320671517:320671521, ack 429244047, win 85, options [nop,nop,TS val 3792899582 ecr 1097605063], length 4
00:00:46.828465 IP 10.0.0.6.1883 > 10.0.0.8.45060: Flags [P.], seq 320671521:320671525, ack 429244051, win 85, options [nop,nop,TS val 3792899584 ecr 1097605065], length 4
00:00:47.827957 IP 10.0.0.6.1883 > 10.0.0.8.45060: Flags [P.], seq 320671525:320671529, ack 429244446, win 85, options [nop,nop,TS val 3792900583 ecr 1097606064], length 4
00:00:47.830033 IP 10.0.0.6.1883 > 10.0.0.8.45060: Flags [P.], seq 320671529:320671533, ack 429244450, win 85, options [nop,nop,TS val 3792900585 ecr 1097606067], length 4
00:00:48.787174 IP 10.0.0.6.1883 > 10.0.0.8.45060: Flags [P.], seq 320671533:320671535, ack 429244452, win 85, options [nop,nop,TS val 3792901543 ecr 1097607024], length 2
00:00:48.828841 IP 10.0.0.6.1883 > 10.0.0.8.45060: Flags [P.], seq 320671535:320671539, ack 429244847, win 85, options [nop,nop,TS val 3792901584 ecr 1097607065], length 4
00:00:48.830345 IP 10.0.0.6.1883 > 10.0.0.8.45060: Flags [P.], seq 320671539:320671543, ack 429244851, win 85, options [nop,nop,TS val 3792901586 ecr 1097607067], length 4
00:00:49.830685 IP 10.0.0.6.1883 > 10.0.0.8.45060: Flags [P.], seq 320671543:320671547, ack 429245246, win 85, options [nop,nop,TS val 3792902586 ecr 1097608067], length 4
00:00:49.832690 IP 10.0.0.6.1883 > 10.0.0.8.45060: Flags [P.], seq 320671547:320671551, ack 429245250, win 85, options [nop,nop,TS val 3792902588 ecr 1097608069], length 4
00:00:50.832064 IP 10.0.0.6.1883 > 10.0.0.8.45060: Flags [P.], seq 320671551:320671555, ack 429245645, win 85, options [nop,nop,TS val 3792903587 ecr 1097609069], length 4
00:00:50.833789 IP 10.0.0.6.1883 > 10.0.0.8.45060: Flags [P.], seq 320671555:320671559, ack 429245649, win 85, options [nop,nop,TS val 3792903589 ecr 1097609070], length 4
00:00:51.834936 IP 10.0.0.6.1883 > 10.0.0.8.45060: Flags [P.], seq 320671559:320671563, ack 429246044, win 85, options [nop,nop,TS val 3792904590 ecr 1097610071], length 4
00:00:51.836493 IP 10.0.0.6.1883 > 10.0.0.8.45060: Flags [P.], seq 320671563:320671567, ack 429246048, win 85, options [nop,nop,TS val 3792904592 ecr 1097610073], length 4
00:00:52.836990 IP 10.0.0.6.1883 > 10.0.0.8.45060: Flags [P.], seq 320671567:320671571, ack 429246443, win 85, options [nop,nop,TS val 3792905592 ecr 1097611073], length 4
00:00:52.839084 IP 10.0.0.6.1883 > 10.0.0.8.45060: Flags [P.], seq 320671571:320671575, ack 429246447, win 85, options [nop,nop,TS val 3792905594 ecr 1097611075], length 4
00:00:53.787966 IP 10.0.0.6.1883 > 10.0.0.8.45060: Flags [P.], seq 320671575:320671577, ack 429246449, win 85, options [nop,nop,TS val 3792906543 ecr 1097612025], length 2
00:00:53.838031 IP 10.0.0.6.1883 > 10.0.0.8.45060: Flags [P.], seq 320671577:320671581, ack 429246844, win 85, options [nop,nop,TS val 3792906593 ecr 1097612075], length 4
00:00:53.839577 IP 10.0.0.6.1883 > 10.0.0.8.45060: Flags [P.], seq 320671581:320671585, ack 429246848, win 85, options [nop,nop,TS val 3792906595 ecr 1097612076], length 4
00:00:54.846279 IP 10.0.0.6.1883 > 10.0.0.8.45060: Flags [P.], seq 320671585:320671589, ack 429247243, win 85, options [nop,nop,TS val 3792907602 ecr 1097613083], length 4
00:00:54.848380 IP 10.0.0.6.1883 > 10.0.0.8.45060: Flags [P.], seq 320671589:320671593, ack 429247247, win 85, options [nop,nop,TS val 3792907604 ecr 1097613085], length 4
00:00:55.849636 IP 10.0.0.6.1883 > 10.0.0.8.45060: Flags [P.], seq 320671593:320671597, ack 429247642, win 85, options [nop,nop,TS val 3792908605 ecr 1097614086], length 4
00:00:55.851810 IP 10.0.0.6.1883 > 10.0.0.8.45060: Flags [P.], seq 320671597:320671601, ack 429247646, win 85, options [nop,nop,TS val 3792908607 ecr 1097614087], length 4
00:00:56.851449 IP 10.0.0.6.1883 > 10.0.0.8.45060: Flags [P.], seq 320671601:320671605, ack 429248041, win 85, options [nop,nop,TS val 3792909607 ecr 1097615088], length 4
00:00:56.853244 IP 10.0.0.6.1883 > 10.0.0.8.45060: Flags [P.], seq 320671605:320671609, ack 429248045, win 85, options [nop,nop,TS val 3792909609 ecr 1097615090], length 4
00:00:57.854909 IP 10.0.0.6.1883 > 10.0.0.8.45060: Flags [P.], seq 320671609:320671613, ack 429248440, win 85, options [nop,nop,TS val 3792910610 ecr 1097616090], length 4
00:00:57.856726 IP 10.0.0.6.1883 > 10.0.0.8.45060: Flags [P.], seq 320671613:320671617, ack 429248444, win 85, options [nop,nop,TS val 3792910612 ecr 1097616093], length 4
00:00:58.789425 IP 10.0.0.6.1883 > 10.0.0.8.45060: Flags [P.], seq 320671617:320671619, ack 429248446, win 85, options [nop,nop,TS val 3792911545 ecr 1097617026], length 2
00:00:58.855761 IP 10.0.0.6.1883 > 10.0.0.8.45060: Flags [P.], seq 320671619:320671623, ack 429248841, win 85, options [nop,nop,TS val 3792911611 ecr 1097617091], length 4
00:00:58.939964 IP 10.0.0.6.1883 > 10.0.0.8.45060: Flags [P.], seq 320671623:320671627, ack 429248845, win 85, options [nop,nop,TS val 3792911695 ecr 1097617175], length 4
00:00:59.856927 IP 10.0.0.6.1883 > 10.0.0.8.45060: Flags [P.], seq 320671627:320671631, ack 429249240, win 85, options [nop,nop,TS val 3792912612 ecr 1097618093], length 4
00:00:59.859934 IP 10.0.0.6.1883 > 10.0.0.8.45060: Flags [P.], seq 320671631:320671635, ack 429249244, win 85, options [nop,nop,TS val 3792912615 ecr 1097618096], length 4
00:01:00.861094 IP 10.0.0.6.1883 > 10.0.0.8.45060: Flags [P.], seq 320671635:320671639, ack 429249639, win 85, options [nop,nop,TS val 3792913615 ecr 1097619095], length 4
00:01:00.904243 IP 10.0.0.6.1883 > 10.0.0.8.45060: Flags [P.], seq 320671639:320671643, ack 429249643, win 85, options [nop,nop,TS val 3792913659 ecr 1097619139], length 4
00:01:01.862092 IP 10.0.0.6.1883 > 10.0.0.8.45060: Flags [P.], seq 320671643:320671647, ack 429250038, win 85, options [nop,nop,TS val 3792914617 ecr 1097620098], length 4
00:01:01.864512 IP 10.0.0.6.1883 > 10.0.0.8.45060: Flags [P.], seq 320671647:320671651, ack 429250042, win 85, options [nop,nop,TS val 3792914620 ecr 1097620100], length 4
00:01:02.952130 IP 10.0.0.6.1883 > 10.0.0.8.45060: Flags [P.], seq 320671651:320671655, ack 429250437, win 85, options [nop,nop,TS val 3792915707 ecr 1097621187], length 4
00:01:03.014615 IP 10.0.0.6.1883 > 10.0.0.8.45060: Flags [P.], seq 320671655:320671659, ack 429250441, win 85, options [nop,nop,TS val 3792915769 ecr 1097621251], length 4
00:01:03.835393 IP 10.0.0.6.1883 > 10.0.0.8.45060: Flags [P.], seq 320671659:320671661, ack 429250443, win 85, options [nop,nop,TS val 3792916591 ecr 1097622071], length 2
00:01:03.961192 IP 10.0.0.6.1883 > 10.0.0.8.45060: Flags [P.], seq 320671661:320671665, ack 429250838, win 85, options [nop,nop,TS val 3792916716 ecr 1097622197], length 4
00:01:03.962433 IP 10.0.0.6.1883 > 10.0.0.8.45060: Flags [P.], seq 320671665:320671669, ack 429250842, win 85, options [nop,nop,TS val 3792916718 ecr 1097622199], length 4
00:01:04.965682 IP 10.0.0.6.1883 > 10.0.0.8.45060: Flags [P.], seq 320671669:320671673, ack 429251237, win 85, options [nop,nop,TS val 3792917721 ecr 1097623201], length 4
00:01:04.967873 IP 10.0.0.6.1883 > 10.0.0.8.45060: Flags [P.], seq 320671673:320671677, ack 429251241, win 85, options [nop,nop,TS val 3792917723 ecr 1097623204], length 4
00:01:05.966726 IP 10.0.0.6.1883 > 10.0.0.8.45060: Flags [P.], seq 320671677:320671681, ack 429251636, win 85, options [nop,nop,TS val 3792918722 ecr 1097624202], length 4
00:01:05.969378 IP 10.0.0.6.1883 > 10.0.0.8.45060: Flags [P.], seq 320671681:320671685, ack 429251640, win 85, options [nop,nop,TS val 3792918725 ecr 1097624205], length 4
00:01:06.969026 IP 10.0.0.6.1883 > 10.0.0.8.45060: Flags [P.], seq 320671685:320671689, ack 429252035, win 85, options [nop,nop,TS val 3792919724 ecr 1097625203], length 4
00:01:06.973075 IP 10.0.0.6.1883 > 10.0.0.8.45060: Flags [P.], seq 320671689:320671693, ack 429252039, win 85, options [nop,nop,TS val 3792919729 ecr 1097625209], length 4
00:01:07.972524 IP 10.0.0.6.1883 > 10.0.0.8.45060: Flags [P.], seq 320671693:320671697, ack 429252434, win 85, options [nop,nop,TS val 3792920728 ecr 1097626208], length 4
00:01:07.974870 IP 10.0.0.6.1883 > 10.0.0.8.45060: Flags [P.], seq 320671697:320671701, ack 429252438, win 85, options [nop,nop,TS val 3792920730 ecr 1097626211], length 4
00:01:08.936396 IP 10.0.0.6.1883 > 10.0.0.8.45060: Flags [P.], seq 320671701:320671703, ack 429252440, win 85, options [nop,nop,TS val 3792921692 ecr 1097627172], length 2
00:01:09.008969 IP 10.0.0.6.1883 > 10.0.0.8.45060: Flags [P.], seq 320671703:320671707, ack 429252835, win 85, options [nop,nop,TS val 3792921764 ecr 1097627246], length 4
00:01:09.011477 IP 10.0.0.6.1883 > 10.0.0.8.45060: Flags [P.], seq 320671707:320671711, ack 429252839, win 85, options [nop,nop,TS val 3792921767 ecr 1097627248], length 4
00:01:09.294750 IP 10.0.0.6.1883 > 10.0.0.8.45060: Flags [P.], seq 320671707:320671711, ack 429252839, win 85, options [nop,nop,TS val 3792922050 ecr 1097627248], length 4
00:01:10.017931 IP 10.0.0.6.1883 > 10.0.0.8.45060: Flags [P.], seq 320671711:320671715, ack 429253234, win 85, options [nop,nop,TS val 3792922773 ecr 1097628253], length 4
00:01:10.019620 IP 10.0.0.6.1883 > 10.0.0.8.45060: Flags [P.], seq 320671715:320671719, ack 429253238, win 85, options [nop,nop,TS val 3792922775 ecr 1097628256], length 4
00:01:11.023647 IP 10.0.0.6.1883 > 10.0.0.8.45060: Flags [P.], seq 320671719:320671723, ack 429253633, win 85, options [nop,nop,TS val 3792923779 ecr 1097629259], length 4
00:01:11.024840 IP 10.0.0.6.1883 > 10.0.0.8.45060: Flags [P.], seq 320671723:320671727, ack 429253637, win 85, options [nop,nop,TS val 3792923780 ecr 1097629262], length 4
00:01:12.027434 IP 10.0.0.6.1883 > 10.0.0.8.45060: Flags [P.], seq 320671727:320671731, ack 429254032, win 85, options [nop,nop,TS val 3792924783 ecr 1097630263], length 4
00:01:12.029814 IP 10.0.0.6.1883 > 10.0.0.8.45060: Flags [P.], seq 320671731:320671735, ack 429254036, win 85, options [nop,nop,TS val 3792924785 ecr 1097630266], length 4
00:01:13.029565 IP 10.0.0.6.1883 > 10.0.0.8.45060: Flags [P.], seq 320671735:320671739, ack 429254431, win 85, options [nop,nop,TS val 3792925785 ecr 1097631266], length 4
00:01:13.031686 IP 10.0.0.6.1883 > 10.0.0.8.45060: Flags [P.], seq 320671739:320671743, ack 429254435, win 85, options [nop,nop,TS val 3792925787 ecr 1097631268], length 4
00:01:13.937407 IP 10.0.0.6.1883 > 10.0.0.8.45060: Flags [P.], seq 320671743:320671745, ack 429254437, win 85, options [nop,nop,TS val 3792926693 ecr 1097632174], length 2
00:01:14.030514 IP 10.0.0.6.1883 > 10.0.0.8.45060: Flags [P.], seq 320671745:320671749, ack 429254832, win 85, options [nop,nop,TS val 3792926786 ecr 1097632267], length 4
00:01:14.032531 IP 10.0.0.6.1883 > 10.0.0.8.45060: Flags [P.], seq 320671749:320671753, ack 429254836, win 85, options [nop,nop,TS val 3792926788 ecr 1097632269], length 4
00:01:15.031587 IP 10.0.0.6.1883 > 10.0.0.8.45060: Flags [P.], seq 320671753:320671757, ack 429255231, win 85, options [nop,nop,TS val 3792927787 ecr 1097633268], length 4
00:01:15.033539 IP 10.0.0.6.1883 > 10.0.0.8.45060: Flags [P.], seq 320671757:320671761, ack 429255235, win 85, options [nop,nop,TS val 3792927789 ecr 1097633270], length 4
00:01:16.032548 IP 10.0.0.6.1883 > 10.0.0.8.45060: Flags [P.], seq 320671761:320671765, ack 429255630, win 85, options [nop,nop,TS val 3792928788 ecr 1097634269], length 4
00:01:16.034056 IP 10.0.0.6.1883 > 10.0.0.8.45060: Flags [P.], seq 320671765:320671769, ack 429255634, win 85, options [nop,nop,TS val 3792928789 ecr 1097634271], length 4
00:01:17.033304 IP 10.0.0.6.1883 > 10.0.0.8.45060: Flags [P.], seq 320671769:320671773, ack 429256029, win 85, options [nop,nop,TS val 3792929789 ecr 1097635269], length 4
00:01:17.111657 IP 10.0.0.6.1883 > 10.0.0.8.45060: Flags [P.], seq 320671773:320671777, ack 429256033, win 85, options [nop,nop,TS val 3792929867 ecr 1097635348], length 4
00:01:18.037970 IP 10.0.0.6.1883 > 10.0.0.8.45060: Flags [P.], seq 320671777:320671781, ack 429256428, win 85, options [nop,nop,TS val 3792930793 ecr 1097636274], length 4
00:01:18.040002 IP 10.0.0.6.1883 > 10.0.0.8.45060: Flags [P.], seq 320671781:320671785, ack 429256432, win 85, options [nop,nop,TS val 3792930795 ecr 1097636276], length 4
00:01:19.017956 IP 10.0.0.6.1883 > 10.0.0.8.45060: Flags [P.], seq 320671785:320671787, ack 429256434, win 85, options [nop,nop,TS val 3792931773 ecr 1097637254], length 2
00:01:19.210269 IP 10.0.0.6.1883 > 10.0.0.8.45060: Flags [P.], seq 320671787:320671791, ack 429256829, win 85, options [nop,nop,TS val 3792931965 ecr 1097637446], length 4
00:01:19.212255 IP 10.0.0.6.1883 > 10.0.0.8.45060: Flags [P.], seq 320671791:320671795, ack 429256833, win 85, options [nop,nop,TS val 3792931968 ecr 1097637448], length 4
00:01:20.416821 IP 10.0.0.6.1883 > 10.0.0.8.45060: Flags [P.], seq 320671795:320671799, ack 429257228, win 85, options [nop,nop,TS val 3792933172 ecr 1097638652], length 4
00:01:20.625449 IP 10.0.0.6.1883 > 10.0.0.8.45060: Flags [P.], seq 320671799:320671803, ack 429257232, win 85, options [nop,nop,TS val 3792933381 ecr 1097638860], length 4
00:01:21.419242 IP 10.0.0.6.1883 > 10.0.0.8.45060: Flags [P.], seq 320671803:320671807, ack 429257627, win 85, options [nop,nop,TS val 3792934174 ecr 1097639655], length 4
00:01:21.422044 IP 10.0.0.6.1883 > 10.0.0.8.45060: Flags [P.], seq 320671807:320671811, ack 429257631, win 85, options [nop,nop,TS val 3792934177 ecr 1097639658], length 4
00:01:22.432253 IP 10.0.0.6.1883 > 10.0.0.8.45060: Flags [P.], seq 320671811:320671815, ack 429258026, win 85, options [nop,nop,TS val 3792935187 ecr 1097640668], length 4
00:01:22.434315 IP 10.0.0.6.1883 > 10.0.0.8.45060: Flags [P.], seq 320671815:320671819, ack 429258030, win 85, options [nop,nop,TS val 3792935189 ecr 1097640670], length 4
00:01:23.434125 IP 10.0.0.6.1883 > 10.0.0.8.45060: Flags [P.], seq 320671819:320671823, ack 429258425, win 85, options [nop,nop,TS val 3792936190 ecr 1097641671], length 4
00:01:23.582800 IP 10.0.0.6.1883 > 10.0.0.8.45060: Flags [P.], seq 320671823:320671827, ack 429258429, win 85, options [nop,nop,TS val 3792936338 ecr 1097641820], length 4
00:01:24.160566 IP 10.0.0.6.1883 > 10.0.0.8.45060: Flags [P.], seq 320671827:320671829, ack 429258431, win 85, options [nop,nop,TS val 3792936916 ecr 1097642397], length 2
00:01:24.523455 IP 10.0.0.6.1883 > 10.0.0.8.45060: Flags [P.], seq 320671829:320671833, ack 429258826, win 85, options [nop,nop,TS val 3792937279 ecr 1097642759], length 4
00:01:24.525678 IP 10.0.0.6.1883 > 10.0.0.8.45060: Flags [P.], seq 320671833:320671837, ack 429258830, win 85, options [nop,nop,TS val 3792937281 ecr 1097642762], length 4
00:01:25.601171 IP 10.0.0.6.1883 > 10.0.0.8.45060: Flags [P.], seq 320671837:320671841, ack 429259225, win 85, options [nop,nop,TS val 3792938357 ecr 1097643837], length 4
00:01:25.603428 IP 10.0.0.6.1883 > 10.0.0.8.45060: Flags [P.], seq 320671841:320671845, ack 429259229, win 85, options [nop,nop,TS val 3792938359 ecr 1097643840], length 4
00:01:26.836822 IP 10.0.0.6.1883 > 10.0.0.8.45060: Flags [P.], seq 320671845:320671849, ack 429259624, win 85, options [nop,nop,TS val 3792939592 ecr 1097645072], length 4
00:01:26.839160 IP 10.0.0.6.1883 > 10.0.0.8.45060: Flags [P.], seq 320671849:320671853, ack 429259628, win 85, options [nop,nop,TS val 3792939595 ecr 1097645075], length 4
00:01:27.873582 IP 10.0.0.6.1883 > 10.0.0.8.45060: Flags [P.], seq 320671853:320671857, ack 429260023, win 85, options [nop,nop,TS val 3792940629 ecr 1097646108], length 4
00:01:27.874993 IP 10.0.0.6.1883 > 10.0.0.8.45060: Flags [P.], seq 320671857:320671861, ack 429260027, win 85, options [nop,nop,TS val 3792940630 ecr 1097646112], length 4
00:01:28.878769 IP 10.0.0.6.1883 > 10.0.0.8.45060: Flags [P.], seq 320671861:320671865, ack 429260422, win 85, options [nop,nop,TS val 3792941634 ecr 1097647115], length 4
00:01:28.880522 IP 10.0.0.6.1883 > 10.0.0.8.45060: Flags [P.], seq 320671865:320671869, ack 429260426, win 85, options [nop,nop,TS val 3792941636 ecr 1097647117], length 4
00:01:29.161660 IP 10.0.0.6.1883 > 10.0.0.8.45060: Flags [P.], seq 320671869:320671871, ack 429260428, win 85, options [nop,nop,TS val 3792941917 ecr 1097647398], length 2
00:01:29.880666 IP 10.0.0.6.1883 > 10.0.0.8.45060: Flags [P.], seq 320671871:320671875, ack 429260823, win 85, options [nop,nop,TS val 3792942636 ecr 1097648116], length 4
00:01:29.882130 IP 10.0.0.6.1883 > 10.0.0.8.45060: Flags [P.], seq 320671875:320671879, ack 429260827, win 85, options [nop,nop,TS val 3792942638 ecr 1097648119], length 4
00:01:30.881792 IP 10.0.0.6.1883 > 10.0.0.8.45060: Flags [P.], seq 320671879:320671883, ack 429261222, win 85, options [nop,nop,TS val 3792943637 ecr 1097649118], length 4
00:01:30.883283 IP 10.0.0.6.1883 > 10.0.0.8.45060: Flags [P.], seq 320671883:320671887, ack 429261226, win 85, options [nop,nop,TS val 3792943639 ecr 1097649120], length 4
00:01:31.884969 IP 10.0.0.6.1883 > 10.0.0.8.45060: Flags [P.], seq 320671887:320671891, ack 429261621, win 85, options [nop,nop,TS val 3792944640 ecr 1097650120], length 4
00:01:31.885680 IP 10.0.0.6.1883 > 10.0.0.8.45060: Flags [P.], seq 320671891:320671895, ack 429261625, win 85, options [nop,nop,TS val 3792944641 ecr 1097650123], length 4
00:01:32.884644 IP 10.0.0.6.1883 > 10.0.0.8.45060: Flags [P.], seq 320671895:320671899, ack 429262020, win 85, options [nop,nop,TS val 3792945640 ecr 1097651121], length 4
00:01:32.886418 IP 10.0.0.6.1883 > 10.0.0.8.45060: Flags [P.], seq 320671899:320671903, ack 429262024, win 85, options [nop,nop,TS val 3792945642 ecr 1097651123], length 4
00:01:33.887481 IP 10.0.0.6.1883 > 10.0.0.8.45060: Flags [P.], seq 320671903:320671907, ack 429262419, win 85, options [nop,nop,TS val 3792946643 ecr 1097652124], length 4
00:01:33.888568 IP 10.0.0.6.1883 > 10.0.0.8.45060: Flags [P.], seq 320671907:320671911, ack 429262423, win 85, options [nop,nop,TS val 3792946644 ecr 1097652126], length 4
00:01:34.163638 IP 10.0.0.6.1883 > 10.0.0.8.45060: Flags [P.], seq 320671911:320671913, ack 429262425, win 85, options [nop,nop,TS val 3792946919 ecr 1097652400], length 2
00:01:34.890719 IP 10.0.0.6.1883 > 10.0.0.8.45060: Flags [P.], seq 320671913:320671917, ack 429262820, win 85, options [nop,nop,TS val 3792947646 ecr 1097653124], length 4
00:01:34.892618 IP 10.0.0.6.1883 > 10.0.0.8.45060: Flags [P.], seq 320671917:320671921, ack 429262824, win 85, options [nop,nop,TS val 3792947648 ecr 1097653129], length 4
00:01:35.897877 IP 10.0.0.6.1883 > 10.0.0.8.45060: Flags [P.], seq 320671921:320671925, ack 429263219, win 85, options [nop,nop,TS val 3792948653 ecr 1097654132], length 4
00:01:35.899422 IP 10.0.0.6.1883 > 10.0.0.8.45060: Flags [P.], seq 320671925:320671929, ack 429263223, win 85, options [nop,nop,TS val 3792948655 ecr 1097654136], length 4
00:01:36.918319 IP 10.0.0.6.1883 > 10.0.0.8.45060: Flags [P.], seq 320671929:320671933, ack 429263618, win 85, options [nop,nop,TS val 3792949674 ecr 1097655155], length 4
00:01:36.919870 IP 10.0.0.6.1883 > 10.0.0.8.45060: Flags [P.], seq 320671933:320671937, ack 429263622, win 85, options [nop,nop,TS val 3792949675 ecr 1097655157], length 4
00:01:37.919575 IP 10.0.0.6.1883 > 10.0.0.8.45060: Flags [P.], seq 320671937:320671941, ack 429264017, win 85, options [nop,nop,TS val 3792950675 ecr 1097656156], length 4
00:01:37.921204 IP 10.0.0.6.1883 > 10.0.0.8.45060: Flags [P.], seq 320671941:320671945, ack 429264021, win 85, options [nop,nop,TS val 3792950677 ecr 1097656158], length 4
00:01:38.920266 IP 10.0.0.6.1883 > 10.0.0.8.45060: Flags [P.], seq 320671945:320671949, ack 429264416, win 85, options [nop,nop,TS val 3792951676 ecr 1097657157], length 4
00:01:38.921725 IP 10.0.0.6.1883 > 10.0.0.8.45060: Flags [P.], seq 320671949:320671953, ack 429264420, win 85, options [nop,nop,TS val 3792951677 ecr 1097657158], length 4
00:01:39.164665 IP 10.0.0.6.1883 > 10.0.0.8.45060: Flags [P.], seq 320671953:320671955, ack 429264422, win 85, options [nop,nop,TS val 3792951920 ecr 1097657401], length 2
00:01:39.949487 IP 10.0.0.6.1883 > 10.0.0.8.45060: Flags [P.], seq 320671955:320671959, ack 429264817, win 85, options [nop,nop,TS val 3792952705 ecr 1097658186], length 4
00:01:39.951414 IP 10.0.0.6.1883 > 10.0.0.8.45060: Flags [P.], seq 320671959:320671963, ack 429264821, win 85, options [nop,nop,TS val 3792952707 ecr 1097658188], length 4
00:01:40.950519 IP 10.0.0.6.1883 > 10.0.0.8.45060: Flags [P.], seq 320671963:320671967, ack 429265216, win 85, options [nop,nop,TS val 3792953706 ecr 1097659187], length 4
00:01:40.952696 IP 10.0.0.6.1883 > 10.0.0.8.45060: Flags [P.], seq 320671967:320671971, ack 429265220, win 85, options [nop,nop,TS val 3792953708 ecr 1097659189], length 4
00:01:41.951628 IP 10.0.0.6.1883 > 10.0.0.8.45060: Flags [P.], seq 320671971:320671975, ack 429265615, win 85, options [nop,nop,TS val 3792954707 ecr 1097660188], length 4
00:01:41.953732 IP 10.0.0.6.1883 > 10.0.0.8.45060: Flags [P.], seq 320671975:320671979, ack 429265619, win 85, options [nop,nop,TS val 3792954709 ecr 1097660190], length 4
00:01:42.952645 IP 10.0.0.6.1883 > 10.0.0.8.45060: Flags [P.], seq 320671979:320671983, ack 429266014, win 85, options [nop,nop,TS val 3792955708 ecr 1097661189], length 4
00:01:42.954317 IP 10.0.0.6.1883 > 10.0.0.8.45060: Flags [P.], seq 320671983:320671987, ack 429266018, win 85, options [nop,nop,TS val 3792955710 ecr 1097661191], length 4
00:01:43.958772 IP 10.0.0.6.1883 > 10.0.0.8.45060: Flags [P.], seq 320671987:320671991, ack 429266413, win 85, options [nop,nop,TS val 3792956714 ecr 1097662195], length 4
00:01:43.960216 IP 10.0.0.6.1883 > 10.0.0.8.45060: Flags [P.], seq 320671991:320671995, ack 429266417, win 85, options [nop,nop,TS val 3792956716 ecr 1097662197], length 4
00:01:44.168463 IP 10.0.0.6.1883 > 10.0.0.8.45060: Flags [P.], seq 320671995:320671997, ack 429266419, win 85, options [nop,nop,TS val 3792956924 ecr 1097662405], length 2
00:01:45.380736 IP 10.0.0.6.1883 > 10.0.0.8.45060: Flags [F.], seq 320671997, ack 429266420, win 85, options [nop,nop,TS val 3792958136 ecr 1097663617], length 0