00:00:10.725844 IP 10.0.0.6.1883 > 10.0.0.8.45094: Flags [S.], seq 2512235009, ack 3391562715, win 43440, options [mss 1460,sackOK,TS val 3793056471 ecr 1097761924,nop,wscale 9], length 0
00:00:10.737715 IP 10.0.0.6.1883 > 10.0.0.8.45094: Flags [.], ack 3391562735, win 85, options [nop,nop,TS val 3793056483 ecr 1097761965], length 0
00:00:10.738237 IP 10.0.0.6.1883 > 10.0.0.8.45094: Flags [P.], seq 2512235010:2512235014, ack 3391562735, win 85, options [nop,nop,TS val 3793056483 ecr 1097761965], length 4
00:00:10.740068 IP 10.0.0.6.1883 > 10.0.0.8.45094: Flags [P.], seq 2512235014:2512235079, ack 3391562799, win 85, options [nop,nop,TS val 3793056485 ecr 1097761966], length 65
00:00:10.740727 IP 10.0.0.6.1883 > 10.0.0.8.45094: Flags [P.], seq 2512235079:2512235084, ack 3391563194, win 85, options [nop,nop,TS val 3793056486 ecr 1097761968], length 5
00:00:10.783265 IP 10.0.0.6.1883 > 10.0.0.8.45094: Flags [P.], seq 2512235084:2512235088, ack 3391563194, win 85, options [nop,nop,TS val 3793056529 ecr 1097762011], length 4
00:00:10.784263 IP 10.0.0.6.1883 > 10.0.0.8.45094: Flags [P.], seq 2512235088:2512235092, ack 3391563198, win 85, options [nop,nop,TS val 3793056530 ecr 1097762011], length 4
00:00:11.714206 IP 10.0.0.6.1883 > 10.0.0.8.45094: Flags [P.], seq 2512235092:2512235096, ack 3391563593, win 85, options [nop,nop,TS val 3793057459 ecr 1097762938], length 4
00:00:11.716456 IP 10.0.0.6.1883 > 10.0.0.8.45094: Flags [P.], seq 2512235096:2512235100, ack 3391563597, win 85, options [nop,nop,TS val 3793057462 ecr 1097762942], length 4
00:00:12.718543 IP 10.0.0.6.1883 > 10.0.0.8.45094: Flags [P.], seq 2512235100:2512235104, ack 3391563992, win 85, options [nop,nop,TS val 3793058464 ecr 1097763943], length 4
00:00:12.720650 IP 10.0.0.6.1883 > 10.0.0.8.45094: Flags [P.], seq 2512235104:2512235108, ack 3391563996, win 85, options [nop,nop,TS val 3793058466 ecr 1097763947], length 4
00:00:13.721989 IP 10.0.0.6.1883 > 10.0.0.8.45094: Flags [P.], seq 2512235108:2512235112, ack 3391564391, win 85, options [nop,nop,TS val 3793059467 ecr 1097764947], length 4
00:00:13.854359 IP 10.0.0.6.1883 > 10.0.0.8.45094: Flags [P.], seq 2512235112:2512235116, ack 3391564395, win 85, options [nop,nop,TS val 3793059600 ecr 1097765080], length 4
00:00:14.844470 IP 10.0.0.6.1883 > 10.0.0.8.45094: Flags [P.], seq 2512235116:2512235120, ack 3391564790, win 85, options [nop,nop,TS val 3793060590 ecr 1097766070], length 4
00:00:14.846964 IP 10.0.0.6.1883 > 10.0.0.8.45094: Flags [P.], seq 2512235120:2512235124, ack 3391564794, win 85, options [nop,nop,TS val 3793060592 ecr 1097766073], length 4
00:00:15.741514 IP 10.0.0.6.1883 > 10.0.0.8.45094: Flags [P.], seq 2512235124:2512235126, ack 3391564796, win 85, options [nop,nop,TS val 3793061487 ecr 1097766967], length 2
00:00:15.853055 IP 10.0.0.6.1883 > 10.0.0.8.45094: Flags [P.], seq 2512235126:2512235130, ack 3391565191, win 85, options [nop,nop,TS val 3793061598 ecr 1097767079], length 4
00:00:15.854557 IP 10.0.0.6.1883 > 10.0.0.8.45094: Flags [P.], seq 2512235130:2512235134, ack 3391565195, win 85, options [nop,nop,TS val 3793061600 ecr 1097767081], length 4
00:00:16.866180 IP 10.0.0.6.1883 > 10.0.0.8.45094: Flags [P.], seq 2512235134:2512235138, ack 3391565590, win 85, options [nop,nop,TS val 3793062611 ecr 1097768092], length 4
00:00:16.868410 IP 10.0.0.6.1883 > 10.0.0.8.45094: Flags [P.], seq 2512235138:2512235142, ack 3391565594, win 85, options [nop,nop,TS val 3793062614 ecr 1097768095], length 4
00:00:17.869278 IP 10.0.0.6.1883 > 10.0.0.8.45094: Flags [P.], seq 2512235142:2512235146, ack 3391565989, win 85, options [nop,nop,TS val 3793063614 ecr 1097769093], length 4
00:00:17.871513 IP 10.0.0.6.1883 > 10.0.0.8.45094: Flags [P.], seq 2512235146:2512235150, ack 3391565993, win 85, options [nop,nop,TS val 3793063617 ecr 1097769097], length 4
00:00:18.869816 IP 10.0.0.6.1883 > 10.0.0.8.45094: Flags [P.], seq 2512235150:2512235154, ack 3391566388, win 85, options [nop,nop,TS val 3793064615 ecr 1097770094], length 4
00:00:18.871864 IP 10.0.0.6.1883 > 10.0.0.8.45094: Flags [P.], seq 2512235154:2512235158, ack 3391566392, win 85, options [nop,nop,TS val 3793064617 ecr 1097770098], length 4
00:00:19.868780 IP 10.0.0.6.1883 > 10.0.0.8.45094: Flags [P.], seq 2512235158:2512235162, ack 3391566787, win 85, options [nop,nop,TS val 3793065614 ecr 1097771095], length 4
00:00:19.871004 IP 10.0.0.6.1883 > 10.0.0.8.45094: Flags [P.], seq 2512235162:2512235166, ack 3391566791, win 85, options [nop,nop,TS val 3793065616 ecr 1097771097], length 4
00:00:20.744586 IP 10.0.0.6.1883 > 10.0.0.8.45094: Flags [P.], seq 2512235166:2512235168, ack 3391566793, win 85, options [nop,nop,TS val 3793066490 ecr 1097771971], length 2
00:00:20.873358 IP 10.0.0.6.1883 > 10.0.0.8.45094: Flags [P.], seq 2512235168:2512235172, ack 3391567188, win 85, options [nop,nop,TS val 3793066618 ecr 1097772097], length 4
00:00:21.019743 IP 10.0.0.6.1883 > 10.0.0.8.45094: Flags [P.], seq 2512235172:2512235176, ack 3391567192, win 85, options [nop,nop,TS val 3793066765 ecr 1097772245], length 4
00:00:21.882556 IP 10.0.0.6.1883 > 10.0.0.8.45094: Flags [P.], seq 2512235176:2512235180, ack 3391567587, win 85, options [nop,nop,TS val 3793067628 ecr 1097773109], length 4
00:00:21.883462 IP 10.0.0.6.1883 > 10.0.0.8.45094: Flags [P.], seq 2512235180:2512235184, ack 3391567591, win 85, options [nop,nop,TS val 3793067629 ecr 1097773110], length 4
00:00:22.883809 IP 10.0.0.6.1883 > 10.0.0.8.45094: Flags [P.], seq 2512235184:2512235188, ack 3391567986, win 85, options [nop,nop,TS val 3793068629 ecr 1097774110], length 4
00:00:22.885948 IP 10.0.0.6.1883 > 10.0.0.8.45094: Flags [P.], seq 2512235188:2512235192, ack 3391567990, win 85, options [nop,nop,TS val 3793068631 ecr 1097774112], length 4
00:00:23.885393 IP 10.0.0.6.1883 > 10.0.0.8.45094: Flags [P.], seq 2512235192:2512235196, ack 3391568385, win 85, options [nop,nop,TS val 3793069631 ecr 1097775111], length 4
00:00:23.887471 IP 10.0.0.6.1883 > 10.0.0.8.45094: Flags [P.], seq 2512235196:2512235200, ack 3391568389, win 85, options [nop,nop,TS val 3793069633 ecr 1097775114], length 4
00:00:24.888964 IP 10.0.0.6.1883 > 10.0.0.8.45094: Flags [P.], seq 2512235200:2512235204, ack 3391568784, win 85, options [nop,nop,TS val 3793070634 ecr 1097776114], length 4
00:00:25.000300 IP 10.0.0.6.1883 > 10.0.0.8.45094: Flags [P.], seq 2512235204:2512235208, ack 3391568788, win 85, options [nop,nop,TS val 3793070746 ecr 1097776226], length 4
00:00:25.751689 IP 10.0.0.6.1883 > 10.0.0.8.45094: Flags [P.], seq 2512235208:2512235210, ack 3391568790, win 85, options [nop,nop,TS val 3793071497 ecr 1097776977], length 2
00:00:25.891197 IP 10.0.0.6.1883 > 10.0.0.8.45094: Flags [P.], seq 2512235210:2512235214, ack 3391569185, win 85, options [nop,nop,TS val 3793071637 ecr 1097777116], length 4
00:00:25.897086 IP 10.0.0.6.1883 > 10.0.0.8.45094: Flags [P.], seq 2512235214:2512235218, ack 3391569189, win 85, options [nop,nop,TS val 3793071642 ecr 1097777123], length 4
00:00:26.903455 IP 10.0.0.6.1883 > 10.0.0.8.45094: Flags [P.], seq 2512235218:2512235222, ack 3391569584, win 85, options [nop,nop,TS val 3793072649 ecr 1097778130], length 4
00:00:26.904305 IP 10.0.0.6.1883 > 10.0.0.8.45094: Flags [P.], seq 2512235222:2512235226, ack 3391569588, win 85, options [nop,nop,TS val 3793072650 ecr 1097778131], length 4
00:00:27.906736 IP 10.0.0.6.1883 > 10.0.0.8.45094: Flags [P.], seq 2512235226:2512235230, ack 3391569983, win 85, options [nop,nop,TS val 3793073652 ecr 1097779133], length 4
00:00:28.000318 IP 10.0.0.6.1883 > 10.0.0.8.45094: Flags [P.], seq 2512235230:2512235234, ack 3391569987, win 85, options [nop,nop,TS val 3793073746 ecr 1097779227], length 4
00:00:28.908351 IP 10.0.0.6.1883 > 10.0.0.8.45094: Flags [P.], seq 2512235234:2512235238, ack 3391570382, win 85, options [nop,nop,TS val 3793074654 ecr 1097780134], length 4
00:00:28.909493 IP 10.0.0.6.1883 > 10.0.0.8.45094: Flags [P.], seq 2512235238:2512235242, ack 3391570386, win 85, options [nop,nop,TS val 3793074654 ecr 1097780136], length 4
00:00:29.914902 IP 10.0.0.6.1883 > 10.0.0.8.45094: Flags [P.], seq 2512235242:2512235246, ack 3391570781, win 85, options [nop,nop,TS val 3793075658 ecr 1097781138], length 4
00:00:29.921458 IP 10.0.0.6.1883 > 10.0.0.8.45094: Flags [P.], seq 2512235246:2512235250, ack 3391570785, win 85, options [nop,nop,TS val 3793075667 ecr 1097781147], length 4
00:00:30.843440 IP 10.0.0.6.1883 > 10.0.0.8.45094: Flags [P.], seq 2512235250:2512235252, ack 3391570787, win 85, options [nop,nop,TS val 3793076589 ecr 1097782069], length 2
00:00:30.914716 IP 10.0.0.6.1883 > 10.0.0.8.45094: Flags [P.], seq 2512235252:2512235256, ack 3391571182, win 85, options [nop,nop,TS val 3793076660 ecr 1097782140], length 4
00:00:30.918400 IP 10.0.0.6.1883 > 10.0.0.8.45094: Flags [P.], seq 2512235256:2512235260, ack 3391571186, win 85, options [nop,nop,TS val 3793076664 ecr 1097782144], length 4
00:00:31.949679 IP 10.0.0.6.1883 > 10.0.0.8.45094: Flags [P.], seq 2512235260:2512235264, ack 3391571581, win 85, options [nop,nop,TS val 3793077695 ecr 1097783176], length 4
00:00:31.951180 IP 10.0.0.6.1883 > 10.0.0.8.45094: Flags [P.], seq 2512235264:2512235268, ack 3391571585, win 85, options [nop,nop,TS val 3793077696 ecr 1097783177], length 4
00:00:32.953060 IP 10.0.0.6.1883 > 10.0.0.8.45094: Flags [P.], seq 2512235268:2512235272, ack 3391571980, win 85, options [nop,nop,TS val 3793078698 ecr 1097784179], length 4
00:00:32.954973 IP 10.0.0.6.1883 > 10.0.0.8.45094: Flags [P.], seq 2512235272:2512235276, ack 3391571984, win 85, options [nop,nop,TS val 3793078700 ecr 1097784181], length 4
00:00:33.954235 IP 10.0.0.6.1883 > 10.0.0.8.45094: Flags [P.], seq 2512235276:2512235280, ack 3391572379, win 85, options [nop,nop,TS val 3793079699 ecr 1097785180], length 4
00:00:33.956590 IP 10.0.0.6.1883 > 10.0.0.8.45094: Flags [P.], seq 2512235280:2512235284, ack 3391572383, win 85, options [nop,nop,TS val 3793079702 ecr 1097785183], length 4
00:00:34.954312 IP 10.0.0.6.1883 > 10.0.0.8.45094: Flags [P.], seq 2512235284:2512235288, ack 3391572778, win 85, options [nop,nop,TS val 3793080700 ecr 1097786181], length 4
00:00:34.955776 IP 10.0.0.6.1883 > 10.0.0.8.45094: Flags [P.], seq 2512235288:2512235292, ack 3391572782, win 85, options [nop,nop,TS val 3793080701 ecr 1097786182], length 4
00:00:35.844581 IP 10.0.0.6.1883 > 10.0.0.8.45094: Flags [P.], seq 2512235292:2512235294, ack 3391572784, win 85, options [nop,nop,TS val 3793081590 ecr 1097787071], length 2
00:00:35.955910 IP 10.0.0.6.1883 > 10.0.0.8.45094: Flags [P.], seq 2512235294:2512235298, ack 3391573179, win 85, options [nop,nop,TS val 3793081701 ecr 1097787182], length 4
00:00:35.957167 IP 10.0.0.6.1883 > 10.0.0.8.45094: Flags [P.], seq 2512235298:2512235302, ack 3391573183, win 85, options [nop,nop,TS val 3793081702 ecr 1097787184], length 4
00:00:36.957075 IP 10.0.0.6.1883 > 10.0.0.8.45094: Flags [P.], seq 2512235302:2512235306, ack 3391573578, win 85, options [nop,nop,TS val 3793082702 ecr 1097788183], length 4
00:00:36.958786 IP 10.0.0.6.1883 > 10.0.0.8.45094: Flags [P.], seq 2512235306:2512235310, ack 3391573582, win 85, options [nop,nop,TS val 3793082704 ecr 1097788185], length 4
00:00:37.962295 IP 10.0.0.6.1883 > 10.0.0.8.45094: Flags [P.], seq 2512235310:2512235314, ack 3391573977, win 85, options [nop,nop,TS val 3793083708 ecr 1097789189], length 4
00:00:37.963535 IP 10.0.0.6.1883 > 10.0.0.8.45094: Flags [P.], seq 2512235314:2512235318, ack 3391573981, win 85, options [nop,nop,TS val 3793083709 ecr 1097789190], length 4
00:00:38.964753 IP 10.0.0.6.1883 > 10.0.0.8.45094: Flags [P.], seq 2512235318:2512235322, ack 3391574376, win 85, options [nop,nop,TS val 3793084710 ecr 1097790191], length 4
00:00:38.966589 IP 10.0.0.6.1883 > 10.0.0.8.45094: Flags [P.], seq 2512235322:2512235326, ack 3391574380, win 85, options [nop,nop,TS val 3793084712 ecr 1097790193], length 4
00:00:39.967474 IP 10.0.0.6.1883 > 10.0.0.8.45094: Flags [P.], seq 2512235326:2512235330, ack 3391574775, win 85, options [nop,nop,TS val 3793085713 ecr 1097791194], length 4
00:00:39.969328 IP 10.0.0.6.1883 > 10.0.0.8.45094: Flags [P.], seq 2512235330:2512235334, ack 3391574779, win 85, options [nop,nop,TS val 3793085715 ecr 1097791195], length 4
00:00:40.845811 IP 10.0.0.6.1883 > 10.0.0.8.45094: Flags [P.], seq 2512235334:2512235336, ack 3391574781, win 85, options [nop,nop,TS val 3793086591 ecr 1097792072], length 2
00:00:40.992374 IP 10.0.0.6.1883 > 10.0.0.8.45094: Flags [P.], seq 2512235336:2512235340, ack 3391575176, win 85, options [nop,nop,TS val 3793086738 ecr 1097792219], length 4
00:00:40.993557 IP 10.0.0.6.1883 > 10.0.0.8.45094: Flags [P.], seq 2512235340:2512235344, ack 3391575180, win 85, options [nop,nop,TS val 3793086739 ecr 1097792220], length 4
00:00:42.003203 IP 10.0.0.6.1883 > 10.0.0.8.45094: Flags [P.], seq 2512235344:2512235348, ack 3391575575, win 85, options [nop,nop,TS val 3793087749 ecr 1097793230], length 4
00:00:42.003749 IP 10.0.0.6.1883 > 10.0.0.8.45094: Flags [P.], seq 2512235348:2512235352, ack 3391575579, win 85, options [nop,nop,TS val 3793087749 ecr 1097793231], length 4
00:00:43.004892 IP 10.0.0.6.1883 > 10.0.0.8.45094: Flags [P.], seq 2512235352:2512235356, ack 3391575974, win 85, options [nop,nop,TS val 3793088750 ecr 1097794231], length 4
00:00:43.008030 IP 10.0.0.6.1883 > 10.0.0.8.45094: Flags [P.], seq 2512235356:2512235360, ack 3391575978, win 85, options [nop,nop,TS val 3793088753 ecr 1097794234], length 4
00:00:44.005689 IP 10.0.0.6.1883 > 10.0.0.8.45094: Flags [P.], seq 2512235360:2512235364, ack 3391576373, win 85, options [nop,nop,TS val 3793089751 ecr 1097795232], length 4
00:00:44.008076 IP 10.0.0.6.1883 > 10.0.0.8.45094: Flags [P.], seq 2512235364:2512235368, ack 3391576377, win 85, options [nop,nop,TS val 3793089753 ecr 1097795234], length 4
00:00:45.007649 IP 10.0.0.6.1883 > 10.0.0.8.45094: Flags [P.], seq 2512235368:2512235372, ack 3391576772, win 85, options [nop,nop,TS val 3793090753 ecr 1097796233], length 4
00:00:45.009266 IP 10.0.0.6.1883 > 10.0.0.8.45094: Flags [P.], seq 2512235372:2512235376, ack 3391576776, win 85, options [nop,nop,TS val 3793090754 ecr 1097796236], length 4
00:00:45.847627 IP 10.0.0.6.1883 > 10.0.0.8.45094: Flags [P.], seq 2512235376:2512235378, ack 3391576778, win 85, options [nop,nop,TS val 3793091593 ecr 1097797074], length 2
00:00:46.018734 IP 10.0.0.6.1883 > 10.0.0.8.45094: Flags [P.], seq 2512235378:2512235382, ack 3391577173, win 85, options [nop,nop,TS val 3793091764 ecr 1097797245], length 4
00:00:46.020153 IP 10.0.0.6.1883 > 10.0.0.8.45094: Flags [P.], seq 2512235382:2512235386, ack 3391577177, win 85, options [nop,nop,TS val 3793091766 ecr 1097797247], length 4
00:00:47.023351 IP 10.0.0.6.1883 > 10.0.0.8.45094: Flags [P.], seq 2512235386:2512235390, ack 3391577572, win 85, options [nop,nop,TS val 3793092769 ecr 1097798248], length 4
00:00:47.024799 IP 10.0.0.6.1883 > 10.0.0.8.45094: Flags [P.], seq 2512235390:2512235394, ack 3391577576, win 85, options [nop,nop,TS val 3793092770 ecr 1097798251], length 4
00:00:48.027749 IP 10.0.0.6.1883 > 10.0.0.8.45094: Flags [P.], seq 2512235394:2512235398, ack 3391577971, win 85, options [nop,nop,TS val 3793093773 ecr 1097799253], length 4
00:00:48.029429 IP 10.0.0.6.1883 > 10.0.0.8.45094: Flags [P.], seq 2512235398:2512235402, ack 3391577975, win 85, options [nop,nop,TS val 3793093774 ecr 1097799256], length 4
00:00:49.028133 IP 10.0.0.6.1883 > 10.0.0.8.45094: Flags [P.], seq 2512235402:2512235406, ack 3391578370, win 85, options [nop,nop,TS val 3793094773 ecr 1097800255], length 4
00:00:49.029695 IP 10.0.0.6.1883 > 10.0.0.8.45094: Flags [P.], seq 2512235406:2512235410, ack 3391578374, win 85, options [nop,nop,TS val 3793094775 ecr 1097800256], length 4
00:00:50.029133 IP 10.0.0.6.1883 > 10.0.0.8.45094: Flags [P.], seq 2512235410:2512235414, ack 3391578769, win 85, options [nop,nop,TS val 3793095774 ecr 1097801256], length 4
00:00:50.030252 IP 10.0.0.6.1883 > 10.0.0.8.45094: Flags [P.], seq 2512235414:2512235418, ack 3391578773, win 85, options [nop,nop,TS val 3793095776 ecr 1097801257], length 4
00:00:50.848353 IP 10.0.0.6.1883 > 10.0.0.8.45094: Flags [P.], seq 2512235418:2512235420, ack 3391578775, win 85, options [nop,nop,TS val 3793096594 ecr 1097802075], length 2
00:00:51.030410 IP 10.0.0.6.1883 > 10.0.0.8.45094: Flags [P.], seq 2512235420:2512235424, ack 3391579170, win 85, options [nop,nop,TS val 3793096776 ecr 1097802257], length 4
00:00:51.032171 IP 10.0.0.6.1883 > 10.0.0.8.45094: Flags [P.], seq 2512235424:2512235428, ack 3391579174, win 85, options [nop,nop,TS val 3793096778 ecr 1097802259], length 4
00:00:52.031649 IP 10.0.0.6.1883 > 10.0.0.8.45094: Flags [P.], seq 2512235428:2512235432, ack 3391579569, win 85, options [nop,nop,TS val 3793097777 ecr 1097803259], length 4
00:00:52.031914 IP 10.0.0.6.1883 > 10.0.0.8.45094: Flags [P.], seq 2512235432:2512235436, ack 3391579573, win 85, options [nop,nop,TS val 3793097777 ecr 1097803259], length 4
00:00:53.034462 IP 10.0.0.6.1883 > 10.0.0.8.45094: Flags [P.], seq 2512235436:2512235440, ack 3391579968, win 85, options [nop,nop,TS val 3793098780 ecr 1097804261], length 4
00:00:53.036772 IP 10.0.0.6.1883 > 10.0.0.8.45094: Flags [P.], seq 2512235440:2512235444, ack 3391579972, win 85, options [nop,nop,TS val 3793098782 ecr 1097804264], length 4
00:00:54.037501 IP 10.0.0.6.1883 > 10.0.0.8.45094: Flags [P.], seq 2512235444:2512235448, ack 3391580367, win 85, options [nop,nop,TS val 3793099783 ecr 1097805262], length 4
00:00:54.040749 IP 10.0.0.6.1883 > 10.0.0.8.45094: Flags [P.], seq 2512235448:2512235452, ack 3391580371, win 85, options [nop,nop,TS val 3793099786 ecr 1097805267], length 4
00:00:55.039409 IP 10.0.0.6.1883 > 10.0.0.8.45094: Flags [P.], seq 2512235452:2512235456, ack 3391580766, win 85, options [nop,nop,TS val 3793100785 ecr 1097806263], length 4
00:00:55.047117 IP 10.0.0.6.1883 > 10.0.0.8.45094: Flags [P.], seq 2512235456:2512235460, ack 3391580770, win 85, options [nop,nop,TS val 3793100793 ecr 1097806272], length 4
00:00:55.935092 IP 10.0.0.6.1883 > 10.0.0.8.45094: Flags [P.], seq 2512235460:2512235462, ack 3391580772, win 85, options [nop,nop,TS val 3793101680 ecr 1097807160], length 2
00:00:56.042284 IP 10.0.0.6.1883 > 10.0.0.8.45094: Flags [P.], seq 2512235462:2512235466, ack 3391581167, win 85, options [nop,nop,TS val 3793101788 ecr 1097807267], length 4
00:00:56.044565 IP 10.0.0.6.1883 > 10.0.0.8.45094: Flags [P.], seq 2512235466:2512235470, ack 3391581171, win 85, options [nop,nop,TS val 3793101790 ecr 1097807270], length 4
00:00:57.043237 IP 10.0.0.6.1883 > 10.0.0.8.45094: Flags [P.], seq 2512235470:2512235474, ack 3391581566, win 85, options [nop,nop,TS val 3793102788 ecr 1097808269], length 4
00:00:57.046308 IP 10.0.0.6.1883 > 10.0.0.8.45094: Flags [P.], seq 2512235474:2512235478, ack 3391581570, win 85, options [nop,nop,TS val 3793102792 ecr 1097808272], length 4
00:00:58.045205 IP 10.0.0.6.1883 > 10.0.0.8.45094: Flags [P.], seq 2512235478:2512235482, ack 3391581965, win 85, options [nop,nop,TS val 3793103791 ecr 1097809270], length 4
00:00:58.045771 IP 10.0.0.6.1883 > 10.0.0.8.45094: Flags [P.], seq 2512235482:2512235486, ack 3391581969, win 85, options [nop,nop,TS val 3793103791 ecr 1097809273], length 4
00:00:59.046635 IP 10.0.0.6.1883 > 10.0.0.8.45094: Flags [P.], seq 2512235486:2512235490, ack 3391582364, win 85, options [nop,nop,TS val 3793104792 ecr 1097810272], length 4
00:00:59.048138 IP 10.0.0.6.1883 > 10.0.0.8.45094: Flags [P.], seq 2512235490:2512235494, ack 3391582368, win 85, options [nop,nop,TS val 3793104793 ecr 1097810274], length 4
00:01:00.046884 IP 10.0.0.6.1883 > 10.0.0.8.45094: Flags [P.], seq 2512235494:2512235498, ack 3391582763, win 85, options [nop,nop,TS val 3793105792 ecr 1097811273], length 4
00:01:00.047592 IP 10.0.0.6.1883 > 10.0.0.8.45094: Flags [P.], seq 2512235498:2512235502, ack 3391582767, win 85, options [nop,nop,TS val 3793105793 ecr 1097811275], length 4
00:01:00.936568 IP 10.0.0.6.1883 > 10.0.0.8.45094: Flags [P.], seq 2512235502:2512235504, ack 3391582769, win 85, options [nop,nop,TS val 3793106682 ecr 1097812161], length 2
00:01:01.050103 IP 10.0.0.6.1883 > 10.0.0.8.45094: Flags [P.], seq 2512235504:2512235508, ack 3391583164, win 85, options [nop,nop,TS val 3793106795 ecr 1097812275], length 4
00:01:01.051647 IP 10.0.0.6.1883 > 10.0.0.8.45094: Flags [P.], seq 2512235508:2512235512, ack 3391583168, win 85, options [nop,nop,TS val 3793106797 ecr 1097812278], length 4
00:01:02.052419 IP 10.0.0.6.1883 > 10.0.0.8.45094: Flags [P.], seq 2512235512:2512235516, ack 3391583563, win 85, options [nop,nop,TS val 3793107798 ecr 1097813278], length 4
00:01:02.054067 IP 10.0.0.6.1883 > 10.0.0.8.45094: Flags [P.], seq 2512235516:2512235520, ack 3391583567, win 85, options [nop,nop,TS val 3793107799 ecr 1097813280], length 4
00:01:03.053714 IP 10.0.0.6.1883 > 10.0.0.8.45094: Flags [P.], seq 2512235520:2512235524, ack 3391583962, win 85, options [nop,nop,TS val 3793108799 ecr 1097814279], length 4
00:01:03.055315 IP 10.0.0.6.1883 > 10.0.0.8.45094: Flags [P.], seq 2512235524:2512235528, ack 3391583966, win 85, options [nop,nop,TS val 3793108801 ecr 1097814281], length 4
00:01:04.057015 IP 10.0.0.6.1883 > 10.0.0.8.45094: Flags [P.], seq 2512235528:2512235532, ack 3391584361, win 85, options [nop,nop,TS val 3793109802 ecr 1097815283], length 4
00:01:04.058614 IP 10.0.0.6.1883 > 10.0.0.8.45094: Flags [P.], seq 2512235532:2512235536, ack 3391584365, win 85, options [nop,nop,TS val 3793109804 ecr 1097815285], length 4
00:01:05.057679 IP 10.0.0.6.1883 > 10.0.0.8.45094: Flags [P.], seq 2512235536:2512235540, ack 3391584760, win 85, options [nop,nop,TS val 3793110803 ecr 1097816284], length 4
00:01:05.060147 IP 10.0.0.6.1883 > 10.0.0.8.45094: Flags [P.], seq 2512235540:2512235544, ack 3391584764, win 85, options [nop,nop,TS val 3793110805 ecr 1097816286], length 4
00:01:05.937108 IP 10.0.0.6.1883 > 10.0.0.8.45094: Flags [P.], seq 2512235544:2512235546, ack 3391584766, win 85, options [nop,nop,TS val 3793111682 ecr 1097817163], length 2
00:01:06.059919 IP 10.0.0.6.1883 > 10.0.0.8.45094: Flags [P.], seq 2512235546:2512235550, ack 3391585161, win 85, options [nop,nop,TS val 3793111805 ecr 1097817285], length 4
00:01:06.061260 IP 10.0.0.6.1883 > 10.0.0.8.45094: Flags [P.], seq 2512235550:2512235554, ack 3391585165, win 85, options [nop,nop,TS val 3793111806 ecr 1097817288], length 4
00:01:07.063883 IP 10.0.0.6.1883 > 10.0.0.8.45094: Flags [P.], seq 2512235554:2512235558, ack 3391585560, win 85, options [nop,nop,TS val 3793112809 ecr 1097818287], length 4
00:01:07.065463 IP 10.0.0.6.1883 > 10.0.0.8.45094: Flags [P.], seq 2512235558:2512235562, ack 3391585564, win 85, options [nop,nop,TS val 3793112810 ecr 1097818292], length 4
00:01:08.062622 IP 10.0.0.6.1883 > 10.0.0.8.45094: Flags [P.], seq 2512235562:2512235566, ack 3391585959, win 85, options [nop,nop,TS val 3793113808 ecr 1097819288], length 4
00:01:08.063713 IP 10.0.0.6.1883 > 10.0.0.8.45094: Flags [P.], seq 2512235566:2512235570, ack 3391585963, win 85, options [nop,nop,TS val 3793113809 ecr 1097819291], length 4
00:01:09.064424 IP 10.0.0.6.1883 > 10.0.0.8.45094: Flags [P.], seq 2512235570:2512235574, ack 3391586358, win 85, options [nop,nop,TS val 3793114810 ecr 1097820290], length 4
00:01:09.066018 IP 10.0.0.6.1883 > 10.0.0.8.45094: Flags [P.], seq 2512235574:2512235578, ack 3391586362, win 85, options [nop,nop,TS val 3793114811 ecr 1097820292], length 4
00:01:10.065637 IP 10.0.0.6.1883 > 10.0.0.8.45094: Flags [P.], seq 2512235578:2512235582, ack 3391586757, win 85, options [nop,nop,TS val 3793115811 ecr 1097821291], length 4
00:01:10.067108 IP 10.0.0.6.1883 > 10.0.0.8.45094: Flags [P.], seq 2512235582:2512235586, ack 3391586761, win 85, options [nop,nop,TS val 3793115812 ecr 1097821294], length 4
00:01:10.938369 IP 10.0.0.6.1883 > 10.0.0.8.45094: Flags [P.], seq 2512235586:2512235588, ack 3391586763, win 85, options [nop,nop,TS val 3793116684 ecr 1097822164], length 2
00:01:11.066856 IP 10.0.0.6.1883 > 10.0.0.8.45094: Flags [P.], seq 2512235588:2512235592, ack 3391587158, win 85, options [nop,nop,TS val 3793116812 ecr 1097822292], length 4
00:01:11.068250 IP 10.0.0.6.1883 > 10.0.0.8.45094: Flags [P.], seq 2512235592:2512235596, ack 3391587162, win 85, options [nop,nop,TS val 3793116813 ecr 1097822295], length 4
00:01:12.067578 IP 10.0.0.6.1883 > 10.0.0.8.45094: Flags [P.], seq 2512235596:2512235600, ack 3391587557, win 85, options [nop,nop,TS val 3793117813 ecr 1097823293], length 4
00:01:12.069019 IP 10.0.0.6.1883 > 10.0.0.8.45094: Flags [P.], seq 2512235600:2512235604, ack 3391587561, win 85, options [nop,nop,TS val 3793117814 ecr 1097823295], length 4
00:01:13.069138 IP 10.0.0.6.1883 > 10.0.0.8.45094: Flags [P.], seq 2512235604:2512235608, ack 3391587956, win 85, options [nop,nop,TS val 3793118814 ecr 1097824295], length 4
00:01:13.071501 IP 10.0.0.6.1883 > 10.0.0.8.45094: Flags [P.], seq 2512235608:2512235612, ack 3391587960, win 85, options [nop,nop,TS val 3793118817 ecr 1097824297], length 4
00:01:14.069778 IP 10.0.0.6.1883 > 10.0.0.8.45094: Flags [P.], seq 2512235612:2512235616, ack 3391588355, win 85, options [nop,nop,TS val 3793119815 ecr 1097825296], length 4
00:01:14.070962 IP 10.0.0.6.1883 > 10.0.0.8.45094: Flags [P.], seq 2512235616:2512235620, ack 3391588359, win 85, options [nop,nop,TS val 3793119816 ecr 1097825298], length 4
00:01:15.071041 IP 10.0.0.6.1883 > 10.0.0.8.45094: Flags [P.], seq 2512235620:2512235624, ack 3391588754, win 85, options [nop,nop,TS val 3793120816 ecr 1097826297], length 4
00:01:15.072400 IP 10.0.0.6.1883 > 10.0.0.8.45094: Flags [P.], seq 2512235624:2512235628, ack 3391588758, win 85, options [nop,nop,TS val 3793120818 ecr 1097826299], length 4
00:01:15.938060 IP 10.0.0.6.1883 > 10.0.0.8.45094: Flags [P.], seq 2512235628:2512235630, ack 3391588760, win 85, options [nop,nop,TS val 3793121683 ecr 1097827165], length 2
00:01:16.072081 IP 10.0.0.6.1883 > 10.0.0.8.45094: Flags [P.], seq 2512235630:2512235634, ack 3391589155, win 85, options [nop,nop,TS val 3793121817 ecr 1097827298], length 4
00:01:16.073915 IP 10.0.0.6.1883 > 10.0.0.8.45094: Flags [P.], seq 2512235634:2512235638, ack 3391589159, win 85, options [nop,nop,TS val 3793121819 ecr 1097827300], length 4
00:01:17.074420 IP 10.0.0.6.1883 > 10.0.0.8.45094: Flags [P.], seq 2512235638:2512235642, ack 3391589554, win 85, options [nop,nop,TS val 3793122820 ecr 1097828300], length 4
00:01:17.077484 IP 10.0.0.6.1883 > 10.0.0.8.45094: Flags [P.], seq 2512235642:2512235646, ack 3391589558, win 85, options [nop,nop,TS val 3793122822 ecr 1097828303], length 4
00:01:18.074040 IP 10.0.0.6.1883 > 10.0.0.8.45094: Flags [P.], seq 2512235646:2512235650, ack 3391589953, win 85, options [nop,nop,TS val 3793123819 ecr 1097829301], length 4
00:01:18.074362 IP 10.0.0.6.1883 > 10.0.0.8.45094: Flags [P.], seq 2512235650:2512235654, ack 3391589957, win 85, options [nop,nop,TS val 3793123820 ecr 1097829302], length 4
00:01:19.076545 IP 10.0.0.6.1883 > 10.0.0.8.45094: Flags [P.], seq 2512235654:2512235658, ack 3391590352, win 85, options [nop,nop,TS val 3793124822 ecr 1097830302], length 4
00:01:19.078725 IP 10.0.0.6.1883 > 10.0.0.8.45094: Flags [P.], seq 2512235658:2512235662, ack 3391590356, win 85, options [nop,nop,TS val 3793124824 ecr 1097830305], length 4
00:01:20.075669 IP 10.0.0.6.1883 > 10.0.0.8.45094: Flags [P.], seq 2512235662:2512235666, ack 3391590751, win 85, options [nop,nop,TS val 3793125821 ecr 1097831303], length 4
00:01:20.076339 IP 10.0.0.6.1883 > 10.0.0.8.45094: Flags [P.], seq 2512235666:2512235670, ack 3391590755, win 85, options [nop,nop,TS val 3793125822 ecr 1097831303], length 4
00:01:20.943114 IP 10.0.0.6.1883 > 10.0.0.8.45094: Flags [P.], seq 2512235670:2512235672, ack 3391590757, win 85, options [nop,nop,TS val 3793126687 ecr 1097832168], length 2
00:01:21.078478 IP 10.0.0.6.1883 > 10.0.0.8.45094: Flags [P.], seq 2512235672:2512235676, ack 3391591152, win 85, options [nop,nop,TS val 3793126824 ecr 1097832304], length 4
00:01:21.080661 IP 10.0.0.6.1883 > 10.0.0.8.45094: Flags [P.], seq 2512235676:2512235680, ack 3391591156, win 85, options [nop,nop,TS val 3793126826 ecr 1097832307], length 4
00:01:21.313706 IP 10.0.0.6.1883 > 10.0.0.8.45094: Flags [P.], seq 2512235676:2512235680, ack 3391591156, win 85, options [nop,nop,TS val 3793127059 ecr 1097832307], length 4
00:01:22.077985 IP 10.0.0.6.1883 > 10.0.0.8.45094: Flags [P.], seq 2512235680:2512235684, ack 3391591551, win 85, options [nop,nop,TS val 3793127823 ecr 1097833305], length 4
00:01:22.078777 IP 10.0.0.6.1883 > 10.0.0.8.45094: Flags [P.], seq 2512235684:2512235688, ack 3391591555, win 85, options [nop,nop,TS val 3793127824 ecr 1097833306], length 4
00:01:23.080662 IP 10.0.0.6.1883 > 10.0.0.8.45094: Flags [P.], seq 2512235688:2512235692, ack 3391591950, win 85, options [nop,nop,TS val 3793128826 ecr 1097834308], length 4
00:01:23.199002 IP 10.0.0.6.1883 > 10.0.0.8.45094: Flags [P.], seq 2512235692:2512235696, ack 3391591954, win 85, options [nop,nop,TS val 3793128944 ecr 1097834425], length 4
00:01:24.201293 IP 10.0.0.6.1883 > 10.0.0.8.45094: Flags [P.], seq 2512235696:2512235700, ack 3391592349, win 85, options [nop,nop,TS val 3793129946 ecr 1097835427], length 4
00:01:24.204061 IP 10.0.0.6.1883 > 10.0.0.8.45094: Flags [P.], seq 2512235700:2512235704, ack 3391592353, win 85, options [nop,nop,TS val 3793129949 ecr 1097835430], length 4
00:01:25.202425 IP 10.0.0.6.1883 > 10.0.0.8.45094: Flags [P.], seq 2512235704:2512235708, ack 3391592748, win 85, options [nop,nop,TS val 3793130948 ecr 1097836429], length 4
00:01:25.206413 IP 10.0.0.6.1883 > 10.0.0.8.45094: Flags [P.], seq 2512235708:2512235712, ack 3391592752, win 85, options [nop,nop,TS val 3793130952 ecr 1097836433], length 4
00:01:25.705438 IP 10.0.0.6.1883 > 10.0.0.8.45094: Flags [P.], seq 2512235708:2512235712, ack 3391592752, win 85, options [nop,nop,TS val 3793131448 ecr 1097836433], length 4
00:01:26.023582 IP 10.0.0.6.1883 > 10.0.0.8.45094: Flags [P.], seq 2512235712:2512235714, ack 3391592754, win 85, options [nop,nop,TS val 3793131769 ecr 1097837250], length 2
00:01:26.224486 IP 10.0.0.6.1883 > 10.0.0.8.45094: Flags [P.], seq 2512235714:2512235718, ack 3391593149, win 85, options [nop,nop,TS val 3793131970 ecr 1097837451], length 4
00:01:26.228906 IP 10.0.0.6.1883 > 10.0.0.8.45094: Flags [P.], seq 2512235718:2512235722, ack 3391593153, win 85, options [nop,nop,TS val 3793131974 ecr 1097837455], length 4
00:01:27.228096 IP 10.0.0.6.1883 > 10.0.0.8.45094: Flags [P.], seq 2512235722:2512235726, ack 3391593548, win 85, options [nop,nop,TS val 3793132973 ecr 1097838453], length 4
00:01:27.230034 IP 10.0.0.6.1883 > 10.0.0.8.45094: Flags [P.], seq 2512235726:2512235730, ack 3391593552, win 85, options [nop,nop,TS val 3793132975 ecr 1097838456], length 4
00:01:28.230950 IP 10.0.0.6.1883 > 10.0.0.8.45094: Flags [P.], seq 2512235730:2512235734, ack 3391593947, win 85, options [nop,nop,TS val 3793133976 ecr 1097839456], length 4
00:01:28.233174 IP 10.0.0.6.1883 > 10.0.0.8.45094: Flags [P.], seq 2512235734:2512235738, ack 3391593951, win 85, options [nop,nop,TS val 3793133978 ecr 1097839459], length 4
00:01:29.232364 IP 10.0.0.6.1883 > 10.0.0.8.45094: Flags [P.], seq 2512235738:2512235742, ack 3391594346, win 85, options [nop,nop,TS val 3793134977 ecr 1097840458], length 4
00:01:29.237216 IP 10.0.0.6.1883 > 10.0.0.8.45094: Flags [P.], seq 2512235742:2512235746, ack 3391594350, win 85, options [nop,nop,TS val 3793134982 ecr 1097840463], length 4
00:01:30.234822 IP 10.0.0.6.1883 > 10.0.0.8.45094: Flags [P.], seq 2512235746:2512235750, ack 3391594745, win 85, options [nop,nop,TS val 3793135978 ecr 1097841460], length 4
00:01:30.238102 IP 10.0.0.6.1883 > 10.0.0.8.45094: Flags [P.], seq 2512235750:2512235754, ack 3391594749, win 85, options [nop,nop,TS val 3793135984 ecr 1097841465], length 4
00:01:31.026871 IP 10.0.0.6.1883 > 10.0.0.8.45094: Flags [P.], seq 2512235754:2512235756, ack 3391594751, win 85, options [nop,nop,TS val 3793136772 ecr 1097842253], length 2
00:01:31.250774 IP 10.0.0.6.1883 > 10.0.0.8.45094: Flags [P.], seq 2512235756:2512235760, ack 3391595146, win 85, options [nop,nop,TS val 3793136996 ecr 1097842477], length 4
00:01:31.252408 IP 10.0.0.6.1883 > 10.0.0.8.45094: Flags [P.], seq 2512235760:2512235764, ack 3391595150, win 85, options [nop,nop,TS val 3793136998 ecr 1097842479], length 4
00:01:32.285844 IP 10.0.0.6.1883 > 10.0.0.8.45094: Flags [P.], seq 2512235764:2512235768, ack 3391595545, win 85, options [nop,nop,TS val 3793138031 ecr 1097843511], length 4
00:01:32.304330 IP 10.0.0.6.1883 > 10.0.0.8.45094: Flags [P.], seq 2512235768:2512235772, ack 3391595549, win 85, options [nop,nop,TS val 3793138049 ecr 1097843531], length 4
00:01:33.290147 IP 10.0.0.6.1883 > 10.0.0.8.45094: Flags [P.], seq 2512235772:2512235776, ack 3391595944, win 85, options [nop,nop,TS val 3793139036 ecr 1097844516], length 4
00:01:33.290885 IP 10.0.0.6.1883 > 10.0.0.8.45094: Flags [P.], seq 2512235776:2512235780, ack 3391595948, win 85, options [nop,nop,TS val 3793139036 ecr 1097844518], length 4
00:01:34.290431 IP 10.0.0.6.1883 > 10.0.0.8.45094: Flags [P.], seq 2512235780:2512235784, ack 3391596343, win 85, options [nop,nop,TS val 3793140036 ecr 1097845517], length 4
00:01:34.291362 IP 10.0.0.6.1883 > 10.0.0.8.45094: Flags [P.], seq 2512235784:2512235788, ack 3391596347, win 85, options [nop,nop,TS val 3793140037 ecr 1097845518], length 4
00:01:35.291433 IP 10.0.0.6.1883 > 10.0.0.8.45094: Flags [P.], seq 2512235788:2512235792, ack 3391596742, win 85, options [nop,nop,TS val 3793141037 ecr 1097846518], length 4
00:01:35.293603 IP 10.0.0.6.1883 > 10.0.0.8.45094: Flags [P.], seq 2512235792:2512235796, ack 3391596746, win 85, options [nop,nop,TS val 3793141039 ecr 1097846520], length 4
00:01:36.028095 IP 10.0.0.6.1883 > 10.0.0.8.45094: Flags [P.], seq 2512235796:2512235798, ack 3391596748, win 85, options [nop,nop,TS val 3793141773 ecr 1097847255], length 2
00:01:36.293518 IP 10.0.0.6.1883 > 10.0.0.8.45094: Flags [P.], seq 2512235798:2512235802, ack 3391597143, win 85, options [nop,nop,TS val 3793142038 ecr 1097847519], length 4
00:01:36.295622 IP 10.0.0.6.1883 > 10.0.0.8.45094: Flags [P.], seq 2512235802:2512235806, ack 3391597147, win 85, options [nop,nop,TS val 3793142041 ecr 1097847522], length 4
00:01:37.296017 IP 10.0.0.6.1883 > 10.0.0.8.45094: Flags [P.], seq 2512235806:2512235810, ack 3391597542, win 85, options [nop,nop,TS val 3793143041 ecr 1097848521], length 4
00:01:37.344879 IP 10.0.0.6.1883 > 10.0.0.8.45094: Flags [P.], seq 2512235810:2512235814, ack 3391597546, win 85, options [nop,nop,TS val 3793143090 ecr 1097848571], length 4
00:01:38.350135 IP 10.0.0.6.1883 > 10.0.0.8.45094: Flags [P.], seq 2512235814:2512235818, ack 3391597941, win 85, options [nop,nop,TS val 3793144095 ecr 1097849575], length 4
00:01:38.353240 IP 10.0.0.6.1883 > 10.0.0.8.45094: Flags [P.], seq 2512235818:2512235822, ack 3391597945, win 85, options [nop,nop,TS val 3793144098 ecr 1097849580], length 4
00:01:39.352125 IP 10.0.0.6.1883 > 10.0.0.8.45094: Flags [P.], seq 2512235822:2512235826, ack 3391598340, win 85, options [nop,nop,TS val 3793145097 ecr 1097850578], length 4
00:01:39.354851 IP 10.0.0.6.1883 > 10.0.0.8.45094: Flags [P.], seq 2512235826:2512235830, ack 3391598344, win 85, options [nop,nop,TS val 3793145100 ecr 1097850580], length 4
00:01:40.357107 IP 10.0.0.6.1883 > 10.0.0.8.45094: Flags [P.], seq 2512235830:2512235834, ack 3391598739, win 85, options [nop,nop,TS val 3793146102 ecr 1097851583], length 4
00:01:40.358771 IP 10.0.0.6.1883 > 10.0.0.8.45094: Flags [P.], seq 2512235834:2512235838, ack 3391598743, win 85, options [nop,nop,TS val 3793146104 ecr 1097851585], length 4
00:01:41.032756 IP 10.0.0.6.1883 > 10.0.0.8.45094: Flags [P.], seq 2512235838:2512235840, ack 3391598745, win 85, options [nop,nop,TS val 3793146778 ecr 1097852259], length 2
00:01:41.358351 IP 10.0.0.6.1883 > 10.0.0.8.45094: Flags [P.], seq 2512235840:2512235844, ack 3391599140, win 85, options [nop,nop,TS val 3793147104 ecr 1097852585], length 4
00:01:41.360046 IP 10.0.0.6.1883 > 10.0.0.8.45094: Flags [P.], seq 2512235844:2512235848, ack 3391599144, win 85, options [nop,nop,TS val 3793147105 ecr 1097852586], length 4
00:01:42.359976 IP 10.0.0.6.1883 > 10.0.0.8.45094: Flags [P.], seq 2512235848:2512235852, ack 3391599539, win 85, options [nop,nop,TS val 3793148105 ecr 1097853586], length 4
00:01:42.361222 IP 10.0.0.6.1883 > 10.0.0.8.45094: Flags [P.], seq 2512235852:2512235856, ack 3391599543, win 85, options [nop,nop,TS val 3793148106 ecr 1097853588], length 4
00:01:43.361801 IP 10.0.0.6.1883 > 10.0.0.8.45094: Flags [P.], seq 2512235856:2512235860, ack 3391599938, win 85, options [nop,nop,TS val 3793149107 ecr 1097854588], length 4
00:01:43.363934 IP 10.0.0.6.1883 > 10.0.0.8.45094: Flags [P.], seq 2512235860:2512235864, ack 3391599942, win 85, options [nop,nop,TS val 3793149109 ecr 1097854590], length 4
00:01:44.362312 IP 10.0.0.6.1883 > 10.0.0.8.45094: Flags [P.], seq 2512235864:2512235868, ack 3391600337, win 85, options [nop,nop,TS val 3793150108 ecr 1097855589], length 4
00:01:44.362802 IP 10.0.0.6.1883 > 10.0.0.8.45094: Flags [P.], seq 2512235868:2512235872, ack 3391600341, win 85, options [nop,nop,TS val 3793150108 ecr 1097855590], length 4
00:01:45.364309 IP 10.0.0.6.1883 > 10.0.0.8.45094: Flags [P.], seq 2512235872:2512235876, ack 3391600736, win 85, options [nop,nop,TS val 3793151110 ecr 1097856591], length 4
00:01:45.365859 IP 10.0.0.6.1883 > 10.0.0.8.45094: Flags [P.], seq 2512235876:2512235880, ack 3391600740, win 85, options [nop,nop,TS val 3793151111 ecr 1097856593], length 4
00:01:46.034785 IP 10.0.0.6.1883 > 10.0.0.8.45094: Flags [P.], seq 2512235880:2512235882, ack 3391600742, win 85, options [nop,nop,TS val 3793151780 ecr 1097857261], length 2
00:01:46.366010 IP 10.0.0.6.1883 > 10.0.0.8.45094: Flags [P.], seq 2512235882:2512235886, ack 3391601137, win 85, options [nop,nop,TS val 3793152111 ecr 1097857592], length 4
00:01:46.367362 IP 10.0.0.6.1883 > 10.0.0.8.45094: Flags [P.], seq 2512235886:2512235890, ack 3391601141, win 85, options [nop,nop,TS val 3793152113 ecr 1097857594], length 4
00:01:47.368638 IP 10.0.0.6.1883 > 10.0.0.8.45094: Flags [P.], seq 2512235890:2512235894, ack 3391601536, win 85, options [nop,nop,TS val 3793153114 ecr 1097858593], length 4
00:01:47.369490 IP 10.0.0.6.1883 > 10.0.0.8.45094: Flags [P.], seq 2512235894:2512235898, ack 3391601540, win 85, options [nop,nop,TS val 3793153115 ecr 1097858596], length 4
00:01:48.368476 IP 10.0.0.6.1883 > 10.0.0.8.45094: Flags [P.], seq 2512235898:2512235902, ack 3391601935, win 85, options [nop,nop,TS val 3793154114 ecr 1097859594], length 4
00:01:48.371561 IP 10.0.0.6.1883 > 10.0.0.8.45094: Flags [P.], seq 2512235902:2512235906, ack 3391601939, win 85, options [nop,nop,TS val 3793154117 ecr 1097859597], length 4
00:01:49.369037 IP 10.0.0.6.1883 > 10.0.0.8.45094: Flags [P.], seq 2512235906:2512235910, ack 3391602334, win 85, options [nop,nop,TS val 3793155114 ecr 1097860596], length 4
00:01:49.369607 IP 10.0.0.6.1883 > 10.0.0.8.45094: Flags [P.], seq 2512235910:2512235914, ack 3391602338, win 85, options [nop,nop,TS val 3793155115 ecr 1097860597], length 4
00:01:50.371557 IP 10.0.0.6.1883 > 10.0.0.8.45094: Flags [P.], seq 2512235914:2512235918, ack 3391602733, win 85, options [nop,nop,TS val 3793156117 ecr 1097861597], length 4
00:01:50.372688 IP 10.0.0.6.1883 > 10.0.0.8.45094: Flags [P.], seq 2512235918:2512235922, ack 3391602737, win 85, options [nop,nop,TS val 3793156118 ecr 1097861600], length 4
00:01:51.037136 IP 10.0.0.6.1883 > 10.0.0.8.45094: Flags [P.], seq 2512235922:2512235924, ack 3391602739, win 85, options [nop,nop,TS val 3793156782 ecr 1097862264], length 2
00:01:52.327357 IP 10.0.0.6.1883 > 10.0.0.8.45094: Flags [F.], seq 2512235924, ack 3391602740, win 85, options [nop,nop,TS val 3793158072 ecr 1097863553], length 0