 00:00:00.000000 ARP, Request who-has 10.0.0.6 tell 10.0.0.11, length 28
 00:00:00.020278 ARP, Reply 10.0.0.6 is-at f6:e5:7c:ac:90:a1, length 28
 00:00:00.175712 IP 10.0.0.11.33524 > 10.0.0.6.1883: Flags [S], seq 3664464586, win 42340, options [mss 1460,sackOK,TS val 3459724218 ecr 0,nop,wscale 9], length 0
 00:00:00.196166 IP 10.0.0.6.1883 > 10.0.0.11.33524: Flags [S.], seq 2935243003, ack 3664464587, win 43440, options [mss 1460,sackOK,TS val 2016598441 ecr 3459724218,nop,wscale 9], length 0
 00:00:00.331139 IP 10.0.0.11.33524 > 10.0.0.6.1883: Flags [.], ack 2935243004, win 83, options [nop,nop,TS val 3459724572 ecr 2016598441], length 0
 00:00:00.331142 IP 10.0.0.11.33524 > 10.0.0.6.1883: Flags [P.], seq 3664464587:3664464607, ack 2935243004, win 83, options [nop,nop,TS val 3459724572 ecr 2016598441], length 20
 00:00:00.351742 IP 10.0.0.6.1883 > 10.0.0.11.33524: Flags [.], ack 3664464607, win 85, options [nop,nop,TS val 2016598597 ecr 3459724572], length 0
 00:00:00.352405 IP 10.0.0.6.1883 > 10.0.0.11.33524: Flags [P.], seq 2935243004:2935243008, ack 3664464607, win 85, options [nop,nop,TS val 2016598598 ecr 3459724572], length 4
 00:00:00.458013 IP 10.0.0.11.33524 > 10.0.0.6.1883: Flags [.], ack 2935243008, win 83, options [nop,nop,TS val 3459724701 ecr 2016598598], length 0
 00:00:00.458018 IP 10.0.0.11.33524 > 10.0.0.6.1883: Flags [P.], seq 3664464607:3664464671, ack 2935243008, win 83, options [nop,nop,TS val 3459724702 ecr 2016598598], length 64
 00:00:00.480331 IP 10.0.0.6.1883 > 10.0.0.11.33524: Flags [P.], seq 2935243008:2935243073, ack 3664464671, win 85, options [nop,nop,TS val 2016598724 ecr 3459724702], length 65
 00:00:00.598673 IP 10.0.0.11.33524 > 10.0.0.6.1883: Flags [P.], seq 3664464671:3664465066, ack 2935243073, win 83, options [nop,nop,TS val 3459724840 ecr 2016598724], length 395
 00:00:00.618947 IP 10.0.0.6.1883 > 10.0.0.11.33524: Flags [P.], seq 2935243073:2935243078, ack 3664465066, win 85, options [nop,nop,TS val 2016598864 ecr 3459724840], length 5
 00:00:00.766650 IP 10.0.0.11.33524 > 10.0.0.6.1883: Flags [.], ack 2935243078, win 83, options [nop,nop,TS val 3459725008 ecr 2016598864], length 0
 00:00:00.790634 IP 10.0.0.6.1883 > 10.0.0.11.33524: Flags [P.], seq 2935243078:2935243082, ack 3664465066, win 85, options [nop,nop,TS val 2016599032 ecr 3459725008], length 4
 00:00:00.891956 IP 10.0.0.11.33524 > 10.0.0.6.1883: Flags [.], ack 2935243082, win 83, options [nop,nop,TS val 3459725137 ecr 2016599032], length 0
 00:00:00.891960 IP 10.0.0.11.33524 > 10.0.0.6.1883: Flags [P.], seq 3664465066:3664465070, ack 2935243082, win 83, options [nop,nop,TS val 3459725137 ecr 2016599032], length 4
 00:00:00.912793 IP 10.0.0.6.1883 > 10.0.0.11.33524: Flags [P.], seq 2935243082:2935243086, ack 3664465070, win 85, options [nop,nop,TS val 2016599158 ecr 3459725137], length 4
 00:00:01.013889 IP 10.0.0.11.33524 > 10.0.0.6.1883: Flags [P.], seq 3664465070:3664465465, ack 2935243086, win 83, options [nop,nop,TS val 3459725259 ecr 2016599158], length 395
 00:00:01.034955 IP 10.0.0.6.1883 > 10.0.0.11.33524: Flags [P.], seq 2935243086:2935243090, ack 3664465465, win 85, options [nop,nop,TS val 2016599280 ecr 3459725259], length 4
 00:00:01.142247 IP 10.0.0.11.33524 > 10.0.0.6.1883: Flags [P.], seq 3664465465:3664465469, ack 2935243090, win 83, options [nop,nop,TS val 3459725387 ecr 2016599280], length 4
 00:00:01.162783 IP 10.0.0.6.1883 > 10.0.0.11.33524: Flags [P.], seq 2935243090:2935243094, ack 3664465469, win 85, options [nop,nop,TS val 2016599408 ecr 3459725387], length 4
 00:00:01.546466 IP 10.0.0.11.33524 > 10.0.0.6.1883: Flags [.], ack 2935243094, win 83, options [nop,nop,TS val 3459725552 ecr 2016599408], length 0
 00:00:02.011344 IP 10.0.0.11.33524 > 10.0.0.6.1883: Flags [P.], seq 3664465469:3664465864, ack 2935243094, win 83, options [nop,nop,TS val 3459726256 ecr 2016599408], length 395
 00:00:02.035006 IP 10.0.0.6.1883 > 10.0.0.11.33524: Flags [P.], seq 2935243094:2935243098, ack 3664465864, win 85, options [nop,nop,TS val 2016600278 ecr 3459726256], length 4
 00:00:02.136740 IP 10.0.0.11.33524 > 10.0.0.6.1883: Flags [.], ack 2935243098, win 83, options [nop,nop,TS val 3459726381 ecr 2016600278], length 0
 00:00:02.136745 IP 10.0.0.11.33524 > 10.0.0.6.1883: Flags [P.], seq 3664465864:3664465868, ack 2935243098, win 83, options [nop,nop,TS val 3459726382 ecr 2016600278], length 4
 00:00:02.157238 IP 10.0.0.6.1883 > 10.0.0.11.33524: Flags [P.], seq 2935243098:2935243102, ack 3664465868, win 85, options [nop,nop,TS val 2016600403 ecr 3459726382], length 4
 00:00:02.654181 IP 10.0.0.11.33524 > 10.0.0.6.1883: Flags [.], ack 2935243102, win 83, options [nop,nop,TS val 3459726548 ecr 2016600403], length 0
 00:00:03.014859 IP 10.0.0.11.33524 > 10.0.0.6.1883: Flags [P.], seq 3664465868:3664466263, ack 2935243102, win 83, options [nop,nop,TS val 3459727260 ecr 2016600403], length 395
 00:00:03.035832 IP 10.0.0.6.1883 > 10.0.0.11.33524: Flags [P.], seq 2935243102:2935243106, ack 3664466263, win 85, options [nop,nop,TS val 2016601281 ecr 3459727260], length 4
 00:00:03.141553 IP 10.0.0.11.33524 > 10.0.0.6.1883: Flags [.], ack 2935243106, win 83, options [nop,nop,TS val 3459727385 ecr 2016601281], length 0
 00:00:03.141561 IP 10.0.0.11.33524 > 10.0.0.6.1883: Flags [P.], seq 3664466263:3664466267, ack 2935243106, win 83, options [nop,nop,TS val 3459727386 ecr 2016601281], length 4
 00:00:03.162256 IP 10.0.0.6.1883 > 10.0.0.11.33524: Flags [P.], seq 2935243106:2935243110, ack 3664466267, win 85, options [nop,nop,TS val 2016601407 ecr 3459727386], length 4
 00:00:03.690262 IP 10.0.0.11.33524 > 10.0.0.6.1883: Flags [.], ack 2935243110, win 83, options [nop,nop,TS val 3459727552 ecr 2016601407], length 0
 00:00:04.032685 IP 10.0.0.11.33524 > 10.0.0.6.1883: Flags [P.], seq 3664466267:3664466662, ack 2935243110, win 83, options [nop,nop,TS val 3459728276 ecr 2016601407], length 395
 00:00:04.053510 IP 10.0.0.6.1883 > 10.0.0.11.33524: Flags [P.], seq 2935243110:2935243114, ack 3664466662, win 85, options [nop,nop,TS val 2016602299 ecr 3459728276], length 4
 00:00:04.163529 IP 10.0.0.11.33524 > 10.0.0.6.1883: Flags [.], ack 2935243114, win 83, options [nop,nop,TS val 3459728400 ecr 2016602299], length 0
 00:00:04.163533 IP 10.0.0.11.33524 > 10.0.0.6.1883: Flags [P.], seq 3664466662:3664466666, ack 2935243114, win 83, options [nop,nop,TS val 3459728401 ecr 2016602299], length 4
 00:00:04.183958 IP 10.0.0.6.1883 > 10.0.0.11.33524: Flags [P.], seq 2935243114:2935243118, ack 3664466666, win 85, options [nop,nop,TS val 2016602429 ecr 3459728401], length 4
 00:00:04.335637 IP 10.0.0.11.33524 > 10.0.0.6.1883: Flags [.], ack 2935243118, win 83, options [nop,nop,TS val 3459728578 ecr 2016602429], length 0
 00:00:05.034879 IP 10.0.0.11.33524 > 10.0.0.6.1883: Flags [P.], seq 3664466666:3664467061, ack 2935243118, win 83, options [nop,nop,TS val 3459729278 ecr 2016602429], length 395
 00:00:05.055927 IP 10.0.0.6.1883 > 10.0.0.11.33524: Flags [P.], seq 2935243118:2935243122, ack 3664467061, win 85, options [nop,nop,TS val 2016603301 ecr 3459729278], length 4
 00:00:05.168912 IP 10.0.0.11.33524 > 10.0.0.6.1883: Flags [.], ack 2935243122, win 83, options [nop,nop,TS val 3459729402 ecr 2016603301], length 0
 00:00:05.168917 IP 10.0.0.11.33524 > 10.0.0.6.1883: Flags [P.], seq 3664467061:3664467065, ack 2935243122, win 83, options [nop,nop,TS val 3459729402 ecr 2016603301], length 4
 00:00:05.191946 IP 10.0.0.6.1883 > 10.0.0.11.33524: Flags [P.], seq 2935243122:2935243126, ack 3664467065, win 85, options [nop,nop,TS val 2016603435 ecr 3459729402], length 4
 00:00:05.335215 IP 10.0.0.11.33524 > 10.0.0.6.1883: Flags [.], ack 2935243126, win 83, options [nop,nop,TS val 3459729580 ecr 2016603435], length 0
 00:00:05.463646 IP 10.0.0.11.33524 > 10.0.0.6.1883: Flags [P.], seq 3664467065:3664467067, ack 2935243126, win 83, options [nop,nop,TS val 3459729703 ecr 2016603435], length 2
 00:00:05.484305 IP 10.0.0.6.1883 > 10.0.0.11.33524: Flags [P.], seq 2935243126:2935243128, ack 3664467067, win 85, options [nop,nop,TS val 2016603729 ecr 3459729703], length 2
 00:00:05.585982 IP 10.0.0.11.33524 > 10.0.0.6.1883: Flags [.], ack 2935243128, win 83, options [nop,nop,TS val 3459729831 ecr 2016603729], length 0
 00:00:06.034382 IP 10.0.0.11.33524 > 10.0.0.6.1883: Flags [P.], seq 3664467067:3664467462, ack 2935243128, win 83, options [nop,nop,TS val 3459730279 ecr 2016603729], length 395
 00:00:06.055438 IP 10.0.0.6.1883 > 10.0.0.11.33524: Flags [P.], seq 2935243128:2935243132, ack 3664467462, win 85, options [nop,nop,TS val 2016604301 ecr 3459730279], length 4
 00:00:06.156893 IP 10.0.0.11.33524 > 10.0.0.6.1883: Flags [.], ack 2935243132, win 83, options [nop,nop,TS val 3459730402 ecr 2016604301], length 0
 00:00:06.156897 IP 10.0.0.11.33524 > 10.0.0.6.1883: Flags [P.], seq 3664467462:3664467466, ack 2935243132, win 83, options [nop,nop,TS val 3459730402 ecr 2016604301], length 4
 00:00:06.177497 IP 10.0.0.6.1883 > 10.0.0.11.33524: Flags [P.], seq 2935243132:2935243136, ack 3664467466, win 85, options [nop,nop,TS val 2016604423 ecr 3459730402], length 4
 00:00:06.323000 IP 10.0.0.11.33524 > 10.0.0.6.1883: Flags [.], ack 2935243136, win 83, options [nop,nop,TS val 3459730568 ecr 2016604423], length 0
 00:00:07.038881 IP 10.0.0.11.33524 > 10.0.0.6.1883: Flags [P.], seq 3664467466:3664467861, ack 2935243136, win 83, options [nop,nop,TS val 3459731280 ecr 2016604423], length 395
 00:00:07.060003 IP 10.0.0.6.1883 > 10.0.0.11.33524: Flags [P.], seq 2935243136:2935243140, ack 3664467861, win 85, options [nop,nop,TS val 2016605305 ecr 3459731280], length 4
 00:00:07.162043 IP 10.0.0.11.33524 > 10.0.0.6.1883: Flags [.], ack 2935243140, win 83, options [nop,nop,TS val 3459731406 ecr 2016605305], length 0
 00:00:07.162047 IP 10.0.0.11.33524 > 10.0.0.6.1883: Flags [P.], seq 3664467861:3664467865, ack 2935243140, win 83, options [nop,nop,TS val 3459731407 ecr 2016605305], length 4
 00:00:07.182551 IP 10.0.0.6.1883 > 10.0.0.11.33524: Flags [P.], seq 2935243140:2935243144, ack 3664467865, win 85, options [nop,nop,TS val 2016605428 ecr 3459731407], length 4
 00:00:07.329358 IP 10.0.0.11.33524 > 10.0.0.6.1883: Flags [.], ack 2935243144, win 83, options [nop,nop,TS val 3459731572 ecr 2016605428], length 0
 00:00:08.036366 IP 10.0.0.11.33524 > 10.0.0.6.1883: Flags [P.], seq 3664467865:3664468260, ack 2935243144, win 83, options [nop,nop,TS val 3459732281 ecr 2016605428], length 395
 00:00:08.057665 IP 10.0.0.6.1883 > 10.0.0.11.33524: Flags [P.], seq 2935243144:2935243148, ack 3664468260, win 85, options [nop,nop,TS val 2016606303 ecr 3459732281], length 4
 00:00:08.159674 IP 10.0.0.11.33524 > 10.0.0.6.1883: Flags [.], ack 2935243148, win 83, options [nop,nop,TS val 3459732404 ecr 2016606303], length 0
 00:00:08.159678 IP 10.0.0.11.33524 > 10.0.0.6.1883: Flags [P.], seq 3664468260:3664468264, ack 2935243148, win 83, options [nop,nop,TS val 3459732404 ecr 2016606303], length 4
 00:00:08.180236 IP 10.0.0.6.1883 > 10.0.0.11.33524: Flags [P.], seq 2935243148:2935243152, ack 3664468264, win 85, options [nop,nop,TS val 2016606425 ecr 3459732404], length 4
 00:00:08.323216 IP 10.0.0.11.33524 > 10.0.0.6.1883: Flags [.], ack 2935243152, win 83, options [nop,nop,TS val 3459732568 ecr 2016606425], length 0
 00:00:09.037901 IP 10.0.0.11.33524 > 10.0.0.6.1883: Flags [P.], seq 3664468264:3664468659, ack 2935243152, win 83, options [nop,nop,TS val 3459733283 ecr 2016606425], length 395
 00:00:09.059010 IP 10.0.0.6.1883 > 10.0.0.11.33524: Flags [P.], seq 2935243152:2935243156, ack 3664468659, win 85, options [nop,nop,TS val 2016607304 ecr 3459733283], length 4
 00:00:09.175349 IP 10.0.0.11.33524 > 10.0.0.6.1883: Flags [.], ack 2935243156, win 83, options [nop,nop,TS val 3459733405 ecr 2016607304], length 0
 00:00:09.175353 IP 10.0.0.11.33524 > 10.0.0.6.1883: Flags [P.], seq 3664468659:3664468663, ack 2935243156, win 83, options [nop,nop,TS val 3459733405 ecr 2016607304], length 4
 00:00:09.198088 IP 10.0.0.6.1883 > 10.0.0.11.33524: Flags [P.], seq 2935243156:2935243160, ack 3664468663, win 85, options [nop,nop,TS val 2016607441 ecr 3459733405], length 4
 00:00:09.343184 IP 10.0.0.11.33524 > 10.0.0.6.1883: Flags [.], ack 2935243160, win 83, options [nop,nop,TS val 3459733588 ecr 2016607441], length 0
 00:00:10.038996 IP 10.0.0.11.33524 > 10.0.0.6.1883: Flags [P.], seq 3664468663:3664469058, ack 2935243160, win 83, options [nop,nop,TS val 3459734284 ecr 2016607441], length 395
 00:00:10.059990 IP 10.0.0.6.1883 > 10.0.0.11.33524: Flags [P.], seq 2935243160:2935243164, ack 3664469058, win 85, options [nop,nop,TS val 2016608305 ecr 3459734284], length 4
 00:00:10.173670 IP 10.0.0.11.33524 > 10.0.0.6.1883: Flags [.], ack 2935243164, win 83, options [nop,nop,TS val 3459734406 ecr 2016608305], length 0
 00:00:10.173674 IP 10.0.0.11.33524 > 10.0.0.6.1883: Flags [P.], seq 3664469058:3664469062, ack 2935243164, win 83, options [nop,nop,TS val 3459734407 ecr 2016608305], length 4
 00:00:10.199273 IP 10.0.0.6.1883 > 10.0.0.11.33524: Flags [P.], seq 2935243164:2935243168, ack 3664469062, win 85, options [nop,nop,TS val 2016608439 ecr 3459734407], length 4
 00:00:10.342929 IP 10.0.0.11.33524 > 10.0.0.6.1883: Flags [.], ack 2935243168, win 83, options [nop,nop,TS val 3459734588 ecr 2016608439], length 0
 00:00:10.470498 IP 10.0.0.11.33524 > 10.0.0.6.1883: Flags [P.], seq 3664469062:3664469064, ack 2935243168, win 83, options [nop,nop,TS val 3459734704 ecr 2016608439], length 2
 00:00:10.490848 IP 10.0.0.6.1883 > 10.0.0.11.33524: Flags [P.], seq 2935243168:2935243170, ack 3664469064, win 85, options [nop,nop,TS val 2016608736 ecr 3459734704], length 2
 00:00:10.592507 IP 10.0.0.11.33524 > 10.0.0.6.1883: Flags [.], ack 2935243170, win 83, options [nop,nop,TS val 3459734837 ecr 2016608736], length 0
 00:00:11.040348 IP 10.0.0.11.33524 > 10.0.0.6.1883: Flags [P.], seq 3664469064:3664469459, ack 2935243170, win 83, options [nop,nop,TS val 3459735285 ecr 2016608736], length 395
 00:00:11.061451 IP 10.0.0.6.1883 > 10.0.0.11.33524: Flags [P.], seq 2935243170:2935243174, ack 3664469459, win 85, options [nop,nop,TS val 2016609307 ecr 3459735285], length 4
 00:00:11.162884 IP 10.0.0.11.33524 > 10.0.0.6.1883: Flags [.], ack 2935243174, win 83, options [nop,nop,TS val 3459735408 ecr 2016609307], length 0
 00:00:11.162888 IP 10.0.0.11.33524 > 10.0.0.6.1883: Flags [P.], seq 3664469459:3664469463, ack 2935243174, win 83, options [nop,nop,TS val 3459735408 ecr 2016609307], length 4
 00:00:11.183458 IP 10.0.0.6.1883 > 10.0.0.11.33524: Flags [P.], seq 2935243174:2935243178, ack 3664469463, win 85, options [nop,nop,TS val 2016609429 ecr 3459735408], length 4
 00:00:11.326881 IP 10.0.0.11.33524 > 10.0.0.6.1883: Flags [.], ack 2935243178, win 83, options [nop,nop,TS val 3459735572 ecr 2016609429], length 0
 00:00:12.041820 IP 10.0.0.11.33524 > 10.0.0.6.1883: Flags [P.], seq 3664469463:3664469858, ack 2935243178, win 83, options [nop,nop,TS val 3459736287 ecr 2016609429], length 395
 00:00:12.062977 IP 10.0.0.6.1883 > 10.0.0.11.33524: Flags [P.], seq 2935243178:2935243182, ack 3664469858, win 85, options [nop,nop,TS val 2016610308 ecr 3459736287], length 4
 00:00:12.164382 IP 10.0.0.11.33524 > 10.0.0.6.1883: Flags [.], ack 2935243182, win 83, options [nop,nop,TS val 3459736409 ecr 2016610308], length 0
 00:00:12.164385 IP 10.0.0.11.33524 > 10.0.0.6.1883: Flags [P.], seq 3664469858:3664469862, ack 2935243182, win 83, options [nop,nop,TS val 3459736409 ecr 2016610308], length 4
 00:00:12.184775 IP 10.0.0.6.1883 > 10.0.0.11.33524: Flags [P.], seq 2935243182:2935243186, ack 3664469862, win 85, options [nop,nop,TS val 2016610430 ecr 3459736409], length 4
 00:00:12.327142 IP 10.0.0.11.33524 > 10.0.0.6.1883: Flags [.], ack 2935243186, win 83, options [nop,nop,TS val 3459736572 ecr 2016610430], length 0
 00:00:13.043245 IP 10.0.0.11.33524 > 10.0.0.6.1883: Flags [P.], seq 3664469862:3664470257, ack 2935243186, win 83, options [nop,nop,TS val 3459737288 ecr 2016610430], length 395
 00:00:13.064196 IP 10.0.0.6.1883 > 10.0.0.11.33524: Flags [P.], seq 2935243186:2935243190, ack 3664470257, win 85, options [nop,nop,TS val 2016611310 ecr 3459737288], length 4
 00:00:13.168662 IP 10.0.0.11.33524 > 10.0.0.6.1883: Flags [.], ack 2935243190, win 83, options [nop,nop,TS val 3459737410 ecr 2016611310], length 0
 00:00:13.168666 IP 10.0.0.11.33524 > 10.0.0.6.1883: Flags [P.], seq 3664470257:3664470261, ack 2935243190, win 83, options [nop,nop,TS val 3459737410 ecr 2016611310], length 4
 00:00:13.189387 IP 10.0.0.6.1883 > 10.0.0.11.33524: Flags [P.], seq 2935243190:2935243194, ack 3664470261, win 85, options [nop,nop,TS val 2016611434 ecr 3459737410], length 4
 00:00:13.334641 IP 10.0.0.11.33524 > 10.0.0.6.1883: Flags [.], ack 2935243194, win 83, options [nop,nop,TS val 3459737580 ecr 2016611434], length 0
 00:00:14.044333 IP 10.0.0.11.33524 > 10.0.0.6.1883: Flags [P.], seq 3664470261:3664470656, ack 2935243194, win 83, options [nop,nop,TS val 3459738289 ecr 2016611434], length 395
 00:00:14.065716 IP 10.0.0.6.1883 > 10.0.0.11.33524: Flags [P.], seq 2935243194:2935243198, ack 3664470656, win 85, options [nop,nop,TS val 2016612311 ecr 3459738289], length 4
 00:00:14.166989 IP 10.0.0.11.33524 > 10.0.0.6.1883: Flags [.], ack 2935243198, win 83, options [nop,nop,TS val 3459738412 ecr 2016612311], length 0
 00:00:14.166993 IP 10.0.0.11.33524 > 10.0.0.6.1883: Flags [P.], seq 3664470656:3664470660, ack 2935243198, win 83, options [nop,nop,TS val 3459738412 ecr 2016612311], length 4
 00:00:14.187394 IP 10.0.0.6.1883 > 10.0.0.11.33524: Flags [P.], seq 2935243198:2935243202, ack 3664470660, win 85, options [nop,nop,TS val 2016612433 ecr 3459738412], length 4
 00:00:14.343018 IP 10.0.0.11.33524 > 10.0.0.6.1883: Flags [.], ack 2935243202, win 83, options [nop,nop,TS val 3459738576 ecr 2016612433], length 0
 00:00:15.047003 IP 10.0.0.11.33524 > 10.0.0.6.1883: Flags [P.], seq 3664470660:3664471055, ack 2935243202, win 83, options [nop,nop,TS val 3459739290 ecr 2016612433], length 395
 00:00:15.068169 IP 10.0.0.6.1883 > 10.0.0.11.33524: Flags [P.], seq 2935243202:2935243206, ack 3664471055, win 85, options [nop,nop,TS val 2016613313 ecr 3459739290], length 4
 00:00:15.170174 IP 10.0.0.11.33524 > 10.0.0.6.1883: Flags [.], ack 2935243206, win 83, options [nop,nop,TS val 3459739414 ecr 2016613313], length 0
 00:00:15.170178 IP 10.0.0.11.33524 > 10.0.0.6.1883: Flags [P.], seq 3664471055:3664471059, ack 2935243206, win 83, options [nop,nop,TS val 3459739414 ecr 2016613313], length 4
 00:00:15.192841 IP 10.0.0.6.1883 > 10.0.0.11.33524: Flags [P.], seq 2935243206:2935243210, ack 3664471059, win 85, options [nop,nop,TS val 2016613436 ecr 3459739414], length 4
 00:00:15.336796 IP 10.0.0.11.33524 > 10.0.0.6.1883: Flags [.], ack 2935243210, win 83, options [nop,nop,TS val 3459739580 ecr 2016613436], length 0
 00:00:15.470275 IP 10.0.0.11.33524 > 10.0.0.6.1883: Flags [P.], seq 3664471059:3664471061, ack 2935243210, win 83, options [nop,nop,TS val 3459739706 ecr 2016613436], length 2
 00:00:15.490724 IP 10.0.0.6.1883 > 10.0.0.11.33524: Flags [P.], seq 2935243210:2935243212, ack 3664471061, win 85, options [nop,nop,TS val 2016613736 ecr 3459739706], length 2
 00:00:15.592307 IP 10.0.0.11.33524 > 10.0.0.6.1883: Flags [.], ack 2935243212, win 83, options [nop,nop,TS val 3459739837 ecr 2016613736], length 0
 00:00:16.047516 IP 10.0.0.11.33524 > 10.0.0.6.1883: Flags [P.], seq 3664471061:3664471456, ack 2935243212, win 83, options [nop,nop,TS val 3459740291 ecr 2016613736], length 395
 00:00:16.068462 IP 10.0.0.6.1883 > 10.0.0.11.33524: Flags [P.], seq 2935243212:2935243216, ack 3664471456, win 85, options [nop,nop,TS val 2016614314 ecr 3459740291], length 4
 00:00:16.170292 IP 10.0.0.11.33524 > 10.0.0.6.1883: Flags [.], ack 2935243216, win 83, options [nop,nop,TS val 3459740415 ecr 2016614314], length 0
 00:00:16.170296 IP 10.0.0.11.33524 > 10.0.0.6.1883: Flags [P.], seq 3664471456:3664471460, ack 2935243216, win 83, options [nop,nop,TS val 3459740415 ecr 2016614314], length 4
 00:00:16.190753 IP 10.0.0.6.1883 > 10.0.0.11.33524: Flags [P.], seq 2935243216:2935243220, ack 3664471460, win 85, options [nop,nop,TS val 2016614436 ecr 3459740415], length 4
 00:00:16.335002 IP 10.0.0.11.33524 > 10.0.0.6.1883: Flags [.], ack 2935243220, win 83, options [nop,nop,TS val 3459740580 ecr 2016614436], length 0
 00:00:17.047558 IP 10.0.0.11.33524 > 10.0.0.6.1883: Flags [P.], seq 3664471460:3664471855, ack 2935243220, win 83, options [nop,nop,TS val 3459741292 ecr 2016614436], length 395
 00:00:17.068752 IP 10.0.0.6.1883 > 10.0.0.11.33524: Flags [P.], seq 2935243220:2935243224, ack 3664471855, win 85, options [nop,nop,TS val 2016615314 ecr 3459741292], length 4
 00:00:17.170650 IP 10.0.0.11.33524 > 10.0.0.6.1883: Flags [.], ack 2935243224, win 83, options [nop,nop,TS val 3459741415 ecr 2016615314], length 0
 00:00:17.170654 IP 10.0.0.11.33524 > 10.0.0.6.1883: Flags [P.], seq 3664471855:3664471859, ack 2935243224, win 83, options [nop,nop,TS val 3459741415 ecr 2016615314], length 4
 00:00:17.191143 IP 10.0.0.6.1883 > 10.0.0.11.33524: Flags [P.], seq 2935243224:2935243228, ack 3664471859, win 85, options [nop,nop,TS val 2016615436 ecr 3459741415], length 4
 00:00:17.334972 IP 10.0.0.11.33524 > 10.0.0.6.1883: Flags [.], ack 2935243228, win 83, options [nop,nop,TS val 3459741580 ecr 2016615436], length 0
 00:00:18.066732 IP 10.0.0.11.33524 > 10.0.0.6.1883: Flags [P.], seq 3664471859:3664472254, ack 2935243228, win 83, options [nop,nop,TS val 3459742311 ecr 2016615436], length 395
 00:00:18.087791 IP 10.0.0.6.1883 > 10.0.0.11.33524: Flags [P.], seq 2935243228:2935243232, ack 3664472254, win 85, options [nop,nop,TS val 2016616333 ecr 3459742311], length 4
 00:00:18.189614 IP 10.0.0.11.33524 > 10.0.0.6.1883: Flags [.], ack 2935243232, win 83, options [nop,nop,TS val 3459742434 ecr 2016616333], length 0
 00:00:18.189618 IP 10.0.0.11.33524 > 10.0.0.6.1883: Flags [P.], seq 3664472254:3664472258, ack 2935243232, win 83, options [nop,nop,TS val 3459742434 ecr 2016616333], length 4
 00:00:18.210152 IP 10.0.0.6.1883 > 10.0.0.11.33524: Flags [P.], seq 2935243232:2935243236, ack 3664472258, win 85, options [nop,nop,TS val 2016616455 ecr 3459742434], length 4
 00:00:18.355187 IP 10.0.0.11.33524 > 10.0.0.6.1883: Flags [.], ack 2935243236, win 83, options [nop,nop,TS val 3459742600 ecr 2016616455], length 0
 00:00:19.067543 IP 10.0.0.11.33524 > 10.0.0.6.1883: Flags [P.], seq 3664472258:3664472653, ack 2935243236, win 83, options [nop,nop,TS val 3459743313 ecr 2016616455], length 395
 00:00:19.088390 IP 10.0.0.6.1883 > 10.0.0.11.33524: Flags [P.], seq 2935243236:2935243240, ack 3664472653, win 85, options [nop,nop,TS val 2016617334 ecr 3459743313], length 4
 00:00:19.192963 IP 10.0.0.11.33524 > 10.0.0.6.1883: Flags [.], ack 2935243240, win 83, options [nop,nop,TS val 3459743435 ecr 2016617334], length 0
 00:00:19.192969 IP 10.0.0.11.33524 > 10.0.0.6.1883: Flags [P.], seq 3664472653:3664472657, ack 2935243240, win 83, options [nop,nop,TS val 3459743435 ecr 2016617334], length 4
 00:00:19.213497 IP 10.0.0.6.1883 > 10.0.0.11.33524: Flags [P.], seq 2935243240:2935243244, ack 3664472657, win 85, options [nop,nop,TS val 2016617459 ecr 3459743435], length 4
 00:00:19.363462 IP 10.0.0.11.33524 > 10.0.0.6.1883: Flags [.], ack 2935243244, win 83, options [nop,nop,TS val 3459743600 ecr 2016617459], length 0
 00:00:20.069227 IP 10.0.0.11.33524 > 10.0.0.6.1883: Flags [P.], seq 3664472657:3664473052, ack 2935243244, win 83, options [nop,nop,TS val 3459744314 ecr 2016617459], length 395
 00:00:20.090140 IP 10.0.0.6.1883 > 10.0.0.11.33524: Flags [P.], seq 2935243244:2935243248, ack 3664473052, win 85, options [nop,nop,TS val 2016618336 ecr 3459744314], length 4
 00:00:20.191289 IP 10.0.0.11.33524 > 10.0.0.6.1883: Flags [.], ack 2935243248, win 83, options [nop,nop,TS val 3459744436 ecr 2016618336], length 0
 00:00:20.191301 IP 10.0.0.11.33524 > 10.0.0.6.1883: Flags [P.], seq 3664473052:3664473056, ack 2935243248, win 83, options [nop,nop,TS val 3459744436 ecr 2016618336], length 4
 00:00:20.214784 IP 10.0.0.6.1883 > 10.0.0.11.33524: Flags [P.], seq 2935243248:2935243252, ack 3664473056, win 85, options [nop,nop,TS val 2016618457 ecr 3459744436], length 4
 00:00:20.358896 IP 10.0.0.11.33524 > 10.0.0.6.1883: Flags [.], ack 2935243252, win 83, options [nop,nop,TS val 3459744604 ecr 2016618457], length 0
 00:00:20.468719 IP 10.0.0.11.33524 > 10.0.0.6.1883: Flags [P.], seq 3664473056:3664473058, ack 2935243252, win 83, options [nop,nop,TS val 3459744707 ecr 2016618457], length 2
 00:00:20.489375 IP 10.0.0.6.1883 > 10.0.0.11.33524: Flags [P.], seq 2935243252:2935243254, ack 3664473058, win 85, options [nop,nop,TS val 2016618735 ecr 3459744707], length 2
 00:00:20.590967 IP 10.0.0.11.33524 > 10.0.0.6.1883: Flags [.], ack 2935243254, win 83, options [nop,nop,TS val 3459744836 ecr 2016618735], length 0
 00:00:21.069911 IP 10.0.0.11.33524 > 10.0.0.6.1883: Flags [P.], seq 3664473058:3664473453, ack 2935243254, win 83, options [nop,nop,TS val 3459745315 ecr 2016618735], length 395
 00:00:21.091218 IP 10.0.0.6.1883 > 10.0.0.11.33524: Flags [P.], seq 2935243254:2935243258, ack 3664473453, win 85, options [nop,nop,TS val 2016619337 ecr 3459745315], length 4
 00:00:21.194791 IP 10.0.0.11.33524 > 10.0.0.6.1883: Flags [.], ack 2935243258, win 83, options [nop,nop,TS val 3459745438 ecr 2016619337], length 0
 00:00:21.194795 IP 10.0.0.11.33524 > 10.0.0.6.1883: Flags [P.], seq 3664473453:3664473457, ack 2935243258, win 83, options [nop,nop,TS val 3459745438 ecr 2016619337], length 4
 00:00:21.215270 IP 10.0.0.6.1883 > 10.0.0.11.33524: Flags [P.], seq 2935243258:2935243262, ack 3664473457, win 85, options [nop,nop,TS val 2016619461 ecr 3459745438], length 4
 00:00:21.359304 IP 10.0.0.11.33524 > 10.0.0.6.1883: Flags [.], ack 2935243262, win 83, options [nop,nop,TS val 3459745604 ecr 2016619461], length 0
 00:00:22.074507 IP 10.0.0.11.33524 > 10.0.0.6.1883: Flags [P.], seq 3664473457:3664473852, ack 2935243262, win 83, options [nop,nop,TS val 3459746316 ecr 2016619461], length 395
 00:00:22.095688 IP 10.0.0.6.1883 > 10.0.0.11.33524: Flags [P.], seq 2935243262:2935243266, ack 3664473852, win 85, options [nop,nop,TS val 2016620341 ecr 3459746316], length 4
 00:00:22.197335 IP 10.0.0.11.33524 > 10.0.0.6.1883: Flags [.], ack 2935243266, win 83, options [nop,nop,TS val 3459746442 ecr 2016620341], length 0
 00:00:22.197339 IP 10.0.0.11.33524 > 10.0.0.6.1883: Flags [P.], seq 3664473852:3664473856, ack 2935243266, win 83, options [nop,nop,TS val 3459746442 ecr 2016620341], length 4
 00:00:22.217827 IP 10.0.0.6.1883 > 10.0.0.11.33524: Flags [P.], seq 2935243266:2935243270, ack 3664473856, win 85, options [nop,nop,TS val 2016620463 ecr 3459746442], length 4
 00:00:22.363128 IP 10.0.0.11.33524 > 10.0.0.6.1883: Flags [.], ack 2935243270, win 83, options [nop,nop,TS val 3459746608 ecr 2016620463], length 0
 00:00:23.073060 IP 10.0.0.11.33524 > 10.0.0.6.1883: Flags [P.], seq 3664473856:3664474251, ack 2935243270, win 83, options [nop,nop,TS val 3459747318 ecr 2016620463], length 395
 00:00:23.094128 IP 10.0.0.6.1883 > 10.0.0.11.33524: Flags [P.], seq 2935243270:2935243274, ack 3664474251, win 85, options [nop,nop,TS val 2016621340 ecr 3459747318], length 4
 00:00:23.196279 IP 10.0.0.11.33524 > 10.0.0.6.1883: Flags [.], ack 2935243274, win 83, options [nop,nop,TS val 3459747440 ecr 2016621340], length 0
 00:00:23.196284 IP 10.0.0.11.33524 > 10.0.0.6.1883: Flags [P.], seq 3664474251:3664474255, ack 2935243274, win 83, options [nop,nop,TS val 3459747440 ecr 2016621340], length 4
 00:00:23.216783 IP 10.0.0.6.1883 > 10.0.0.11.33524: Flags [P.], seq 2935243274:2935243278, ack 3664474255, win 85, options [nop,nop,TS val 2016621462 ecr 3459747440], length 4
 00:00:23.366010 IP 10.0.0.11.33524 > 10.0.0.6.1883: Flags [.], ack 2935243278, win 83, options [nop,nop,TS val 3459747604 ecr 2016621462], length 0
 00:00:24.028904 IP6 fe80::e4eb:c6ff:fe67:225e > ff02::2: ICMP6, router solicitation, length 16
 00:00:24.080745 IP 10.0.0.11.33524 > 10.0.0.6.1883: Flags [P.], seq 3664474255:3664474650, ack 2935243278, win 83, options [nop,nop,TS val 3459748320 ecr 2016621462], length 395
 00:00:24.101776 IP 10.0.0.6.1883 > 10.0.0.11.33524: Flags [P.], seq 2935243278:2935243282, ack 3664474650, win 85, options [nop,nop,TS val 2016622347 ecr 3459748320], length 4
 00:00:24.204527 IP 10.0.0.11.33524 > 10.0.0.6.1883: Flags [.], ack 2935243282, win 83, options [nop,nop,TS val 3459748449 ecr 2016622347], length 0
 00:00:24.204531 IP 10.0.0.11.33524 > 10.0.0.6.1883: Flags [P.], seq 3664474650:3664474654, ack 2935243282, win 83, options [nop,nop,TS val 3459748450 ecr 2016622347], length 4
 00:00:24.230618 IP 10.0.0.6.1883 > 10.0.0.11.33524: Flags [P.], seq 2935243282:2935243286, ack 3664474654, win 85, options [nop,nop,TS val 2016622470 ecr 3459748450], length 4
 00:00:24.375191 IP 10.0.0.11.33524 > 10.0.0.6.1883: Flags [.], ack 2935243286, win 83, options [nop,nop,TS val 3459748620 ecr 2016622470], length 0
 00:00:25.079142 IP 10.0.0.11.33524 > 10.0.0.6.1883: Flags [P.], seq 3664474654:3664475049, ack 2935243286, win 83, options [nop,nop,TS val 3459749324 ecr 2016622470], length 395
 00:00:25.102554 IP 10.0.0.6.1883 > 10.0.0.11.33524: Flags [P.], seq 2935243286:2935243290, ack 3664475049, win 85, options [nop,nop,TS val 2016623346 ecr 3459749324], length 4
 00:00:25.213357 IP 10.0.0.11.33524 > 10.0.0.6.1883: Flags [.], ack 2935243290, win 83, options [nop,nop,TS val 3459749458 ecr 2016623346], length 0
 00:00:25.213362 IP 10.0.0.11.33524 > 10.0.0.6.1883: Flags [P.], seq 3664475049:3664475053, ack 2935243290, win 83, options [nop,nop,TS val 3459749458 ecr 2016623346], length 4
 00:00:25.234304 IP 10.0.0.6.1883 > 10.0.0.11.33524: Flags [P.], seq 2935243290:2935243294, ack 3664475053, win 85, options [nop,nop,TS val 2016623479 ecr 3459749458], length 4
 00:00:25.382515 IP 10.0.0.11.33524 > 10.0.0.6.1883: Flags [.], ack 2935243294, win 83, options [nop,nop,TS val 3459749624 ecr 2016623479], length 0
 00:00:25.484130 IP 10.0.0.11.33524 > 10.0.0.6.1883: Flags [P.], seq 3664475053:3664475055, ack 2935243294, win 83, options [nop,nop,TS val 3459749709 ecr 2016623479], length 2
 00:00:25.504613 IP 10.0.0.6.1883 > 10.0.0.11.33524: Flags [P.], seq 2935243294:2935243296, ack 3664475055, win 85, options [nop,nop,TS val 2016623750 ecr 3459749709], length 2
 00:00:25.606793 IP 10.0.0.11.33524 > 10.0.0.6.1883: Flags [.], ack 2935243296, win 83, options [nop,nop,TS val 3459749851 ecr 2016623750], length 0
 00:00:26.080927 IP 10.0.0.11.33524 > 10.0.0.6.1883: Flags [P.], seq 3664475055:3664475450, ack 2935243296, win 83, options [nop,nop,TS val 3459750325 ecr 2016623750], length 395
 00:00:26.090276 IP6 fe80::cc8e:5eff:fe2f:4b53 > ff02::2: ICMP6, router solicitation, length 16
 00:00:26.101183 IP 10.0.0.6.1883 > 10.0.0.11.33524: Flags [P.], seq 2935243296:2935243300, ack 3664475450, win 85, options [nop,nop,TS val 2016624347 ecr 3459750325], length 4
 00:00:26.205697 IP 10.0.0.11.33524 > 10.0.0.6.1883: Flags [.], ack 2935243300, win 83, options [nop,nop,TS val 3459750447 ecr 2016624347], length 0
 00:00:26.205699 IP 10.0.0.11.33524 > 10.0.0.6.1883: Flags [P.], seq 3664475450:3664475454, ack 2935243300, win 83, options [nop,nop,TS val 3459750447 ecr 2016624347], length 4
 00:00:26.225871 IP 10.0.0.6.1883 > 10.0.0.11.33524: Flags [P.], seq 2935243300:2935243304, ack 3664475454, win 85, options [nop,nop,TS val 2016624471 ecr 3459750447], length 4
 00:00:26.374178 IP 10.0.0.11.33524 > 10.0.0.6.1883: Flags [.], ack 2935243304, win 83, options [nop,nop,TS val 3459750619 ecr 2016624471], length 0
 00:00:27.084007 IP 10.0.0.11.33524 > 10.0.0.6.1883: Flags [P.], seq 3664475454:3664475849, ack 2935243304, win 83, options [nop,nop,TS val 3459751328 ecr 2016624471], length 395
 00:00:27.104898 IP 10.0.0.6.1883 > 10.0.0.11.33524: Flags [P.], seq 2935243304:2935243308, ack 3664475849, win 85, options [nop,nop,TS val 2016625350 ecr 3459751328], length 4
 00:00:27.206433 IP 10.0.0.11.33524 > 10.0.0.6.1883: Flags [.], ack 2935243308, win 83, options [nop,nop,TS val 3459751451 ecr 2016625350], length 0
 00:00:27.206439 IP 10.0.0.11.33524 > 10.0.0.6.1883: Flags [P.], seq 3664475849:3664475853, ack 2935243308, win 83, options [nop,nop,TS val 3459751451 ecr 2016625350], length 4
 00:00:27.226915 IP 10.0.0.6.1883 > 10.0.0.11.33524: Flags [P.], seq 2935243308:2935243312, ack 3664475853, win 85, options [nop,nop,TS val 2016625472 ecr 3459751451], length 4
 00:00:27.370316 IP 10.0.0.11.33524 > 10.0.0.6.1883: Flags [.], ack 2935243312, win 83, options [nop,nop,TS val 3459751616 ecr 2016625472], length 0
 00:00:28.087317 IP 10.0.0.11.33524 > 10.0.0.6.1883: Flags [P.], seq 3664475853:3664476248, ack 2935243312, win 83, options [nop,nop,TS val 3459752329 ecr 2016625472], length 395
 00:00:28.108368 IP 10.0.0.6.1883 > 10.0.0.11.33524: Flags [P.], seq 2935243312:2935243316, ack 3664476248, win 85, options [nop,nop,TS val 2016626354 ecr 3459752329], length 4
 00:00:28.212740 IP 10.0.0.11.33524 > 10.0.0.6.1883: Flags [.], ack 2935243316, win 83, options [nop,nop,TS val 3459752458 ecr 2016626354], length 0
 00:00:28.212744 IP 10.0.0.11.33524 > 10.0.0.6.1883: Flags [P.], seq 3664476248:3664476252, ack 2935243316, win 83, options [nop,nop,TS val 3459752458 ecr 2016626354], length 4
 00:00:28.233332 IP 10.0.0.6.1883 > 10.0.0.11.33524: Flags [P.], seq 2935243316:2935243320, ack 3664476252, win 85, options [nop,nop,TS val 2016626479 ecr 3459752458], length 4
 00:00:28.374762 IP 10.0.0.11.33524 > 10.0.0.6.1883: Flags [.], ack 2935243320, win 83, options [nop,nop,TS val 3459752619 ecr 2016626479], length 0
 00:00:29.087463 IP 10.0.0.11.33524 > 10.0.0.6.1883: Flags [P.], seq 3664476252:3664476647, ack 2935243320, win 83, options [nop,nop,TS val 3459753330 ecr 2016626479], length 395
 00:00:29.110597 IP 10.0.0.6.1883 > 10.0.0.11.33524: Flags [P.], seq 2935243320:2935243324, ack 3664476647, win 85, options [nop,nop,TS val 2016627354 ecr 3459753330], length 4
 00:00:29.211899 IP 10.0.0.11.33524 > 10.0.0.6.1883: Flags [.], ack 2935243324, win 83, options [nop,nop,TS val 3459753457 ecr 2016627354], length 0
 00:00:29.211905 IP 10.0.0.11.33524 > 10.0.0.6.1883: Flags [P.], seq 3664476647:3664476651, ack 2935243324, win 83, options [nop,nop,TS val 3459753457 ecr 2016627354], length 4
 00:00:29.232462 IP 10.0.0.6.1883 > 10.0.0.11.33524: Flags [P.], seq 2935243324:2935243328, ack 3664476651, win 85, options [nop,nop,TS val 2016627478 ecr 3459753457], length 4
 00:00:29.374675 IP 10.0.0.11.33524 > 10.0.0.6.1883: Flags [.], ack 2935243328, win 83, options [nop,nop,TS val 3459753620 ecr 2016627478], length 0
 00:00:30.086977 IP 10.0.0.11.33524 > 10.0.0.6.1883: Flags [P.], seq 3664476651:3664477046, ack 2935243328, win 83, options [nop,nop,TS val 3459754332 ecr 2016627478], length 395
 00:00:30.110043 IP 10.0.0.6.1883 > 10.0.0.11.33524: Flags [P.], seq 2935243328:2935243332, ack 3664477046, win 85, options [nop,nop,TS val 2016628355 ecr 3459754332], length 4
 00:00:30.211612 IP 10.0.0.11.33524 > 10.0.0.6.1883: Flags [.], ack 2935243332, win 83, options [nop,nop,TS val 3459754456 ecr 2016628355], length 0
 00:00:30.211616 IP 10.0.0.11.33524 > 10.0.0.6.1883: Flags [P.], seq 3664477046:3664477050, ack 2935243332, win 83, options [nop,nop,TS val 3459754456 ecr 2016628355], length 4
 00:00:30.232099 IP 10.0.0.6.1883 > 10.0.0.11.33524: Flags [P.], seq 2935243332:2935243336, ack 3664477050, win 85, options [nop,nop,TS val 2016628477 ecr 3459754456], length 4
 00:00:30.378380 IP 10.0.0.11.33524 > 10.0.0.6.1883: Flags [.], ack 2935243336, win 83, options [nop,nop,TS val 3459754620 ecr 2016628477], length 0
 00:00:30.467901 IP 10.0.0.11.33524 > 10.0.0.6.1883: Flags [P.], seq 3664477050:3664477052, ack 2935243336, win 83, options [nop,nop,TS val 3459754711 ecr 2016628477], length 2
 00:00:30.488383 IP 10.0.0.6.1883 > 10.0.0.11.33524: Flags [P.], seq 2935243336:2935243338, ack 3664477052, win 85, options [nop,nop,TS val 2016628734 ecr 3459754711], length 2
 00:00:30.590365 IP 10.0.0.11.33524 > 10.0.0.6.1883: Flags [.], ack 2935243338, win 83, options [nop,nop,TS val 3459754835 ecr 2016628734], length 0
 00:00:31.087985 IP 10.0.0.11.33524 > 10.0.0.6.1883: Flags [P.], seq 3664477052:3664477447, ack 2935243338, win 83, options [nop,nop,TS val 3459755333 ecr 2016628734], length 395
 00:00:31.108588 IP 10.0.0.6.1883 > 10.0.0.11.33524: Flags [P.], seq 2935243338:2935243342, ack 3664477447, win 85, options [nop,nop,TS val 2016629354 ecr 3459755333], length 4
 00:00:31.210525 IP 10.0.0.11.33524 > 10.0.0.6.1883: Flags [.], ack 2935243342, win 83, options [nop,nop,TS val 3459755455 ecr 2016629354], length 0
 00:00:31.210529 IP 10.0.0.11.33524 > 10.0.0.6.1883: Flags [P.], seq 3664477447:3664477451, ack 2935243342, win 83, options [nop,nop,TS val 3459755455 ecr 2016629354], length 4
 00:00:31.230983 IP 10.0.0.6.1883 > 10.0.0.11.33524: Flags [P.], seq 2935243342:2935243346, ack 3664477451, win 85, options [nop,nop,TS val 2016629476 ecr 3459755455], length 4
 00:00:31.375078 IP 10.0.0.11.33524 > 10.0.0.6.1883: Flags [.], ack 2935243346, win 83, options [nop,nop,TS val 3459755620 ecr 2016629476], length 0
 00:00:32.089589 IP 10.0.0.11.33524 > 10.0.0.6.1883: Flags [P.], seq 3664477451:3664477846, ack 2935243346, win 83, options [nop,nop,TS val 3459756334 ecr 2016629476], length 395
 00:00:32.110331 IP 10.0.0.6.1883 > 10.0.0.11.33524: Flags [P.], seq 2935243346:2935243350, ack 3664477846, win 85, options [nop,nop,TS val 2016630356 ecr 3459756334], length 4
 00:00:32.211284 IP 10.0.0.11.33524 > 10.0.0.6.1883: Flags [.], ack 2935243350, win 83, options [nop,nop,TS val 3459756456 ecr 2016630356], length 0
 00:00:32.211289 IP 10.0.0.11.33524 > 10.0.0.6.1883: Flags [P.], seq 3664477846:3664477850, ack 2935243350, win 83, options [nop,nop,TS val 3459756457 ecr 2016630356], length 4
 00:00:32.235548 IP 10.0.0.6.1883 > 10.0.0.11.33524: Flags [P.], seq 2935243350:2935243354, ack 3664477850, win 85, options [nop,nop,TS val 2016630477 ecr 3459756457], length 4
 00:00:32.387431 IP 10.0.0.11.33524 > 10.0.0.6.1883: Flags [.], ack 2935243354, win 83, options [nop,nop,TS val 3459756632 ecr 2016630477], length 0
 00:00:33.090953 IP 10.0.0.11.33524 > 10.0.0.6.1883: Flags [P.], seq 3664477850:3664478245, ack 2935243354, win 83, options [nop,nop,TS val 3459757336 ecr 2016630477], length 395
 00:00:33.111564 IP 10.0.0.6.1883 > 10.0.0.11.33524: Flags [P.], seq 2935243354:2935243358, ack 3664478245, win 85, options [nop,nop,TS val 2016631357 ecr 3459757336], length 4
 00:00:33.213157 IP 10.0.0.11.33524 > 10.0.0.6.1883: Flags [.], ack 2935243358, win 83, options [nop,nop,TS val 3459757458 ecr 2016631357], length 0
 00:00:33.213161 IP 10.0.0.11.33524 > 10.0.0.6.1883: Flags [P.], seq 3664478245:3664478249, ack 2935243358, win 83, options [nop,nop,TS val 3459757458 ecr 2016631357], length 4
 00:00:33.233734 IP 10.0.0.6.1883 > 10.0.0.11.33524: Flags [P.], seq 2935243358:2935243362, ack 3664478249, win 85, options [nop,nop,TS val 2016631479 ecr 3459757458], length 4
 00:00:33.378774 IP 10.0.0.11.33524 > 10.0.0.6.1883: Flags [.], ack 2935243362, win 83, options [nop,nop,TS val 3459757623 ecr 2016631479], length 0
 00:00:34.091967 IP 10.0.0.11.33524 > 10.0.0.6.1883: Flags [P.], seq 3664478249:3664478644, ack 2935243362, win 83, options [nop,nop,TS val 3459758337 ecr 2016631479], length 395
 00:00:34.112226 IP 10.0.0.6.1883 > 10.0.0.11.33524: Flags [P.], seq 2935243362:2935243366, ack 3664478644, win 85, options [nop,nop,TS val 2016632358 ecr 3459758337], length 4
 00:00:34.216067 IP 10.0.0.11.33524 > 10.0.0.6.1883: Flags [.], ack 2935243366, win 83, options [nop,nop,TS val 3459758458 ecr 2016632358], length 0
 00:00:34.216072 IP 10.0.0.11.33524 > 10.0.0.6.1883: Flags [P.], seq 3664478644:3664478648, ack 2935243366, win 83, options [nop,nop,TS val 3459758458 ecr 2016632358], length 4
