 00:00:00.000000 IP6 fe80::2895:9dff:fe8c:575b > ff02::2: ICMP6, router solicitation, length 16
 00:00:00.242507 IP6 fe80::c1f:92ff:feb1:426f > ff02::2: ICMP6, router solicitation, length 16
 00:00:00.273893 IP6 fe80::3035:5aff:fe1d:a8d7 > ff02::2: ICMP6, router solicitation, length 16
 00:00:00.487441 IP6 fe80::dc:aaff:fe02:a06c > ff02::2: ICMP6, router solicitation, length 16
 00:00:00.528626 IP6 fe80::d495:f2ff:fedc:b9cc > ff02::2: ICMP6, router solicitation, length 16
 00:00:00.766106 IP6 fe80::1cb1:f4ff:fe2a:6d81 > ff02::2: ICMP6, router solicitation, length 16
 00:00:01.022145 IP6 fe80::d4c7:ceff:feb6:891d > ff02::2: ICMP6, router solicitation, length 16
 00:00:01.524807 IP6 fe80::b09b:a9ff:fe5c:d659 > ff02::2: ICMP6, router solicitation, length 16
 00:00:01.552191 IP6 fe80::d82a:76ff:fe67:fb77 > ff02::2: ICMP6, router solicitation, length 16
 00:00:01.792505 IP6 fe80::386d:ddff:fefa:bc91 > ff02::2: ICMP6, router solicitation, length 16
 00:00:02.025864 IP6 fe80::fc3b:45ff:fe75:23ba > ff02::2: ICMP6, router solicitation, length 16
 00:00:02.058437 IP6 fe80::54da:7ff:fecb:a9c0 > ff02::2: ICMP6, router solicitation, length 16
 00:00:02.070800 IP6 fe80::2414:83ff:fea7:a702 > ff02::2: ICMP6, router solicitation, length 16
 00:00:02.813496 IP6 fe80::b881:8dff:fe77:321a > ff02::2: ICMP6, router solicitation, length 16
 00:00:09.034216 ARP, Request who-has 10.0.0.6 tell 10.0.0.8, length 28
 00:00:09.035196 ARP, Reply 10.0.0.6 is-at 02:dc:aa:02:a0:6c, length 28
 00:00:09.072088 IP 10.0.0.8.44998 > 10.0.0.6.1883: Flags [S], seq 3131655445, win 42340, options [mss 1460,sackOK,TS val 1097105413 ecr 0,nop,wscale 9], length 0
 00:00:09.072175 IP 10.0.0.6.1883 > 10.0.0.8.44998: Flags [S.], seq 2787520982, ack 3131655446, win 43440, options [mss 1460,sackOK,TS val 3792399994 ecr 1097105413,nop,wscale 9], length 0
 00:00:09.079784 IP 10.0.0.8.44998 > 10.0.0.6.1883: Flags [.], ack 2787520983, win 83, options [nop,nop,TS val 1097105483 ecr 3792399994], length 0
 00:00:09.083922 IP 10.0.0.8.44998 > 10.0.0.6.1883: Flags [P.], seq 3131655446:3131655466, ack 2787520983, win 83, options [nop,nop,TS val 1097105484 ecr 3792399994], length 20
 00:00:09.084087 IP 10.0.0.6.1883 > 10.0.0.8.44998: Flags [.], ack 3131655466, win 85, options [nop,nop,TS val 3792400005 ecr 1097105484], length 0
 00:00:09.085450 IP 10.0.0.6.1883 > 10.0.0.8.44998: Flags [P.], seq 2787520983:2787520987, ack 3131655466, win 85, options [nop,nop,TS val 3792400006 ecr 1097105484], length 4
 00:00:09.086430 IP 10.0.0.8.44998 > 10.0.0.6.1883: Flags [.], ack 2787520987, win 83, options [nop,nop,TS val 1097105489 ecr 3792400006], length 0
 00:00:09.086628 IP 10.0.0.8.44998 > 10.0.0.6.1883: Flags [P.], seq 3131655466:3131655530, ack 2787520987, win 83, options [nop,nop,TS val 1097105489 ecr 3792400006], length 64
 00:00:09.087008 IP 10.0.0.6.1883 > 10.0.0.8.44998: Flags [P.], seq 2787520987:2787521052, ack 3131655530, win 85, options [nop,nop,TS val 3792400008 ecr 1097105489], length 65
 00:00:09.087781 IP 10.0.0.8.44998 > 10.0.0.6.1883: Flags [P.], seq 3131655530:3131655925, ack 2787521052, win 83, options [nop,nop,TS val 1097105491 ecr 3792400008], length 395
 00:00:09.087948 IP 10.0.0.6.1883 > 10.0.0.8.44998: Flags [P.], seq 2787521052:2787521057, ack 3131655925, win 85, options [nop,nop,TS val 3792400009 ecr 1097105491], length 5
 00:00:09.131507 IP 10.0.0.8.44998 > 10.0.0.6.1883: Flags [.], ack 2787521057, win 83, options [nop,nop,TS val 1097105535 ecr 3792400009], length 0
 00:00:09.131677 IP 10.0.0.6.1883 > 10.0.0.8.44998: Flags [P.], seq 2787521057:2787521061, ack 3131655925, win 85, options [nop,nop,TS val 3792400053 ecr 1097105535], length 4
 00:00:09.132338 IP 10.0.0.8.44998 > 10.0.0.6.1883: Flags [.], ack 2787521061, win 83, options [nop,nop,TS val 1097105535 ecr 3792400053], length 0
 00:00:09.134023 IP 10.0.0.8.44998 > 10.0.0.6.1883: Flags [P.], seq 3131655925:3131655929, ack 2787521061, win 83, options [nop,nop,TS val 1097105536 ecr 3792400053], length 4
 00:00:09.135002 IP 10.0.0.6.1883 > 10.0.0.8.44998: Flags [P.], seq 2787521061:2787521065, ack 3131655929, win 85, options [nop,nop,TS val 3792400056 ecr 1097105536], length 4
 00:00:09.260959 IP 10.0.0.8.44998 > 10.0.0.6.1883: Flags [.], ack 2787521065, win 83, options [nop,nop,TS val 1097105582 ecr 3792400056], length 0
 00:00:10.025772 IP 10.0.0.8.44998 > 10.0.0.6.1883: Flags [P.], seq 3131655929:3131656324, ack 2787521065, win 83, options [nop,nop,TS val 1097106428 ecr 3792400056], length 395
 00:00:10.026918 IP 10.0.0.6.1883 > 10.0.0.8.44998: Flags [P.], seq 2787521065:2787521069, ack 3131656324, win 85, options [nop,nop,TS val 3792400948 ecr 1097106428], length 4
 00:00:10.027526 IP 10.0.0.8.44998 > 10.0.0.6.1883: Flags [.], ack 2787521069, win 83, options [nop,nop,TS val 1097106431 ecr 3792400948], length 0
 00:00:10.028596 IP 10.0.0.8.44998 > 10.0.0.6.1883: Flags [P.], seq 3131656324:3131656328, ack 2787521069, win 83, options [nop,nop,TS val 1097106431 ecr 3792400948], length 4
 00:00:10.029425 IP 10.0.0.6.1883 > 10.0.0.8.44998: Flags [P.], seq 2787521069:2787521073, ack 3131656328, win 85, options [nop,nop,TS val 3792400951 ecr 1097106431], length 4
 00:00:10.078721 IP 10.0.0.8.44998 > 10.0.0.6.1883: Flags [.], ack 2787521073, win 83, options [nop,nop,TS val 1097106475 ecr 3792400951], length 0
 00:00:11.243343 IP 10.0.0.8.44998 > 10.0.0.6.1883: Flags [P.], seq 3131656328:3131656723, ack 2787521073, win 83, options [nop,nop,TS val 1097107645 ecr 3792400951], length 395
 00:00:11.244114 IP 10.0.0.6.1883 > 10.0.0.8.44998: Flags [P.], seq 2787521073:2787521077, ack 3131656723, win 85, options [nop,nop,TS val 3792402165 ecr 1097107645], length 4
 00:00:11.244799 IP 10.0.0.8.44998 > 10.0.0.6.1883: Flags [.], ack 2787521077, win 83, options [nop,nop,TS val 1097107648 ecr 3792402165], length 0
 00:00:11.245946 IP 10.0.0.8.44998 > 10.0.0.6.1883: Flags [P.], seq 3131656723:3131656727, ack 2787521077, win 83, options [nop,nop,TS val 1097107648 ecr 3792402165], length 4
 00:00:11.246574 IP 10.0.0.6.1883 > 10.0.0.8.44998: Flags [P.], seq 2787521077:2787521081, ack 3131656727, win 85, options [nop,nop,TS val 3792402168 ecr 1097107648], length 4
 00:00:11.478994 IP 10.0.0.8.44998 > 10.0.0.6.1883: Flags [.], ack 2787521081, win 83, options [nop,nop,TS val 1097107691 ecr 3792402168], length 0
 00:00:11.479136 IP 10.0.0.6.1883 > 10.0.0.8.44998: Flags [P.], seq 2787521077:2787521081, ack 3131656727, win 85, options [nop,nop,TS val 3792402400 ecr 1097107648], length 4
 00:00:11.480988 IP 10.0.0.8.44998 > 10.0.0.6.1883: Flags [.], ack 2787521081, win 83, options [nop,nop,TS val 1097107884 ecr 3792402400,nop,nop,sack 1 {2787521077:2787521081}], length 0
 00:00:12.244408 IP 10.0.0.8.44998 > 10.0.0.6.1883: Flags [P.], seq 3131656727:3131657122, ack 2787521081, win 83, options [nop,nop,TS val 1097108647 ecr 3792402400], length 395
 00:00:12.245490 IP 10.0.0.6.1883 > 10.0.0.8.44998: Flags [P.], seq 2787521081:2787521085, ack 3131657122, win 85, options [nop,nop,TS val 3792403167 ecr 1097108647], length 4
 00:00:12.246085 IP 10.0.0.8.44998 > 10.0.0.6.1883: Flags [.], ack 2787521085, win 83, options [nop,nop,TS val 1097108649 ecr 3792403167], length 0
 00:00:12.246952 IP 10.0.0.8.44998 > 10.0.0.6.1883: Flags [P.], seq 3131657122:3131657126, ack 2787521085, win 83, options [nop,nop,TS val 1097108650 ecr 3792403167], length 4
 00:00:12.247555 IP 10.0.0.6.1883 > 10.0.0.8.44998: Flags [P.], seq 2787521085:2787521089, ack 3131657126, win 85, options [nop,nop,TS val 3792403169 ecr 1097108650], length 4
 00:00:12.295613 IP 10.0.0.8.44998 > 10.0.0.6.1883: Flags [.], ack 2787521089, win 83, options [nop,nop,TS val 1097108694 ecr 3792403169], length 0
 00:00:13.247930 IP 10.0.0.8.44998 > 10.0.0.6.1883: Flags [P.], seq 3131657126:3131657521, ack 2787521089, win 83, options [nop,nop,TS val 1097109650 ecr 3792403169], length 395
 00:00:13.248554 IP 10.0.0.6.1883 > 10.0.0.8.44998: Flags [P.], seq 2787521089:2787521093, ack 3131657521, win 85, options [nop,nop,TS val 3792404170 ecr 1097109650], length 4
 00:00:13.249202 IP 10.0.0.8.44998 > 10.0.0.6.1883: Flags [.], ack 2787521093, win 83, options [nop,nop,TS val 1097109652 ecr 3792404170], length 0
 00:00:13.250371 IP 10.0.0.8.44998 > 10.0.0.6.1883: Flags [P.], seq 3131657521:3131657525, ack 2787521093, win 83, options [nop,nop,TS val 1097109653 ecr 3792404170], length 4
 00:00:13.250862 IP 10.0.0.6.1883 > 10.0.0.8.44998: Flags [P.], seq 2787521093:2787521097, ack 3131657525, win 85, options [nop,nop,TS val 3792404172 ecr 1097109653], length 4
 00:00:13.301110 IP 10.0.0.8.44998 > 10.0.0.6.1883: Flags [.], ack 2787521097, win 83, options [nop,nop,TS val 1097109704 ecr 3792404172], length 0
 00:00:14.089559 IP 10.0.0.8.44998 > 10.0.0.6.1883: Flags [P.], seq 3131657525:3131657527, ack 2787521097, win 83, options [nop,nop,TS val 1097110492 ecr 3792404172], length 2
 00:00:14.090213 IP 10.0.0.6.1883 > 10.0.0.8.44998: Flags [P.], seq 2787521097:2787521099, ack 3131657527, win 85, options [nop,nop,TS val 3792405012 ecr 1097110492], length 2
 00:00:14.090894 IP 10.0.0.8.44998 > 10.0.0.6.1883: Flags [.], ack 2787521099, win 83, options [nop,nop,TS val 1097110494 ecr 3792405012], length 0
 00:00:14.248741 IP 10.0.0.8.44998 > 10.0.0.6.1883: Flags [P.], seq 3131657527:3131657922, ack 2787521099, win 83, options [nop,nop,TS val 1097110652 ecr 3792405012], length 395
 00:00:14.249688 IP 10.0.0.6.1883 > 10.0.0.8.44998: Flags [P.], seq 2787521099:2787521103, ack 3131657922, win 85, options [nop,nop,TS val 3792405171 ecr 1097110652], length 4
 00:00:14.250690 IP 10.0.0.8.44998 > 10.0.0.6.1883: Flags [.], ack 2787521103, win 83, options [nop,nop,TS val 1097110654 ecr 3792405171], length 0
 00:00:14.251500 IP 10.0.0.8.44998 > 10.0.0.6.1883: Flags [P.], seq 3131657922:3131657926, ack 2787521103, win 83, options [nop,nop,TS val 1097110654 ecr 3792405171], length 4
 00:00:14.252192 IP 10.0.0.6.1883 > 10.0.0.8.44998: Flags [P.], seq 2787521103:2787521107, ack 3131657926, win 85, options [nop,nop,TS val 3792405173 ecr 1097110654], length 4
 00:00:14.304630 IP 10.0.0.8.44998 > 10.0.0.6.1883: Flags [.], ack 2787521107, win 83, options [nop,nop,TS val 1097110708 ecr 3792405173], length 0
 00:00:14.582826 IP6 fe80::3035:5aff:fe1d:a8d7 > ff02::2: ICMP6, router solicitation, length 16
 00:00:14.594910 IP6 fe80::2895:9dff:fe8c:575b > ff02::2: ICMP6, router solicitation, length 16
 00:00:15.251317 IP 10.0.0.8.44998 > 10.0.0.6.1883: Flags [P.], seq 3131657926:3131658321, ack 2787521107, win 83, options [nop,nop,TS val 1097111654 ecr 3792405173], length 395
 00:00:15.252571 IP 10.0.0.6.1883 > 10.0.0.8.44998: Flags [P.], seq 2787521107:2787521111, ack 3131658321, win 85, options [nop,nop,TS val 3792406174 ecr 1097111654], length 4
 00:00:15.253522 IP 10.0.0.8.44998 > 10.0.0.6.1883: Flags [.], ack 2787521111, win 83, options [nop,nop,TS val 1097111657 ecr 3792406174], length 0
 00:00:15.254229 IP 10.0.0.8.44998 > 10.0.0.6.1883: Flags [P.], seq 3131658321:3131658325, ack 2787521111, win 83, options [nop,nop,TS val 1097111657 ecr 3792406174], length 4
 00:00:15.254811 IP 10.0.0.6.1883 > 10.0.0.8.44998: Flags [P.], seq 2787521111:2787521115, ack 3131658325, win 85, options [nop,nop,TS val 3792406176 ecr 1097111657], length 4
 00:00:15.299456 IP 10.0.0.8.44998 > 10.0.0.6.1883: Flags [.], ack 2787521115, win 83, options [nop,nop,TS val 1097111703 ecr 3792406176], length 0
 00:00:15.591893 IP6 fe80::dc:aaff:fe02:a06c > ff02::2: ICMP6, router solicitation, length 16
 00:00:15.602569 IP6 fe80::c1f:92ff:feb1:426f > ff02::2: ICMP6, router solicitation, length 16
 00:00:15.875090 IP6 fe80::d495:f2ff:fedc:b9cc > ff02::2: ICMP6, router solicitation, length 16
 00:00:16.128101 IP6 fe80::1cb1:f4ff:fe2a:6d81 > ff02::2: ICMP6, router solicitation, length 16
 00:00:16.253218 IP 10.0.0.8.44998 > 10.0.0.6.1883: Flags [P.], seq 3131658325:3131658720, ack 2787521115, win 83, options [nop,nop,TS val 1097112655 ecr 3792406176], length 395
 00:00:16.254390 IP 10.0.0.6.1883 > 10.0.0.8.44998: Flags [P.], seq 2787521115:2787521119, ack 3131658720, win 85, options [nop,nop,TS val 3792407176 ecr 1097112655], length 4
 00:00:16.255030 IP 10.0.0.8.44998 > 10.0.0.6.1883: Flags [.], ack 2787521119, win 83, options [nop,nop,TS val 1097112658 ecr 3792407176], length 0
 00:00:16.255943 IP 10.0.0.8.44998 > 10.0.0.6.1883: Flags [P.], seq 3131658720:3131658724, ack 2787521119, win 83, options [nop,nop,TS val 1097112659 ecr 3792407176], length 4
 00:00:16.256669 IP 10.0.0.6.1883 > 10.0.0.8.44998: Flags [P.], seq 2787521119:2787521123, ack 3131658724, win 85, options [nop,nop,TS val 3792407178 ecr 1097112659], length 4
 00:00:16.299575 IP 10.0.0.8.44998 > 10.0.0.6.1883: Flags [.], ack 2787521123, win 83, options [nop,nop,TS val 1097112703 ecr 3792407178], length 0
 00:00:16.897138 IP6 fe80::d4c7:ceff:feb6:891d > ff02::2: ICMP6, router solicitation, length 16
 00:00:17.254356 IP 10.0.0.8.44998 > 10.0.0.6.1883: Flags [P.], seq 3131658724:3131659119, ack 2787521123, win 83, options [nop,nop,TS val 1097113657 ecr 3792407178], length 395
 00:00:17.255067 IP 10.0.0.6.1883 > 10.0.0.8.44998: Flags [P.], seq 2787521123:2787521127, ack 3131659119, win 85, options [nop,nop,TS val 3792408176 ecr 1097113657], length 4
 00:00:17.256495 IP 10.0.0.8.44998 > 10.0.0.6.1883: Flags [.], ack 2787521127, win 83, options [nop,nop,TS val 1097113659 ecr 3792408176], length 0
 00:00:17.256588 IP 10.0.0.8.44998 > 10.0.0.6.1883: Flags [P.], seq 3131659119:3131659123, ack 2787521127, win 83, options [nop,nop,TS val 1097113660 ecr 3792408176], length 4
 00:00:17.256844 IP 10.0.0.6.1883 > 10.0.0.8.44998: Flags [P.], seq 2787521127:2787521131, ack 3131659123, win 85, options [nop,nop,TS val 3792408178 ecr 1097113660], length 4
 00:00:17.299356 IP 10.0.0.8.44998 > 10.0.0.6.1883: Flags [.], ack 2787521131, win 83, options [nop,nop,TS val 1097113703 ecr 3792408178], length 0
 00:00:17.396151 IP6 fe80::b09b:a9ff:fe5c:d659 > ff02::2: ICMP6, router solicitation, length 16
 00:00:18.158201 IP6 fe80::fc3b:45ff:fe75:23ba > ff02::2: ICMP6, router solicitation, length 16
 00:00:18.194357 IP6 fe80::2414:83ff:fea7:a702 > ff02::2: ICMP6, router solicitation, length 16
 00:00:18.198727 IP6 fe80::54da:7ff:fecb:a9c0 > ff02::2: ICMP6, router solicitation, length 16
 00:00:18.255290 IP 10.0.0.8.44998 > 10.0.0.6.1883: Flags [P.], seq 3131659123:3131659518, ack 2787521131, win 83, options [nop,nop,TS val 1097114659 ecr 3792408178], length 395
 00:00:18.255851 IP 10.0.0.6.1883 > 10.0.0.8.44998: Flags [P.], seq 2787521131:2787521135, ack 3131659518, win 85, options [nop,nop,TS val 3792409177 ecr 1097114659], length 4
 00:00:18.256478 IP 10.0.0.8.44998 > 10.0.0.6.1883: Flags [.], ack 2787521135, win 83, options [nop,nop,TS val 1097114660 ecr 3792409177], length 0
 00:00:18.256536 IP 10.0.0.8.44998 > 10.0.0.6.1883: Flags [P.], seq 3131659518:3131659522, ack 2787521135, win 83, options [nop,nop,TS val 1097114660 ecr 3792409177], length 4
 00:00:18.256776 IP 10.0.0.6.1883 > 10.0.0.8.44998: Flags [P.], seq 2787521135:2787521139, ack 3131659522, win 85, options [nop,nop,TS val 3792409178 ecr 1097114660], length 4
 00:00:18.299887 IP 10.0.0.8.44998 > 10.0.0.6.1883: Flags [.], ack 2787521139, win 83, options [nop,nop,TS val 1097114703 ecr 3792409178], length 0
 00:00:18.744153 IP6 fe80::d82a:76ff:fe67:fb77 > ff02::2: ICMP6, router solicitation, length 16
 00:00:18.755280 IP6 fe80::386d:ddff:fefa:bc91 > ff02::2: ICMP6, router solicitation, length 16
 00:00:19.090236 IP 10.0.0.8.44998 > 10.0.0.6.1883: Flags [P.], seq 3131659522:3131659524, ack 2787521139, win 83, options [nop,nop,TS val 1097115493 ecr 3792409178], length 2
 00:00:19.090564 IP 10.0.0.6.1883 > 10.0.0.8.44998: Flags [P.], seq 2787521139:2787521141, ack 3131659524, win 85, options [nop,nop,TS val 3792410012 ecr 1097115493], length 2
 00:00:19.091937 IP 10.0.0.8.44998 > 10.0.0.6.1883: Flags [.], ack 2787521141, win 83, options [nop,nop,TS val 1097115495 ecr 3792410012], length 0
 00:00:19.256441 IP 10.0.0.8.44998 > 10.0.0.6.1883: Flags [P.], seq 3131659524:3131659919, ack 2787521141, win 83, options [nop,nop,TS val 1097115659 ecr 3792410012], length 395
 00:00:19.257086 IP 10.0.0.6.1883 > 10.0.0.8.44998: Flags [P.], seq 2787521141:2787521145, ack 3131659919, win 85, options [nop,nop,TS val 3792410178 ecr 1097115659], length 4
 00:00:19.258253 IP 10.0.0.8.44998 > 10.0.0.6.1883: Flags [.], ack 2787521145, win 83, options [nop,nop,TS val 1097115661 ecr 3792410178], length 0
 00:00:19.258476 IP 10.0.0.8.44998 > 10.0.0.6.1883: Flags [P.], seq 3131659919:3131659923, ack 2787521145, win 83, options [nop,nop,TS val 1097115662 ecr 3792410178], length 4
 00:00:19.258688 IP 10.0.0.6.1883 > 10.0.0.8.44998: Flags [P.], seq 2787521145:2787521149, ack 3131659923, win 85, options [nop,nop,TS val 3792410180 ecr 1097115662], length 4
 00:00:19.303638 IP 10.0.0.8.44998 > 10.0.0.6.1883: Flags [.], ack 2787521149, win 83, options [nop,nop,TS val 1097115707 ecr 3792410180], length 0
 00:00:20.257684 IP 10.0.0.8.44998 > 10.0.0.6.1883: Flags [P.], seq 3131659923:3131660318, ack 2787521149, win 83, options [nop,nop,TS val 1097116661 ecr 3792410180], length 395
 00:00:20.257964 IP 10.0.0.6.1883 > 10.0.0.8.44998: Flags [P.], seq 2787521149:2787521153, ack 3131660318, win 85, options [nop,nop,TS val 3792411179 ecr 1097116661], length 4
 00:00:20.258453 IP 10.0.0.8.44998 > 10.0.0.6.1883: Flags [.], ack 2787521153, win 83, options [nop,nop,TS val 1097116662 ecr 3792411179], length 0
 00:00:20.258516 IP 10.0.0.8.44998 > 10.0.0.6.1883: Flags [P.], seq 3131660318:3131660322, ack 2787521153, win 83, options [nop,nop,TS val 1097116662 ecr 3792411179], length 4
 00:00:20.258629 IP 10.0.0.6.1883 > 10.0.0.8.44998: Flags [P.], seq 2787521153:2787521157, ack 3131660322, win 85, options [nop,nop,TS val 3792411180 ecr 1097116662], length 4
 00:00:20.299249 IP 10.0.0.8.44998 > 10.0.0.6.1883: Flags [.], ack 2787521157, win 83, options [nop,nop,TS val 1097116703 ecr 3792411180], length 0
 00:00:20.733784 IP6 fe80::b881:8dff:fe77:321a > ff02::2: ICMP6, router solicitation, length 16
 00:00:21.258670 IP 10.0.0.8.44998 > 10.0.0.6.1883: Flags [P.], seq 3131660322:3131660717, ack 2787521157, win 83, options [nop,nop,TS val 1097117662 ecr 3792411180], length 395
 00:00:21.259489 IP 10.0.0.6.1883 > 10.0.0.8.44998: Flags [P.], seq 2787521157:2787521161, ack 3131660717, win 85, options [nop,nop,TS val 3792412181 ecr 1097117662], length 4
 00:00:21.260926 IP 10.0.0.8.44998 > 10.0.0.6.1883: Flags [.], ack 2787521161, win 83, options [nop,nop,TS val 1097117663 ecr 3792412181], length 0
 00:00:21.261135 IP 10.0.0.8.44998 > 10.0.0.6.1883: Flags [P.], seq 3131660717:3131660721, ack 2787521161, win 83, options [nop,nop,TS val 1097117664 ecr 3792412181], length 4
 00:00:21.261374 IP 10.0.0.6.1883 > 10.0.0.8.44998: Flags [P.], seq 2787521161:2787521165, ack 3131660721, win 85, options [nop,nop,TS val 3792412183 ecr 1097117664], length 4
 00:00:21.305753 IP 10.0.0.8.44998 > 10.0.0.6.1883: Flags [.], ack 2787521165, win 83, options [nop,nop,TS val 1097117709 ecr 3792412183], length 0
 00:00:22.259371 IP 10.0.0.8.44998 > 10.0.0.6.1883: Flags [P.], seq 3131660721:3131661116, ack 2787521165, win 83, options [nop,nop,TS val 1097118662 ecr 3792412183], length 395
 00:00:22.260004 IP 10.0.0.6.1883 > 10.0.0.8.44998: Flags [P.], seq 2787521165:2787521169, ack 3131661116, win 85, options [nop,nop,TS val 3792413181 ecr 1097118662], length 4
 00:00:22.261467 IP 10.0.0.8.44998 > 10.0.0.6.1883: Flags [.], ack 2787521169, win 83, options [nop,nop,TS val 1097118664 ecr 3792413181], length 0
 00:00:22.261553 IP 10.0.0.8.44998 > 10.0.0.6.1883: Flags [P.], seq 3131661116:3131661120, ack 2787521169, win 83, options [nop,nop,TS val 1097118665 ecr 3792413181], length 4
 00:00:22.261829 IP 10.0.0.6.1883 > 10.0.0.8.44998: Flags [P.], seq 2787521169:2787521173, ack 3131661120, win 85, options [nop,nop,TS val 3792413183 ecr 1097118665], length 4
 00:00:22.303653 IP 10.0.0.8.44998 > 10.0.0.6.1883: Flags [.], ack 2787521173, win 83, options [nop,nop,TS val 1097118707 ecr 3792413183], length 0
 00:00:23.261124 IP 10.0.0.8.44998 > 10.0.0.6.1883: Flags [P.], seq 3131661120:3131661515, ack 2787521173, win 83, options [nop,nop,TS val 1097119664 ecr 3792413183], length 395
 00:00:23.261819 IP 10.0.0.6.1883 > 10.0.0.8.44998: Flags [P.], seq 2787521173:2787521177, ack 3131661515, win 85, options [nop,nop,TS val 3792414183 ecr 1097119664], length 4
 00:00:23.263025 IP 10.0.0.8.44998 > 10.0.0.6.1883: Flags [.], ack 2787521177, win 83, options [nop,nop,TS val 1097119666 ecr 3792414183], length 0
 00:00:23.263026 IP 10.0.0.8.44998 > 10.0.0.6.1883: Flags [P.], seq 3131661515:3131661519, ack 2787521177, win 83, options [nop,nop,TS val 1097119666 ecr 3792414183], length 4
 00:00:23.263284 IP 10.0.0.6.1883 > 10.0.0.8.44998: Flags [P.], seq 2787521177:2787521181, ack 3131661519, win 85, options [nop,nop,TS val 3792414185 ecr 1097119666], length 4
 00:00:23.307678 IP 10.0.0.8.44998 > 10.0.0.6.1883: Flags [.], ack 2787521181, win 83, options [nop,nop,TS val 1097119711 ecr 3792414185], length 0
 00:00:24.092470 IP 10.0.0.8.44998 > 10.0.0.6.1883: Flags [P.], seq 3131661519:3131661521, ack 2787521181, win 83, options [nop,nop,TS val 1097120495 ecr 3792414185], length 2
 00:00:24.092806 IP 10.0.0.6.1883 > 10.0.0.8.44998: Flags [P.], seq 2787521181:2787521183, ack 3131661521, win 85, options [nop,nop,TS val 3792415014 ecr 1097120495], length 2
 00:00:24.093550 IP 10.0.0.8.44998 > 10.0.0.6.1883: Flags [.], ack 2787521183, win 83, options [nop,nop,TS val 1097120497 ecr 3792415014], length 0
 00:00:24.263480 IP 10.0.0.8.44998 > 10.0.0.6.1883: Flags [P.], seq 3131661521:3131661916, ack 2787521183, win 83, options [nop,nop,TS val 1097120666 ecr 3792415014], length 395
 00:00:24.264108 IP 10.0.0.6.1883 > 10.0.0.8.44998: Flags [P.], seq 2787521183:2787521187, ack 3131661916, win 85, options [nop,nop,TS val 3792415185 ecr 1097120666], length 4
 00:00:24.265090 IP 10.0.0.8.44998 > 10.0.0.6.1883: Flags [.], ack 2787521187, win 83, options [nop,nop,TS val 1097120668 ecr 3792415185], length 0
 00:00:24.266272 IP 10.0.0.8.44998 > 10.0.0.6.1883: Flags [P.], seq 3131661916:3131661920, ack 2787521187, win 83, options [nop,nop,TS val 1097120668 ecr 3792415185], length 4
 00:00:24.267412 IP 10.0.0.6.1883 > 10.0.0.8.44998: Flags [P.], seq 2787521187:2787521191, ack 3131661920, win 85, options [nop,nop,TS val 3792415189 ecr 1097120668], length 4
 00:00:24.311727 IP 10.0.0.8.44998 > 10.0.0.6.1883: Flags [.], ack 2787521191, win 83, options [nop,nop,TS val 1097120715 ecr 3792415189], length 0
 00:00:25.263789 IP 10.0.0.8.44998 > 10.0.0.6.1883: Flags [P.], seq 3131661920:3131662315, ack 2787521191, win 83, options [nop,nop,TS val 1097121667 ecr 3792415189], length 395
 00:00:25.264660 IP 10.0.0.6.1883 > 10.0.0.8.44998: Flags [P.], seq 2787521191:2787521195, ack 3131662315, win 85, options [nop,nop,TS val 3792416186 ecr 1097121667], length 4
 00:00:25.265874 IP 10.0.0.8.44998 > 10.0.0.6.1883: Flags [.], ack 2787521195, win 83, options [nop,nop,TS val 1097121668 ecr 3792416186], length 0
 00:00:25.266286 IP 10.0.0.8.44998 > 10.0.0.6.1883: Flags [P.], seq 3131662315:3131662319, ack 2787521195, win 83, options [nop,nop,TS val 1097121669 ecr 3792416186], length 4
 00:00:25.266989 IP 10.0.0.6.1883 > 10.0.0.8.44998: Flags [P.], seq 2787521195:2787521199, ack 3131662319, win 85, options [nop,nop,TS val 3792416188 ecr 1097121669], length 4
 00:00:25.311476 IP 10.0.0.8.44998 > 10.0.0.6.1883: Flags [.], ack 2787521199, win 83, options [nop,nop,TS val 1097121715 ecr 3792416188], length 0
 00:00:26.265415 IP 10.0.0.8.44998 > 10.0.0.6.1883: Flags [P.], seq 3131662319:3131662714, ack 2787521199, win 83, options [nop,nop,TS val 1097122668 ecr 3792416188], length 395
 00:00:26.266269 IP 10.0.0.6.1883 > 10.0.0.8.44998: Flags [P.], seq 2787521199:2787521203, ack 3131662714, win 85, options [nop,nop,TS val 3792417187 ecr 1097122668], length 4
 00:00:26.267558 IP 10.0.0.8.44998 > 10.0.0.6.1883: Flags [.], ack 2787521203, win 83, options [nop,nop,TS val 1097122670 ecr 3792417187], length 0
 00:00:26.267687 IP 10.0.0.8.44998 > 10.0.0.6.1883: Flags [P.], seq 3131662714:3131662718, ack 2787521203, win 83, options [nop,nop,TS val 1097122671 ecr 3792417187], length 4
 00:00:26.268235 IP 10.0.0.6.1883 > 10.0.0.8.44998: Flags [P.], seq 2787521203:2787521207, ack 3131662718, win 85, options [nop,nop,TS val 3792417189 ecr 1097122671], length 4
 00:00:26.311164 IP 10.0.0.8.44998 > 10.0.0.6.1883: Flags [.], ack 2787521207, win 83, options [nop,nop,TS val 1097122714 ecr 3792417189], length 0
 00:00:27.266338 IP 10.0.0.8.44998 > 10.0.0.6.1883: Flags [P.], seq 3131662718:3131663113, ack 2787521207, win 83, options [nop,nop,TS val 1097123670 ecr 3792417189], length 395
 00:00:27.266619 IP 10.0.0.6.1883 > 10.0.0.8.44998: Flags [P.], seq 2787521207:2787521211, ack 3131663113, win 85, options [nop,nop,TS val 3792418188 ecr 1097123670], length 4
 00:00:27.267102 IP 10.0.0.8.44998 > 10.0.0.6.1883: Flags [.], ack 2787521211, win 83, options [nop,nop,TS val 1097123670 ecr 3792418188], length 0
 00:00:27.267241 IP 10.0.0.8.44998 > 10.0.0.6.1883: Flags [P.], seq 3131663113:3131663117, ack 2787521211, win 83, options [nop,nop,TS val 1097123670 ecr 3792418188], length 4
 00:00:27.267390 IP 10.0.0.6.1883 > 10.0.0.8.44998: Flags [P.], seq 2787521211:2787521215, ack 3131663117, win 85, options [nop,nop,TS val 3792418189 ecr 1097123670], length 4
 00:00:27.311357 IP 10.0.0.8.44998 > 10.0.0.6.1883: Flags [.], ack 2787521215, win 83, options [nop,nop,TS val 1097123715 ecr 3792418189], length 0
 00:00:28.267420 IP 10.0.0.8.44998 > 10.0.0.6.1883: Flags [P.], seq 3131663117:3131663512, ack 2787521215, win 83, options [nop,nop,TS val 1097124670 ecr 3792418189], length 395
 00:00:28.268439 IP 10.0.0.6.1883 > 10.0.0.8.44998: Flags [P.], seq 2787521215:2787521219, ack 3131663512, win 85, options [nop,nop,TS val 3792419190 ecr 1097124670], length 4
 00:00:28.269695 IP 10.0.0.8.44998 > 10.0.0.6.1883: Flags [.], ack 2787521219, win 83, options [nop,nop,TS val 1097124673 ecr 3792419190], length 0
 00:00:28.269817 IP 10.0.0.8.44998 > 10.0.0.6.1883: Flags [P.], seq 3131663512:3131663516, ack 2787521219, win 83, options [nop,nop,TS val 1097124673 ecr 3792419190], length 4
 00:00:28.270175 IP 10.0.0.6.1883 > 10.0.0.8.44998: Flags [P.], seq 2787521219:2787521223, ack 3131663516, win 85, options [nop,nop,TS val 3792419192 ecr 1097124673], length 4
 00:00:28.311454 IP 10.0.0.8.44998 > 10.0.0.6.1883: Flags [.], ack 2787521223, win 83, options [nop,nop,TS val 1097124715 ecr 3792419192], length 0
 00:00:29.095009 IP 10.0.0.8.44998 > 10.0.0.6.1883: Flags [P.], seq 3131663516:3131663518, ack 2787521223, win 83, options [nop,nop,TS val 1097125498 ecr 3792419192], length 2
 00:00:29.095342 IP 10.0.0.6.1883 > 10.0.0.8.44998: Flags [P.], seq 2787521223:2787521225, ack 3131663518, win 85, options [nop,nop,TS val 3792420017 ecr 1097125498], length 2
 00:00:29.096430 IP 10.0.0.8.44998 > 10.0.0.6.1883: Flags [.], ack 2787521225, win 83, options [nop,nop,TS val 1097125499 ecr 3792420017], length 0
 00:00:29.268440 IP 10.0.0.8.44998 > 10.0.0.6.1883: Flags [P.], seq 3131663518:3131663913, ack 2787521225, win 83, options [nop,nop,TS val 1097125672 ecr 3792420017], length 395
 00:00:29.268697 IP 10.0.0.6.1883 > 10.0.0.8.44998: Flags [P.], seq 2787521225:2787521229, ack 3131663913, win 85, options [nop,nop,TS val 3792420190 ecr 1097125672], length 4
 00:00:29.269255 IP 10.0.0.8.44998 > 10.0.0.6.1883: Flags [.], ack 2787521229, win 83, options [nop,nop,TS val 1097125673 ecr 3792420190], length 0
 00:00:29.269329 IP 10.0.0.8.44998 > 10.0.0.6.1883: Flags [P.], seq 3131663913:3131663917, ack 2787521229, win 83, options [nop,nop,TS val 1097125673 ecr 3792420190], length 4
 00:00:29.269466 IP 10.0.0.6.1883 > 10.0.0.8.44998: Flags [P.], seq 2787521229:2787521233, ack 3131663917, win 85, options [nop,nop,TS val 3792420191 ecr 1097125673], length 4
 00:00:29.311349 IP 10.0.0.8.44998 > 10.0.0.6.1883: Flags [.], ack 2787521233, win 83, options [nop,nop,TS val 1097125715 ecr 3792420191], length 0
 00:00:30.270336 IP 10.0.0.8.44998 > 10.0.0.6.1883: Flags [P.], seq 3131663917:3131664312, ack 2787521233, win 83, options [nop,nop,TS val 1097126673 ecr 3792420191], length 395
 00:00:30.271062 IP 10.0.0.6.1883 > 10.0.0.8.44998: Flags [P.], seq 2787521233:2787521237, ack 3131664312, win 85, options [nop,nop,TS val 3792421192 ecr 1097126673], length 4
 00:00:30.272222 IP 10.0.0.8.44998 > 10.0.0.6.1883: Flags [.], ack 2787521237, win 83, options [nop,nop,TS val 1097126675 ecr 3792421192], length 0
 00:00:30.272619 IP 10.0.0.8.44998 > 10.0.0.6.1883: Flags [P.], seq 3131664312:3131664316, ack 2787521237, win 83, options [nop,nop,TS val 1097126675 ecr 3792421192], length 4
 00:00:30.273423 IP 10.0.0.6.1883 > 10.0.0.8.44998: Flags [P.], seq 2787521237:2787521241, ack 3131664316, win 85, options [nop,nop,TS val 3792421195 ecr 1097126675], length 4
 00:00:30.315677 IP 10.0.0.8.44998 > 10.0.0.6.1883: Flags [.], ack 2787521241, win 83, options [nop,nop,TS val 1097126719 ecr 3792421195], length 0
 00:00:31.272183 IP 10.0.0.8.44998 > 10.0.0.6.1883: Flags [P.], seq 3131664316:3131664711, ack 2787521241, win 83, options [nop,nop,TS val 1097127675 ecr 3792421195], length 395
 00:00:31.273084 IP 10.0.0.6.1883 > 10.0.0.8.44998: Flags [P.], seq 2787521241:2787521245, ack 3131664711, win 85, options [nop,nop,TS val 3792422194 ecr 1097127675], length 4
 00:00:31.274431 IP 10.0.0.8.44998 > 10.0.0.6.1883: Flags [.], ack 2787521245, win 83, options [nop,nop,TS val 1097127677 ecr 3792422194], length 0
 00:00:31.274511 IP 10.0.0.8.44998 > 10.0.0.6.1883: Flags [P.], seq 3131664711:3131664715, ack 2787521245, win 83, options [nop,nop,TS val 1097127677 ecr 3792422194], length 4
 00:00:31.274775 IP 10.0.0.6.1883 > 10.0.0.8.44998: Flags [P.], seq 2787521245:2787521249, ack 3131664715, win 85, options [nop,nop,TS val 3792422196 ecr 1097127677], length 4
 00:00:31.319386 IP 10.0.0.8.44998 > 10.0.0.6.1883: Flags [.], ack 2787521249, win 83, options [nop,nop,TS val 1097127723 ecr 3792422196], length 0
 00:00:32.273604 IP 10.0.0.8.44998 > 10.0.0.6.1883: Flags [P.], seq 3131664715:3131665110, ack 2787521249, win 83, options [nop,nop,TS val 1097128676 ecr 3792422196], length 395
 00:00:32.274527 IP 10.0.0.6.1883 > 10.0.0.8.44998: Flags [P.], seq 2787521249:2787521253, ack 3131665110, win 85, options [nop,nop,TS val 3792423196 ecr 1097128676], length 4
 00:00:32.275926 IP 10.0.0.8.44998 > 10.0.0.6.1883: Flags [.], ack 2787521253, win 83, options [nop,nop,TS val 1097128678 ecr 3792423196], length 0
 00:00:32.276013 IP 10.0.0.8.44998 > 10.0.0.6.1883: Flags [P.], seq 3131665110:3131665114, ack 2787521253, win 83, options [nop,nop,TS val 1097128679 ecr 3792423196], length 4
 00:00:32.276417 IP 10.0.0.6.1883 > 10.0.0.8.44998: Flags [P.], seq 2787521253:2787521257, ack 3131665114, win 85, options [nop,nop,TS val 3792423198 ecr 1097128679], length 4
 00:00:32.319257 IP 10.0.0.8.44998 > 10.0.0.6.1883: Flags [.], ack 2787521257, win 83, options [nop,nop,TS val 1097128722 ecr 3792423198], length 0
 00:00:33.275136 IP 10.0.0.8.44998 > 10.0.0.6.1883: Flags [P.], seq 3131665114:3131665509, ack 2787521257, win 83, options [nop,nop,TS val 1097129677 ecr 3792423198], length 395
 00:00:33.276061 IP 10.0.0.6.1883 > 10.0.0.8.44998: Flags [P.], seq 2787521257:2787521261, ack 3131665509, win 85, options [nop,nop,TS val 3792424197 ecr 1097129677], length 4
 00:00:33.277366 IP 10.0.0.8.44998 > 10.0.0.6.1883: Flags [.], ack 2787521261, win 83, options [nop,nop,TS val 1097129680 ecr 3792424197], length 0
 00:00:33.277446 IP 10.0.0.8.44998 > 10.0.0.6.1883: Flags [P.], seq 3131665509:3131665513, ack 2787521261, win 83, options [nop,nop,TS val 1097129680 ecr 3792424197], length 4
 00:00:33.277762 IP 10.0.0.6.1883 > 10.0.0.8.44998: Flags [P.], seq 2787521261:2787521265, ack 3131665513, win 85, options [nop,nop,TS val 3792424199 ecr 1097129680], length 4
 00:00:33.319666 IP 10.0.0.8.44998 > 10.0.0.6.1883: Flags [.], ack 2787521265, win 83, options [nop,nop,TS val 1097129723 ecr 3792424199], length 0
 00:00:34.097567 IP 10.0.0.8.44998 > 10.0.0.6.1883: Flags [P.], seq 3131665513:3131665515, ack 2787521265, win 83, options [nop,nop,TS val 1097130500 ecr 3792424199], length 2
 00:00:34.098204 IP 10.0.0.6.1883 > 10.0.0.8.44998: Flags [P.], seq 2787521265:2787521267, ack 3131665515, win 85, options [nop,nop,TS val 3792425019 ecr 1097130500], length 2
 00:00:34.099423 IP 10.0.0.8.44998 > 10.0.0.6.1883: Flags [.], ack 2787521267, win 83, options [nop,nop,TS val 1097130502 ecr 3792425019], length 0
 00:00:34.276531 IP 10.0.0.8.44998 > 10.0.0.6.1883: Flags [P.], seq 3131665515:3131665910, ack 2787521267, win 83, options [nop,nop,TS val 1097130679 ecr 3792425019], length 395
 00:00:34.277605 IP 10.0.0.6.1883 > 10.0.0.8.44998: Flags [P.], seq 2787521267:2787521271, ack 3131665910, win 85, options [nop,nop,TS val 3792425199 ecr 1097130679], length 4
 00:00:34.279019 IP 10.0.0.8.44998 > 10.0.0.6.1883: Flags [.], ack 2787521271, win 83, options [nop,nop,TS val 1097130681 ecr 3792425199], length 0
 00:00:34.279021 IP 10.0.0.8.44998 > 10.0.0.6.1883: Flags [P.], seq 3131665910:3131665914, ack 2787521271, win 83, options [nop,nop,TS val 1097130682 ecr 3792425199], length 4
 00:00:34.279287 IP 10.0.0.6.1883 > 10.0.0.8.44998: Flags [P.], seq 2787521271:2787521275, ack 3131665914, win 85, options [nop,nop,TS val 3792425201 ecr 1097130682], length 4
 00:00:34.323901 IP 10.0.0.8.44998 > 10.0.0.6.1883: Flags [.], ack 2787521275, win 83, options [nop,nop,TS val 1097130727 ecr 3792425201], length 0
 00:00:35.277711 IP 10.0.0.8.44998 > 10.0.0.6.1883: Flags [P.], seq 3131665914:3131666309, ack 2787521275, win 83, options [nop,nop,TS val 1097131680 ecr 3792425201], length 395
 00:00:35.278781 IP 10.0.0.6.1883 > 10.0.0.8.44998: Flags [P.], seq 2787521275:2787521279, ack 3131666309, win 85, options [nop,nop,TS val 3792426200 ecr 1097131680], length 4
 00:00:35.280035 IP 10.0.0.8.44998 > 10.0.0.6.1883: Flags [.], ack 2787521279, win 83, options [nop,nop,TS val 1097131683 ecr 3792426200], length 0
 00:00:35.280114 IP 10.0.0.8.44998 > 10.0.0.6.1883: Flags [P.], seq 3131666309:3131666313, ack 2787521279, win 83, options [nop,nop,TS val 1097131683 ecr 3792426200], length 4
 00:00:35.280460 IP 10.0.0.6.1883 > 10.0.0.8.44998: Flags [P.], seq 2787521279:2787521283, ack 3131666313, win 85, options [nop,nop,TS val 3792426202 ecr 1097131683], length 4
 00:00:35.323413 IP 10.0.0.8.44998 > 10.0.0.6.1883: Flags [.], ack 2787521283, win 83, options [nop,nop,TS val 1097131727 ecr 3792426202], length 0
 00:00:36.279800 IP 10.0.0.8.44998 > 10.0.0.6.1883: Flags [P.], seq 3131666313:3131666708, ack 2787521283, win 83, options [nop,nop,TS val 1097132682 ecr 3792426202], length 395
 00:00:36.280819 IP 10.0.0.6.1883 > 10.0.0.8.44998: Flags [P.], seq 2787521283:2787521287, ack 3131666708, win 85, options [nop,nop,TS val 3792427202 ecr 1097132682], length 4
 00:00:36.282229 IP 10.0.0.8.44998 > 10.0.0.6.1883: Flags [.], ack 2787521287, win 83, options [nop,nop,TS val 1097132685 ecr 3792427202], length 0
 00:00:36.282366 IP 10.0.0.8.44998 > 10.0.0.6.1883: Flags [P.], seq 3131666708:3131666712, ack 2787521287, win 83, options [nop,nop,TS val 1097132685 ecr 3792427202], length 4
 00:00:36.282915 IP 10.0.0.6.1883 > 10.0.0.8.44998: Flags [P.], seq 2787521287:2787521291, ack 3131666712, win 85, options [nop,nop,TS val 3792427204 ecr 1097132685], length 4
 00:00:36.327412 IP 10.0.0.8.44998 > 10.0.0.6.1883: Flags [.], ack 2787521291, win 83, options [nop,nop,TS val 1097132731 ecr 3792427204], length 0
 00:00:37.281056 IP 10.0.0.8.44998 > 10.0.0.6.1883: Flags [P.], seq 3131666712:3131667107, ack 2787521291, win 83, options [nop,nop,TS val 1097133683 ecr 3792427204], length 395
 00:00:37.282095 IP 10.0.0.6.1883 > 10.0.0.8.44998: Flags [P.], seq 2787521291:2787521295, ack 3131667107, win 85, options [nop,nop,TS val 3792428203 ecr 1097133683], length 4
 00:00:37.283510 IP 10.0.0.8.44998 > 10.0.0.6.1883: Flags [.], ack 2787521295, win 83, options [nop,nop,TS val 1097133686 ecr 3792428203], length 0
 00:00:37.283608 IP 10.0.0.8.44998 > 10.0.0.6.1883: Flags [P.], seq 3131667107:3131667111, ack 2787521295, win 83, options [nop,nop,TS val 1097133686 ecr 3792428203], length 4
 00:00:37.283858 IP 10.0.0.6.1883 > 10.0.0.8.44998: Flags [P.], seq 2787521295:2787521299, ack 3131667111, win 85, options [nop,nop,TS val 3792428205 ecr 1097133686], length 4
 00:00:37.327360 IP 10.0.0.8.44998 > 10.0.0.6.1883: Flags [.], ack 2787521299, win 83, options [nop,nop,TS val 1097133731 ecr 3792428205], length 0
 00:00:38.282628 IP 10.0.0.8.44998 > 10.0.0.6.1883: Flags [P.], seq 3131667111:3131667506, ack 2787521299, win 83, options [nop,nop,TS val 1097134685 ecr 3792428205], length 395
 00:00:38.283650 IP 10.0.0.6.1883 > 10.0.0.8.44998: Flags [P.], seq 2787521299:2787521303, ack 3131667506, win 85, options [nop,nop,TS val 3792429205 ecr 1097134685], length 4
 00:00:38.285034 IP 10.0.0.8.44998 > 10.0.0.6.1883: Flags [.], ack 2787521303, win 83, options [nop,nop,TS val 1097134687 ecr 3792429205], length 0
 00:00:38.285114 IP 10.0.0.8.44998 > 10.0.0.6.1883: Flags [P.], seq 3131667506:3131667510, ack 2787521303, win 83, options [nop,nop,TS val 1097134688 ecr 3792429205], length 4
 00:00:38.285433 IP 10.0.0.6.1883 > 10.0.0.8.44998: Flags [P.], seq 2787521303:2787521307, ack 3131667510, win 85, options [nop,nop,TS val 3792429207 ecr 1097134688], length 4
 00:00:38.327744 IP 10.0.0.8.44998 > 10.0.0.6.1883: Flags [.], ack 2787521307, win 83, options [nop,nop,TS val 1097134731 ecr 3792429207], length 0
 00:00:39.099648 IP 10.0.0.8.44998 > 10.0.0.6.1883: Flags [P.], seq 3131667510:3131667512, ack 2787521307, win 83, options [nop,nop,TS val 1097135502 ecr 3792429207], length 2
 00:00:39.099990 IP 10.0.0.6.1883 > 10.0.0.8.44998: Flags [P.], seq 2787521307:2787521309, ack 3131667512, win 85, options [nop,nop,TS val 3792430021 ecr 1097135502], length 2
 00:00:39.101465 IP 10.0.0.8.44998 > 10.0.0.6.1883: Flags [.], ack 2787521309, win 83, options [nop,nop,TS val 1097135504 ecr 3792430021], length 0
 00:00:39.283841 IP 10.0.0.8.44998 > 10.0.0.6.1883: Flags [P.], seq 3131667512:3131667907, ack 2787521309, win 83, options [nop,nop,TS val 1097135686 ecr 3792430021], length 395
 00:00:39.284705 IP 10.0.0.6.1883 > 10.0.0.8.44998: Flags [P.], seq 2787521309:2787521313, ack 3131667907, win 85, options [nop,nop,TS val 3792430206 ecr 1097135686], length 4
 00:00:39.285798 IP 10.0.0.8.44998 > 10.0.0.6.1883: Flags [.], ack 2787521313, win 83, options [nop,nop,TS val 1097135689 ecr 3792430206], length 0
 00:00:39.286475 IP 10.0.0.8.44998 > 10.0.0.6.1883: Flags [P.], seq 3131667907:3131667911, ack 2787521313, win 83, options [nop,nop,TS val 1097135689 ecr 3792430206], length 4
 00:00:39.286762 IP 10.0.0.6.1883 > 10.0.0.8.44998: Flags [P.], seq 2787521313:2787521317, ack 3131667911, win 85, options [nop,nop,TS val 3792430208 ecr 1097135689], length 4
 00:00:39.331587 IP 10.0.0.8.44998 > 10.0.0.6.1883: Flags [.], ack 2787521317, win 83, options [nop,nop,TS val 1097135735 ecr 3792430208], length 0
 00:00:40.285133 IP 10.0.0.8.44998 > 10.0.0.6.1883: Flags [P.], seq 3131667911:3131668306, ack 2787521317, win 83, options [nop,nop,TS val 1097136687 ecr 3792430208], length 395
 00:00:40.286432 IP 10.0.0.6.1883 > 10.0.0.8.44998: Flags [P.], seq 2787521317:2787521321, ack 3131668306, win 85, options [nop,nop,TS val 3792431208 ecr 1097136687], length 4
 00:00:40.287115 IP 10.0.0.8.44998 > 10.0.0.6.1883: Flags [.], ack 2787521321, win 83, options [nop,nop,TS val 1097136690 ecr 3792431208], length 0
