 00:00:00.000000 IP6 fe80::d081:80ff:feb9:ed53 > ff02::2: ICMP6, router solicitation, length 16
 00:00:00.378567 IP6 fe80::cc4d:f7ff:fe7d:5dda > ff02::2: ICMP6, router solicitation, length 16
 00:00:00.484552 IP6 fe80::b8e6:e6ff:fe54:7281 > ff02::2: ICMP6, router solicitation, length 16
 00:00:00.742646 IP6 fe80::201f:3fff:fe09:a776 > ff02::2: ICMP6, router solicitation, length 16
 00:00:01.317661 IP6 fe80::ec51:ff:fe4d:5364 > ff02::2: ICMP6, router solicitation, length 16
 00:00:01.776121 IP6 fe80::b4fd:9cff:fe8b:4787 > ff02::2: ICMP6, router solicitation, length 16
 00:00:03.314717 IP6 fe80::9ced:13ff:fec2:88b6 > ff02::2: ICMP6, router solicitation, length 16
 00:00:03.343733 IP6 fe80::140b:85ff:fee0:1258 > ff02::2: ICMP6, router solicitation, length 16
 00:00:03.357116 IP6 fe80::d41b:2dff:fe8d:a5f8 > ff02::2: ICMP6, router solicitation, length 16
 00:00:03.367633 IP6 fe80::9c17:e8ff:fe47:6b2 > ff02::2: ICMP6, router solicitation, length 16
 00:00:03.377175 IP6 fe80::382d:15ff:fe12:345c > ff02::2: ICMP6, router solicitation, length 16
 00:00:03.383164 IP6 fe80::2845:d5ff:feb4:e544 > ff02::2: ICMP6, router solicitation, length 16
 00:00:03.391744 IP6 fe80::a033:d2ff:fe0b:b2cf > ff02::2: ICMP6, router solicitation, length 16
 00:00:07.419113 IP6 fe80::8cbd:a1ff:fe95:b104 > ff02::2: ICMP6, router solicitation, length 16
 00:00:09.854071 ARP, Request who-has 10.0.0.6 tell 10.0.0.8, length 28
 00:00:09.856349 ARP, Reply 10.0.0.6 is-at ba:e6:e6:54:72:81, length 28
 00:00:09.898463 IP 10.0.0.8.44970 > 10.0.0.6.1883: Flags [S], seq 340581890, win 42340, options [mss 1460,sackOK,TS val 1096906553 ecr 0,nop,wscale 9], length 0
 00:00:09.900566 IP 10.0.0.6.1883 > 10.0.0.8.44970: Flags [S.], seq 2894247760, ack 340581891, win 43440, options [mss 1460,sackOK,TS val 3792201143 ecr 1096906553,nop,wscale 9], length 0
 00:00:09.914567 IP 10.0.0.8.44970 > 10.0.0.6.1883: Flags [.], ack 2894247761, win 83, options [nop,nop,TS val 1096906636 ecr 3792201143], length 0
 00:00:09.916128 IP 10.0.0.8.44970 > 10.0.0.6.1883: Flags [P.], seq 340581891:340581911, ack 2894247761, win 83, options [nop,nop,TS val 1096906636 ecr 3792201143], length 20
 00:00:09.916180 IP 10.0.0.6.1883 > 10.0.0.8.44970: Flags [.], ack 340581911, win 85, options [nop,nop,TS val 3792201160 ecr 1096906636], length 0
 00:00:09.919542 IP 10.0.0.6.1883 > 10.0.0.8.44970: Flags [P.], seq 2894247761:2894247765, ack 340581911, win 85, options [nop,nop,TS val 3792201161 ecr 1096906636], length 4
 00:00:09.924141 IP 10.0.0.8.44970 > 10.0.0.6.1883: Flags [.], ack 2894247765, win 83, options [nop,nop,TS val 1096906650 ecr 3792201161], length 0
 00:00:09.925391 IP 10.0.0.8.44970 > 10.0.0.6.1883: Flags [P.], seq 340581911:340581975, ack 2894247765, win 83, options [nop,nop,TS val 1096906651 ecr 3792201161], length 64
 00:00:09.925820 IP 10.0.0.6.1883 > 10.0.0.8.44970: Flags [P.], seq 2894247765:2894247830, ack 340581975, win 85, options [nop,nop,TS val 3792201170 ecr 1096906651], length 65
 00:00:09.932123 IP 10.0.0.8.44970 > 10.0.0.6.1883: Flags [P.], seq 340581975:340582370, ack 2894247830, win 83, options [nop,nop,TS val 1096906658 ecr 3792201170], length 395
 00:00:09.932210 IP 10.0.0.6.1883 > 10.0.0.8.44970: Flags [P.], seq 2894247830:2894247835, ack 340582370, win 85, options [nop,nop,TS val 3792201176 ecr 1096906658], length 5
 00:00:10.033847 IP 10.0.0.8.44970 > 10.0.0.6.1883: Flags [.], ack 2894247835, win 83, options [nop,nop,TS val 1096906759 ecr 3792201176], length 0
 00:00:10.033946 IP 10.0.0.6.1883 > 10.0.0.8.44970: Flags [P.], seq 2894247835:2894247839, ack 340582370, win 85, options [nop,nop,TS val 3792201278 ecr 1096906759], length 4
 00:00:10.073659 IP 10.0.0.8.44970 > 10.0.0.6.1883: Flags [.], ack 2894247839, win 83, options [nop,nop,TS val 1096906797 ecr 3792201278], length 0
 00:00:10.073911 IP 10.0.0.8.44970 > 10.0.0.6.1883: Flags [P.], seq 340582370:340582374, ack 2894247839, win 83, options [nop,nop,TS val 1096906798 ecr 3792201278], length 4
 00:00:10.074243 IP 10.0.0.6.1883 > 10.0.0.8.44970: Flags [P.], seq 2894247839:2894247843, ack 340582374, win 85, options [nop,nop,TS val 3792201318 ecr 1096906798], length 4
 00:00:10.241280 IP 10.0.0.8.44970 > 10.0.0.6.1883: Flags [.], ack 2894247843, win 83, options [nop,nop,TS val 1096906967 ecr 3792201318], length 0
 00:00:10.885223 IP 10.0.0.8.44970 > 10.0.0.6.1883: Flags [P.], seq 340582374:340582769, ack 2894247843, win 83, options [nop,nop,TS val 1096907610 ecr 3792201318], length 395
 00:00:10.885887 IP 10.0.0.6.1883 > 10.0.0.8.44970: Flags [P.], seq 2894247843:2894247847, ack 340582769, win 85, options [nop,nop,TS val 3792202130 ecr 1096907610], length 4
 00:00:10.887732 IP 10.0.0.8.44970 > 10.0.0.6.1883: Flags [.], ack 2894247847, win 83, options [nop,nop,TS val 1096907612 ecr 3792202130], length 0
 00:00:10.887820 IP 10.0.0.8.44970 > 10.0.0.6.1883: Flags [P.], seq 340582769:340582773, ack 2894247847, win 83, options [nop,nop,TS val 1096907613 ecr 3792202130], length 4
 00:00:10.888115 IP 10.0.0.6.1883 > 10.0.0.8.44970: Flags [P.], seq 2894247847:2894247851, ack 340582773, win 85, options [nop,nop,TS val 3792202132 ecr 1096907613], length 4
 00:00:11.114855 IP 10.0.0.8.44970 > 10.0.0.6.1883: Flags [.], ack 2894247851, win 83, options [nop,nop,TS val 1096907659 ecr 3792202132], length 0
 00:00:11.944032 IP 10.0.0.8.44970 > 10.0.0.6.1883: Flags [P.], seq 340582773:340583168, ack 2894247851, win 83, options [nop,nop,TS val 1096908669 ecr 3792202132], length 395
 00:00:11.948454 IP 10.0.0.6.1883 > 10.0.0.8.44970: Flags [P.], seq 2894247851:2894247855, ack 340583168, win 85, options [nop,nop,TS val 3792203189 ecr 1096908669], length 4
 00:00:11.955893 IP 10.0.0.8.44970 > 10.0.0.6.1883: Flags [.], ack 2894247855, win 83, options [nop,nop,TS val 1096908682 ecr 3792203189], length 0
 00:00:11.957770 IP 10.0.0.8.44970 > 10.0.0.6.1883: Flags [P.], seq 340583168:340583172, ack 2894247855, win 83, options [nop,nop,TS val 1096908682 ecr 3792203189], length 4
 00:00:11.958158 IP 10.0.0.6.1883 > 10.0.0.8.44970: Flags [P.], seq 2894247855:2894247859, ack 340583172, win 85, options [nop,nop,TS val 3792203202 ecr 1096908682], length 4
 00:00:12.165544 IP 10.0.0.8.44970 > 10.0.0.6.1883: Flags [.], ack 2894247859, win 83, options [nop,nop,TS val 1096908727 ecr 3792203202], length 0
 00:00:13.164926 IP 10.0.0.8.44970 > 10.0.0.6.1883: Flags [P.], seq 340583172:340583567, ack 2894247859, win 83, options [nop,nop,TS val 1096909890 ecr 3792203202], length 395
 00:00:13.166100 IP 10.0.0.6.1883 > 10.0.0.8.44970: Flags [P.], seq 2894247859:2894247863, ack 340583567, win 85, options [nop,nop,TS val 3792204410 ecr 1096909890], length 4
 00:00:13.168268 IP 10.0.0.8.44970 > 10.0.0.6.1883: Flags [.], ack 2894247863, win 83, options [nop,nop,TS val 1096909893 ecr 3792204410], length 0
 00:00:13.168403 IP 10.0.0.8.44970 > 10.0.0.6.1883: Flags [P.], seq 340583567:340583571, ack 2894247863, win 83, options [nop,nop,TS val 1096909893 ecr 3792204410], length 4
 00:00:13.168627 IP 10.0.0.6.1883 > 10.0.0.8.44970: Flags [P.], seq 2894247863:2894247867, ack 340583571, win 85, options [nop,nop,TS val 3792204413 ecr 1096909893], length 4
 00:00:13.259706 IP 10.0.0.8.44970 > 10.0.0.6.1883: Flags [.], ack 2894247867, win 83, options [nop,nop,TS val 1096909939 ecr 3792204413], length 0
 00:00:14.264777 IP 10.0.0.8.44970 > 10.0.0.6.1883: Flags [P.], seq 340583571:340583966, ack 2894247867, win 83, options [nop,nop,TS val 1096910990 ecr 3792204413], length 395
 00:00:14.265910 IP 10.0.0.6.1883 > 10.0.0.8.44970: Flags [P.], seq 2894247867:2894247871, ack 340583966, win 85, options [nop,nop,TS val 3792205509 ecr 1096910990], length 4
 00:00:14.266900 IP 10.0.0.8.44970 > 10.0.0.6.1883: Flags [.], ack 2894247871, win 83, options [nop,nop,TS val 1096910993 ecr 3792205509], length 0
 00:00:14.268355 IP 10.0.0.8.44970 > 10.0.0.6.1883: Flags [P.], seq 340583966:340583970, ack 2894247871, win 83, options [nop,nop,TS val 1096910993 ecr 3792205509], length 4
 00:00:14.268629 IP 10.0.0.6.1883 > 10.0.0.8.44970: Flags [P.], seq 2894247871:2894247875, ack 340583970, win 85, options [nop,nop,TS val 3792205513 ecr 1096910993], length 4
 00:00:14.313180 IP 10.0.0.8.44970 > 10.0.0.6.1883: Flags [.], ack 2894247875, win 83, options [nop,nop,TS val 1096911039 ecr 3792205513], length 0
 00:00:14.934869 IP 10.0.0.8.44970 > 10.0.0.6.1883: Flags [P.], seq 340583970:340583972, ack 2894247875, win 83, options [nop,nop,TS val 1096911660 ecr 3792205513], length 2
 00:00:14.935176 IP 10.0.0.6.1883 > 10.0.0.8.44970: Flags [P.], seq 2894247875:2894247877, ack 340583972, win 85, options [nop,nop,TS val 3792206179 ecr 1096911660], length 2
 00:00:14.935927 IP 10.0.0.8.44970 > 10.0.0.6.1883: Flags [.], ack 2894247877, win 83, options [nop,nop,TS val 1096911662 ecr 3792206179], length 0
 00:00:15.266142 IP 10.0.0.8.44970 > 10.0.0.6.1883: Flags [P.], seq 340583972:340584367, ack 2894247877, win 83, options [nop,nop,TS val 1096911992 ecr 3792206179], length 395
 00:00:15.266730 IP 10.0.0.6.1883 > 10.0.0.8.44970: Flags [P.], seq 2894247877:2894247881, ack 340584367, win 85, options [nop,nop,TS val 3792206511 ecr 1096911992], length 4
 00:00:15.267497 IP 10.0.0.8.44970 > 10.0.0.6.1883: Flags [.], ack 2894247881, win 83, options [nop,nop,TS val 1096911993 ecr 3792206511], length 0
 00:00:15.267729 IP 10.0.0.8.44970 > 10.0.0.6.1883: Flags [P.], seq 340584367:340584371, ack 2894247881, win 83, options [nop,nop,TS val 1096911993 ecr 3792206511], length 4
 00:00:15.268195 IP 10.0.0.6.1883 > 10.0.0.8.44970: Flags [P.], seq 2894247881:2894247885, ack 340584371, win 85, options [nop,nop,TS val 3792206512 ecr 1096911993], length 4
 00:00:15.355842 IP 10.0.0.8.44970 > 10.0.0.6.1883: Flags [.], ack 2894247885, win 83, options [nop,nop,TS val 1096912082 ecr 3792206512], length 0
 00:00:16.267382 IP 10.0.0.8.44970 > 10.0.0.6.1883: Flags [P.], seq 340584371:340584766, ack 2894247885, win 83, options [nop,nop,TS val 1096912993 ecr 3792206512], length 395
 00:00:16.269463 IP 10.0.0.6.1883 > 10.0.0.8.44970: Flags [P.], seq 2894247885:2894247889, ack 340584766, win 85, options [nop,nop,TS val 3792207513 ecr 1096912993], length 4
 00:00:16.270813 IP 10.0.0.8.44970 > 10.0.0.6.1883: Flags [.], ack 2894247889, win 83, options [nop,nop,TS val 1096912996 ecr 3792207513], length 0
 00:00:16.271253 IP 10.0.0.8.44970 > 10.0.0.6.1883: Flags [P.], seq 340584766:340584770, ack 2894247889, win 83, options [nop,nop,TS val 1096912996 ecr 3792207513], length 4
 00:00:16.271582 IP 10.0.0.6.1883 > 10.0.0.8.44970: Flags [P.], seq 2894247889:2894247893, ack 340584770, win 85, options [nop,nop,TS val 3792207516 ecr 1096912996], length 4
 00:00:16.480945 IP 10.0.0.8.44970 > 10.0.0.6.1883: Flags [.], ack 2894247893, win 83, options [nop,nop,TS val 1096913082 ecr 3792207516], length 0
 00:00:17.268786 IP 10.0.0.8.44970 > 10.0.0.6.1883: Flags [P.], seq 340584770:340585165, ack 2894247893, win 83, options [nop,nop,TS val 1096913994 ecr 3792207516], length 395
 00:00:17.269183 IP 10.0.0.6.1883 > 10.0.0.8.44970: Flags [P.], seq 2894247893:2894247897, ack 340585165, win 85, options [nop,nop,TS val 3792208513 ecr 1096913994], length 4
 00:00:17.331667 IP 10.0.0.8.44970 > 10.0.0.6.1883: Flags [.], ack 2894247897, win 83, options [nop,nop,TS val 1096914057 ecr 3792208513], length 0
 00:00:17.332020 IP 10.0.0.8.44970 > 10.0.0.6.1883: Flags [P.], seq 340585165:340585169, ack 2894247897, win 83, options [nop,nop,TS val 1096914057 ecr 3792208513], length 4
 00:00:17.332244 IP 10.0.0.6.1883 > 10.0.0.8.44970: Flags [P.], seq 2894247897:2894247901, ack 340585169, win 85, options [nop,nop,TS val 3792208576 ecr 1096914057], length 4
 00:00:17.534652 IP 10.0.0.8.44970 > 10.0.0.6.1883: Flags [.], ack 2894247901, win 83, options [nop,nop,TS val 1096914247 ecr 3792208576], length 0
 00:00:18.333143 IP 10.0.0.8.44970 > 10.0.0.6.1883: Flags [P.], seq 340585169:340585564, ack 2894247901, win 83, options [nop,nop,TS val 1096915059 ecr 3792208576], length 395
 00:00:18.333822 IP 10.0.0.6.1883 > 10.0.0.8.44970: Flags [P.], seq 2894247901:2894247905, ack 340585564, win 85, options [nop,nop,TS val 3792209578 ecr 1096915059], length 4
 00:00:18.335323 IP 10.0.0.8.44970 > 10.0.0.6.1883: Flags [.], ack 2894247905, win 83, options [nop,nop,TS val 1096915060 ecr 3792209578], length 0
 00:00:18.335450 IP 10.0.0.8.44970 > 10.0.0.6.1883: Flags [P.], seq 340585564:340585568, ack 2894247905, win 83, options [nop,nop,TS val 1096915060 ecr 3792209578], length 4
 00:00:18.335863 IP 10.0.0.6.1883 > 10.0.0.8.44970: Flags [P.], seq 2894247905:2894247909, ack 340585568, win 85, options [nop,nop,TS val 3792209580 ecr 1096915060], length 4
 00:00:18.397598 IP 10.0.0.8.44970 > 10.0.0.6.1883: Flags [.], ack 2894247909, win 83, options [nop,nop,TS val 1096915123 ecr 3792209580], length 0
 00:00:19.334436 IP 10.0.0.8.44970 > 10.0.0.6.1883: Flags [P.], seq 340585568:340585963, ack 2894247909, win 83, options [nop,nop,TS val 1096916060 ecr 3792209580], length 395
 00:00:19.335655 IP 10.0.0.6.1883 > 10.0.0.8.44970: Flags [P.], seq 2894247909:2894247913, ack 340585963, win 85, options [nop,nop,TS val 3792210579 ecr 1096916060], length 4
 00:00:19.337164 IP 10.0.0.8.44970 > 10.0.0.6.1883: Flags [.], ack 2894247913, win 83, options [nop,nop,TS val 1096916062 ecr 3792210579], length 0
 00:00:19.337881 IP 10.0.0.8.44970 > 10.0.0.6.1883: Flags [P.], seq 340585963:340585967, ack 2894247913, win 83, options [nop,nop,TS val 1096916063 ecr 3792210579], length 4
 00:00:19.338421 IP 10.0.0.6.1883 > 10.0.0.8.44970: Flags [P.], seq 2894247913:2894247917, ack 340585967, win 85, options [nop,nop,TS val 3792210582 ecr 1096916063], length 4
 00:00:19.385406 IP 10.0.0.8.44970 > 10.0.0.6.1883: Flags [.], ack 2894247917, win 83, options [nop,nop,TS val 1096916111 ecr 3792210582], length 0
 00:00:19.936537 IP 10.0.0.8.44970 > 10.0.0.6.1883: Flags [P.], seq 340585967:340585969, ack 2894247917, win 83, options [nop,nop,TS val 1096916661 ecr 3792210582], length 2
 00:00:19.937089 IP 10.0.0.6.1883 > 10.0.0.8.44970: Flags [P.], seq 2894247917:2894247919, ack 340585969, win 85, options [nop,nop,TS val 3792211181 ecr 1096916661], length 2
 00:00:19.937997 IP 10.0.0.8.44970 > 10.0.0.6.1883: Flags [.], ack 2894247919, win 83, options [nop,nop,TS val 1096916664 ecr 3792211181], length 0
 00:00:20.336633 IP 10.0.0.8.44970 > 10.0.0.6.1883: Flags [P.], seq 340585969:340586364, ack 2894247919, win 83, options [nop,nop,TS val 1096917061 ecr 3792211181], length 395
 00:00:20.337628 IP 10.0.0.6.1883 > 10.0.0.8.44970: Flags [P.], seq 2894247919:2894247923, ack 340586364, win 85, options [nop,nop,TS val 3792211582 ecr 1096917061], length 4
 00:00:20.339141 IP 10.0.0.8.44970 > 10.0.0.6.1883: Flags [.], ack 2894247923, win 83, options [nop,nop,TS val 1096917064 ecr 3792211582], length 0
 00:00:20.339232 IP 10.0.0.8.44970 > 10.0.0.6.1883: Flags [P.], seq 340586364:340586368, ack 2894247923, win 83, options [nop,nop,TS val 1096917064 ecr 3792211582], length 4
 00:00:20.339508 IP 10.0.0.6.1883 > 10.0.0.8.44970: Flags [P.], seq 2894247923:2894247927, ack 340586368, win 85, options [nop,nop,TS val 3792211583 ecr 1096917064], length 4
 00:00:20.401422 IP 10.0.0.8.44970 > 10.0.0.6.1883: Flags [.], ack 2894247927, win 83, options [nop,nop,TS val 1096917127 ecr 3792211583], length 0
 00:00:21.337214 IP 10.0.0.8.44970 > 10.0.0.6.1883: Flags [P.], seq 340586368:340586763, ack 2894247927, win 83, options [nop,nop,TS val 1096918062 ecr 3792211583], length 395
 00:00:21.337878 IP 10.0.0.6.1883 > 10.0.0.8.44970: Flags [P.], seq 2894247927:2894247931, ack 340586763, win 85, options [nop,nop,TS val 3792212582 ecr 1096918062], length 4
 00:00:21.382751 IP 10.0.0.8.44970 > 10.0.0.6.1883: Flags [.], ack 2894247931, win 83, options [nop,nop,TS val 1096918108 ecr 3792212582], length 0
 00:00:21.383349 IP 10.0.0.8.44970 > 10.0.0.6.1883: Flags [P.], seq 340586763:340586767, ack 2894247931, win 83, options [nop,nop,TS val 1096918109 ecr 3792212582], length 4
 00:00:21.383781 IP 10.0.0.6.1883 > 10.0.0.8.44970: Flags [P.], seq 2894247931:2894247935, ack 340586767, win 85, options [nop,nop,TS val 3792212628 ecr 1096918109], length 4
 00:00:21.434389 IP 10.0.0.8.44970 > 10.0.0.6.1883: Flags [.], ack 2894247935, win 83, options [nop,nop,TS val 1096918160 ecr 3792212628], length 0
 00:00:22.336860 IP 10.0.0.8.44970 > 10.0.0.6.1883: Flags [P.], seq 340586767:340587162, ack 2894247935, win 83, options [nop,nop,TS val 1096919063 ecr 3792212628], length 395
 00:00:22.337079 IP 10.0.0.6.1883 > 10.0.0.8.44970: Flags [P.], seq 2894247935:2894247939, ack 340587162, win 85, options [nop,nop,TS val 3792213581 ecr 1096919063], length 4
 00:00:22.337637 IP 10.0.0.8.44970 > 10.0.0.6.1883: Flags [.], ack 2894247939, win 83, options [nop,nop,TS val 1096919063 ecr 3792213581], length 0
 00:00:22.337638 IP 10.0.0.8.44970 > 10.0.0.6.1883: Flags [P.], seq 340587162:340587166, ack 2894247939, win 83, options [nop,nop,TS val 1096919063 ecr 3792213581], length 4
 00:00:22.337797 IP 10.0.0.6.1883 > 10.0.0.8.44970: Flags [P.], seq 2894247939:2894247943, ack 340587166, win 85, options [nop,nop,TS val 3792213582 ecr 1096919063], length 4
 00:00:22.380670 IP 10.0.0.8.44970 > 10.0.0.6.1883: Flags [.], ack 2894247943, win 83, options [nop,nop,TS val 1096919107 ecr 3792213582], length 0
 00:00:23.339599 IP 10.0.0.8.44970 > 10.0.0.6.1883: Flags [P.], seq 340587166:340587561, ack 2894247943, win 83, options [nop,nop,TS val 1096920066 ecr 3792213582], length 395
 00:00:23.339906 IP 10.0.0.6.1883 > 10.0.0.8.44970: Flags [P.], seq 2894247943:2894247947, ack 340587561, win 85, options [nop,nop,TS val 3792214584 ecr 1096920066], length 4
 00:00:23.340466 IP 10.0.0.8.44970 > 10.0.0.6.1883: Flags [.], ack 2894247947, win 83, options [nop,nop,TS val 1096920066 ecr 3792214584], length 0
 00:00:23.340595 IP 10.0.0.8.44970 > 10.0.0.6.1883: Flags [P.], seq 340587561:340587565, ack 2894247947, win 83, options [nop,nop,TS val 1096920067 ecr 3792214584], length 4
 00:00:23.340719 IP 10.0.0.6.1883 > 10.0.0.8.44970: Flags [P.], seq 2894247947:2894247951, ack 340587565, win 85, options [nop,nop,TS val 3792214585 ecr 1096920067], length 4
 00:00:23.384675 IP 10.0.0.8.44970 > 10.0.0.6.1883: Flags [.], ack 2894247951, win 83, options [nop,nop,TS val 1096920110 ecr 3792214585], length 0
 00:00:24.350018 IP 10.0.0.8.44970 > 10.0.0.6.1883: Flags [P.], seq 340587565:340587960, ack 2894247951, win 83, options [nop,nop,TS val 1096921076 ecr 3792214585], length 395
 00:00:24.350245 IP 10.0.0.6.1883 > 10.0.0.8.44970: Flags [P.], seq 2894247951:2894247955, ack 340587960, win 85, options [nop,nop,TS val 3792215594 ecr 1096921076], length 4
 00:00:24.350575 IP 10.0.0.8.44970 > 10.0.0.6.1883: Flags [.], ack 2894247955, win 83, options [nop,nop,TS val 1096921076 ecr 3792215594], length 0
 00:00:24.350672 IP 10.0.0.8.44970 > 10.0.0.6.1883: Flags [P.], seq 340587960:340587964, ack 2894247955, win 83, options [nop,nop,TS val 1096921077 ecr 3792215594], length 4
 00:00:24.350742 IP 10.0.0.6.1883 > 10.0.0.8.44970: Flags [P.], seq 2894247955:2894247959, ack 340587964, win 85, options [nop,nop,TS val 3792215595 ecr 1096921077], length 4
 00:00:24.392468 IP 10.0.0.8.44970 > 10.0.0.6.1883: Flags [.], ack 2894247959, win 83, options [nop,nop,TS val 1096921118 ecr 3792215595], length 0
 00:00:24.937894 IP 10.0.0.8.44970 > 10.0.0.6.1883: Flags [P.], seq 340587964:340587966, ack 2894247959, win 83, options [nop,nop,TS val 1096921664 ecr 3792215595], length 2
 00:00:24.938234 IP 10.0.0.6.1883 > 10.0.0.8.44970: Flags [P.], seq 2894247959:2894247961, ack 340587966, win 85, options [nop,nop,TS val 3792216182 ecr 1096921664], length 2
 00:00:24.939187 IP 10.0.0.8.44970 > 10.0.0.6.1883: Flags [.], ack 2894247961, win 83, options [nop,nop,TS val 1096921665 ecr 3792216182], length 0
 00:00:25.354283 IP 10.0.0.8.44970 > 10.0.0.6.1883: Flags [P.], seq 340587966:340588361, ack 2894247961, win 83, options [nop,nop,TS val 1096922080 ecr 3792216182], length 395
 00:00:25.355019 IP 10.0.0.6.1883 > 10.0.0.8.44970: Flags [P.], seq 2894247961:2894247965, ack 340588361, win 85, options [nop,nop,TS val 3792216599 ecr 1096922080], length 4
 00:00:25.356332 IP 10.0.0.8.44970 > 10.0.0.6.1883: Flags [.], ack 2894247965, win 83, options [nop,nop,TS val 1096922081 ecr 3792216599], length 0
 00:00:25.356532 IP 10.0.0.8.44970 > 10.0.0.6.1883: Flags [P.], seq 340588361:340588365, ack 2894247965, win 83, options [nop,nop,TS val 1096922082 ecr 3792216599], length 4
 00:00:25.356801 IP 10.0.0.6.1883 > 10.0.0.8.44970: Flags [P.], seq 2894247965:2894247969, ack 340588365, win 85, options [nop,nop,TS val 3792216601 ecr 1096922082], length 4
 00:00:25.401186 IP 10.0.0.8.44970 > 10.0.0.6.1883: Flags [.], ack 2894247969, win 83, options [nop,nop,TS val 1096922127 ecr 3792216601], length 0
 00:00:26.355570 IP 10.0.0.8.44970 > 10.0.0.6.1883: Flags [P.], seq 340588365:340588760, ack 2894247969, win 83, options [nop,nop,TS val 1096923081 ecr 3792216601], length 395
 00:00:26.356179 IP 10.0.0.6.1883 > 10.0.0.8.44970: Flags [P.], seq 2894247969:2894247973, ack 340588760, win 85, options [nop,nop,TS val 3792217600 ecr 1096923081], length 4
 00:00:26.357946 IP 10.0.0.8.44970 > 10.0.0.6.1883: Flags [.], ack 2894247973, win 83, options [nop,nop,TS val 1096923083 ecr 3792217600], length 0
 00:00:26.358582 IP 10.0.0.8.44970 > 10.0.0.6.1883: Flags [P.], seq 340588760:340588764, ack 2894247973, win 83, options [nop,nop,TS val 1096923083 ecr 3792217600], length 4
 00:00:26.358894 IP 10.0.0.6.1883 > 10.0.0.8.44970: Flags [P.], seq 2894247973:2894247977, ack 340588764, win 85, options [nop,nop,TS val 3792217603 ecr 1096923083], length 4
 00:00:26.540574 IP 10.0.0.8.44970 > 10.0.0.6.1883: Flags [.], ack 2894247977, win 83, options [nop,nop,TS val 1096923248 ecr 3792217603], length 0
 00:00:27.356381 IP 10.0.0.8.44970 > 10.0.0.6.1883: Flags [P.], seq 340588764:340589159, ack 2894247977, win 83, options [nop,nop,TS val 1096924082 ecr 3792217603], length 395
 00:00:27.356895 IP 10.0.0.6.1883 > 10.0.0.8.44970: Flags [P.], seq 2894247977:2894247981, ack 340589159, win 85, options [nop,nop,TS val 3792218601 ecr 1096924082], length 4
 00:00:27.357777 IP 10.0.0.8.44970 > 10.0.0.6.1883: Flags [.], ack 2894247981, win 83, options [nop,nop,TS val 1096924083 ecr 3792218601], length 0
 00:00:27.358118 IP 10.0.0.8.44970 > 10.0.0.6.1883: Flags [P.], seq 340589159:340589163, ack 2894247981, win 83, options [nop,nop,TS val 1096924083 ecr 3792218601], length 4
 00:00:27.358269 IP 10.0.0.6.1883 > 10.0.0.8.44970: Flags [P.], seq 2894247981:2894247985, ack 340589163, win 85, options [nop,nop,TS val 3792218602 ecr 1096924083], length 4
 00:00:27.436989 IP 10.0.0.8.44970 > 10.0.0.6.1883: Flags [.], ack 2894247985, win 83, options [nop,nop,TS val 1096924147 ecr 3792218602], length 0
 00:00:28.357520 IP 10.0.0.8.44970 > 10.0.0.6.1883: Flags [P.], seq 340589163:340589558, ack 2894247985, win 83, options [nop,nop,TS val 1096925083 ecr 3792218602], length 395
 00:00:28.357973 IP 10.0.0.6.1883 > 10.0.0.8.44970: Flags [P.], seq 2894247985:2894247989, ack 340589558, win 85, options [nop,nop,TS val 3792219602 ecr 1096925083], length 4
 00:00:28.358341 IP 10.0.0.8.44970 > 10.0.0.6.1883: Flags [.], ack 2894247989, win 83, options [nop,nop,TS val 1096925084 ecr 3792219602], length 0
 00:00:28.358741 IP 10.0.0.8.44970 > 10.0.0.6.1883: Flags [P.], seq 340589558:340589562, ack 2894247989, win 83, options [nop,nop,TS val 1096925084 ecr 3792219602], length 4
 00:00:28.358995 IP 10.0.0.6.1883 > 10.0.0.8.44970: Flags [P.], seq 2894247989:2894247993, ack 340589562, win 85, options [nop,nop,TS val 3792219603 ecr 1096925084], length 4
 00:00:28.403806 IP 10.0.0.8.44970 > 10.0.0.6.1883: Flags [.], ack 2894247993, win 83, options [nop,nop,TS val 1096925130 ecr 3792219603], length 0
 00:00:29.359864 IP 10.0.0.8.44970 > 10.0.0.6.1883: Flags [P.], seq 340589562:340589957, ack 2894247993, win 83, options [nop,nop,TS val 1096926085 ecr 3792219603], length 395
 00:00:29.360295 IP 10.0.0.6.1883 > 10.0.0.8.44970: Flags [P.], seq 2894247993:2894247997, ack 340589957, win 85, options [nop,nop,TS val 3792220604 ecr 1096926085], length 4
 00:00:29.381098 IP 10.0.0.8.44970 > 10.0.0.6.1883: Flags [.], ack 2894247997, win 83, options [nop,nop,TS val 1096926107 ecr 3792220604], length 0
 00:00:29.381392 IP 10.0.0.8.44970 > 10.0.0.6.1883: Flags [P.], seq 340589957:340589961, ack 2894247997, win 83, options [nop,nop,TS val 1096926107 ecr 3792220604], length 4
 00:00:29.381945 IP 10.0.0.6.1883 > 10.0.0.8.44970: Flags [P.], seq 2894247997:2894248001, ack 340589961, win 85, options [nop,nop,TS val 3792220626 ecr 1096926107], length 4
 00:00:29.449116 IP 10.0.0.8.44970 > 10.0.0.6.1883: Flags [.], ack 2894248001, win 83, options [nop,nop,TS val 1096926151 ecr 3792220626], length 0
 00:00:29.942485 IP 10.0.0.8.44970 > 10.0.0.6.1883: Flags [P.], seq 340589961:340589963, ack 2894248001, win 83, options [nop,nop,TS val 1096926666 ecr 3792220626], length 2
 00:00:29.942910 IP 10.0.0.6.1883 > 10.0.0.8.44970: Flags [P.], seq 2894248001:2894248003, ack 340589963, win 85, options [nop,nop,TS val 3792221187 ecr 1096926666], length 2
 00:00:29.945277 IP 10.0.0.8.44970 > 10.0.0.6.1883: Flags [.], ack 2894248003, win 83, options [nop,nop,TS val 1096926671 ecr 3792221187], length 0
 00:00:29.955311 IP6 fe80::d081:80ff:feb9:ed53 > ff02::2: ICMP6, router solicitation, length 16
 00:00:30.461152 IP 10.0.0.8.44970 > 10.0.0.6.1883: Flags [P.], seq 340589963:340590358, ack 2894248003, win 83, options [nop,nop,TS val 1096927186 ecr 3792221187], length 395
 00:00:30.462183 IP 10.0.0.6.1883 > 10.0.0.8.44970: Flags [P.], seq 2894248003:2894248007, ack 340590358, win 85, options [nop,nop,TS val 3792221706 ecr 1096927186], length 4
 00:00:30.462657 IP 10.0.0.8.44970 > 10.0.0.6.1883: Flags [.], ack 2894248007, win 83, options [nop,nop,TS val 1096927189 ecr 3792221706], length 0
 00:00:30.462930 IP 10.0.0.8.44970 > 10.0.0.6.1883: Flags [P.], seq 340590358:340590362, ack 2894248007, win 83, options [nop,nop,TS val 1096927189 ecr 3792221706], length 4
 00:00:30.463143 IP 10.0.0.6.1883 > 10.0.0.8.44970: Flags [P.], seq 2894248007:2894248011, ack 340590362, win 85, options [nop,nop,TS val 3792221707 ecr 1096927189], length 4
 00:00:30.516226 IP 10.0.0.8.44970 > 10.0.0.6.1883: Flags [.], ack 2894248011, win 83, options [nop,nop,TS val 1096927242 ecr 3792221707], length 0
 00:00:31.461862 IP 10.0.0.8.44970 > 10.0.0.6.1883: Flags [P.], seq 340590362:340590757, ack 2894248011, win 83, options [nop,nop,TS val 1096928188 ecr 3792221707], length 395
 00:00:31.462112 IP 10.0.0.6.1883 > 10.0.0.8.44970: Flags [P.], seq 2894248011:2894248015, ack 340590757, win 85, options [nop,nop,TS val 3792222706 ecr 1096928188], length 4
 00:00:31.462507 IP 10.0.0.8.44970 > 10.0.0.6.1883: Flags [.], ack 2894248015, win 83, options [nop,nop,TS val 1096928188 ecr 3792222706], length 0
 00:00:31.462556 IP 10.0.0.8.44970 > 10.0.0.6.1883: Flags [P.], seq 340590757:340590761, ack 2894248015, win 83, options [nop,nop,TS val 1096928189 ecr 3792222706], length 4
 00:00:31.462632 IP 10.0.0.6.1883 > 10.0.0.8.44970: Flags [P.], seq 2894248015:2894248019, ack 340590761, win 85, options [nop,nop,TS val 3792222707 ecr 1096928189], length 4
 00:00:31.529495 IP 10.0.0.8.44970 > 10.0.0.6.1883: Flags [.], ack 2894248019, win 83, options [nop,nop,TS val 1096928255 ecr 3792222707], length 0
 00:00:31.972534 IP6 fe80::b8e6:e6ff:fe54:7281 > ff02::2: ICMP6, router solicitation, length 16
 00:00:31.972517 IP6 fe80::201f:3fff:fe09:a776 > ff02::2: ICMP6, router solicitation, length 16
 00:00:31.993021 IP6 fe80::cc4d:f7ff:fe7d:5dda > ff02::2: ICMP6, router solicitation, length 16
 00:00:32.463454 IP 10.0.0.8.44970 > 10.0.0.6.1883: Flags [P.], seq 340590761:340591156, ack 2894248019, win 83, options [nop,nop,TS val 1096929189 ecr 3792222707], length 395
 00:00:32.463836 IP 10.0.0.6.1883 > 10.0.0.8.44970: Flags [P.], seq 2894248019:2894248023, ack 340591156, win 85, options [nop,nop,TS val 3792223708 ecr 1096929189], length 4
 00:00:32.464386 IP 10.0.0.8.44970 > 10.0.0.6.1883: Flags [.], ack 2894248023, win 83, options [nop,nop,TS val 1096929190 ecr 3792223708], length 0
 00:00:32.464556 IP 10.0.0.8.44970 > 10.0.0.6.1883: Flags [P.], seq 340591156:340591160, ack 2894248023, win 83, options [nop,nop,TS val 1096929190 ecr 3792223708], length 4
 00:00:32.464824 IP 10.0.0.6.1883 > 10.0.0.8.44970: Flags [P.], seq 2894248023:2894248027, ack 340591160, win 85, options [nop,nop,TS val 3792223709 ecr 1096929190], length 4
 00:00:32.512779 IP 10.0.0.8.44970 > 10.0.0.6.1883: Flags [.], ack 2894248027, win 83, options [nop,nop,TS val 1096929239 ecr 3792223709], length 0
 00:00:33.465377 IP 10.0.0.8.44970 > 10.0.0.6.1883: Flags [P.], seq 340591160:340591555, ack 2894248027, win 83, options [nop,nop,TS val 1096930191 ecr 3792223709], length 395
 00:00:33.465913 IP 10.0.0.6.1883 > 10.0.0.8.44970: Flags [P.], seq 2894248027:2894248031, ack 340591555, win 85, options [nop,nop,TS val 3792224710 ecr 1096930191], length 4
 00:00:33.467145 IP 10.0.0.8.44970 > 10.0.0.6.1883: Flags [.], ack 2894248031, win 83, options [nop,nop,TS val 1096930192 ecr 3792224710], length 0
 00:00:33.467208 IP 10.0.0.8.44970 > 10.0.0.6.1883: Flags [P.], seq 340591555:340591559, ack 2894248031, win 83, options [nop,nop,TS val 1096930192 ecr 3792224710], length 4
 00:00:33.467595 IP 10.0.0.6.1883 > 10.0.0.8.44970: Flags [P.], seq 2894248031:2894248035, ack 340591559, win 85, options [nop,nop,TS val 3792224712 ecr 1096930192], length 4
 00:00:33.513712 IP 10.0.0.8.44970 > 10.0.0.6.1883: Flags [.], ack 2894248035, win 83, options [nop,nop,TS val 1096930239 ecr 3792224712], length 0
 00:00:34.027761 IP6 fe80::b4fd:9cff:fe8b:4787 > ff02::2: ICMP6, router solicitation, length 16
 00:00:34.467069 IP 10.0.0.8.44970 > 10.0.0.6.1883: Flags [P.], seq 340591559:340591954, ack 2894248035, win 83, options [nop,nop,TS val 1096931192 ecr 3792224712], length 395
 00:00:34.469020 IP 10.0.0.6.1883 > 10.0.0.8.44970: Flags [P.], seq 2894248035:2894248039, ack 340591954, win 85, options [nop,nop,TS val 3792225712 ecr 1096931192], length 4
 00:00:34.471040 IP 10.0.0.8.44970 > 10.0.0.6.1883: Flags [.], ack 2894248039, win 83, options [nop,nop,TS val 1096931196 ecr 3792225712], length 0
 00:00:34.473336 IP 10.0.0.8.44970 > 10.0.0.6.1883: Flags [P.], seq 340591954:340591958, ack 2894248039, win 83, options [nop,nop,TS val 1096931196 ecr 3792225712], length 4
 00:00:34.474325 IP 10.0.0.6.1883 > 10.0.0.8.44970: Flags [P.], seq 2894248039:2894248043, ack 340591958, win 85, options [nop,nop,TS val 3792225718 ecr 1096931196], length 4
 00:00:34.527831 IP 10.0.0.8.44970 > 10.0.0.6.1883: Flags [.], ack 2894248043, win 83, options [nop,nop,TS val 1096931254 ecr 3792225718], length 0
 00:00:34.943694 IP 10.0.0.8.44970 > 10.0.0.6.1883: Flags [P.], seq 340591958:340591960, ack 2894248043, win 83, options [nop,nop,TS val 1096931668 ecr 3792225718], length 2
 00:00:34.944074 IP 10.0.0.6.1883 > 10.0.0.8.44970: Flags [P.], seq 2894248043:2894248045, ack 340591960, win 85, options [nop,nop,TS val 3792226188 ecr 1096931668], length 2
 00:00:34.945979 IP 10.0.0.8.44970 > 10.0.0.6.1883: Flags [.], ack 2894248045, win 83, options [nop,nop,TS val 1096931670 ecr 3792226188], length 0
 00:00:35.467590 IP 10.0.0.8.44970 > 10.0.0.6.1883: Flags [P.], seq 340591960:340592355, ack 2894248045, win 83, options [nop,nop,TS val 1096932193 ecr 3792226188], length 395
 00:00:35.467893 IP 10.0.0.6.1883 > 10.0.0.8.44970: Flags [P.], seq 2894248045:2894248049, ack 340592355, win 85, options [nop,nop,TS val 3792226712 ecr 1096932193], length 4
 00:00:35.469322 IP 10.0.0.8.44970 > 10.0.0.6.1883: Flags [.], ack 2894248049, win 83, options [nop,nop,TS val 1096932194 ecr 3792226712], length 0
 00:00:35.469375 IP 10.0.0.8.44970 > 10.0.0.6.1883: Flags [P.], seq 340592355:340592359, ack 2894248049, win 83, options [nop,nop,TS val 1096932194 ecr 3792226712], length 4
 00:00:35.470092 IP 10.0.0.6.1883 > 10.0.0.8.44970: Flags [P.], seq 2894248049:2894248053, ack 340592359, win 85, options [nop,nop,TS val 3792226714 ecr 1096932194], length 4
 00:00:35.535067 IP 10.0.0.8.44970 > 10.0.0.6.1883: Flags [.], ack 2894248053, win 83, options [nop,nop,TS val 1096932261 ecr 3792226714], length 0
 00:00:36.091343 IP6 fe80::ec51:ff:fe4d:5364 > ff02::2: ICMP6, router solicitation, length 16
 00:00:36.469742 IP 10.0.0.8.44970 > 10.0.0.6.1883: Flags [P.], seq 340592359:340592754, ack 2894248053, win 83, options [nop,nop,TS val 1096933194 ecr 3792226714], length 395
 00:00:36.470655 IP 10.0.0.6.1883 > 10.0.0.8.44970: Flags [P.], seq 2894248053:2894248057, ack 340592754, win 85, options [nop,nop,TS val 3792227715 ecr 1096933194], length 4
 00:00:36.471659 IP 10.0.0.8.44970 > 10.0.0.6.1883: Flags [.], ack 2894248057, win 83, options [nop,nop,TS val 1096933197 ecr 3792227715], length 0
 00:00:36.471781 IP 10.0.0.8.44970 > 10.0.0.6.1883: Flags [P.], seq 340592754:340592758, ack 2894248057, win 83, options [nop,nop,TS val 1096933197 ecr 3792227715], length 4
 00:00:36.472185 IP 10.0.0.6.1883 > 10.0.0.8.44970: Flags [P.], seq 2894248057:2894248061, ack 340592758, win 85, options [nop,nop,TS val 3792227716 ecr 1096933197], length 4
 00:00:36.516484 IP 10.0.0.8.44970 > 10.0.0.6.1883: Flags [.], ack 2894248061, win 83, options [nop,nop,TS val 1096933242 ecr 3792227716], length 0
 00:00:37.470084 IP 10.0.0.8.44970 > 10.0.0.6.1883: Flags [P.], seq 340592758:340593153, ack 2894248061, win 83, options [nop,nop,TS val 1096934195 ecr 3792227716], length 395
 00:00:37.470787 IP 10.0.0.6.1883 > 10.0.0.8.44970: Flags [P.], seq 2894248061:2894248065, ack 340593153, win 85, options [nop,nop,TS val 3792228715 ecr 1096934195], length 4
 00:00:37.471841 IP 10.0.0.8.44970 > 10.0.0.6.1883: Flags [.], ack 2894248065, win 83, options [nop,nop,TS val 1096934197 ecr 3792228715], length 0
 00:00:37.472148 IP 10.0.0.8.44970 > 10.0.0.6.1883: Flags [P.], seq 340593153:340593157, ack 2894248065, win 83, options [nop,nop,TS val 1096934197 ecr 3792228715], length 4
 00:00:37.472520 IP 10.0.0.6.1883 > 10.0.0.8.44970: Flags [P.], seq 2894248065:2894248069, ack 340593157, win 85, options [nop,nop,TS val 3792228716 ecr 1096934197], length 4
 00:00:37.516775 IP 10.0.0.8.44970 > 10.0.0.6.1883: Flags [.], ack 2894248069, win 83, options [nop,nop,TS val 1096934243 ecr 3792228716], length 0
 00:00:38.405019 IP6 fe80::9ced:13ff:fec2:88b6 > ff02::2: ICMP6, router solicitation, length 16
 00:00:38.425274 IP6 fe80::140b:85ff:fee0:1258 > ff02::2: ICMP6, router solicitation, length 16
 00:00:38.438580 IP6 fe80::a033:d2ff:fe0b:b2cf > ff02::2: ICMP6, router solicitation, length 16
 00:00:38.444335 IP6 fe80::382d:15ff:fe12:345c > ff02::2: ICMP6, router solicitation, length 16
 00:00:38.453570 IP6 fe80::d41b:2dff:fe8d:a5f8 > ff02::2: ICMP6, router solicitation, length 16
 00:00:38.473716 IP 10.0.0.8.44970 > 10.0.0.6.1883: Flags [P.], seq 340593157:340593552, ack 2894248069, win 83, options [nop,nop,TS val 1096935199 ecr 3792228716], length 395
 00:00:38.474038 IP 10.0.0.6.1883 > 10.0.0.8.44970: Flags [P.], seq 2894248069:2894248073, ack 340593552, win 85, options [nop,nop,TS val 3792229718 ecr 1096935199], length 4
 00:00:38.474398 IP 10.0.0.8.44970 > 10.0.0.6.1883: Flags [.], ack 2894248073, win 83, options [nop,nop,TS val 1096935200 ecr 3792229718], length 0
 00:00:38.474402 IP 10.0.0.8.44970 > 10.0.0.6.1883: Flags [P.], seq 340593552:340593556, ack 2894248073, win 83, options [nop,nop,TS val 1096935200 ecr 3792229718], length 4
 00:00:38.474612 IP 10.0.0.6.1883 > 10.0.0.8.44970: Flags [P.], seq 2894248073:2894248077, ack 340593556, win 85, options [nop,nop,TS val 3792229719 ecr 1096935200], length 4
 00:00:38.516774 IP 10.0.0.8.44970 > 10.0.0.6.1883: Flags [.], ack 2894248077, win 83, options [nop,nop,TS val 1096935243 ecr 3792229719], length 0
 00:00:39.475790 IP 10.0.0.8.44970 > 10.0.0.6.1883: Flags [P.], seq 340593556:340593951, ack 2894248077, win 83, options [nop,nop,TS val 1096936201 ecr 3792229719], length 395
 00:00:39.476446 IP 10.0.0.6.1883 > 10.0.0.8.44970: Flags [P.], seq 2894248077:2894248081, ack 340593951, win 85, options [nop,nop,TS val 3792230720 ecr 1096936201], length 4
 00:00:39.476943 IP 10.0.0.8.44970 > 10.0.0.6.1883: Flags [.], ack 2894248081, win 83, options [nop,nop,TS val 1096936203 ecr 3792230720], length 0
 00:00:39.477247 IP 10.0.0.8.44970 > 10.0.0.6.1883: Flags [P.], seq 340593951:340593955, ack 2894248081, win 83, options [nop,nop,TS val 1096936203 ecr 3792230720], length 4
 00:00:39.477847 IP 10.0.0.6.1883 > 10.0.0.8.44970: Flags [P.], seq 2894248081:2894248085, ack 340593955, win 85, options [nop,nop,TS val 3792230721 ecr 1096936203], length 4
 00:00:39.521459 IP 10.0.0.8.44970 > 10.0.0.6.1883: Flags [.], ack 2894248085, win 83, options [nop,nop,TS val 1096936247 ecr 3792230721], length 0
 00:00:39.943770 IP 10.0.0.8.44970 > 10.0.0.6.1883: Flags [P.], seq 340593955:340593957, ack 2894248085, win 83, options [nop,nop,TS val 1096936669 ecr 3792230721], length 2
 00:00:39.944645 IP 10.0.0.6.1883 > 10.0.0.8.44970: Flags [P.], seq 2894248085:2894248087, ack 340593957, win 85, options [nop,nop,TS val 3792231188 ecr 1096936669], length 2
 00:00:39.945896 IP 10.0.0.8.44970 > 10.0.0.6.1883: Flags [.], ack 2894248087, win 83, options [nop,nop,TS val 1096936671 ecr 3792231188], length 0
 00:00:40.189728 IP6 fe80::9c17:e8ff:fe47:6b2 > ff02::2: ICMP6, router solicitation, length 16
 00:00:40.193297 IP6 fe80::2845:d5ff:feb4:e544 > ff02::2: ICMP6, router solicitation, length 16
 00:00:40.475921 IP 10.0.0.8.44970 > 10.0.0.6.1883: Flags [P.], seq 340593957:340594352, ack 2894248087, win 83, options [nop,nop,TS val 1096937202 ecr 3792231188], length 395
 00:00:40.476933 IP 10.0.0.6.1883 > 10.0.0.8.44970: Flags [P.], seq 2894248087:2894248091, ack 340594352, win 85, options [nop,nop,TS val 3792231721 ecr 1096937202], length 4
 00:00:40.478821 IP 10.0.0.8.44970 > 10.0.0.6.1883: Flags [.], ack 2894248091, win 83, options [nop,nop,TS val 1096937204 ecr 3792231721], length 0
 00:00:40.478948 IP 10.0.0.8.44970 > 10.0.0.6.1883: Flags [P.], seq 340594352:340594356, ack 2894248091, win 83, options [nop,nop,TS val 1096937205 ecr 3792231721], length 4
 00:00:40.479249 IP 10.0.0.6.1883 > 10.0.0.8.44970: Flags [P.], seq 2894248091:2894248095, ack 340594356, win 85, options [nop,nop,TS val 3792231723 ecr 1096937205], length 4
 00:00:40.520623 IP 10.0.0.8.44970 > 10.0.0.6.1883: Flags [.], ack 2894248095, win 83, options [nop,nop,TS val 1096937247 ecr 3792231723], length 0
 00:00:41.477502 IP 10.0.0.8.44970 > 10.0.0.6.1883: Flags [P.], seq 340594356:340594751, ack 2894248095, win 83, options [nop,nop,TS val 1096938203 ecr 3792231723], length 395
 00:00:41.478127 IP 10.0.0.6.1883 > 10.0.0.8.44970: Flags [P.], seq 2894248095:2894248099, ack 340594751, win 85, options [nop,nop,TS val 3792232722 ecr 1096938203], length 4
 00:00:41.479125 IP 10.0.0.8.44970 > 10.0.0.6.1883: Flags [.], ack 2894248099, win 83, options [nop,nop,TS val 1096938204 ecr 3792232722], length 0
 00:00:41.479424 IP 10.0.0.8.44970 > 10.0.0.6.1883: Flags [P.], seq 340594751:340594755, ack 2894248099, win 83, options [nop,nop,TS val 1096938205 ecr 3792232722], length 4
 00:00:41.480136 IP 10.0.0.6.1883 > 10.0.0.8.44970: Flags [P.], seq 2894248099:2894248103, ack 340594755, win 85, options [nop,nop,TS val 3792232724 ecr 1096938205], length 4
 00:00:41.594531 IP 10.0.0.8.44970 > 10.0.0.6.1883: Flags [.], ack 2894248103, win 83, options [nop,nop,TS val 1096938308 ecr 3792232724], length 0
 00:00:42.506573 IP 10.0.0.8.44970 > 10.0.0.6.1883: Flags [P.], seq 340594755:340595150, ack 2894248103, win 83, options [nop,nop,TS val 1096939232 ecr 3792232724], length 395
