 00:00:00.000000 IP6 fe80::44a:86ff:fe1f:4c02 > ff02::2: ICMP6, router solicitation, length 16
 00:00:02.031777 IP6 fe80::4cea:1fff:fea9:6fb3 > ff02::2: ICMP6, router solicitation, length 16
 00:00:03.738565 ARP, Request who-has 10.0.0.6 tell 10.0.0.8, length 28
 00:00:03.738739 ARP, Reply 10.0.0.6 is-at ae:07:7d:ec:35:ff, length 28
 00:00:03.767347 IP 10.0.0.8.45026 > 10.0.0.6.1883: Flags [S], seq 3315409260, win 42340, options [mss 1460,sackOK,TS val 1097307235 ecr 0,nop,wscale 9], length 0
 00:00:03.767715 IP 10.0.0.6.1883 > 10.0.0.8.45026: Flags [S.], seq 3582166489, ack 3315409261, win 43440, options [mss 1460,sackOK,TS val 3792601809 ecr 1097307235,nop,wscale 9], length 0
 00:00:03.779560 IP 10.0.0.8.45026 > 10.0.0.6.1883: Flags [.], ack 3582166490, win 83, options [nop,nop,TS val 1097307303 ecr 3792601809], length 0
 00:00:03.779764 IP 10.0.0.8.45026 > 10.0.0.6.1883: Flags [P.], seq 3315409261:3315409281, ack 3582166490, win 83, options [nop,nop,TS val 1097307303 ecr 3792601809], length 20
 00:00:03.779866 IP 10.0.0.6.1883 > 10.0.0.8.45026: Flags [.], ack 3315409281, win 85, options [nop,nop,TS val 3792601821 ecr 1097307303], length 0
 00:00:03.780337 IP 10.0.0.6.1883 > 10.0.0.8.45026: Flags [P.], seq 3582166490:3582166494, ack 3315409281, win 85, options [nop,nop,TS val 3792601822 ecr 1097307303], length 4
 00:00:03.780900 IP 10.0.0.8.45026 > 10.0.0.6.1883: Flags [.], ack 3582166494, win 83, options [nop,nop,TS val 1097307304 ecr 3792601822], length 0
 00:00:03.780978 IP 10.0.0.8.45026 > 10.0.0.6.1883: Flags [P.], seq 3315409281:3315409345, ack 3582166494, win 83, options [nop,nop,TS val 1097307304 ecr 3792601822], length 64
 00:00:03.781746 IP 10.0.0.6.1883 > 10.0.0.8.45026: Flags [P.], seq 3582166494:3582166559, ack 3315409345, win 85, options [nop,nop,TS val 3792601823 ecr 1097307304], length 65
 00:00:03.782061 IP 10.0.0.8.45026 > 10.0.0.6.1883: Flags [P.], seq 3315409345:3315409740, ack 3582166559, win 83, options [nop,nop,TS val 1097307305 ecr 3792601823], length 395
 00:00:03.782139 IP 10.0.0.6.1883 > 10.0.0.8.45026: Flags [P.], seq 3582166559:3582166564, ack 3315409740, win 85, options [nop,nop,TS val 3792601824 ecr 1097307305], length 5
 00:00:03.924040 IP 10.0.0.8.45026 > 10.0.0.6.1883: Flags [.], ack 3582166564, win 83, options [nop,nop,TS val 1097307434 ecr 3792601824], length 0
 00:00:03.924170 IP 10.0.0.6.1883 > 10.0.0.8.45026: Flags [P.], seq 3582166564:3582166568, ack 3315409740, win 85, options [nop,nop,TS val 3792601966 ecr 1097307434], length 4
 00:00:03.927435 IP 10.0.0.8.45026 > 10.0.0.6.1883: Flags [.], ack 3582166568, win 83, options [nop,nop,TS val 1097307451 ecr 3792601966], length 0
 00:00:03.927877 IP 10.0.0.8.45026 > 10.0.0.6.1883: Flags [P.], seq 3315409740:3315409744, ack 3582166568, win 83, options [nop,nop,TS val 1097307451 ecr 3792601966], length 4
 00:00:03.928054 IP 10.0.0.6.1883 > 10.0.0.8.45026: Flags [P.], seq 3582166568:3582166572, ack 3315409744, win 85, options [nop,nop,TS val 3792601970 ecr 1097307451], length 4
 00:00:03.979203 IP 10.0.0.8.45026 > 10.0.0.6.1883: Flags [.], ack 3582166572, win 83, options [nop,nop,TS val 1097307495 ecr 3792601970], length 0
 00:00:04.068206 IP6 fe80::84de:e5ff:feae:c715 > ff02::2: ICMP6, router solicitation, length 16
 00:00:04.088811 IP6 fe80::bca5:29ff:feba:547 > ff02::2: ICMP6, router solicitation, length 16
 00:00:04.109354 IP6 fe80::6411:faff:feee:e05f > ff02::2: ICMP6, router solicitation, length 16
 00:00:04.727358 IP 10.0.0.8.45026 > 10.0.0.6.1883: Flags [P.], seq 3315409744:3315410139, ack 3582166572, win 83, options [nop,nop,TS val 1097308251 ecr 3792601970], length 395
 00:00:04.728148 IP 10.0.0.6.1883 > 10.0.0.8.45026: Flags [P.], seq 3582166572:3582166576, ack 3315410139, win 85, options [nop,nop,TS val 3792602770 ecr 1097308251], length 4
 00:00:04.729534 IP 10.0.0.8.45026 > 10.0.0.6.1883: Flags [.], ack 3582166576, win 83, options [nop,nop,TS val 1097308253 ecr 3792602770], length 0
 00:00:04.729536 IP 10.0.0.8.45026 > 10.0.0.6.1883: Flags [P.], seq 3315410139:3315410143, ack 3582166576, win 83, options [nop,nop,TS val 1097308253 ecr 3792602770], length 4
 00:00:04.729815 IP 10.0.0.6.1883 > 10.0.0.8.45026: Flags [P.], seq 3582166576:3582166580, ack 3315410143, win 85, options [nop,nop,TS val 3792602771 ecr 1097308253], length 4
 00:00:04.774869 IP 10.0.0.8.45026 > 10.0.0.6.1883: Flags [.], ack 3582166580, win 83, options [nop,nop,TS val 1097308295 ecr 3792602771], length 0
 00:00:05.734317 IP 10.0.0.8.45026 > 10.0.0.6.1883: Flags [P.], seq 3315410143:3315410538, ack 3582166580, win 83, options [nop,nop,TS val 1097309258 ecr 3792602771], length 395
 00:00:05.734781 IP 10.0.0.6.1883 > 10.0.0.8.45026: Flags [P.], seq 3582166580:3582166584, ack 3315410538, win 85, options [nop,nop,TS val 3792603776 ecr 1097309258], length 4
 00:00:05.735270 IP 10.0.0.8.45026 > 10.0.0.6.1883: Flags [.], ack 3582166584, win 83, options [nop,nop,TS val 1097309259 ecr 3792603776], length 0
 00:00:05.735866 IP 10.0.0.8.45026 > 10.0.0.6.1883: Flags [P.], seq 3315410538:3315410542, ack 3582166584, win 83, options [nop,nop,TS val 1097309259 ecr 3792603776], length 4
 00:00:05.736069 IP 10.0.0.6.1883 > 10.0.0.8.45026: Flags [P.], seq 3582166584:3582166588, ack 3315410542, win 85, options [nop,nop,TS val 3792603778 ecr 1097309259], length 4
 00:00:05.781703 IP 10.0.0.8.45026 > 10.0.0.6.1883: Flags [.], ack 3582166588, win 83, options [nop,nop,TS val 1097309305 ecr 3792603778], length 0
 00:00:06.127240 IP6 fe80::48c7:1ff:fe92:6cff > ff02::2: ICMP6, router solicitation, length 16
 00:00:06.736059 IP 10.0.0.8.45026 > 10.0.0.6.1883: Flags [P.], seq 3315410542:3315410937, ack 3582166588, win 83, options [nop,nop,TS val 1097310259 ecr 3792603778], length 395
 00:00:06.736606 IP 10.0.0.6.1883 > 10.0.0.8.45026: Flags [P.], seq 3582166588:3582166592, ack 3315410937, win 85, options [nop,nop,TS val 3792604778 ecr 1097310259], length 4
 00:00:06.737465 IP 10.0.0.8.45026 > 10.0.0.6.1883: Flags [.], ack 3582166592, win 83, options [nop,nop,TS val 1097310261 ecr 3792604778], length 0
 00:00:06.738921 IP 10.0.0.8.45026 > 10.0.0.6.1883: Flags [P.], seq 3315410937:3315410941, ack 3582166592, win 83, options [nop,nop,TS val 1097310262 ecr 3792604778], length 4
 00:00:06.739108 IP 10.0.0.6.1883 > 10.0.0.8.45026: Flags [P.], seq 3582166592:3582166596, ack 3315410941, win 85, options [nop,nop,TS val 3792604781 ecr 1097310262], length 4
 00:00:06.783243 IP 10.0.0.8.45026 > 10.0.0.6.1883: Flags [.], ack 3582166596, win 83, options [nop,nop,TS val 1097310307 ecr 3792604781], length 0
 00:00:07.745769 IP 10.0.0.8.45026 > 10.0.0.6.1883: Flags [P.], seq 3315410941:3315411336, ack 3582166596, win 83, options [nop,nop,TS val 1097311269 ecr 3792604781], length 395
 00:00:07.746636 IP 10.0.0.6.1883 > 10.0.0.8.45026: Flags [P.], seq 3582166596:3582166600, ack 3315411336, win 85, options [nop,nop,TS val 3792605788 ecr 1097311269], length 4
 00:00:07.747141 IP 10.0.0.8.45026 > 10.0.0.6.1883: Flags [.], ack 3582166600, win 83, options [nop,nop,TS val 1097311270 ecr 3792605788], length 0
 00:00:07.747143 IP 10.0.0.8.45026 > 10.0.0.6.1883: Flags [P.], seq 3315411336:3315411340, ack 3582166600, win 83, options [nop,nop,TS val 1097311271 ecr 3792605788], length 4
 00:00:07.747355 IP 10.0.0.6.1883 > 10.0.0.8.45026: Flags [P.], seq 3582166600:3582166604, ack 3315411340, win 85, options [nop,nop,TS val 3792605789 ecr 1097311271], length 4
 00:00:07.791181 IP 10.0.0.8.45026 > 10.0.0.6.1883: Flags [.], ack 3582166604, win 83, options [nop,nop,TS val 1097311315 ecr 3792605789], length 0
 00:00:08.154998 IP6 fe80::ac07:7dff:feec:35ff > ff02::2: ICMP6, router solicitation, length 16
 00:00:08.196532 IP6 fe80::ace8:c4ff:fe63:133 > ff02::2: ICMP6, router solicitation, length 16
 00:00:08.211604 IP6 fe80::348b:d9ff:fe02:37f5 > ff02::2: ICMP6, router solicitation, length 16
 00:00:08.747976 IP 10.0.0.8.45026 > 10.0.0.6.1883: Flags [P.], seq 3315411340:3315411735, ack 3582166604, win 83, options [nop,nop,TS val 1097312271 ecr 3792605789], length 395
 00:00:08.749009 IP 10.0.0.6.1883 > 10.0.0.8.45026: Flags [P.], seq 3582166604:3582166608, ack 3315411735, win 85, options [nop,nop,TS val 3792606791 ecr 1097312271], length 4
 00:00:08.749481 IP 10.0.0.8.45026 > 10.0.0.6.1883: Flags [.], ack 3582166608, win 83, options [nop,nop,TS val 1097312273 ecr 3792606791], length 0
 00:00:08.749483 IP 10.0.0.8.45026 > 10.0.0.6.1883: Flags [P.], seq 3315411735:3315411739, ack 3582166608, win 83, options [nop,nop,TS val 1097312273 ecr 3792606791], length 4
 00:00:08.749704 IP 10.0.0.6.1883 > 10.0.0.8.45026: Flags [P.], seq 3582166608:3582166612, ack 3315411739, win 85, options [nop,nop,TS val 3792606791 ecr 1097312273], length 4
 00:00:08.782788 IP 10.0.0.8.45026 > 10.0.0.6.1883: Flags [P.], seq 3315411739:3315411741, ack 3582166612, win 83, options [nop,nop,TS val 1097312306 ecr 3792606791], length 2
 00:00:08.782990 IP 10.0.0.6.1883 > 10.0.0.8.45026: Flags [P.], seq 3582166612:3582166614, ack 3315411741, win 85, options [nop,nop,TS val 3792606825 ecr 1097312306], length 2
 00:00:08.827431 IP 10.0.0.8.45026 > 10.0.0.6.1883: Flags [.], ack 3582166614, win 83, options [nop,nop,TS val 1097312351 ecr 3792606825], length 0
 00:00:09.753116 IP 10.0.0.8.45026 > 10.0.0.6.1883: Flags [P.], seq 3315411741:3315412136, ack 3582166614, win 83, options [nop,nop,TS val 1097313276 ecr 3792606825], length 395
 00:00:09.754081 IP 10.0.0.6.1883 > 10.0.0.8.45026: Flags [P.], seq 3582166614:3582166618, ack 3315412136, win 85, options [nop,nop,TS val 3792607796 ecr 1097313276], length 4
 00:00:09.754546 IP 10.0.0.8.45026 > 10.0.0.6.1883: Flags [.], ack 3582166618, win 83, options [nop,nop,TS val 1097313278 ecr 3792607796], length 0
 00:00:09.754548 IP 10.0.0.8.45026 > 10.0.0.6.1883: Flags [P.], seq 3315412136:3315412140, ack 3582166618, win 83, options [nop,nop,TS val 1097313278 ecr 3792607796], length 4
 00:00:09.755182 IP 10.0.0.6.1883 > 10.0.0.8.45026: Flags [P.], seq 3582166618:3582166622, ack 3315412140, win 85, options [nop,nop,TS val 3792607797 ecr 1097313278], length 4
 00:00:09.798953 IP 10.0.0.8.45026 > 10.0.0.6.1883: Flags [.], ack 3582166622, win 83, options [nop,nop,TS val 1097313322 ecr 3792607797], length 0
 00:00:10.218916 IP6 fe80::34ec:eeff:fef1:d2e5 > ff02::2: ICMP6, router solicitation, length 16
 00:00:10.758547 IP 10.0.0.8.45026 > 10.0.0.6.1883: Flags [P.], seq 3315412140:3315412535, ack 3582166622, win 83, options [nop,nop,TS val 1097314282 ecr 3792607797], length 395
 00:00:10.759881 IP 10.0.0.6.1883 > 10.0.0.8.45026: Flags [P.], seq 3582166622:3582166626, ack 3315412535, win 85, options [nop,nop,TS val 3792608801 ecr 1097314282], length 4
 00:00:10.760700 IP 10.0.0.8.45026 > 10.0.0.6.1883: Flags [.], ack 3582166626, win 83, options [nop,nop,TS val 1097314284 ecr 3792608801], length 0
 00:00:10.761125 IP 10.0.0.8.45026 > 10.0.0.6.1883: Flags [P.], seq 3315412535:3315412539, ack 3582166626, win 83, options [nop,nop,TS val 1097314284 ecr 3792608801], length 4
 00:00:10.761984 IP 10.0.0.6.1883 > 10.0.0.8.45026: Flags [P.], seq 3582166626:3582166630, ack 3315412539, win 85, options [nop,nop,TS val 3792608803 ecr 1097314284], length 4
 00:00:10.803162 IP 10.0.0.8.45026 > 10.0.0.6.1883: Flags [.], ack 3582166630, win 83, options [nop,nop,TS val 1097314327 ecr 3792608803], length 0
 00:00:11.770597 IP 10.0.0.8.45026 > 10.0.0.6.1883: Flags [P.], seq 3315412539:3315412934, ack 3582166630, win 83, options [nop,nop,TS val 1097315294 ecr 3792608803], length 395
 00:00:11.771405 IP 10.0.0.6.1883 > 10.0.0.8.45026: Flags [P.], seq 3582166630:3582166634, ack 3315412934, win 85, options [nop,nop,TS val 3792609813 ecr 1097315294], length 4
 00:00:11.771876 IP 10.0.0.8.45026 > 10.0.0.6.1883: Flags [.], ack 3582166634, win 83, options [nop,nop,TS val 1097315295 ecr 3792609813], length 0
 00:00:11.771879 IP 10.0.0.8.45026 > 10.0.0.6.1883: Flags [P.], seq 3315412934:3315412938, ack 3582166634, win 83, options [nop,nop,TS val 1097315295 ecr 3792609813], length 4
 00:00:11.772099 IP 10.0.0.6.1883 > 10.0.0.8.45026: Flags [P.], seq 3582166634:3582166638, ack 3315412938, win 85, options [nop,nop,TS val 3792609814 ecr 1097315295], length 4
 00:00:11.815120 IP 10.0.0.8.45026 > 10.0.0.6.1883: Flags [.], ack 3582166638, win 83, options [nop,nop,TS val 1097315339 ecr 3792609814], length 0
 00:00:12.276389 IP6 fe80::e454:9cff:fe50:5195 > ff02::2: ICMP6, router solicitation, length 16
 00:00:12.298064 IP6 fe80::a07e:33ff:fed8:740e > ff02::2: ICMP6, router solicitation, length 16
 00:00:12.302556 IP6 fe80::3014:afff:fea8:6303 > ff02::2: ICMP6, router solicitation, length 16
 00:00:12.771539 IP 10.0.0.8.45026 > 10.0.0.6.1883: Flags [P.], seq 3315412938:3315413333, ack 3582166638, win 83, options [nop,nop,TS val 1097316295 ecr 3792609814], length 395
 00:00:12.772087 IP 10.0.0.6.1883 > 10.0.0.8.45026: Flags [P.], seq 3582166638:3582166642, ack 3315413333, win 85, options [nop,nop,TS val 3792610814 ecr 1097316295], length 4
 00:00:12.772564 IP 10.0.0.8.45026 > 10.0.0.6.1883: Flags [.], ack 3582166642, win 83, options [nop,nop,TS val 1097316296 ecr 3792610814], length 0
 00:00:12.772567 IP 10.0.0.8.45026 > 10.0.0.6.1883: Flags [P.], seq 3315413333:3315413337, ack 3582166642, win 83, options [nop,nop,TS val 1097316296 ecr 3792610814], length 4
 00:00:12.772846 IP 10.0.0.6.1883 > 10.0.0.8.45026: Flags [P.], seq 3582166642:3582166646, ack 3315413337, win 85, options [nop,nop,TS val 3792610814 ecr 1097316296], length 4
 00:00:12.983864 IP 10.0.0.8.45026 > 10.0.0.6.1883: Flags [.], ack 3582166646, win 83, options [nop,nop,TS val 1097316339 ecr 3792610814], length 0
 00:00:13.776636 IP 10.0.0.8.45026 > 10.0.0.6.1883: Flags [P.], seq 3315413337:3315413732, ack 3582166646, win 83, options [nop,nop,TS val 1097317300 ecr 3792610814], length 395
 00:00:13.777341 IP 10.0.0.6.1883 > 10.0.0.8.45026: Flags [P.], seq 3582166646:3582166650, ack 3315413732, win 85, options [nop,nop,TS val 3792611819 ecr 1097317300], length 4
 00:00:13.777773 IP 10.0.0.8.45026 > 10.0.0.6.1883: Flags [.], ack 3582166650, win 83, options [nop,nop,TS val 1097317301 ecr 3792611819], length 0
 00:00:13.777774 IP 10.0.0.8.45026 > 10.0.0.6.1883: Flags [P.], seq 3315413732:3315413736, ack 3582166650, win 83, options [nop,nop,TS val 1097317301 ecr 3792611819], length 4
 00:00:13.778285 IP 10.0.0.6.1883 > 10.0.0.8.45026: Flags [P.], seq 3582166650:3582166654, ack 3315413736, win 85, options [nop,nop,TS val 3792611820 ecr 1097317301], length 4
 00:00:13.783575 IP 10.0.0.8.45026 > 10.0.0.6.1883: Flags [P.], seq 3315413736:3315413738, ack 3582166654, win 83, options [nop,nop,TS val 1097317307 ecr 3792611820], length 2
 00:00:13.783850 IP 10.0.0.6.1883 > 10.0.0.8.45026: Flags [P.], seq 3582166654:3582166656, ack 3315413738, win 85, options [nop,nop,TS val 3792611825 ecr 1097317307], length 2
 00:00:13.827291 IP 10.0.0.8.45026 > 10.0.0.6.1883: Flags [.], ack 3582166656, win 83, options [nop,nop,TS val 1097317351 ecr 3792611825], length 0
 00:00:14.777463 IP 10.0.0.8.45026 > 10.0.0.6.1883: Flags [P.], seq 3315413738:3315414133, ack 3582166656, win 83, options [nop,nop,TS val 1097318301 ecr 3792611825], length 395
 00:00:14.777888 IP 10.0.0.6.1883 > 10.0.0.8.45026: Flags [P.], seq 3582166656:3582166660, ack 3315414133, win 85, options [nop,nop,TS val 3792612819 ecr 1097318301], length 4
 00:00:14.778328 IP 10.0.0.8.45026 > 10.0.0.6.1883: Flags [.], ack 3582166660, win 83, options [nop,nop,TS val 1097318302 ecr 3792612819], length 0
 00:00:14.778330 IP 10.0.0.8.45026 > 10.0.0.6.1883: Flags [P.], seq 3315414133:3315414137, ack 3582166660, win 83, options [nop,nop,TS val 1097318302 ecr 3792612819], length 4
 00:00:14.779017 IP 10.0.0.6.1883 > 10.0.0.8.45026: Flags [P.], seq 3582166660:3582166664, ack 3315414137, win 85, options [nop,nop,TS val 3792612821 ecr 1097318302], length 4
 00:00:14.823078 IP 10.0.0.8.45026 > 10.0.0.6.1883: Flags [.], ack 3582166664, win 83, options [nop,nop,TS val 1097318347 ecr 3792612821], length 0
 00:00:15.778590 IP 10.0.0.8.45026 > 10.0.0.6.1883: Flags [P.], seq 3315414137:3315414532, ack 3582166664, win 83, options [nop,nop,TS val 1097319302 ecr 3792612821], length 395
 00:00:15.779125 IP 10.0.0.6.1883 > 10.0.0.8.45026: Flags [P.], seq 3582166664:3582166668, ack 3315414532, win 85, options [nop,nop,TS val 3792613821 ecr 1097319302], length 4
 00:00:15.779412 IP 10.0.0.8.45026 > 10.0.0.6.1883: Flags [.], ack 3582166668, win 83, options [nop,nop,TS val 1097319303 ecr 3792613821], length 0
 00:00:15.779414 IP 10.0.0.8.45026 > 10.0.0.6.1883: Flags [P.], seq 3315414532:3315414536, ack 3582166668, win 83, options [nop,nop,TS val 1097319303 ecr 3792613821], length 4
 00:00:15.779645 IP 10.0.0.6.1883 > 10.0.0.8.45026: Flags [P.], seq 3582166668:3582166672, ack 3315414536, win 85, options [nop,nop,TS val 3792613821 ecr 1097319303], length 4
 00:00:15.823230 IP 10.0.0.8.45026 > 10.0.0.6.1883: Flags [.], ack 3582166672, win 83, options [nop,nop,TS val 1097319347 ecr 3792613821], length 0
 00:00:16.551801 IP6 fe80::8d7:83ff:fea2:98bc > ff02::2: ICMP6, router solicitation, length 16
 00:00:16.779263 IP 10.0.0.8.45026 > 10.0.0.6.1883: Flags [P.], seq 3315414536:3315414931, ack 3582166672, win 83, options [nop,nop,TS val 1097320303 ecr 3792613821], length 395
 00:00:16.779877 IP 10.0.0.6.1883 > 10.0.0.8.45026: Flags [P.], seq 3582166672:3582166676, ack 3315414931, win 85, options [nop,nop,TS val 3792614821 ecr 1097320303], length 4
 00:00:16.780338 IP 10.0.0.8.45026 > 10.0.0.6.1883: Flags [.], ack 3582166676, win 83, options [nop,nop,TS val 1097320304 ecr 3792614821], length 0
 00:00:16.780339 IP 10.0.0.8.45026 > 10.0.0.6.1883: Flags [P.], seq 3315414931:3315414935, ack 3582166676, win 83, options [nop,nop,TS val 1097320304 ecr 3792614821], length 4
 00:00:16.780521 IP 10.0.0.6.1883 > 10.0.0.8.45026: Flags [P.], seq 3582166676:3582166680, ack 3315414935, win 85, options [nop,nop,TS val 3792614822 ecr 1097320304], length 4
 00:00:16.823279 IP 10.0.0.8.45026 > 10.0.0.6.1883: Flags [.], ack 3582166680, win 83, options [nop,nop,TS val 1097320347 ecr 3792614822], length 0
 00:00:17.780670 IP 10.0.0.8.45026 > 10.0.0.6.1883: Flags [P.], seq 3315414935:3315415330, ack 3582166680, win 83, options [nop,nop,TS val 1097321304 ecr 3792614822], length 395
 00:00:17.781166 IP 10.0.0.6.1883 > 10.0.0.8.45026: Flags [P.], seq 3582166680:3582166684, ack 3315415330, win 85, options [nop,nop,TS val 3792615823 ecr 1097321304], length 4
 00:00:17.782260 IP 10.0.0.8.45026 > 10.0.0.6.1883: Flags [.], ack 3582166684, win 83, options [nop,nop,TS val 1097321305 ecr 3792615823], length 0
 00:00:17.782833 IP 10.0.0.8.45026 > 10.0.0.6.1883: Flags [P.], seq 3315415330:3315415334, ack 3582166684, win 83, options [nop,nop,TS val 1097321306 ecr 3792615823], length 4
 00:00:17.782944 IP 10.0.0.6.1883 > 10.0.0.8.45026: Flags [P.], seq 3582166684:3582166688, ack 3315415334, win 85, options [nop,nop,TS val 3792615825 ecr 1097321306], length 4
 00:00:17.827180 IP 10.0.0.8.45026 > 10.0.0.6.1883: Flags [.], ack 3582166688, win 83, options [nop,nop,TS val 1097321351 ecr 3792615825], length 0
 00:00:18.781396 IP 10.0.0.8.45026 > 10.0.0.6.1883: Flags [P.], seq 3315415334:3315415729, ack 3582166688, win 83, options [nop,nop,TS val 1097322305 ecr 3792615825], length 395
 00:00:18.782091 IP 10.0.0.6.1883 > 10.0.0.8.45026: Flags [P.], seq 3582166688:3582166692, ack 3315415729, win 85, options [nop,nop,TS val 3792616824 ecr 1097322305], length 4
 00:00:18.782647 IP 10.0.0.8.45026 > 10.0.0.6.1883: Flags [.], ack 3582166692, win 83, options [nop,nop,TS val 1097322306 ecr 3792616824], length 0
 00:00:18.782921 IP 10.0.0.8.45026 > 10.0.0.6.1883: Flags [P.], seq 3315415729:3315415733, ack 3582166692, win 83, options [nop,nop,TS val 1097322306 ecr 3792616824], length 4
 00:00:18.783218 IP 10.0.0.6.1883 > 10.0.0.8.45026: Flags [P.], seq 3582166692:3582166696, ack 3315415733, win 85, options [nop,nop,TS val 3792616825 ecr 1097322306], length 4
 00:00:18.785135 IP 10.0.0.8.45026 > 10.0.0.6.1883: Flags [P.], seq 3315415733:3315415735, ack 3582166696, win 83, options [nop,nop,TS val 1097322309 ecr 3792616825], length 2
 00:00:18.785315 IP 10.0.0.6.1883 > 10.0.0.8.45026: Flags [P.], seq 3582166696:3582166698, ack 3315415735, win 85, options [nop,nop,TS val 3792616827 ecr 1097322309], length 2
 00:00:18.843884 IP 10.0.0.8.45026 > 10.0.0.6.1883: Flags [.], ack 3582166698, win 83, options [nop,nop,TS val 1097322350 ecr 3792616827], length 0
 00:00:20.119269 IP 10.0.0.8.45026 > 10.0.0.6.1883: Flags [P.], seq 3315415735:3315416130, ack 3582166698, win 83, options [nop,nop,TS val 1097323643 ecr 3792616827], length 395
 00:00:20.120353 IP 10.0.0.6.1883 > 10.0.0.8.45026: Flags [P.], seq 3582166698:3582166702, ack 3315416130, win 85, options [nop,nop,TS val 3792618162 ecr 1097323643], length 4
 00:00:20.120806 IP 10.0.0.8.45026 > 10.0.0.6.1883: Flags [.], ack 3582166702, win 83, options [nop,nop,TS val 1097323644 ecr 3792618162], length 0
 00:00:20.120807 IP 10.0.0.8.45026 > 10.0.0.6.1883: Flags [P.], seq 3315416130:3315416134, ack 3582166702, win 83, options [nop,nop,TS val 1097323644 ecr 3792618162], length 4
 00:00:20.121154 IP 10.0.0.6.1883 > 10.0.0.8.45026: Flags [P.], seq 3582166702:3582166706, ack 3315416134, win 85, options [nop,nop,TS val 3792618163 ecr 1097323644], length 4
 00:00:20.222823 IP 10.0.0.8.45026 > 10.0.0.6.1883: Flags [.], ack 3582166706, win 83, options [nop,nop,TS val 1097323687 ecr 3792618163], length 0
 00:00:21.144891 IP 10.0.0.8.45026 > 10.0.0.6.1883: Flags [P.], seq 3315416134:3315416529, ack 3582166706, win 83, options [nop,nop,TS val 1097324668 ecr 3792618163], length 395
 00:00:21.146167 IP 10.0.0.6.1883 > 10.0.0.8.45026: Flags [P.], seq 3582166706:3582166710, ack 3315416529, win 85, options [nop,nop,TS val 3792619188 ecr 1097324668], length 4
 00:00:21.146863 IP 10.0.0.8.45026 > 10.0.0.6.1883: Flags [.], ack 3582166710, win 83, options [nop,nop,TS val 1097324670 ecr 3792619188], length 0
 00:00:21.147607 IP 10.0.0.8.45026 > 10.0.0.6.1883: Flags [P.], seq 3315416529:3315416533, ack 3582166710, win 83, options [nop,nop,TS val 1097324671 ecr 3792619188], length 4
 00:00:21.148250 IP 10.0.0.6.1883 > 10.0.0.8.45026: Flags [P.], seq 3582166710:3582166714, ack 3315416533, win 85, options [nop,nop,TS val 3792619190 ecr 1097324671], length 4
 00:00:21.244681 IP 10.0.0.8.45026 > 10.0.0.6.1883: Flags [.], ack 3582166714, win 83, options [nop,nop,TS val 1097324768 ecr 3792619190], length 0
 00:00:22.146006 IP 10.0.0.8.45026 > 10.0.0.6.1883: Flags [P.], seq 3315416533:3315416928, ack 3582166714, win 83, options [nop,nop,TS val 1097325669 ecr 3792619190], length 395
 00:00:22.146719 IP 10.0.0.6.1883 > 10.0.0.8.45026: Flags [P.], seq 3582166714:3582166718, ack 3315416928, win 85, options [nop,nop,TS val 3792620188 ecr 1097325669], length 4
 00:00:22.147211 IP 10.0.0.8.45026 > 10.0.0.6.1883: Flags [.], ack 3582166718, win 83, options [nop,nop,TS val 1097325670 ecr 3792620188], length 0
 00:00:22.147213 IP 10.0.0.8.45026 > 10.0.0.6.1883: Flags [P.], seq 3315416928:3315416932, ack 3582166718, win 83, options [nop,nop,TS val 1097325671 ecr 3792620188], length 4
 00:00:22.147386 IP 10.0.0.6.1883 > 10.0.0.8.45026: Flags [P.], seq 3582166718:3582166722, ack 3315416932, win 85, options [nop,nop,TS val 3792620189 ecr 1097325671], length 4
 00:00:22.258171 IP 10.0.0.8.45026 > 10.0.0.6.1883: Flags [.], ack 3582166722, win 83, options [nop,nop,TS val 1097325715 ecr 3792620189], length 0
 00:00:23.148029 IP 10.0.0.8.45026 > 10.0.0.6.1883: Flags [P.], seq 3315416932:3315417327, ack 3582166722, win 83, options [nop,nop,TS val 1097326671 ecr 3792620189], length 395
 00:00:23.148792 IP 10.0.0.6.1883 > 10.0.0.8.45026: Flags [P.], seq 3582166722:3582166726, ack 3315417327, win 85, options [nop,nop,TS val 3792621190 ecr 1097326671], length 4
 00:00:23.149684 IP 10.0.0.8.45026 > 10.0.0.6.1883: Flags [.], ack 3582166726, win 83, options [nop,nop,TS val 1097326673 ecr 3792621190], length 0
 00:00:23.149686 IP 10.0.0.8.45026 > 10.0.0.6.1883: Flags [P.], seq 3315417327:3315417331, ack 3582166726, win 83, options [nop,nop,TS val 1097326673 ecr 3792621190], length 4
 00:00:23.149792 IP 10.0.0.6.1883 > 10.0.0.8.45026: Flags [P.], seq 3582166726:3582166730, ack 3315417331, win 85, options [nop,nop,TS val 3792621191 ecr 1097326673], length 4
 00:00:23.266165 IP 10.0.0.8.45026 > 10.0.0.6.1883: Flags [.], ack 3582166730, win 83, options [nop,nop,TS val 1097326715 ecr 3792621191], length 0
 00:00:23.795424 IP 10.0.0.8.45026 > 10.0.0.6.1883: Flags [P.], seq 3315417331:3315417333, ack 3582166730, win 83, options [nop,nop,TS val 1097327319 ecr 3792621191], length 2
 00:00:23.795656 IP 10.0.0.6.1883 > 10.0.0.8.45026: Flags [P.], seq 3582166730:3582166732, ack 3315417333, win 85, options [nop,nop,TS val 3792621837 ecr 1097327319], length 2
 00:00:23.795998 IP 10.0.0.8.45026 > 10.0.0.6.1883: Flags [.], ack 3582166732, win 83, options [nop,nop,TS val 1097327319 ecr 3792621837], length 0
 00:00:24.149611 IP 10.0.0.8.45026 > 10.0.0.6.1883: Flags [P.], seq 3315417333:3315417728, ack 3582166732, win 83, options [nop,nop,TS val 1097327673 ecr 3792621837], length 395
 00:00:24.150296 IP 10.0.0.6.1883 > 10.0.0.8.45026: Flags [P.], seq 3582166732:3582166736, ack 3315417728, win 85, options [nop,nop,TS val 3792622192 ecr 1097327673], length 4
 00:00:24.151370 IP 10.0.0.8.45026 > 10.0.0.6.1883: Flags [.], ack 3582166736, win 83, options [nop,nop,TS val 1097327675 ecr 3792622192], length 0
 00:00:24.151372 IP 10.0.0.8.45026 > 10.0.0.6.1883: Flags [P.], seq 3315417728:3315417732, ack 3582166736, win 83, options [nop,nop,TS val 1097327675 ecr 3792622192], length 4
 00:00:24.151622 IP 10.0.0.6.1883 > 10.0.0.8.45026: Flags [P.], seq 3582166736:3582166740, ack 3315417732, win 85, options [nop,nop,TS val 3792622193 ecr 1097327675], length 4
 00:00:24.195217 IP 10.0.0.8.45026 > 10.0.0.6.1883: Flags [.], ack 3582166740, win 83, options [nop,nop,TS val 1097327719 ecr 3792622193], length 0
 00:00:25.152065 IP 10.0.0.8.45026 > 10.0.0.6.1883: Flags [P.], seq 3315417732:3315418127, ack 3582166740, win 83, options [nop,nop,TS val 1097328675 ecr 3792622193], length 395
 00:00:25.152715 IP 10.0.0.6.1883 > 10.0.0.8.45026: Flags [P.], seq 3582166740:3582166744, ack 3315418127, win 85, options [nop,nop,TS val 3792623194 ecr 1097328675], length 4
 00:00:25.153611 IP 10.0.0.8.45026 > 10.0.0.6.1883: Flags [.], ack 3582166744, win 83, options [nop,nop,TS val 1097328677 ecr 3792623194], length 0
 00:00:25.153613 IP 10.0.0.8.45026 > 10.0.0.6.1883: Flags [P.], seq 3315418127:3315418131, ack 3582166744, win 83, options [nop,nop,TS val 1097328677 ecr 3792623194], length 4
 00:00:25.153814 IP 10.0.0.6.1883 > 10.0.0.8.45026: Flags [P.], seq 3582166744:3582166748, ack 3315418131, win 85, options [nop,nop,TS val 3792623195 ecr 1097328677], length 4
 00:00:25.225162 IP 10.0.0.8.45026 > 10.0.0.6.1883: Flags [.], ack 3582166748, win 83, options [nop,nop,TS val 1097328749 ecr 3792623195], length 0
 00:00:26.301843 IP 10.0.0.8.45026 > 10.0.0.6.1883: Flags [P.], seq 3315418131:3315418526, ack 3582166748, win 83, options [nop,nop,TS val 1097329825 ecr 3792623195], length 395
 00:00:26.302412 IP 10.0.0.6.1883 > 10.0.0.8.45026: Flags [P.], seq 3582166748:3582166752, ack 3315418526, win 85, options [nop,nop,TS val 3792624344 ecr 1097329825], length 4
 00:00:26.303481 IP 10.0.0.8.45026 > 10.0.0.6.1883: Flags [.], ack 3582166752, win 83, options [nop,nop,TS val 1097329827 ecr 3792624344], length 0
 00:00:26.304045 IP 10.0.0.8.45026 > 10.0.0.6.1883: Flags [P.], seq 3315418526:3315418530, ack 3582166752, win 83, options [nop,nop,TS val 1097329827 ecr 3792624344], length 4
 00:00:26.304314 IP 10.0.0.6.1883 > 10.0.0.8.45026: Flags [P.], seq 3582166752:3582166756, ack 3315418530, win 85, options [nop,nop,TS val 3792624346 ecr 1097329827], length 4
 00:00:26.347355 IP 10.0.0.8.45026 > 10.0.0.6.1883: Flags [.], ack 3582166756, win 83, options [nop,nop,TS val 1097329871 ecr 3792624346], length 0
 00:00:27.303630 IP 10.0.0.8.45026 > 10.0.0.6.1883: Flags [P.], seq 3315418530:3315418925, ack 3582166756, win 83, options [nop,nop,TS val 1097330827 ecr 3792624346], length 395
 00:00:27.304428 IP 10.0.0.6.1883 > 10.0.0.8.45026: Flags [P.], seq 3582166756:3582166760, ack 3315418925, win 85, options [nop,nop,TS val 3792625346 ecr 1097330827], length 4
 00:00:27.304550 IP 10.0.0.8.45026 > 10.0.0.6.1883: Flags [.], ack 3582166760, win 83, options [nop,nop,TS val 1097330828 ecr 3792625346], length 0
 00:00:27.304937 IP 10.0.0.8.45026 > 10.0.0.6.1883: Flags [P.], seq 3315418925:3315418929, ack 3582166760, win 83, options [nop,nop,TS val 1097330829 ecr 3792625346], length 4
 00:00:27.305265 IP 10.0.0.6.1883 > 10.0.0.8.45026: Flags [P.], seq 3582166760:3582166764, ack 3315418929, win 85, options [nop,nop,TS val 3792625347 ecr 1097330829], length 4
 00:00:27.347465 IP 10.0.0.8.45026 > 10.0.0.6.1883: Flags [.], ack 3582166764, win 83, options [nop,nop,TS val 1097330871 ecr 3792625347], length 0
 00:00:28.304805 IP 10.0.0.8.45026 > 10.0.0.6.1883: Flags [P.], seq 3315418929:3315419324, ack 3582166764, win 83, options [nop,nop,TS val 1097331828 ecr 3792625347], length 395
 00:00:28.305634 IP 10.0.0.6.1883 > 10.0.0.8.45026: Flags [P.], seq 3582166764:3582166768, ack 3315419324, win 85, options [nop,nop,TS val 3792626347 ecr 1097331828], length 4
 00:00:28.306526 IP 10.0.0.8.45026 > 10.0.0.6.1883: Flags [.], ack 3582166768, win 83, options [nop,nop,TS val 1097331830 ecr 3792626347], length 0
 00:00:28.306714 IP 10.0.0.8.45026 > 10.0.0.6.1883: Flags [P.], seq 3315419324:3315419328, ack 3582166768, win 83, options [nop,nop,TS val 1097331830 ecr 3792626347], length 4
 00:00:28.306946 IP 10.0.0.6.1883 > 10.0.0.8.45026: Flags [P.], seq 3582166768:3582166772, ack 3315419328, win 85, options [nop,nop,TS val 3792626349 ecr 1097331830], length 4
 00:00:28.352948 IP 10.0.0.8.45026 > 10.0.0.6.1883: Flags [.], ack 3582166772, win 83, options [nop,nop,TS val 1097331876 ecr 3792626349], length 0
 00:00:28.797296 IP 10.0.0.8.45026 > 10.0.0.6.1883: Flags [P.], seq 3315419328:3315419330, ack 3582166772, win 83, options [nop,nop,TS val 1097332321 ecr 3792626349], length 2
 00:00:28.797483 IP 10.0.0.6.1883 > 10.0.0.8.45026: Flags [P.], seq 3582166772:3582166774, ack 3315419330, win 85, options [nop,nop,TS val 3792626839 ecr 1097332321], length 2
 00:00:28.798486 IP 10.0.0.8.45026 > 10.0.0.6.1883: Flags [.], ack 3582166774, win 83, options [nop,nop,TS val 1097332321 ecr 3792626839], length 0
 00:00:29.305896 IP 10.0.0.8.45026 > 10.0.0.6.1883: Flags [P.], seq 3315419330:3315419725, ack 3582166774, win 83, options [nop,nop,TS val 1097332829 ecr 3792626839], length 395
 00:00:29.306439 IP 10.0.0.6.1883 > 10.0.0.8.45026: Flags [P.], seq 3582166774:3582166778, ack 3315419725, win 85, options [nop,nop,TS val 3792627348 ecr 1097332829], length 4
 00:00:29.307066 IP 10.0.0.8.45026 > 10.0.0.6.1883: Flags [.], ack 3582166778, win 83, options [nop,nop,TS val 1097332830 ecr 3792627348], length 0
 00:00:29.307068 IP 10.0.0.8.45026 > 10.0.0.6.1883: Flags [P.], seq 3315419725:3315419729, ack 3582166778, win 83, options [nop,nop,TS val 1097332831 ecr 3792627348], length 4
 00:00:29.307180 IP 10.0.0.6.1883 > 10.0.0.8.45026: Flags [P.], seq 3582166778:3582166782, ack 3315419729, win 85, options [nop,nop,TS val 3792627349 ecr 1097332831], length 4
 00:00:29.351673 IP 10.0.0.8.45026 > 10.0.0.6.1883: Flags [.], ack 3582166782, win 83, options [nop,nop,TS val 1097332875 ecr 3792627349], length 0
 00:00:30.306657 IP 10.0.0.8.45026 > 10.0.0.6.1883: Flags [P.], seq 3315419729:3315420124, ack 3582166782, win 83, options [nop,nop,TS val 1097333830 ecr 3792627349], length 395
 00:00:30.307230 IP 10.0.0.6.1883 > 10.0.0.8.45026: Flags [P.], seq 3582166782:3582166786, ack 3315420124, win 85, options [nop,nop,TS val 3792628349 ecr 1097333830], length 4
 00:00:30.307677 IP 10.0.0.8.45026 > 10.0.0.6.1883: Flags [.], ack 3582166786, win 83, options [nop,nop,TS val 1097333831 ecr 3792628349], length 0
 00:00:30.307678 IP 10.0.0.8.45026 > 10.0.0.6.1883: Flags [P.], seq 3315420124:3315420128, ack 3582166786, win 83, options [nop,nop,TS val 1097333831 ecr 3792628349], length 4
 00:00:30.307858 IP 10.0.0.6.1883 > 10.0.0.8.45026: Flags [P.], seq 3582166786:3582166790, ack 3315420128, win 85, options [nop,nop,TS val 3792628349 ecr 1097333831], length 4
 00:00:30.350993 IP 10.0.0.8.45026 > 10.0.0.6.1883: Flags [.], ack 3582166790, win 83, options [nop,nop,TS val 1097333874 ecr 3792628349], length 0
 00:00:31.307661 IP 10.0.0.8.45026 > 10.0.0.6.1883: Flags [P.], seq 3315420128:3315420523, ack 3582166790, win 83, options [nop,nop,TS val 1097334831 ecr 3792628349], length 395
 00:00:31.308232 IP 10.0.0.6.1883 > 10.0.0.8.45026: Flags [P.], seq 3582166790:3582166794, ack 3315420523, win 85, options [nop,nop,TS val 3792629350 ecr 1097334831], length 4
 00:00:31.308697 IP 10.0.0.8.45026 > 10.0.0.6.1883: Flags [.], ack 3582166794, win 83, options [nop,nop,TS val 1097334832 ecr 3792629350], length 0
 00:00:31.308698 IP 10.0.0.8.45026 > 10.0.0.6.1883: Flags [P.], seq 3315420523:3315420527, ack 3582166794, win 83, options [nop,nop,TS val 1097334832 ecr 3792629350], length 4
 00:00:31.309380 IP 10.0.0.6.1883 > 10.0.0.8.45026: Flags [P.], seq 3582166794:3582166798, ack 3315420527, win 85, options [nop,nop,TS val 3792629351 ecr 1097334832], length 4
 00:00:31.351465 IP 10.0.0.8.45026 > 10.0.0.6.1883: Flags [.], ack 3582166798, win 83, options [nop,nop,TS val 1097334875 ecr 3792629351], length 0
 00:00:32.309625 IP 10.0.0.8.45026 > 10.0.0.6.1883: Flags [P.], seq 3315420527:3315420922, ack 3582166798, win 83, options [nop,nop,TS val 1097335832 ecr 3792629351], length 395
 00:00:32.310293 IP 10.0.0.6.1883 > 10.0.0.8.45026: Flags [P.], seq 3582166798:3582166802, ack 3315420922, win 85, options [nop,nop,TS val 3792630352 ecr 1097335832], length 4
 00:00:32.311842 IP 10.0.0.8.45026 > 10.0.0.6.1883: Flags [.], ack 3582166802, win 83, options [nop,nop,TS val 1097335834 ecr 3792630352], length 0
 00:00:32.311893 IP 10.0.0.8.45026 > 10.0.0.6.1883: Flags [P.], seq 3315420922:3315420926, ack 3582166802, win 83, options [nop,nop,TS val 1097335835 ecr 3792630352], length 4
 00:00:32.312092 IP 10.0.0.6.1883 > 10.0.0.8.45026: Flags [P.], seq 3582166802:3582166806, ack 3315420926, win 85, options [nop,nop,TS val 3792630354 ecr 1097335835], length 4
 00:00:32.355348 IP 10.0.0.8.45026 > 10.0.0.6.1883: Flags [.], ack 3582166806, win 83, options [nop,nop,TS val 1097335879 ecr 3792630354], length 0
 00:00:33.310335 IP 10.0.0.8.45026 > 10.0.0.6.1883: Flags [P.], seq 3315420926:3315421321, ack 3582166806, win 83, options [nop,nop,TS val 1097336833 ecr 3792630354], length 395
 00:00:33.311388 IP 10.0.0.6.1883 > 10.0.0.8.45026: Flags [P.], seq 3582166806:3582166810, ack 3315421321, win 85, options [nop,nop,TS val 3792631353 ecr 1097336833], length 4
 00:00:33.311957 IP 10.0.0.8.45026 > 10.0.0.6.1883: Flags [.], ack 3582166810, win 83, options [nop,nop,TS val 1097336835 ecr 3792631353], length 0
 00:00:33.312343 IP 10.0.0.8.45026 > 10.0.0.6.1883: Flags [P.], seq 3315421321:3315421325, ack 3582166810, win 83, options [nop,nop,TS val 1097336836 ecr 3792631353], length 4
 00:00:33.312530 IP 10.0.0.6.1883 > 10.0.0.8.45026: Flags [P.], seq 3582166810:3582166814, ack 3315421325, win 85, options [nop,nop,TS val 3792631354 ecr 1097336836], length 4
 00:00:33.510924 IP 10.0.0.8.45026 > 10.0.0.6.1883: Flags [.], ack 3582166814, win 83, options [nop,nop,TS val 1097336879 ecr 3792631354], length 0
 00:00:33.820188 IP 10.0.0.8.45026 > 10.0.0.6.1883: Flags [P.], seq 3315421325:3315421327, ack 3582166814, win 83, options [nop,nop,TS val 1097337343 ecr 3792631354], length 2
 00:00:33.820387 IP 10.0.0.6.1883 > 10.0.0.8.45026: Flags [P.], seq 3582166814:3582166816, ack 3315421327, win 85, options [nop,nop,TS val 3792631862 ecr 1097337343], length 2
 00:00:33.822148 IP 10.0.0.8.45026 > 10.0.0.6.1883: Flags [.], ack 3582166816, win 83, options [nop,nop,TS val 1097337345 ecr 3792631862], length 0
 00:00:34.323854 IP 10.0.0.8.45026 > 10.0.0.6.1883: Flags [P.], seq 3315421327:3315421722, ack 3582166816, win 83, options [nop,nop,TS val 1097337847 ecr 3792631862], length 395
 00:00:34.324678 IP 10.0.0.6.1883 > 10.0.0.8.45026: Flags [P.], seq 3582166816:3582166820, ack 3315421722, win 85, options [nop,nop,TS val 3792632366 ecr 1097337847], length 4
 00:00:34.325107 IP 10.0.0.8.45026 > 10.0.0.6.1883: Flags [.], ack 3582166820, win 83, options [nop,nop,TS val 1097337848 ecr 3792632366], length 0
 00:00:34.325108 IP 10.0.0.8.45026 > 10.0.0.6.1883: Flags [P.], seq 3315421722:3315421726, ack 3582166820, win 83, options [nop,nop,TS val 1097337849 ecr 3792632366], length 4
 00:00:34.325318 IP 10.0.0.6.1883 > 10.0.0.8.45026: Flags [P.], seq 3582166820:3582166824, ack 3315421726, win 85, options [nop,nop,TS val 3792632367 ecr 1097337849], length 4
 00:00:34.536050 IP 10.0.0.8.45026 > 10.0.0.6.1883: Flags [.], ack 3582166824, win 83, options [nop,nop,TS val 1097338059 ecr 3792632367], length 0
 00:00:35.328161 IP 10.0.0.8.45026 > 10.0.0.6.1883: Flags [P.], seq 3315421726:3315422121, ack 3582166824, win 83, options [nop,nop,TS val 1097338851 ecr 3792632367], length 395
 00:00:35.329462 IP 10.0.0.6.1883 > 10.0.0.8.45026: Flags [P.], seq 3582166824:3582166828, ack 3315422121, win 85, options [nop,nop,TS val 3792633371 ecr 1097338851], length 4
 00:00:35.330009 IP 10.0.0.8.45026 > 10.0.0.6.1883: Flags [.], ack 3582166828, win 83, options [nop,nop,TS val 1097338853 ecr 3792633371], length 0
 00:00:35.330033 IP 10.0.0.8.45026 > 10.0.0.6.1883: Flags [P.], seq 3315422121:3315422125, ack 3582166828, win 83, options [nop,nop,TS val 1097338854 ecr 3792633371], length 4
 00:00:35.330469 IP 10.0.0.6.1883 > 10.0.0.8.45026: Flags [P.], seq 3582166828:3582166832, ack 3315422125, win 85, options [nop,nop,TS val 3792633372 ecr 1097338854], length 4
 00:00:35.579597 IP 10.0.0.8.45026 > 10.0.0.6.1883: Flags [.], ack 3582166832, win 83, options [nop,nop,TS val 1097339075 ecr 3792633372], length 0
 00:00:36.332699 IP 10.0.0.8.45026 > 10.0.0.6.1883: Flags [P.], seq 3315422125:3315422520, ack 3582166832, win 83, options [nop,nop,TS val 1097339855 ecr 3792633372], length 395
 00:00:36.333438 IP 10.0.0.6.1883 > 10.0.0.8.45026: Flags [P.], seq 3582166832:3582166836, ack 3315422520, win 85, options [nop,nop,TS val 3792634375 ecr 1097339855], length 4
 00:00:36.333954 IP 10.0.0.8.45026 > 10.0.0.6.1883: Flags [.], ack 3582166836, win 83, options [nop,nop,TS val 1097339857 ecr 3792634375], length 0
 00:00:36.334180 IP 10.0.0.8.45026 > 10.0.0.6.1883: Flags [P.], seq 3315422520:3315422524, ack 3582166836, win 83, options [nop,nop,TS val 1097339857 ecr 3792634375], length 4
 00:00:36.334298 IP 10.0.0.6.1883 > 10.0.0.8.45026: Flags [P.], seq 3582166836:3582166840, ack 3315422524, win 85, options [nop,nop,TS val 3792634376 ecr 1097339857], length 4
 00:00:36.551550 IP 10.0.0.8.45026 > 10.0.0.6.1883: Flags [.], ack 3582166840, win 83, options [nop,nop,TS val 1097340075 ecr 3792634376], length 0
 00:00:37.335393 IP 10.0.0.8.45026 > 10.0.0.6.1883: Flags [P.], seq 3315422524:3315422919, ack 3582166840, win 83, options [nop,nop,TS val 1097340858 ecr 3792634376], length 395
 00:00:37.336681 IP 10.0.0.6.1883 > 10.0.0.8.45026: Flags [P.], seq 3582166840:3582166844, ack 3315422919, win 85, options [nop,nop,TS val 3792635378 ecr 1097340858], length 4
 00:00:37.338569 IP 10.0.0.8.45026 > 10.0.0.6.1883: Flags [.], ack 3582166844, win 83, options [nop,nop,TS val 1097340862 ecr 3792635378], length 0
 00:00:37.338570 IP 10.0.0.8.45026 > 10.0.0.6.1883: Flags [P.], seq 3315422919:3315422923, ack 3582166844, win 83, options [nop,nop,TS val 1097340862 ecr 3792635378], length 4
