 00:00:00.000000 IP6 fe80::7437:3cff:fe16:bbbe > ff02::2: ICMP6, router solicitation, length 16
 00:00:00.228873 IP6 fe80::6c4d:7dff:fe1d:7b1e > ff02::2: ICMP6, router solicitation, length 16
 00:00:00.755227 IP6 fe80::d815:bff:fed8:acb4 > ff02::2: ICMP6, router solicitation, length 16
 00:00:00.788495 IP6 fe80::4443:d0ff:fe18:dcb8 > ff02::2: ICMP6, router solicitation, length 16
 00:00:00.804711 IP6 fe80::dc36:7bff:fe16:9739 > ff02::2: ICMP6, router solicitation, length 16
 00:00:00.811605 IP6 fe80::2c4c:2eff:fe53:3870 > ff02::2: ICMP6, router solicitation, length 16
 00:00:01.287664 IP6 fe80::b044:e0ff:fea3:6665 > ff02::2: ICMP6, router solicitation, length 16
 00:00:01.305762 IP6 fe80::848d:aaff:fe91:566d > ff02::2: ICMP6, router solicitation, length 16
 00:00:01.314810 IP6 fe80::982f:3bff:fe3c:5612 > ff02::2: ICMP6, router solicitation, length 16
 00:00:01.508641 IP6 fe80::40bd:a6ff:fe95:79d > ff02::2: ICMP6, router solicitation, length 16
 00:00:01.780443 IP6 fe80::a85b:64ff:fee2:2af4 > ff02::2: ICMP6, router solicitation, length 16
 00:00:12.492591 ARP, Request who-has 10.0.0.6 tell 10.0.0.8, length 28
 00:00:12.492903 ARP, Reply 10.0.0.6 is-at 6e:4d:7d:1d:7b:1e, length 28
 00:00:12.515427 IP 10.0.0.8.44896 > 10.0.0.6.1883: Flags [S], seq 1405119464, win 42340, options [mss 1460,sackOK,TS val 1096299673 ecr 0,nop,wscale 9], length 0
 00:00:12.515643 IP 10.0.0.6.1883 > 10.0.0.8.44896: Flags [S.], seq 1400237860, ack 1405119465, win 43440, options [mss 1460,sackOK,TS val 3791594224 ecr 1096299673,nop,wscale 9], length 0
 00:00:12.527846 IP6 fe80::7d:71ff:fec1:d523 > ff02::2: ICMP6, router solicitation, length 16
 00:00:12.533277 IP 10.0.0.8.44896 > 10.0.0.6.1883: Flags [.], ack 1400237861, win 83, options [nop,nop,TS val 1096299723 ecr 3791594224], length 0
 00:00:12.533340 IP 10.0.0.8.44896 > 10.0.0.6.1883: Flags [P.], seq 1405119465:1405119485, ack 1400237861, win 83, options [nop,nop,TS val 1096299723 ecr 3791594224], length 20
 00:00:12.533521 IP 10.0.0.6.1883 > 10.0.0.8.44896: Flags [.], ack 1405119485, win 85, options [nop,nop,TS val 3791594242 ecr 1096299723], length 0
 00:00:12.533645 IP 10.0.0.6.1883 > 10.0.0.8.44896: Flags [P.], seq 1400237861:1400237865, ack 1405119485, win 85, options [nop,nop,TS val 3791594242 ecr 1096299723], length 4
 00:00:12.534753 IP 10.0.0.8.44896 > 10.0.0.6.1883: Flags [.], ack 1400237865, win 83, options [nop,nop,TS val 1096299724 ecr 3791594242], length 0
 00:00:12.534804 IP 10.0.0.8.44896 > 10.0.0.6.1883: Flags [P.], seq 1405119485:1405119549, ack 1400237865, win 83, options [nop,nop,TS val 1096299724 ecr 3791594242], length 64
 00:00:12.535013 IP 10.0.0.6.1883 > 10.0.0.8.44896: Flags [P.], seq 1400237865:1400237930, ack 1405119549, win 85, options [nop,nop,TS val 3791594243 ecr 1096299724], length 65
 00:00:12.535659 IP 10.0.0.8.44896 > 10.0.0.6.1883: Flags [P.], seq 1405119549:1405119944, ack 1400237930, win 83, options [nop,nop,TS val 1096299725 ecr 3791594243], length 395
 00:00:12.535728 IP 10.0.0.6.1883 > 10.0.0.8.44896: Flags [P.], seq 1400237930:1400237935, ack 1405119944, win 85, options [nop,nop,TS val 3791594244 ecr 1096299725], length 5
 00:00:12.580659 IP 10.0.0.8.44896 > 10.0.0.6.1883: Flags [.], ack 1400237935, win 83, options [nop,nop,TS val 1096299771 ecr 3791594244], length 0
 00:00:12.580707 IP 10.0.0.6.1883 > 10.0.0.8.44896: Flags [P.], seq 1400237935:1400237939, ack 1405119944, win 85, options [nop,nop,TS val 3791594289 ecr 1096299771], length 4
 00:00:12.580922 IP 10.0.0.8.44896 > 10.0.0.6.1883: Flags [.], ack 1400237939, win 83, options [nop,nop,TS val 1096299771 ecr 3791594289], length 0
 00:00:12.581813 IP 10.0.0.8.44896 > 10.0.0.6.1883: Flags [P.], seq 1405119944:1405119948, ack 1400237939, win 83, options [nop,nop,TS val 1096299771 ecr 3791594289], length 4
 00:00:12.581998 IP 10.0.0.6.1883 > 10.0.0.8.44896: Flags [P.], seq 1400237939:1400237943, ack 1405119948, win 85, options [nop,nop,TS val 3791594290 ecr 1096299771], length 4
 00:00:12.699181 IP 10.0.0.8.44896 > 10.0.0.6.1883: Flags [.], ack 1400237943, win 83, options [nop,nop,TS val 1096299815 ecr 3791594290], length 0
 00:00:13.503328 IP 10.0.0.8.44896 > 10.0.0.6.1883: Flags [P.], seq 1405119948:1405120343, ack 1400237943, win 83, options [nop,nop,TS val 1096300693 ecr 3791594290], length 395
 00:00:13.504242 IP 10.0.0.6.1883 > 10.0.0.8.44896: Flags [P.], seq 1400237943:1400237947, ack 1405120343, win 85, options [nop,nop,TS val 3791595212 ecr 1096300693], length 4
 00:00:13.505388 IP 10.0.0.8.44896 > 10.0.0.6.1883: Flags [.], ack 1400237947, win 83, options [nop,nop,TS val 1096300695 ecr 3791595212], length 0
 00:00:13.505500 IP 10.0.0.8.44896 > 10.0.0.6.1883: Flags [P.], seq 1405120343:1405120347, ack 1400237947, win 83, options [nop,nop,TS val 1096300695 ecr 3791595212], length 4
 00:00:13.505794 IP 10.0.0.6.1883 > 10.0.0.8.44896: Flags [P.], seq 1400237947:1400237951, ack 1405120347, win 85, options [nop,nop,TS val 3791595214 ecr 1096300695], length 4
 00:00:13.789211 IP 10.0.0.6.1883 > 10.0.0.8.44896: Flags [P.], seq 1400237947:1400237951, ack 1405120347, win 85, options [nop,nop,TS val 3791595497 ecr 1096300695], length 4
 00:00:13.791987 IP 10.0.0.8.44896 > 10.0.0.6.1883: Flags [.], ack 1400237951, win 83, options [nop,nop,TS val 1096300742 ecr 3791595214], length 0
 00:00:13.985105 IP 10.0.0.8.44896 > 10.0.0.6.1883: Flags [.], ack 1400237951, win 83, options [nop,nop,TS val 1096301101 ecr 3791595497,nop,nop,sack 1 {1400237947:1400237951}], length 0
 00:00:14.534058 IP 10.0.0.8.44896 > 10.0.0.6.1883: Flags [P.], seq 1405120347:1405120742, ack 1400237951, win 83, options [nop,nop,TS val 1096301724 ecr 3791595497], length 395
 00:00:14.535273 IP 10.0.0.6.1883 > 10.0.0.8.44896: Flags [P.], seq 1400237951:1400237955, ack 1405120742, win 85, options [nop,nop,TS val 3791596243 ecr 1096301724], length 4
 00:00:14.536671 IP 10.0.0.8.44896 > 10.0.0.6.1883: Flags [.], ack 1400237955, win 83, options [nop,nop,TS val 1096301726 ecr 3791596243], length 0
 00:00:14.537041 IP 10.0.0.8.44896 > 10.0.0.6.1883: Flags [P.], seq 1405120742:1405120746, ack 1400237955, win 83, options [nop,nop,TS val 1096301727 ecr 3791596243], length 4
 00:00:14.537814 IP 10.0.0.6.1883 > 10.0.0.8.44896: Flags [P.], seq 1400237955:1400237959, ack 1405120746, win 85, options [nop,nop,TS val 3791596245 ecr 1096301727], length 4
 00:00:14.787409 IP 10.0.0.8.44896 > 10.0.0.6.1883: Flags [.], ack 1400237959, win 83, options [nop,nop,TS val 1096301935 ecr 3791596245], length 0
 00:00:14.951502 IP6 fe80::5883:44ff:fe68:1cf5 > ff02::2: ICMP6, router solicitation, length 16
 00:00:14.961905 IP6 fe80::7437:3cff:fe16:bbbe > ff02::2: ICMP6, router solicitation, length 16
 00:00:15.537372 IP 10.0.0.8.44896 > 10.0.0.6.1883: Flags [P.], seq 1405120746:1405121141, ack 1400237959, win 83, options [nop,nop,TS val 1096302727 ecr 3791596245], length 395
 00:00:15.538866 IP 10.0.0.6.1883 > 10.0.0.8.44896: Flags [P.], seq 1400237959:1400237963, ack 1405121141, win 85, options [nop,nop,TS val 3791597247 ecr 1096302727], length 4
 00:00:15.540799 IP 10.0.0.8.44896 > 10.0.0.6.1883: Flags [.], ack 1400237963, win 83, options [nop,nop,TS val 1096302730 ecr 3791597247], length 0
 00:00:15.540931 IP 10.0.0.8.44896 > 10.0.0.6.1883: Flags [P.], seq 1405121141:1405121145, ack 1400237963, win 83, options [nop,nop,TS val 1096302731 ecr 3791597247], length 4
 00:00:15.541261 IP 10.0.0.6.1883 > 10.0.0.8.44896: Flags [P.], seq 1400237963:1400237967, ack 1405121145, win 85, options [nop,nop,TS val 3791597249 ecr 1096302731], length 4
 00:00:15.588861 IP6 fe80::6c4d:7dff:fe1d:7b1e > ff02::2: ICMP6, router solicitation, length 16
 00:00:15.589575 IP 10.0.0.8.44896 > 10.0.0.6.1883: Flags [.], ack 1400237967, win 83, options [nop,nop,TS val 1096302775 ecr 3791597249], length 0
 00:00:15.640576 IP6 fe80::7c85:c0ff:fe63:507 > ff02::2: ICMP6, router solicitation, length 16
 00:00:16.131286 IP6 fe80::dc36:7bff:fe16:9739 > ff02::2: ICMP6, router solicitation, length 16
 00:00:16.369036 IP6 fe80::4443:d0ff:fe18:dcb8 > ff02::2: ICMP6, router solicitation, length 16
 00:00:16.380339 IP6 fe80::d815:bff:fed8:acb4 > ff02::2: ICMP6, router solicitation, length 16
 00:00:16.541238 IP 10.0.0.8.44896 > 10.0.0.6.1883: Flags [P.], seq 1405121145:1405121540, ack 1400237967, win 83, options [nop,nop,TS val 1096303730 ecr 3791597249], length 395
 00:00:16.542829 IP 10.0.0.6.1883 > 10.0.0.8.44896: Flags [P.], seq 1400237967:1400237971, ack 1405121540, win 85, options [nop,nop,TS val 3791598251 ecr 1096303730], length 4
 00:00:16.543589 IP 10.0.0.8.44896 > 10.0.0.6.1883: Flags [.], ack 1400237971, win 83, options [nop,nop,TS val 1096303733 ecr 3791598251], length 0
 00:00:16.544222 IP 10.0.0.8.44896 > 10.0.0.6.1883: Flags [P.], seq 1405121540:1405121544, ack 1400237971, win 83, options [nop,nop,TS val 1096303734 ecr 3791598251], length 4
 00:00:16.544906 IP 10.0.0.6.1883 > 10.0.0.8.44896: Flags [P.], seq 1400237971:1400237975, ack 1405121544, win 85, options [nop,nop,TS val 3791598253 ecr 1096303734], length 4
 00:00:16.590310 IP 10.0.0.8.44896 > 10.0.0.6.1883: Flags [.], ack 1400237975, win 83, options [nop,nop,TS val 1096303780 ecr 3791598253], length 0
 00:00:17.535981 IP 10.0.0.8.44896 > 10.0.0.6.1883: Flags [P.], seq 1405121544:1405121546, ack 1400237975, win 83, options [nop,nop,TS val 1096304726 ecr 3791598253], length 2
 00:00:17.536637 IP 10.0.0.6.1883 > 10.0.0.8.44896: Flags [P.], seq 1400237975:1400237977, ack 1405121546, win 85, options [nop,nop,TS val 3791599244 ecr 1096304726], length 2
 00:00:17.536641 IP6 fe80::848d:aaff:fe91:566d > ff02::2: ICMP6, router solicitation, length 16
 00:00:17.537565 IP 10.0.0.8.44896 > 10.0.0.6.1883: Flags [.], ack 1400237977, win 83, options [nop,nop,TS val 1096304727 ecr 3791599244], length 0
 00:00:17.541272 IP 10.0.0.8.44896 > 10.0.0.6.1883: Flags [P.], seq 1405121546:1405121941, ack 1400237977, win 83, options [nop,nop,TS val 1096304731 ecr 3791599244], length 395
 00:00:17.541903 IP 10.0.0.6.1883 > 10.0.0.8.44896: Flags [P.], seq 1400237977:1400237981, ack 1405121941, win 85, options [nop,nop,TS val 3791599250 ecr 1096304731], length 4
 00:00:17.543185 IP 10.0.0.8.44896 > 10.0.0.6.1883: Flags [P.], seq 1405121941:1405121945, ack 1400237981, win 83, options [nop,nop,TS val 1096304733 ecr 3791599250], length 4
 00:00:17.543322 IP 10.0.0.6.1883 > 10.0.0.8.44896: Flags [P.], seq 1400237981:1400237985, ack 1405121945, win 85, options [nop,nop,TS val 3791599251 ecr 1096304733], length 4
 00:00:17.599423 IP 10.0.0.8.44896 > 10.0.0.6.1883: Flags [.], ack 1400237985, win 83, options [nop,nop,TS val 1096304789 ecr 3791599251], length 0
 00:00:18.555741 IP 10.0.0.8.44896 > 10.0.0.6.1883: Flags [P.], seq 1405121945:1405122340, ack 1400237985, win 83, options [nop,nop,TS val 1096305744 ecr 3791599251], length 395
 00:00:18.556780 IP 10.0.0.6.1883 > 10.0.0.8.44896: Flags [P.], seq 1400237985:1400237989, ack 1405122340, win 85, options [nop,nop,TS val 3791600265 ecr 1096305744], length 4
 00:00:18.557392 IP 10.0.0.8.44896 > 10.0.0.6.1883: Flags [.], ack 1400237989, win 83, options [nop,nop,TS val 1096305747 ecr 3791600265], length 0
 00:00:18.558554 IP 10.0.0.8.44896 > 10.0.0.6.1883: Flags [P.], seq 1405122340:1405122344, ack 1400237989, win 83, options [nop,nop,TS val 1096305747 ecr 3791600265], length 4
 00:00:18.559219 IP 10.0.0.6.1883 > 10.0.0.8.44896: Flags [P.], seq 1400237989:1400237993, ack 1405122344, win 85, options [nop,nop,TS val 3791600267 ecr 1096305747], length 4
 00:00:18.611005 IP 10.0.0.8.44896 > 10.0.0.6.1883: Flags [.], ack 1400237993, win 83, options [nop,nop,TS val 1096305801 ecr 3791600267], length 0
 00:00:18.916803 IP6 fe80::40bd:a6ff:fe95:79d > ff02::2: ICMP6, router solicitation, length 16
 00:00:18.928337 IP6 fe80::a85b:64ff:fee2:2af4 > ff02::2: ICMP6, router solicitation, length 16
 00:00:18.941068 IP6 fe80::b044:e0ff:fea3:6665 > ff02::2: ICMP6, router solicitation, length 16
 00:00:18.945007 IP6 fe80::2c4c:2eff:fe53:3870 > ff02::2: ICMP6, router solicitation, length 16
 00:00:19.556385 IP 10.0.0.8.44896 > 10.0.0.6.1883: Flags [P.], seq 1405122344:1405122739, ack 1400237993, win 83, options [nop,nop,TS val 1096306746 ecr 3791600267], length 395
 00:00:19.556871 IP 10.0.0.6.1883 > 10.0.0.8.44896: Flags [P.], seq 1400237993:1400237997, ack 1405122739, win 85, options [nop,nop,TS val 3791601265 ecr 1096306746], length 4
 00:00:19.557710 IP 10.0.0.8.44896 > 10.0.0.6.1883: Flags [.], ack 1400237997, win 83, options [nop,nop,TS val 1096306747 ecr 3791601265], length 0
 00:00:19.558043 IP 10.0.0.8.44896 > 10.0.0.6.1883: Flags [P.], seq 1405122739:1405122743, ack 1400237997, win 83, options [nop,nop,TS val 1096306747 ecr 3791601265], length 4
 00:00:19.558369 IP 10.0.0.6.1883 > 10.0.0.8.44896: Flags [P.], seq 1400237997:1400238001, ack 1405122743, win 85, options [nop,nop,TS val 3791601266 ecr 1096306747], length 4
 00:00:19.600855 IP 10.0.0.8.44896 > 10.0.0.6.1883: Flags [.], ack 1400238001, win 83, options [nop,nop,TS val 1096306791 ecr 3791601266], length 0
 00:00:20.557274 IP 10.0.0.8.44896 > 10.0.0.6.1883: Flags [P.], seq 1405122743:1405123138, ack 1400238001, win 83, options [nop,nop,TS val 1096307747 ecr 3791601266], length 395
 00:00:20.558210 IP 10.0.0.6.1883 > 10.0.0.8.44896: Flags [P.], seq 1400238001:1400238005, ack 1405123138, win 85, options [nop,nop,TS val 3791602266 ecr 1096307747], length 4
 00:00:20.559312 IP 10.0.0.8.44896 > 10.0.0.6.1883: Flags [.], ack 1400238005, win 83, options [nop,nop,TS val 1096307749 ecr 3791602266], length 0
 00:00:20.559393 IP 10.0.0.8.44896 > 10.0.0.6.1883: Flags [P.], seq 1405123138:1405123142, ack 1400238005, win 83, options [nop,nop,TS val 1096307749 ecr 3791602266], length 4
 00:00:20.559656 IP 10.0.0.6.1883 > 10.0.0.8.44896: Flags [P.], seq 1400238005:1400238009, ack 1405123142, win 85, options [nop,nop,TS val 3791602268 ecr 1096307749], length 4
 00:00:20.600526 IP 10.0.0.8.44896 > 10.0.0.6.1883: Flags [.], ack 1400238009, win 83, options [nop,nop,TS val 1096307790 ecr 3791602268], length 0
 00:00:20.975874 IP6 fe80::982f:3bff:fe3c:5612 > ff02::2: ICMP6, router solicitation, length 16
 00:00:21.558048 IP 10.0.0.8.44896 > 10.0.0.6.1883: Flags [P.], seq 1405123142:1405123537, ack 1400238009, win 83, options [nop,nop,TS val 1096308748 ecr 3791602268], length 395
 00:00:21.558338 IP 10.0.0.6.1883 > 10.0.0.8.44896: Flags [P.], seq 1400238009:1400238013, ack 1405123537, win 85, options [nop,nop,TS val 3791603266 ecr 1096308748], length 4
 00:00:21.558868 IP 10.0.0.8.44896 > 10.0.0.6.1883: Flags [.], ack 1400238013, win 83, options [nop,nop,TS val 1096308749 ecr 3791603266], length 0
 00:00:21.558913 IP 10.0.0.8.44896 > 10.0.0.6.1883: Flags [P.], seq 1405123537:1405123541, ack 1400238013, win 83, options [nop,nop,TS val 1096308749 ecr 3791603266], length 4
 00:00:21.559009 IP 10.0.0.6.1883 > 10.0.0.8.44896: Flags [P.], seq 1400238013:1400238017, ack 1405123541, win 85, options [nop,nop,TS val 3791603267 ecr 1096308749], length 4
 00:00:21.600401 IP 10.0.0.8.44896 > 10.0.0.6.1883: Flags [.], ack 1400238017, win 83, options [nop,nop,TS val 1096308790 ecr 3791603267], length 0
 00:00:22.537366 IP 10.0.0.8.44896 > 10.0.0.6.1883: Flags [P.], seq 1405123541:1405123543, ack 1400238017, win 83, options [nop,nop,TS val 1096309727 ecr 3791603267], length 2
 00:00:22.537709 IP 10.0.0.6.1883 > 10.0.0.8.44896: Flags [P.], seq 1400238017:1400238019, ack 1405123543, win 85, options [nop,nop,TS val 3791604246 ecr 1096309727], length 2
 00:00:22.538478 IP 10.0.0.8.44896 > 10.0.0.6.1883: Flags [.], ack 1400238019, win 83, options [nop,nop,TS val 1096309728 ecr 3791604246], length 0
 00:00:22.558871 IP 10.0.0.8.44896 > 10.0.0.6.1883: Flags [P.], seq 1405123543:1405123938, ack 1400238019, win 83, options [nop,nop,TS val 1096309749 ecr 3791604246], length 395
 00:00:22.559536 IP 10.0.0.6.1883 > 10.0.0.8.44896: Flags [P.], seq 1400238019:1400238023, ack 1405123938, win 85, options [nop,nop,TS val 3791604268 ecr 1096309749], length 4
 00:00:22.560547 IP 10.0.0.8.44896 > 10.0.0.6.1883: Flags [P.], seq 1405123938:1405123942, ack 1400238023, win 83, options [nop,nop,TS val 1096309750 ecr 3791604268], length 4
 00:00:22.560786 IP 10.0.0.6.1883 > 10.0.0.8.44896: Flags [P.], seq 1400238023:1400238027, ack 1405123942, win 85, options [nop,nop,TS val 3791604269 ecr 1096309750], length 4
 00:00:22.604824 IP 10.0.0.8.44896 > 10.0.0.6.1883: Flags [.], ack 1400238027, win 83, options [nop,nop,TS val 1096309795 ecr 3791604269], length 0
 00:00:23.560382 IP 10.0.0.8.44896 > 10.0.0.6.1883: Flags [P.], seq 1405123942:1405124337, ack 1400238027, win 83, options [nop,nop,TS val 1096310750 ecr 3791604269], length 395
 00:00:23.561269 IP 10.0.0.6.1883 > 10.0.0.8.44896: Flags [P.], seq 1400238027:1400238031, ack 1405124337, win 85, options [nop,nop,TS val 3791605269 ecr 1096310750], length 4
 00:00:23.562465 IP 10.0.0.8.44896 > 10.0.0.6.1883: Flags [.], ack 1400238031, win 83, options [nop,nop,TS val 1096310752 ecr 3791605269], length 0
 00:00:23.562643 IP 10.0.0.8.44896 > 10.0.0.6.1883: Flags [P.], seq 1405124337:1405124341, ack 1400238031, win 83, options [nop,nop,TS val 1096310752 ecr 3791605269], length 4
 00:00:23.562934 IP 10.0.0.6.1883 > 10.0.0.8.44896: Flags [P.], seq 1400238031:1400238035, ack 1405124341, win 85, options [nop,nop,TS val 3791605271 ecr 1096310752], length 4
 00:00:23.604716 IP 10.0.0.8.44896 > 10.0.0.6.1883: Flags [.], ack 1400238035, win 83, options [nop,nop,TS val 1096310795 ecr 3791605271], length 0
 00:00:24.561424 IP 10.0.0.8.44896 > 10.0.0.6.1883: Flags [P.], seq 1405124341:1405124736, ack 1400238035, win 83, options [nop,nop,TS val 1096311751 ecr 3791605271], length 395
 00:00:24.562146 IP 10.0.0.6.1883 > 10.0.0.8.44896: Flags [P.], seq 1400238035:1400238039, ack 1405124736, win 85, options [nop,nop,TS val 3791606270 ecr 1096311751], length 4
 00:00:24.563398 IP 10.0.0.8.44896 > 10.0.0.6.1883: Flags [.], ack 1400238039, win 83, options [nop,nop,TS val 1096311753 ecr 3791606270], length 0
 00:00:24.563807 IP 10.0.0.8.44896 > 10.0.0.6.1883: Flags [P.], seq 1405124736:1405124740, ack 1400238039, win 83, options [nop,nop,TS val 1096311753 ecr 3791606270], length 4
 00:00:24.564152 IP 10.0.0.6.1883 > 10.0.0.8.44896: Flags [P.], seq 1400238039:1400238043, ack 1405124740, win 85, options [nop,nop,TS val 3791606272 ecr 1096311753], length 4
 00:00:24.608724 IP 10.0.0.8.44896 > 10.0.0.6.1883: Flags [.], ack 1400238043, win 83, options [nop,nop,TS val 1096311799 ecr 3791606272], length 0
 00:00:25.562969 IP 10.0.0.8.44896 > 10.0.0.6.1883: Flags [P.], seq 1405124740:1405125135, ack 1400238043, win 83, options [nop,nop,TS val 1096312753 ecr 3791606272], length 395
 00:00:25.563659 IP 10.0.0.6.1883 > 10.0.0.8.44896: Flags [P.], seq 1400238043:1400238047, ack 1405125135, win 85, options [nop,nop,TS val 3791607272 ecr 1096312753], length 4
 00:00:25.564972 IP 10.0.0.8.44896 > 10.0.0.6.1883: Flags [.], ack 1400238047, win 83, options [nop,nop,TS val 1096312754 ecr 3791607272], length 0
 00:00:25.565180 IP 10.0.0.8.44896 > 10.0.0.6.1883: Flags [P.], seq 1405125135:1405125139, ack 1400238047, win 83, options [nop,nop,TS val 1096312754 ecr 3791607272], length 4
 00:00:25.565837 IP 10.0.0.6.1883 > 10.0.0.8.44896: Flags [P.], seq 1400238047:1400238051, ack 1405125139, win 85, options [nop,nop,TS val 3791607274 ecr 1096312754], length 4
 00:00:25.608395 IP 10.0.0.8.44896 > 10.0.0.6.1883: Flags [.], ack 1400238051, win 83, options [nop,nop,TS val 1096312798 ecr 3791607274], length 0
 00:00:26.564534 IP 10.0.0.8.44896 > 10.0.0.6.1883: Flags [P.], seq 1405125139:1405125534, ack 1400238051, win 83, options [nop,nop,TS val 1096313754 ecr 3791607274], length 395
 00:00:26.565221 IP 10.0.0.6.1883 > 10.0.0.8.44896: Flags [P.], seq 1400238051:1400238055, ack 1405125534, win 85, options [nop,nop,TS val 3791608273 ecr 1096313754], length 4
 00:00:26.566265 IP 10.0.0.8.44896 > 10.0.0.6.1883: Flags [.], ack 1400238055, win 83, options [nop,nop,TS val 1096313756 ecr 3791608273], length 0
 00:00:26.566418 IP 10.0.0.8.44896 > 10.0.0.6.1883: Flags [P.], seq 1405125534:1405125538, ack 1400238055, win 83, options [nop,nop,TS val 1096313756 ecr 3791608273], length 4
 00:00:26.566679 IP 10.0.0.6.1883 > 10.0.0.8.44896: Flags [P.], seq 1400238055:1400238059, ack 1405125538, win 85, options [nop,nop,TS val 3791608275 ecr 1096313756], length 4
 00:00:26.608688 IP 10.0.0.8.44896 > 10.0.0.6.1883: Flags [.], ack 1400238059, win 83, options [nop,nop,TS val 1096313799 ecr 3791608275], length 0
 00:00:27.538900 IP 10.0.0.8.44896 > 10.0.0.6.1883: Flags [P.], seq 1405125538:1405125540, ack 1400238059, win 83, options [nop,nop,TS val 1096314729 ecr 3791608275], length 2
 00:00:27.539336 IP 10.0.0.6.1883 > 10.0.0.8.44896: Flags [P.], seq 1400238059:1400238061, ack 1405125540, win 85, options [nop,nop,TS val 3791609247 ecr 1096314729], length 2
 00:00:27.540159 IP 10.0.0.8.44896 > 10.0.0.6.1883: Flags [.], ack 1400238061, win 83, options [nop,nop,TS val 1096314730 ecr 3791609247], length 0
 00:00:27.565345 IP 10.0.0.8.44896 > 10.0.0.6.1883: Flags [P.], seq 1405125540:1405125935, ack 1400238061, win 83, options [nop,nop,TS val 1096314755 ecr 3791609247], length 395
 00:00:27.565906 IP 10.0.0.6.1883 > 10.0.0.8.44896: Flags [P.], seq 1400238061:1400238065, ack 1405125935, win 85, options [nop,nop,TS val 3791609274 ecr 1096314755], length 4
 00:00:27.566916 IP 10.0.0.8.44896 > 10.0.0.6.1883: Flags [P.], seq 1405125935:1405125939, ack 1400238065, win 83, options [nop,nop,TS val 1096314756 ecr 3791609274], length 4
 00:00:27.567291 IP 10.0.0.6.1883 > 10.0.0.8.44896: Flags [P.], seq 1400238065:1400238069, ack 1405125939, win 85, options [nop,nop,TS val 3791609275 ecr 1096314756], length 4
 00:00:27.612949 IP 10.0.0.8.44896 > 10.0.0.6.1883: Flags [.], ack 1400238069, win 83, options [nop,nop,TS val 1096314802 ecr 3791609275], length 0
 00:00:28.566477 IP 10.0.0.8.44896 > 10.0.0.6.1883: Flags [P.], seq 1405125939:1405126334, ack 1400238069, win 83, options [nop,nop,TS val 1096315756 ecr 3791609275], length 395
 00:00:28.567043 IP 10.0.0.6.1883 > 10.0.0.8.44896: Flags [P.], seq 1400238069:1400238073, ack 1405126334, win 85, options [nop,nop,TS val 3791610275 ecr 1096315756], length 4
 00:00:28.568074 IP 10.0.0.8.44896 > 10.0.0.6.1883: Flags [.], ack 1400238073, win 83, options [nop,nop,TS val 1096315757 ecr 3791610275], length 0
 00:00:28.568432 IP 10.0.0.8.44896 > 10.0.0.6.1883: Flags [P.], seq 1405126334:1405126338, ack 1400238073, win 83, options [nop,nop,TS val 1096315758 ecr 3791610275], length 4
 00:00:28.568963 IP 10.0.0.6.1883 > 10.0.0.8.44896: Flags [P.], seq 1400238073:1400238077, ack 1405126338, win 85, options [nop,nop,TS val 3791610277 ecr 1096315758], length 4
 00:00:28.612846 IP 10.0.0.8.44896 > 10.0.0.6.1883: Flags [.], ack 1400238077, win 83, options [nop,nop,TS val 1096315803 ecr 3791610277], length 0
 00:00:29.568063 IP 10.0.0.8.44896 > 10.0.0.6.1883: Flags [P.], seq 1405126338:1405126733, ack 1400238077, win 83, options [nop,nop,TS val 1096316758 ecr 3791610277], length 395
 00:00:29.568306 IP 10.0.0.6.1883 > 10.0.0.8.44896: Flags [P.], seq 1400238077:1400238081, ack 1405126733, win 85, options [nop,nop,TS val 3791611276 ecr 1096316758], length 4
 00:00:29.568658 IP 10.0.0.8.44896 > 10.0.0.6.1883: Flags [.], ack 1400238081, win 83, options [nop,nop,TS val 1096316759 ecr 3791611276], length 0
 00:00:29.568721 IP 10.0.0.8.44896 > 10.0.0.6.1883: Flags [P.], seq 1405126733:1405126737, ack 1400238081, win 83, options [nop,nop,TS val 1096316759 ecr 3791611276], length 4
 00:00:29.568827 IP 10.0.0.6.1883 > 10.0.0.8.44896: Flags [P.], seq 1400238081:1400238085, ack 1405126737, win 85, options [nop,nop,TS val 3791611277 ecr 1096316759], length 4
 00:00:29.613060 IP 10.0.0.8.44896 > 10.0.0.6.1883: Flags [.], ack 1400238085, win 83, options [nop,nop,TS val 1096316803 ecr 3791611277], length 0
 00:00:30.569092 IP 10.0.0.8.44896 > 10.0.0.6.1883: Flags [P.], seq 1405126737:1405127132, ack 1400238085, win 83, options [nop,nop,TS val 1096317759 ecr 3791611277], length 395
 00:00:30.569662 IP 10.0.0.6.1883 > 10.0.0.8.44896: Flags [P.], seq 1400238085:1400238089, ack 1405127132, win 85, options [nop,nop,TS val 3791612278 ecr 1096317759], length 4
 00:00:30.570495 IP 10.0.0.8.44896 > 10.0.0.6.1883: Flags [.], ack 1400238089, win 83, options [nop,nop,TS val 1096317760 ecr 3791612278], length 0
 00:00:30.570684 IP 10.0.0.8.44896 > 10.0.0.6.1883: Flags [P.], seq 1405127132:1405127136, ack 1400238089, win 83, options [nop,nop,TS val 1096317760 ecr 3791612278], length 4
 00:00:30.571122 IP 10.0.0.6.1883 > 10.0.0.8.44896: Flags [P.], seq 1400238089:1400238093, ack 1405127136, win 85, options [nop,nop,TS val 3791612279 ecr 1096317760], length 4
 00:00:30.621980 IP 10.0.0.8.44896 > 10.0.0.6.1883: Flags [.], ack 1400238093, win 83, options [nop,nop,TS val 1096317812 ecr 3791612279], length 0
 00:00:31.569821 IP 10.0.0.8.44896 > 10.0.0.6.1883: Flags [P.], seq 1405127136:1405127531, ack 1400238093, win 83, options [nop,nop,TS val 1096318759 ecr 3791612279], length 395
 00:00:31.570420 IP 10.0.0.6.1883 > 10.0.0.8.44896: Flags [P.], seq 1400238093:1400238097, ack 1405127531, win 85, options [nop,nop,TS val 3791613278 ecr 1096318759], length 4
 00:00:31.571209 IP 10.0.0.8.44896 > 10.0.0.6.1883: Flags [.], ack 1400238097, win 83, options [nop,nop,TS val 1096318761 ecr 3791613278], length 0
 00:00:31.571481 IP 10.0.0.8.44896 > 10.0.0.6.1883: Flags [P.], seq 1405127531:1405127535, ack 1400238097, win 83, options [nop,nop,TS val 1096318761 ecr 3791613278], length 4
 00:00:31.572327 IP 10.0.0.6.1883 > 10.0.0.8.44896: Flags [P.], seq 1400238097:1400238101, ack 1405127535, win 85, options [nop,nop,TS val 3791613280 ecr 1096318761], length 4
 00:00:31.616828 IP 10.0.0.8.44896 > 10.0.0.6.1883: Flags [.], ack 1400238101, win 83, options [nop,nop,TS val 1096318807 ecr 3791613280], length 0
 00:00:32.539899 IP 10.0.0.8.44896 > 10.0.0.6.1883: Flags [P.], seq 1405127535:1405127537, ack 1400238101, win 83, options [nop,nop,TS val 1096319730 ecr 3791613280], length 2
 00:00:32.539992 IP 10.0.0.6.1883 > 10.0.0.8.44896: Flags [P.], seq 1400238101:1400238103, ack 1405127537, win 85, options [nop,nop,TS val 3791614248 ecr 1096319730], length 2
 00:00:32.540195 IP 10.0.0.8.44896 > 10.0.0.6.1883: Flags [.], ack 1400238103, win 83, options [nop,nop,TS val 1096319730 ecr 3791614248], length 0
 00:00:32.570826 IP 10.0.0.8.44896 > 10.0.0.6.1883: Flags [P.], seq 1405127537:1405127932, ack 1400238103, win 83, options [nop,nop,TS val 1096319761 ecr 3791614248], length 395
 00:00:32.571257 IP 10.0.0.6.1883 > 10.0.0.8.44896: Flags [P.], seq 1400238103:1400238107, ack 1405127932, win 85, options [nop,nop,TS val 3791614279 ecr 1096319761], length 4
 00:00:32.571847 IP 10.0.0.8.44896 > 10.0.0.6.1883: Flags [P.], seq 1405127932:1405127936, ack 1400238107, win 83, options [nop,nop,TS val 1096319762 ecr 3791614279], length 4
 00:00:32.572366 IP 10.0.0.6.1883 > 10.0.0.8.44896: Flags [P.], seq 1400238107:1400238111, ack 1405127936, win 85, options [nop,nop,TS val 3791614280 ecr 1096319762], length 4
 00:00:32.616570 IP 10.0.0.8.44896 > 10.0.0.6.1883: Flags [.], ack 1400238111, win 83, options [nop,nop,TS val 1096319807 ecr 3791614280], length 0
 00:00:33.571652 IP 10.0.0.8.44896 > 10.0.0.6.1883: Flags [P.], seq 1405127936:1405128331, ack 1400238111, win 83, options [nop,nop,TS val 1096320762 ecr 3791614280], length 395
 00:00:33.571936 IP 10.0.0.6.1883 > 10.0.0.8.44896: Flags [P.], seq 1400238111:1400238115, ack 1405128331, win 85, options [nop,nop,TS val 3791615280 ecr 1096320762], length 4
 00:00:33.572470 IP 10.0.0.8.44896 > 10.0.0.6.1883: Flags [.], ack 1400238115, win 83, options [nop,nop,TS val 1096320762 ecr 3791615280], length 0
 00:00:33.572525 IP 10.0.0.8.44896 > 10.0.0.6.1883: Flags [P.], seq 1405128331:1405128335, ack 1400238115, win 83, options [nop,nop,TS val 1096320763 ecr 3791615280], length 4
 00:00:33.572673 IP 10.0.0.6.1883 > 10.0.0.8.44896: Flags [P.], seq 1400238115:1400238119, ack 1405128335, win 85, options [nop,nop,TS val 3791615281 ecr 1096320763], length 4
 00:00:33.616487 IP 10.0.0.8.44896 > 10.0.0.6.1883: Flags [.], ack 1400238119, win 83, options [nop,nop,TS val 1096320807 ecr 3791615281], length 0
 00:00:34.572636 IP 10.0.0.8.44896 > 10.0.0.6.1883: Flags [P.], seq 1405128335:1405128730, ack 1400238119, win 83, options [nop,nop,TS val 1096321763 ecr 3791615281], length 395
 00:00:34.572940 IP 10.0.0.6.1883 > 10.0.0.8.44896: Flags [P.], seq 1400238119:1400238123, ack 1405128730, win 85, options [nop,nop,TS val 3791616281 ecr 1096321763], length 4
 00:00:34.573304 IP 10.0.0.8.44896 > 10.0.0.6.1883: Flags [.], ack 1400238123, win 83, options [nop,nop,TS val 1096321763 ecr 3791616281], length 0
 00:00:34.573360 IP 10.0.0.8.44896 > 10.0.0.6.1883: Flags [P.], seq 1405128730:1405128734, ack 1400238123, win 83, options [nop,nop,TS val 1096321763 ecr 3791616281], length 4
 00:00:34.573480 IP 10.0.0.6.1883 > 10.0.0.8.44896: Flags [P.], seq 1400238123:1400238127, ack 1405128734, win 85, options [nop,nop,TS val 3791616282 ecr 1096321763], length 4
 00:00:34.616571 IP 10.0.0.8.44896 > 10.0.0.6.1883: Flags [.], ack 1400238127, win 83, options [nop,nop,TS val 1096321807 ecr 3791616282], length 0
 00:00:35.574233 IP 10.0.0.8.44896 > 10.0.0.6.1883: Flags [P.], seq 1405128734:1405129129, ack 1400238127, win 83, options [nop,nop,TS val 1096322764 ecr 3791616282], length 395
 00:00:35.574633 IP 10.0.0.6.1883 > 10.0.0.8.44896: Flags [P.], seq 1400238127:1400238131, ack 1405129129, win 85, options [nop,nop,TS val 3791617283 ecr 1096322764], length 4
 00:00:35.575989 IP 10.0.0.8.44896 > 10.0.0.6.1883: Flags [.], ack 1400238131, win 83, options [nop,nop,TS val 1096322765 ecr 3791617283], length 0
 00:00:35.576099 IP 10.0.0.8.44896 > 10.0.0.6.1883: Flags [P.], seq 1405129129:1405129133, ack 1400238131, win 83, options [nop,nop,TS val 1096322765 ecr 3791617283], length 4
 00:00:35.576636 IP 10.0.0.6.1883 > 10.0.0.8.44896: Flags [P.], seq 1400238131:1400238135, ack 1405129133, win 85, options [nop,nop,TS val 3791617285 ecr 1096322765], length 4
 00:00:35.620492 IP 10.0.0.8.44896 > 10.0.0.6.1883: Flags [.], ack 1400238135, win 83, options [nop,nop,TS val 1096322810 ecr 3791617285], length 0
 00:00:36.575940 IP 10.0.0.8.44896 > 10.0.0.6.1883: Flags [P.], seq 1405129133:1405129528, ack 1400238135, win 83, options [nop,nop,TS val 1096323765 ecr 3791617285], length 395
 00:00:36.576849 IP 10.0.0.6.1883 > 10.0.0.8.44896: Flags [P.], seq 1400238135:1400238139, ack 1405129528, win 85, options [nop,nop,TS val 3791618285 ecr 1096323765], length 4
 00:00:36.577695 IP 10.0.0.8.44896 > 10.0.0.6.1883: Flags [.], ack 1400238139, win 83, options [nop,nop,TS val 1096323767 ecr 3791618285], length 0
 00:00:36.578241 IP 10.0.0.8.44896 > 10.0.0.6.1883: Flags [P.], seq 1405129528:1405129532, ack 1400238139, win 83, options [nop,nop,TS val 1096323767 ecr 3791618285], length 4
 00:00:36.578518 IP 10.0.0.6.1883 > 10.0.0.8.44896: Flags [P.], seq 1400238139:1400238143, ack 1405129532, win 85, options [nop,nop,TS val 3791618287 ecr 1096323767], length 4
 00:00:36.620765 IP 10.0.0.8.44896 > 10.0.0.6.1883: Flags [.], ack 1400238143, win 83, options [nop,nop,TS val 1096323811 ecr 3791618287], length 0
 00:00:37.541579 IP 10.0.0.8.44896 > 10.0.0.6.1883: Flags [P.], seq 1405129532:1405129534, ack 1400238143, win 83, options [nop,nop,TS val 1096324731 ecr 3791618287], length 2
 00:00:37.541712 IP 10.0.0.6.1883 > 10.0.0.8.44896: Flags [P.], seq 1400238143:1400238145, ack 1405129534, win 85, options [nop,nop,TS val 3791619250 ecr 1096324731], length 2
 00:00:37.542029 IP 10.0.0.8.44896 > 10.0.0.6.1883: Flags [.], ack 1400238145, win 83, options [nop,nop,TS val 1096324732 ecr 3791619250], length 0
 00:00:37.576391 IP 10.0.0.8.44896 > 10.0.0.6.1883: Flags [P.], seq 1405129534:1405129929, ack 1400238145, win 83, options [nop,nop,TS val 1096324766 ecr 3791619250], length 395
 00:00:37.576973 IP 10.0.0.6.1883 > 10.0.0.8.44896: Flags [P.], seq 1400238145:1400238149, ack 1405129929, win 85, options [nop,nop,TS val 3791619285 ecr 1096324766], length 4
 00:00:37.579824 IP 10.0.0.8.44896 > 10.0.0.6.1883: Flags [P.], seq 1405129929:1405129933, ack 1400238149, win 83, options [nop,nop,TS val 1096324768 ecr 3791619285], length 4
 00:00:37.581133 IP 10.0.0.6.1883 > 10.0.0.8.44896: Flags [P.], seq 1400238149:1400238153, ack 1405129933, win 85, options [nop,nop,TS val 3791619289 ecr 1096324768], length 4
 00:00:37.624433 IP 10.0.0.8.44896 > 10.0.0.6.1883: Flags [.], ack 1400238153, win 83, options [nop,nop,TS val 1096324814 ecr 3791619289], length 0
 00:00:38.577201 IP 10.0.0.8.44896 > 10.0.0.6.1883: Flags [P.], seq 1405129933:1405130328, ack 1400238153, win 83, options [nop,nop,TS val 1096325767 ecr 3791619289], length 395
 00:00:38.577430 IP 10.0.0.6.1883 > 10.0.0.8.44896: Flags [P.], seq 1400238153:1400238157, ack 1405130328, win 85, options [nop,nop,TS val 3791620286 ecr 1096325767], length 4
 00:00:38.577655 IP 10.0.0.8.44896 > 10.0.0.6.1883: Flags [.], ack 1400238157, win 83, options [nop,nop,TS val 1096325768 ecr 3791620286], length 0
 00:00:38.577737 IP 10.0.0.8.44896 > 10.0.0.6.1883: Flags [P.], seq 1405130328:1405130332, ack 1400238157, win 83, options [nop,nop,TS val 1096325768 ecr 3791620286], length 4
 00:00:38.577926 IP 10.0.0.6.1883 > 10.0.0.8.44896: Flags [P.], seq 1400238157:1400238161, ack 1405130332, win 85, options [nop,nop,TS val 3791620286 ecr 1096325768], length 4
 00:00:38.620458 IP 10.0.0.8.44896 > 10.0.0.6.1883: Flags [.], ack 1400238161, win 83, options [nop,nop,TS val 1096325811 ecr 3791620286], length 0
 00:00:39.419660 IP6 fe80::7d:71ff:fec1:d523 > ff02::2: ICMP6, router solicitation, length 16
 00:00:39.579634 IP 10.0.0.8.44896 > 10.0.0.6.1883: Flags [P.], seq 1405130332:1405130727, ack 1400238161, win 83, options [nop,nop,TS val 1096326769 ecr 3791620286], length 395
 00:00:39.580362 IP 10.0.0.6.1883 > 10.0.0.8.44896: Flags [P.], seq 1400238161:1400238165, ack 1405130727, win 85, options [nop,nop,TS val 3791621288 ecr 1096326769], length 4
 00:00:39.581273 IP 10.0.0.8.44896 > 10.0.0.6.1883: Flags [.], ack 1400238165, win 83, options [nop,nop,TS val 1096326771 ecr 3791621288], length 0
 00:00:39.581384 IP 10.0.0.8.44896 > 10.0.0.6.1883: Flags [P.], seq 1405130727:1405130731, ack 1400238165, win 83, options [nop,nop,TS val 1096326771 ecr 3791621288], length 4
 00:00:39.581780 IP 10.0.0.6.1883 > 10.0.0.8.44896: Flags [P.], seq 1400238165:1400238169, ack 1405130731, win 85, options [nop,nop,TS val 3791621290 ecr 1096326771], length 4
 00:00:39.624946 IP 10.0.0.8.44896 > 10.0.0.6.1883: Flags [.], ack 1400238169, win 83, options [nop,nop,TS val 1096326815 ecr 3791621290], length 0
 00:00:40.581012 IP 10.0.0.8.44896 > 10.0.0.6.1883: Flags [P.], seq 1405130731:1405131126, ack 1400238169, win 83, options [nop,nop,TS val 1096327771 ecr 3791621290], length 395
 00:00:40.581327 IP 10.0.0.6.1883 > 10.0.0.8.44896: Flags [P.], seq 1400238169:1400238173, ack 1405131126, win 85, options [nop,nop,TS val 3791622289 ecr 1096327771], length 4
 00:00:40.581790 IP 10.0.0.8.44896 > 10.0.0.6.1883: Flags [.], ack 1400238173, win 83, options [nop,nop,TS val 1096327772 ecr 3791622289], length 0
 00:00:40.581877 IP 10.0.0.8.44896 > 10.0.0.6.1883: Flags [P.], seq 1405131126:1405131130, ack 1400238173, win 83, options [nop,nop,TS val 1096327772 ecr 3791622289], length 4
 00:00:40.581994 IP 10.0.0.6.1883 > 10.0.0.8.44896: Flags [P.], seq 1400238173:1400238177, ack 1405131130, win 85, options [nop,nop,TS val 3791622290 ecr 1096327772], length 4
 00:00:40.624452 IP 10.0.0.8.44896 > 10.0.0.6.1883: Flags [.], ack 1400238177, win 83, options [nop,nop,TS val 1096327815 ecr 3791622290], length 0
 00:00:41.584258 IP 10.0.0.8.44896 > 10.0.0.6.1883: Flags [P.], seq 1405131130:1405131525, ack 1400238177, win 83, options [nop,nop,TS val 1096328774 ecr 3791622290], length 395
 00:00:41.584486 IP 10.0.0.6.1883 > 10.0.0.8.44896: Flags [P.], seq 1400238177:1400238181, ack 1405131525, win 85, options [nop,nop,TS val 3791623293 ecr 1096328774], length 4
 00:00:41.585020 IP 10.0.0.8.44896 > 10.0.0.6.1883: Flags [.], ack 1400238181, win 83, options [nop,nop,TS val 1096328775 ecr 3791623293], length 0
 00:00:41.585075 IP 10.0.0.8.44896 > 10.0.0.6.1883: Flags [P.], seq 1405131525:1405131529, ack 1400238181, win 83, options [nop,nop,TS val 1096328775 ecr 3791623293], length 4
 00:00:41.585187 IP 10.0.0.6.1883 > 10.0.0.8.44896: Flags [P.], seq 1400238181:1400238185, ack 1405131529, win 85, options [nop,nop,TS val 3791623293 ecr 1096328775], length 4
 00:00:41.628540 IP 10.0.0.8.44896 > 10.0.0.6.1883: Flags [.], ack 1400238185, win 83, options [nop,nop,TS val 1096328819 ecr 3791623293], length 0
 00:00:42.546581 IP 10.0.0.8.44896 > 10.0.0.6.1883: Flags [P.], seq 1405131529:1405131531, ack 1400238185, win 83, options [nop,nop,TS val 1096329737 ecr 3791623293], length 2
 00:00:42.546714 IP 10.0.0.6.1883 > 10.0.0.8.44896: Flags [P.], seq 1400238185:1400238187, ack 1405131531, win 85, options [nop,nop,TS val 3791624255 ecr 1096329737], length 2
 00:00:42.547053 IP 10.0.0.8.44896 > 10.0.0.6.1883: Flags [.], ack 1400238187, win 83, options [nop,nop,TS val 1096329737 ecr 3791624255], length 0
 00:00:42.586059 IP 10.0.0.8.44896 > 10.0.0.6.1883: Flags [P.], seq 1405131531:1405131926, ack 1400238187, win 83, options [nop,nop,TS val 1096329776 ecr 3791624255], length 395
 00:00:42.586884 IP 10.0.0.6.1883 > 10.0.0.8.44896: Flags [P.], seq 1400238187:1400238191, ack 1405131926, win 85, options [nop,nop,TS val 3791624295 ecr 1096329776], length 4
 00:00:42.588007 IP 10.0.0.8.44896 > 10.0.0.6.1883: Flags [.], ack 1400238191, win 83, options [nop,nop,TS val 1096329778 ecr 3791624295], length 0
 00:00:42.588108 IP 10.0.0.8.44896 > 10.0.0.6.1883: Flags [P.], seq 1405131926:1405131930, ack 1400238191, win 83, options [nop,nop,TS val 1096329778 ecr 3791624295], length 4
 00:00:42.588529 IP 10.0.0.6.1883 > 10.0.0.8.44896: Flags [P.], seq 1400238191:1400238195, ack 1405131930, win 85, options [nop,nop,TS val 3791624297 ecr 1096329778], length 4
 00:00:42.632775 IP 10.0.0.8.44896 > 10.0.0.6.1883: Flags [.], ack 1400238195, win 83, options [nop,nop,TS val 1096329823 ecr 3791624297], length 0
 00:00:43.586920 IP 10.0.0.8.44896 > 10.0.0.6.1883: Flags [P.], seq 1405131930:1405132325, ack 1400238195, win 83, options [nop,nop,TS val 1096330777 ecr 3791624297], length 395
 00:00:43.587113 IP 10.0.0.6.1883 > 10.0.0.8.44896: Flags [P.], seq 1400238195:1400238199, ack 1405132325, win 85, options [nop,nop,TS val 3791625295 ecr 1096330777], length 4
 00:00:43.587344 IP 10.0.0.8.44896 > 10.0.0.6.1883: Flags [.], ack 1400238199, win 83, options [nop,nop,TS val 1096330777 ecr 3791625295], length 0
 00:00:43.587344 IP 10.0.0.8.44896 > 10.0.0.6.1883: Flags [P.], seq 1405132325:1405132329, ack 1400238199, win 83, options [nop,nop,TS val 1096330777 ecr 3791625295], length 4
 00:00:43.587489 IP 10.0.0.6.1883 > 10.0.0.8.44896: Flags [P.], seq 1400238199:1400238203, ack 1405132329, win 85, options [nop,nop,TS val 3791625296 ecr 1096330777], length 4
 00:00:43.628429 IP 10.0.0.8.44896 > 10.0.0.6.1883: Flags [.], ack 1400238203, win 83, options [nop,nop,TS val 1096330819 ecr 3791625296], length 0
 00:00:44.588166 IP 10.0.0.8.44896 > 10.0.0.6.1883: Flags [P.], seq 1405132329:1405132724, ack 1400238203, win 83, options [nop,nop,TS val 1096331778 ecr 3791625296], length 395
 00:00:44.588992 IP 10.0.0.6.1883 > 10.0.0.8.44896: Flags [P.], seq 1400238203:1400238207, ack 1405132724, win 85, options [nop,nop,TS val 3791626297 ecr 1096331778], length 4
 00:00:44.590430 IP 10.0.0.8.44896 > 10.0.0.6.1883: Flags [.], ack 1400238207, win 83, options [nop,nop,TS val 1096331780 ecr 3791626297], length 0
