 00:00:00.000000 IP6 fe80::dcd8:73ff:fea8:4cb4 > ff02::2: ICMP6, router solicitation, length 16
 00:00:00.289590 IP6 fe80::2c50:afff:fe64:3db0 > ff02::2: ICMP6, router solicitation, length 16
 00:00:00.299445 IP6 fe80::1865:93ff:fe3c:c1fd > ff02::2: ICMP6, router solicitation, length 16
 00:00:01.030971 IP6 fe80::4e9:f5ff:fe47:955b > ff02::2: ICMP6, router solicitation, length 16
 00:00:01.565382 IP6 fe80::fc36:42ff:fe59:9c7f > ff02::2: ICMP6, router solicitation, length 16
 00:00:01.575583 IP6 fe80::70de:d6ff:fed2:b51c > ff02::2: ICMP6, router solicitation, length 16
 00:00:02.066264 IP6 fe80::80a9:cfff:fe42:16c1 > ff02::2: ICMP6, router solicitation, length 16
 00:00:02.300524 IP6 fe80::30eb:69ff:fe84:11ce > ff02::2: ICMP6, router solicitation, length 16
 00:00:02.322035 IP6 fe80::703f:cfff:fe1b:540a > ff02::2: ICMP6, router solicitation, length 16
 00:00:02.579954 IP6 fe80::a8d7:98ff:feab:2ccf > ff02::2: ICMP6, router solicitation, length 16
 00:00:03.324498 IP6 fe80::3819:44ff:fec2:8c8b > ff02::2: ICMP6, router solicitation, length 16
 00:00:03.369128 IP6 fe80::d4c5:b5ff:fe34:c07 > ff02::2: ICMP6, router solicitation, length 16
 00:00:04.398978 ARP, Request who-has 10.0.0.6 tell 10.0.0.8, length 28
 00:00:04.399939 ARP, Reply 10.0.0.6 is-at 3a:19:44:c2:8c:8b, length 28
 00:00:04.438291 IP 10.0.0.8.44942 > 10.0.0.6.1883: Flags [S], seq 3906225180, win 42340, options [mss 1460,sackOK,TS val 1096536530 ecr 0,nop,wscale 9], length 0
 00:00:04.438335 IP 10.0.0.6.1883 > 10.0.0.8.44942: Flags [S.], seq 3502762739, ack 3906225181, win 43440, options [mss 1460,sackOK,TS val 3791831115 ecr 1096536530,nop,wscale 9], length 0
 00:00:04.446609 IP 10.0.0.8.44942 > 10.0.0.6.1883: Flags [.], ack 3502762740, win 83, options [nop,nop,TS val 1096536605 ecr 3791831115], length 0
 00:00:04.446804 IP 10.0.0.8.44942 > 10.0.0.6.1883: Flags [P.], seq 3906225181:3906225201, ack 3502762740, win 83, options [nop,nop,TS val 1096536605 ecr 3791831115], length 20
 00:00:04.446891 IP 10.0.0.6.1883 > 10.0.0.8.44942: Flags [.], ack 3906225201, win 85, options [nop,nop,TS val 3791831123 ecr 1096536605], length 0
 00:00:04.447228 IP 10.0.0.6.1883 > 10.0.0.8.44942: Flags [P.], seq 3502762740:3502762744, ack 3906225201, win 85, options [nop,nop,TS val 3791831124 ecr 1096536605], length 4
 00:00:04.447927 IP 10.0.0.8.44942 > 10.0.0.6.1883: Flags [.], ack 3502762744, win 83, options [nop,nop,TS val 1096536606 ecr 3791831124], length 0
 00:00:04.448517 IP 10.0.0.8.44942 > 10.0.0.6.1883: Flags [P.], seq 3906225201:3906225265, ack 3502762744, win 83, options [nop,nop,TS val 1096536607 ecr 3791831124], length 64
 00:00:04.449542 IP 10.0.0.6.1883 > 10.0.0.8.44942: Flags [P.], seq 3502762744:3502762809, ack 3906225265, win 85, options [nop,nop,TS val 3791831126 ecr 1096536607], length 65
 00:00:04.449743 IP 10.0.0.8.44942 > 10.0.0.6.1883: Flags [P.], seq 3906225265:3906225660, ack 3502762809, win 83, options [nop,nop,TS val 1096536608 ecr 3791831126], length 395
 00:00:04.449822 IP 10.0.0.6.1883 > 10.0.0.8.44942: Flags [P.], seq 3502762809:3502762814, ack 3906225660, win 85, options [nop,nop,TS val 3791831126 ecr 1096536608], length 5
 00:00:04.453768 IP 10.0.0.8.44942 > 10.0.0.6.1883: Flags [.], ack 3502762814, win 83, options [nop,nop,TS val 1096536612 ecr 3791831126], length 0
 00:00:04.453798 IP 10.0.0.6.1883 > 10.0.0.8.44942: Flags [P.], seq 3502762814:3502762818, ack 3906225660, win 85, options [nop,nop,TS val 3791831130 ecr 1096536612], length 4
 00:00:04.454547 IP 10.0.0.8.44942 > 10.0.0.6.1883: Flags [P.], seq 3906225660:3906225664, ack 3502762818, win 83, options [nop,nop,TS val 1096536613 ecr 3791831130], length 4
 00:00:04.454769 IP 10.0.0.6.1883 > 10.0.0.8.44942: Flags [P.], seq 3502762818:3502762822, ack 3906225664, win 85, options [nop,nop,TS val 3791831131 ecr 1096536613], length 4
 00:00:04.500342 IP 10.0.0.8.44942 > 10.0.0.6.1883: Flags [.], ack 3502762822, win 83, options [nop,nop,TS val 1096536659 ecr 3791831131], length 0
 00:00:05.373892 IP 10.0.0.8.44942 > 10.0.0.6.1883: Flags [P.], seq 3906225664:3906226059, ack 3502762822, win 83, options [nop,nop,TS val 1096537532 ecr 3791831131], length 395
 00:00:05.374625 IP 10.0.0.6.1883 > 10.0.0.8.44942: Flags [P.], seq 3502762822:3502762826, ack 3906226059, win 85, options [nop,nop,TS val 3791832051 ecr 1096537532], length 4
 00:00:05.374752 IP 10.0.0.8.44942 > 10.0.0.6.1883: Flags [.], ack 3502762826, win 83, options [nop,nop,TS val 1096537533 ecr 3791832051], length 0
 00:00:05.375124 IP 10.0.0.8.44942 > 10.0.0.6.1883: Flags [P.], seq 3906226059:3906226063, ack 3502762826, win 83, options [nop,nop,TS val 1096537533 ecr 3791832051], length 4
 00:00:05.375230 IP 10.0.0.6.1883 > 10.0.0.8.44942: Flags [P.], seq 3502762826:3502762830, ack 3906226063, win 85, options [nop,nop,TS val 3791832052 ecr 1096537533], length 4
 00:00:05.384154 IP6 fe80::6caf:9cff:feaf:5920 > ff02::2: ICMP6, router solicitation, length 16
 00:00:05.386563 IP6 fe80::d44d:c7ff:fe8b:a657 > ff02::2: ICMP6, router solicitation, length 16
 00:00:05.417849 IP 10.0.0.8.44942 > 10.0.0.6.1883: Flags [.], ack 3502762830, win 83, options [nop,nop,TS val 1096537575 ecr 3791832052], length 0
 00:00:06.385563 IP 10.0.0.8.44942 > 10.0.0.6.1883: Flags [P.], seq 3906226063:3906226458, ack 3502762830, win 83, options [nop,nop,TS val 1096538543 ecr 3791832052], length 395
 00:00:06.387994 IP 10.0.0.6.1883 > 10.0.0.8.44942: Flags [P.], seq 3502762830:3502762834, ack 3906226458, win 85, options [nop,nop,TS val 3791833063 ecr 1096538543], length 4
 00:00:06.389468 IP 10.0.0.8.44942 > 10.0.0.6.1883: Flags [.], ack 3502762834, win 83, options [nop,nop,TS val 1096538548 ecr 3791833063], length 0
 00:00:06.390894 IP 10.0.0.8.44942 > 10.0.0.6.1883: Flags [P.], seq 3906226458:3906226462, ack 3502762834, win 83, options [nop,nop,TS val 1096538548 ecr 3791833063], length 4
 00:00:06.391257 IP 10.0.0.6.1883 > 10.0.0.8.44942: Flags [P.], seq 3502762834:3502762838, ack 3906226462, win 85, options [nop,nop,TS val 3791833068 ecr 1096538548], length 4
 00:00:06.477838 IP 10.0.0.8.44942 > 10.0.0.6.1883: Flags [.], ack 3502762838, win 83, options [nop,nop,TS val 1096538617 ecr 3791833068], length 0
 00:00:07.389274 IP 10.0.0.8.44942 > 10.0.0.6.1883: Flags [P.], seq 3906226462:3906226857, ack 3502762838, win 83, options [nop,nop,TS val 1096539546 ecr 3791833068], length 395
 00:00:07.390865 IP 10.0.0.6.1883 > 10.0.0.8.44942: Flags [P.], seq 3502762838:3502762842, ack 3906226857, win 85, options [nop,nop,TS val 3791834067 ecr 1096539546], length 4
 00:00:07.391267 IP 10.0.0.8.44942 > 10.0.0.6.1883: Flags [.], ack 3502762842, win 83, options [nop,nop,TS val 1096539550 ecr 3791834067], length 0
 00:00:07.392605 IP 10.0.0.8.44942 > 10.0.0.6.1883: Flags [P.], seq 3906226857:3906226861, ack 3502762842, win 83, options [nop,nop,TS val 1096539550 ecr 3791834067], length 4
 00:00:07.393676 IP 10.0.0.6.1883 > 10.0.0.8.44942: Flags [P.], seq 3502762842:3502762846, ack 3906226861, win 85, options [nop,nop,TS val 3791834070 ecr 1096539550], length 4
 00:00:07.488971 IP 10.0.0.8.44942 > 10.0.0.6.1883: Flags [.], ack 3502762846, win 83, options [nop,nop,TS val 1096539595 ecr 3791834070], length 0
 00:00:08.391018 IP 10.0.0.8.44942 > 10.0.0.6.1883: Flags [P.], seq 3906226861:3906227256, ack 3502762846, win 83, options [nop,nop,TS val 1096540548 ecr 3791834070], length 395
 00:00:08.392187 IP 10.0.0.6.1883 > 10.0.0.8.44942: Flags [P.], seq 3502762846:3502762850, ack 3906227256, win 85, options [nop,nop,TS val 3791835069 ecr 1096540548], length 4
 00:00:08.392598 IP 10.0.0.8.44942 > 10.0.0.6.1883: Flags [.], ack 3502762850, win 83, options [nop,nop,TS val 1096540551 ecr 3791835069], length 0
 00:00:08.394054 IP 10.0.0.8.44942 > 10.0.0.6.1883: Flags [P.], seq 3906227256:3906227260, ack 3502762850, win 83, options [nop,nop,TS val 1096540551 ecr 3791835069], length 4
 00:00:08.394525 IP 10.0.0.6.1883 > 10.0.0.8.44942: Flags [P.], seq 3502762850:3502762854, ack 3906227260, win 85, options [nop,nop,TS val 3791835071 ecr 1096540551], length 4
 00:00:08.445768 IP 10.0.0.8.44942 > 10.0.0.6.1883: Flags [.], ack 3502762854, win 83, options [nop,nop,TS val 1096540595 ecr 3791835071], length 0
 00:00:09.394701 IP 10.0.0.8.44942 > 10.0.0.6.1883: Flags [P.], seq 3906227260:3906227655, ack 3502762854, win 83, options [nop,nop,TS val 1096541552 ecr 3791835071], length 395
 00:00:09.395900 IP 10.0.0.6.1883 > 10.0.0.8.44942: Flags [P.], seq 3502762854:3502762858, ack 3906227655, win 85, options [nop,nop,TS val 3791836072 ecr 1096541552], length 4
 00:00:09.396833 IP 10.0.0.8.44942 > 10.0.0.6.1883: Flags [.], ack 3502762858, win 83, options [nop,nop,TS val 1096541555 ecr 3791836072], length 0
 00:00:09.397806 IP 10.0.0.8.44942 > 10.0.0.6.1883: Flags [P.], seq 3906227655:3906227659, ack 3502762858, win 83, options [nop,nop,TS val 1096541555 ecr 3791836072], length 4
 00:00:09.398194 IP 10.0.0.6.1883 > 10.0.0.8.44942: Flags [P.], seq 3502762858:3502762862, ack 3906227659, win 85, options [nop,nop,TS val 3791836075 ecr 1096541555], length 4
 00:00:09.440351 IP 10.0.0.8.44942 > 10.0.0.6.1883: Flags [.], ack 3502762862, win 83, options [nop,nop,TS val 1096541599 ecr 3791836075], length 0
 00:00:09.449405 IP 10.0.0.8.44942 > 10.0.0.6.1883: Flags [P.], seq 3906227659:3906227661, ack 3502762862, win 83, options [nop,nop,TS val 1096541608 ecr 3791836075], length 2
 00:00:09.449760 IP 10.0.0.6.1883 > 10.0.0.8.44942: Flags [P.], seq 3502762862:3502762864, ack 3906227661, win 85, options [nop,nop,TS val 3791836126 ecr 1096541608], length 2
 00:00:09.450248 IP 10.0.0.8.44942 > 10.0.0.6.1883: Flags [.], ack 3502762864, win 83, options [nop,nop,TS val 1096541609 ecr 3791836126], length 0
 00:00:10.396840 IP 10.0.0.8.44942 > 10.0.0.6.1883: Flags [P.], seq 3906227661:3906228056, ack 3502762864, win 83, options [nop,nop,TS val 1096542554 ecr 3791836126], length 395
 00:00:10.397674 IP 10.0.0.6.1883 > 10.0.0.8.44942: Flags [P.], seq 3502762864:3502762868, ack 3906228056, win 85, options [nop,nop,TS val 3791837074 ecr 1096542554], length 4
 00:00:10.398496 IP 10.0.0.8.44942 > 10.0.0.6.1883: Flags [.], ack 3502762868, win 83, options [nop,nop,TS val 1096542557 ecr 3791837074], length 0
 00:00:10.399150 IP 10.0.0.8.44942 > 10.0.0.6.1883: Flags [P.], seq 3906228056:3906228060, ack 3502762868, win 83, options [nop,nop,TS val 1096542557 ecr 3791837074], length 4
 00:00:10.399871 IP 10.0.0.6.1883 > 10.0.0.8.44942: Flags [P.], seq 3502762868:3502762872, ack 3906228060, win 85, options [nop,nop,TS val 3791837076 ecr 1096542557], length 4
 00:00:10.507102 IP 10.0.0.8.44942 > 10.0.0.6.1883: Flags [.], ack 3502762872, win 83, options [nop,nop,TS val 1096542651 ecr 3791837076], length 0
 00:00:11.485641 IP 10.0.0.8.44942 > 10.0.0.6.1883: Flags [P.], seq 3906228060:3906228455, ack 3502762872, win 83, options [nop,nop,TS val 1096543644 ecr 3791837076], length 395
 00:00:11.516017 IP 10.0.0.6.1883 > 10.0.0.8.44942: Flags [P.], seq 3502762872:3502762876, ack 3906228455, win 85, options [nop,nop,TS val 3791838163 ecr 1096543644], length 4
 00:00:11.648737 IP 10.0.0.8.44942 > 10.0.0.6.1883: Flags [.], ack 3502762876, win 83, options [nop,nop,TS val 1096543807 ecr 3791838163], length 0
 00:00:11.649066 IP 10.0.0.8.44942 > 10.0.0.6.1883: Flags [P.], seq 3906228455:3906228459, ack 3502762876, win 83, options [nop,nop,TS val 1096543807 ecr 3791838163], length 4
 00:00:11.649189 IP 10.0.0.6.1883 > 10.0.0.8.44942: Flags [P.], seq 3502762876:3502762880, ack 3906228459, win 85, options [nop,nop,TS val 3791838326 ecr 1096543807], length 4
 00:00:11.734026 IP 10.0.0.8.44942 > 10.0.0.6.1883: Flags [.], ack 3502762880, win 83, options [nop,nop,TS val 1096543851 ecr 3791838326], length 0
 00:00:12.510112 IP 10.0.0.8.44942 > 10.0.0.6.1883: Flags [P.], seq 3906228459:3906228854, ack 3502762880, win 83, options [nop,nop,TS val 1096544668 ecr 3791838326], length 395
 00:00:12.516521 IP 10.0.0.6.1883 > 10.0.0.8.44942: Flags [P.], seq 3502762880:3502762884, ack 3906228854, win 85, options [nop,nop,TS val 3791839187 ecr 1096544668], length 4
 00:00:12.653587 IP 10.0.0.8.44942 > 10.0.0.6.1883: Flags [.], ack 3502762884, win 83, options [nop,nop,TS val 1096544812 ecr 3791839187], length 0
 00:00:12.653936 IP 10.0.0.8.44942 > 10.0.0.6.1883: Flags [P.], seq 3906228854:3906228858, ack 3502762884, win 83, options [nop,nop,TS val 1096544812 ecr 3791839187], length 4
 00:00:12.654357 IP 10.0.0.6.1883 > 10.0.0.8.44942: Flags [P.], seq 3502762884:3502762888, ack 3906228858, win 85, options [nop,nop,TS val 3791839331 ecr 1096544812], length 4
 00:00:13.053765 IP 10.0.0.6.1883 > 10.0.0.8.44942: Flags [P.], seq 3502762884:3502762888, ack 3906228858, win 85, options [nop,nop,TS val 3791839730 ecr 1096544812], length 4
 00:00:13.056371 IP 10.0.0.8.44942 > 10.0.0.6.1883: Flags [.], ack 3502762888, win 83, options [nop,nop,TS val 1096545086 ecr 3791839331], length 0
 00:00:13.064213 IP 10.0.0.8.44942 > 10.0.0.6.1883: Flags [.], ack 3502762888, win 83, options [nop,nop,TS val 1096545218 ecr 3791839730,nop,nop,sack 1 {3502762884:3502762888}], length 0
 00:00:13.666914 IP 10.0.0.8.44942 > 10.0.0.6.1883: Flags [P.], seq 3906228858:3906229253, ack 3502762888, win 83, options [nop,nop,TS val 1096545824 ecr 3791839730], length 395
 00:00:13.668558 IP 10.0.0.6.1883 > 10.0.0.8.44942: Flags [P.], seq 3502762888:3502762892, ack 3906229253, win 85, options [nop,nop,TS val 3791840344 ecr 1096545824], length 4
 00:00:13.670513 IP 10.0.0.8.44942 > 10.0.0.6.1883: Flags [.], ack 3502762892, win 83, options [nop,nop,TS val 1096545828 ecr 3791840344], length 0
 00:00:13.671147 IP 10.0.0.8.44942 > 10.0.0.6.1883: Flags [P.], seq 3906229253:3906229257, ack 3502762892, win 83, options [nop,nop,TS val 1096545828 ecr 3791840344], length 4
 00:00:13.671429 IP 10.0.0.6.1883 > 10.0.0.8.44942: Flags [P.], seq 3502762892:3502762896, ack 3906229257, win 85, options [nop,nop,TS val 3791840348 ecr 1096545828], length 4
 00:00:13.927957 IP 10.0.0.8.44942 > 10.0.0.6.1883: Flags [.], ack 3502762896, win 83, options [nop,nop,TS val 1096546086 ecr 3791840348], length 0
 00:00:14.493702 IP 10.0.0.8.44942 > 10.0.0.6.1883: Flags [P.], seq 3906229257:3906229259, ack 3502762896, win 83, options [nop,nop,TS val 1096546651 ecr 3791840348], length 2
 00:00:14.494519 IP 10.0.0.6.1883 > 10.0.0.8.44942: Flags [P.], seq 3502762896:3502762898, ack 3906229259, win 85, options [nop,nop,TS val 3791841171 ecr 1096546651], length 2
 00:00:14.496384 IP 10.0.0.8.44942 > 10.0.0.6.1883: Flags [.], ack 3502762898, win 83, options [nop,nop,TS val 1096546653 ecr 3791841171], length 0
 00:00:14.757715 IP 10.0.0.8.44942 > 10.0.0.6.1883: Flags [P.], seq 3906229259:3906229654, ack 3502762898, win 83, options [nop,nop,TS val 1096546914 ecr 3791841171], length 395
 00:00:14.758997 IP 10.0.0.6.1883 > 10.0.0.8.44942: Flags [P.], seq 3502762898:3502762902, ack 3906229654, win 85, options [nop,nop,TS val 3791841435 ecr 1096546914], length 4
 00:00:14.761151 IP 10.0.0.8.44942 > 10.0.0.6.1883: Flags [.], ack 3502762902, win 83, options [nop,nop,TS val 1096546919 ecr 3791841435], length 0
 00:00:14.761792 IP 10.0.0.8.44942 > 10.0.0.6.1883: Flags [P.], seq 3906229654:3906229658, ack 3502762902, win 83, options [nop,nop,TS val 1096546919 ecr 3791841435], length 4
 00:00:14.762474 IP 10.0.0.6.1883 > 10.0.0.8.44942: Flags [P.], seq 3502762902:3502762906, ack 3906229658, win 85, options [nop,nop,TS val 3791841439 ecr 1096546919], length 4
 00:00:14.867782 IP 10.0.0.8.44942 > 10.0.0.6.1883: Flags [.], ack 3502762906, win 83, options [nop,nop,TS val 1096546999 ecr 3791841439], length 0
 00:00:15.759760 IP 10.0.0.8.44942 > 10.0.0.6.1883: Flags [P.], seq 3906229658:3906230053, ack 3502762906, win 83, options [nop,nop,TS val 1096547916 ecr 3791841439], length 395
 00:00:15.764106 IP 10.0.0.6.1883 > 10.0.0.8.44942: Flags [P.], seq 3502762906:3502762910, ack 3906230053, win 85, options [nop,nop,TS val 3791842437 ecr 1096547916], length 4
 00:00:15.765112 IP 10.0.0.8.44942 > 10.0.0.6.1883: Flags [.], ack 3502762910, win 83, options [nop,nop,TS val 1096547923 ecr 3791842437], length 0
 00:00:15.765192 IP 10.0.0.8.44942 > 10.0.0.6.1883: Flags [P.], seq 3906230053:3906230057, ack 3502762910, win 83, options [nop,nop,TS val 1096547923 ecr 3791842437], length 4
 00:00:15.765936 IP 10.0.0.6.1883 > 10.0.0.8.44942: Flags [P.], seq 3502762910:3502762914, ack 3906230057, win 85, options [nop,nop,TS val 3791842442 ecr 1096547923], length 4
 00:00:15.927832 IP 10.0.0.8.44942 > 10.0.0.6.1883: Flags [.], ack 3502762914, win 83, options [nop,nop,TS val 1096548086 ecr 3791842442], length 0
 00:00:16.760847 IP 10.0.0.8.44942 > 10.0.0.6.1883: Flags [P.], seq 3906230057:3906230452, ack 3502762914, win 83, options [nop,nop,TS val 1096548918 ecr 3791842442], length 395
 00:00:16.761475 IP 10.0.0.6.1883 > 10.0.0.8.44942: Flags [P.], seq 3502762914:3502762918, ack 3906230452, win 85, options [nop,nop,TS val 3791843438 ecr 1096548918], length 4
 00:00:16.775398 IP 10.0.0.8.44942 > 10.0.0.6.1883: Flags [.], ack 3502762918, win 83, options [nop,nop,TS val 1096548933 ecr 3791843438], length 0
 00:00:16.775592 IP 10.0.0.8.44942 > 10.0.0.6.1883: Flags [P.], seq 3906230452:3906230456, ack 3502762918, win 83, options [nop,nop,TS val 1096548934 ecr 3791843438], length 4
 00:00:16.776308 IP 10.0.0.6.1883 > 10.0.0.8.44942: Flags [P.], seq 3502762918:3502762922, ack 3906230456, win 85, options [nop,nop,TS val 3791843453 ecr 1096548934], length 4
 00:00:17.136256 IP 10.0.0.8.44942 > 10.0.0.6.1883: Flags [.], ack 3502762922, win 83, options [nop,nop,TS val 1096549086 ecr 3791843453], length 0
 00:00:17.765795 IP 10.0.0.8.44942 > 10.0.0.6.1883: Flags [P.], seq 3906230456:3906230851, ack 3502762922, win 83, options [nop,nop,TS val 1096549922 ecr 3791843453], length 395
 00:00:17.766373 IP 10.0.0.6.1883 > 10.0.0.8.44942: Flags [P.], seq 3502762922:3502762926, ack 3906230851, win 85, options [nop,nop,TS val 3791844443 ecr 1096549922], length 4
 00:00:17.767208 IP 10.0.0.8.44942 > 10.0.0.6.1883: Flags [.], ack 3502762926, win 83, options [nop,nop,TS val 1096549925 ecr 3791844443], length 0
 00:00:17.767649 IP 10.0.0.8.44942 > 10.0.0.6.1883: Flags [P.], seq 3906230851:3906230855, ack 3502762926, win 83, options [nop,nop,TS val 1096549925 ecr 3791844443], length 4
 00:00:17.767972 IP 10.0.0.6.1883 > 10.0.0.8.44942: Flags [P.], seq 3502762926:3502762930, ack 3906230855, win 85, options [nop,nop,TS val 3791844444 ecr 1096549925], length 4
 00:00:17.927567 IP 10.0.0.8.44942 > 10.0.0.6.1883: Flags [.], ack 3502762930, win 83, options [nop,nop,TS val 1096550086 ecr 3791844444], length 0
 00:00:18.767409 IP 10.0.0.8.44942 > 10.0.0.6.1883: Flags [P.], seq 3906230855:3906231250, ack 3502762930, win 83, options [nop,nop,TS val 1096550924 ecr 3791844444], length 395
 00:00:18.768036 IP 10.0.0.6.1883 > 10.0.0.8.44942: Flags [P.], seq 3502762930:3502762934, ack 3906231250, win 85, options [nop,nop,TS val 3791845444 ecr 1096550924], length 4
 00:00:18.770497 IP 10.0.0.8.44942 > 10.0.0.6.1883: Flags [.], ack 3502762934, win 83, options [nop,nop,TS val 1096550927 ecr 3791845444], length 0
 00:00:18.770784 IP 10.0.0.8.44942 > 10.0.0.6.1883: Flags [P.], seq 3906231250:3906231254, ack 3502762934, win 83, options [nop,nop,TS val 1096550928 ecr 3791845444], length 4
 00:00:18.771138 IP 10.0.0.6.1883 > 10.0.0.8.44942: Flags [P.], seq 3502762934:3502762938, ack 3906231254, win 85, options [nop,nop,TS val 3791845448 ecr 1096550928], length 4
 00:00:18.927528 IP 10.0.0.8.44942 > 10.0.0.6.1883: Flags [.], ack 3502762938, win 83, options [nop,nop,TS val 1096551086 ecr 3791845448], length 0
 00:00:19.495603 IP 10.0.0.8.44942 > 10.0.0.6.1883: Flags [P.], seq 3906231254:3906231256, ack 3502762938, win 83, options [nop,nop,TS val 1096551653 ecr 3791845448], length 2
 00:00:19.495978 IP 10.0.0.6.1883 > 10.0.0.8.44942: Flags [P.], seq 3502762938:3502762940, ack 3906231256, win 85, options [nop,nop,TS val 3791846172 ecr 1096551653], length 2
 00:00:19.537889 IP 10.0.0.8.44942 > 10.0.0.6.1883: Flags [.], ack 3502762940, win 83, options [nop,nop,TS val 1096551695 ecr 3791846172], length 0
 00:00:19.773550 IP 10.0.0.8.44942 > 10.0.0.6.1883: Flags [P.], seq 3906231256:3906231651, ack 3502762940, win 83, options [nop,nop,TS val 1096551931 ecr 3791846172], length 395
 00:00:19.773998 IP 10.0.0.6.1883 > 10.0.0.8.44942: Flags [P.], seq 3502762940:3502762944, ack 3906231651, win 85, options [nop,nop,TS val 3791846451 ecr 1096551931], length 4
 00:00:19.777446 IP 10.0.0.8.44942 > 10.0.0.6.1883: Flags [.], ack 3502762944, win 83, options [nop,nop,TS val 1096551935 ecr 3791846451], length 0
 00:00:19.777585 IP 10.0.0.8.44942 > 10.0.0.6.1883: Flags [P.], seq 3906231651:3906231655, ack 3502762944, win 83, options [nop,nop,TS val 1096551935 ecr 3791846451], length 4
 00:00:19.777996 IP 10.0.0.6.1883 > 10.0.0.8.44942: Flags [P.], seq 3502762944:3502762948, ack 3906231655, win 85, options [nop,nop,TS val 3791846455 ecr 1096551935], length 4
 00:00:19.937039 IP 10.0.0.8.44942 > 10.0.0.6.1883: Flags [.], ack 3502762948, win 83, options [nop,nop,TS val 1096552086 ecr 3791846455], length 0
 00:00:20.776193 IP 10.0.0.8.44942 > 10.0.0.6.1883: Flags [P.], seq 3906231655:3906232050, ack 3502762948, win 83, options [nop,nop,TS val 1096552934 ecr 3791846455], length 395
 00:00:20.776563 IP 10.0.0.6.1883 > 10.0.0.8.44942: Flags [P.], seq 3502762948:3502762952, ack 3906232050, win 85, options [nop,nop,TS val 3791847453 ecr 1096552934], length 4
 00:00:20.777251 IP 10.0.0.8.44942 > 10.0.0.6.1883: Flags [.], ack 3502762952, win 83, options [nop,nop,TS val 1096552936 ecr 3791847453], length 0
 00:00:20.777319 IP 10.0.0.8.44942 > 10.0.0.6.1883: Flags [P.], seq 3906232050:3906232054, ack 3502762952, win 83, options [nop,nop,TS val 1096552936 ecr 3791847453], length 4
 00:00:20.777673 IP 10.0.0.6.1883 > 10.0.0.8.44942: Flags [P.], seq 3502762952:3502762956, ack 3906232054, win 85, options [nop,nop,TS val 3791847454 ecr 1096552936], length 4
 00:00:21.014291 IP 10.0.0.8.44942 > 10.0.0.6.1883: Flags [.], ack 3502762956, win 83, options [nop,nop,TS val 1096553086 ecr 3791847454], length 0
 00:00:21.778419 IP 10.0.0.8.44942 > 10.0.0.6.1883: Flags [P.], seq 3906232054:3906232449, ack 3502762956, win 83, options [nop,nop,TS val 1096553936 ecr 3791847454], length 395
 00:00:21.778701 IP 10.0.0.6.1883 > 10.0.0.8.44942: Flags [P.], seq 3502762956:3502762960, ack 3906232449, win 85, options [nop,nop,TS val 3791848455 ecr 1096553936], length 4
 00:00:21.779004 IP 10.0.0.8.44942 > 10.0.0.6.1883: Flags [.], ack 3502762960, win 83, options [nop,nop,TS val 1096553937 ecr 3791848455], length 0
 00:00:21.779028 IP 10.0.0.8.44942 > 10.0.0.6.1883: Flags [P.], seq 3906232449:3906232453, ack 3502762960, win 83, options [nop,nop,TS val 1096553937 ecr 3791848455], length 4
 00:00:21.779165 IP 10.0.0.6.1883 > 10.0.0.8.44942: Flags [P.], seq 3502762960:3502762964, ack 3906232453, win 85, options [nop,nop,TS val 3791848456 ecr 1096553937], length 4
 00:00:21.820053 IP 10.0.0.8.44942 > 10.0.0.6.1883: Flags [.], ack 3502762964, win 83, options [nop,nop,TS val 1096553979 ecr 3791848456], length 0
 00:00:22.781696 IP 10.0.0.8.44942 > 10.0.0.6.1883: Flags [P.], seq 3906232453:3906232848, ack 3502762964, win 83, options [nop,nop,TS val 1096554938 ecr 3791848456], length 395
 00:00:22.782488 IP 10.0.0.6.1883 > 10.0.0.8.44942: Flags [P.], seq 3502762964:3502762968, ack 3906232848, win 85, options [nop,nop,TS val 3791849459 ecr 1096554938], length 4
 00:00:22.783088 IP 10.0.0.8.44942 > 10.0.0.6.1883: Flags [.], ack 3502762968, win 83, options [nop,nop,TS val 1096554941 ecr 3791849459], length 0
 00:00:22.783191 IP 10.0.0.8.44942 > 10.0.0.6.1883: Flags [P.], seq 3906232848:3906232852, ack 3502762968, win 83, options [nop,nop,TS val 1096554941 ecr 3791849459], length 4
 00:00:22.783432 IP 10.0.0.6.1883 > 10.0.0.8.44942: Flags [P.], seq 3502762968:3502762972, ack 3906232852, win 85, options [nop,nop,TS val 3791849460 ecr 1096554941], length 4
 00:00:22.824221 IP 10.0.0.8.44942 > 10.0.0.6.1883: Flags [.], ack 3502762972, win 83, options [nop,nop,TS val 1096554983 ecr 3791849460], length 0
 00:00:23.782623 IP 10.0.0.8.44942 > 10.0.0.6.1883: Flags [P.], seq 3906232852:3906233247, ack 3502762972, win 83, options [nop,nop,TS val 1096555940 ecr 3791849460], length 395
 00:00:23.783637 IP 10.0.0.6.1883 > 10.0.0.8.44942: Flags [P.], seq 3502762972:3502762976, ack 3906233247, win 85, options [nop,nop,TS val 3791850460 ecr 1096555940], length 4
 00:00:23.784404 IP 10.0.0.8.44942 > 10.0.0.6.1883: Flags [.], ack 3502762976, win 83, options [nop,nop,TS val 1096555943 ecr 3791850460], length 0
 00:00:23.784511 IP 10.0.0.8.44942 > 10.0.0.6.1883: Flags [P.], seq 3906233247:3906233251, ack 3502762976, win 83, options [nop,nop,TS val 1096555943 ecr 3791850460], length 4
 00:00:23.784741 IP 10.0.0.6.1883 > 10.0.0.8.44942: Flags [P.], seq 3502762976:3502762980, ack 3906233251, win 85, options [nop,nop,TS val 3791850461 ecr 1096555943], length 4
 00:00:23.828258 IP 10.0.0.8.44942 > 10.0.0.6.1883: Flags [.], ack 3502762980, win 83, options [nop,nop,TS val 1096555987 ecr 3791850461], length 0
 00:00:24.494933 IP 10.0.0.8.44942 > 10.0.0.6.1883: Flags [P.], seq 3906233251:3906233253, ack 3502762980, win 83, options [nop,nop,TS val 1096556653 ecr 3791850461], length 2
 00:00:24.495082 IP 10.0.0.6.1883 > 10.0.0.8.44942: Flags [P.], seq 3502762980:3502762982, ack 3906233253, win 85, options [nop,nop,TS val 3791851172 ecr 1096556653], length 2
 00:00:24.495327 IP 10.0.0.8.44942 > 10.0.0.6.1883: Flags [.], ack 3502762982, win 83, options [nop,nop,TS val 1096556654 ecr 3791851172], length 0
 00:00:24.784481 IP 10.0.0.8.44942 > 10.0.0.6.1883: Flags [P.], seq 3906233253:3906233648, ack 3502762982, win 83, options [nop,nop,TS val 1096556941 ecr 3791851172], length 395
 00:00:24.785341 IP 10.0.0.6.1883 > 10.0.0.8.44942: Flags [P.], seq 3502762982:3502762986, ack 3906233648, win 85, options [nop,nop,TS val 3791851462 ecr 1096556941], length 4
 00:00:24.785961 IP 10.0.0.8.44942 > 10.0.0.6.1883: Flags [.], ack 3502762986, win 83, options [nop,nop,TS val 1096556944 ecr 3791851462], length 0
 00:00:24.786066 IP 10.0.0.8.44942 > 10.0.0.6.1883: Flags [P.], seq 3906233648:3906233652, ack 3502762986, win 83, options [nop,nop,TS val 1096556944 ecr 3791851462], length 4
 00:00:24.786297 IP 10.0.0.6.1883 > 10.0.0.8.44942: Flags [P.], seq 3502762986:3502762990, ack 3906233652, win 85, options [nop,nop,TS val 3791851463 ecr 1096556944], length 4
 00:00:24.828398 IP 10.0.0.8.44942 > 10.0.0.6.1883: Flags [.], ack 3502762990, win 83, options [nop,nop,TS val 1096556987 ecr 3791851463], length 0
 00:00:25.784046 IP 10.0.0.8.44942 > 10.0.0.6.1883: Flags [P.], seq 3906233652:3906234047, ack 3502762990, win 83, options [nop,nop,TS val 1096557942 ecr 3791851463], length 395
 00:00:25.784304 IP 10.0.0.6.1883 > 10.0.0.8.44942: Flags [P.], seq 3502762990:3502762994, ack 3906234047, win 85, options [nop,nop,TS val 3791852461 ecr 1096557942], length 4
 00:00:25.784619 IP 10.0.0.8.44942 > 10.0.0.6.1883: Flags [.], ack 3502762994, win 83, options [nop,nop,TS val 1096557943 ecr 3791852461], length 0
 00:00:25.785145 IP 10.0.0.8.44942 > 10.0.0.6.1883: Flags [P.], seq 3906234047:3906234051, ack 3502762994, win 83, options [nop,nop,TS val 1096557943 ecr 3791852461], length 4
 00:00:25.785237 IP 10.0.0.6.1883 > 10.0.0.8.44942: Flags [P.], seq 3502762994:3502762998, ack 3906234051, win 85, options [nop,nop,TS val 3791852462 ecr 1096557943], length 4
 00:00:25.831257 IP 10.0.0.8.44942 > 10.0.0.6.1883: Flags [.], ack 3502762998, win 83, options [nop,nop,TS val 1096557990 ecr 3791852462], length 0
 00:00:26.785157 IP 10.0.0.8.44942 > 10.0.0.6.1883: Flags [P.], seq 3906234051:3906234446, ack 3502762998, win 83, options [nop,nop,TS val 1096558944 ecr 3791852462], length 395
 00:00:26.785395 IP 10.0.0.6.1883 > 10.0.0.8.44942: Flags [P.], seq 3502762998:3502763002, ack 3906234446, win 85, options [nop,nop,TS val 3791853462 ecr 1096558944], length 4
 00:00:26.785602 IP 10.0.0.8.44942 > 10.0.0.6.1883: Flags [.], ack 3502763002, win 83, options [nop,nop,TS val 1096558944 ecr 3791853462], length 0
 00:00:26.785629 IP 10.0.0.8.44942 > 10.0.0.6.1883: Flags [P.], seq 3906234446:3906234450, ack 3502763002, win 83, options [nop,nop,TS val 1096558944 ecr 3791853462], length 4
 00:00:26.785821 IP 10.0.0.6.1883 > 10.0.0.8.44942: Flags [P.], seq 3502763002:3502763006, ack 3906234450, win 85, options [nop,nop,TS val 3791853462 ecr 1096558944], length 4
 00:00:26.828506 IP 10.0.0.8.44942 > 10.0.0.6.1883: Flags [.], ack 3502763006, win 83, options [nop,nop,TS val 1096558987 ecr 3791853462], length 0
 00:00:27.785969 IP 10.0.0.8.44942 > 10.0.0.6.1883: Flags [P.], seq 3906234450:3906234845, ack 3502763006, win 83, options [nop,nop,TS val 1096559944 ecr 3791853462], length 395
 00:00:27.786175 IP 10.0.0.6.1883 > 10.0.0.8.44942: Flags [P.], seq 3502763006:3502763010, ack 3906234845, win 85, options [nop,nop,TS val 3791854463 ecr 1096559944], length 4
 00:00:27.786379 IP 10.0.0.8.44942 > 10.0.0.6.1883: Flags [.], ack 3502763010, win 83, options [nop,nop,TS val 1096559945 ecr 3791854463], length 0
 00:00:27.786437 IP 10.0.0.8.44942 > 10.0.0.6.1883: Flags [P.], seq 3906234845:3906234849, ack 3502763010, win 83, options [nop,nop,TS val 1096559945 ecr 3791854463], length 4
 00:00:27.786643 IP 10.0.0.6.1883 > 10.0.0.8.44942: Flags [P.], seq 3502763010:3502763014, ack 3906234849, win 85, options [nop,nop,TS val 3791854463 ecr 1096559945], length 4
 00:00:27.828278 IP 10.0.0.8.44942 > 10.0.0.6.1883: Flags [.], ack 3502763014, win 83, options [nop,nop,TS val 1096559987 ecr 3791854463], length 0
 00:00:28.788136 IP 10.0.0.8.44942 > 10.0.0.6.1883: Flags [P.], seq 3906234849:3906235244, ack 3502763014, win 83, options [nop,nop,TS val 1096560946 ecr 3791854463], length 395
 00:00:28.788944 IP 10.0.0.6.1883 > 10.0.0.8.44942: Flags [P.], seq 3502763014:3502763018, ack 3906235244, win 85, options [nop,nop,TS val 3791855465 ecr 1096560946], length 4
 00:00:28.789654 IP 10.0.0.8.44942 > 10.0.0.6.1883: Flags [.], ack 3502763018, win 83, options [nop,nop,TS val 1096560948 ecr 3791855465], length 0
 00:00:28.789693 IP 10.0.0.8.44942 > 10.0.0.6.1883: Flags [P.], seq 3906235244:3906235248, ack 3502763018, win 83, options [nop,nop,TS val 1096560948 ecr 3791855465], length 4
 00:00:28.789929 IP 10.0.0.6.1883 > 10.0.0.8.44942: Flags [P.], seq 3502763018:3502763022, ack 3906235248, win 85, options [nop,nop,TS val 3791855466 ecr 1096560948], length 4
 00:00:28.832128 IP 10.0.0.8.44942 > 10.0.0.6.1883: Flags [.], ack 3502763022, win 83, options [nop,nop,TS val 1096560991 ecr 3791855466], length 0
 00:00:29.496810 IP 10.0.0.8.44942 > 10.0.0.6.1883: Flags [P.], seq 3906235248:3906235250, ack 3502763022, win 83, options [nop,nop,TS val 1096561655 ecr 3791855466], length 2
 00:00:29.497053 IP 10.0.0.6.1883 > 10.0.0.8.44942: Flags [P.], seq 3502763022:3502763024, ack 3906235250, win 85, options [nop,nop,TS val 3791856174 ecr 1096561655], length 2
 00:00:29.497310 IP 10.0.0.8.44942 > 10.0.0.6.1883: Flags [.], ack 3502763024, win 83, options [nop,nop,TS val 1096561656 ecr 3791856174], length 0
 00:00:29.789333 IP 10.0.0.8.44942 > 10.0.0.6.1883: Flags [P.], seq 3906235250:3906235645, ack 3502763024, win 83, options [nop,nop,TS val 1096561948 ecr 3791856174], length 395
 00:00:29.789579 IP 10.0.0.6.1883 > 10.0.0.8.44942: Flags [P.], seq 3502763024:3502763028, ack 3906235645, win 85, options [nop,nop,TS val 3791856466 ecr 1096561948], length 4
 00:00:29.789871 IP 10.0.0.8.44942 > 10.0.0.6.1883: Flags [.], ack 3502763028, win 83, options [nop,nop,TS val 1096561948 ecr 3791856466], length 0
 00:00:29.789961 IP 10.0.0.8.44942 > 10.0.0.6.1883: Flags [P.], seq 3906235645:3906235649, ack 3502763028, win 83, options [nop,nop,TS val 1096561948 ecr 3791856466], length 4
 00:00:29.790256 IP 10.0.0.6.1883 > 10.0.0.8.44942: Flags [P.], seq 3502763028:3502763032, ack 3906235649, win 85, options [nop,nop,TS val 3791856467 ecr 1096561948], length 4
 00:00:29.832193 IP 10.0.0.8.44942 > 10.0.0.6.1883: Flags [.], ack 3502763032, win 83, options [nop,nop,TS val 1096561991 ecr 3791856467], length 0
 00:00:29.952095 IP6 fe80::dcd8:73ff:fea8:4cb4 > ff02::2: ICMP6, router solicitation, length 16
 00:00:29.966389 IP6 fe80::1865:93ff:fe3c:c1fd > ff02::2: ICMP6, router solicitation, length 16
 00:00:29.976509 IP6 fe80::2c50:afff:fe64:3db0 > ff02::2: ICMP6, router solicitation, length 16
 00:00:30.791198 IP 10.0.0.8.44942 > 10.0.0.6.1883: Flags [P.], seq 3906235649:3906236044, ack 3502763032, win 83, options [nop,nop,TS val 1096562949 ecr 3791856467], length 395
 00:00:30.792303 IP 10.0.0.6.1883 > 10.0.0.8.44942: Flags [P.], seq 3502763032:3502763036, ack 3906236044, win 85, options [nop,nop,TS val 3791857468 ecr 1096562949], length 4
 00:00:30.793646 IP 10.0.0.8.44942 > 10.0.0.6.1883: Flags [.], ack 3502763036, win 83, options [nop,nop,TS val 1096562951 ecr 3791857468], length 0
 00:00:30.794578 IP 10.0.0.8.44942 > 10.0.0.6.1883: Flags [P.], seq 3906236044:3906236048, ack 3502763036, win 83, options [nop,nop,TS val 1096562952 ecr 3791857468], length 4
 00:00:30.795172 IP 10.0.0.6.1883 > 10.0.0.8.44942: Flags [P.], seq 3502763036:3502763040, ack 3906236048, win 85, options [nop,nop,TS val 3791857472 ecr 1096562952], length 4
 00:00:30.836160 IP 10.0.0.8.44942 > 10.0.0.6.1883: Flags [.], ack 3502763040, win 83, options [nop,nop,TS val 1096562994 ecr 3791857472], length 0
 00:00:31.792234 IP 10.0.0.8.44942 > 10.0.0.6.1883: Flags [P.], seq 3906236048:3906236443, ack 3502763040, win 83, options [nop,nop,TS val 1096563950 ecr 3791857472], length 395
 00:00:31.792866 IP 10.0.0.6.1883 > 10.0.0.8.44942: Flags [P.], seq 3502763040:3502763044, ack 3906236443, win 85, options [nop,nop,TS val 3791858469 ecr 1096563950], length 4
 00:00:31.793498 IP 10.0.0.8.44942 > 10.0.0.6.1883: Flags [.], ack 3502763044, win 83, options [nop,nop,TS val 1096563952 ecr 3791858469], length 0
 00:00:31.793723 IP 10.0.0.8.44942 > 10.0.0.6.1883: Flags [P.], seq 3906236443:3906236447, ack 3502763044, win 83, options [nop,nop,TS val 1096563952 ecr 3791858469], length 4
 00:00:31.794348 IP 10.0.0.6.1883 > 10.0.0.8.44942: Flags [P.], seq 3502763044:3502763048, ack 3906236447, win 85, options [nop,nop,TS val 3791858471 ecr 1096563952], length 4
 00:00:31.836014 IP 10.0.0.8.44942 > 10.0.0.6.1883: Flags [.], ack 3502763048, win 83, options [nop,nop,TS val 1096563994 ecr 3791858471], length 0
 00:00:32.023296 IP6 fe80::70de:d6ff:fed2:b51c > ff02::2: ICMP6, router solicitation, length 16
 00:00:32.793472 IP 10.0.0.8.44942 > 10.0.0.6.1883: Flags [P.], seq 3906236447:3906236842, ack 3502763048, win 83, options [nop,nop,TS val 1096564952 ecr 3791858471], length 395
 00:00:32.793917 IP 10.0.0.6.1883 > 10.0.0.8.44942: Flags [P.], seq 3502763048:3502763052, ack 3906236842, win 85, options [nop,nop,TS val 3791859470 ecr 1096564952], length 4
 00:00:32.794270 IP 10.0.0.8.44942 > 10.0.0.6.1883: Flags [.], ack 3502763052, win 83, options [nop,nop,TS val 1096564953 ecr 3791859470], length 0
 00:00:32.794270 IP 10.0.0.8.44942 > 10.0.0.6.1883: Flags [P.], seq 3906236842:3906236846, ack 3502763052, win 83, options [nop,nop,TS val 1096564953 ecr 3791859470], length 4
 00:00:32.794352 IP 10.0.0.6.1883 > 10.0.0.8.44942: Flags [P.], seq 3502763052:3502763056, ack 3906236846, win 85, options [nop,nop,TS val 3791859471 ecr 1096564953], length 4
 00:00:32.836139 IP 10.0.0.8.44942 > 10.0.0.6.1883: Flags [.], ack 3502763056, win 83, options [nop,nop,TS val 1096564995 ecr 3791859471], length 0
 00:00:33.805988 IP 10.0.0.8.44942 > 10.0.0.6.1883: Flags [P.], seq 3906236846:3906237241, ack 3502763056, win 83, options [nop,nop,TS val 1096565963 ecr 3791859471], length 395
 00:00:33.806999 IP 10.0.0.6.1883 > 10.0.0.8.44942: Flags [P.], seq 3502763056:3502763060, ack 3906237241, win 85, options [nop,nop,TS val 3791860483 ecr 1096565963], length 4
 00:00:33.807691 IP 10.0.0.8.44942 > 10.0.0.6.1883: Flags [.], ack 3502763060, win 83, options [nop,nop,TS val 1096565966 ecr 3791860483], length 0
 00:00:33.808899 IP 10.0.0.8.44942 > 10.0.0.6.1883: Flags [P.], seq 3906237241:3906237245, ack 3502763060, win 83, options [nop,nop,TS val 1096565966 ecr 3791860483], length 4
 00:00:33.809428 IP 10.0.0.6.1883 > 10.0.0.8.44942: Flags [P.], seq 3502763060:3502763064, ack 3906237245, win 85, options [nop,nop,TS val 3791860486 ecr 1096565966], length 4
 00:00:33.927538 IP 10.0.0.8.44942 > 10.0.0.6.1883: Flags [.], ack 3502763064, win 83, options [nop,nop,TS val 1096566086 ecr 3791860486], length 0
 00:00:34.051253 IP6 fe80::4e9:f5ff:fe47:955b > ff02::2: ICMP6, router solicitation, length 16
 00:00:34.064070 IP6 fe80::703f:cfff:fe1b:540a > ff02::2: ICMP6, router solicitation, length 16
 00:00:34.078212 IP6 fe80::a8d7:98ff:feab:2ccf > ff02::2: ICMP6, router solicitation, length 16
 00:00:34.091890 IP6 fe80::fc36:42ff:fe59:9c7f > ff02::2: ICMP6, router solicitation, length 16
 00:00:34.104355 IP6 fe80::80a9:cfff:fe42:16c1 > ff02::2: ICMP6, router solicitation, length 16
 00:00:34.502013 IP 10.0.0.8.44942 > 10.0.0.6.1883: Flags [P.], seq 3906237245:3906237247, ack 3502763064, win 83, options [nop,nop,TS val 1096566660 ecr 3791860486], length 2
 00:00:34.502295 IP 10.0.0.6.1883 > 10.0.0.8.44942: Flags [P.], seq 3502763064:3502763066, ack 3906237247, win 85, options [nop,nop,TS val 3791861179 ecr 1096566660], length 2
 00:00:34.503534 IP 10.0.0.8.44942 > 10.0.0.6.1883: Flags [.], ack 3502763066, win 83, options [nop,nop,TS val 1096566661 ecr 3791861179], length 0
 00:00:34.807524 IP 10.0.0.8.44942 > 10.0.0.6.1883: Flags [P.], seq 3906237247:3906237642, ack 3502763066, win 83, options [nop,nop,TS val 1096566966 ecr 3791861179], length 395
 00:00:34.808002 IP 10.0.0.6.1883 > 10.0.0.8.44942: Flags [P.], seq 3502763066:3502763070, ack 3906237642, win 85, options [nop,nop,TS val 3791861485 ecr 1096566966], length 4
 00:00:34.808249 IP 10.0.0.8.44942 > 10.0.0.6.1883: Flags [.], ack 3502763070, win 83, options [nop,nop,TS val 1096566967 ecr 3791861485], length 0
 00:00:34.808276 IP 10.0.0.8.44942 > 10.0.0.6.1883: Flags [P.], seq 3906237642:3906237646, ack 3502763070, win 83, options [nop,nop,TS val 1096566967 ecr 3791861485], length 4
 00:00:34.808349 IP 10.0.0.6.1883 > 10.0.0.8.44942: Flags [P.], seq 3502763070:3502763074, ack 3906237646, win 85, options [nop,nop,TS val 3791861485 ecr 1096566967], length 4
 00:00:34.854923 IP 10.0.0.8.44942 > 10.0.0.6.1883: Flags [.], ack 3502763074, win 83, options [nop,nop,TS val 1096567013 ecr 3791861485], length 0
 00:00:35.808911 IP 10.0.0.8.44942 > 10.0.0.6.1883: Flags [P.], seq 3906237646:3906238041, ack 3502763074, win 83, options [nop,nop,TS val 1096567967 ecr 3791861485], length 395
 00:00:35.809205 IP 10.0.0.6.1883 > 10.0.0.8.44942: Flags [P.], seq 3502763074:3502763078, ack 3906238041, win 85, options [nop,nop,TS val 3791862486 ecr 1096567967], length 4
 00:00:35.809737 IP 10.0.0.8.44942 > 10.0.0.6.1883: Flags [.], ack 3502763078, win 83, options [nop,nop,TS val 1096567968 ecr 3791862486], length 0
 00:00:35.810015 IP 10.0.0.8.44942 > 10.0.0.6.1883: Flags [P.], seq 3906238041:3906238045, ack 3502763078, win 83, options [nop,nop,TS val 1096567968 ecr 3791862486], length 4
 00:00:35.810209 IP 10.0.0.6.1883 > 10.0.0.8.44942: Flags [P.], seq 3502763078:3502763082, ack 3906238045, win 85, options [nop,nop,TS val 3791862487 ecr 1096567968], length 4
 00:00:35.852062 IP 10.0.0.8.44942 > 10.0.0.6.1883: Flags [.], ack 3502763082, win 83, options [nop,nop,TS val 1096568011 ecr 3791862487], length 0
 00:00:36.096506 IP6 fe80::3819:44ff:fec2:8c8b > ff02::2: ICMP6, router solicitation, length 16
 00:00:36.096514 IP6 fe80::30eb:69ff:fe84:11ce > ff02::2: ICMP6, router solicitation, length 16
 00:00:36.108635 IP6 fe80::d4c5:b5ff:fe34:c07 > ff02::2: ICMP6, router solicitation, length 16
